{
  "assigned_to_str": "Sarah Sharer Curley",
  "case_name": "GUILLERMO DE LA VARA",
  "cause": "",
  "court_id": "azb",
  "date_converted": null,
  "date_discharged": null,
  "date_filed": "2008-01-15",
  "date_terminated": null,
  "demand": "",
  "docket_entries": [
    {
      "date_entered": "2008-01-15",
      "date_filed": "2008-01-15",
      "description": "Chapter 7 Voluntary Petition, Schedules and Statements (except for those listed below). The mailing list of creditors if not uploaded when the petition was filed, must be uploaded no later than 5 calendar days from the date of the filing of the petition. Failure to timely upload the list of creditors, may result in dismissal of the case without further notice. Electronic Filing Declaration due 2/4/2008, Schedules A-J due 1/30/2008. Statement of Financial Affairs due 1/30/2008, Attorney Disclosure Statement due 1/30/2008, filed by DAN GUKEISEN on behalf of GUILLERMO DE LA VARA (GUKEISEN, DAN) (Entered: 01/15/2008)",
      "document_number": "1",
      "pacer_doc_id": "sho0_doc.pl",
      "pacer_seq_no": null
    },
    {
      "date_entered": "2008-01-15",
      "date_filed": "2008-01-15",
      "description": "Credit Counseling Certificate filed by DAN GUKEISEN on behalf of GUILLERMO DE LA VARA. (GUKEISEN, DAN) (Entered: 01/15/2008)",
      "document_number": "2",
      "pacer_doc_id": "sho0_doc.pl",
      "pacer_seq_no": null
    },
    {
      "date_entered": "2008-01-15",
      "date_filed": "2008-01-15",
      "description": "Declaration of Evidence of Employer Payments filed by DAN GUKEISEN on behalf of GUILLERMO DE LA VARA. (GUKEISEN, DAN) (Entered: 01/15/2008)",
      "document_number": "3",
      "pacer_doc_id": "sho0_doc.pl",
      "pacer_seq_no": null
    },
    {
      "date_entered": "2008-01-15",
      "date_filed": "2008-01-15",
      "description": "Receipt of Voluntary Petition (Chapter 7)(2:08-bk-00381) [other,volp7] ( 299.00) Filing Fee. Receipt number 6622084. Fee amount 299.00. (U.S. Treasury) (Entered: 01/15/2008)",
      "document_number": null,
      "pacer_doc_id": null,
      "pacer_seq_no": null
    },
    {
      "date_entered": "2008-01-15",
      "date_filed": "2008-01-15",
      "description": "Meeting of Creditors scheduled for 02/19/2008 at 10:30 AM at US Trustee Meeting Room, 230 N. First Avenue, Suite 102, Phoenix, AZ (341-PHX). (Admin, ) (Entered: 01/15/2008)",
      "document_number": "4",
      "pacer_doc_id": null,
      "pacer_seq_no": null
    },
    {
      "date_entered": "2008-01-16",
      "date_filed": "2008-01-16",
      "description": "Deficiency Notice to Debtor and Attorney for Debtor That All Required Documents Were Not Filed. (Beckett, Evelyn) (Entered: 01/16/2008)",
      "document_number": "5",
      "pacer_doc_id": "sho0_doc.pl",
      "pacer_seq_no": null
    },
    {
      "date_entered": "2008-01-16",
      "date_filed": "2008-01-16",
      "description": "Schedules/Statements due by 1/30/2008, Chapter 7 Individual Debtor Statement of Current Monthly Income and Means Test Calculation Due by 1/30/2008, (Beckett, Evelyn) (Entered: 01/16/2008)",
      "document_number": "6",
      "pacer_doc_id": null,
      "pacer_seq_no": null
    },
    {
      "date_entered": "2008-01-16",
      "date_filed": "2008-01-16",
      "description": "Chapter 7 Indiv/Joint--Notice of Meeting of Creditors. 341(a) meeting to be held on 2/19/2008 at 10:30 AM at US Trustee Meeting Room, 230 N. First Avenue, Suite 102, Phoenix, AZ (341-PHX) Complaints under Sections 727 or 523 due by 4/21/2008. (Beckett, Evelyn) (Entered: 01/16/2008)",
      "document_number": "7",
      "pacer_doc_id": "sho0_doc.pl",
      "pacer_seq_no": null
    },
    {
      "date_entered": "2008-01-18",
      "date_filed": "2008-01-16",
      "description": "BNC Certificate of Service - Notice of Meeting of Creditors (related document(s) (Related Doc # 7 )) (Admin.) (Entered: 01/18/2008)",
      "document_number": "8",
      "pacer_doc_id": "sho0_doc.pl",
      "pacer_seq_no": null
    },
    {
      "date_entered": "2008-01-18",
      "date_filed": "2008-01-16",
      "description": "BNC Certificate of Service (related document(s) (Related Doc # 5 )) (Admin.) (Entered: 01/18/2008)",
      "document_number": "9",
      "pacer_doc_id": "sho0_doc.pl",
      "pacer_seq_no": null
    },
    {
      "date_entered": "2008-01-21",
      "date_filed": "2008-01-21",
      "description": "Notice of Appearance filed by HILARY B. BONIAL of BRICE, VANDER LINDEN & WERNICK, PC on behalf of AMERICA'S SERVICING COMPANY.(BONIAL, HILARY) (Entered: 01/21/2008)",
      "document_number": "10",
      "pacer_doc_id": "sho0_doc.pl",
      "pacer_seq_no": null
    },
    {
      "date_entered": "2008-01-22",
      "date_filed": "2008-01-22",
      "description": "Notice of Appearance/Request for Notice on Behalf of Wells Fargo Bank. (ROGERS, DUSTIN) (Entered: 01/22/2008)",
      "document_number": "11",
      "pacer_doc_id": "sho0_doc.pl",
      "pacer_seq_no": null
    },
    {
      "date_entered": "2008-01-28",
      "date_filed": "2008-01-28",
      "description": "Motion for Relief from Stay (150.00 fee) filed by MATTHEW A. SILVERMAN of MCCARTHY HOLTHUS LEVINE on behalf of Wells Fargo Bank, N.A. Wells Fargo Bank, N.A. as Trustee for Option One Mortgage Loan Trust 2007-4 Asset-Backed Certificates, Series 2007-4, its assignees and/or successors and its servicing agent Op (Attachments: # 1 Exhibit). (SILVERMAN, MATTHEW) (Entered: 01/28/2008)",
      "document_number": "12",
      "pacer_doc_id": "sho0_doc.pl",
      "pacer_seq_no": null
    },
    {
      "date_entered": "2008-01-28",
      "date_filed": "2008-01-28",
      "description": "Notice of Motion for Relief from Stay filed by MATTHEW A. SILVERMAN of MCCARTHY HOLTHUS LEVINE on behalf of Wells Fargo Bank, N.A. Wells Fargo Bank, N.A. as Trustee for Option One Mortgage Loan Trust 2007-4 Asset-Backed Certificates, Series 2007-4, its assignees and/or successors and its servicing agent Op (related document(s) 12 ) (Attachments: # 1 Exhibit).(SILVERMAN, MATTHEW) (Entered: 01/28/2008)",
      "document_number": "13",
      "pacer_doc_id": "sho0_doc.pl",
      "pacer_seq_no": null
    },
    {
      "date_entered": "2008-01-28",
      "date_filed": "2008-01-28",
      "description": "Motion for Relief from Stay (150.00 fee) filed by MATTHEW A. SILVERMAN of MCCARTHY HOLTHUS LEVINE on behalf of Option One Mortgage, its assignees and/or successors and its servicing agent Option One Mortgage (Attachments: # 1 Exhibit). (SILVERMAN, MATTHEW) (Entered: 01/28/2008)",
      "document_number": "14",
      "pacer_doc_id": "sho0_doc.pl",
      "pacer_seq_no": null
    },
    {
      "date_entered": "2008-01-28",
      "date_filed": "2008-01-28",
      "description": "Notice of Motion for Relief from Stay filed by MATTHEW A. SILVERMAN of MCCARTHY HOLTHUS LEVINE on behalf of Option One Mortgage, its assignees and/or successors and its servicing agent Option One Mortgage (related document(s) 14 ) (Attachments: # 1 Exhibit).(SILVERMAN, MATTHEW) (Entered: 01/28/2008)",
      "document_number": "15",
      "pacer_doc_id": "sho0_doc.pl",
      "pacer_seq_no": null
    },
    {
      "date_entered": "2008-01-28",
      "date_filed": "2008-01-28",
      "description": "Receipt of Motion for Relief from Stay (150.00 fee)(2:08-bk-00381-SSC) [motion,185] ( 150.00) Filing Fee. Receipt number 6657608. Fee amount 150.00. (U.S. Treasury) (Entered: 01/28/2008)",
      "document_number": null,
      "pacer_doc_id": null,
      "pacer_seq_no": null
    },
    {
      "date_entered": "2008-01-28",
      "date_filed": "2008-01-28",
      "description": "Receipt of Motion for Relief from Stay (150.00 fee)(2:08-bk-00381-SSC) [motion,185] ( 150.00) Filing Fee. Receipt number 6657608. Fee amount 150.00. (U.S. Treasury) (Entered: 01/28/2008)",
      "document_number": null,
      "pacer_doc_id": null,
      "pacer_seq_no": null
    },
    {
      "date_entered": "2008-01-30",
      "date_filed": "2008-01-30",
      "description": "Notice of Appearance filed by MARK 2 BOSCO of TIFFANY & BOSCO, P.A. on behalf of Wells Fargo Bank, N.A., C/O Mark S. Bosco..(BOSCO, MARK) (Entered: 01/30/2008)",
      "document_number": "16",
      "pacer_doc_id": "sho0_doc.pl",
      "pacer_seq_no": null
    },
    {
      "date_entered": "2008-01-30",
      "date_filed": "2008-01-30",
      "description": "Motion for Relief from Stay (150.00 fee) Re: Real Property Located at 2235 E. Saint Catherine Ave. Phoenix, AZ. 85042 filed by MARK 2 BOSCO of TIFFANY & BOSCO, P.A. on behalf of Wells Fargo Bank, N.A., C/O Mark S. Bosco. (Attachments: # 1 Exhibit a# 2 Exhibit b). (BOSCO, MARK) (Entered: 01/30/2008)",
      "document_number": "17",
      "pacer_doc_id": "sho0_doc.pl",
      "pacer_seq_no": null
    },
    {
      "date_entered": "2008-01-30",
      "date_filed": "2008-01-30",
      "description": "Notice of Motion for Relief from Stay filed by MARK 2 BOSCO of TIFFANY & BOSCO, P.A. on behalf of Wells Fargo Bank, N.A., C/O Mark S. Bosco. (related document(s) 17 ) Objections/Responses due by 2/15/2008,.(BOSCO, MARK) (Entered: 01/30/2008)",
      "document_number": "18",
      "pacer_doc_id": "sho0_doc.pl",
      "pacer_seq_no": null
    },
    {
      "date_entered": "2008-01-30",
      "date_filed": "2008-01-30",
      "description": "Schedules and Statements Completion of SchedulesDisclosure of Compensation for Attorney for Debtor, Master Mailing List, Statement of Current Monthly Income and Means Test filed by DAN GUKEISEN on behalf of GUILLERMO DE LA VARA. Electronic Filing Declaration due by 2/4/2008, (GUKEISEN, DAN) Modified on 2/5/2008 to EditText(Beckett, Evelyn). (Entered: 01/30/2008)",
      "document_number": "19",
      "pacer_doc_id": "sho0_doc.pl",
      "pacer_seq_no": null
    },
    {
      "date_entered": "2008-01-30",
      "date_filed": "2008-01-30",
      "description": "Motion to Convert Chapter 7 or 11 Case to Chapter 13 filed by DAN GUKEISEN on behalf of GUILLERMO DE LA VARA. (GUKEISEN, DAN) (Entered: 01/30/2008)",
      "document_number": "20",
      "pacer_doc_id": "sho0_doc.pl",
      "pacer_seq_no": null
    },
    {
      "date_entered": "2008-01-30",
      "date_filed": "2008-01-30",
      "description": "Notice of Lodging Proposed Order filed by DAN GUKEISEN on behalf of GUILLERMO DE LA VARA.(GUKEISEN, DAN) (Entered: 01/30/2008)",
      "document_number": "21",
      "pacer_doc_id": "sho0_doc.pl",
      "pacer_seq_no": null
    },
    {
      "date_entered": "2008-01-31",
      "date_filed": "2008-01-31",
      "description": "Receipt of Motion for Relief from Stay (150.00 fee)(2:08-bk-00381-SSC) [motion,185] ( 150.00) Filing Fee. Receipt number 6668014. Fee amount 150.00. (U.S. Treasury) (Entered: 01/31/2008)",
      "document_number": null,
      "pacer_doc_id": null,
      "pacer_seq_no": null
    },
    {
      "date_entered": "2008-02-04",
      "date_filed": "2008-02-04",
      "description": "Debtor Declaration Re: Electronic Filing (Beckett, Evelyn) (Entered: 02/04/2008)",
      "document_number": "22",
      "pacer_doc_id": "sho0_doc.pl",
      "pacer_seq_no": null
    },
    {
      "date_entered": "2008-02-08",
      "date_filed": "2008-02-08",
      "description": "Application to Employ Counsel for Trustee filed by THOMAS H. ALLEN of ALLEN, SALA & BAYNE, PLC on behalf of JILL H. FORD. (ALLEN, THOMAS) (Entered: 02/08/2008)",
      "document_number": "23",
      "pacer_doc_id": "sho0_doc.pl",
      "pacer_seq_no": null
    },
    {
      "date_entered": "2008-02-08",
      "date_filed": "2008-02-08",
      "description": "Verified Statement of Thomas H. Allen pursuant to Fed.R.Bankr.p. 2014 and 2016 and 11 U.S.C. Section 327 filed by THOMAS H. ALLEN of ALLEN, SALA & BAYNE, PLC on behalf of JILL H. FORD.(related document(s) 23 ) (ALLEN, THOMAS) (Entered: 02/08/2008)",
      "document_number": "24",
      "pacer_doc_id": "sho0_doc.pl",
      "pacer_seq_no": null
    },
    {
      "date_entered": "2008-02-08",
      "date_filed": "2008-02-08",
      "description": "Notice of Appearance and Request for Notices filed by THOMAS H. ALLEN of ALLEN, SALA & BAYNE, PLC on behalf of JILL H. FORD.(ALLEN, THOMAS) (Entered: 02/08/2008)",
      "document_number": "25",
      "pacer_doc_id": "sho0_doc.pl",
      "pacer_seq_no": null
    },
    {
      "date_entered": "2008-02-08",
      "date_filed": "2008-02-08",
      "description": "Notice of Lodging Proposed Order filed by THOMAS H. ALLEN of ALLEN, SALA & BAYNE, PLC on behalf of JILL H. FORD (related document(s) 23 ) (Attachments: # 1 Exhibit A).(ALLEN, THOMAS) (Entered: 02/08/2008)",
      "document_number": "26",
      "pacer_doc_id": "sho0_doc.pl",
      "pacer_seq_no": null
    },
    {
      "date_entered": "2008-02-08",
      "date_filed": "2008-02-08",
      "description": "Objection to Motion/Application to Convert (related to motions(s) 20 ) filed by THOMAS H. ALLEN of ALLEN, SALA & BAYNE, PLC on behalf of JILL H. FORD. (ALLEN, THOMAS) (Entered: 02/08/2008)",
      "document_number": "27",
      "pacer_doc_id": "sho0_doc.pl",
      "pacer_seq_no": null
    },
    {
      "date_entered": "2008-02-12",
      "date_filed": "2008-02-11",
      "description": "ORDER Granting Application to Employ (Related Doc # 23 ) signed on 2/11/2008 . (Leary, Sharon) (Entered: 02/12/2008)",
      "document_number": "32",
      "pacer_doc_id": "sho0_doc.pl",
      "pacer_seq_no": null
    },
    {
      "date_entered": "2008-02-12",
      "date_filed": "2008-02-12",
      "description": "Motion for Relief from Stay (150.00 fee) PROPERTY: 11020 NORTH 17TH AVENUE, PHOENIX, AZ 85029 filed by MICHAEL W. CHEN of COOPER CASTLE LAW FIRM, LLP on behalf of AMERICAS SERVICING COMPANY, A SERVICING AGENT FOR DEUTSCHE PMSR ACE. (CHEN, MICHAEL) (Entered: 02/12/2008)",
      "document_number": "28",
      "pacer_doc_id": "sho0_doc.pl",
      "pacer_seq_no": null
    },
    {
      "date_entered": "2008-02-12",
      "date_filed": "2008-02-12",
      "description": "Receipt of Motion for Relief from Stay (150.00 fee)(2:08-bk-00381-SSC) [motion,185] ( 150.00) Filing Fee. Receipt number 6705524. Fee amount 150.00. (U.S. Treasury) (Entered: 02/12/2008)",
      "document_number": null,
      "pacer_doc_id": null,
      "pacer_seq_no": null
    },
    {
      "date_entered": "2008-02-12",
      "date_filed": "2008-02-12",
      "description": "Notice of Motion for Relief from Stay filed by MICHAEL W. CHEN of COOPER CASTLE LAW FIRM, LLP on behalf of AMERICAS SERVICING COMPANY, A SERVICING AGENT FOR DEUTSCHE PMSR ACE (related document(s) 28 ) Objections/Responses due by 2/28/2008,.(CHEN, MICHAEL) (Entered: 02/12/2008)",
      "document_number": "29",
      "pacer_doc_id": "sho0_doc.pl",
      "pacer_seq_no": null
    },
    {
      "date_entered": "2008-02-12",
      "date_filed": "2008-02-12",
      "description": "Certificate of Service filed by MICHAEL W. CHEN of COOPER CASTLE LAW FIRM, LLP on behalf of AMERICAS SERVICING COMPANY, A SERVICING AGENT FOR DEUTSCHE PMSR ACE.(related document(s) 29, 28 ) (CHEN, MICHAEL) (Entered: 02/12/2008)",
      "document_number": "30",
      "pacer_doc_id": "sho0_doc.pl",
      "pacer_seq_no": null
    },
    {
      "date_entered": "2008-02-12",
      "date_filed": "2008-02-12",
      "description": "Request for Notice filed by ANDREW D. GOLDBERG of Rosicki, Rosicki & Associates, P.C. on behalf of Franklin Credit Management Corporation. (GOLDBERG, ANDREW) (Entered: 02/12/2008)",
      "document_number": "31",
      "pacer_doc_id": "sho0_doc.pl",
      "pacer_seq_no": null
    },
    {
      "date_entered": "2008-02-19",
      "date_filed": "2008-02-19",
      "description": "Notice of Lodging Proposed Order filed by MATTHEW A. SILVERMAN of MCCARTHY HOLTHUS LEVINE on behalf of Option One Mortgage, its assignees and/or successors and its servicing agent Option One Mortgage (related document(s) 14 ) (Attachments: # 1 Exhibit).(SILVERMAN, MATTHEW) (Entered: 02/19/2008)",
      "document_number": "33",
      "pacer_doc_id": "sho0_doc.pl",
      "pacer_seq_no": null
    },
    {
      "date_entered": "2008-02-19",
      "date_filed": "2008-02-19",
      "description": "Certificate of Service and No Objections filed by MATTHEW A. SILVERMAN of MCCARTHY HOLTHUS LEVINE on behalf of Option One Mortgage, its assignees and/or successors and its servicing agent Option One Mortgage.(related document(s) 14 ) (SILVERMAN, MATTHEW) (Entered: 02/19/2008)",
      "document_number": "34",
      "pacer_doc_id": "sho0_doc.pl",
      "pacer_seq_no": null
    },
    {
      "date_entered": "2008-02-19",
      "date_filed": "2008-02-19",
      "description": "Certificate of Service and Notice of No Objection filed by MARK 2 BOSCO of TIFFANY & BOSCO, P.A. on behalf of Wells Fargo Bank, N.A., C/O Mark S. Bosco. (related document(s) 17 ).(BOSCO, MARK) Modified on 2/20/2008 to Edit Text (Beckett, Evelyn). (Entered: 02/19/2008)",
      "document_number": "35",
      "pacer_doc_id": "sho0_doc.pl",
      "pacer_seq_no": null
    },
    {
      "date_entered": "2008-02-19",
      "date_filed": "2008-02-19",
      "description": "Notice of Lodging Proposed Order filed by MARK 2 BOSCO of TIFFANY & BOSCO, P.A. on behalf of Wells Fargo Bank, N.A., C/O Mark S. Bosco..(BOSCO, MARK) (Entered: 02/19/2008)",
      "document_number": "36",
      "pacer_doc_id": "sho0_doc.pl",
      "pacer_seq_no": null
    },
    {
      "date_entered": "2008-02-19",
      "date_filed": "2008-02-19",
      "description": "Notice of Appearance filed by TERRY A. DAKE of TERRY A. DAKE, LTD. on behalf of Dale D. Ulrich.(DAKE, TERRY) (Entered: 02/19/2008)",
      "document_number": "37",
      "pacer_doc_id": "sho0_doc.pl",
      "pacer_seq_no": null
    },
    {
      "date_entered": "2008-02-21",
      "date_filed": "2008-02-20",
      "description": "ORDER Denying Motion for Relief from Stay (Related Doc # 14 ) signed on 2/20/2008 . (Beckett, Evelyn) (Entered: 02/21/2008)",
      "document_number": "38",
      "pacer_doc_id": "sho0_doc.pl",
      "pacer_seq_no": null
    },
    {
      "date_entered": "2008-02-21",
      "date_filed": "2008-02-20",
      "description": "ORDER Denying Motion for Relief from Stay (Related Doc # 17 ) signed on 2/20/2008 . (Beckett, Evelyn) (Entered: 02/21/2008)",
      "document_number": "39",
      "pacer_doc_id": "sho0_doc.pl",
      "pacer_seq_no": null
    },
    {
      "date_entered": "2008-02-23",
      "date_filed": "2008-02-21",
      "description": "BNC Certificate of Service (related document(s) (Related Doc # 38 )) (Admin.) (Entered: 02/23/2008)",
      "document_number": "41",
      "pacer_doc_id": "sho0_doc.pl",
      "pacer_seq_no": null
    },
    {
      "date_entered": "2008-02-23",
      "date_filed": "2008-02-21",
      "description": "BNC Certificate of Service (related document(s) (Related Doc # 39 )) (Admin.) (Entered: 02/23/2008)",
      "document_number": "42",
      "pacer_doc_id": "sho0_doc.pl",
      "pacer_seq_no": null
    },
    {
      "date_entered": "2008-02-23",
      "date_filed": "2008-02-21",
      "description": "BNC Certificate of Service - PDF Document (related document(s) (Related Doc # 38 )) (Admin.) (Entered: 02/23/2008)",
      "document_number": "43",
      "pacer_doc_id": "sho0_doc.pl",
      "pacer_seq_no": null
    },
    {
      "date_entered": "2008-02-23",
      "date_filed": "2008-02-21",
      "description": "BNC Certificate of Service - PDF Document (related document(s) (Related Doc # 39 )) (Admin.) (Entered: 02/23/2008)",
      "document_number": "44",
      "pacer_doc_id": "sho0_doc.pl",
      "pacer_seq_no": null
    },
    {
      "date_entered": "2008-02-22",
      "date_filed": "2008-02-22",
      "description": "Notice of Appearance and Request for Notice filed by KEVIN J. RATTAY of JABURG & WILK, P.C. on behalf of Sun Pacific Investment Corp., Bruce and Susan VanDenburgh, Robert P. VanDenburgh Defined Contribution Plan, ROBERT AND ELEANOR VANDENBURGH.(RATTAY, KEVIN) (Entered: 02/22/2008)",
      "document_number": "40",
      "pacer_doc_id": "sho0_doc.pl",
      "pacer_seq_no": null
    },
    {
      "date_entered": "2008-02-26",
      "date_filed": "2008-02-26",
      "description": "Amended Motion for Relief from Stay filed by MATTHEW A. SILVERMAN of MCCARTHY HOLTHUS LEVINE on behalf of Option One Mortgage, its assignees and/or successors and its servicing agent Option One Mortgage (Attachments: # 1 Exhibit). (SILVERMAN, MATTHEW) (Entered: 02/26/2008)",
      "document_number": "45",
      "pacer_doc_id": "sho0_doc.pl",
      "pacer_seq_no": null
    },
    {
      "date_entered": "2008-02-26",
      "date_filed": "2008-02-26",
      "description": "Notice of Motion for Relief from Stay filed by MATTHEW A. SILVERMAN of MCCARTHY HOLTHUS LEVINE on behalf of Option One Mortgage, its assignees and/or successors and its servicing agent Option One Mortgage (related document(s) 45 ) (Attachments: # 1 Exhibit).(SILVERMAN, MATTHEW) (Entered: 02/26/2008)",
      "document_number": "46",
      "pacer_doc_id": "sho0_doc.pl",
      "pacer_seq_no": null
    },
    {
      "date_entered": "2008-02-29",
      "date_filed": "2008-02-29",
      "description": "Motion for Entry of Order Confirming that No Stay is in Effect or that the Stay has been Terminated filed by CHRISTOPHER RYAN CHICOINE of PITE DUNCAN LLP on behalf of AMERICAN GUARDIAN FINANCIAL GROUP, INC., its successors and/or assigns (Attachments: # 1 Exhibit A - DOT# 2 Exhibit B - Court docket# 3 Exhibit C - Court Docket). (CHICOINE, CHRISTOPHER) (Entered: 02/29/2008)",
      "document_number": "47",
      "pacer_doc_id": "sho0_doc.pl",
      "pacer_seq_no": null
    },
    {
      "date_entered": "2008-02-29",
      "date_filed": "2008-02-29",
      "description": "Affidavit of Service OF MOTION FOR ENTRY OF ORDER CONFIRMING AUTOMATIC STAY IS NOT IN EFFECT filed by CHRISTOPHER RYAN CHICOINE of PITE DUNCAN LLP on behalf of AMERICAN GUARDIAN FINANCIAL GROUP, INC., its successors and/or assigns (related document(s) 47 ).(CHICOINE, CHRISTOPHER) (Entered: 02/29/2008)",
      "document_number": "48",
      "pacer_doc_id": "sho0_doc.pl",
      "pacer_seq_no": null
    },
    {
      "date_entered": "2008-03-06",
      "date_filed": "2008-03-06",
      "description": "Motion for Entry of Order Confirming that No Stay is in Effect or that the Stay has been Terminated re: 1320 East Roeser Lane, Phoenix, Arizona 85014 filed by CHRISTOPHER RYAN CHICOINE of PITE DUNCAN LLP on behalf of BANK OF AMERICA, N.A., its successors and/or assigns (Attachments: # 1 Exhibit A - DOT). (CHICOINE, CHRISTOPHER) (Entered: 03/06/2008)",
      "document_number": "49",
      "pacer_doc_id": "sho0_doc.pl",
      "pacer_seq_no": null
    },
    {
      "date_entered": "2008-03-06",
      "date_filed": "2008-03-06",
      "description": "Notice of Lodging Proposed Order CONFIRMING AUTOMATIC STAY IS NOT IN EFFECT filed by CHRISTOPHER RYAN CHICOINE of PITE DUNCAN LLP on behalf of BANK OF AMERICA, N.A., its successors and/or assigns (related document(s) 49 ).(CHICOINE, CHRISTOPHER) (Entered: 03/06/2008)",
      "document_number": "50",
      "pacer_doc_id": "sho0_doc.pl",
      "pacer_seq_no": null
    },
    {
      "date_entered": "2008-03-06",
      "date_filed": "2008-03-06",
      "description": "Affidavit of Service OF MOTION FOR ENTRY OF ORDER CONFIRMING AUTOMATIC STAY IS NOT IN EFFECT and ORDER CONFIRMING THAT NO AUTOMATIC STAY IS IN EFFECT filed by CHRISTOPHER RYAN CHICOINE of PITE DUNCAN LLP on behalf of BANK OF AMERICA, N.A., its successors and/or assigns (related document(s) 49, 50 ).(CHICOINE, CHRISTOPHER) (Entered: 03/06/2008)",
      "document_number": "51",
      "pacer_doc_id": "sho0_doc.pl",
      "pacer_seq_no": null
    },
    {
      "date_entered": "2008-03-11",
      "date_filed": "2008-03-11",
      "description": "ORDER Granting Motion for Entry of Order Confirming that No Stay is in Effect (Related Doc # 49 ) signed on 3/11/2008 . (Beckett, Evelyn) (Entered: 03/11/2008)",
      "document_number": "52",
      "pacer_doc_id": "sho0_doc.pl",
      "pacer_seq_no": null
    },
    {
      "date_entered": "2008-03-13",
      "date_filed": "2008-03-11",
      "description": "BNC Certificate of Service - PDF Document (related document(s) (Related Doc # 52 )) (Admin.) (Entered: 03/13/2008)",
      "document_number": "54",
      "pacer_doc_id": "sho0_doc.pl",
      "pacer_seq_no": null
    },
    {
      "date_entered": "2008-03-13",
      "date_filed": "2008-03-13",
      "description": "Affidavit of Service OF ORDER CONFIRMING THAT NO AUTOMATIC STAY IN EFFECT filed by CHRISTOPHER RYAN CHICOINE of PITE DUNCAN LLP on behalf of AMERICAN GUARDIAN FINANCIAL GROUP, INC., its successors and/or assigns (related document(s) 52 ).(CHICOINE, CHRISTOPHER) (Entered: 03/13/2008)",
      "document_number": "53",
      "pacer_doc_id": "sho0_doc.pl",
      "pacer_seq_no": null
    },
    {
      "date_entered": "2008-03-19",
      "date_filed": "2008-03-19",
      "description": "Notice of Lodging Proposed Order CONFIRMING THAT NO AUTOMATIC STAY IS IN EFFECT filed by CHRISTOPHER RYAN CHICOINE of PITE DUNCAN LLP on behalf of AMERICAN GUARDIAN FINANCIAL GROUP, INC., its successors and/or assigns (related document(s) 47 ) (Attachments: # 1 Exhibit A - proposed order).(CHICOINE, CHRISTOPHER) (Entered: 03/19/2008)",
      "document_number": "55",
      "pacer_doc_id": "sho0_doc.pl",
      "pacer_seq_no": null
    },
    {
      "date_entered": "2008-03-19",
      "date_filed": "2008-03-19",
      "description": "Affidavit of Service OF NOTICE OF LODGMENT OF ORDER CONFIRMING THAT NO AUTOMATIC STAY IS IN EFFECT and [PROPOSED] ORDER CONFIRMING THAT NO AUTOMATIC STAY IS IN EFFECT filed by CHRISTOPHER RYAN CHICOINE of PITE DUNCAN LLP on behalf of AMERICAN GUARDIAN FINANCIAL GROUP, INC., its successors and/or assigns (related document(s) 55 ).(CHICOINE, CHRISTOPHER) (Entered: 03/19/2008)",
      "document_number": "56",
      "pacer_doc_id": "sho0_doc.pl",
      "pacer_seq_no": null
    },
    {
      "date_entered": "2008-03-24",
      "date_filed": "2008-03-21",
      "description": "ORDER Granting Motion for Entry of Order Confirming that No Automatic Stay is in Effect (Related Doc # 47 ) signed on 3/21/2008 . (Lewis, Diane) (Entered: 03/24/2008)",
      "document_number": "57",
      "pacer_doc_id": "sho0_doc.pl",
      "pacer_seq_no": null
    },
    {
      "date_entered": "2008-03-26",
      "date_filed": "2008-03-24",
      "description": "BNC Certificate of Service - PDF Document (related document(s) (Related Doc # 57 )) (Admin.) (Entered: 03/26/2008)",
      "document_number": "60",
      "pacer_doc_id": "sho0_doc.pl",
      "pacer_seq_no": null
    },
    {
      "date_entered": "2008-03-26",
      "date_filed": "2008-03-26",
      "description": "Amended Motion for Relief from Stay filed by MATTHEW A. SILVERMAN of MCCARTHY HOLTHUS LEVINE on behalf of Wells Fargo Bank, N.A. as Trustee for Option One Mortgage Loan Trust 2007-4 Asset-Backed Certificates, Series 2007-4, its assignees and/or successors (related document(s) 14 ) (Attachments: # 1 Exhibit). (SILVERMAN, MATTHEW) (Entered: 03/26/2008)",
      "document_number": "58",
      "pacer_doc_id": "sho0_doc.pl",
      "pacer_seq_no": null
    },
    {
      "date_entered": "2008-03-26",
      "date_filed": "2008-03-26",
      "description": "Notice of Motion for Relief from Stay filed by MATTHEW A. SILVERMAN of MCCARTHY HOLTHUS LEVINE on behalf of Wells Fargo Bank, N.A. as Trustee for Option One Mortgage Loan Trust 2007-4 Asset-Backed Certificates, Series 2007-4, its assignees and/or successors (related document(s) 58 ) (Attachments: # 1 Exhibit).(SILVERMAN, MATTHEW) (Entered: 03/26/2008)",
      "document_number": "59",
      "pacer_doc_id": "sho0_doc.pl",
      "pacer_seq_no": null
    },
    {
      "date_entered": "2008-03-28",
      "date_filed": "2008-03-27",
      "description": "ORDER Denying Motion for Relief signed on 3/27/2008 (related document(s) 17 ) . (Beckett, Evelyn) (Entered: 03/28/2008)",
      "document_number": "61",
      "pacer_doc_id": "sho0_doc.pl",
      "pacer_seq_no": null
    },
    {
      "date_entered": "2008-03-28",
      "date_filed": "2008-03-28",
      "description": "ORDER Noticed to Interested Parties signed on 3/28/2008 (related document(s) 61 ) . (Beckett, Evelyn) (Entered: 03/28/2008)",
      "document_number": "62",
      "pacer_doc_id": "sho0_doc.pl",
      "pacer_seq_no": null
    },
    {
      "date_entered": "2008-03-30",
      "date_filed": "2008-03-28",
      "description": "BNC Certificate of Service - PDF Document (related document(s) (Related Doc # 62 )) (Admin.) (Entered: 03/30/2008)",
      "document_number": "63",
      "pacer_doc_id": "sho0_doc.pl",
      "pacer_seq_no": null
    },
    {
      "date_entered": "2008-03-31",
      "date_filed": "2008-03-31",
      "description": "Affidavit of Service OF ENRTERED ORDER CONFIRMING THAT NO AUTOMATIC STAY IS IN EFFECT filed by CHRISTOPHER RYAN CHICOINE of PITE DUNCAN LLP on behalf of AMERICAN GUARDIAN FINANCIAL GROUP, INC., its successors and/or assigns (related document(s) 57 ).(CHICOINE, CHRISTOPHER) (Entered: 03/31/2008)",
      "document_number": "64",
      "pacer_doc_id": "sho0_doc.pl",
      "pacer_seq_no": null
    },
    {
      "date_entered": "2008-04-01",
      "date_filed": "2008-04-01",
      "description": "Notice of Filing Exhibit filed by MATTHEW A. SILVERMAN of MCCARTHY HOLTHUS LEVINE on behalf of Option One Mortgage Corporation, its assignees and/or successors (related document(s) 45 ) (Attachments: # 1 Exhibit).(SILVERMAN, MATTHEW) Modified on 4/1/2008 to Edit Text(Beckett, Evelyn). (Entered: 04/01/2008)",
      "document_number": "65",
      "pacer_doc_id": "sho0_doc.pl",
      "pacer_seq_no": null
    },
    {
      "date_entered": "2008-04-16",
      "date_filed": "2008-04-16",
      "description": "Adversary case 2:08-ap-00287. Adversary Proceeding Opened. (RATTAY, KEVIN) (Entered: 04/16/2008)",
      "document_number": null,
      "pacer_doc_id": null,
      "pacer_seq_no": null
    },
    {
      "date_entered": "2008-04-18",
      "date_filed": "2008-04-18",
      "description": "Motion to Extend Deadline for Filing Section 727 Objection to Discharge filed by DAWN M. BAYNE of ALLEN, SALA & BAYNE, PLC on behalf of JILL H. FORD. (BAYNE, DAWN) (Entered: 04/18/2008)",
      "document_number": "66",
      "pacer_doc_id": "sho0_doc.pl",
      "pacer_seq_no": null
    },
    {
      "date_entered": "2008-04-18",
      "date_filed": "2008-04-18",
      "description": "Notice of Lodging Proposed Order filed by DAWN M. BAYNE of ALLEN, SALA & BAYNE, PLC on behalf of JILL H. FORD (related document(s) 66 ) (Attachments: # 1 Exhibit A- Proposed Order).(BAYNE, DAWN) (Entered: 04/18/2008)",
      "document_number": "67",
      "pacer_doc_id": "sho0_doc.pl",
      "pacer_seq_no": null
    },
    {
      "date_entered": "2008-04-18",
      "date_filed": "2008-04-18",
      "description": "Adversary case 2:08-ap-00294. Adversary Proceeding Opened. (DAKE, TERRY) (Entered: 04/18/2008)",
      "document_number": null,
      "pacer_doc_id": null,
      "pacer_seq_no": null
    },
    {
      "date_entered": "2008-04-22",
      "date_filed": "2008-04-22",
      "description": "Notice of Lodging Proposed Order filed by MATTHEW A. SILVERMAN of MCCARTHY HOLTHUS LEVINE on behalf of Wells Fargo Bank, N.A. as Trustee for Option One Mortgage Loan Trust 2007-4 Asset-Backed Certificates, Series 2007-4, its assignees and/or successors (related document(s) 58 ) (Attachments: # 1 Exhibit).(SILVERMAN, MATTHEW) (Entered: 04/22/2008)",
      "document_number": "68",
      "pacer_doc_id": "sho0_doc.pl",
      "pacer_seq_no": null
    },
    {
      "date_entered": "2008-04-22",
      "date_filed": "2008-04-22",
      "description": "Certificate of Service and No Objections filed by MATTHEW A. SILVERMAN of MCCARTHY HOLTHUS LEVINE on behalf of Wells Fargo Bank, N.A. as Trustee for Option One Mortgage Loan Trust 2007-4 Asset-Backed Certificates, Series 2007-4, its assignees and/or successors.(related document(s) 58 ) (SILVERMAN, MATTHEW) (Entered: 04/22/2008)",
      "document_number": "69",
      "pacer_doc_id": "sho0_doc.pl",
      "pacer_seq_no": null
    },
    {
      "date_entered": "2008-04-23",
      "date_filed": "2008-04-22",
      "description": "ORDER Granting Amended Motion for Relief from Stay (Related Doc # 58 ) signed on 4/22/2008 . (Allen, Barbara) (Entered: 04/23/2008)",
      "document_number": "70",
      "pacer_doc_id": "sho0_doc.pl",
      "pacer_seq_no": null
    },
    {
      "date_entered": "2008-04-23",
      "date_filed": "2008-04-23",
      "description": "Notice of Filing Motion to Extend Complaints Deadline filed by DAWN M. BAYNE of ALLEN, SALA & BAYNE, PLC on behalf of JILL H. FORD (related document(s) 66 ).(BAYNE, DAWN) (Entered: 04/23/2008)",
      "document_number": "71",
      "pacer_doc_id": "sho0_doc.pl",
      "pacer_seq_no": null
    },
    {
      "date_entered": "2008-04-25",
      "date_filed": "2008-04-23",
      "description": "BNC Certificate of Service (related document(s) (Related Doc # 70 )) (Admin.) (Entered: 04/25/2008)",
      "document_number": "72",
      "pacer_doc_id": "sho0_doc.pl",
      "pacer_seq_no": null
    },
    {
      "date_entered": "2008-04-25",
      "date_filed": "2008-04-23",
      "description": "BNC Certificate of Service - PDF Document (related document(s) (Related Doc # 70 )) (Admin.) (Entered: 04/25/2008)",
      "document_number": "73",
      "pacer_doc_id": "sho0_doc.pl",
      "pacer_seq_no": null
    },
    {
      "date_entered": "2008-04-28",
      "date_filed": "2008-04-28",
      "description": "Application for FRBP 2004 Examination filed by DAWN 3 BAYNE of ALLEN, SALA & BAYNE, PLC on behalf of JILL H. FORD. (BAYNE, DAWN) (Entered: 04/28/2008)",
      "document_number": "74",
      "pacer_doc_id": "sho0_doc.pl",
      "pacer_seq_no": null
    },
    {
      "date_entered": "2008-04-28",
      "date_filed": "2008-04-28",
      "description": "Notice of Lodging Proposed Order filed by DAWN 3 BAYNE of ALLEN, SALA & BAYNE, PLC on behalf of JILL H. FORD (related document(s) 74 ) (Attachments: # 1 Exhibit A).(BAYNE, DAWN) (Entered: 04/28/2008)",
      "document_number": "75",
      "pacer_doc_id": "sho0_doc.pl",
      "pacer_seq_no": null
    },
    {
      "date_entered": "2008-04-29",
      "date_filed": "2008-04-29",
      "description": "Deficiency Memo - No Financial Management Course (Beckett, Evelyn) (Entered: 04/29/2008)",
      "document_number": "76",
      "pacer_doc_id": "sho0_doc.pl",
      "pacer_seq_no": null
    },
    {
      "date_entered": "2008-04-29",
      "date_filed": "2008-04-29",
      "description": "Notice of Appearance [Request for Special Notice] with Certificate of Mailing filed by JEREMY T. BERGSTROM of MILES, BAUER, BERGSTROM & WINTERS, LLP on behalf of COUNTRYWIDE HOME LOANS, INC..(BERGSTROM, JEREMY) (Entered: 04/29/2008)",
      "document_number": "77",
      "pacer_doc_id": "sho0_doc.pl",
      "pacer_seq_no": null
    },
    {
      "date_entered": "2008-04-30",
      "date_filed": "2008-04-29",
      "description": "ORDER Granting Application for FRBP 2004 Examination (Related Doc # 74 ) signed on 4/29/2008 . (Beckett, Evelyn) (Entered: 04/30/2008)",
      "document_number": "78",
      "pacer_doc_id": "sho0_doc.pl",
      "pacer_seq_no": null
    },
    {
      "date_entered": "2008-05-01",
      "date_filed": "2008-04-29",
      "description": "BNC Certificate of Service (related document(s) (Related Doc # 76 )) (Admin.) (Entered: 05/01/2008)",
      "document_number": "82",
      "pacer_doc_id": "sho0_doc.pl",
      "pacer_seq_no": null
    },
    {
      "date_entered": "2008-05-01",
      "date_filed": "2008-05-01",
      "description": "Notice of Appearance filed by MARK 2 BOSCO of TIFFANY & BOSCO, P.A. on behalf of Countrywide Home Loans, Inc. C/O Mark S. Bosco..(BOSCO, MARK) (Entered: 05/01/2008)",
      "document_number": "79",
      "pacer_doc_id": "sho0_doc.pl",
      "pacer_seq_no": null
    },
    {
      "date_entered": "2008-05-01",
      "date_filed": "2008-05-01",
      "description": "Motion for Relief from Stay (150.00 fee) Re: Real Property Located at 6427 S. 23rd St. Phoenix, AZ. 85042 filed by MARK 2 BOSCO of TIFFANY & BOSCO, P.A. on behalf of Countrywide Home Loans, Inc. C/O Mark S. Bosco. (Attachments: # 1 Exhibit a# 2 Exhibit b). (BOSCO, MARK) (Entered: 05/01/2008)",
      "document_number": "80",
      "pacer_doc_id": "sho0_doc.pl",
      "pacer_seq_no": null
    },
    {
      "date_entered": "2008-05-01",
      "date_filed": "2008-05-01",
      "description": "Notice of Motion for Relief from Stay filed by MARK 2 BOSCO of TIFFANY & BOSCO, P.A. on behalf of Countrywide Home Loans, Inc. C/O Mark S. Bosco. (related document(s) 80 ) Objections/Responses due by 5/19/2008,.(BOSCO, MARK) (Entered: 05/01/2008)",
      "document_number": "81",
      "pacer_doc_id": "sho0_doc.pl",
      "pacer_seq_no": null
    },
    {
      "date_entered": "2008-05-05",
      "date_filed": "2008-05-05",
      "description": "Receipt of Motion for Relief from Stay (150.00 fee)(2:08-bk-00381-SSC) [motion,185] ( 150.00) Filing Fee. Receipt number 6991129. Fee amount 150.00. (U.S. Treasury) (Entered: 05/05/2008)",
      "document_number": null,
      "pacer_doc_id": null,
      "pacer_seq_no": null
    },
    {
      "date_entered": "2008-05-06",
      "date_filed": "2008-05-06",
      "description": "Motion for Relief from Stay (150.00 fee) [on 3938 East Becker Lane, Phoenix, AZ 85028] filed by JEREMY T. BERGSTROM of MILES, BAUER, BERGSTROM & WINTERS, LLP on behalf of COUNTRYWIDE HOME LOANS, INC.. (BERGSTROM, JEREMY) (Entered: 05/06/2008)",
      "document_number": "83",
      "pacer_doc_id": "sho0_doc.pl",
      "pacer_seq_no": null
    },
    {
      "date_entered": "2008-05-06",
      "date_filed": "2008-05-06",
      "description": "Notice of Motion for Relief from Stay with Certificate of Mailing filed by JEREMY T. BERGSTROM of MILES, BAUER, BERGSTROM & WINTERS, LLP on behalf of COUNTRYWIDE HOME LOANS, INC. (related document(s) 83 ) Objections/Responses due by 5/27/2008,.(BERGSTROM, JEREMY) (Entered: 05/06/2008)",
      "document_number": "84",
      "pacer_doc_id": "sho0_doc.pl",
      "pacer_seq_no": null
    },
    {
      "date_entered": "2008-05-06",
      "date_filed": "2008-05-06",
      "description": "Supplemental Declaration of Marita Graulich filed by JEREMY T. BERGSTROM of MILES, BAUER, BERGSTROM & WINTERS, LLP on behalf of COUNTRYWIDE HOME LOANS, INC..(related document(s) 83 ) (BERGSTROM, JEREMY) (Entered: 05/06/2008)",
      "document_number": "85",
      "pacer_doc_id": "sho0_doc.pl",
      "pacer_seq_no": null
    },
    {
      "date_entered": "2008-05-06",
      "date_filed": "2008-05-06",
      "description": "Receipt of Motion for Relief from Stay (150.00 fee)(2:08-bk-00381-SSC) [motion,185] ( 150.00) Filing Fee. Receipt number 6996699. Fee amount 150.00. (U.S. Treasury) (Entered: 05/06/2008)",
      "document_number": null,
      "pacer_doc_id": null,
      "pacer_seq_no": null
    },
    {
      "date_entered": "2008-05-16",
      "date_filed": "2008-05-16",
      "description": "Certificate of Service and No Objection and Notice of Lodging Proposed Form of Order filed by DAWN M. BAYNE of ALLEN, SALA & BAYNE, PLC on behalf of JILL H. FORD (related document(s) 66, 71 ) (Attachments: # 1 Exhibit A- Proposed Order Extending Deadline).(BAYNE, DAWN) (Entered: 05/16/2008)",
      "document_number": "86",
      "pacer_doc_id": "sho0_doc.pl",
      "pacer_seq_no": null
    },
    {
      "date_entered": "2008-05-19",
      "date_filed": "2008-05-16",
      "description": "ORDER Extending Deadline for Filing Section 727 Objection to Discharge signed on 5/16/2008 (related document(s) 66 ) Complaints under Sections 727 or 523 due by 6/21/2008. . (Beckett, Evelyn) (Entered: 05/19/2008)",
      "document_number": "87",
      "pacer_doc_id": "sho0_doc.pl",
      "pacer_seq_no": null
    },
    {
      "date_entered": "2008-05-28",
      "date_filed": "2008-05-28",
      "description": "Notice of Lodging Proposed Order with Certificate of Mailing filed by JEREMY T. BERGSTROM of MILES, BAUER, BERGSTROM & WINTERS, LLP on behalf of COUNTRYWIDE HOME LOANS, INC. (related document(s) 83 ).(BERGSTROM, JEREMY) (Entered: 05/28/2008)",
      "document_number": "88",
      "pacer_doc_id": "sho0_doc.pl",
      "pacer_seq_no": null
    },
    {
      "date_entered": "2008-05-28",
      "date_filed": "2008-05-28",
      "description": "Certificate of Service and No Objections with Certificate of Mailing filed by JEREMY T. BERGSTROM of MILES, BAUER, BERGSTROM & WINTERS, LLP on behalf of COUNTRYWIDE HOME LOANS, INC..(related document(s) 83 ) (BERGSTROM, JEREMY) (Entered: 05/28/2008)",
      "document_number": "89",
      "pacer_doc_id": "sho0_doc.pl",
      "pacer_seq_no": null
    },
    {
      "date_entered": "2008-05-29",
      "date_filed": "2008-05-28",
      "description": "Financial Management Course Certificate filed by GUILLERMO DE LA VARA. (Beckett, Evelyn) (Entered: 05/29/2008)",
      "document_number": "90",
      "pacer_doc_id": "sho0_doc.pl",
      "pacer_seq_no": null
    },
    {
      "date_entered": "2008-05-29",
      "date_filed": "2008-05-29",
      "description": "ORDER Granting Motion for Relief from Stay (Related Doc # 83 ) signed on 5/29/2008 . (Beckett, Evelyn) (Entered: 05/29/2008)",
      "document_number": "91",
      "pacer_doc_id": "sho0_doc.pl",
      "pacer_seq_no": null
    },
    {
      "date_entered": "2008-05-31",
      "date_filed": "2008-05-29",
      "description": "BNC Certificate of Service (related document(s) (Related Doc # 91 )) (Admin.) (Entered: 05/31/2008)",
      "document_number": "92",
      "pacer_doc_id": "sho0_doc.pl",
      "pacer_seq_no": null
    },
    {
      "date_entered": "2008-05-31",
      "date_filed": "2008-05-29",
      "description": "BNC Certificate of Service - PDF Document (related document(s) (Related Doc # 91 )) (Admin.) (Entered: 05/31/2008)",
      "document_number": "93",
      "pacer_doc_id": "sho0_doc.pl",
      "pacer_seq_no": null
    },
    {
      "date_entered": "2008-06-02",
      "date_filed": "2008-06-02",
      "description": "Notice of Filing Additional Exhibit filed by MARK 2 BOSCO of TIFFANY & BOSCO, P.A. on behalf of Wells Fargo Bank, N.A., C/O Mark S. Bosco. (related document(s) 17 ).(BOSCO, MARK) (Entered: 06/02/2008)",
      "document_number": "94",
      "pacer_doc_id": "sho0_doc.pl",
      "pacer_seq_no": null
    },
    {
      "date_entered": "2008-06-06",
      "date_filed": "2008-06-05",
      "description": "ORDER Granting Motion for Relief from Stay (Related Doc # 17 ) signed on 6/5/2008 . (Fagan, Staci) (Entered: 06/06/2008)",
      "document_number": "95",
      "pacer_doc_id": "sho0_doc.pl",
      "pacer_seq_no": null
    },
    {
      "date_entered": "2008-06-08",
      "date_filed": "2008-06-06",
      "description": "BNC Certificate of Service (related document(s) (Related Doc # 95 )) (Admin.) (Entered: 06/08/2008)",
      "document_number": "96",
      "pacer_doc_id": "sho0_doc.pl",
      "pacer_seq_no": null
    },
    {
      "date_entered": "2008-06-08",
      "date_filed": "2008-06-06",
      "description": "BNC Certificate of Service - PDF Document (related document(s) (Related Doc # 95 )) (Admin.) (Entered: 06/08/2008)",
      "document_number": "97",
      "pacer_doc_id": "sho0_doc.pl",
      "pacer_seq_no": null
    },
    {
      "date_entered": "2008-06-10",
      "date_filed": "2008-06-09",
      "description": "ORDER Denying Discharge - Default Judgment Entered 08-ap-294 - signed on 6/9/2008 . (Fagan, Staci) (Entered: 06/10/2008)",
      "document_number": "98",
      "pacer_doc_id": "sho0_doc.pl",
      "pacer_seq_no": null
    },
    {
      "date_entered": "2008-09-25",
      "date_filed": "2008-06-09",
      "description": "=ENTERED IN ERROR (DUPLICATE) ORDER Denying Discharge - Default Judgment Entered in Adv. 08-294 signed on 6/9/2008 . (Fagan, Staci) Modified on 9/25/2008 (Fagan, Staci). (Entered: 09/25/2008)",
      "document_number": "121",
      "pacer_doc_id": "sho0_doc.pl",
      "pacer_seq_no": null
    },
    {
      "date_entered": "2008-06-10",
      "date_filed": "2008-06-10",
      "description": "Notice of No Objection filed by MARK 4 BOSCO of TIFFANY & BOSCO, P.A. on behalf of Countrywide Home Loans, Inc. C/O Mark S. Bosco. (related document(s) 80 ).(BOSCO, MARK) (Entered: 06/10/2008)",
      "document_number": "99",
      "pacer_doc_id": "sho0_doc.pl",
      "pacer_seq_no": null
    },
    {
      "date_entered": "2008-06-10",
      "date_filed": "2008-06-10",
      "description": "Notice of Lodging Proposed Order filed by MARK 4 BOSCO of TIFFANY & BOSCO, P.A. on behalf of Countrywide Home Loans, Inc. C/O Mark S. Bosco..(BOSCO, MARK) (Entered: 06/10/2008)",
      "document_number": "100",
      "pacer_doc_id": "sho0_doc.pl",
      "pacer_seq_no": null
    },
    {
      "date_entered": "2008-06-12",
      "date_filed": "2008-06-10",
      "description": "BNC Certificate of Service - PDF Document (related document(s) (Related Doc # 98 )) (Admin.) (Entered: 06/12/2008)",
      "document_number": "101",
      "pacer_doc_id": "sho0_doc.pl",
      "pacer_seq_no": null
    },
    {
      "date_entered": "2008-06-16",
      "date_filed": "2008-06-13",
      "description": "ORDER Granting Motion for Relief from Stay (Related Doc # 80 ) signed on 6/13/2008 . (Taylor, Erika) (Entered: 06/16/2008)",
      "document_number": "102",
      "pacer_doc_id": "sho0_doc.pl",
      "pacer_seq_no": null
    },
    {
      "date_entered": "2008-06-18",
      "date_filed": "2008-06-16",
      "description": "BNC Certificate of Service (related document(s) (Related Doc # 102 )) (Admin.) (Entered: 06/18/2008)",
      "document_number": "103",
      "pacer_doc_id": "sho0_doc.pl",
      "pacer_seq_no": null
    },
    {
      "date_entered": "2008-06-18",
      "date_filed": "2008-06-16",
      "description": "BNC Certificate of Service - PDF Document (related document(s) (Related Doc # 102 )) (Admin.) (Entered: 06/18/2008)",
      "document_number": "104",
      "pacer_doc_id": "sho0_doc.pl",
      "pacer_seq_no": null
    },
    {
      "date_entered": "2008-07-18",
      "date_filed": "2008-07-18",
      "description": "Motion to Withdraw as Attorney filed by DAN 2 GUKEISEN of GUKEISEN LAW GROUP, P.C. on behalf of GUILLERMO DE LA VARA (Attachments: # 1 Pleading Order). (GUKEISEN, DAN) (Entered: 07/18/2008)",
      "document_number": "105",
      "pacer_doc_id": "sho0_doc.pl",
      "pacer_seq_no": null
    },
    {
      "date_entered": "2008-07-18",
      "date_filed": "2008-07-18",
      "description": "Entered in Error/Incorrect Document Attached/ Notice of Withdrawal filed by DAN 2 GUKEISEN of GUKEISEN LAW GROUP, P.C. on behalf of GUILLERMO DE LA VARA (related document(s) 105 Motion to Withdraw as Attorney).(GUKEISEN, DAN) Modified on 7/21/2008 (Allen, Barbara). (Entered: 07/18/2008)",
      "document_number": "106",
      "pacer_doc_id": "sho0_doc.pl",
      "pacer_seq_no": null
    },
    {
      "date_entered": "2008-07-21",
      "date_filed": "2008-07-21",
      "description": "Motion to Withdraw as Attorney filed by DAN 2 GUKEISEN of GUKEISEN LAW GROUP, P.C. on behalf of GUILLERMO DE LA VARA. (GUKEISEN, DAN) (Entered: 07/21/2008)",
      "document_number": "107",
      "pacer_doc_id": "sho0_doc.pl",
      "pacer_seq_no": null
    },
    {
      "date_entered": "2008-07-21",
      "date_filed": "2008-07-21",
      "description": "Notice of Lodging Proposed Order filed by DAN 2 GUKEISEN of GUKEISEN LAW GROUP, P.C. on behalf of GUILLERMO DE LA VARA.(GUKEISEN, DAN) (Entered: 07/21/2008)",
      "document_number": "108",
      "pacer_doc_id": "sho0_doc.pl",
      "pacer_seq_no": null
    },
    {
      "date_entered": "2008-07-28",
      "date_filed": "2008-07-25",
      "description": "ORDER Granting Motion to Withdraw as Attorney (Related Doc # 107 ) signed on 7/25/2008 . (Fagan, Staci) (Entered: 07/28/2008)",
      "document_number": "109",
      "pacer_doc_id": "sho0_doc.pl",
      "pacer_seq_no": null
    },
    {
      "date_entered": "2008-07-31",
      "date_filed": "2008-07-31",
      "description": "Notice of Lodging Proposed Order filed by DAN 2 GUKEISEN of GUKEISEN LAW GROUP, P.C. on behalf of GUILLERMO DE LA VARA.(GUKEISEN, DAN) (Entered: 07/31/2008)",
      "document_number": "110",
      "pacer_doc_id": "sho0_doc.pl",
      "pacer_seq_no": null
    },
    {
      "date_entered": "2008-07-31",
      "date_filed": "2008-07-31",
      "description": "Notice of Appearance and Request for Notice filed by KEVIN HAHN of MALCOLM & CISNEROS on behalf of American Home Mortgage Servicing, Inc.(HAHN, KEVIN) (Entered: 07/31/2008)",
      "document_number": "111",
      "pacer_doc_id": "sho0_doc.pl",
      "pacer_seq_no": null
    },
    {
      "date_entered": "2008-07-31",
      "date_filed": "2008-07-31",
      "description": "Motion for Relief from Stay (150.00 fee) re: 3941 West Grant Street, Phoenix, AZ 85009 filed by KEVIN HAHN of MALCOLM & CISNEROS on behalf of American Home Mortgage Servicing, Inc (related document(s) 111 Notice of Appearance) (Attachments: # 1 Exhibit A, Exhibit B, Exhibit C, Exhibit D). (HAHN, KEVIN) (Entered: 07/31/2008)",
      "document_number": "112",
      "pacer_doc_id": "sho0_doc.pl",
      "pacer_seq_no": null
    },
    {
      "date_entered": "2008-07-31",
      "date_filed": "2008-07-31",
      "description": "Receipt of Motion for Relief from Stay (150.00 fee)(2:08-bk-00381-SSC) [motion,185] ( 150.00) Filing Fee. Receipt number 7812868. Fee amount 150.00. (U.S. Treasury) (Entered: 07/31/2008)",
      "document_number": null,
      "pacer_doc_id": null,
      "pacer_seq_no": null
    },
    {
      "date_entered": "2008-07-31",
      "date_filed": "2008-07-31",
      "description": "Notice of Motion for Relief from Stay and Requirement to File Response filed by KEVIN HAHN of MALCOLM & CISNEROS on behalf of American Home Mortgage Servicing, Inc (related document(s) 111 Notice of Appearance, 112 Motion for Relief from Stay (150.00 fee)) (Attachments: # 1 Proposed Order Lifting Stay).(HAHN, KEVIN) (Entered: 07/31/2008)",
      "document_number": "113",
      "pacer_doc_id": "sho0_doc.pl",
      "pacer_seq_no": null
    },
    {
      "date_entered": "2008-07-31",
      "date_filed": "2008-07-31",
      "description": "Certificate of Mailing filed by KEVIN HAHN of MALCOLM & CISNEROS on behalf of American Home Mortgage Servicing, Inc. (related document(s) 111 Notice of Appearance, 112 Motion for Relief from Stay (150.00 fee), 113 Notice of Motion for Relief from Stay) (HAHN, KEVIN) (Entered: 07/31/2008)",
      "document_number": "114",
      "pacer_doc_id": "sho0_doc.pl",
      "pacer_seq_no": null
    },
    {
      "date_entered": "2008-08-20",
      "date_filed": "2008-08-20",
      "description": "Notice of Lodging Proposed Order filed by KEVIN HAHN of MALCOLM & CISNEROS on behalf of American Home Mortgage Servicing, Inc (related document(s) 112 Motion for Relief from Stay (150.00 fee)).(HAHN, KEVIN) (Entered: 08/20/2008)",
      "document_number": "115",
      "pacer_doc_id": "sho0_doc.pl",
      "pacer_seq_no": null
    },
    {
      "date_entered": "2008-08-20",
      "date_filed": "2008-08-20",
      "description": "Certificate of Service and No Objections filed by KEVIN HAHN of MALCOLM & CISNEROS on behalf of American Home Mortgage Servicing, Inc. (related document(s) 115 Notice of Lodging Proposed Order) (HAHN, KEVIN) (Entered: 08/20/2008)",
      "document_number": "116",
      "pacer_doc_id": "sho0_doc.pl",
      "pacer_seq_no": null
    },
    {
      "date_entered": "2008-08-22",
      "date_filed": "2008-08-21",
      "description": "ORDER Granting Motion for Relief from Stay (Related Doc # 112 ) signed on 8/21/2008 . (Fagan, Staci) (Entered: 08/22/2008)",
      "document_number": "117",
      "pacer_doc_id": "sho0_doc.pl",
      "pacer_seq_no": null
    },
    {
      "date_entered": "2008-08-24",
      "date_filed": "2008-08-22",
      "description": "BNC Certificate of Service (related document(s) 117 Order on Motion for Relief from Stay) (Admin.) (Entered: 08/24/2008)",
      "document_number": "118",
      "pacer_doc_id": "sho0_doc.pl",
      "pacer_seq_no": null
    },
    {
      "date_entered": "2008-08-24",
      "date_filed": "2008-08-22",
      "description": "BNC Certificate of Service - PDF Document (related document(s) 117 Order on Motion for Relief from Stay) (Admin.) (Entered: 08/24/2008)",
      "document_number": "119",
      "pacer_doc_id": "sho0_doc.pl",
      "pacer_seq_no": null
    },
    {
      "date_entered": "2008-09-11",
      "date_filed": "2008-09-11",
      "description": "Notice of Appearance filed by ERICH M RAMSEY of ASCENSION CAPITAL GROUP on behalf of COMPASS BANK (UNSECURED) DEPARTMENT.(RAMSEY, ERICH) (Entered: 09/11/2008)",
      "document_number": "120",
      "pacer_doc_id": "sho0_doc.pl",
      "pacer_seq_no": null
    },
    {
      "date_entered": "2008-10-08",
      "date_filed": "2008-10-08",
      "description": "Motion for Relief from Stay (150.00 fee) 642 West Laguna Azul Avenue, Mesa, AZ 85210, (AZ08-31050) filed by MATTHEW A. SILVERMAN of MCCARTHY HOLTHUS LEVINE on behalf of Mortgage Electronic Registration Systems, Inc. as nominee for American Home Mortgage Acceptance, Inc., its assignees and/or successors and servicing agent American Home Mortgage Servicing, Inc. (Attachments: # 1 Exhibit). (SILVERMAN, MATTHEW) (Entered: 10/08/2008)",
      "document_number": "122",
      "pacer_doc_id": "sho0_doc.pl",
      "pacer_seq_no": null
    },
    {
      "date_entered": "2008-10-08",
      "date_filed": "2008-10-08",
      "description": "Notice of Motion for Relief from Stay (AZ08-31050) filed by MATTHEW A. SILVERMAN of MCCARTHY HOLTHUS LEVINE on behalf of Mortgage Electronic Registration Systems, Inc. as nominee for American Home Mortgage Acceptance, Inc., its assignees and/or successors and servicing agent American Home Mortgage Servicing, Inc. (related document(s) 122 Motion for Relief from Stay (150.00 fee)) (Attachments: # 1 Exhibit).(SILVERMAN, MATTHEW) (Entered: 10/08/2008)",
      "document_number": "123",
      "pacer_doc_id": "sho0_doc.pl",
      "pacer_seq_no": null
    },
    {
      "date_entered": "2008-10-08",
      "date_filed": "2008-10-08",
      "description": "Receipt of Motion for Relief from Stay (150.00 fee)(2:08-bk-00381-SSC) [motion,185] ( 150.00) Filing Fee. Receipt number 8093348. Fee amount 150.00. (U.S. Treasury) (Entered: 10/08/2008)",
      "document_number": null,
      "pacer_doc_id": null,
      "pacer_seq_no": null
    },
    {
      "date_entered": "2008-10-27",
      "date_filed": "2008-10-27",
      "description": "Notice of Deposition and Request for Production of Documents filed by DAWN M. BAYNE of ALLEN, SALA & BAYNE, P.L.C. on behalf of JILL H. FORD (Attachments: # 1 Pleading 2004 Order).(BAYNE, DAWN) (Entered: 10/27/2008)",
      "document_number": "124",
      "pacer_doc_id": "sho0_doc.pl",
      "pacer_seq_no": null
    },
    {
      "date_entered": "2008-10-30",
      "date_filed": "2008-10-30",
      "description": "Notice of Lodging Proposed Order (AZ08-31050) filed by MATTHEW A. SILVERMAN of MCCARTHY HOLTHUS LEVINE on behalf of Mortgage Electronic Registration Systems, Inc. as nominee for American Home Mortgage Acceptance, Inc., its assignees and/or successors and servicing agent American Home Mortgage Servicing, Inc. (related document(s) 122 Motion for Relief from Stay (150.00 fee)) (Attachments: # 1 Exhibit).(SILVERMAN, MATTHEW) (Entered: 10/30/2008)",
      "document_number": "125",
      "pacer_doc_id": "sho0_doc.pl",
      "pacer_seq_no": null
    },
    {
      "date_entered": "2008-10-30",
      "date_filed": "2008-10-30",
      "description": "Certificate of Service and No Objections (AZ08-31050) filed by MATTHEW A. SILVERMAN of MCCARTHY HOLTHUS LEVINE on behalf of Mortgage Electronic Registration Systems, Inc. as nominee for American Home Mortgage Acceptance, Inc., its assignees and/or successors and servicing agent American Home Mortgage Servicing, Inc.. (related document(s) 122 Motion for Relief from Stay (150.00 fee)) (SILVERMAN, MATTHEW) (Entered: 10/30/2008)",
      "document_number": "126",
      "pacer_doc_id": "sho0_doc.pl",
      "pacer_seq_no": null
    },
    {
      "date_entered": "2008-10-31",
      "date_filed": "2008-10-30",
      "description": "ORDER Granting Motion for Relief from Stay (Related Doc # 122 ) signed on 10/30/2008 . (Taylor, Erika) (Entered: 10/31/2008)",
      "document_number": "127",
      "pacer_doc_id": "sho0_doc.pl",
      "pacer_seq_no": null
    },
    {
      "date_entered": "2008-10-31",
      "date_filed": "2008-10-31",
      "description": "Notice of Appearance filed by MARK 1 BOSCO of TIFFANY & BOSCO, P.A. on behalf of C/O Mark S. Bosco Argent Mortgage Co., LLC.(BOSCO, MARK) (Entered: 10/31/2008)",
      "document_number": "128",
      "pacer_doc_id": "sho0_doc.pl",
      "pacer_seq_no": null
    },
    {
      "date_entered": "2008-10-31",
      "date_filed": "2008-10-31",
      "description": "Motion for Relief from Stay (150.00 fee) RE: 2235 E SAINT CATHERINE PHOENIX AZ 85042 filed by MARK 1 BOSCO of TIFFANY & BOSCO, P.A. on behalf of C/O Mark S. Bosco Argent Mortgage Co., LLC (Attachments: # 1 Exhibit A# 2 Exhibit B# 3 Exhibit C). (BOSCO, MARK) (Entered: 10/31/2008)",
      "document_number": "129",
      "pacer_doc_id": "sho0_doc.pl",
      "pacer_seq_no": null
    },
    {
      "date_entered": "2008-10-31",
      "date_filed": "2008-10-31",
      "description": "Notice of Motion for Relief from Stay filed by MARK 1 BOSCO of TIFFANY & BOSCO, P.A. on behalf of C/O Mark S. Bosco Argent Mortgage Co., LLC Objections/Responses due by 11/17/2008,.(BOSCO, MARK) (Entered: 10/31/2008)",
      "document_number": "130",
      "pacer_doc_id": "sho0_doc.pl",
      "pacer_seq_no": null
    },
    {
      "date_entered": "2008-11-02",
      "date_filed": "2008-10-31",
      "description": "BNC Certificate of Notice (related document(s) 127 Order on Motion for Relief from Stay) (Admin.) (Entered: 11/02/2008)",
      "document_number": "131",
      "pacer_doc_id": "sho0_doc.pl",
      "pacer_seq_no": null
    },
    {
      "date_entered": "2008-11-02",
      "date_filed": "2008-10-31",
      "description": "BNC Certificate of Notice - PDF Document (related document(s) 127 Order on Motion for Relief from Stay) (Admin.) (Entered: 11/02/2008)",
      "document_number": "132",
      "pacer_doc_id": "sho0_doc.pl",
      "pacer_seq_no": null
    },
    {
      "date_entered": "2008-11-03",
      "date_filed": "2008-11-03",
      "description": "Receipt of Motion for Relief from Stay (150.00 fee)(2:08-bk-00381-SSC) [motion,185] ( 150.00) Filing Fee. Receipt number 8196698. Fee amount 150.00. (U.S. Treasury) (Entered: 11/03/2008)",
      "document_number": null,
      "pacer_doc_id": null,
      "pacer_seq_no": null
    },
    {
      "date_entered": "2008-11-12",
      "date_filed": "2008-11-12",
      "description": "Motion to Withdraw Document filed by MARK 3 BOSCO of TIFFANY & BOSCO, P.A. on behalf of C/O Mark S. Bosco Argent Mortgage Co., LLC (related document(s) 129 Motion for Relief from Stay (150.00 fee)). (BOSCO, MARK) (Entered: 11/12/2008)",
      "document_number": "133",
      "pacer_doc_id": "sho0_doc.pl",
      "pacer_seq_no": null
    },
    {
      "date_entered": "2008-11-17",
      "date_filed": "2008-11-14",
      "description": "ORDER Granting Motion to Withdraw Document (Related Doc # 133, 129 ) signed on 11/14/2008 . (Lewis, Diane) (Entered: 11/17/2008)",
      "document_number": "134",
      "pacer_doc_id": "sho0_doc.pl",
      "pacer_seq_no": null
    },
    {
      "date_entered": "2008-11-18",
      "date_filed": "2008-11-18",
      "description": "(ENTERED IN ERROR) Notice of Appearance filed by MARK 1 BOSCO of TIFFANY & BOSCO, P.A. on behalf of Wells Fargo Bank, N.A., C/O Mark S. Bosco..(BOSCO, MARK) Modified on 11/20/2008 (Estrella, Mary). (Entered: 11/18/2008)",
      "document_number": "135",
      "pacer_doc_id": "sho0_doc.pl",
      "pacer_seq_no": null
    },
    {
      "date_entered": "2008-11-20",
      "date_filed": "2008-11-20",
      "description": "Deficiency Memo (related document(s) 135 Notice of Appearance) (Estrella, Mary) (Entered: 11/20/2008)",
      "document_number": "136",
      "pacer_doc_id": "sho0_doc.pl",
      "pacer_seq_no": null
    },
    {
      "date_entered": "2008-11-22",
      "date_filed": "2008-11-20",
      "description": "BNC Certificate of Notice (related document(s) 136 Deficiency Memo) (Admin.) (Entered: 11/22/2008)",
      "document_number": "137",
      "pacer_doc_id": "sho0_doc.pl",
      "pacer_seq_no": null
    },
    {
      "date_entered": "2009-01-27",
      "date_filed": "2009-01-27",
      "description": "Motion to Approve Compromise/Settlement of Claim Pursuant to Fed.R.Bankr.P. 9019 filed by DAWN 4 BAYNE of ALLEN, SALA & BAYNE, PLC on behalf of JILL H. FORD (Attachments: # 1 Exhibit A- Signed Settlement Agreement). (BAYNE, DAWN) (Entered: 01/27/2009)",
      "document_number": "138",
      "pacer_doc_id": "sho0_doc.pl",
      "pacer_seq_no": null
    },
    {
      "date_entered": "2009-01-27",
      "date_filed": "2009-01-27",
      "description": "Chapter 7 Trustee Notice of Motion to Approve Compromise/Settlement of Claim Pursuant to Fed.R.Bankr.P. 9019 filed by DAWN 4 BAYNE of ALLEN, SALA & BAYNE, PLC on behalf of JILL H. FORD (related document(s) 138 Motion to Approve Compromise/Settlement) Objections/Responses due by 2/19/2009,.(BAYNE, DAWN) (Entered: 01/27/2009)",
      "document_number": "139",
      "pacer_doc_id": "sho0_doc.pl",
      "pacer_seq_no": null
    },
    {
      "date_entered": "2009-01-30",
      "date_filed": "2009-01-27",
      "description": "BNC Certificate of Notice - PDF Document (related document(s) 139 Chapter 7 Trustee Notice) (Admin.) (Entered: 01/30/2009)",
      "document_number": "140",
      "pacer_doc_id": "sho0_doc.pl",
      "pacer_seq_no": null
    },
    {
      "date_entered": "2009-01-30",
      "date_filed": "2009-01-30",
      "description": "Notice of Appearance and Request for Notice filed by KEVIN HAHN of MALCOLM & CISNEROS on behalf of Bank of America, N.A..(HAHN, KEVIN) (Entered: 01/30/2009)",
      "document_number": "141",
      "pacer_doc_id": "sho0_doc.pl",
      "pacer_seq_no": null
    },
    {
      "date_entered": "2009-01-30",
      "date_filed": "2009-01-30",
      "description": "Motion for Relief from Stay (150.00 fee) Re: 102 Churchrock Place, Gallup, NM 87301 filed by KEVIN HAHN of MALCOLM & CISNEROS on behalf of Bank of America, N.A. (related document(s) 141 Notice of Appearance) (Attachments: # 1 Exhibit A, Exhibit B, Exhibit C). (HAHN, KEVIN) (Entered: 01/30/2009)",
      "document_number": "142",
      "pacer_doc_id": "sho0_doc.pl",
      "pacer_seq_no": null
    },
    {
      "date_entered": "2009-01-30",
      "date_filed": "2009-01-30",
      "description": "Receipt of Motion for Relief from Stay (150.00 fee)(2:08-bk-00381-SSC) [motion,185] ( 150.00) Filing Fee. Receipt number 8561276. Fee amount 150.00. (U.S. Treasury) (Entered: 01/30/2009)",
      "document_number": null,
      "pacer_doc_id": null,
      "pacer_seq_no": null
    },
    {
      "date_entered": "2009-01-30",
      "date_filed": "2009-01-30",
      "description": "Notice of Motion for Relief from Stay and Requirement to File Response filed by KEVIN HAHN of MALCOLM & CISNEROS on behalf of Bank of America, N.A. (related document(s) 141 Notice of Appearance, 142 Motion for Relief from Stay (150.00 fee)) (Attachments: # 1 Proposed Order Lifting Stay).(HAHN, KEVIN) (Entered: 01/30/2009)",
      "document_number": "143",
      "pacer_doc_id": "sho0_doc.pl",
      "pacer_seq_no": null
    },
    {
      "date_entered": "2009-01-30",
      "date_filed": "2009-01-30",
      "description": "Certificate of Mailing filed by KEVIN HAHN of MALCOLM & CISNEROS on behalf of Bank of America, N.A.. (related document(s) 141 Notice of Appearance, 142 Motion for Relief from Stay (150.00 fee), 143 Notice of Motion for Relief from Stay) (HAHN, KEVIN) (Entered: 01/30/2009)",
      "document_number": "144",
      "pacer_doc_id": "sho0_doc.pl",
      "pacer_seq_no": null
    },
    {
      "date_entered": "2009-02-11",
      "date_filed": "2009-02-11",
      "description": "Certificate of Mailing filed by KEVIN HAHN of MALCOLM & CISNEROS on behalf of Bank of America, N.A.. (related document(s) 141 Notice of Appearance, 142 Motion for Relief from Stay (150.00 fee), 143 Notice of Motion for Relief from Stay) (HAHN, KEVIN) (Entered: 02/11/2009)",
      "document_number": "145",
      "pacer_doc_id": "sho0_doc.pl",
      "pacer_seq_no": null
    },
    {
      "date_entered": "2009-02-16",
      "date_filed": "2009-02-16",
      "description": "The Trustee reports that he or she now holds funds of this bankruptcy estate or expects to receive funds which should result in a dividend to creditors who were previously instructed not to file claims. The Trustee hereby requests that the Court fix the last date for filing proofs of claim and that notice be given to creditors. filed by JILL H. FORD on behalf of JILL H. FORD.(FORD, JILL) (Entered: 02/16/2009)",
      "document_number": "146",
      "pacer_doc_id": null,
      "pacer_seq_no": null
    },
    {
      "date_entered": "2009-02-17",
      "date_filed": "2009-02-17",
      "description": "Notice of Claims Bar Date. Proof of Claims due by 5/20/2009, (Taylor, Erika) (Entered: 02/17/2009)",
      "document_number": "147",
      "pacer_doc_id": "sho0_doc.pl",
      "pacer_seq_no": null
    },
    {
      "date_entered": "2009-02-20",
      "date_filed": "2009-02-17",
      "description": "BNC Certificate of Notice - Notice of Claims Bar Date (related document(s) 147 BNC Form Request--Notice of Claims Bar Date) (Admin.) (Entered: 02/20/2009)",
      "document_number": "148",
      "pacer_doc_id": "sho0_doc.pl",
      "pacer_seq_no": null
    },
    {
      "date_entered": "2009-03-02",
      "date_filed": "2009-03-02",
      "description": "Notice of Lodging Proposed Order filed by KEVIN HAHN of MALCOLM & CISNEROS on behalf of Bank of America, N.A. (related document(s) 142 Motion for Relief from Stay (150.00 fee)).(HAHN, KEVIN) (Entered: 03/02/2009)",
      "document_number": "149",
      "pacer_doc_id": "sho0_doc.pl",
      "pacer_seq_no": null
    },
    {
      "date_entered": "2009-03-02",
      "date_filed": "2009-03-02",
      "description": "Certificate of Service and No Objections filed by KEVIN HAHN of MALCOLM & CISNEROS on behalf of Bank of America, N.A.. (related document(s) 149 Notice of Lodging Proposed Order) (HAHN, KEVIN) (Entered: 03/02/2009)",
      "document_number": "150",
      "pacer_doc_id": "sho0_doc.pl",
      "pacer_seq_no": null
    },
    {
      "date_entered": "2009-03-03",
      "date_filed": "2009-03-03",
      "description": "Certificate of Service and No Objections -and- Notice of Lodging Proposed Form of Order filed by DAWN 4 BAYNE of ALLEN, SALA & BAYNE, PLC on behalf of JILL H. FORD. (related document(s) 138 Motion to Approve Compromise/Settlement, 139 Chapter 7 Trustee Notice) (Attachments: # 1 Exhibit A- Proposed Order)(BAYNE, DAWN) (Entered: 03/03/2009)",
      "document_number": "151",
      "pacer_doc_id": "sho0_doc.pl",
      "pacer_seq_no": null
    },
    {
      "date_entered": "2009-03-04",
      "date_filed": "2009-03-03",
      "description": "ORDER Granting Motion for Relief from Stay (Related Doc # 142 ) signed on 3/3/2009 . (Taylor, Erika) (Entered: 03/04/2009)",
      "document_number": "152",
      "pacer_doc_id": "sho0_doc.pl",
      "pacer_seq_no": null
    },
    {
      "date_entered": "2009-03-04",
      "date_filed": "2009-03-03",
      "description": "ORDER Approving Stipulation for Compromise/Settlement of Claim (Related Doc # 138 ) signed on 3/3/2009 . (Taylor, Erika) (Entered: 03/04/2009)",
      "document_number": "153",
      "pacer_doc_id": "sho0_doc.pl",
      "pacer_seq_no": null
    },
    {
      "date_entered": "2009-03-07",
      "date_filed": "2009-03-04",
      "description": "BNC Certificate of Notice (related document(s) 152 Order on Motion for Relief from Stay) (Admin.) (Entered: 03/07/2009)",
      "document_number": "154",
      "pacer_doc_id": "sho0_doc.pl",
      "pacer_seq_no": null
    },
    {
      "date_entered": "2009-03-07",
      "date_filed": "2009-03-04",
      "description": "BNC Certificate of Notice - PDF Document (related document(s) 152 Order on Motion for Relief from Stay) (Admin.) (Entered: 03/07/2009)",
      "document_number": "155",
      "pacer_doc_id": "sho0_doc.pl",
      "pacer_seq_no": null
    },
    {
      "date_entered": "2009-04-27",
      "date_filed": "2009-04-27",
      "description": "Trustee Notice to Abandon Property REAL PROPERTY filed by JILL H. FORD on behalf of JILL H. FORD.(FORD, JILL) (Entered: 04/27/2009)",
      "document_number": "156",
      "pacer_doc_id": "sho0_doc.pl",
      "pacer_seq_no": null
    },
    {
      "date_entered": "2009-04-29",
      "date_filed": "2009-04-27",
      "description": "BNC Certificate of Notice - PDF Document (related document(s) 156 Trustee Notice to Abandon Property) (Admin.) (Entered: 04/29/2009)",
      "document_number": "157",
      "pacer_doc_id": "sho0_doc.pl",
      "pacer_seq_no": null
    },
    {
      "date_entered": "2009-07-28",
      "date_filed": "2009-07-28",
      "description": "Adversary case 2:09-ap-00844. Adversary Proceeding Opened. (BAYNE, DAWN) (Entered: 07/28/2009)",
      "document_number": null,
      "pacer_doc_id": null,
      "pacer_seq_no": null
    },
    {
      "date_entered": "2009-09-10",
      "date_filed": "2009-09-10",
      "description": "Notice of Withdrawal of Motion for Relief From Automatic Stay filed by MARTY G BAKER of ROUTH CASTLE COOPER OLSEN, LLC on behalf of AMERICA'S SERVICING COMPANY (related document(s) 28 Motion for Relief from Stay (150.00 fee)).(BAKER, MARTY) (Entered: 09/10/2009)",
      "document_number": "158",
      "pacer_doc_id": "sho0_doc.pl",
      "pacer_seq_no": null
    },
    {
      "date_entered": "2009-12-04",
      "date_filed": "2009-12-04",
      "description": "Motion for Relief from Stay (150.00 fee) Re: Real property, 11020 N. 17th Ave., Phoenix, AZ 85029 filed by MARK 1 BOSCO of TIFFANY & BOSCO, P.A. on behalf of HSBC Bank USA, National Association, as Trustee for Home Equity Loan Trust Series ACE 2006-HE1 (Attachments: # 1 Exhibit \"A\" Note# 2 Exhibit \"B\" DOT# 3 Exhibit \"C\" Assignment# 4 Exhibit \"D\" Schedule A). (BOSCO, MARK) (Entered: 12/04/2009)",
      "document_number": "159",
      "pacer_doc_id": "sho0_doc.pl",
      "pacer_seq_no": null
    },
    {
      "date_entered": "2009-12-04",
      "date_filed": "2009-12-04",
      "description": "Notice of Motion for Relief from Stay filed by MARK 1 BOSCO of TIFFANY & BOSCO, P.A. on behalf of HSBC Bank USA, National Association, as Trustee for Home Equity Loan Trust Series ACE 2006-HE1 (related document(s) 159 Motion for Relief from Stay (150.00 fee)).(BOSCO, MARK) (Entered: 12/04/2009)",
      "document_number": "160",
      "pacer_doc_id": "sho0_doc.pl",
      "pacer_seq_no": null
    },
    {
      "date_entered": "2009-12-04",
      "date_filed": "2009-12-04",
      "description": "Notice of Appearance filed by MARK 1 BOSCO of TIFFANY & BOSCO, P.A. on behalf of HSBC Bank USA, National Association, as Trustee for Home Equity Loan Trust Series ACE 2006-HE1.(BOSCO, MARK) (Entered: 12/04/2009)",
      "document_number": "161",
      "pacer_doc_id": "sho0_doc.pl",
      "pacer_seq_no": null
    },
    {
      "date_entered": "2009-12-07",
      "date_filed": "2009-12-07",
      "description": "Receipt of Motion for Relief from Stay (150.00 fee)(2:08-bk-00381-SSC) [motion,185] ( 150.00) Filing Fee. Receipt number 10313948. Fee amount 150.00. (U.S. Treasury) (Entered: 12/07/2009)",
      "document_number": null,
      "pacer_doc_id": null,
      "pacer_seq_no": null
    },
    {
      "date_entered": "2009-12-14",
      "date_filed": "2009-12-14",
      "description": "Application for Compensation by Professional Employed by Trustee /First and Final Application for Compensation of Fees and Reimbursement of Costs by Counsel for the Trustee (For Noticing With Trustee's Final Report) for DAWN 3 BAYNE, Trustee's Attorney, Period: 2/8/2008 to 12/10/2009, Fees:$51.22, Expenses: $198.78. filed by DAWN 3 BAYNE (Attachments: # 1 Exhibit A# 2 Appendix Summary). (BAYNE, DAWN) (Entered: 12/14/2009)",
      "document_number": "162",
      "pacer_doc_id": "sho0_doc.pl",
      "pacer_seq_no": null
    },
    {
      "date_entered": "2009-12-29",
      "date_filed": "2009-12-29",
      "description": "Certificate of Service and No Objections filed by MARK 1 BOSCO of TIFFANY & BOSCO, P.A. on behalf of HSBC Bank USA, National Association, as Trustee for Home Equity Loan Trust Series ACE 2006-HE1. (related document(s) 159 Motion for Relief from Stay (150.00 fee)) (BOSCO, MARK) (Entered: 12/29/2009)",
      "document_number": "163",
      "pacer_doc_id": "sho0_doc.pl",
      "pacer_seq_no": null
    },
    {
      "date_entered": "2009-12-29",
      "date_filed": "2009-12-29",
      "description": "Notice of Lodging Proposed Order filed by MARK 1 BOSCO of TIFFANY & BOSCO, P.A. on behalf of HSBC Bank USA, National Association, as Trustee for Home Equity Loan Trust Series ACE 2006-HE1 (related document(s) 159 Motion for Relief from Stay (150.00 fee)).(BOSCO, MARK) (Entered: 12/29/2009)",
      "document_number": "164",
      "pacer_doc_id": "sho0_doc.pl",
      "pacer_seq_no": null
    },
    {
      "date_entered": "2010-01-05",
      "date_filed": "2010-01-04",
      "description": "ORDER Granting Motion for Relief from Stay (Related Doc # 159 ) signed on 1/4/2010 . (Taylor, Erika) (Entered: 01/05/2010)",
      "document_number": "165",
      "pacer_doc_id": "sho0_doc.pl",
      "pacer_seq_no": null
    },
    {
      "date_entered": "2010-01-07",
      "date_filed": "2010-01-05",
      "description": "BNC Certificate of Notice (related document(s) 165 Order on Motion for Relief from Stay) (Admin.) (Entered: 01/07/2010)",
      "document_number": "166",
      "pacer_doc_id": "sho0_doc.pl",
      "pacer_seq_no": null
    },
    {
      "date_entered": "2010-01-07",
      "date_filed": "2010-01-05",
      "description": "BNC Certificate of Notice - PDF Document (related document(s) 165 Order on Motion for Relief from Stay) (Admin.) (Entered: 01/07/2010)",
      "document_number": "167",
      "pacer_doc_id": "sho0_doc.pl",
      "pacer_seq_no": null
    }
  ],
  "docket_number": "2:08-bk-00381",
  "federal_defendant_number": null,
  "federal_dn_case_type": "bk",
  "federal_dn_judge_initials_assigned": "SSC",
  "federal_dn_judge_initials_referred": null,
  "federal_dn_office_code": "2",
  "jurisdiction": "",
  "jury_demand": "",
  "mdl_status": "",
  "nature_of_suit": "",
  "ordered_by": "date_filed",
  "parties": [
    {
      "attorneys": [
        {
          "contact": "PRO SE\n",
          "name": "GUILLERMO DE LA VARA",
          "roles": []
        },
        {
          "contact": "",
          "name": "",
          "roles": []
        }
      ],
      "date_terminated": null,
      "extra_info": "3946 EAST BECKER LANE\nPHOENIX, AZ 85028\nSSN / ITIN: xxx-xx-1057",
      "name": "GUILLERMO DE LA VARA",
      "type": "Debtor"
    },
    {
      "attorneys": [
        {
          "contact": "ALLEN, SALA & BAYNE, PLC\nVIAD CORPORATE CENTER\n1850 N. CENTRAL AVE., #1150\nPHOENIX, AZ 85004\n602-256-6000\nEmail: dbayne@asbazlaw.com\n",
          "name": "DAWN 3 BAYNE",
          "roles": []
        },
        {
          "contact": "ALLEN, SALA & BAYNE, PLC\nVIAD CORPORATE CENTER\n1850 N. CENTRAL AVE., #1150\nPHOENIX, AZ 85004\n602-256-6000\nFax : 602-252-4712\nEmail: dbayne@asbazlaw.com\n",
          "name": "DAWN 4 BAYNE",
          "roles": []
        },
        {
          "contact": "ALLEN, SALA & BAYNE, P.L.C.\nVIAD CORPORATE CENTER\n1850 N. CENTRAL AVE., #1150\nPHOENIX, AZ 85004\n602-256-6000\nFax : 602-252-4712\nEmail: dbayne@asbazlaw.com\n",
          "name": "DAWN M. BAYNE",
          "roles": []
        },
        {
          "contact": "ALLEN, SALA & BAYNE, PLC\nVIAD CORPORATE CENTER\n1850 N. CENTRAL AVE., #1150\nPHOENIX, AZ 85004\n602-256-6000\nFax : 602-252-4712\nEmail: tallen@asbazlaw.com\n",
          "name": "THOMAS H. ALLEN",
          "roles": []
        }
      ],
      "date_terminated": null,
      "extra_info": "PO BOX 5845\nCAREFREE, AZ 85377\n480-575-8250",
      "name": "JILL H. FORD",
      "type": "Trustee"
    },
    {
      "attorneys": [],
      "date_terminated": null,
      "extra_info": "OFFICE OF THE U.S. TRUSTEE\n230 NORTH FIRST AVENUE\nSUITE 204\nPHOENIX, AZ 85003",
      "name": "U.S. TRUSTEE",
      "type": "U.S. Trustee"
    }
  ],
  "referred_to_str": ""
}