{
  "assigned_to_str": "Randolph J. Haines", 
  "case_name": "PAMELA R. SCHMIDT", 
  "cause": null, 
  "court_id": "azb", 
  "date_converted": null, 
  "date_discharged": null, 
  "date_filed": "2008-10-27", 
  "date_terminated": null, 
  "demand": null, 
  "docket_entries": [
    {
      "date_filed": "2008-10-27", 
      "description": "Chapter 13 Voluntary Petition, Schedules and Statements (except for those listed below). The mailing list of creditors if not uploaded when the petition was filed, must be uploaded no later than 5 calendar days from the date of the filing of the petition. Failure to timely upload the list of creditors, may result in dismissal of the case without further notice. Electronic Filing Declaration due 11/17/2008, filed by MICHAEL REDDIG of REDDIG LAW OFFICE on behalf of PAMELA R. SCHMIDT (REDDIG, MICHAEL) (Entered: 10/27/2008)", 
      "document_number": "1", 
      "pacer_doc_id": "show_doc.pl"
    }, 
    {
      "date_filed": "2008-10-27", 
      "description": "Credit Counseling Certificate filed by MICHAEL REDDIG of REDDIG LAW OFFICE on behalf of PAMELA R. SCHMIDT. (REDDIG, MICHAEL) (Entered: 10/27/2008)", 
      "document_number": "2", 
      "pacer_doc_id": "show_doc.pl"
    }, 
    {
      "date_filed": "2008-10-27", 
      "description": "Declaration of Evidence of Employer Payments filed by MICHAEL REDDIG of REDDIG LAW OFFICE on behalf of PAMELA R. SCHMIDT. (REDDIG, MICHAEL) (Entered: 10/27/2008)", 
      "document_number": "3", 
      "pacer_doc_id": "show_doc.pl"
    }, 
    {
      "date_filed": "2008-10-27", 
      "description": "Meeting of Creditors scheduled for 12/16/2008 at 08:30 AM at Mohave County Judicial Facility, 2225 Trane, Bullhead City, AZ (BHC). (Admin, ) (Entered: 10/27/2008)", 
      "document_number": "4", 
      "pacer_doc_id": null
    }, 
    {
      "date_filed": "2008-10-28", 
      "description": "Notice of Meeting of Creditors and Notice of Chapter 13 Procedures. 341(a) meeting to be held on 12/16/2008 at 08:30 AM at U.S. District Court Building, 325 West 19th St., Yuma, AZ (YUMA) Complaints under Sections 727 or 523 due by 2/17/2009. Proof of Claims due by 3/16/2009, Government Proof of Claims due by 4/27/2009, (Manning, Jennifer) (Entered: 10/28/2008)", 
      "document_number": "5", 
      "pacer_doc_id": "show_doc.pl"
    }, 
    {
      "date_filed": "2008-10-28", 
      "description": "Deficiency Notice to Debtor and Attorney for Debtor That All Required Documents Were Not Filed. (Manning, Jennifer) (Entered: 10/28/2008)", 
      "document_number": "6", 
      "pacer_doc_id": "show_doc.pl"
    }, 
    {
      "date_filed": "2008-10-28", 
      "description": "BNC Certificate of Notice - Notice of Meeting of Creditors (related document(s) 5 BNC Form Request--341 Notice--Chapter 13) (Admin.) (Entered: 10/30/2008)", 
      "document_number": "8", 
      "pacer_doc_id": "show_doc.pl"
    }, 
    {
      "date_filed": "2008-10-28", 
      "description": "BNC Certificate of Notice (related document(s) 6 Deficiency Notice to Debtor (Missing Documents Form)) (Admin.) (Entered: 10/30/2008)", 
      "document_number": "9", 
      "pacer_doc_id": "show_doc.pl"
    }, 
    {
      "date_filed": "2008-10-29", 
      "description": "Chapter 13 Plan and Application for Payment of Administrative Expense and Notice of Date to File Objection filed by MICHAEL REDDIG of REDDIG LAW OFFICE on behalf of PAMELA R. SCHMIDT.(REDDIG, MICHAEL) (Entered: 10/29/2008)", 
      "document_number": "7", 
      "pacer_doc_id": "show_doc.pl"
    }, 
    {
      "date_filed": "2008-10-29", 
      "description": "Debtor Declaration Re: Electronic Filing (Manning, Jennifer) (Entered: 10/31/2008)", 
      "document_number": "10", 
      "pacer_doc_id": "show_doc.pl"
    }, 
    {
      "date_filed": "2008-10-29", 
      "description": "Statement of Social Security Number Submitted (Manning, Jennifer) (Entered: 10/31/2008)", 
      "document_number": "11", 
      "pacer_doc_id": "show_doc.pl"
    }, 
    {
      "date_filed": "2008-10-29", 
      "description": "BNC Certificate of Notice (related document(s) 7 Chapter 13 Plan and Application for Payment of Administrative Expense and Notice of Date to File Objection) (Admin.) (Entered: 10/31/2008)", 
      "document_number": "12", 
      "pacer_doc_id": "show_doc.pl"
    }, 
    {
      "date_filed": "2008-10-29", 
      "description": "BNC Certificate of Notice - PDF Document (related document(s) 7 Chapter 13 Plan and Application for Payment of Administrative Expense and Notice of Date to File Objection) (Admin.) (Entered: 10/31/2008)", 
      "document_number": "13", 
      "pacer_doc_id": "show_doc.pl"
    }, 
    {
      "date_filed": "2008-11-13", 
      "description": "Notice of Appearance filed by MARK 7 BOSCO of TIFFANY & BOSCO on behalf of Wells Fargo Bank, N.A. C/O Mark S. Bosco..(BOSCO, MARK) (Entered: 11/13/2008)", 
      "document_number": "14", 
      "pacer_doc_id": "show_doc.pl"
    }, 
    {
      "date_filed": "2008-11-14", 
      "description": "Objection filed by MARK 7 BOSCO of TIFFANY & BOSCO on behalf of Wells Fargo Bank, N.A. C/O Mark S. Bosco. (related document(s) 7 Chapter 13 Plan and Application for Payment of Administrative Expense and Notice of Date to File Objection) (Attachments: # 1 Exhibit). (BOSCO, MARK) (Entered: 11/14/2008)", 
      "document_number": "15", 
      "pacer_doc_id": "show_doc.pl"
    }, 
    {
      "date_filed": "2008-11-17", 
      "description": "Amended Chapter 13 Plan and Notice of Date to File Objection filed by MICHAEL REDDIG of REDDIG LAW OFFICE on behalf of PAMELA R. SCHMIDT.(REDDIG, MICHAEL) (Entered: 11/17/2008)", 
      "document_number": "16", 
      "pacer_doc_id": "show_doc.pl"
    }, 
    {
      "date_filed": "2008-11-17", 
      "description": "BNC Certificate of Notice (related document(s) 16 Amended Chapter 13 Plan and Notice of Date to File Objection) (Admin.) (Entered: 11/20/2008)", 
      "document_number": "17", 
      "pacer_doc_id": "show_doc.pl"
    }, 
    {
      "date_filed": "2008-11-17", 
      "description": "BNC Certificate of Notice - PDF Document (related document(s) 16 Amended Chapter 13 Plan and Notice of Date to File Objection) (Admin.) (Entered: 11/20/2008)", 
      "document_number": "18", 
      "pacer_doc_id": "show_doc.pl"
    }, 
    {
      "date_filed": "2008-11-25", 
      "description": "Trustee Notice of Rescheduled Meeting of Creditors and Certificate of Mailing, Continuance of Meeting of Creditors filed by SCOTT A. LIESKE of RUSSELL A. BROWN, CHAPTER 13 TRUSTEE on behalf of RUSSELL BROWN 341(a) meeting to be held on 1/27/2009 at 08:30 AM at Mohave County Judicial Facility, 2225 Trane, Bullhead City, AZ (BHC).(LIESKE, SCOTT) (Entered: 11/25/2008)", 
      "document_number": "19", 
      "pacer_doc_id": "show_doc.pl"
    }, 
    {
      "date_filed": "2009-01-28", 
      "description": "Amended Statement of Financial Affairs filed by MICHAEL REDDIG of REDDIG LAW OFFICE on behalf of PAMELA R. SCHMIDT. Electronic Filing Declaration due by 02/2/2009, (REDDIG, MICHAEL) (Entered: 01/28/2009)", 
      "document_number": "20", 
      "pacer_doc_id": "show_doc.pl"
    }, 
    {
      "date_filed": "2009-02-11", 
      "description": "Motion for Relief from Stay (150.00 fee) RE: Real property at 9459 W. Bonanza Ave. Dolan Springs, AZ 86441 filed by MARK 2 BOSCO of TIFFANY & BOSCO, P.A. on behalf of Wells Fargo Bank, N.A. C/O Mark S. Bosco. (Attachments: # 1 Exhibit a# (2) Exhibit b). (BOSCO, MARK) (Entered: 02/11/2009)", 
      "document_number": "21", 
      "pacer_doc_id": "show_doc.pl"
    }, 
    {
      "date_filed": "2009-02-11", 
      "description": "Notice of Motion for Relief from Stay filed by MARK 2 BOSCO of TIFFANY & BOSCO, P.A. on behalf of Wells Fargo Bank, N.A. C/O Mark S. Bosco. (related document(s) 21 Motion for Relief from Stay (150.00 fee)).(BOSCO, MARK) (Entered: 02/11/2009)", 
      "document_number": "22", 
      "pacer_doc_id": "show_doc.pl"
    }, 
    {
      "date_filed": "2009-02-19", 
      "description": "Objection to Motion/Application to Lift of Stay on Homestead (related to motions(s) 21 ) filed by MICHAEL REDDIG of REDDIG LAW OFFICE on behalf of PAMELA R. SCHMIDT (related document(s) 21 motion Motion for Relief from Stay (150.00 fee)). (REDDIG, MICHAEL) (Entered: 02/19/2009)", 
      "document_number": "23", 
      "pacer_doc_id": "show_doc.pl"
    }, 
    {
      "date_filed": "2009-02-25", 
      "description": "Trustee Objection to Exempt Property filed by SCOTT A. LIESKE of RUSSELL A. BROWN, CHAPTER 13 TRUSTEE on behalf of RUSSELL BROWN (related document(s) 1 Voluntary Petition (Chapter 13)).(LIESKE, SCOTT) (Entered: 02/25/2009)", 
      "document_number": "24", 
      "pacer_doc_id": "show_doc.pl"
    }, 
    {
      "date_filed": "2009-02-25", 
      "description": "Notice of Bar Date, Certificate of Service filed by SCOTT A. LIESKE of RUSSELL A. BROWN, CHAPTER 13 TRUSTEE on behalf of RUSSELL BROWN (related document(s) 24 Trustee Objection to Exempt Property) Objections/Responses due by 3/17/2009,.(LIESKE, SCOTT) (Entered: 02/25/2009)", 
      "document_number": "25", 
      "pacer_doc_id": "show_doc.pl"
    }, 
    {
      "date_filed": "2009-03-13", 
      "description": "Response to Trustee's Objection to Claims of Property as Exempt filed by MICHAEL REDDIG of REDDIG LAW OFFICE on behalf of PAMELA R. SCHMIDT (related document(s) 24 Trustee Objection to Exempt Property). (REDDIG, MICHAEL) (Entered: 03/13/2009)", 
      "document_number": "26", 
      "pacer_doc_id": "show_doc.pl"
    }, 
    {
      "date_filed": "2009-03-18", 
      "description": "Notice of Hearing on Trustee's Objection to Claims of Property as Exempt filed by SCOTT A. LIESKE of RUSSELL A. BROWN, CHAPTER 13 TRUSTEE on behalf of RUSSELL BROWN (related document(s) 24 Trustee Objection to Exempt Property, 26 Response) Hearing set for 5/7/2009 at 01:30 PM at Mohave County Superior Court, 2225 Trane, Courtroom R, Bullhead City, AZ (BHC) Objections/Responses due by 4/30/2009,.(LIESKE, SCOTT) (Entered: 03/18/2009)", 
      "document_number": "27", 
      "pacer_doc_id": "show_doc.pl"
    }, 
    {
      "date_filed": "2009-03-23", 
      "description": "Notice of Preliminary Hearing Re: Motion for Relief (#21) filed by MARK 1 BOSCO of TIFFANY & BOSCO, P.A. on behalf of Wells Fargo Bank, N.A. C/O Mark S. Bosco. (related document(s) 21 Motion for Relief from Stay (150.00 fee)) Preliminary Hearing set for 4/6/2009 at 11:00 AM at 230 N. First Ave., 6th Floor, Courtroom 603, Phoenix, AZ (RJH ) (Attachments: # 1 Exhibit (A) Procedures in Stay Relief Matters).(BOSCO, MARK) (Entered: 03/23/2009)", 
      "document_number": "28", 
      "pacer_doc_id": "show_doc.pl"
    }, 
    {
      "date_filed": "2009-03-23", 
      "description": "Certificate of Mailing Re: Notice of Preliminary Hearing (#28) filed by MARK 1 BOSCO of TIFFANY & BOSCO, P.A. on behalf of Wells Fargo Bank, N.A. C/O Mark S. Bosco.. (related document(s) 28 Notice of Preliminary Hearing) (BOSCO, MARK) (Entered: 03/23/2009)", 
      "document_number": "29", 
      "pacer_doc_id": "show_doc.pl"
    }, 
    {
      "date_filed": "2009-04-06", 
      "description": "Minutes of Hearing held on: 04/06/2009 Subject: PRELIMINARY HEARING ON MOTION FOR RELIEF FROM STAY RE: REAL PROPERTY AT 9459 W. BONANZA AVE. DOLAN SPRINGS, AZ 86441 FILED BY WELLS FARGO BANK. (vCal Hearing ID (1145831)). (related document(s) 21 ) Preliminary Hearing set for 05/04/2009 at 11:00 AM at 230 N. First Ave., 6th Floor, Courtroom 603, Phoenix, AZ (RJH ) (Smith, Janet) (Entered: 04/06/2009)", 
      "document_number": "30", 
      "pacer_doc_id": "show_doc.pl"
    }, 
    {
      "date_filed": "2009-05-04", 
      "description": "Minutes of Hearing held on: 05/04/2009 Subject: PRELIMINARY HEARING ON MOTION FOR RELIEF FROM STAY RE: REAL PROPERTY AT 9459 W. BONANZA AVE. DOLAN SPRINGS, AZ 86441 FILED BY WELLS FARGO BANK. (vCal Hearing ID (1146011)). (related document(s) 21 ) Preliminary Hearing set for 06/09/2009 at 11:00 AM at 230 N. First Ave., 6th Floor, Courtroom 603, Phoenix, AZ (RJH ) (Smith, Janet) (Entered: 05/05/2009)", 
      "document_number": "31", 
      "pacer_doc_id": "show_doc.pl"
    }, 
    {
      "date_filed": "2009-05-07", 
      "description": "ORDER, Minute Entry Sustaining Trustee's Objection signed on 5/7/2009 (related document(s) 24 Trustee Objection to Exempt Property) . (Richard, Trudy) (Entered: 05/08/2009)", 
      "document_number": "32", 
      "pacer_doc_id": "show_doc.pl"
    }, 
    {
      "date_filed": "2009-05-11", 
      "description": "Chapter 13 Trustee Notice of Submitting Proposed Dismissal Order filed by RUSSELL 13 BROWN on behalf of RUSSELL BROWN.(BROWN, RUSSELL 13) (Entered: 05/11/2009)", 
      "document_number": "33", 
      "pacer_doc_id": "show_doc.pl"
    }, 
    {
      "date_filed": "2009-05-20", 
      "description": "Withdrawal of Claim 2 filed by ERLINDA BERNICE HEAD of ARIZONA DEPARTMENT OF REVENUE on behalf of ARIZONA DEPARTMENT OF REVENUE. (HEAD, ERLINDA) (Entered: 05/20/2009)", 
      "document_number": "34", 
      "pacer_doc_id": "show_doc.pl"
    }, 
    {
      "date_filed": "2009-05-26", 
      "description": "ORDER Dismissing Case Debtor signed on 5/26/2009 (related document(s) 33 Chapter 13 Trustee Notice of Submitting Order) . (Richard, Trudy) (Entered: 05/27/2009)", 
      "document_number": "35", 
      "pacer_doc_id": "show_doc.pl"
    }, 
    {
      "date_filed": "2009-05-27", 
      "description": "BNC Certificate of Notice - PDF Document (related document(s) 35 Order Dismissing Case) (Admin.) (Entered: 05/29/2009)", 
      "document_number": "38", 
      "pacer_doc_id": "show_doc.pl"
    }, 
    {
      "date_filed": "2009-05-29", 
      "description": "Motion to Reinstate Case filed by MICHAEL REDDIG of REDDIG LAW OFFICE on behalf of PAMELA R. SCHMIDT (related document(s) 35 Order Dismissing Case). (REDDIG, MICHAEL) (Entered: 05/29/2009)", 
      "document_number": "36", 
      "pacer_doc_id": "show_doc.pl"
    }, 
    {
      "date_filed": "2009-05-29", 
      "description": "Notice of Lodging Proposed Order Reinstating Case filed by MICHAEL REDDIG of REDDIG LAW OFFICE on behalf of PAMELA R. SCHMIDT (related document(s) 36 Motion to Reinstate Case).(REDDIG, MICHAEL) (Entered: 05/29/2009)", 
      "document_number": "37", 
      "pacer_doc_id": "show_doc.pl"
    }, 
    {
      "date_filed": "2009-06-09", 
      "description": "Minutes of Hearing held on: 06/09/2009 Subject: PRELIMINARY HEARING ON MOTION FOR RELIEF FROM STAY RE: REAL PROPERTY AT 9459 W. BONANZA AVE. DOLAN SPRINGS, AZ 86441 FILED BY WELLS FARGO BANK. (vCal Hearing ID (1147390)). (related document(s) 21 ) (Smith, Janet) (Entered: 06/09/2009)", 
      "document_number": "39", 
      "pacer_doc_id": "show_doc.pl"
    }, 
    {
      "date_filed": "2009-06-09", 
      "description": "Notice of Lodging Proposed Order Stipulated Reinstatement Order filed by MICHAEL REDDIG of REDDIG LAW OFFICE on behalf of PAMELA R. SCHMIDT (related document(s) 35 Order Dismissing Case) (Attachments: # 1 Exhibit order).(REDDIG, MICHAEL) (Entered: 06/09/2009)", 
      "document_number": "40", 
      "pacer_doc_id": "show_doc.pl"
    }, 
    {
      "date_filed": "2009-06-09", 
      "description": "ORDER Reinstating Case Debtor signed on 6/9/2009 . (Manning, Jennifer) (Entered: 06/10/2009)", 
      "document_number": "41", 
      "pacer_doc_id": "show_doc.pl"
    }, 
    {
      "date_filed": "2009-06-10", 
      "description": "BNC Certificate of Notice - PDF Document (related document(s) 41 Order Reinstating Case) (Admin.) (Entered: 06/12/2009)", 
      "document_number": "42", 
      "pacer_doc_id": "show_doc.pl"
    }, 
    {
      "date_filed": "2009-06-30", 
      "description": "Notice of Preliminary Hearing Re: Motion for Relief (#21) filed by MARK 1 BOSCO of TIFFANY & BOSCO, P.A. on behalf of Wells Fargo Bank, N.A. C/O Mark S. Bosco. (related document(s) 21 Motion for Relief from Stay (150.00 fee)) Preliminary Hearing set for 7/13/2009 at 10:00 AM at 230 N. First Ave., 6th Floor, Courtroom 603, Phoenix, AZ (RJH ) (Attachments: # 1 Exhibit (a) Procedures in Stay Relief Matters).(BOSCO, MARK) (Entered: 06/30/2009)", 
      "document_number": "43", 
      "pacer_doc_id": "show_doc.pl"
    }, 
    {
      "date_filed": "2009-06-30", 
      "description": "Certificate of Mailing Re: Notice of Preliminary Hearing (#43) filed by MARK 1 BOSCO of TIFFANY & BOSCO, P.A. on behalf of Wells Fargo Bank, N.A. C/O Mark S. Bosco.. (related document(s) 43 Notice of Preliminary Hearing) (BOSCO, MARK) (Entered: 06/30/2009)", 
      "document_number": "44", 
      "pacer_doc_id": "show_doc.pl"
    }, 
    {
      "date_filed": "2009-07-08", 
      "description": "Amended Notice of Preliminary Hearing Re: Motion for Relief (#21) filed by MARK 1 BOSCO of TIFFANY & BOSCO, P.A. on behalf of Wells Fargo Bank, N.A. C/O Mark S. Bosco. (related document(s) 21 Motion for Relief from Stay (150.00 fee)) Preliminary Hearing set for 7/13/2009 at 11:00 AM at 230 N. First Ave., 7th Floor, Courtroom 703, Phoenix, AZ (RTB).(BOSCO, MARK) (Entered: 07/08/2009)", 
      "document_number": "45", 
      "pacer_doc_id": "show_doc.pl"
    }, 
    {
      "date_filed": "2009-07-08", 
      "description": "Certificate of Mailing Re: Amended Notice of Preliminary Hearing (#45) filed by MARK 1 BOSCO of TIFFANY & BOSCO, P.A. on behalf of Wells Fargo Bank, N.A. C/O Mark S. Bosco.. (related document(s) 45 Notice of Preliminary Hearing) (BOSCO, MARK) (Entered: 07/08/2009)", 
      "document_number": "46", 
      "pacer_doc_id": "show_doc.pl"
    }, 
    {
      "date_filed": "2009-07-09", 
      "description": "Trustee Plan Recommendation. (BROWN, RUSSELL 3) (Entered: 07/09/2009)", 
      "document_number": "47", 
      "pacer_doc_id": "show_doc.pl"
    }, 
    {
      "date_filed": "2009-07-13", 
      "description": "Minutes of Hearing held on: 07/13/2009 Subject: PRELIMINARY HEARING ON MOTION FOR RELIEF FROM STAY FILED BY WELLS FARGO BANK. (vCal Hearing ID (1150051)). (related document(s) 21 ) Preliminary Hearing set for 08/10/2009 at 11:00 AM at 230 N. First Ave., 6th Floor, Courtroom 603, Phoenix, AZ (RJH ) (Smith, Janet) (Entered: 07/13/2009)", 
      "document_number": "48", 
      "pacer_doc_id": "show_doc.pl"
    }, 
    {
      "date_filed": "2009-08-10", 
      "description": "Minutes of Hearing held on: 08/10/2009 Subject: PRELIMINARY HEARING ON MOTION FOR RELIEF FROM STAY FILED BY WELLS FARGO BANK. (vCal Hearing ID (1150719)). (related document(s) 21 ) (Smith, Janet) (Entered: 08/10/2009)", 
      "document_number": "49", 
      "pacer_doc_id": "show_doc.pl"
    }, 
    {
      "date_filed": "2009-09-16", 
      "description": "Stipulation Regarding Motion For Relief filed by MARK 6 BOSCO of TIFFANY & BOSCO on behalf of Wells Fargo Bank, N.A. C/O Mark S. Bosco.. (related document(s) 21 Motion for Relief from Stay (150.00 fee)) (BOSCO, MARK) (Entered: 09/16/2009)", 
      "document_number": "50", 
      "pacer_doc_id": "show_doc.pl"
    }, 
    {
      "date_filed": "2009-09-16", 
      "description": "Notice of Lodging Proposed Order Approving Stipulation Regarding Motion For Relief filed by MARK 6 BOSCO of TIFFANY & BOSCO on behalf of Wells Fargo Bank, N.A. C/O Mark S. Bosco. (related document(s) 21 Motion for Relief from Stay (150.00 fee), 50 Stipulation) (Attachments: # 1 Exhibit (A) Order Approving Stipulation Regarding Motion For Relief).(BOSCO, MARK) (Entered: 09/16/2009)", 
      "document_number": "51", 
      "pacer_doc_id": "show_doc.pl"
    }, 
    {
      "date_filed": "2009-09-16", 
      "description": "ORDER Granting Motion for Relief from Stay (Related Doc # 21 ) signed on 9/16/2009 . (Manning, Jennifer) (Entered: 09/17/2009)", 
      "document_number": "52", 
      "pacer_doc_id": "show_doc.pl"
    }, 
    {
      "date_filed": "2009-09-17", 
      "description": "BNC Certificate of Notice (related document(s) 52 Order on Motion for Relief from Stay) (Admin.) (Entered: 09/19/2009)", 
      "document_number": "53", 
      "pacer_doc_id": "show_doc.pl"
    }, 
    {
      "date_filed": "2009-09-17", 
      "description": "BNC Certificate of Notice - PDF Document (related document(s) 52 Order on Motion for Relief from Stay) (Admin.) (Entered: 09/19/2009)", 
      "document_number": "54", 
      "pacer_doc_id": "show_doc.pl"
    }, 
    {
      "date_filed": "2009-12-23", 
      "description": "Notice of Default Re: Real Property, 9459 W Bonanza Avenue, Dolan Springs, AZ 86441 filed by MARK 1 BOSCO of TIFFANY & BOSCO, P.A. on behalf of Wells Fargo Bank, N.A. C/O Mark S. Bosco. (Attachments: # 1 Exhibit \"A\").(BOSCO, MARK) (Entered: 12/23/2009)", 
      "document_number": "55", 
      "pacer_doc_id": "show_doc.pl"
    }, 
    {
      "date_filed": "2009-12-23", 
      "description": "Affidavit of Mailing filed by MARK 4 BOSCO of TIFFANY & BOSCO, P.A. on behalf of Wells Fargo Bank, N.A. C/O Mark S. Bosco.. (related document(s) 55 Notice of Default) (BOSCO, MARK) (Entered: 12/23/2009)", 
      "document_number": "56", 
      "pacer_doc_id": "show_doc.pl"
    }, 
    {
      "date_filed": "2010-01-08", 
      "description": "Objection to Untrue Notice of Default/Controverting Certificate of Payments Made filed by MICHAEL REDDIG of REDDIG LAW OFFICE on behalf of PAMELA R. SCHMIDT (related document(s) 55 Notice of Default). (REDDIG, MICHAEL) (Entered: 01/08/2010)", 
      "document_number": "57", 
      "pacer_doc_id": "show_doc.pl"
    }, 
    {
      "date_filed": "2010-01-11", 
      "description": "Amended Notice of Default Re: Real Property, 9459 W Bonanza Avenue,Dolan Springs, AZ 86441 filed by MARK 1 BOSCO of TIFFANY & BOSCO, P.A. on behalf of Wells Fargo Bank, N.A. C/O Mark S. Bosco. (related document(s) 55 Notice of Default).(BOSCO, MARK) (Entered: 01/11/2010)", 
      "document_number": "58", 
      "pacer_doc_id": "show_doc.pl"
    }, 
    {
      "date_filed": "2010-01-11", 
      "description": "Affidavit of Mailing Re: Real property,9459 W Bonanza Avenue,Dolan Springs, AZ 86441 filed by MARK 1 BOSCO of TIFFANY & BOSCO, P.A. on behalf of Wells Fargo Bank, N.A. C/O Mark S. Bosco.. (related document(s) 58 Notice of Default) (BOSCO, MARK) (Entered: 01/11/2010)", 
      "document_number": "59", 
      "pacer_doc_id": "show_doc.pl"
    }, 
    {
      "date_filed": "2010-01-11", 
      "description": "Exhibit \"A\" filed by MARK 1 BOSCO of TIFFANY & BOSCO, P.A. on behalf of Wells Fargo Bank, N.A. C/O Mark S. Bosco.. (related document(s) 58 Notice of Default) (BOSCO, MARK) (Entered: 01/11/2010)", 
      "document_number": "60", 
      "pacer_doc_id": "show_doc.pl"
    }, 
    {
      "date_filed": "2010-01-22", 
      "description": "Objection to Notice of Default filed by MICHAEL REDDIG of REDDIG LAW OFFICE on behalf of PAMELA R. SCHMIDT (related document(s) 58 Notice of Default). (REDDIG, MICHAEL) (Entered: 01/22/2010)", 
      "document_number": "61", 
      "pacer_doc_id": "show_doc.pl"
    }
  ], 
  "docket_number": "0:08-bk-15042", 
  "jurisdiction": null, 
  "jury_demand": null, 
  "nature_of_suit": null, 
  "parties": [
    {
      "attorneys": [
        {
          "contact": "REDDIG LAW OFFICE\nPO BOX 22143\nFLAGSTAFF, AZ 86002\n928-774-9544\nFax : 928-774-2043\nEmail: reddiglaw@gmail.com\n", 
          "name": "MICHAEL REDDIG", 
          "roles": []
        }
      ], 
      "extra_info": "9459 W. BONANZA  AVENUE\nWILLOW BEACH, AZ 86445\nSSN / ITIN: xxx-xx-9274", 
      "name": "PAMELA R. SCHMIDT", 
      "type": "Debtor"
    }, 
    {
      "attorneys": [], 
      "extra_info": "CHAPTER 13 TRUSTEE\nSUITE 800\n3838 NORTH CENTRAL AVENUE\nPHOENIX, AZ 85012-1965\n602-277-8996", 
      "name": "RUSSELL BROWN", 
      "type": "Trustee"
    }, 
    {
      "attorneys": [], 
      "extra_info": "OFFICE OF THE U.S. TRUSTEE\n230 NORTH FIRST AVENUE\nSUITE 204\nPHOENIX, AZ 85003", 
      "name": "U.S. TRUSTEE", 
      "type": "U.S. Trustee"
    }
  ], 
  "referred_to_str": null
}