{
  "assigned_to_str": "George B. Nielsen Jr.", 
  "case_name": "JOEL H JARAMILLO", 
  "cause": null, 
  "court_id": "azb", 
  "date_converted": null, 
  "date_discharged": null, 
  "date_filed": "2008-11-18", 
  "date_terminated": null, 
  "demand": null, 
  "docket_entries": [
    {
      "date_filed": "2008-11-18", 
      "description": "Chapter 7 Voluntary Petition, Schedules and Statements (except for those listed below). The mailing list of creditors if not uploaded when the petition was filed, must be uploaded no later than 5 calendar days from the date of the filing of the petition. Failure to timely upload the list of creditors, may result in dismissal of the case without further notice. Electronic Filing Declaration due 12/8/2008, filed by MATTHEW 2 FOLEY of PHILLIPS & ASSOCIATES on behalf of JOEL H JARAMILLO, MARIA JARAMILLO (FOLEY, MATTHEW) (Entered: 11/18/2008)", 
      "document_number": "1", 
      "pacer_doc_id": "show_doc.pl"
    }, 
    {
      "date_filed": "2008-11-18", 
      "description": "Credit Counseling Certificate filed by MATTHEW 2 FOLEY of PHILLIPS & ASSOCIATES on behalf of JOEL H JARAMILLO, MARIA JARAMILLO. (FOLEY, MATTHEW) (Entered: 11/18/2008)", 
      "document_number": "2", 
      "pacer_doc_id": "show_doc.pl"
    }, 
    {
      "date_filed": "2008-11-18", 
      "description": "Declaration of Evidence of Employer Payments filed by MATTHEW 2 FOLEY of PHILLIPS & ASSOCIATES on behalf of JOEL H JARAMILLO, MARIA JARAMILLO. (FOLEY, MATTHEW) (Entered: 11/18/2008)", 
      "document_number": "3", 
      "pacer_doc_id": "show_doc.pl"
    }, 
    {
      "date_filed": "2008-11-18", 
      "description": "Meeting of Creditors scheduled for 12/23/2008 at 09:30 AM at US Trustee Meeting Room, 230 N. First Avenue, Suite 102, Phoenix, AZ (341-PHX). (FOLEY, MATTHEW) (Entered: 11/18/2008)", 
      "document_number": "4", 
      "pacer_doc_id": null
    }, 
    {
      "date_filed": "2008-11-21", 
      "description": "Debtor Declaration Re: Electronic Filing (Frazier, Liz) (Entered: 11/24/2008)", 
      "document_number": "6", 
      "pacer_doc_id": "show_doc.pl"
    }, 
    {
      "date_filed": "2008-11-24", 
      "description": "Chapter 7 Indiv/Joint--Notice of Meeting of Creditors. 341(a) meeting to be held on 12/23/2008 at 09:30 AM at US Trustee Meeting Room, 230 N. First Avenue, Suite 102, Phoenix, AZ (341-PHX) Complaints under Sections 727 or 523 due by 2/23/2009. (Frazier, Liz) (Entered: 11/24/2008)", 
      "document_number": "5", 
      "pacer_doc_id": "show_doc.pl"
    }, 
    {
      "date_filed": "2008-11-24", 
      "description": "BNC Certificate of Notice - Notice of Meeting of Creditors (related document(s) 5 BNC Form Request--341 Notice--Chapter 7 Indiv/Joint) (Admin.) (Entered: 11/27/2008)", 
      "document_number": "7", 
      "pacer_doc_id": "show_doc.pl"
    }, 
    {
      "date_filed": "2008-12-16", 
      "description": "Amendment to Schedules (A,B,C,G,H,I,J) B filed by ERIC R. THIEROFF of PHILLIPS & ASSOCIATES on behalf of JOEL H JARAMILLO, MARIA JARAMILLO. (THIEROFF, ERIC) (Entered: 12/16/2008)", 
      "document_number": "8", 
      "pacer_doc_id": "show_doc.pl"
    }, 
    {
      "date_filed": "2008-12-17", 
      "description": "Motion for Relief from Stay (150.00 fee) re: 2007 Chevrolet Avalanche filed by PATRICIA 1 DOYLE-KOSSICK of PATRICIA DOYLE-KOSSICK, PLC on behalf of TRUWEST CREDIT UNION (Attachments: # 1 Exhibit A-C). (DOYLE-KOSSICK, PATRICIA) (Entered: 12/17/2008)", 
      "document_number": "9", 
      "pacer_doc_id": "show_doc.pl"
    }, 
    {
      "date_filed": "2008-12-17", 
      "description": "Notice of Motion for Relief from Stay filed by PATRICIA 1 DOYLE-KOSSICK of PATRICIA DOYLE-KOSSICK, PLC on behalf of TRUWEST CREDIT UNION (related document(s) 9 Motion for Relief from Stay (150.00 fee)).(DOYLE-KOSSICK, PATRICIA) (Entered: 12/17/2008)", 
      "document_number": "10", 
      "pacer_doc_id": "show_doc.pl"
    }, 
    {
      "date_filed": "2009-01-06", 
      "description": "Certificate of Service and No Objections filed by PATRICIA 1 DOYLE-KOSSICK of PATRICIA DOYLE-KOSSICK, PLC on behalf of TRUWEST CREDIT UNION. (related document(s) 9 Motion for Relief from Stay (150.00 fee)) (DOYLE-KOSSICK, PATRICIA) (Entered: 01/06/2009)", 
      "document_number": "11", 
      "pacer_doc_id": "show_doc.pl"
    }, 
    {
      "date_filed": "2009-01-06", 
      "description": "Notice of Lodging Proposed Order filed by PATRICIA 1 DOYLE-KOSSICK of PATRICIA DOYLE-KOSSICK, PLC on behalf of TRUWEST CREDIT UNION (related document(s) 9 Motion for Relief from Stay (150.00 fee)) (Attachments: # 1 Order).(DOYLE-KOSSICK, PATRICIA) (Entered: 01/06/2009)", 
      "document_number": "12", 
      "pacer_doc_id": "show_doc.pl"
    }, 
    {
      "date_filed": "2009-01-09", 
      "description": "The Trustee reports that he or she now holds funds of this bankruptcy estate or expects to receive funds which should result in a dividend to creditors who were previously instructed not to file claims. The Trustee hereby requests that the Court fix the last date for filing proofs of claim and that notice be given to creditors.. (MANERA, WILLIAM) (Entered: 01/09/2009)", 
      "document_number": "13", 
      "pacer_doc_id": null
    }, 
    {
      "date_filed": "2009-01-09", 
      "description": "ORDER Granting Motion for Relief from Stay (Related Doc # 9 ) signed on 1/9/2009 . (Frazier, Liz) (Entered: 01/12/2009)", 
      "document_number": "14", 
      "pacer_doc_id": "show_doc.pl"
    }, 
    {
      "date_filed": "2009-01-12", 
      "description": "BNC Certificate of Notice (related document(s) 14 Order on Motion for Relief from Stay) (Admin.) (Entered: 01/15/2009)", 
      "document_number": "16", 
      "pacer_doc_id": "show_doc.pl"
    }, 
    {
      "date_filed": "2009-01-12", 
      "description": "BNC Certificate of Notice - PDF Document (related document(s) 14 Order on Motion for Relief from Stay) (Admin.) (Entered: 01/15/2009)", 
      "document_number": "17", 
      "pacer_doc_id": "show_doc.pl"
    }, 
    {
      "date_filed": "2009-01-14", 
      "description": "Notice of Claims Bar Date. Proof of Claims due by 4/16/2009, (Frazier, Liz) (Entered: 01/14/2009)", 
      "document_number": "15", 
      "pacer_doc_id": "show_doc.pl"
    }, 
    {
      "date_filed": "2009-01-14", 
      "description": "BNC Certificate of Notice - Notice of Claims Bar Date (related document(s) 15 BNC Form Request--Notice of Claims Bar Date) (Admin.) (Entered: 01/17/2009)", 
      "document_number": "18", 
      "pacer_doc_id": "show_doc.pl"
    }, 
    {
      "date_filed": "2009-03-26", 
      "description": "Trustee Notice of Sale filed by S. WILLIAM MANERA on behalf of S. WILLIAM MANERA Objections/Responses due by 4/17/2009,.(MANERA, S.) (Entered: 03/26/2009)", 
      "document_number": "19", 
      "pacer_doc_id": "show_doc.pl"
    }, 
    {
      "date_filed": "2009-03-26", 
      "description": "BNC Certificate of Notice - PDF Document (related document(s) 19 Trustee Notice of Sale) (Admin.) (Entered: 03/28/2009)", 
      "document_number": "20", 
      "pacer_doc_id": "show_doc.pl"
    }, 
    {
      "date_filed": "2009-05-04", 
      "description": "Trustee Report of Sale filed by S. WILLIAM MANERA on behalf of S. WILLIAM MANERA.(MANERA, S.) (Entered: 05/04/2009)", 
      "document_number": "21", 
      "pacer_doc_id": "show_doc.pl"
    }, 
    {
      "date_filed": "2009-06-01", 
      "description": "Financial Management Course Certificate filed by ROBERT 1 TEAGUE of PHILLIPS & ASSOCIATES on behalf of JOEL H JARAMILLO. (TEAGUE, ROBERT) (Entered: 06/01/2009)", 
      "document_number": "22", 
      "pacer_doc_id": "show_doc.pl"
    }, 
    {
      "date_filed": "2009-06-01", 
      "description": "Financial Management Course Certificate filed by ROBERT 1 TEAGUE of PHILLIPS & ASSOCIATES on behalf of MARIA JARAMILLO. (TEAGUE, ROBERT) (Entered: 06/01/2009)", 
      "document_number": "23", 
      "pacer_doc_id": "show_doc.pl"
    }, 
    {
      "date_filed": "2009-06-02", 
      "description": "Chapter 7 Discharge. (Admin.) (Entered: 06/02/2009)", 
      "document_number": "24", 
      "pacer_doc_id": "show_doc.pl"
    }, 
    {
      "date_filed": "2009-06-02", 
      "description": "BNC Certificate of Notice - Discharge of Debtor (related document(s) 24 BNC Form Request--Chapter 7 Discharge) (Admin.) (Entered: 06/04/2009)", 
      "document_number": "25", 
      "pacer_doc_id": "show_doc.pl"
    }, 
    {
      "date_filed": "2009-07-08", 
      "description": "Trustee Objection to Claim 1 filed by WILLIAM 3 MANERA on behalf of S. WILLIAM MANERA Objections/Responses due by 7/27/2009,.(MANERA, WILLIAM) (Entered: 07/08/2009)", 
      "document_number": "26", 
      "pacer_doc_id": "show_doc.pl"
    }, 
    {
      "date_filed": "2009-07-30", 
      "description": "Notice of Lodging Proposed Order filed by WILLIAM 3 MANERA on behalf of S. WILLIAM MANERA (related document(s) 26 Trustee Objection to Claim) (Attachments: # 1 order).(MANERA, WILLIAM) (Entered: 07/30/2009)", 
      "document_number": "27", 
      "pacer_doc_id": "show_doc.pl"
    }, 
    {
      "date_filed": "2009-08-05", 
      "description": "ORDER Ruling on Objection to Claim 1 signed on 8/5/2009 (related document(s) 26 Trustee Objection to Claim) . (Morgan, Kayla) (Entered: 08/06/2009)", 
      "document_number": "28", 
      "pacer_doc_id": "show_doc.pl"
    }, 
    {
      "date_filed": "2009-09-28", 
      "description": "Motion for Relief from Stay (150.00 fee) Re: Real Property, 15601 North 56th Drive, Glendale, AZ 85306 filed by MARK 1 BOSCO of TIFFANY & BOSCO, P.A. on behalf of C/O MARK S. BOSCO WELLS FARGO BANK, N.A. (Attachments: # 1 Exhibit \"A\" Note# 2 Exhibit \"B\" DOT). (BOSCO, MARK) (Entered: 09/28/2009)", 
      "document_number": "29", 
      "pacer_doc_id": "show_doc.pl"
    }, 
    {
      "date_filed": "2009-09-28", 
      "description": "Notice of Motion for Relief from Stay filed by MARK 1 BOSCO of TIFFANY & BOSCO, P.A. on behalf of C/O MARK S. BOSCO WELLS FARGO BANK, N.A. (related document(s) 29 Motion for Relief from Stay (150.00 fee)).(BOSCO, MARK) (Entered: 09/28/2009)", 
      "document_number": "30", 
      "pacer_doc_id": "show_doc.pl"
    }, 
    {
      "date_filed": "2009-09-28", 
      "description": "Notice of Appearance filed by MARK 1 BOSCO of TIFFANY & BOSCO, P.A. on behalf of C/O MARK S. BOSCO WELLS FARGO BANK, N.A..(BOSCO, MARK) (Entered: 09/28/2009)", 
      "document_number": "31", 
      "pacer_doc_id": "show_doc.pl"
    }, 
    {
      "date_filed": "2009-10-02", 
      "description": "Trustee Notice to Abandon Property filed by WILLIAM 1 MANERA on behalf of S. WILLIAM MANERA Objections/Responses due by 10/22/2009,.(MANERA, WILLIAM) (Entered: 10/02/2009)", 
      "document_number": "32", 
      "pacer_doc_id": "show_doc.pl"
    }, 
    {
      "date_filed": "2009-10-05", 
      "description": "BNC Certificate of Notice - PDF Document (related document(s) 32 Trustee Notice to Abandon Property) (Admin.) (Entered: 10/07/2009)", 
      "document_number": "33", 
      "pacer_doc_id": "show_doc.pl"
    }, 
    {
      "date_filed": "2009-10-12", 
      "description": "Trustee Chapter 7 Final Report and Account, Trustee Application for Compensation for S. WILLIAM MANERA, Trustee Chapter 7, Period: to, Fees:$613.52, Expenses: $22.18. filed by S. WILLIAM MANERA (Attachments: # 1 Compensation Application).(MANERA, WILLIAM) (Entered: 10/12/2009)", 
      "document_number": "34", 
      "pacer_doc_id": "show_doc.pl"
    }, 
    {
      "date_filed": "2009-10-12", 
      "description": "Notice of Trustee's Final Report and Applications for Compensation filed by WILLIAM 3 MANERA on behalf of S. WILLIAM MANERA.(MANERA, WILLIAM) (Entered: 10/12/2009)", 
      "document_number": "35", 
      "pacer_doc_id": "show_doc.pl"
    }, 
    {
      "date_filed": "2009-10-13", 
      "description": "BNC Certificate of Notice - PDF Document (related document(s) 35 Notice of Trustee's Final Report and Applications for Compensation) (Admin.) (Entered: 10/15/2009)", 
      "document_number": "36", 
      "pacer_doc_id": "show_doc.pl"
    }, 
    {
      "date_filed": "2009-10-22", 
      "description": "The United States Trustee has reviewed the Chapter 7 Trustee's Final Report, Application for Compensation and Application(s) for Compensation of Professionals. Filed by the U.S Trustee's Office. (AMOROSI, ELIZABETH) (Entered: 10/22/2009)", 
      "document_number": "37", 
      "pacer_doc_id": null
    }, 
    {
      "date_filed": "2009-11-02", 
      "description": "Motion to Withdraw Document Motion for Relief Re: Real Property, 15601 North 56th Drive,Glendale, AZ 85306 filed by MARK 1 BOSCO of TIFFANY & BOSCO, P.A. on behalf of C/O MARK S. BOSCO WELLS FARGO BANK, N.A. (related document(s) 29 Motion for Relief from Stay (150.00 fee)). (BOSCO, MARK) (Entered: 11/02/2009)", 
      "document_number": "38", 
      "pacer_doc_id": "show_doc.pl"
    }, 
    {
      "date_filed": "2009-11-09", 
      "description": "ORDER Granting Motion to Withdraw Document (Related Doc # 38 ) signed on 11/9/2009 . (Frazier, Liz) (Entered: 11/10/2009)", 
      "document_number": "39", 
      "pacer_doc_id": "show_doc.pl"
    }, 
    {
      "date_filed": "2009-11-19", 
      "description": "Trustee Report of No Objection to Proposed Distribution filed by WILLIAM 3 MANERA on behalf of S. WILLIAM MANERA (related document(s) 34 Trustee Chapter 7 Final Account and Report, Chapter 7 or 11 Trustee Application for Compensation).(MANERA, WILLIAM) (Entered: 11/19/2009)", 
      "document_number": "40", 
      "pacer_doc_id": "show_doc.pl"
    }, 
    {
      "date_filed": "2009-11-19", 
      "description": "Notice of Lodging Proposed Order filed by WILLIAM 3 MANERA on behalf of S. WILLIAM MANERA (related document(s) 34 Trustee Chapter 7 Final Account and Report, Chapter 7 or 11 Trustee Application for Compensation) (Attachments: # 1 Fee/Expenses Application Order).(MANERA, WILLIAM) (Entered: 11/19/2009)", 
      "document_number": "41", 
      "pacer_doc_id": "show_doc.pl"
    }, 
    {
      "date_filed": "2009-11-25", 
      "description": "ORDER Granting Trustee Application for Compensation (Related Doc # 34 ) for S. WILLIAM MANERA, Fees Awarded: $613.52, Expenses Awarded: $22.18 signed on 11/25/2009 . (Stallman, Laurie) (Entered: 11/30/2009)", 
      "document_number": "42", 
      "pacer_doc_id": "show_doc.pl"
    }
  ], 
  "docket_number": "2:08-bk-16567", 
  "jurisdiction": null, 
  "jury_demand": null, 
  "nature_of_suit": null, 
  "parties": [
    {
      "attorneys": [
        {
          "contact": "PHILLIPS & ASSOCIATES\n3030 N. 3RD ST, STE 1100\nPHOENIX, AZ 85012\n602-258-8900\nFax : 602-264-7892\nEmail: mattf@phillipslaw.ws\n", 
          "name": "MATTHEW 2 FOLEY", 
          "roles": []
        }, 
        {
          "contact": "PHILLIPS & ASSOCIATES\n3030 N. 3RD ST., #1100\nPHOENIX, AZ 85012\n602-258-8900\nFax : 602-264-7892\nEmail: robertt@phillipslaw.ws\n", 
          "name": "ROBERT 1 TEAGUE", 
          "roles": []
        }
      ], 
      "extra_info": "15601 N 56TH DR\nGLENDALE, AZ 85306\nSSN / ITIN: xxx-xx-9458", 
      "name": "JOEL H JARAMILLO", 
      "type": "Debtor"
    }, 
    {
      "attorneys": [
        {
          "contact": "PHILLIPS & ASSOCIATES\n3030 N. 3RD ST, STE 1100\nPHOENIX, AZ 85012\n602-258-8900\nFax : 602-264-7892\nEmail: mattf@phillipslaw.ws\n", 
          "name": "MATTHEW 2 FOLEY", 
          "roles": []
        }, 
        {
          "contact": "PHILLIPS & ASSOCIATES\n3030 N. 3RD ST., #1100\nPHOENIX, AZ 85012\n602-258-8900\nFax : 602-264-7892\nEmail: robertt@phillipslaw.ws\n", 
          "name": "ROBERT 1 TEAGUE", 
          "roles": []
        }
      ], 
      "extra_info": "15601 N 56TH DR\nGLENDALE, AZ 85306\nSSN / ITIN: xxx-xx-0359", 
      "name": "MARIA JARAMILLO", 
      "type": "Joint Debtor"
    }, 
    {
      "attorneys": [], 
      "extra_info": "P.O. BOX 44350\nPHOENIX, AZ 85064-4350\n602-795-2796", 
      "name": "S. WILLIAM MANERA", 
      "type": "Trustee"
    }, 
    {
      "attorneys": [], 
      "extra_info": "OFFICE OF THE U.S. TRUSTEE\n230 NORTH FIRST AVENUE\nSUITE 204\nPHOENIX, AZ 85003", 
      "name": "U.S. TRUSTEE", 
      "type": "U.S. Trustee"
    }
  ], 
  "referred_to_str": null
}