{
  "assigned_to_str": "Redfield T. Baum Sr.", 
  "case_name": "EFREN JON C. MARTIN, JR", 
  "cause": null, 
  "court_id": "azb", 
  "date_converted": null, 
  "date_discharged": null, 
  "date_filed": "2009-11-11", 
  "date_terminated": null, 
  "demand": null, 
  "docket_entries": [
    {
      "date_filed": "2009-11-11", 
      "description": "Chapter 7 Voluntary Petition, Schedules and Statements (except for those listed below). The mailing list of creditors if not uploaded when the petition was filed, must be uploaded no later than 5 calendar days from the date of the filing of the petition. Failure to timely upload the list of creditors, may result in dismissal of the case without further notice. Electronic Filing Declaration due 12/1/2009, Payment Advices Declaration Required by 11 USC Section 521(a)(1)(B)(iv) due by 11/27/2009, filed by RANDY NUSSBAUM of NUSSBAUM & GILLIS, P.C. on behalf of EFREN JON C. MARTIN JR, MARY CATHERINE MARTIN (Attachments: # 1 Exhibit Credit Counseling Certificate# 2 Exhibit Credit Counseling Certificate) (NUSSBAUM, RANDY) (Entered: 11/11/2009)", 
      "document_number": "1", 
      "pacer_doc_id": "show_doc.pl"
    }, 
    {
      "date_filed": "2009-11-11", 
      "description": "Schedules and Statements filed by RANDY NUSSBAUM of NUSSBAUM & GILLIS, P.C. on behalf of EFREN JON C. MARTIN JR, MARY CATHERINE MARTIN. Electronic Filing Declaration due by 11/16/2009, (NUSSBAUM, RANDY) (Entered: 11/11/2009)", 
      "document_number": "2", 
      "pacer_doc_id": "show_doc.pl"
    }, 
    {
      "date_filed": "2009-11-11", 
      "description": "Master Mailing List filed by RANDY NUSSBAUM of NUSSBAUM & GILLIS, P.C. on behalf of EFREN JON C. MARTIN JR, MARY CATHERINE MARTIN. (NUSSBAUM, RANDY) (Entered: 11/11/2009)", 
      "document_number": "3", 
      "pacer_doc_id": "show_doc.pl"
    }, 
    {
      "date_filed": "2009-11-11", 
      "description": "Chapter 7 Individual Debtor Statement that Debts are Not Primarily Consumer Debts filed by RANDY NUSSBAUM of NUSSBAUM & GILLIS, P.C. on behalf of EFREN JON C. MARTIN JR, MARY CATHERINE MARTIN. (NUSSBAUM, RANDY) (Entered: 11/11/2009)", 
      "document_number": "4", 
      "pacer_doc_id": "show_doc.pl"
    }, 
    {
      "date_filed": "2009-11-11", 
      "description": "Meeting of Creditors scheduled for 12/17/2009 at 11:00 AM at US Trustee Meeting Room, 230 N. First Avenue, Suite 102, Phoenix, AZ (341-PHX). (NUSSBAUM, RANDY) (Entered: 11/11/2009)", 
      "document_number": "5", 
      "pacer_doc_id": null
    }, 
    {
      "date_filed": "2009-11-12", 
      "description": "Deficiency Notice to Debtor and Attorney for Debtor That All Required Documents Were Not Filed. (Duran, Tammy) (Entered: 11/12/2009)", 
      "document_number": "6", 
      "pacer_doc_id": "show_doc.pl"
    }, 
    {
      "date_filed": "2009-11-12", 
      "description": "Chapter 7 Indiv/Joint--Notice of Meeting of Creditors. 341(a) meeting to be held on 12/17/2009 at 11:00 AM at US Trustee Meeting Room, 230 N. First Avenue, Suite 102, Phoenix, AZ (341-PHX) Complaints under Sections 727 or 523 due by 2/16/2010. (Duran, Tammy) (Entered: 11/12/2009)", 
      "document_number": "7", 
      "pacer_doc_id": "show_doc.pl"
    }, 
    {
      "date_filed": "2009-11-12", 
      "description": "BNC Certificate of Notice - Notice of Meeting of Creditors (related document(s) 7 BNC Form Request--341 Notice--Chapter 7 Indiv/Joint) (Admin.) (Entered: 11/14/2009)", 
      "document_number": "8", 
      "pacer_doc_id": "show_doc.pl"
    }, 
    {
      "date_filed": "2009-11-12", 
      "description": "BNC Certificate of Notice (related document(s) 6 Deficiency Notice to Debtor (Missing Documents Form)) (Admin.) (Entered: 11/14/2009)", 
      "document_number": "9", 
      "pacer_doc_id": "show_doc.pl"
    }, 
    {
      "date_filed": "2009-11-16", 
      "description": "Debtor Declaration Re: Electronic Filing (Gant, Jennifer) (Entered: 11/19/2009)", 
      "document_number": "10", 
      "pacer_doc_id": "show_doc.pl"
    }, 
    {
      "date_filed": "2009-11-16", 
      "description": "Statement of Social Security Number Submitted (Gant, Jennifer) (Entered: 11/19/2009)", 
      "document_number": "11", 
      "pacer_doc_id": "show_doc.pl"
    }, 
    {
      "date_filed": "2009-11-24", 
      "description": "Declaration of Evidence of Employer Payments Within 60 Days filed by RANDY NUSSBAUM of NUSSBAUM & GILLIS, P.C. on behalf of EFREN JON C. MARTIN JR, MARY CATHERINE MARTIN. (NUSSBAUM, RANDY) (Entered: 11/24/2009)", 
      "document_number": "12", 
      "pacer_doc_id": "show_doc.pl"
    }, 
    {
      "date_filed": "2009-11-24", 
      "description": "Request for Notice filed by RAMESH SINGH of RECOVERY MANAGEMENT SYSTEMS CORP. on behalf of RECOVERY MANAGEMENT SYSTEMS CORPORATION. (SINGH, RAMESH) (Entered: 11/24/2009)", 
      "document_number": "13", 
      "pacer_doc_id": "show_doc.pl"
    }, 
    {
      "date_filed": "2009-12-02", 
      "description": "Motion for Relief from Stay (150.00 fee) Re: Real Property, 2355 W. Paradise Dr., Phoenix, AZ 85029 filed by MARK 1 BOSCO of TIFFANY & BOSCO, P.A. on behalf of Deutsche Bank National Trust Company, as Trustee of Morgan Stanley Mortgage Loan Trust 2005-5AR (Attachments: # 1 Exhibit \"A\" Note# 2 Exhibit \"B\" DOT). (BOSCO, MARK) (Entered: 12/02/2009)", 
      "document_number": "14", 
      "pacer_doc_id": "show_doc.pl"
    }, 
    {
      "date_filed": "2009-12-02", 
      "description": "Notice of Motion for Relief from Stay filed by MARK 1 BOSCO of TIFFANY & BOSCO, P.A. on behalf of Deutsche Bank National Trust Company, as Trustee of Morgan Stanley Mortgage Loan Trust 2005-5AR (related document(s) 14 Motion for Relief from Stay (150.00 fee)).(BOSCO, MARK) (Entered: 12/02/2009)", 
      "document_number": "15", 
      "pacer_doc_id": "show_doc.pl"
    }, 
    {
      "date_filed": "2009-12-02", 
      "description": "Notice of Appearance filed by MARK 1 BOSCO of TIFFANY & BOSCO, P.A. on behalf of Deutsche Bank National Trust Company, as Trustee of Morgan Stanley Mortgage Loan Trust 2005-5AR.(BOSCO, MARK) (Entered: 12/02/2009)", 
      "document_number": "16", 
      "pacer_doc_id": "show_doc.pl"
    }, 
    {
      "date_filed": "2009-12-08", 
      "description": "Notice of Appearance filed by MATTHEW A. SILVERMAN of MCCARTHY HOLTHUS LEVINE on behalf of Aurora Loan Services, LLC, its assignees and/or successors.(SILVERMAN, MATTHEW) (Entered: 12/08/2009)", 
      "document_number": "17", 
      "pacer_doc_id": "show_doc.pl"
    }, 
    {
      "date_filed": "2009-12-09", 
      "description": "Motion for Relief from Stay (150.00 fee) 18624 North 42nd Avenue, Glendale, AZ 85308(AZ-09-17451) filed by MATTHEW A. SILVERMAN of MCCARTHY HOLTHUS LEVINE on behalf of Wells Fargo Bank, National Association as Trustee for the Certificateholders of Structured Asset Mortgage Investments II Inc., GreenPoint MTA Trust 2006-AR3, Mortgage Pass-Through Certificates, Series (Attachments: # 1 Exhibit). (SILVERMAN, MATTHEW) (Entered: 12/09/2009)", 
      "document_number": "18", 
      "pacer_doc_id": "show_doc.pl"
    }, 
    {
      "date_filed": "2009-12-09", 
      "description": "Notice of Motion for Relief from Stay (AZ-09-17451) filed by MATTHEW A. SILVERMAN of MCCARTHY HOLTHUS LEVINE on behalf of Wells Fargo Bank, National Association as Trustee for the Certificateholders of Structured Asset Mortgage Investments II Inc., GreenPoint MTA Trust 2006-AR3, Mortgage Pass-Through Certificates, Series (related document(s) 18 Motion for Relief from Stay (150.00 fee)) (Attachments: # 1 Exhibit).(SILVERMAN, MATTHEW) (Entered: 12/09/2009)", 
      "document_number": "19", 
      "pacer_doc_id": "show_doc.pl"
    }, 
    {
      "date_filed": "2009-12-10", 
      "description": "Motion for Relief from Stay (150.00 fee) 3302 East Angela Drive, Phoenix, AZ 85032 (AZ-09-16237) filed by MATTHEW A. SILVERMAN of MCCARTHY HOLTHUS LEVINE on behalf of Bank of America, National Association as trustee for Washington Mutual Mortgage Pass-Through Certificates WMALT Series 2006-1 Trust, its assignees and/or successors (Attachments: # 1 Exhibit). (SILVERMAN, MATTHEW) (Entered: 12/10/2009)", 
      "document_number": "20", 
      "pacer_doc_id": "show_doc.pl"
    }, 
    {
      "date_filed": "2009-12-10", 
      "description": "Notice of Motion for Relief from Stay (AZ-09-16237) filed by MATTHEW A. SILVERMAN of MCCARTHY HOLTHUS LEVINE on behalf of Bank of America, National Association as trustee for Washington Mutual Mortgage Pass-Through Certificates WMALT Series 2006-1 Trust, its assignees and/or successors (related document(s) 20 Motion for Relief from Stay (150.00 fee)) (Attachments: # 1 Exhibit).(SILVERMAN, MATTHEW) (Entered: 12/10/2009)", 
      "document_number": "21", 
      "pacer_doc_id": "show_doc.pl"
    }, 
    {
      "date_filed": "2009-12-15", 
      "description": "Application to Employ Attorney/Declaration of Attorney filed by ADAM B. NACH of LANE & NACH, P.C. on behalf of JILL H. FORD. (NACH, ADAM) (Entered: 12/15/2009)", 
      "document_number": "22", 
      "pacer_doc_id": "show_doc.pl"
    }, 
    {
      "date_filed": "2009-12-15", 
      "description": "Notice of Lodging Proposed Order Authorizing Case Trustee to Employ Attorney filed by ADAM B. NACH of LANE & NACH, P.C. on behalf of JILL H. FORD (related document(s) 22 Application to Employ).(NACH, ADAM) (Entered: 12/15/2009)", 
      "document_number": "23", 
      "pacer_doc_id": "show_doc.pl"
    }, 
    {
      "date_filed": "2009-12-16", 
      "description": "ORDER Granting Application to Employ (Related Doc # 22 ) signed on 12/16/2009 . (Duran, Tammy) (Entered: 12/16/2009)", 
      "document_number": "24", 
      "pacer_doc_id": "show_doc.pl"
    }, 
    {
      "date_filed": "2009-12-21", 
      "description": "Certificate of Service and No Objections filed by MARK 1 BOSCO of TIFFANY & BOSCO, P.A. on behalf of Deutsche Bank National Trust Company, as Trustee of Morgan Stanley Mortgage Loan Trust 2005-5AR. (related document(s) 14 Motion for Relief from Stay (150.00 fee)) (BOSCO, MARK) (Entered: 12/21/2009)", 
      "document_number": "25", 
      "pacer_doc_id": "show_doc.pl"
    }, 
    {
      "date_filed": "2009-12-21", 
      "description": "Notice of Lodging Proposed Order filed by MARK 1 BOSCO of TIFFANY & BOSCO, P.A. on behalf of Deutsche Bank National Trust Company, as Trustee of Morgan Stanley Mortgage Loan Trust 2005-5AR (related document(s) 14 Motion for Relief from Stay (150.00 fee)).(BOSCO, MARK) (Entered: 12/21/2009)", 
      "document_number": "26", 
      "pacer_doc_id": "show_doc.pl"
    }, 
    {
      "date_filed": "2009-12-22", 
      "description": "Motion for Relief from Stay (150.00 fee) 902 North Santa Anna Place, Chandler, AZ 85224(AZ-09-17706) filed by MATTHEW A. SILVERMAN of MCCARTHY HOLTHUS LEVINE on behalf of Aurora Loan Services, LLC, its assignees and/or successors (Attachments: # 1 Exhibit). (SILVERMAN, MATTHEW) (Entered: 12/22/2009)", 
      "document_number": "27", 
      "pacer_doc_id": "show_doc.pl"
    }, 
    {
      "date_filed": "2009-12-22", 
      "description": "Notice of Motion for Relief from Stay (AZ-09-17706) filed by MATTHEW A. SILVERMAN of MCCARTHY HOLTHUS LEVINE on behalf of Aurora Loan Services, LLC, its assignees and/or successors (related document(s) 27 Motion for Relief from Stay (150.00 fee)) (Attachments: # 1 Exhibit).(SILVERMAN, MATTHEW) (Entered: 12/22/2009)", 
      "document_number": "28", 
      "pacer_doc_id": "show_doc.pl"
    }, 
    {
      "date_filed": "2010-01-05", 
      "description": "Notice of Filing OF EXHIBIT AND EXHIBIT IN SUPPORT OF MOTION FOR RELIEF FROM AUTOMATIC STAY filed by MATTHEW A. SILVERMAN of MCCARTHY HOLTHUS LEVINE on behalf of Bank of America, National Association as trustee for Washington Mutual Mortgage Pass-Through Certificates WMALT Series 2006-1 Trust, its assignees and/or successors (related document(s) 20 Motion for Relief from Stay (150.00 fee)) (Attachments: # 1 Exhibit).(SILVERMAN, MATTHEW) (Entered: 01/05/2010)", 
      "document_number": "29", 
      "pacer_doc_id": "show_doc.pl"
    }, 
    {
      "date_filed": "2010-01-07", 
      "description": "Notice of Lodging Proposed Order (AZ-09-17451) filed by MATTHEW A. SILVERMAN of MCCARTHY HOLTHUS LEVINE on behalf of Wells Fargo Bank, National Association as Trustee for the Certificateholders of Structured Asset Mortgage Investments II Inc., GreenPoint MTA Trust 2006-AR3, Mortgage Pass-Through Certificates, Series (related document(s) 18 Motion for Relief from Stay (150.00 fee)) (Attachments: # 1 Exhibit).(SILVERMAN, MATTHEW) (Entered: 01/07/2010)", 
      "document_number": "30", 
      "pacer_doc_id": "show_doc.pl"
    }, 
    {
      "date_filed": "2010-01-07", 
      "description": "Certificate of Service and No Objections (AZ-09-17451) filed by MATTHEW A. SILVERMAN of MCCARTHY HOLTHUS LEVINE on behalf of Wells Fargo Bank, National Association as Trustee for the Certificateholders of Structured Asset Mortgage Investments II Inc., GreenPoint MTA Trust 2006-AR3, Mortgage Pass-Through Certificates, Series. (related document(s) 18 Motion for Relief from Stay (150.00 fee)) (SILVERMAN, MATTHEW) (Entered: 01/07/2010)", 
      "document_number": "31", 
      "pacer_doc_id": "show_doc.pl"
    }, 
    {
      "date_filed": "2010-01-07", 
      "description": "Notice of Lodging Proposed Order (AZ-09-16237) filed by MATTHEW A. SILVERMAN of MCCARTHY HOLTHUS LEVINE on behalf of Bank of America, National Association as trustee for Washington Mutual Mortgage Pass-Through Certificates WMALT Series 2006-1 Trust, its assignees and/or successors (related document(s) 20 Motion for Relief from Stay (150.00 fee)) (Attachments: # 1 Exhibit).(SILVERMAN, MATTHEW) (Entered: 01/07/2010)", 
      "document_number": "32", 
      "pacer_doc_id": "show_doc.pl"
    }, 
    {
      "date_filed": "2010-01-07", 
      "description": "Certificate of Service and No Objections (AZ-09-16237) filed by MATTHEW A. SILVERMAN of MCCARTHY HOLTHUS LEVINE on behalf of Bank of America, National Association as trustee for Washington Mutual Mortgage Pass-Through Certificates WMALT Series 2006-1 Trust, its assignees and/or successors. (related document(s) 20 Motion for Relief from Stay (150.00 fee)) (SILVERMAN, MATTHEW) (Entered: 01/07/2010)", 
      "document_number": "33", 
      "pacer_doc_id": "show_doc.pl"
    }, 
    {
      "date_filed": "2010-01-13", 
      "description": "Exhibit \"C\" Assignment filed by MARK 1 BOSCO of TIFFANY & BOSCO, P.A. on behalf of Deutsche Bank National Trust Company, as Trustee of Morgan Stanley Mortgage Loan Trust 2005-5AR. (related document(s) 14 Motion for Relief from Stay (150.00 fee)) (BOSCO, MARK) (Entered: 01/13/2010)", 
      "document_number": "34", 
      "pacer_doc_id": "show_doc.pl"
    }, 
    {
      "date_filed": "2010-01-13", 
      "description": "Certificate of Service and No Objections filed by MARK 1 BOSCO of TIFFANY & BOSCO, P.A. on behalf of Deutsche Bank National Trust Company, as Trustee of Morgan Stanley Mortgage Loan Trust 2005-5AR. (related document(s) 14 Motion for Relief from Stay (150.00 fee)) (BOSCO, MARK) (Entered: 01/13/2010)", 
      "document_number": "35", 
      "pacer_doc_id": "show_doc.pl"
    }, 
    {
      "date_filed": "2010-01-13", 
      "description": "Notice of Lodging Proposed Order filed by MARK 1 BOSCO of TIFFANY & BOSCO, P.A. on behalf of Deutsche Bank National Trust Company, as Trustee of Morgan Stanley Mortgage Loan Trust 2005-5AR (related document(s) 14 Motion for Relief from Stay (150.00 fee)).(BOSCO, MARK) (Entered: 01/13/2010)", 
      "document_number": "36", 
      "pacer_doc_id": "show_doc.pl"
    }, 
    {
      "date_filed": "2010-01-14", 
      "description": "Certificate of Service and Notice of Lodging Proposed Order (AZ-09-17706) filed by MATTHEW A. SILVERMAN of MCCARTHY HOLTHUS LEVINE on behalf of Aurora Loan Services, LLC, its assignees and/or successors (related document(s) 27 Motion for Relief from Stay (150.00 fee)) (Attachments: # 1 Exhibit).(SILVERMAN, MATTHEW) Modified on 1/20/2010 to add text(Radicke, Michelle). (Entered: 01/14/2010)", 
      "document_number": "37", 
      "pacer_doc_id": "show_doc.pl"
    }, 
    {
      "date_filed": "2010-01-14", 
      "description": "Notice of Lodgement and Certificate of Service and No Objections (AZ-09-17706) filed by MATTHEW A. SILVERMAN of MCCARTHY HOLTHUS LEVINE on behalf of Aurora Loan Services, LLC, its assignees and/or successors. (related document(s) 27 Motion for Relief from Stay (150.00 fee)) (SILVERMAN, MATTHEW) Modified on 1/20/2010 to add text (Radicke, Michelle). (Entered: 01/14/2010)", 
      "document_number": "38", 
      "pacer_doc_id": "show_doc.pl"
    }, 
    {
      "date_filed": "2010-01-14", 
      "description": "ORDER Granting Motion for Relief from Stay (Related Doc # 18 ) signed on 1/14/2010 . (Radicke, Michelle) (Entered: 01/15/2010)", 
      "document_number": "40", 
      "pacer_doc_id": "show_doc.pl"
    }, 
    {
      "date_filed": "2010-01-14", 
      "description": "ORDER Granting Motion for Relief from Stay (Related Doc # 20 ) signed on 1/14/2010 . (Radicke, Michelle) (Entered: 01/15/2010)", 
      "document_number": "41", 
      "pacer_doc_id": "show_doc.pl"
    }, 
    {
      "date_filed": "2010-01-15", 
      "description": "Deficiency Memo (related document(s) 34 Exhibit) (Radicke, Michelle) (Entered: 01/15/2010)", 
      "document_number": "39", 
      "pacer_doc_id": "show_doc.pl"
    }, 
    {
      "date_filed": "2010-01-15", 
      "description": "BNC Certificate of Notice (related document(s) 40 Order on Motion for Relief from Stay) (Admin.) (Entered: 01/17/2010)", 
      "document_number": "42", 
      "pacer_doc_id": "show_doc.pl"
    }, 
    {
      "date_filed": "2010-01-15", 
      "description": "BNC Certificate of Notice (related document(s) 41 Order on Motion for Relief from Stay) (Admin.) (Entered: 01/17/2010)", 
      "document_number": "43", 
      "pacer_doc_id": "show_doc.pl"
    }, 
    {
      "date_filed": "2010-01-15", 
      "description": "BNC Certificate of Notice - PDF Document (related document(s) 40 Order on Motion for Relief from Stay) (Admin.) (Entered: 01/17/2010)", 
      "document_number": "44", 
      "pacer_doc_id": "show_doc.pl"
    }, 
    {
      "date_filed": "2010-01-15", 
      "description": "BNC Certificate of Notice - PDF Document (related document(s) 41 Order on Motion for Relief from Stay) (Admin.) (Entered: 01/17/2010)", 
      "document_number": "45", 
      "pacer_doc_id": "show_doc.pl"
    }, 
    {
      "date_filed": "2010-01-19", 
      "description": "Financial Management Course Certificate - Efren Martin filed by RANDY NUSSBAUM of NUSSBAUM & GILLIS, P.C. on behalf of EFREN JON C. MARTIN JR, MARY CATHERINE MARTIN. (NUSSBAUM, RANDY) (Entered: 01/19/2010)", 
      "document_number": "46", 
      "pacer_doc_id": "show_doc.pl"
    }, 
    {
      "date_filed": "2010-01-19", 
      "description": "Financial Management Course Certificate - Mary Martin filed by RANDY NUSSBAUM of NUSSBAUM & GILLIS, P.C. on behalf of EFREN JON C. MARTIN JR, MARY CATHERINE MARTIN. (NUSSBAUM, RANDY) (Entered: 01/19/2010)", 
      "document_number": "47", 
      "pacer_doc_id": "show_doc.pl"
    }, 
    {
      "date_filed": "2010-01-19", 
      "description": "ORDER Granting Motion for Relief from Stay (Related Doc # 27 ) signed on 1/19/2010 . (Radicke, Michelle) (Entered: 01/20/2010)", 
      "document_number": "48", 
      "pacer_doc_id": "show_doc.pl"
    }, 
    {
      "date_filed": "2010-01-20", 
      "description": "BNC Certificate of Notice (related document(s) 48 Order on Motion for Relief from Stay) (Admin.) (Entered: 01/22/2010)", 
      "document_number": "49", 
      "pacer_doc_id": "show_doc.pl"
    }, 
    {
      "date_filed": "2010-01-20", 
      "description": "BNC Certificate of Notice - PDF Document (related document(s) 48 Order on Motion for Relief from Stay) (Admin.) (Entered: 01/22/2010)", 
      "document_number": "50", 
      "pacer_doc_id": "show_doc.pl"
    }, 
    {
      "date_filed": "2010-02-09", 
      "description": "Notice of Filing, Exhibit (Additional) to Motion for Relief filed by MARK 1 BOSCO of TIFFANY & BOSCO, P.A. on behalf of Deutsche Bank National Trust Company, as Trustee of Morgan Stanley Mortgage Loan Trust 2005-5AR. (related document(s) 14 Motion for Relief from Stay (150.00 fee)) (Attachments: # 1 Exhibit \"A\")(BOSCO, MARK) (Entered: 02/09/2010)", 
      "document_number": "51", 
      "pacer_doc_id": "show_doc.pl"
    }, 
    {
      "date_filed": "2010-02-11", 
      "description": "Notice of Lodging Proposed Order filed by MARK 1 BOSCO of TIFFANY & BOSCO, P.A. on behalf of Deutsche Bank National Trust Company, as Trustee of Morgan Stanley Mortgage Loan Trust 2005-5AR (related document(s) 14 Motion for Relief from Stay (150.00 fee)).(BOSCO, MARK) (Entered: 02/11/2010)", 
      "document_number": "52", 
      "pacer_doc_id": "show_doc.pl"
    }
  ], 
  "docket_number": "2:09-bk-29049", 
  "jurisdiction": null, 
  "jury_demand": null, 
  "nature_of_suit": null, 
  "parties": [
    {
      "attorneys": [
        {
          "contact": "NUSSBAUM & GILLIS, P.C.\n14500 N. NORTHSIGHT BLVD. - #116\nSCOTTSDALE, AZ 85260\n480-609-0011\nFax : 480-609-0016\nEmail: rnussbaum@nussbaumgillis.com\n", 
          "name": "RANDY NUSSBAUM", 
          "roles": []
        }
      ], 
      "extra_info": "2515 E. CASITAS DEL RIO DR\nPHOENIX, AZ 85024\nSSN / ITIN: xxx-xx-0799", 
      "name": "EFREN JON C. MARTIN, JR", 
      "type": "Debtor"
    }, 
    {
      "attorneys": [
        {
          "contact": "NUSSBAUM & GILLIS, P.C.\n14500 N. NORTHSIGHT BLVD. - #116\nSCOTTSDALE, AZ 85260\n480-609-0011\nFax : 480-609-0016\nEmail: rnussbaum@nussbaumgillis.com\n", 
          "name": "RANDY NUSSBAUM", 
          "roles": []
        }
      ], 
      "extra_info": "2515 E. CASITAS DEL RIO DR\nPHOENIX, AZ 85024\nSSN / ITIN: xxx-xx-0506", 
      "name": "MARY CATHERINE MARTIN", 
      "type": "Joint Debtor"
    }, 
    {
      "attorneys": [
        {
          "contact": "LANE & NACH, P.C.\n2025 NORTH THIRD STREET, SUITE 157\nPHOENIX, AZ 85004\n602-258-6000\nFax : 602-258-6003\nEmail: adam.nach@azbar.org\n", 
          "name": "ADAM B. NACH", 
          "roles": []
        }
      ], 
      "extra_info": "PO BOX 5845\nCAREFREE, AZ 85377\n480-575-8250", 
      "name": "JILL H. FORD", 
      "type": "Trustee"
    }, 
    {
      "attorneys": [], 
      "extra_info": "OFFICE OF THE U.S. TRUSTEE\n230 NORTH FIRST AVENUE\nSUITE 204\nPHOENIX, AZ 85003", 
      "name": "U.S. TRUSTEE", 
      "type": "U.S. Trustee"
    }
  ], 
  "referred_to_str": null
}