{
  "assigned_to_str": "Vincent P. Zurzolo", 
  "case_name": "Central Metal, Inc.", 
  "cause": null, 
  "court_id": "cacb", 
  "date_converted": null, 
  "date_discharged": null, 
  "date_filed": "2010-01-08", 
  "date_terminated": null, 
  "demand": null, 
  "docket_entries": [
    {
      "date_filed": "2010-02-16", 
      "description": "Request for judicial notice In Support Of Reply To Center Bank's Objection To Application By The Official Committee Of Creditors Holding Unsecured Claims To Employ Stutman, Treister & Glatt Professional Corporation As Counsel, with Proof of Service Filed by Creditor Committee Official Committee of Creditors Holding Unsecured Claims (RE: related document(s) 86 Reply). (Yun, Scott) (Entered: 02/16/2010)", 
      "document_number": "87", 
      "pacer_doc_id": "show_doc.pl"
    }, 
    {
      "date_filed": "2010-02-16", 
      "description": "Reply to (related document(s): 54 Objection filed by Creditor Center Bank, a California state chartered bank) (Reply To Center Bank's Objection To Application By The Official Committee Of Creditors Holding Unsecured Claims To Employ Stutman, Treister & Glatt Professional Corporation As Counsel, with Proof of Service) Filed by Creditor Committee Official Committee of Creditors Holding Unsecured Claims (Yun, Scott) (Entered: 02/16/2010)", 
      "document_number": "86", 
      "pacer_doc_id": "show_doc.pl"
    }, 
    {
      "date_filed": "2010-02-16", 
      "description": "Stipulation By Central Metal, Inc. and Center Bank, a California state chartered bank - Second Stipulation Regarding Interim Use of Cash Collateral Filed by Debtor Central Metal, Inc. (Oh, Juliet) (Entered: 02/16/2010)", 
      "document_number": "85", 
      "pacer_doc_id": "show_doc.pl"
    }, 
    {
      "date_filed": "2010-02-12", 
      "description": "BNC Certificate of Notice - PDF Document. (RE: related document(s) 73 Order (Generic)) No. of Notices: 21. Service Date 02/12/2010. (Admin.) (Entered: 02/12/2010)", 
      "document_number": "84", 
      "pacer_doc_id": "show_doc.pl"
    }, 
    {
      "date_filed": "2010-02-12", 
      "description": "BNC Certificate of Notice - PDF Document. (RE: related document(s) 71 Order (Generic)) No. of Notices: 21. Service Date 02/12/2010. (Admin.) (Entered: 02/12/2010)", 
      "document_number": "83", 
      "pacer_doc_id": "show_doc.pl"
    }, 
    {
      "date_filed": "2010-02-11", 
      "description": "Status report - Debtor in Possession's Report on Status of Reorganization Case; Declarations of Charles T. Moffitt and Juliet Y. Oh, Esq. in Support Thereof Filed by Debtor Central Metal, Inc. (RE: related document(s) 14 Order (Generic)). (Oh, Juliet) (Entered: 02/11/2010)", 
      "document_number": "82", 
      "pacer_doc_id": "show_doc.pl"
    }, 
    {
      "date_filed": "2010-02-11", 
      "description": "Stipulation By Center Bank, a California state chartered bank and General Electric Capital Corporation, Colonial Pacific Leasing Corporation, Bank of America, N.A., Banc of America Leasing & Capital, LLC, the Official Committee of Creditors Holding Unsecured Claims and Debtor Central Metal, Inc.to Continue Hearing on Center Bank's Motion for Appointment of Examiner Filed by Creditor Center Bank, a California state chartered bank (Polard, Steven) (Entered: 02/11/2010)", 
      "document_number": "81", 
      "pacer_doc_id": "show_doc.pl"
    }, 
    {
      "date_filed": "2010-02-11", 
      "description": "Proof of service - Amended Proof of Service of Debtor's Reply to Center Bank's Opposition to Debtor's Supplemental Emergency Motion for Use of Cash Collateral and Other Papers Filed by Debtor Central Metal, Inc. (RE: related document(s) 76 Reply, 78 Objection, 79 Objection). (Kim, Monica) (Entered: 02/11/2010)", 
      "document_number": "80", 
      "pacer_doc_id": "show_doc.pl"
    }, 
    {
      "date_filed": "2010-02-11", 
      "description": "Objection (related document(s): 60 Opposition filed by Creditor Center Bank, a California state chartered bank) - Evidentiary Objections to Declaration of Edmund C. King Filed in Support of Center Bank's Opposition to Debtor's Emergency Motion for Use of Cash Collateral on an Interim Basis Pending a Final Hearing Filed by Debtor Central Metal, Inc. (Kim, Monica) (Entered: 02/11/2010)", 
      "document_number": "79", 
      "pacer_doc_id": "show_doc.pl"
    }, 
    {
      "date_filed": "2010-02-11", 
      "description": "Objection (related document(s): 60 Opposition filed by Creditor Center Bank, a California state chartered bank) - Evidentiary Objections to Declaration of Seong Jin Park Filed in Support of Center Bank's Opposition to Debtor's Emergency Motion for Use of Cash Collateral on an Interim Basis Pending a Final Hearing Filed by Debtor Central Metal, Inc. (Kim, Monica) (Entered: 02/11/2010)", 
      "document_number": "78", 
      "pacer_doc_id": "show_doc.pl"
    }, 
    {
      "date_filed": "2010-02-11", 
      "description": "Declaration re: - Declaration of Lori Payne in Support of Debtor's Reply to Center Bank's Opposition to Debtor's Supplemental Emergency Motion for Use of Cash Collateral on an Interim Basis Pending a final Hearing Filed by Debtor Central Metal, Inc. (RE: related document(s) 76 Reply). (Kim, Monica) (Entered: 02/11/2010)", 
      "document_number": "77", 
      "pacer_doc_id": "show_doc.pl"
    }, 
    {
      "date_filed": "2010-02-11", 
      "description": "Reply to (related document(s): 60 Opposition filed by Creditor Center Bank, a California state chartered bank) - Declarations of Charles T. Moffitt and Monica Y. Kim Filed by Debtor Central Metal, Inc. (Kim, Monica) (Entered: 02/11/2010)", 
      "document_number": "76", 
      "pacer_doc_id": "show_doc.pl"
    }, 
    {
      "date_filed": "2010-02-11", 
      "description": "Declaration re: non opposition (Amended) Filed by Debtor Central Metal, Inc. (RE: related document(s) 2 Application to Employ Levene, Neale, Bender, Rankin & Brill L.L.P. as Bankruptcy Counsel, with proof of service). (Oh, Juliet) (Entered: 02/11/2010)", 
      "document_number": "75", 
      "pacer_doc_id": "show_doc.pl"
    }, 
    {
      "date_filed": "2010-02-10", 
      "description": "Declaration re: - Declaration of Charles T. Moffitt in Support of Debtor's Opposition to Center Bank's Motion for Appointment of Examiner Filed by Debtor Central Metal, Inc. (RE: related document(s) 67 Opposition). (Oh, Juliet) (Entered: 02/10/2010)", 
      "document_number": "74", 
      "pacer_doc_id": "show_doc.pl"
    }, 
    {
      "date_filed": "2010-02-10", 
      "description": "Amended Order (To Correct Two Inaccuracies) Denying Debtor's ex parte application to exceed page limit for Debtor's opposition to Center Bank's motion to appoint examiner \"for additional information refer to image\" (Related Doc # 59, 71 ) Signed on 2/10/2010 (Johnson, Tina R.) (Entered: 02/10/2010)", 
      "document_number": "73", 
      "pacer_doc_id": "show_doc.pl"
    }, 
    {
      "date_filed": "2010-02-10", 
      "description": "Joint/Joinder of Bank of America, N.A. and Banc of America Leasing & Capital LLC to Center Bank's Motion for Appointment of Examiner (with Proof of Service attached) Filed by Creditors BANK OF AMERICA, N.A., Banc of America Leasing & Capital, LLC (RE: related document(s) 34 Motion to Appoint Examiner ). (Alper, Andrew) (Entered: 02/10/2010)", 
      "document_number": "72", 
      "pacer_doc_id": "show_doc.pl"
    }, 
    {
      "date_filed": "2010-02-10", 
      "description": "Order Denying Debtor's ex parte application to exceed page limit for Debtor's opposition to Center Bank's motion for appointment of examiner \"for additional information refer to image\" (Related Doc # 59 ) Signed on 2/10/2010(Johnson, Tina R.) (Entered: 02/10/2010)", 
      "document_number": "71", 
      "pacer_doc_id": "show_doc.pl"
    }, 
    {
      "date_filed": "2010-02-09", 
      "description": "Declaration re: Declaration of Suk Won \"Tim\" Byun in Support of Debtor's Opposition to Center Bank's Motion for Appointment of Examiner Filed by Debtor Central Metal, Inc. (RE: related document(s) 67 Opposition). (Oh, Juliet) (Entered: 02/09/2010)", 
      "document_number": "70", 
      "pacer_doc_id": "show_doc.pl"
    }, 
    {
      "date_filed": "2010-02-09", 
      "description": "Declaration re: Declaration of Jong Uk Byun in Support of Debtor's Opposition to Center Bank's Motion for Appointment of Examiner Filed by Debtor Central Metal, Inc. (RE: related document(s) 67 Opposition). (Oh, Juliet) (Entered: 02/09/2010)", 
      "document_number": "69", 
      "pacer_doc_id": "show_doc.pl"
    }, 
    {
      "date_filed": "2010-02-09", 
      "description": "Declaration re: Declaration of Michael Park, CPA, in Support of Debtor's Opposition to Center Bank's Motion for Appointment of Examiner Filed by Debtor Central Metal, Inc. (RE: related document(s) 67 Opposition). (Oh, Juliet) (Entered: 02/09/2010)", 
      "document_number": "68", 
      "pacer_doc_id": "show_doc.pl"
    }, 
    {
      "date_filed": "2010-02-09", 
      "description": "Opposition to (related document(s): 34 Motion to Appoint Examiner filed by Creditor Center Bank, a California state chartered bank) Filed by Debtor Central Metal, Inc. (Oh, Juliet) (Entered: 02/09/2010)", 
      "document_number": "67", 
      "pacer_doc_id": "show_doc.pl"
    }, 
    {
      "date_filed": "2010-02-09", 
      "description": "Objection (related document(s): 34 Motion to Appoint Examiner filed by Creditor Center Bank, a California state chartered bank) - Evidentiary Objections To Declaration Of Yi Yong Oh Filed In Support Of Center Bank's Motion For Appointment Of Receiver; And Request For Judicial Notice, with proof of service Filed by Debtor Central Metal, Inc. (Kim, Monica) (Entered: 02/09/2010)", 
      "document_number": "66", 
      "pacer_doc_id": "show_doc.pl"
    }, 
    {
      "date_filed": "2010-02-09", 
      "description": "Objection (related document(s): 34 Motion to Appoint Examiner filed by Creditor Center Bank, a California state chartered bank) - Amended Evidentiary Objections To Declaration Of Edmund C. King Filed In Support Of Center Bank's Motion For Appointment Of Receiver; Request For Judicial Notice, with proof of service Filed by Debtor Central Metal, Inc. (Kim, Monica) (Entered: 02/09/2010)", 
      "document_number": "65", 
      "pacer_doc_id": "show_doc.pl"
    }, 
    {
      "date_filed": "2010-02-09", 
      "description": "Certificate of Service -Joinder of General Electric Capital Corporation and Colonial Pacific Leasing in Motion for Appointment of Examiner Filed by Creditors Colonial Pacific Leasing Corporation, General Electric Capital Corporation (RE: related document(s) 63 Joint/Joinder). (Buckley, Mike) CORRECTION: Title Page not included per the Local Rules. Modified on 2/10/2010 (Johnson, Tina R.). (Entered: 02/09/2010)", 
      "document_number": "64", 
      "pacer_doc_id": "show_doc.pl"
    }, 
    {
      "date_filed": "2010-02-09", 
      "description": "Joint/Joinder of Creditors General Electric Capital Corporation and Colonial Pacific Leasing Corporation in Motion for Appointment of Examiner Filed by Creditors Colonial Pacific Leasing Corporation, General Electric Capital Corporation (RE: related document(s) 42 Notice of Hearing). (Buckley, Mike) (Entered: 02/09/2010)", 
      "document_number": "63", 
      "pacer_doc_id": "show_doc.pl"
    }, 
    {
      "date_filed": "2010-02-09", 
      "description": "Declaration re: of Seong Jin Park in Support of Center Bank's Opposition to Debtor's Supplemental Emergency Motion for Use of Cash Collateral Filed by Creditor Center Bank, a California state chartered bank (RE: related document(s) 60 Opposition). (Polard, Steven) (Entered: 02/09/2010)", 
      "document_number": "62", 
      "pacer_doc_id": "show_doc.pl"
    }, 
    {
      "date_filed": "2010-02-09", 
      "description": "Declaration re: of Edmund C. King in Support of Center Bank's Opposition to Debtor's Supplemental Emergency Motion for Use of Cash Collateral Filed by Creditor Center Bank, a California state chartered bank (RE: related document(s) 60 Opposition). (Polard, Steven) (Entered: 02/09/2010)", 
      "document_number": "61", 
      "pacer_doc_id": "show_doc.pl"
    }, 
    {
      "date_filed": "2010-02-09", 
      "description": "Opposition to (related document(s): 45 Motion to Use Cash Collateral - Supplement to Debtor's Emergency Motion for Use of Cash Collateral on an Interim Basis Pending a Final Hearing filed by Debtor Central Metal, Inc.) Filed by Creditor Center Bank, a California state chartered bank (Polard, Steven) (Entered: 02/09/2010)", 
      "document_number": "60", 
      "pacer_doc_id": "show_doc.pl"
    }, 
    {
      "date_filed": "2010-02-09", 
      "description": "Ex parte application to Exceed Page Limit for Debtor's Opposition to Center Bank's Motion for Appointment of Examiner Filed by Debtor Central Metal, Inc. (Oh, Juliet) (Entered: 02/09/2010)", 
      "document_number": "59", 
      "pacer_doc_id": "show_doc.pl"
    }, 
    {
      "date_filed": "2010-02-09", 
      "description": "Request for courtesy Notice of Electronic Filing (NEF) Filed by John H Choi on behalf of Courtesy NEF. (Choi, John) (Entered: 02/09/2010)", 
      "document_number": "58", 
      "pacer_doc_id": "show_doc.pl"
    }, 
    {
      "date_filed": "2010-02-09", 
      "description": "Opposition to (related document(s): 34 Motion to Appoint Examiner filed by Creditor Center Bank, a California state chartered bank) Official Committee of Creditors Holding Unsecured Claims' Opposition to Center Bank's Motion for Appointment of Examiner with proof of service Filed by Creditor Committee Official Committee of Creditors Holding Unsecured Claims (Yun, Scott) (Entered: 02/09/2010)", 
      "document_number": "57", 
      "pacer_doc_id": "show_doc.pl"
    }, 
    {
      "date_filed": "2010-02-08", 
      "description": "Joint/Joinder with proof of service Filed by Creditor Committee Official Committee of Creditors Holding Unsecured Claims (RE: related document(s) 45 Motion to Use Cash Collateral - Supplement to Debtor's Emergency Motion for Use of Cash Collateral on an Interim Basis Pending a Final Hearing). (Yun, Scott) (Entered: 02/08/2010)", 
      "document_number": "56", 
      "pacer_doc_id": "show_doc.pl"
    }, 
    {
      "date_filed": "2010-02-06", 
      "description": "Request for courtesy Notice of Electronic Filing (NEF) Filed by Joon M Khang on behalf of Jong Uk Byun. (Khang, Joon) (Entered: 02/06/2010)", 
      "document_number": "55", 
      "pacer_doc_id": "show_doc.pl"
    }, 
    {
      "date_filed": "2010-02-05", 
      "description": "Objection (related document(s): 51 Application to Employ Stutman Treister & Glatt Professional Corporation as Counsel Application By The Official Committee Of Creditors Holding Unsecured Claims To Employ Stutman, Treister & Glatt Professional Corporation As Counsel; Declaration Of Sco filed by Creditor Committee Official Committee of Creditors Holding Unsecured Claims) Filed by Creditor Center Bank, a California state chartered bank (Polard, Steven) (Entered: 02/05/2010)", 
      "document_number": "54", 
      "pacer_doc_id": "show_doc.pl"
    }, 
    {
      "date_filed": "2010-02-02", 
      "description": "Declaration Re: Electronic Filing, Summary of Schedules, Schedule A, Schedule B, Schedule D, Schedule E, Schedule F, Schedule G, Schedule H, Declaration concerning debtor's schedules, Statement of Financial Affairs, Exhibit A (Corporation), Exhibit C, Statement of Corporate Ownership filed., Statement of related cases Amended, Venue disclosure form (for Corporations and Partnerships filing a chapter 11), Disclosure of Compensation of Attorney for Debtor Filed by Debtor Central Metal, Inc. (RE: related document(s) 1 Voluntary Petition (Chapter 11)). (Oh, Juliet) (Entered: 02/02/2010)", 
      "document_number": "53", 
      "pacer_doc_id": "show_doc.pl"
    }, 
    {
      "date_filed": "2010-01-29", 
      "description": "Notice of motion/application by the Official Committee of Creditors Holding Unsecured Claims to Employ Stutman Treister & Glatt Professional Corporation as Counsel with proof of service Filed by Creditor Committee Official Committee of Creditors Holding Unsecured Claims (RE: related document(s) 51 Application to Employ Stutman Treister & Glatt Professional Corporation as Counsel Application By The Official Committee Of Creditors Holding Unsecured Claims To Employ Stutman, Treister & Glatt Professional Corporation As Counsel; Declaration Of Scott H. Yun In Support Thereof with proof of service Filed by Creditor Committee Official Committee of Creditors Holding Unsecured Claims). (Yun, Scott) (Entered: 01/29/2010)", 
      "document_number": "52", 
      "pacer_doc_id": "show_doc.pl"
    }, 
    {
      "date_filed": "2010-01-29", 
      "description": "Application to Employ Stutman Treister & Glatt Professional Corporation as Counsel Application By The Official Committee Of Creditors Holding Unsecured Claims To Employ Stutman, Treister & Glatt Professional Corporation As Counsel; Declaration Of Scott H. Yun In Support Thereof with proof of service Filed by Creditor Committee Official Committee of Creditors Holding Unsecured Claims (Yun, Scott) (Entered: 01/29/2010)", 
      "document_number": "51", 
      "pacer_doc_id": "show_doc.pl"
    }, 
    {
      "date_filed": "2010-01-29", 
      "description": "Declaration re: non opposition Filed by Debtor Central Metal, Inc. (RE: related document(s) 2 Application to Employ Levene, Neale, Bender, Rankin & Brill L.L.P. as Bankruptcy Counsel, with proof of service). (Oh, Juliet) (Entered: 01/29/2010)", 
      "document_number": "50", 
      "pacer_doc_id": "show_doc.pl"
    }, 
    {
      "date_filed": "2010-01-29", 
      "description": "Proof of service - Declaration of Service of (1) Supplement to Debtor's Emergency Motion for Use of Cash Collateral on an Interim Basis Pending a Final Hearing; (2) Declaration of Charles T. Moffitt; (3) Declaration of Suk Won \"Tim\" Byun; and (4) Declaration of Jong Uk Byun Filed by Debtor Central Metal, Inc. (RE: related document(s) 45 Motion to Use Cash Collateral - Supplement to Debtor's Emergency Motion for Use of Cash Collateral on an Interim Basis Pending a Final Hearing). (Oh, Juliet) CORRECTION: Incorrect event code used. Modified on 2/2/2010 (Johnson, Tina R.). (Entered: 01/29/2010)", 
      "document_number": "49", 
      "pacer_doc_id": "show_doc.pl"
    }, 
    {
      "date_filed": "2010-01-29", 
      "description": "Declaration re: - Declaration of Charles T. Moffitt in Support of Supplement to Debtor's Emergency Motion for Use of Cash Collateral on an Interim Basis Pending a Final Hearing Filed by Debtor Central Metal, Inc. (RE: related document(s) 45 Motion to Use Cash Collateral - Supplement to Debtor's Emergency Motion for Use of Cash Collateral on an Interim Basis Pending a Final Hearing). (Oh, Juliet) (Entered: 01/29/2010)", 
      "document_number": "48", 
      "pacer_doc_id": "show_doc.pl"
    }, 
    {
      "date_filed": "2010-01-29", 
      "description": "Declaration re: - Declaration of Suk Won \"Tim\" Byun in Support of Supplement to Debtor's Emergency Motion for Use of Cash Collateral on an Interim Basis Pending a Final Hearing Filed by Debtor Central Metal, Inc. (RE: related document(s) 45 Motion to Use Cash Collateral - Supplement to Debtor's Emergency Motion for Use of Cash Collateral on an Interim Basis Pending a Final Hearing). (Oh, Juliet) (Entered: 01/29/2010)", 
      "document_number": "47", 
      "pacer_doc_id": "show_doc.pl"
    }, 
    {
      "date_filed": "2010-01-29", 
      "description": "Declaration re: Declaration of Jong Uk Byun in Support of Supplement to Debtor's Emergency Motion for Use of Cash Collateral on an Interim Basis Pending a Final Hearing Filed by Debtor Central Metal, Inc. (RE: related document(s) 45 Motion to Use Cash Collateral - Supplement to Debtor's Emergency Motion for Use of Cash Collateral on an Interim Basis Pending a Final Hearing). (Oh, Juliet) (Entered: 01/29/2010)", 
      "document_number": "46", 
      "pacer_doc_id": "show_doc.pl"
    }, 
    {
      "date_filed": "2010-01-29", 
      "description": "Motion to Use Cash Collateral - Supplement to Debtor's Emergency Motion for Use of Cash Collateral on an Interim Basis Pending a Final Hearing Filed by Debtor Central Metal, Inc. (Oh, Juliet) CORRECTION: Incorrect event code used. Modified on 2/2/2010 (Johnson, Tina R.). (Entered: 01/29/2010)", 
      "document_number": "45", 
      "pacer_doc_id": "show_doc.pl"
    }, 
    {
      "date_filed": "2010-01-28", 
      "description": "BNC Certificate of Notice - PDF Document. (RE: related document(s) 40 ORDER shortening time) No. of Notices: 15. Service Date 01/28/2010. (Admin.) (Entered: 01/28/2010)", 
      "document_number": "44", 
      "pacer_doc_id": "show_doc.pl"
    }, 
    {
      "date_filed": "2010-01-28", 
      "description": "Proof of service Filed by Creditor Center Bank, a California state chartered bank (RE: related document(s) 34 Motion to Appoint Examiner ). (Polard, Steven) (Entered: 01/28/2010)", 
      "document_number": "43", 
      "pacer_doc_id": "show_doc.pl"
    }, 
    {
      "date_filed": "2010-01-28", 
      "description": "Notice of Hearing on Motion to Appoint Examiner Filed by Creditor Center Capital Corporation (RE: related document(s) 34 Motion to Appoint Examiner Filed by Creditor Center Bank, a California state chartered bank). (Polard, Steven) (Entered: 01/28/2010)", 
      "document_number": "42", 
      "pacer_doc_id": "show_doc.pl"
    }, 
    {
      "date_filed": "2010-01-26", 
      "description": "Objection (related document(s): 34 Motion to Appoint Examiner filed by Creditor Center Bank, a California state chartered bank) -Evidentiary Objection To Declaration Of Edmund C. King In Support Of Center Banks Motion For Appointment Of Receiver, with proof of service Filed by Debtor Central Metal, Inc. (Kim, Monica) (Entered: 01/26/2010)", 
      "document_number": "41", 
      "pacer_doc_id": "show_doc.pl"
    }, 
    {
      "date_filed": "2010-01-26", 
      "description": "Order Denying Application For Order Setting Hearing On Shortened Notice (Related Doc # 33 ) Signed on 1/26/2010 (Smith, Cynthia Joyce) (Entered: 01/26/2010)", 
      "document_number": "40", 
      "pacer_doc_id": "show_doc.pl"
    }, 
    {
      "date_filed": "2010-01-24", 
      "description": "BNC Certificate of Notice - PDF Document. (RE: related document(s) 31 Order on Motion Re: Chapter 11 First Day Motions) No. of Notices: 15. Service Date 01/24/2010. (Admin.) (Entered: 01/24/2010)", 
      "document_number": "39", 
      "pacer_doc_id": "show_doc.pl"
    }, 
    {
      "date_filed": "2010-01-22", 
      "description": "Proof of service Filed by Creditor Center Bank, a California state chartered bank (RE: related document(s) 34 Motion to Appoint Examiner ). (Polard, Steven) (Entered: 01/22/2010)", 
      "document_number": "38", 
      "pacer_doc_id": "show_doc.pl"
    }, 
    {
      "date_filed": "2010-01-22", 
      "description": "Declaration re: of Yi Yong Oh in Support of Motion for Appointment of Examiner Filed by Creditor Center Bank, a California state chartered bank (RE: related document(s) 34 Motion to Appoint Examiner ). (Attachments: # 1 Exhibits A-C# 2 Exhibits D-F# 3 Exhibits G-I# 4 Exhibits J-L# 5 Exhibits M-N# 6 Exhibits O-Q# 7 Exhibit R# 8 Exhibit S# 9 Exhibit T# 10 Exhibits U-W# 11 Exhibits X-Y) (Polard, Steven) (Entered: 01/22/2010)", 
      "document_number": "37", 
      "pacer_doc_id": "show_doc.pl"
    }, 
    {
      "date_filed": "2010-01-22", 
      "description": "Declaration re: of Edmund King in Support of Motion for Appointment of Examiner Filed by Creditor Center Bank, a California state chartered bank (RE: related document(s) 34 Motion to Appoint Examiner ). (Attachments: # 1 Exhibits A & B) (Polard, Steven) (Entered: 01/22/2010)", 
      "document_number": "36", 
      "pacer_doc_id": "show_doc.pl"
    }, 
    {
      "date_filed": "2010-01-22", 
      "description": "Statement Appendix in Support of Motion for Appointment of Examiner Filed by Creditor Center Bank, a California state chartered bank. (Polard, Steven) (Entered: 01/22/2010)", 
      "document_number": "35", 
      "pacer_doc_id": "show_doc.pl"
    }, 
    {
      "date_filed": "2010-01-22", 
      "description": "Motion to Appoint Examiner Filed by Creditor Center Bank, a California state chartered bank (Polard, Steven) (Entered: 01/22/2010)", 
      "document_number": "34", 
      "pacer_doc_id": "show_doc.pl"
    }, 
    {
      "date_filed": "2010-01-22", 
      "description": "Application shortening time on Motion for Appointment of Receiver Filed by Creditor Center Bank, a California state chartered bank (Polard, Steven) (Entered: 01/22/2010)", 
      "document_number": "33", 
      "pacer_doc_id": "show_doc.pl"
    }, 
    {
      "date_filed": "2010-01-22", 
      "description": "Notice of Appointment of Creditors' Committee Filed by United States Trustee. (Law, Dare) (Entered: 01/22/2010)", 
      "document_number": "32", 
      "pacer_doc_id": "show_doc.pl"
    }, 
    {
      "date_filed": "2010-01-22", 
      "description": "Order (A) Granting Debtor's Emergency Motion For Use Of Cash Collateral On A Interim Basis Pending A Final Hearing; And (B) Approving Stipulation Between Debtor And Center Bank Regarding Interim Use Of Cash Collateral (see order for details) (Related Doc # 6 ) Signed on 1/22/2010 (Smith, Cynthia Joyce) (Entered: 01/22/2010)", 
      "document_number": "31", 
      "pacer_doc_id": "show_doc.pl"
    }, 
    {
      "date_filed": "2010-01-21", 
      "description": "BNC Certificate of Notice (RE: related document(s) 26 Case Commencement Deficiency Notice (BNC)) No. of Notices: 3. Service Date 01/21/2010. (Admin.) (Entered: 01/21/2010)", 
      "document_number": "30", 
      "pacer_doc_id": "show_doc.pl"
    }, 
    {
      "date_filed": "2010-01-21", 
      "description": "BNC Certificate of Notice (RE: related document(s) 1 Voluntary Petition (Chapter 11) filed by Debtor Central Metal, Inc.) No. of Notices: 5. Service Date 01/21/2010. (Admin.) (Entered: 01/21/2010)", 
      "document_number": "29", 
      "pacer_doc_id": "show_doc.pl"
    }, 
    {
      "date_filed": "2010-01-21", 
      "description": "Request for courtesy Notice of Electronic Filing (NEF) Filed by Dennis A Dressler on behalf of Center Capital Corporation. (Dressler, Dennis) (Entered: 01/21/2010)", 
      "document_number": "28", 
      "pacer_doc_id": "show_doc.pl"
    }, 
    {
      "date_filed": "2010-01-19", 
      "description": "Request for special notice Filed by Creditor Center Bank, a California state chartered bank. (Polard, Steven) (Entered: 01/19/2010)", 
      "document_number": "27", 
      "pacer_doc_id": "show_doc.pl"
    }, 
    {
      "date_filed": "2010-01-19", 
      "description": "Case Commencement Deficiency Notice to include Declaration re: Electronic Filing and exclude Statistical Summary (BNC) (RE: related document(s) 1 Voluntary Petition (Chapter 11) filed by Debtor Central Metal, Inc.) (Ventura, Olivia) (Entered: 01/19/2010)", 
      "document_number": "26", 
      "pacer_doc_id": "show_doc.pl"
    }, 
    {
      "date_filed": "2010-01-17", 
      "description": "BNC Certificate of Notice - PDF Document. (RE: related document(s) 21 Order on Motion Re: Chapter 11 First Day Motions) No. of Notices: 11. Service Date 01/17/2010. (Admin.) (Entered: 01/17/2010)", 
      "document_number": "25", 
      "pacer_doc_id": "show_doc.pl"
    }, 
    {
      "date_filed": "2010-01-17", 
      "description": "BNC Certificate of Notice - PDF Document. (RE: related document(s) 20 Order on Motion Re: Chapter 11 First Day Motions) No. of Notices: 11. Service Date 01/17/2010. (Admin.) (Entered: 01/17/2010)", 
      "document_number": "24", 
      "pacer_doc_id": "show_doc.pl"
    }, 
    {
      "date_filed": "2010-01-15", 
      "description": "BNC Certificate of Notice - PDF Document. (RE: related document(s) 14 Order (Generic)) No. of Notices: 7. Service Date 01/15/2010. (Admin.) (Entered: 01/15/2010)", 
      "document_number": "23", 
      "pacer_doc_id": "show_doc.pl"
    }, 
    {
      "date_filed": "2010-01-15", 
      "description": "BNC Certificate of Notice (RE: related document(s) 13 Meeting of Creditors Chapter 11 & 12) No. of Notices: 26. Service Date 01/15/2010. (Admin.) (Entered: 01/15/2010)", 
      "document_number": "22", 
      "pacer_doc_id": "show_doc.pl"
    }, 
    {
      "date_filed": "2010-01-15", 
      "description": "Order Granting Motion Debtor's Emergency Motion for entry of an Order Authorizing Debtor to Provide Adequate Assurance of Future Payment to Utility Companies Pursuant to 11 U.S.C. Section 366 (Related Doc # 5 ) Signed on 1/15/2010 (Kaaumoana, William) (Entered: 01/15/2010)", 
      "document_number": "21", 
      "pacer_doc_id": "show_doc.pl"
    }, 
    {
      "date_filed": "2010-01-15", 
      "description": "Order Granting Debtor's Emergency Motion for an order Extending Time for Debtor to (1) File Schedules of Assets and Liabilities and Statement of Financial Affairs; and (2) Submit Creditor Matrix (Related Doc # 4 ) Signed on 1/15/2010 (Kaaumoana, William) (Entered: 01/15/2010)", 
      "document_number": "20", 
      "pacer_doc_id": "show_doc.pl"
    }, 
    {
      "date_filed": "2010-01-15", 
      "description": "Request for courtesy Notice of Electronic Filing (NEF) Filed by Scott H Yun on behalf of Courtesy NEF. (Yun, Scott) (Entered: 01/15/2010)", 
      "document_number": "19", 
      "pacer_doc_id": "show_doc.pl"
    }, 
    {
      "date_filed": "2010-01-15", 
      "description": "Request for courtesy Notice of Electronic Filing (NEF) Filed by Jason E Goldstein on behalf of CIT Group/Equipment Financing, Inc. c/o Buchalter Nemer. (Goldstein, Jason) (Entered: 01/15/2010)", 
      "document_number": "18", 
      "pacer_doc_id": "show_doc.pl"
    }, 
    {
      "date_filed": "2010-01-14", 
      "description": "Request for special notice by Creditor Banc of America Leasing & Capital, LLC (with Proof of Service attached) Filed by Creditor Banc of America Leasing & Capital, LLC. (Alper, Andrew) (Entered: 01/14/2010)", 
      "document_number": "17", 
      "pacer_doc_id": "show_doc.pl"
    }, 
    {
      "date_filed": "2010-01-14", 
      "description": "Request for courtesy Notice of Electronic Filing (NEF) Filed by Andrew K Alper on behalf of Courtesy NEF. (Alper, Andrew) (Entered: 01/14/2010)", 
      "document_number": "16", 
      "pacer_doc_id": "show_doc.pl"
    }, 
    {
      "date_filed": "2010-01-14", 
      "description": "Stipulation By Central Metal, Inc. and Center Bank Regarding Interim Use of Cash Collateral Filed by Debtor Central Metal, Inc. (Oh, Juliet) (Entered: 01/14/2010)", 
      "document_number": "15", 
      "pacer_doc_id": "show_doc.pl"
    }, 
    {
      "date_filed": "2010-01-13", 
      "description": "Order: (1) Requiring Debtor-in-Possession to file report on status of reorganization case; (2) Setting hearing on status of reorganization case; and (3) Establishing procedure for requesting approval of disclosure statement and confirmation of plan; ORDERED that a status conference hearing is set for 2-25-10 at 9:30 a.m., Courtroom 1368 \"for additional information refer to image\" (Related Doc # 1 ) Signed on 1/13/2010 (Johnson, Tina R.) (Entered: 01/13/2010)", 
      "document_number": "14", 
      "pacer_doc_id": "show_doc.pl"
    }, 
    {
      "date_filed": "2010-01-13", 
      "description": "Meeting of Creditors 341(a) meeting to be held on 2/9/2010 at 11:00 AM at RM 2610, 725 S Figueroa St., Los Angeles, CA 90017. (Ly, Lynn) (Entered: 01/13/2010)", 
      "document_number": "13", 
      "pacer_doc_id": "show_doc.pl"
    }, 
    {
      "date_filed": "2010-01-13", 
      "description": "Declaration re: Telephonic Notice Re Hearing on Debtor's Emergency \"First Day\" Motions Filed by Debtor Central Metal, Inc. (RE: related document(s) 8 Notice of Hearing). (Oh, Juliet) (Entered: 01/13/2010)", 
      "document_number": "12", 
      "pacer_doc_id": "show_doc.pl"
    }, 
    {
      "date_filed": "2010-01-12", 
      "description": "Notice of motion/application Filed by Debtor Central Metal, Inc. (RE: related document(s) 10 Application to Employ C.T. Moffitt & Company and Charles T. Moffitt as Financial Consultants and Chief Restructuring Officer, respectively - Declaration of Charles T. Moffitt in Support Thereof Filed by Debtor Central Metal, Inc.). (Oh, Juliet) (Entered: 01/12/2010)", 
      "document_number": "11", 
      "pacer_doc_id": "show_doc.pl"
    }, 
    {
      "date_filed": "2010-01-12", 
      "description": "Application to Employ C.T. Moffitt & Company and Charles T. Moffitt as Financial Consultants and Chief Restructuring Officer, respectively - Declaration of Charles T. Moffitt in Support Thereof Filed by Debtor Central Metal, Inc. (Oh, Juliet) (Entered: 01/12/2010)", 
      "document_number": "10", 
      "pacer_doc_id": "show_doc.pl"
    }, 
    {
      "date_filed": "2010-01-12", 
      "description": "Request for courtesy Notice of Electronic Filing (NEF) Filed by Richard A Solomon on behalf of People's Capital & Leasing Corp.. (Solomon, Richard) (Entered: 01/12/2010)", 
      "document_number": "9", 
      "pacer_doc_id": "show_doc.pl"
    }, 
    {
      "date_filed": "2010-01-12", 
      "description": "Notice of Hearing on Debtor's Emergency \"First Day\" Motions Filed by Debtor Central Metal, Inc. (RE: related document(s) 4 Motion Regarding Chapter 11 First Day Motions - Debtor's Emergency Motion For an Order Extending Time for Debtor to, 5 Motion Regarding Chapter 11 First Day Motions - Debtor's Emergency Motion for Entry of an Order Authorizing Debtor to Provide Adequate Assurance of Future Payment to Utility Companies Pursuant to 11 U.S.C. Section 366; Memorandum of Points and Authorities; Declaration of Suk Won Byun in Support Thereof Filed by Debtor Central Metal, Inc., 6 Motion Regarding Chapter 11 First Day Motions - Debtor's Emergency Motion for Use of Cash Collateral on an Interim Basis Pending a Final Hearing; Memorandum of Points and Authorities; Declaration of Suk Won Byun in Support Thereof Filed by Debtor Central Metal, Inc.). (Oh, Juliet) (Entered: 01/12/2010)", 
      "document_number": "8", 
      "pacer_doc_id": "show_doc.pl"
    }, 
    {
      "date_filed": "2010-01-12", 
      "description": "Declaration re: - Declaration of Monica Y. Kim in Support of Debtor's Emergency Motion for Use of Cash Collateral on an Interim Basis Pending a Final Hearing Filed by Debtor Central Metal, Inc. (RE: related document(s) 6 Motion Regarding Chapter 11 First Day Motions - Debtor's Emergency Motion for Use of Cash Collateral on an Interim Basis Pending a Final Hearing; Memorandum of Points and Authorities; Declaration of Suk Won Byun in Support Thereof). (Oh, Juliet) (Entered: 01/12/2010)", 
      "document_number": "7", 
      "pacer_doc_id": "show_doc.pl"
    }, 
    {
      "date_filed": "2010-01-12", 
      "description": "Motion Regarding Chapter 11 First Day Motions - Debtor's Emergency Motion for Use of Cash Collateral on an Interim Basis Pending a Final Hearing; Memorandum of Points and Authorities; Declaration of Suk Won Byun in Support Thereof Filed by Debtor Central Metal, Inc. (Oh, Juliet) CORRECTION: Incorrect event code used. Correct event code: Emergency motion (motion). Modified on 1/13/2010 (Johnson, Tina R.). (Entered: 01/12/2010)", 
      "document_number": "6", 
      "pacer_doc_id": "show_doc.pl"
    }, 
    {
      "date_filed": "2010-01-12", 
      "description": "Motion Regarding Chapter 11 First Day Motions - Debtor's Emergency Motion for Entry of an Order Authorizing Debtor to Provide Adequate Assurance of Future Payment to Utility Companies Pursuant to 11 U.S.C. Section 366; Memorandum of Points and Authorities; Declaration of Suk Won Byun in Support Thereof Filed by Debtor Central Metal, Inc. (Oh, Juliet) CORRECTION: Incorrect event code used. Correct event code: Emergency motion (motion). Modified on 1/13/2010 (Johnson, Tina R.). (Entered: 01/12/2010)", 
      "document_number": "5", 
      "pacer_doc_id": "show_doc.pl"
    }, 
    {
      "date_filed": "2010-01-12", 
      "description": "Motion Regarding Chapter 11 First Day Motions - Debtor's Emergency Motion For an Order Extending Time for Debtor to (1) File Schedules of Assets and Liabilities and Statement of Financial Affairs; and (2) Submit Creditor Matrix; Memorandum of Points and Authorities; Declarations of Suk Won Byun and Charles T. Moffitt in Support Thereof Filed by Debtor Central Metal, Inc. (Oh, Juliet) CORRECTION: Incorrect event code used.Emergency motion (motion). Modified on 1/13/2010 (Johnson, Tina R.). (Entered: 01/12/2010)", 
      "document_number": "4", 
      "pacer_doc_id": "show_doc.pl"
    }, 
    {
      "date_filed": "2010-01-11", 
      "description": "Notice of motion/application Of Debtor And Debtor In Possession To Employ Levene, Neale, Bender, Rankin & Brill L.L.P. As Bankruptcy Counsel, with proof of service Filed by Debtor Central Metal, Inc. (RE: related document(s) 2 Application to Employ Levene, Neale, Bender, Rankin & Brill L.L.P. as Bankruptcy Counsel, with proof of service Filed by Debtor Central Metal, Inc.). (Kim, Monica) (Entered: 01/11/2010)", 
      "document_number": "3", 
      "pacer_doc_id": "show_doc.pl"
    }, 
    {
      "date_filed": "2010-01-11", 
      "description": "Application to Employ Levene, Neale, Bender, Rankin & Brill L.L.P. as Bankruptcy Counsel, with proof of service Filed by Debtor Central Metal, Inc. (Kim, Monica) (Entered: 01/11/2010)", 
      "document_number": "2", 
      "pacer_doc_id": "show_doc.pl"
    }, 
    {
      "date_filed": "2010-01-08", 
      "description": "Chapter 11 Voluntary Petition. Fee Amount $1039 Filed by Central Metal, Inc. Schedule A due 01/22/2010. Schedule B due 01/22/2010. Schedule C due 01/22/2010. Schedule D due 01/22/2010. Schedule E due 01/22/2010. Schedule F due 01/22/2010. Schedule G due 01/22/2010. Schedule H due 01/22/2010. Schedule I due 01/22/2010. Schedule J due 01/22/2010. Statement of Financial Affairs due 01/22/2010. Statement - Form 22B Due: 01/22/2010. Petition Prep Signature due 01/22/2010. Exhibit B due 01/22/2010. Notice of available chapters due 01/22/2010. Statement of assistance of non-attorney due 01/22/2010. Exhibit A due 01/22/2010. Summary of schedules due 01/22/2010. Declaration concerning debtors schedules due 01/22/2010. Disclosure of Compensation of Attorney for Debtor due 01/22/2010. Disclosure of compensation of bankruptcy petition preparer due 01/22/2010. Venue Disclosure Form due 01/22/2010. Decl. and Ntc. by Petition Preparer (Form 19) due by 01/22/2010. Statistical Summary due 01/22/2010. Exhibit D due 01/22/2010. Corporate Ownership Statement due by 01/22/2010. Cert. of Credit Counseling due by 01/22/2010. Debtor Certification of Employment Income due by 01/22/2010. Statement of Social Security Number(s) Form B21 due by 01/22/2010. Incomplete Filings due by 01/22/2010. (Oh, Juliet) CORRECTION: Incorrect deficiencies, satisfied un-needed deficiencies. Modified on 1/11/2010 (Lazo, Achilles). Deficient for: Declaration re: Electronic Filing due 01/22/2010. Deadline to file schedules and other documents has been extended to 2/2/2010. 20 Modified on 1/19/2010 (Ventura, Olivia). (Entered: 01/08/2010)", 
      "document_number": "1", 
      "pacer_doc_id": "show_doc.pl"
    }
  ], 
  "docket_number": "2:10-bk-10642", 
  "jurisdiction": null, 
  "jury_demand": null, 
  "nature_of_suit": null, 
  "parties": [
    {
      "attorneys": [
        {
          "contact": "10250 Constellation Blvd Ste 1700\nLos Angeles, CA 90067\n310-229-1234\nEmail: jyo@lnbrb.com\n", 
          "name": "Juliet Y Oh", 
          "roles": []
        }, 
        {
          "contact": "10250 Constellation Blvd Ste 1700\nLos Angeles, CA 90067\n310-229-1234\nEmail: myk@lnbrb.com\n", 
          "name": "Monica Y Kim", 
          "roles": []
        }
      ], 
      "extra_info": "8201 Santa Fe Avenue\nHuntington Park, CA 90255\nTax ID / EIN: 95-4413095", 
      "name": "Central Metal, Inc.", 
      "type": "Debtor"
    }, 
    {
      "attorneys": [
        {
          "contact": "725 S Figueroa St 26th Fl\nLos Angeles, CA 90017\n213-894-4925\nFax : 213-894-2603\nEmail: dare.law@usdoj.gov\n", 
          "name": "Dare Law", 
          "roles": []
        }
      ], 
      "extra_info": "725 S Figueroa St., 26th Floor\nLos Angeles, CA 90017", 
      "name": "United States Trustee (LA)", 
      "type": "U.S. Trustee"
    }, 
    {
      "attorneys": [
        {
          "contact": "1901 Ave of the Stars Ste 1200\nLos Angeles, CA 90067\n310-228-5750\nFax : 310-228-5788\nEmail: syun@stutman.com\n", 
          "name": "Scott H Yun", 
          "roles": []
        }
      ], 
      "extra_info": "", 
      "name": "Official Committee of Creditors Holding Unsecured Claims", 
      "type": "Creditor Committee"
    }
  ], 
  "referred_to_str": null
}