{
  "assigned_to_str": "Robert S. Bardwil", 
  "case_name": "Ronald M. Michaelsen, II", 
  "cause": null, 
  "court_id": "caeb", 
  "date_converted": null, 
  "date_discharged": null, 
  "date_filed": "2009-03-02", 
  "date_terminated": null, 
  "demand": null, 
  "docket_entries": [
    {
      "date_filed": "2009-03-02", 
      "description": "Chapter 13 Voluntary Petition All Schedules and Statements filed. (smis) (Entered: 03/02/2009)", 
      "document_number": "1", 
      "pacer_doc_id": "show_doc.pl"
    }, 
    {
      "date_filed": "2009-03-02", 
      "description": "Designation of Trustee (auto) (Entered: 03/02/2009)", 
      "document_number": "2", 
      "pacer_doc_id": "show_doc.pl"
    }, 
    {
      "date_filed": "2009-03-02", 
      "description": "Master Address List (auto) (Entered: 03/02/2009)", 
      "document_number": "3", 
      "pacer_doc_id": "show_doc.pl"
    }, 
    {
      "date_filed": "2009-03-02", 
      "description": "Statement of Social Security Number(s) (smis) (Entered: 03/02/2009)", 
      "document_number": "4", 
      "pacer_doc_id": "show_doc.pl"
    }, 
    {
      "date_filed": "2009-03-02", 
      "description": "Chapter 13 Plan (auto) (Entered: 03/02/2009)", 
      "document_number": "5", 
      "pacer_doc_id": "show_doc.pl"
    }, 
    {
      "date_filed": "2009-03-02", 
      "description": "Order Re: Chapter 13 Plan Payments, Adequate Protection Payments, and Employer Payment Advices (smis) (Entered: 03/02/2009)", 
      "document_number": "6", 
      "pacer_doc_id": "show_doc.pl"
    }, 
    {
      "date_filed": "2009-03-02", 
      "description": "Rights and Responsibilities of Chapter 13 Debtors and their Attorneys (auto) (Entered: 03/02/2009)", 
      "document_number": "7", 
      "pacer_doc_id": "show_doc.pl"
    }, 
    {
      "date_filed": "2009-03-02", 
      "description": "Notice of Transmittal of Employee Income Records (shbs) (Entered: 03/04/2009)", 
      "document_number": "8", 
      "pacer_doc_id": "show_doc.pl"
    }, 
    {
      "date_filed": "2009-03-13", 
      "description": "Request for Special Notice Filed by Creditor HSBC Bank Nevada, N.A. (shbs) (Entered: 03/13/2009)", 
      "document_number": "9", 
      "pacer_doc_id": "show_doc.pl"
    }, 
    {
      "date_filed": "2009-03-16", 
      "description": "Request to be Added to Mailing List by Wilshire Credit Corporation (shbs) (Entered: 03/16/2009)", 
      "document_number": "10", 
      "pacer_doc_id": "show_doc.pl"
    }, 
    {
      "date_filed": "2009-03-19", 
      "description": "Request for Special Notice Filed by Creditor GE Money Bank (shbs) (Entered: 03/19/2009)", 
      "document_number": "11", 
      "pacer_doc_id": "show_doc.pl"
    }, 
    {
      "date_filed": "2009-03-20", 
      "description": "Request for Special Notice Filed by Creditor Select Portfolio Servicing, Inc. (lbes) (Entered: 03/20/2009)", 
      "document_number": "12", 
      "pacer_doc_id": "show_doc.pl"
    }, 
    {
      "date_filed": "2009-03-20", 
      "description": "Certificate/Proof of Service of 12 Request for Special Notice (lbes) (Entered: 03/20/2009)", 
      "document_number": "13", 
      "pacer_doc_id": "show_doc.pl"
    }, 
    {
      "date_filed": "2009-03-27", 
      "description": "Copy of Chapter 13 Plan as transmitted to BNC for service. (Patton, Shelley) (Entered: 03/27/2009)", 
      "document_number": "14", 
      "pacer_doc_id": "show_doc.pl"
    }, 
    {
      "date_filed": "2009-03-27", 
      "description": "Notice of Commencement of Case Under Chapter 13, Meeting of Creditors and Deadlines as transmitted to BNC for service. Meeting of Creditors to be held on 4/22/2009 at 09:30 AM at Modesto Meeting Room. Proofs of Claim due by 7/21/2009. (Patton, Shelley) (Entered: 03/27/2009)", 
      "document_number": "15", 
      "pacer_doc_id": "show_doc.pl"
    }, 
    {
      "date_filed": "2009-03-27", 
      "description": "Certificate of Mailing of Chapter 13 Meeting Notice as provided by the Bankruptcy Noticing Center (Admin.) (Entered: 03/29/2009)", 
      "document_number": "16", 
      "pacer_doc_id": "show_doc.pl"
    }, 
    {
      "date_filed": "2009-03-27", 
      "description": "Certificate of Mailing of Copy of Chapter 13 Plan as provided by the Bankruptcy Noticing Center (Admin.) (Entered: 03/29/2009)", 
      "document_number": "17", 
      "pacer_doc_id": "show_doc.pl"
    }, 
    {
      "date_filed": "2009-04-02", 
      "description": "Amended Summary of Schedules Statistical Summary Schedule B Schedule C (Filing Fee Not Paid or Not Required) (shbs) (Entered: 04/02/2009)", 
      "document_number": "18", 
      "pacer_doc_id": "show_doc.pl"
    }, 
    {
      "date_filed": "2009-04-02", 
      "description": "Certificate/Proof of Service of 18 Summary/Schedule(s)/Statement of Financial Affairs/Intention/Disclosure (shbs) (Entered: 04/02/2009)", 
      "document_number": "19", 
      "pacer_doc_id": "show_doc.pl"
    }, 
    {
      "date_filed": "2009-04-06", 
      "description": "Motion/Application to Value Collateral of Wilshire [FW-1] Filed by Joint Debtor Laurie Inez Michaelsen, Debtor Ronald M. Michaelsen II (lbes) (Entered: 04/07/2009)", 
      "document_number": "20", 
      "pacer_doc_id": "show_doc.pl"
    }, 
    {
      "date_filed": "2009-04-06", 
      "description": "Notice of Hearing Re: 20 Motion/Application to Value Collateral of Wilshire [FW-1] to be held on 5/18/2009 at 09:00 AM at Sacramento Courtroom 28, Department A. (lbes) (Entered: 04/07/2009)", 
      "document_number": "21", 
      "pacer_doc_id": "show_doc.pl"
    }, 
    {
      "date_filed": "2009-04-06", 
      "description": "Declaration of Ronald Michaelsen II and Laurie Michaelsen in support of 20 Motion/Application to Value Collateral of Wilshire [FW-1] (lbes) (Entered: 04/07/2009)", 
      "document_number": "22", 
      "pacer_doc_id": "show_doc.pl"
    }, 
    {
      "date_filed": "2009-04-06", 
      "description": "Certificate/Proof of Service of 20 Motion/Application to Value Collateral of Wilshire [FW-1], 21 Notice of Hearing, 22 Declaration (lbes) (Entered: 04/07/2009)", 
      "document_number": "23", 
      "pacer_doc_id": "show_doc.pl"
    }, 
    {
      "date_filed": "2009-04-23", 
      "description": "Trustee's Report of 341 Meeting Concluded. (nkrs) (Entered: 04/23/2009)", 
      "document_number": "24", 
      "pacer_doc_id": "show_doc.pl"
    }, 
    {
      "date_filed": "2009-05-08", 
      "description": "Wage Order (shbs) (Entered: 05/08/2009)", 
      "document_number": "25", 
      "pacer_doc_id": "show_doc.pl"
    }, 
    {
      "date_filed": "2009-05-11", 
      "description": "Motion/Application for Relief from Stay [JAH-1] Filed by Creditor GEMB Lending Inc. (Fee Paid $150) (shbs) (Entered: 05/12/2009)", 
      "document_number": "26", 
      "pacer_doc_id": "show_doc.pl"
    }, 
    {
      "date_filed": "2009-05-11", 
      "description": "Notice of Hearing Re: 26 Motion/Application for Relief from Stay [JAH-1] to be held on 6/15/2009 at 09:00 AM at Sacramento Courtroom 28, Department A. (shbs) (Entered: 05/12/2009)", 
      "document_number": "27", 
      "pacer_doc_id": "show_doc.pl"
    }, 
    {
      "date_filed": "2009-05-11", 
      "description": "Declaration of Barry Wright in support of 26 Motion/Application for Relief from Stay [JAH-1] (shbs) (Entered: 05/12/2009)", 
      "document_number": "28", 
      "pacer_doc_id": "show_doc.pl"
    }, 
    {
      "date_filed": "2009-05-11", 
      "description": "Exhibit(s) To 28 Declaration [JAH-1] (shbs) (Entered: 05/12/2009)", 
      "document_number": "29", 
      "pacer_doc_id": "show_doc.pl"
    }, 
    {
      "date_filed": "2009-05-11", 
      "description": "Memorandum of Points and Authorities in support of 26 Motion/Application for Relief from Stay [JAH-1] (shbs) (Entered: 05/12/2009)", 
      "document_number": "30", 
      "pacer_doc_id": "show_doc.pl"
    }, 
    {
      "date_filed": "2009-05-11", 
      "description": "Movant's Information Sheet (Section 362) Re: 26 Motion/Application for Relief from Stay [JAH-1] (shbs) (Entered: 05/12/2009)", 
      "document_number": "31", 
      "pacer_doc_id": "show_doc.pl"
    }, 
    {
      "date_filed": "2009-05-11", 
      "description": "Certificate/Proof of Service of 26 Motion/Application for Relief from Stay [JAH-1], 27 Notice of Hearing, 28 Declaration, 29 Exhibit(s), 30 Memorandum of Points and Authorities, 31 Movant's Information Sheet (Section 362) (shbs) (Entered: 05/12/2009)", 
      "document_number": "32", 
      "pacer_doc_id": "show_doc.pl"
    }, 
    {
      "date_filed": "2009-05-18", 
      "description": "Civil Minutes -- Hearing/Motion Resolved without Oral Argument Re: 20 Motion/Application to Value Collateral of Wilshire [FW-1] GRANTED (shes) (Entered: 05/18/2009)", 
      "document_number": "33", 
      "pacer_doc_id": "show_doc.pl"
    }, 
    {
      "date_filed": "2009-05-18", 
      "description": "Change of Address for Chase Bank USA, N.A. (shbs) (Entered: 05/19/2009)", 
      "document_number": "34", 
      "pacer_doc_id": "show_doc.pl"
    }, 
    {
      "date_filed": "2009-06-03", 
      "description": "Order Granting 20 Motion/Application To Value Collateral of Wilshire [FW-1] (shbs) (Entered: 06/03/2009)", 
      "document_number": "35", 
      "pacer_doc_id": "show_doc.pl"
    }, 
    {
      "date_filed": "2009-06-03", 
      "description": "Order Confirming Chapter 13 Plan. (shbs) (Entered: 06/03/2009)", 
      "document_number": "36", 
      "pacer_doc_id": "show_doc.pl"
    }, 
    {
      "date_filed": "2009-06-04", 
      "description": "Notice of Requirement to Complete Course in Financial Management Course Certificate as Transmitted to BNC for Service. (Admin) (Entered: 06/04/2009)", 
      "document_number": "37", 
      "pacer_doc_id": "show_doc.pl"
    }, 
    {
      "date_filed": "2009-06-04", 
      "description": "Certificate of Mailing of Notice of Requirement to File a Statement of Completion of Course in Personal Financial Management as provided by the Bankruptcy Noticing Center (Admin.) (Entered: 06/06/2009)", 
      "document_number": "38", 
      "pacer_doc_id": "show_doc.pl"
    }, 
    {
      "date_filed": "2009-06-15", 
      "description": "Civil Minutes -- Hearing/Motion Resolved without Oral Argument Re: 26 Motion/Application for Relief from Stay [JAH-1] DISMISSED AS MOOT (shes) (Entered: 06/15/2009)", 
      "document_number": "39", 
      "pacer_doc_id": "show_doc.pl"
    }, 
    {
      "date_filed": "2009-06-16", 
      "description": "Civil Minute Order Dismissing 26 Motion/Application for Relief from Stay [JAH-1] (shbs) (Entered: 06/16/2009)", 
      "document_number": "40", 
      "pacer_doc_id": "show_doc.pl"
    }, 
    {
      "date_filed": "2009-07-21", 
      "description": "Notice of Intent to Transfer Claim as Transmitted to BNC for Service (stps) (Entered: 07/21/2009)", 
      "document_number": "41", 
      "pacer_doc_id": "show_doc.pl"
    }, 
    {
      "date_filed": "2009-07-21", 
      "description": "Certificate of Mailing of Notice of Intent to Transfer Claim as provided by the Bankruptcy Noticing Center (Admin.) (Entered: 07/23/2009)", 
      "document_number": "42", 
      "pacer_doc_id": "show_doc.pl"
    }, 
    {
      "date_filed": "2009-07-27", 
      "description": "Notice of Intent to Transfer Claim as Transmitted to BNC for Service (rmes) (Entered: 07/27/2009)", 
      "document_number": "43", 
      "pacer_doc_id": "show_doc.pl"
    }, 
    {
      "date_filed": "2009-07-27", 
      "description": "Certificate of Mailing of Notice of Intent to Transfer Claim as provided by the Bankruptcy Noticing Center (Admin.) (Entered: 07/29/2009)", 
      "document_number": "44", 
      "pacer_doc_id": "show_doc.pl"
    }, 
    {
      "date_filed": "2009-09-21", 
      "description": "Notice of Filed Claims Filed by Trustee Russell D. Greer (shbs) (Entered: 09/21/2009)", 
      "document_number": "45", 
      "pacer_doc_id": "show_doc.pl"
    }, 
    {
      "date_filed": "2009-09-21", 
      "description": "Certificate/Proof of Service of 45 Notice of Filed Claims (shbs) (Entered: 09/21/2009)", 
      "document_number": "46", 
      "pacer_doc_id": "show_doc.pl"
    }, 
    {
      "date_filed": "2009-10-13", 
      "description": "Request to be Added to Mailing List by Wilshire Credit Corporation (shbs) (Entered: 10/14/2009)", 
      "document_number": "47", 
      "pacer_doc_id": "show_doc.pl"
    }, 
    {
      "date_filed": "2009-11-12", 
      "description": "Assignment/Transfer of Claim from Ecast Settlement to Chase Bank USA, NA (psns) (Entered: 11/13/2009)", 
      "document_number": "48", 
      "pacer_doc_id": "show_doc.pl"
    }, 
    {
      "date_filed": "2009-11-13", 
      "description": "Notice of Intent to Transfer Claim From Transferor: eCAST Settlement Corporation (Claim No. 13) To Chase Bank USA NA As Submitted To BNC For Service. (psns) (Entered: 11/13/2009)", 
      "document_number": "49", 
      "pacer_doc_id": "show_doc.pl"
    }, 
    {
      "date_filed": "2009-11-13", 
      "description": "Certificate of Mailing of Transfer of Claim as provided by the Bankruptcy Noticing Center (Admin.) (Entered: 11/15/2009)", 
      "document_number": "50", 
      "pacer_doc_id": "show_doc.pl"
    }, 
    {
      "date_filed": "2009-11-13", 
      "description": "Notice of Withdrawal of Claim Number 23 (shbs) (Entered: 11/16/2009)", 
      "document_number": "51", 
      "pacer_doc_id": "show_doc.pl"
    }
  ], 
  "docket_number": "09-23551", 
  "jurisdiction": null, 
  "jury_demand": null, 
  "nature_of_suit": null, 
  "parties": [
    {
      "attorneys": [
        {
          "contact": "PO Box 830\nModesto, CA 95353-0830\n(209) 238-0946\n", 
          "name": "Ann Marie Friend", 
          "roles": []
        }
      ], 
      "extra_info": "1097 Brenda Lee Dr\nManteca, CA 95337\nSSN / ITIN: xxx-xx-6425", 
      "name": "Ronald M. Michaelsen, II", 
      "type": "Debtor"
    }, 
    {
      "attorneys": [
        {
          "contact": "PO Box 830\nModesto, CA 95353-0830\n(209) 238-0946\n", 
          "name": "Ann Marie Friend", 
          "roles": []
        }
      ], 
      "extra_info": "1097 Brenda Lee Dr\nManteca, CA 95337\nSSN / ITIN: xxx-xx-0319", 
      "name": "Laurie Inez Michaelsen", 
      "type": "Joint Debtor"
    }, 
    {
      "attorneys": [], 
      "extra_info": "PO Box 3051\nModesto, CA 95353-3051\n209-576-1954", 
      "name": "Russell D. Greer", 
      "type": "Trustee"
    }, 
    {
      "attorneys": [], 
      "extra_info": "Robert T Matsui United States Courthouse\n501 I Street, Room 7-500\nSacramento, CA 95814", 
      "name": "Office of the U.S. Trustee", 
      "type": "U.S. Trustee"
    }
  ], 
  "referred_to_str": null
}