{
  "assigned_to_str": "Peter W. Bowie",
  "case_name": "Sandahl Exports Corporation",
  "cause": "",
  "court_id": "casb",
  "date_converted": null,
  "date_discharged": null,
  "date_filed": "1995-06-01",
  "date_terminated": "2002-04-03",
  "demand": "",
  "docket_entries": [
    {
      "date_entered": "1995-06-16",
      "date_filed": "1995-06-01",
      "description": "Voluntary Petition All Sched&Stmts Filing Fees $ 160.00 Receipt # 13332 (Entered: 06/16/1995)",
      "document_number": "1",
      "pacer_doc_id": null,
      "pacer_seq_no": null
    },
    {
      "date_entered": "1995-06-16",
      "date_filed": "1995-06-01",
      "description": "Disclosure of Compensation By Attorney For Debtor In the Amount of $ 1160.00. (Entered: 06/16/1995)",
      "document_number": "1",
      "pacer_doc_id": null,
      "pacer_seq_no": null
    },
    {
      "date_entered": "1995-06-13",
      "date_filed": "1995-06-13",
      "description": "First Meeting of Creditors Scheduled For 9:00 7/10/95 At Wells Fargo Bldg. Rm. 450 (Entered: 06/13/1995)",
      "document_number": null,
      "pacer_doc_id": null,
      "pacer_seq_no": null
    },
    {
      "date_entered": "1995-06-16",
      "date_filed": "1995-06-15",
      "description": "Ex parte Application Filed By Debtor Sandahl Exports Corporation for order Compelling [a] attendance at examination and [b] production of documents (Entered: 06/16/1995)",
      "document_number": "2",
      "pacer_doc_id": null,
      "pacer_seq_no": null
    },
    {
      "date_entered": "1995-06-16",
      "date_filed": "1995-06-15",
      "description": "Declaration in support by: Steven A. Sandahl/ Debtor Sandahl Exports Corporation Re: [2-1] Ex parte Application for order Compelling [a] attendance at examination and [b] production of documents by Sandahl Exports Corporation (Entered: 06/16/1995)",
      "document_number": "3",
      "pacer_doc_id": null,
      "pacer_seq_no": null
    },
    {
      "date_entered": "1995-06-19",
      "date_filed": "1995-06-15",
      "description": "Notice of Appointment of Interim Trustee Harold Taxel (Entered: 06/19/1995)",
      "document_number": "4",
      "pacer_doc_id": null,
      "pacer_seq_no": null
    },
    {
      "date_entered": "1995-06-19",
      "date_filed": "1995-06-15",
      "description": "Courts Certificate of Mailing Re: [0-0] First Meeting # of notices: 104. (Entered: 06/19/1995)",
      "document_number": "5",
      "pacer_doc_id": null,
      "pacer_seq_no": null
    },
    {
      "date_entered": "1995-06-19",
      "date_filed": "1995-06-16",
      "description": "Order Granting [2-1] Application for order Compelling [a] attendance at examination and [b] production of documents by Sandahl Exports Corporation . (Entered: 06/19/1995)",
      "document_number": "6",
      "pacer_doc_id": null,
      "pacer_seq_no": null
    },
    {
      "date_entered": "1995-07-20",
      "date_filed": "1995-07-18",
      "description": "Ex parte Application Filed By Debtor Sandahl Exports Corporation for order approving late service of order compelling attendance of John Vandy at examination and requiring him to produce documents and answer questions (Entered: 07/20/1995)",
      "document_number": "7",
      "pacer_doc_id": null,
      "pacer_seq_no": null
    },
    {
      "date_entered": "1995-07-24",
      "date_filed": "1995-07-18",
      "description": "Ex parte Application Filed By Robert T. Pasulka for Debtor Sandahl Exports Corporation for order approving late service of order compelling attendance of John Vandy at examination and requiring him to produce documents and anser questions. (Entered: 07/24/1995)",
      "document_number": "9",
      "pacer_doc_id": null,
      "pacer_seq_no": null
    },
    {
      "date_entered": "1995-07-20",
      "date_filed": "1995-07-19",
      "description": "Order Granting [7-1] Ex parte Application for order approving late service of order compelling attendance of John Vandy at examination and requiring him to produce documents and answer questions by Sandahl Exports Corporation . (Entered: 07/20/1995)",
      "document_number": "8",
      "pacer_doc_id": null,
      "pacer_seq_no": null
    },
    {
      "date_entered": "1995-07-31",
      "date_filed": "1995-07-26",
      "description": "Trustee's Initial Report and First Meeting Held (Entered: 07/31/1995)",
      "document_number": "10",
      "pacer_doc_id": null,
      "pacer_seq_no": null
    },
    {
      "date_entered": "1995-07-31",
      "date_filed": "1995-07-28",
      "description": "Certificate Of Service By Robert T. Pasulka for Debtor Sandahl Exports Corporation Of [6-1] Order . (Entered: 07/31/1995)",
      "document_number": "11",
      "pacer_doc_id": null,
      "pacer_seq_no": null
    },
    {
      "date_entered": "1995-08-21",
      "date_filed": "1995-08-18",
      "description": "Declaration of disinterest by: Jeffrey A. Davis on behalf of himself and The Law Firm of Gray Cary Ware & Freidenrich/ Trustee Harold Taxel (Entered: 08/21/1995)",
      "document_number": "12",
      "pacer_doc_id": null,
      "pacer_seq_no": null
    },
    {
      "date_entered": "1995-08-21",
      "date_filed": "1995-08-18",
      "description": "Statement of Position by the U.S. Trustee Re: Employ Gray, Cary, Ware & Freidenrich as counsel by the U.S Trustee Has No Objection (Entered: 08/21/1995)",
      "document_number": "13",
      "pacer_doc_id": null,
      "pacer_seq_no": null
    },
    {
      "date_entered": "1995-08-29",
      "date_filed": "1995-08-27",
      "description": "Ex parte Application By Trustee Harold Taxel To Employ Gray Cary Ware & Freidenrich . (Entered: 08/29/1995)",
      "document_number": "14",
      "pacer_doc_id": null,
      "pacer_seq_no": null
    },
    {
      "date_entered": "1995-08-29",
      "date_filed": "1995-08-27",
      "description": "Order Granting [14-1] Application To Employ Gray Cary Ware & Freidenrich by Harold Taxel . (Entered: 08/29/1995)",
      "document_number": "14",
      "pacer_doc_id": null,
      "pacer_seq_no": null
    },
    {
      "date_entered": "1995-08-30",
      "date_filed": "1995-08-29",
      "description": "Ex parte Application Filed By Trustee Harold Taxel for order authorizing the trustee to use estate money (Entered: 08/30/1995)",
      "document_number": "15",
      "pacer_doc_id": null,
      "pacer_seq_no": null
    },
    {
      "date_entered": "1995-08-30",
      "date_filed": "1995-08-29",
      "description": "Certificate Of Service By Trustee Harold Taxel Of [15-1] Application for order authorizing the trustee to use estate money by Harold Taxel . (Entered: 08/30/1995)",
      "document_number": "16",
      "pacer_doc_id": null,
      "pacer_seq_no": null
    },
    {
      "date_entered": "1995-08-30",
      "date_filed": "1995-08-29",
      "description": "Declaration in by: John Vandy/ Creditor Terex Corporation Re (Entered: 08/30/1995)",
      "document_number": "17",
      "pacer_doc_id": null,
      "pacer_seq_no": null
    },
    {
      "date_entered": "1995-08-31",
      "date_filed": "1995-08-30",
      "description": "Supplemental Declaration of disinterest in by: Jeffrey A. Davis on behalf of himself and the law firm of Gray Cary Ware & Freidenrich (Entered: 08/31/1995)",
      "document_number": "18",
      "pacer_doc_id": null,
      "pacer_seq_no": null
    },
    {
      "date_entered": "1995-08-31",
      "date_filed": "1995-08-30",
      "description": "Certificate Of Service By Jeffrey A. Davis for Trustee Harold Taxel Of [18-1] Declaration by Jeffrey A. Davis . (Entered: 08/31/1995)",
      "document_number": "19",
      "pacer_doc_id": null,
      "pacer_seq_no": null
    },
    {
      "date_entered": "1995-09-06",
      "date_filed": "1995-09-05",
      "description": "Order Granting [15-1] Application for order authorizing the trustee to use estate money by Harold Taxel . (Entered: 09/06/1995)",
      "document_number": "20",
      "pacer_doc_id": null,
      "pacer_seq_no": null
    },
    {
      "date_entered": "1995-09-11",
      "date_filed": "1995-09-08",
      "description": "Notice of Motion by Trustee Harold Taxel Re: [tr moves the court for its order authorizing the sale to Hypac or overbidder of all the remaining inventory of the db free & clear of liens. (Entered: 09/11/1995)",
      "document_number": "21",
      "pacer_doc_id": null,
      "pacer_seq_no": null
    },
    {
      "date_entered": "1995-09-11",
      "date_filed": "1995-09-08",
      "description": "Notice of Hearing and [21-1] Notice of motion by Harold Taxel scheduled For 10:30 10/10/95 at Rm 328, Weinberger Courthouse [for sale of Hypac or overbidder] (Entered: 09/11/1995)",
      "document_number": "21",
      "pacer_doc_id": null,
      "pacer_seq_no": null
    },
    {
      "date_entered": "1995-09-11",
      "date_filed": "1995-09-08",
      "description": "Memorandum of points and authorities By Trustee Harold Taxel In Support Of [21-1] Motion Notice by Harold Taxel . (Entered: 09/11/1995)",
      "document_number": "22",
      "pacer_doc_id": null,
      "pacer_seq_no": null
    },
    {
      "date_entered": "1995-09-11",
      "date_filed": "1995-09-08",
      "description": "Declaration in support by: Troy Zander/ Trustee Harold Taxel Re: [21-1] Motion Notice by Harold Taxel (Entered: 09/11/1995)",
      "document_number": "23",
      "pacer_doc_id": null,
      "pacer_seq_no": null
    },
    {
      "date_entered": "1995-09-25",
      "date_filed": "1995-09-21",
      "description": "Statement of Position by the U.S. Trustee Re: [application by H. Taxel to employ R. Dean Johnson]-- the U.S Trustee Has No Objection (Entered: 09/25/1995)",
      "document_number": "24",
      "pacer_doc_id": null,
      "pacer_seq_no": null
    },
    {
      "date_entered": "1995-09-25",
      "date_filed": "1995-09-21",
      "description": "Certificate Of Service By R. Dean Johnson re appl to employ.. (Entered: 09/25/1995)",
      "document_number": "25",
      "pacer_doc_id": null,
      "pacer_seq_no": null
    },
    {
      "date_entered": "1995-09-26",
      "date_filed": "1995-09-21",
      "description": "Order Granted, To Employ accountant R. Dean Johnson . (Entered: 09/26/1995)",
      "document_number": "26",
      "pacer_doc_id": null,
      "pacer_seq_no": null
    },
    {
      "date_entered": "1995-10-11",
      "date_filed": "1995-10-10",
      "description": "Hearing Held Re: [21-1] Motion Notice by Harold Taxel, motion granted, ord/Zander (Entered: 10/11/1995)",
      "document_number": "27",
      "pacer_doc_id": null,
      "pacer_seq_no": null
    },
    {
      "date_entered": "1995-10-17",
      "date_filed": "1995-10-16",
      "description": "Order Granting [21-1] Motion Notice to sell property free and clear of interest by Harold Taxel . (Entered: 10/17/1995)",
      "document_number": "28",
      "pacer_doc_id": null,
      "pacer_seq_no": null
    },
    {
      "date_entered": "1995-12-11",
      "date_filed": "1995-12-11",
      "description": "Request by Trustee Fixing Claims Bar Date ; Last Date to File Proof of Claims 3/11/96 (Entered: 12/11/1995)",
      "document_number": null,
      "pacer_doc_id": null,
      "pacer_seq_no": null
    },
    {
      "date_entered": "1995-12-18",
      "date_filed": "1995-12-13",
      "description": "Order Fixing Last Date to File Claims and Notice Thereof. Service Date:12/13/95 ; Last Day to File Claims 3/11/96 ; With Service; # of Notices: 110 (Entered: 12/18/1995)",
      "document_number": "29",
      "pacer_doc_id": null,
      "pacer_seq_no": null
    },
    {
      "date_entered": "1995-12-18",
      "date_filed": "1995-12-14",
      "description": "Order, Granted For Examination of Imperial Bank & First Int'l Bank Under Rule 2004 . (Entered: 12/18/1995)",
      "document_number": "30",
      "pacer_doc_id": null,
      "pacer_seq_no": null
    },
    {
      "date_entered": "1995-12-21",
      "date_filed": "1995-12-20",
      "description": "Certificate Of Service By Trustee Harold Taxel Of [30-2] Order . (Entered: 12/21/1995)",
      "document_number": "31",
      "pacer_doc_id": null,
      "pacer_seq_no": null
    },
    {
      "date_entered": "1995-12-29",
      "date_filed": "1995-12-27",
      "description": "Motion By Trustee Harold Taxel For Examination of Steven Sandahl Under Rule 2004 (Entered: 12/29/1995)",
      "document_number": "32",
      "pacer_doc_id": null,
      "pacer_seq_no": null
    },
    {
      "date_entered": "1995-12-29",
      "date_filed": "1995-12-27",
      "description": "Order Granting [32-1] Motion For Examination of Steven Sandahl Under Rule 2004 by Harold Taxel . (Entered: 12/29/1995)",
      "document_number": "32",
      "pacer_doc_id": null,
      "pacer_seq_no": null
    },
    {
      "date_entered": "1996-01-26",
      "date_filed": "1996-01-25",
      "description": "Motion By other professional Steven A. Sandahl For Protective Order (Entered: 01/26/1996)",
      "document_number": "33",
      "pacer_doc_id": null,
      "pacer_seq_no": null
    },
    {
      "date_entered": "1996-01-26",
      "date_filed": "1996-01-25",
      "description": "Notice of ex parte Motion by other professional Steven A. Sandahl Re: [33-1] Motion For Protective Order by Steven A. Sandahl. [NOTE: To be ntcd after OST has been reviewed. [There is NO hearing date & time set w/in this ntc.] (Entered: 01/26/1996)",
      "document_number": "33",
      "pacer_doc_id": null,
      "pacer_seq_no": null
    },
    {
      "date_entered": "1996-01-26",
      "date_filed": "1996-01-25",
      "description": "ExApplication Filed By other professional Steven A. Sandahl shortening Time for service (Entered: 01/26/1996)",
      "document_number": "34",
      "pacer_doc_id": null,
      "pacer_seq_no": null
    },
    {
      "date_entered": "1996-01-26",
      "date_filed": "1996-01-25",
      "description": "Declaration in support by: Melissa W. Cook for other professional Steven A. Sandahl Re: [34-1] Application shortening Time for service by Steven A. Sandahl (Entered: 01/26/1996)",
      "document_number": "35",
      "pacer_doc_id": null,
      "pacer_seq_no": null
    },
    {
      "date_entered": "1996-01-26",
      "date_filed": "1996-01-25",
      "description": "Memorandum of points and authorities By Melissa W. Cook for other professional Steven A. Sandahl In Support Of [34-1] Application shortening Time for service by Steven A. Sandahl . (Entered: 01/26/1996)",
      "document_number": "36",
      "pacer_doc_id": null,
      "pacer_seq_no": null
    },
    {
      "date_entered": "1996-01-26",
      "date_filed": "1996-01-25",
      "description": "Declaration in support by: Melissa W. Cook for other professional Steven A. Sandahl Re: [34-1] Application shortening Time for service by Steven A. Sandahl (Entered: 01/26/1996)",
      "document_number": "37",
      "pacer_doc_id": null,
      "pacer_seq_no": null
    },
    {
      "date_entered": "1996-01-26",
      "date_filed": "1996-01-25",
      "description": "Declaration in support by: other professional Steven A. Sandahl Re: [33-1] Motion For Protective Order by Steven A. Sandahl (Entered: 01/26/1996)",
      "document_number": "38",
      "pacer_doc_id": null,
      "pacer_seq_no": null
    },
    {
      "date_entered": "1996-01-26",
      "date_filed": "1996-01-25",
      "description": "Notice Re:, of transcrip in support of ex parte motion for protective order [0-0] by other professional Steven A. Sandahl (Entered: 01/26/1996)",
      "document_number": "39",
      "pacer_doc_id": null,
      "pacer_seq_no": null
    },
    {
      "date_entered": "1996-02-06",
      "date_filed": "1996-01-26",
      "description": "Certificate Of Service By Scott Stevens Of various pleadings. [refer to file for details]. (Entered: 02/06/1996)",
      "document_number": "41",
      "pacer_doc_id": null,
      "pacer_seq_no": null
    },
    {
      "date_entered": "1996-02-06",
      "date_filed": "1996-01-29",
      "description": "Response By Trustee Harold Taxel To [33-1] Steven Sandahl's Motion For Protective Order by Steven A. Sandahl . (Entered: 02/06/1996)",
      "document_number": "40",
      "pacer_doc_id": null,
      "pacer_seq_no": null
    },
    {
      "date_entered": "1996-02-06",
      "date_filed": "1996-01-31",
      "description": "Opposition by Creditor Terex Corporation to [33-1] Motion For Protective Order by Steven A. Sandahl (Entered: 02/06/1996)",
      "document_number": "42",
      "pacer_doc_id": null,
      "pacer_seq_no": null
    },
    {
      "date_entered": "1996-02-06",
      "date_filed": "1996-02-02",
      "description": "Ex Parte Order NOT APPROVED, shortening Time for service of notice of emergency motion for protective order Filed by Melissa Cook. . (Entered: 02/06/1996)",
      "document_number": "43",
      "pacer_doc_id": null,
      "pacer_seq_no": null
    },
    {
      "date_entered": "1996-02-09",
      "date_filed": "1996-02-05",
      "description": "Amended Schedules d,e,f,matrix,summary And Certificate of Service. Filing Fees $ 20.00 Receipt # 29552 (Entered: 02/09/1996)",
      "document_number": "44",
      "pacer_doc_id": null,
      "pacer_seq_no": null
    },
    {
      "date_entered": "1996-02-09",
      "date_filed": "1996-02-05",
      "description": "Notice to Creditors Listed in Amendment Re: [44-1] Amended Schedules (Entered: 02/09/1996)",
      "document_number": "45",
      "pacer_doc_id": null,
      "pacer_seq_no": null
    },
    {
      "date_entered": "1996-09-23",
      "date_filed": "1996-09-20",
      "description": "Final Application By accountant R. Dean Johnson, CPA For allowance of Compensation and reimbursement of expenses as accountant for Harold Taxel, trustee of debtor. . (Entered: 09/23/1996)",
      "document_number": "46",
      "pacer_doc_id": null,
      "pacer_seq_no": null
    },
    {
      "date_entered": "1996-09-26",
      "date_filed": "1996-09-23",
      "description": "First Application By Trustee Harold Taxel For allowance of fees and reimbursement of expenses by Gray Cary Ware & Freidenrich, counsel fr the chapter 7 trustee. . (Entered: 09/26/1996)",
      "document_number": "47",
      "pacer_doc_id": null,
      "pacer_seq_no": null
    },
    {
      "date_entered": "1996-09-26",
      "date_filed": "1996-09-23",
      "description": "Notice of Hearing Re: [47-1] Application For allowance of fees and reimbursement of expenses by Gray Cary Ware & Freidenrich, counsel fr the chapter 7 trustee. by Harold Taxel, [46-1] Application For allowance of Compensation and reimbursement of expenses as accountant for Harold Taxel, trustee of debtor. by R. Dean Johnson, CPA scheduled For 10:30 10/21/96 at Rm 328, Weinberger Courthouse (Entered: 09/26/1996)",
      "document_number": "48",
      "pacer_doc_id": null,
      "pacer_seq_no": null
    },
    {
      "date_entered": "1996-10-28",
      "date_filed": "1996-10-21",
      "description": "Hearing Held Re: [47-1] Application For allowance of fees and reimbursement of expenses by Gray Cary Ware & Freidenrich, counsel fr the chapter 7 trustee. by Harold Taxel, [Applicant 1 Gray, Cary Fees allowed $42,824.50 Fees Approved $34,259.60 Costs $1848.42. [46-1] Application For allowance of Compensation and reimbursement of expenses as accountant for Harold Taxel, trustee of debtor. by R. Dean Johnson, CPA Applicant Johnson: Fees Allowed $3099 Fees Approved $3099- Costs $84.23 + $500 for year end tax work. Order by Zander (Entered: 10/28/1996)",
      "document_number": "49",
      "pacer_doc_id": null,
      "pacer_seq_no": null
    },
    {
      "date_entered": "1996-10-29",
      "date_filed": "1996-10-24",
      "description": "Order Granting [47-1] Application For allowance of fees and reimbursement of expenses by Gray Cary Ware & Freidenrich, counsel fr the chapter 7 trustee. by Harold Taxel payment to Gray Cary Ware & Freidenrich of $42824.50 in fees and $1848.42 in expenses . (Entered: 10/29/1996)",
      "document_number": "50",
      "pacer_doc_id": null,
      "pacer_seq_no": null
    },
    {
      "date_entered": "1996-11-22",
      "date_filed": "1996-11-21",
      "description": "Complaint [96-90891] Harold Taxel vs. L.B. Smith . NOS 454 Recover Money/Property . Filing Fee $ 120.00 Receipt # 51644 (Entered: 11/22/1996)",
      "document_number": null,
      "pacer_doc_id": null,
      "pacer_seq_no": null
    },
    {
      "date_entered": "1996-11-22",
      "date_filed": "1996-11-21",
      "description": "Complaint [96-90894] Harold S. Taxel vs. Votainer USA . NOS 454 Recover Money/Property . Filing Fee $ 120.00 Receipt # 51651 (Entered: 11/22/1996)",
      "document_number": null,
      "pacer_doc_id": null,
      "pacer_seq_no": null
    },
    {
      "date_entered": "1996-11-22",
      "date_filed": "1996-11-21",
      "description": "Complaint [96-90890] Harold Taxel vs. Filter Products Corporation . NOS 454 Recover Money/Property . Filing Fee $ 120.00 Receipt # 51641 (Entered: 11/22/1996)",
      "document_number": null,
      "pacer_doc_id": null,
      "pacer_seq_no": null
    },
    {
      "date_entered": "1996-11-22",
      "date_filed": "1996-11-21",
      "description": "Complaint [96-90889] Harold Taxel vs. Macwhyte Company . NOS 454 Recover Money/Property . Filing Fee $ 120.00 Receipt # 51640 (Entered: 11/22/1996)",
      "document_number": null,
      "pacer_doc_id": null,
      "pacer_seq_no": null
    },
    {
      "date_entered": "1996-11-22",
      "date_filed": "1996-11-21",
      "description": "Complaint [96-90893] Harold S. Taxel vs. General Diesel and Electronics, Inc., a . NOS 454 Recover Money/Property . Filing Fee $ 120.00 Receipt # 51647 (Entered: 11/22/1996)",
      "document_number": null,
      "pacer_doc_id": null,
      "pacer_seq_no": null
    },
    {
      "date_entered": "1996-11-22",
      "date_filed": "1996-11-21",
      "description": "Complaint [96-90888] Harold S. Taxel, Trustee vs. Desert Wheel Co., A Neveda Corp. NOS 454 Recover Money/Property . Filing Fee $ 120.00 Receipt # 51638 (Entered: 11/22/1996)",
      "document_number": null,
      "pacer_doc_id": null,
      "pacer_seq_no": null
    },
    {
      "date_entered": "1996-11-22",
      "date_filed": "1996-11-21",
      "description": "Complaint [96-90892] Harold S. Taxel vs. Svedala Industries Canada, Inc. . NOS 454 Recover Money/Property . Filing Fee $ 120.00 Receipt # 51646 (Entered: 11/22/1996)",
      "document_number": null,
      "pacer_doc_id": null,
      "pacer_seq_no": null
    },
    {
      "date_entered": "1996-11-22",
      "date_filed": "1996-11-21",
      "description": "Complaint [96-90887] Harold S. Taxel vs. King Bearing, Inc., a California Corp. . NOS 454 Recover Money/Property . Filing Fee $ 120.00 Receipt # 51636 (Entered: 11/22/1996)",
      "document_number": null,
      "pacer_doc_id": null,
      "pacer_seq_no": null
    },
    {
      "date_entered": "1996-11-22",
      "date_filed": "1996-11-21",
      "description": "Complaint [96-90886] Harold S. Taxel vs. Waukesha Pearce . NOS 454 Recover Money/Property . Filing Fee $ 120.00 Receipt # 51635 (Entered: 11/22/1996)",
      "document_number": null,
      "pacer_doc_id": null,
      "pacer_seq_no": null
    },
    {
      "date_entered": "1996-11-22",
      "date_filed": "1996-11-21",
      "description": "Complaint [96-90885] Harold S. Taxel vs. Lubrication Equipment & Supply . NOS 454 Recover Money/Property . Filing Fee $ 120.00 Receipt # 51632 (Entered: 11/22/1996)",
      "document_number": null,
      "pacer_doc_id": null,
      "pacer_seq_no": null
    },
    {
      "date_entered": "1997-04-29",
      "date_filed": "1996-11-21",
      "description": "Complaint [96-90894] Harold S. Taxel vs. Votainer USA . NOS 454 Recover Money/Property . Filing Fee $ 120.00 Receipt # 51651 (Entered: 04/29/1997)",
      "document_number": null,
      "pacer_doc_id": null,
      "pacer_seq_no": null
    },
    {
      "date_entered": "1996-12-30",
      "date_filed": "1996-12-27",
      "description": "Notice by Trustee Harold Taxel of Intent to Compromise or Settle Controversy ; Last Day For Objections 1/27/97 (Entered: 12/30/1996)",
      "document_number": "51",
      "pacer_doc_id": null,
      "pacer_seq_no": null
    },
    {
      "date_entered": "1997-01-16",
      "date_filed": "1997-01-15",
      "description": "Complaint [97-90039] Harold S. Taxel vs. County Wholesale Electric Co . NOS 454 Recover Money/Property . Filing Fee $ 120.00 Receipt # 55257 (Entered: 01/16/1997)",
      "document_number": null,
      "pacer_doc_id": null,
      "pacer_seq_no": null
    },
    {
      "date_entered": "1997-01-16",
      "date_filed": "1997-01-15",
      "description": "Complaint [97-90039] Harold S. Taxel vs. County Wholesale Electric Co . NOS 454 Recover Money/Property . Filing Fee $ 120.00 Receipt # 55257 (Entered: 01/16/1997)",
      "document_number": null,
      "pacer_doc_id": null,
      "pacer_seq_no": null
    },
    {
      "date_entered": "1997-01-16",
      "date_filed": "1997-01-15",
      "description": "Complaint [97-90040] Harold S. Taxel vs. Svedala Pumps & Process . NOS 454 Recover Money/Property . Filing Fee $ 150.00 Receipt # 55258 (Entered: 01/16/1997)",
      "document_number": null,
      "pacer_doc_id": null,
      "pacer_seq_no": null
    },
    {
      "date_entered": "1997-01-22",
      "date_filed": "1997-01-21",
      "description": "Order Granted, For authorizing rule 2004 Examination of Dena Cope/Terex filed by Harold Taxel trustee.. (Entered: 01/22/1997)",
      "document_number": "52",
      "pacer_doc_id": null,
      "pacer_seq_no": null
    },
    {
      "date_entered": "1997-01-29",
      "date_filed": "1997-01-27",
      "description": "Motion By Creditor Terex Corporation For order limiting order authorizing rule 2004 Examination and for protective order re: [Terex Employee] Under Rule 2004 And for memorandum of points and authorities in support thereof. (Entered: 01/29/1997)",
      "document_number": "53",
      "pacer_doc_id": null,
      "pacer_seq_no": null
    },
    {
      "date_entered": "1997-01-29",
      "date_filed": "1997-01-27",
      "description": "Notice of Motion by: Creditor Terex Corporation With Hearing Re: [53-1] Motion For order limiting order authorizing rule 2004 Examination and for protective order re: [Terex Employee] Under Rule 2004 by Terex Corporation scheduled For 10:00 2/24/97 at Rm 328, Weinberger Courthouse ; (Entered: 01/29/1997)",
      "document_number": "54",
      "pacer_doc_id": null,
      "pacer_seq_no": null
    },
    {
      "date_entered": "1997-01-29",
      "date_filed": "1997-01-27",
      "description": "Declaration in support by: Susan C. Stevenson for Creditor Terex Corporation Re: [53-1] Motion For order limiting order authorizing rule 2004 Examination and for protective order re: [Terex Employee] Under Rule 2004 by Terex Corporation (Entered: 01/29/1997)",
      "document_number": "55",
      "pacer_doc_id": null,
      "pacer_seq_no": null
    },
    {
      "date_entered": "1997-02-03",
      "date_filed": "1997-01-31",
      "description": "Order Granting [51-1] Intent Notice by Harold Taxel . (Entered: 02/03/1997)",
      "document_number": "56",
      "pacer_doc_id": null,
      "pacer_seq_no": null
    },
    {
      "date_entered": "1997-02-03",
      "date_filed": "1997-02-03",
      "description": "Disposition of Adversary [96-90892] Granting [1-1] Complaint NOS 454 Recover Money/Property (Entered: 02/03/1997)",
      "document_number": null,
      "pacer_doc_id": null,
      "pacer_seq_no": null
    },
    {
      "date_entered": "1997-02-03",
      "date_filed": "1997-02-03",
      "description": "Adversary Case [96-90892] Closed. [95-05684] (Entered: 02/03/1997)",
      "document_number": null,
      "pacer_doc_id": null,
      "pacer_seq_no": null
    },
    {
      "date_entered": "1997-02-05",
      "date_filed": "1997-02-05",
      "description": "Notice by Trustee Harold Taxel of Intent to compromise/settle preference claims ; Last Day For Objections 3/7/97.[for details refer to file] (Entered: 02/05/1997)",
      "document_number": "57",
      "pacer_doc_id": null,
      "pacer_seq_no": null
    },
    {
      "date_entered": "1997-02-10",
      "date_filed": "1997-02-07",
      "description": "Complaint [97-90099] Harold S. Taxel vs. Ingersoll-Rand . NOS 454 Recover Money/Property . Filing Fee $ 150.00 Receipt # 57114 (Entered: 02/10/1997)",
      "document_number": null,
      "pacer_doc_id": null,
      "pacer_seq_no": null
    },
    {
      "date_entered": "1997-02-10",
      "date_filed": "1997-02-10",
      "description": "Disposition of Adversary [96-90888] Granting [1-1] Complaint NOS 454 Recover Money/Property (Entered: 02/10/1997)",
      "document_number": null,
      "pacer_doc_id": null,
      "pacer_seq_no": null
    },
    {
      "date_entered": "1997-02-10",
      "date_filed": "1997-02-10",
      "description": "Adversary Case [96-90888] Closed. (Entered: 02/10/1997)",
      "document_number": null,
      "pacer_doc_id": null,
      "pacer_seq_no": null
    },
    {
      "date_entered": "1997-02-10",
      "date_filed": "1997-02-10",
      "description": "Disposition of Adversary [96-90890] Granting [1-1] Complaint NOS 454 Recover Money/Property (Entered: 02/10/1997)",
      "document_number": null,
      "pacer_doc_id": null,
      "pacer_seq_no": null
    },
    {
      "date_entered": "1997-02-10",
      "date_filed": "1997-02-10",
      "description": "Adversary Case [96-90890] Closed. [95-05684] (Entered: 02/10/1997)",
      "document_number": null,
      "pacer_doc_id": null,
      "pacer_seq_no": null
    },
    {
      "date_entered": "1997-02-11",
      "date_filed": "1997-02-10",
      "description": "Opposition by Trustee Harold Taxel to [53-1] Motion For order limiting order authorizing rule 2004 Examination and for protective order re: [Terex Employee] Under Rule 2004 by Terex Corporation, [52-2] Order (Entered: 02/11/1997)",
      "document_number": "58",
      "pacer_doc_id": null,
      "pacer_seq_no": null
    },
    {
      "date_entered": "1997-02-13",
      "date_filed": "1997-02-13",
      "description": "Disposition of Adversary [96-90886] Dismissing [1-1] Complaint NOS 454 Recover Money/Property (Entered: 02/13/1997)",
      "document_number": null,
      "pacer_doc_id": null,
      "pacer_seq_no": null
    },
    {
      "date_entered": "1997-02-13",
      "date_filed": "1997-02-13",
      "description": "Adversary Case [96-90886] Closed. [95-05684] (Entered: 02/13/1997)",
      "document_number": null,
      "pacer_doc_id": null,
      "pacer_seq_no": null
    },
    {
      "date_entered": "1997-02-13",
      "date_filed": "1997-02-13",
      "description": "Disposition of Adversary [96-90891] Dismissing [1-1] Complaint NOS 454 Recover Money/Property (Entered: 02/13/1997)",
      "document_number": null,
      "pacer_doc_id": null,
      "pacer_seq_no": null
    },
    {
      "date_entered": "1997-02-13",
      "date_filed": "1997-02-13",
      "description": "Adversary Case [96-90891] Closed. [95-05684] (Entered: 02/13/1997)",
      "document_number": null,
      "pacer_doc_id": null,
      "pacer_seq_no": null
    },
    {
      "date_entered": "1997-02-20",
      "date_filed": "1997-02-16",
      "description": "Reply By Creditor Terex Corporation To [58-1] Opposition by Harold Taxel . (Entered: 02/20/1997)",
      "document_number": "59",
      "pacer_doc_id": null,
      "pacer_seq_no": null
    },
    {
      "date_entered": "1997-02-19",
      "date_filed": "1997-02-18",
      "description": "Complaint [97-90128] Harold S. Taxel vs. Zia Mian . NOS 454 Recover Money/Property . Filing Fee $ 150.00 Receipt # 57765 (Entered: 02/19/1997)",
      "document_number": null,
      "pacer_doc_id": null,
      "pacer_seq_no": null
    },
    {
      "date_entered": "1997-02-19",
      "date_filed": "1997-02-18",
      "description": "Complaint [97-90129] Harold S. Taxel vs. Graham Jones . NOS 454 Recover Money/Property . Filing Fee $ 150.00 Receipt # 57768 (Entered: 02/19/1997)",
      "document_number": null,
      "pacer_doc_id": null,
      "pacer_seq_no": null
    },
    {
      "date_entered": "1997-02-20",
      "date_filed": "1997-02-18",
      "description": "Declaration in support by: John Vandy/ Creditor Terex Corporation Re: [59-1] Response by Terex Corporation (Entered: 02/20/1997)",
      "document_number": "60",
      "pacer_doc_id": null,
      "pacer_seq_no": null
    },
    {
      "date_entered": "1997-02-20",
      "date_filed": "1997-02-18",
      "description": "Declaration in support by:Dena Cope/ Creditor Terex Corporation Re: [59-1] Response by Terex Corporation (Entered: 02/20/1997)",
      "document_number": "61",
      "pacer_doc_id": null,
      "pacer_seq_no": null
    },
    {
      "date_entered": "1997-02-20",
      "date_filed": "1997-02-18",
      "description": "Declaration in support by: Howard Jaffe/ Creditor Terex Corporation Re: [59-1] Response by Terex Corporation (Entered: 02/20/1997)",
      "document_number": "62",
      "pacer_doc_id": null,
      "pacer_seq_no": null
    },
    {
      "date_entered": "1997-02-20",
      "date_filed": "1997-02-18",
      "description": "Declaration in support by: Joel Stutts/ Creditor Terex Corporation Re: [59-1] Response by Terex Corporation (Entered: 02/20/1997)",
      "document_number": "63",
      "pacer_doc_id": null,
      "pacer_seq_no": null
    },
    {
      "date_entered": "1997-02-27",
      "date_filed": "1997-02-21",
      "description": "Declaration in support by: Susan C. Stevenson for Creditor Terex Corporation Re: [59-1] Reply by Terex Corporation to opposition to motion for order limiting order authorizing rule 2004 examination and for protective order. (Entered: 02/27/1997)",
      "document_number": "68",
      "pacer_doc_id": null,
      "pacer_seq_no": null
    },
    {
      "date_entered": "1997-02-25",
      "date_filed": "1997-02-24",
      "description": "Hearing Held Re: [53-1] Motion For order limiting order authorizing rule 2004 Examination and for protective order re: [Terex Employee] Under Rule 2004 by Terex Corporation . Tex Corp is to turn over to the trustee the 200 boxes of documents they currently hold. Terex may idenfity & with hold those docs which do not belong to the Sandahl estate. They are to create a log of the w/held docs & file a mtn for protective order if needed. Order by Stevenson. (Entered: 02/25/1997)",
      "document_number": "64",
      "pacer_doc_id": null,
      "pacer_seq_no": null
    },
    {
      "date_entered": "1997-02-27",
      "date_filed": "1997-02-24",
      "description": "Evidentiary objection by Trustee Harold Taxel to [60-1] Declaration by John Vandy/ Terex Corporation (Entered: 02/27/1997)",
      "document_number": "65",
      "pacer_doc_id": null,
      "pacer_seq_no": null
    },
    {
      "date_entered": "1997-02-27",
      "date_filed": "1997-02-24",
      "description": "Objection by Trustee Harold Taxel to [63-1] Declaration by Joel Stutts/ Terex Corporation (Entered: 02/27/1997)",
      "document_number": "66",
      "pacer_doc_id": null,
      "pacer_seq_no": null
    },
    {
      "date_entered": "1997-02-27",
      "date_filed": "1997-02-24",
      "description": "Objection by Trustee Harold Taxel Trustee Harold Taxelto [62-1] Declaration Howard Jaffe/ by Terex Corporation (Entered: 02/27/1997)",
      "document_number": "67",
      "pacer_doc_id": null,
      "pacer_seq_no": null
    },
    {
      "date_entered": "1997-02-26",
      "date_filed": "1997-02-25",
      "description": "Complaint [97-99889] Harold S. Taxel vs. Crown Parts & Machine Inc . NOS 454 Recover Money/Property . Filing Fee $ 150.00 Receipt # 58488 (Entered: 02/26/1997)",
      "document_number": null,
      "pacer_doc_id": null,
      "pacer_seq_no": null
    },
    {
      "date_entered": "1997-02-26",
      "date_filed": "1997-02-25",
      "description": "Complaint [97-90153] Harold S. Taxel vs. Celadon-Jacky Maeder Company . NOS 454 Recover Money/Property . Filing Fee $ 150.00 Receipt # 58486 (Entered: 02/26/1997)",
      "document_number": null,
      "pacer_doc_id": null,
      "pacer_seq_no": null
    },
    {
      "date_entered": "1997-03-12",
      "date_filed": "1997-03-11",
      "description": "Ex parte Application Filed By Trustee Harold Taxel To shorten Time forr hearing on motion to compel production of documents, to compel appearance after production, and for contempt sanctions (Entered: 03/12/1997)",
      "document_number": "69",
      "pacer_doc_id": null,
      "pacer_seq_no": null
    },
    {
      "date_entered": "1997-03-12",
      "date_filed": "1997-03-11",
      "description": "Order Granting [69-1] Ex parte Application To shorten Time forr hearing on motion to compel production of documents, to compel appearance after production, and for contempt sanctions by Harold Taxel . (Entered: 03/12/1997)",
      "document_number": "69",
      "pacer_doc_id": null,
      "pacer_seq_no": null
    },
    {
      "date_entered": "1997-03-12",
      "date_filed": "1997-03-11",
      "description": "Hearing Re: [69-1] Order w/ex parte application to shorten time for hearing scheduled For 2:30 3/20/97 at Rm 328, Weinberger Courthouse (Entered: 03/12/1997)",
      "document_number": null,
      "pacer_doc_id": null,
      "pacer_seq_no": null
    },
    {
      "date_entered": "1997-03-12",
      "date_filed": "1997-03-11",
      "description": "Declaration in support by: Leslie T. Rubin/ Trustee Harold Taxel Re: [69-1] Application To shorten Time forr hearing on motion to compel production of documents, to compel appearance after production, and for contempt sanctions by Harold Taxel (Entered: 03/12/1997)",
      "document_number": "70",
      "pacer_doc_id": null,
      "pacer_seq_no": null
    },
    {
      "date_entered": "1997-03-12",
      "date_filed": "1997-03-11",
      "description": "Order Granted, For Examination of Chase Manhattan Bank, Citibank, N.A. and First Interstate Bank of Arizona Under Rule 2004 Filed by Harold Taxel, chapter 7 trustee. . (Entered: 03/12/1997)",
      "document_number": "71",
      "pacer_doc_id": null,
      "pacer_seq_no": null
    },
    {
      "date_entered": "1997-03-17",
      "date_filed": "1997-03-12",
      "description": "Motion By Creditor Terex Corporation For Protective Order memorandum of points and authorities in support thereof. [Fed. R. Civ. Pro.26 [c]. (Entered: 03/17/1997)",
      "document_number": "72",
      "pacer_doc_id": null,
      "pacer_seq_no": null
    },
    {
      "date_entered": "1997-03-17",
      "date_filed": "1997-03-12",
      "description": "Notice of Motion w/svc by: Creditor Terex Corporation With Hearing Re: [72-1] Motion For Protective Order by Terex Corporation scheduled For 10:30 4/25/97 at Rm 328, Weinberger Courthouse ; With Service; # of Notices: (Entered: 03/17/1997)",
      "document_number": "73",
      "pacer_doc_id": null,
      "pacer_seq_no": null
    },
    {
      "date_entered": "1997-03-17",
      "date_filed": "1997-03-12",
      "description": "Declaration in support by: Joel Stutts/ Creditor Terex Corporation Re: [72-1] Motion For Protective Order by Terex Corporation (Entered: 03/17/1997)",
      "document_number": "74",
      "pacer_doc_id": null,
      "pacer_seq_no": null
    },
    {
      "date_entered": "1997-03-17",
      "date_filed": "1997-03-12",
      "description": "Declaration in support by: Susan C. Stevenson for Creditor Terex Corporation Re: [72-1] Motion For Protective Order by Terex Corporation (Entered: 03/17/1997)",
      "document_number": "75",
      "pacer_doc_id": null,
      "pacer_seq_no": null
    },
    {
      "date_entered": "1997-03-17",
      "date_filed": "1997-03-12",
      "description": "Declaration in support by: Howard Jaffe/ Creditor Terex Corporation Re: [72-1] Motion For Protective Order by Terex Corporation (Entered: 03/17/1997)",
      "document_number": "76",
      "pacer_doc_id": null,
      "pacer_seq_no": null
    },
    {
      "date_entered": "1997-03-17",
      "date_filed": "1997-03-12",
      "description": "Declaration in support by: John Vandy/ Creditor Terex Corporation Re: [72-1] Motion For Protective Order by Terex Corporation (Entered: 03/17/1997)",
      "document_number": "77",
      "pacer_doc_id": null,
      "pacer_seq_no": null
    },
    {
      "date_entered": "1997-03-17",
      "date_filed": "1997-03-13",
      "description": "Motion By Trustee Harold Taxel To Compel production of documents; to compel the appearance of Dena Copr after production, and for contempt sanctions. . (Entered: 03/17/1997)",
      "document_number": "78",
      "pacer_doc_id": null,
      "pacer_seq_no": null
    },
    {
      "date_entered": "1997-03-17",
      "date_filed": "1997-03-13",
      "description": "Notice of Motion by: Trustee Harold Taxel With Hearing Re: [78-1] Motion To Compel production of documents; to compel the appearance of Dena Copr after production, and for contempt sanctions. by Harold Taxel scheduled For 2:30 3/20/97 at Rm 328, Weinberger Courthouse ; (Entered: 03/17/1997)",
      "document_number": "79",
      "pacer_doc_id": null,
      "pacer_seq_no": null
    },
    {
      "date_entered": "1997-03-17",
      "date_filed": "1997-03-13",
      "description": "Declaration in support by: Leslie T. Rubin/ Trustee Harold Taxel Re: [78-1] Motion To Compel production of documents; to compel the appearance of Dena Copr after production, and for contempt sanctions. by Harold Taxel (Entered: 03/17/1997)",
      "document_number": "80",
      "pacer_doc_id": null,
      "pacer_seq_no": null
    },
    {
      "date_entered": "1997-03-18",
      "date_filed": "1997-03-17",
      "description": "Complaint [97-90203] Harold S. Taxel vs. Berendsen Fluid Power . NOS 454 Recover Money/Property . Filing Fee $ 150.00 Receipt # 60114 (Entered: 03/18/1997)",
      "document_number": null,
      "pacer_doc_id": null,
      "pacer_seq_no": null
    },
    {
      "date_entered": "1997-03-18",
      "date_filed": "1997-03-17",
      "description": "Notice by Trustee Harold Taxel of Intent to compromise/settle controversy re preference claims regarding creditors: Aring Equipment Co; CF Motorfreight; So-Low Environmental Equipment Co; and Lubrication Equipment and Supply. [for further details refer to file] the ; Last Day For Objections 4/16/97 (Entered: 03/18/1997)",
      "document_number": "81",
      "pacer_doc_id": null,
      "pacer_seq_no": null
    },
    {
      "date_entered": "1997-03-18",
      "date_filed": "1997-03-17",
      "description": "Order Granting noncontested [57-1] Intent Notice by Harold Taxel filed February 5, l997]. (Entered: 03/18/1997)",
      "document_number": "82",
      "pacer_doc_id": null,
      "pacer_seq_no": null
    },
    {
      "date_entered": "1997-03-19",
      "date_filed": "1997-03-18",
      "description": "Opposition by Creditor Terex Corporation to [78-1] Motion To Compel production of documents; to compel the appearance of Dena Cope after production, and for contempt sanctions. by Harold Taxel,; Request for protective order and memorandum of pints and authorities in support thereof. (Entered: 03/19/1997)",
      "document_number": "83",
      "pacer_doc_id": null,
      "pacer_seq_no": null
    },
    {
      "date_entered": "1997-03-19",
      "date_filed": "1997-03-18",
      "description": "Declaration in support by: Susan C. Stevenson for Creditor Terex Corporation Re: [83-1] Opposition by Terex Corporation (Entered: 03/19/1997)",
      "document_number": "84",
      "pacer_doc_id": null,
      "pacer_seq_no": null
    },
    {
      "date_entered": "1997-03-19",
      "date_filed": "1997-03-18",
      "description": "Certificate Of Service By Susan C. Stevenson for Creditor Terex Corporation Of [84-1] Declaration by Susan C. Stevenson, [83-1] Opposition by Terex Corporation . (Entered: 03/19/1997)",
      "document_number": "85",
      "pacer_doc_id": null,
      "pacer_seq_no": null
    },
    {
      "date_entered": "1997-03-19",
      "date_filed": "1997-03-18",
      "description": "Certificate Of Service By Susan C. Stevenson for Creditor Terex Corporation Of [84-1] Declaration by Susan C. Stevenson, [83-1] Opposition by Terex Corporation . (Entered: 03/19/1997)",
      "document_number": "86",
      "pacer_doc_id": null,
      "pacer_seq_no": null
    },
    {
      "date_entered": "1997-03-21",
      "date_filed": "1997-03-20",
      "description": "Hearing Held Re: [78-1] Motion To Compel production of documents; to compel the appearance of Dena Copr after production, and for contempt sanctions. by Harold Taxel . Terex to provide information w/in 10 days and prepare a priorledge log. Mtn for sanctions derred. Order by Rubin. (Entered: 03/21/1997)",
      "document_number": "87",
      "pacer_doc_id": null,
      "pacer_seq_no": null
    },
    {
      "date_entered": "1997-03-21",
      "date_filed": "1997-03-20",
      "description": "Declaration in support by: Leslie T. Rubin for Trustee Harold Taxel Re: [78-1] Motion To Compel production of documents; to compel the appearance of Dena Copr after production, and for contempt sanctions. by Harold Taxel (Entered: 03/21/1997)",
      "document_number": "88",
      "pacer_doc_id": null,
      "pacer_seq_no": null
    },
    {
      "date_entered": "1997-04-02",
      "date_filed": "1997-03-28",
      "description": "Notice By Trustee Harold Taxel of Lodgment of Order Re: [78-1] Motion To Compel production of documents; to compel the appearance of Dena Cope after production, and for contempt sanctions. by Harold Taxel With Service. (Entered: 04/02/1997)",
      "document_number": "89",
      "pacer_doc_id": null,
      "pacer_seq_no": null
    },
    {
      "date_entered": "1997-04-02",
      "date_filed": "1997-03-31",
      "description": "Amended Motion By Creditor Terex Corporation For Protective Order memorandum of points and authorities in support thereof [Fed. R. Civ. Pro. 26 [c]. (Entered: 04/02/1997)",
      "document_number": "90",
      "pacer_doc_id": null,
      "pacer_seq_no": null
    },
    {
      "date_entered": "1997-04-02",
      "date_filed": "1997-03-31",
      "description": "Declaration in support by: Joel Stutts/ Creditor Terex Corporation Re: [90-1] Motion For Protective Order by Terex Corporation (Entered: 04/02/1997)",
      "document_number": "91",
      "pacer_doc_id": null,
      "pacer_seq_no": null
    },
    {
      "date_entered": "1997-04-02",
      "date_filed": "1997-03-31",
      "description": "Declaration in support by: John Vandy/ Creditor Terex Corporation Re: [90-1] Motion For Protective Order by Terex Corporation (Entered: 04/02/1997)",
      "document_number": "92",
      "pacer_doc_id": null,
      "pacer_seq_no": null
    },
    {
      "date_entered": "1997-04-02",
      "date_filed": "1997-04-01",
      "description": "Order Granting [78-1] Motion To Compel production of documents; to compel the appearance of Dena Copr after production, and for contempt sanctions. by Harold Taxel . (Entered: 04/02/1997)",
      "document_number": "93",
      "pacer_doc_id": null,
      "pacer_seq_no": null
    },
    {
      "date_entered": "1997-04-02",
      "date_filed": "1997-04-02",
      "description": "Notice of Entry Re: [93-1] Order to Parties. (Entered: 04/02/1997)",
      "document_number": "94",
      "pacer_doc_id": null,
      "pacer_seq_no": null
    },
    {
      "date_entered": "1997-04-04",
      "date_filed": "1997-04-02",
      "description": "Declaration in support by:Howard Jaffe/ Creditor Terex Corporation Re: [90-1] Amended Motion For Protective Order by Terex Corporation (Entered: 04/04/1997)",
      "document_number": "96",
      "pacer_doc_id": null,
      "pacer_seq_no": null
    },
    {
      "date_entered": "1997-04-04",
      "date_filed": "1997-04-02",
      "description": "Certificate Of Service By Creditor Terex Corporation Of [96-1] Declaration by Terex Corporation . (Entered: 04/04/1997)",
      "document_number": "97",
      "pacer_doc_id": null,
      "pacer_seq_no": null
    },
    {
      "date_entered": "1997-04-04",
      "date_filed": "1997-04-03",
      "description": "Order [granted by court clk ] w/Stipulation by Trustee Harold Taxel to Continue hearing date on [90-1] Motion For Protective Order by Terex Corporation (Entered: 04/04/1997)",
      "document_number": "95",
      "pacer_doc_id": null,
      "pacer_seq_no": null
    },
    {
      "date_entered": "1997-04-04",
      "date_filed": "1997-04-03",
      "description": "Hearing Continued Re: [95-1] Order w/ stipulation by Harold Taxel to continue hearing date to 2:00 4/28/97 at Rm 328, Weinberger Courthouse on motion for protective order. (Entered: 04/04/1997)",
      "document_number": "95",
      "pacer_doc_id": null,
      "pacer_seq_no": null
    },
    {
      "date_entered": "1997-04-04",
      "date_filed": "1997-04-04",
      "description": "Disposition of Adversary [97-90039] Granting [1-1] Complaint NOS 454 Recover Money/Property (Entered: 04/04/1997)",
      "document_number": null,
      "pacer_doc_id": null,
      "pacer_seq_no": null
    },
    {
      "date_entered": "1997-04-04",
      "date_filed": "1997-04-04",
      "description": "Adversary Case [97-90039] Closed. [95-05684] (Entered: 04/04/1997)",
      "document_number": null,
      "pacer_doc_id": null,
      "pacer_seq_no": null
    },
    {
      "date_entered": "1997-04-04",
      "date_filed": "1997-04-04",
      "description": "Disposition of Adversary [96-90888] Granting [1-1] Complaint NOS 454 Recover Money/Property (Entered: 04/04/1997)",
      "document_number": null,
      "pacer_doc_id": null,
      "pacer_seq_no": null
    },
    {
      "date_entered": "1997-04-04",
      "date_filed": "1997-04-04",
      "description": "Adversary Case [96-90888] Closed. (Entered: 04/04/1997)",
      "document_number": null,
      "pacer_doc_id": null,
      "pacer_seq_no": null
    },
    {
      "date_entered": "1997-04-04",
      "date_filed": "1997-04-04",
      "description": "Disposition of Adversary [97-90040] Dismissing [1-1] Complaint NOS 454 Recover Money/Property (Entered: 04/04/1997)",
      "document_number": null,
      "pacer_doc_id": null,
      "pacer_seq_no": null
    },
    {
      "date_entered": "1997-04-04",
      "date_filed": "1997-04-04",
      "description": "Adversary Case [97-90040] Closed. (Entered: 04/04/1997)",
      "document_number": null,
      "pacer_doc_id": null,
      "pacer_seq_no": null
    },
    {
      "date_entered": "1997-04-04",
      "date_filed": "1997-04-04",
      "description": "Disposition of Adversary [96-90887] Dismissing [1-1] Complaint NOS 454 Recover Money/Property (Entered: 04/04/1997)",
      "document_number": null,
      "pacer_doc_id": null,
      "pacer_seq_no": null
    },
    {
      "date_entered": "1997-04-04",
      "date_filed": "1997-04-04",
      "description": "Adversary Case [96-90887] Closed. (Entered: 04/04/1997)",
      "document_number": null,
      "pacer_doc_id": null,
      "pacer_seq_no": null
    },
    {
      "date_entered": "1997-04-04",
      "date_filed": "1997-04-04",
      "description": "Disposition of Adversary [96-90889] Dismissing [1-1] Complaint NOS 454 Recover Money/Property (Entered: 04/04/1997)",
      "document_number": null,
      "pacer_doc_id": null,
      "pacer_seq_no": null
    },
    {
      "date_entered": "1997-04-04",
      "date_filed": "1997-04-04",
      "description": "Adversary Case [96-90889] Closed. [95-05684] (Entered: 04/04/1997)",
      "document_number": null,
      "pacer_doc_id": null,
      "pacer_seq_no": null
    },
    {
      "date_entered": "1997-04-04",
      "date_filed": "1997-04-04",
      "description": "Disposition of Adversary [96-90893] Dismissing [1-1] Complaint NOS 454 Recover Money/Property (Entered: 04/04/1997)",
      "document_number": null,
      "pacer_doc_id": null,
      "pacer_seq_no": null
    },
    {
      "date_entered": "1997-04-04",
      "date_filed": "1997-04-04",
      "description": "Adversary Case [96-90893] Closed. (Entered: 04/04/1997)",
      "document_number": null,
      "pacer_doc_id": null,
      "pacer_seq_no": null
    },
    {
      "date_entered": "1997-04-04",
      "date_filed": "1997-04-04",
      "description": "Disposition of Adversary [97-90099] Granting [1-1] Complaint NOS 454 Recover Money/Property (Entered: 04/04/1997)",
      "document_number": null,
      "pacer_doc_id": null,
      "pacer_seq_no": null
    },
    {
      "date_entered": "1997-04-04",
      "date_filed": "1997-04-04",
      "description": "Adversary Case [97-90099] Closed. (Entered: 04/04/1997)",
      "document_number": null,
      "pacer_doc_id": null,
      "pacer_seq_no": null
    },
    {
      "date_entered": "1997-04-04",
      "date_filed": "1997-04-04",
      "description": "Disposition of Adversary [97-90203] Dismissing [1-1] Complaint NOS 454 Recover Money/Property (Entered: 04/04/1997)",
      "document_number": null,
      "pacer_doc_id": null,
      "pacer_seq_no": null
    },
    {
      "date_entered": "1997-04-04",
      "date_filed": "1997-04-04",
      "description": "Adversary Case [97-90203] Closed. (Entered: 04/04/1997)",
      "document_number": null,
      "pacer_doc_id": null,
      "pacer_seq_no": null
    },
    {
      "date_entered": "1997-04-08",
      "date_filed": "1997-04-07",
      "description": "Second Application By Gray Cary Ware & Freidenrich attorney for trustee For interim allowance of fees and reimbursement of expenses . (Entered: 04/08/1997)",
      "document_number": "98",
      "pacer_doc_id": null,
      "pacer_seq_no": null
    },
    {
      "date_entered": "1997-04-08",
      "date_filed": "1997-04-07",
      "description": "Notice of Motion by: other professional Gray Cary Ware & Freidenrich With Hearing Re: [98-1] Application For interim allowance of fees and reimbursement of expenses by Gray Cary Ware & Freidenrich scheduled For 10:30 5/5/97 at Rm 328, Weinberger Courthouse ; (Entered: 04/08/1997)",
      "document_number": "99",
      "pacer_doc_id": null,
      "pacer_seq_no": null
    },
    {
      "date_entered": "1997-04-08",
      "date_filed": "1997-04-07",
      "description": "Certificate Of Service By other professional Gray Cary Ware & Freidenrich Of [99-1] Motion Hearing Notice by Gray Cary Ware & Freidenrich, [98-1] Application For interim allowance of fees and reimbursement of expenses by Gray Cary Ware & Freidenrich . (Entered: 04/08/1997)",
      "document_number": "100",
      "pacer_doc_id": null,
      "pacer_seq_no": null
    },
    {
      "date_entered": "1997-04-14",
      "date_filed": "1997-04-14",
      "description": "Disposition of Adversary [97-90153] Granting [1-1] Complaint NOS 454 Recover Money/Property (Entered: 04/14/1997)",
      "document_number": null,
      "pacer_doc_id": null,
      "pacer_seq_no": null
    },
    {
      "date_entered": "1997-04-14",
      "date_filed": "1997-04-14",
      "description": "Adversary Case [97-90153] Closed. [95-05684] (Entered: 04/14/1997)",
      "document_number": null,
      "pacer_doc_id": null,
      "pacer_seq_no": null
    },
    {
      "date_entered": "1997-04-22",
      "date_filed": "1997-04-21",
      "description": "Stipulation w/ Order Granted, to avoid security interest, release judgment and allow general unsecured claim . (Entered: 04/22/1997)",
      "document_number": "101",
      "pacer_doc_id": null,
      "pacer_seq_no": null
    },
    {
      "date_entered": "1997-04-23",
      "date_filed": "1997-04-21",
      "description": "Withdrawal by Creditor Terex Corporation of [90-1] Motion For Protective Order by Terex Corporation (Entered: 04/23/1997)",
      "document_number": "102",
      "pacer_doc_id": null,
      "pacer_seq_no": null
    },
    {
      "date_entered": "1997-04-28",
      "date_filed": "1997-04-25",
      "description": "Order Granting [81-1] Intent Notice by Harold Taxel . (Entered: 04/28/1997)",
      "document_number": "103",
      "pacer_doc_id": null,
      "pacer_seq_no": null
    },
    {
      "date_entered": "1997-05-06",
      "date_filed": "1997-05-05",
      "description": "Hearing Held Re: [98-1] Application For interim allowance of fees and reimbursement of expenses by Gray Cary Ware & Freidenrich . Fees awarded at $78,326.50, with/or pymt at $62,661.20. Costs $4253.60. Order by Zander (Entered: 05/06/1997)",
      "document_number": "104",
      "pacer_doc_id": null,
      "pacer_seq_no": null
    },
    {
      "date_entered": "1997-05-07",
      "date_filed": "1997-05-07",
      "description": "Disposition of Adversary [96-90885] Dismissing [1-1] Complaint NOS 454 Recover Money/Property (Entered: 05/07/1997)",
      "document_number": null,
      "pacer_doc_id": null,
      "pacer_seq_no": null
    },
    {
      "date_entered": "1997-05-07",
      "date_filed": "1997-05-07",
      "description": "Adversary Case [96-90885] Closed. (Entered: 05/07/1997)",
      "document_number": null,
      "pacer_doc_id": null,
      "pacer_seq_no": null
    },
    {
      "date_entered": "1997-05-07",
      "date_filed": "1997-05-07",
      "description": "Disposition of Adversary [97-90129] Granting [1-1] Complaint NOS 454 Recover Money/Property (Entered: 05/07/1997)",
      "document_number": null,
      "pacer_doc_id": null,
      "pacer_seq_no": null
    },
    {
      "date_entered": "1997-05-07",
      "date_filed": "1997-05-07",
      "description": "Adversary Case [97-90129] Closed. (Entered: 05/07/1997)",
      "document_number": null,
      "pacer_doc_id": null,
      "pacer_seq_no": null
    },
    {
      "date_entered": "1997-05-19",
      "date_filed": "1997-05-09",
      "description": "Withdrawal of proof of claim by Trustee Harold Taxel for/ creditor Pacific Coast Tool & Supply Inc; [\"Pacific Coast\"]. (Entered: 05/19/1997)",
      "document_number": "106",
      "pacer_doc_id": null,
      "pacer_seq_no": null
    },
    {
      "date_entered": "1997-05-13",
      "date_filed": "1997-05-12",
      "description": "Order Granting [98-1] Application For interim allowance of fees and reimbursement of expenses by Gray Cary Ware & Freidenrich payment of $78326.50 in fees and $4253.50 in expenses . (Entered: 05/13/1997)",
      "document_number": "105",
      "pacer_doc_id": null,
      "pacer_seq_no": null
    },
    {
      "date_entered": "1997-05-19",
      "date_filed": "1997-05-19",
      "description": "Notice by court of Withdrawal of proof of claim and deadline to object to proposed withdrawal and certificate of service dated 5/19/97. ] of proof of claim No. 22 filed by Pacific Coast Tool & Supply Inc/ Withdrawal filed by trustee Harold Taxel for Pacific Coast Tool Inc. (Entered: 05/19/1997)",
      "document_number": "107",
      "pacer_doc_id": null,
      "pacer_seq_no": null
    },
    {
      "date_entered": "1997-05-21",
      "date_filed": "1997-05-20",
      "description": "Complaint [97-90368] Harold S. Taxel vs. Carl Sandahl . NOS 454 Recover Money/Property . Filing Fee $ 150.00 Receipt # 65201 (Entered: 05/21/1997)",
      "document_number": null,
      "pacer_doc_id": null,
      "pacer_seq_no": null
    },
    {
      "date_entered": "1997-05-30",
      "date_filed": "1997-05-29",
      "description": "Notice by Trustee Harold Taxel of Intent to compromise/settle financial impact on estate as required by local bcky rule 9019. ; Last Day For Objections 6/30/97 (Entered: 05/30/1997)",
      "document_number": "108",
      "pacer_doc_id": null,
      "pacer_seq_no": null
    },
    {
      "date_entered": "1997-06-02",
      "date_filed": "1997-05-30",
      "description": "Complaint [97-90395] Harold S. Taxel vs. Terex Corporation . NOS 454 Recover Money/Property, NOS 434 Injunctive Relief, NOTE: The following 21 items are listed on the compliant: 1 Breach of contract 2 Fraud 3 Negligent misrepresentaion 4 Embezzlement 5 Conversion 6 Breach of fiduciary duty 7 Intentional interference with Economic relations 8 Neglegent interference with economic relations 9 Constructive Trust 10 Violation of good faith and fair dealing 11 Negligence 12 conspiracy to defraud 13 conspiracy to convert funds 14 Avoidance of preferential transfers 15 Avoidance of preferential transfers 16 Avoidance of fraudulent transfers 17 Turnover of property 18 Violation of automatic stay [19 Disallowance of claim 20 Equitable subordination of claim and 21 accounting Jury demand . Filing Fee $ 150.00 Receipt # 66049 (Entered: 06/02/1997)",
      "document_number": null,
      "pacer_doc_id": null,
      "pacer_seq_no": null
    },
    {
      "date_entered": "1997-07-07",
      "date_filed": "1997-07-03",
      "description": "Order Granting noncontested action re [108-1] Intent Notice by Harold Taxel . (Entered: 07/07/1997)",
      "document_number": "109",
      "pacer_doc_id": null,
      "pacer_seq_no": null
    },
    {
      "date_entered": "1997-07-07",
      "date_filed": "1997-07-03",
      "description": "Stipulation and Order Granted, to avoid security interst and release judgment and allow general unsecured claim filed by Harold Taxel ch 7 trustee/ The Horsburgh & Scott co.. (Entered: 07/07/1997)",
      "document_number": "110",
      "pacer_doc_id": null,
      "pacer_seq_no": null
    },
    {
      "date_entered": "1997-07-15",
      "date_filed": "1997-07-11",
      "description": "Notice by Trustee Harold Taxel of Intent to Employ O'Connor, Greenspoon, Atty's ; Last Day For Objections 8/11/97 (Entered: 07/15/1997)",
      "document_number": "111",
      "pacer_doc_id": null,
      "pacer_seq_no": null
    },
    {
      "date_entered": "1997-07-15",
      "date_filed": "1997-07-11",
      "description": "Declaration Of Disinterest Of Howard Greenspoon On Behalf Of Himself And The Law Firm Of O'Connor & Greenspoon by: Re: [111-1] Intent Notice by Harold Taxel (Entered: 07/15/1997)",
      "document_number": "112",
      "pacer_doc_id": null,
      "pacer_seq_no": null
    },
    {
      "date_entered": "1997-08-18",
      "date_filed": "1997-08-16",
      "description": "Order Granting [111-1] Intent Notice by Harold Taxel . (Entered: 08/18/1997)",
      "document_number": "113",
      "pacer_doc_id": null,
      "pacer_seq_no": null
    },
    {
      "date_entered": "1997-09-09",
      "date_filed": "1997-09-08",
      "description": "Third Application By other professional Gray Cary Ware & Freidenrich For interim allowance of fees and reimbursment of expenses by Gray Cary Ware & Freidenrich counsel for the chapter 7 trustee . (Entered: 09/09/1997)",
      "document_number": "114",
      "pacer_doc_id": null,
      "pacer_seq_no": null
    },
    {
      "date_entered": "1997-09-09",
      "date_filed": "1997-09-08",
      "description": "Notice of Motion by: other professional Gray Cary Ware & Freidenrich With Hearing Re: [114-1] Application For interim allowance of fees and reimbursment of expenses by Gray Cary Ware & Freidenrich counsel for the chapter 7 trustee by Gray Cary Ware & Freidenrich scheduled For 10:30 10/6/97 at Rm 328, Weinberger Courthouse ; (Entered: 09/09/1997)",
      "document_number": "115",
      "pacer_doc_id": null,
      "pacer_seq_no": null
    },
    {
      "date_entered": "1997-09-09",
      "date_filed": "1997-09-08",
      "description": "Certificate Of Service By other professional Gray Cary Ware & Freidenrich Of [115-1] Motion Hearing Notice by Gray Cary Ware & Freidenrich, [114-1] Application For interim allowance of fees and reimbursment of expenses by Gray Cary Ware & Freidenrich counsel for the chapter 7 trustee by Gray Cary Ware & Freidenrich . (Entered: 09/09/1997)",
      "document_number": "116",
      "pacer_doc_id": null,
      "pacer_seq_no": null
    },
    {
      "date_entered": "1997-09-17",
      "date_filed": "1997-09-16",
      "description": "Notice by Trustee Harold Taxel of Intent to compromise and settle preference claims against the referenced creditors ; [see file for details] Last Day For Objections 10/16/97 (Entered: 09/17/1997)",
      "document_number": "117",
      "pacer_doc_id": null,
      "pacer_seq_no": null
    },
    {
      "date_entered": "1997-09-25",
      "date_filed": "1997-09-23",
      "description": "Limited Objection by Creditor Terex Corporation to [114-1]Third Application For interim allowance of fees and reimbursment of expenses by Gray Cary Ware & Freidenrich counsel for the chapter 7 trustee by Gray Cary Ware & Freidenrich (Entered: 09/25/1997)",
      "document_number": "118",
      "pacer_doc_id": null,
      "pacer_seq_no": null
    },
    {
      "date_entered": "1997-10-07",
      "date_filed": "1997-10-06",
      "description": "Hearing Held Re: [114-1] Application For interim allowance of fees and reimbursment of expenses by Gray Cary Ware & Freidenrich counsel for the chapter 7 trustee by Gray Cary Ware & Freidenrich -- Hrg on 3rd Interim Aplc for Cmpn & reimbursement of expenses by Gray Cary Ware & Freidenrich, attys for Tr., NTCD 9/8/97, Fees awarded in the amt of $124,94.50; auth for pymt in the amt of $99,952.40 Costs awarded - $4494.71 Prior holdbacks auth. for pymt in full. order/Rubin. (Entered: 10/07/1997)",
      "document_number": "119",
      "pacer_doc_id": null,
      "pacer_seq_no": null
    },
    {
      "date_entered": "1997-10-17",
      "date_filed": "1997-10-15",
      "description": "Order Granting [114-1] Application For interim allowance of fees and reimbursment of expenses by Gray Cary Ware & Freidenrich counsel for the chapter 7 trustee by Gray Cary Ware & Freidenrich payment to Gray Cary Ware & Freidenrich of $124940.50 in fees and $4494.71 in expenses . (Entered: 10/17/1997)",
      "document_number": "120",
      "pacer_doc_id": null,
      "pacer_seq_no": null
    },
    {
      "date_entered": "1997-10-23",
      "date_filed": "1997-10-22",
      "description": "Order Granting [117-1] Intent Notice by Harold Taxel . (Entered: 10/23/1997)",
      "document_number": "121",
      "pacer_doc_id": null,
      "pacer_seq_no": null
    },
    {
      "date_entered": "1997-10-27",
      "date_filed": "1997-10-27",
      "description": "Disposition of Adversary [96-90894] Dismissing [1-1] Complaint NOS 454 Recover Money/Property (Entered: 10/27/1997)",
      "document_number": null,
      "pacer_doc_id": null,
      "pacer_seq_no": null
    },
    {
      "date_entered": "1997-10-27",
      "date_filed": "1997-10-27",
      "description": "Adversary Case [96-90894] Closed. (Entered: 10/27/1997)",
      "document_number": null,
      "pacer_doc_id": null,
      "pacer_seq_no": null
    },
    {
      "date_entered": "1998-02-24",
      "date_filed": "1998-02-24",
      "description": "Disposition of Adversary [97-90368] Dismissing [1-1] Complaint NOS 454 Recover Money/Property (Entered: 02/24/1998)",
      "document_number": null,
      "pacer_doc_id": null,
      "pacer_seq_no": null
    },
    {
      "date_entered": "1998-02-24",
      "date_filed": "1998-02-24",
      "description": "Adversary Case [97-90368] Closed. (Entered: 02/24/1998)",
      "document_number": null,
      "pacer_doc_id": null,
      "pacer_seq_no": null
    },
    {
      "date_entered": "1998-02-24",
      "date_filed": "1998-02-24",
      "description": "Disposition of Adversary [97-90154] Granting [1-1] Complaint NOS 454 Recover Money/Property (Entered: 02/24/1998)",
      "document_number": null,
      "pacer_doc_id": null,
      "pacer_seq_no": null
    },
    {
      "date_entered": "1998-02-24",
      "date_filed": "1998-02-24",
      "description": "Adversary Case [97-90154] Closed. (Entered: 02/24/1998)",
      "document_number": null,
      "pacer_doc_id": null,
      "pacer_seq_no": null
    },
    {
      "date_entered": "1998-03-11",
      "date_filed": "1998-03-11",
      "description": "Disposition of Adversary [97-90039] Dismissing [1-1] Complaint NOS 454 Recover Money/Property (Entered: 03/11/1998)",
      "document_number": null,
      "pacer_doc_id": null,
      "pacer_seq_no": null
    },
    {
      "date_entered": "1998-03-11",
      "date_filed": "1998-03-11",
      "description": "Adversary Case [97-90039] Closed. (Entered: 03/11/1998)",
      "document_number": null,
      "pacer_doc_id": null,
      "pacer_seq_no": null
    },
    {
      "date_entered": "1998-06-18",
      "date_filed": "1998-06-17",
      "description": "Order Granting [90-1] Motion For Protective Order by Terex Corporation . (Entered: 06/18/1998)",
      "document_number": "122",
      "pacer_doc_id": null,
      "pacer_seq_no": null
    },
    {
      "date_entered": "1998-06-18",
      "date_filed": "1998-06-18",
      "description": "Notice of Entry Re: [122-1] Order to Parties. (Entered: 06/18/1998)",
      "document_number": "123",
      "pacer_doc_id": null,
      "pacer_seq_no": null
    },
    {
      "date_entered": "1998-09-18",
      "date_filed": "1998-09-11",
      "description": "Fourth interim Application By Trustee Harold Taxel For allowance of fees and reimbursement of expenses by Gray, Cary Ware & Fredenrich LLP, counsel for the chapter 7 trustee . (Entered: 09/18/1998)",
      "document_number": "126",
      "pacer_doc_id": null,
      "pacer_seq_no": null
    },
    {
      "date_entered": "1998-09-17",
      "date_filed": "1998-09-15",
      "description": "First and final Application By Trustee Harold Taxel For allowance of fees and reimbursement of expenses by O'Conner, Greenspoon, Special litigation counsel to Harold S. Taxel, chapter 7 trustee. . (Entered: 09/17/1998)",
      "document_number": "124",
      "pacer_doc_id": null,
      "pacer_seq_no": null
    },
    {
      "date_entered": "1998-09-17",
      "date_filed": "1998-09-15",
      "description": "First interim Application Filed By Trustee Harold Taxel For allowance of fees and reimbursement of expenses by special litigation accountants, Brodshaltzer, Wallace, Spoon & YIP (Entered: 09/17/1998)",
      "document_number": "125",
      "pacer_doc_id": null,
      "pacer_seq_no": null
    },
    {
      "date_entered": "1998-09-18",
      "date_filed": "1998-09-15",
      "description": "Notice of Motion by: Trustee Harold Taxel With Hearing Re: [125-1] Application For allowance of fees and reimbursement of expenses by special litigation accountants, Brodshaltzer, Wallace, Spoon & YIP by Harold Taxel scheduled For 3:00 10/13/98 at Rm 328, Weinberger Courthouse, [124-1] Application For allowance of fees and reimbursement of expenses by O'Conner, Greenspoon, Special litigation counsel to Harold S. Taxel, chapter 7 trustee. by Harold Taxel scheduled For 3:00 10/13/98 at Rm 328, Weinberger Courthouse ; [NOTE: AMENDED NTC TO BE FLD] (Entered: 09/18/1998)",
      "document_number": "127",
      "pacer_doc_id": null,
      "pacer_seq_no": null
    },
    {
      "date_entered": "1998-09-18",
      "date_filed": "1998-09-15",
      "description": "Certificate Of Service By Jeffry A. Davis for Trustee Harold Taxel Of [127-1] Motion Hearing Notice by Harold Taxel, [125-1] Application For allowance of fees and reimbursement of expenses by special litigation accountants, Brodshaltzer, Wallace, Spoon & YIP by Harold Taxel, [124-1] Application For allowance of fees and reimbursement of expenses by O'Conner, Greenspoon, Special litigation counsel to Harold S. Taxel, chapter 7 trustee. by Harold Taxel . (Entered: 09/18/1998)",
      "document_number": "128",
      "pacer_doc_id": null,
      "pacer_seq_no": null
    },
    {
      "date_entered": "1998-09-18",
      "date_filed": "1998-09-15",
      "description": "Application By Trustee Harold Taxel For authorization for trustee to pay his one-third share of the fees and expenses of Richard Page, Arbitrator . (Entered: 09/18/1998)",
      "document_number": "129",
      "pacer_doc_id": null,
      "pacer_seq_no": null
    },
    {
      "date_entered": "1998-09-18",
      "date_filed": "1998-09-15",
      "description": "Notice of Motion by: Trustee Harold Taxel With Hearing Re: [129-1] Application For authorization for trustee to pay his one-third share of the fees and expenses of Richard Page, Arbitrator by Harold Taxel scheduled For 3:00 10/13/98 at Rm 328, Weinberger Courthouse ; (Entered: 09/18/1998)",
      "document_number": "130",
      "pacer_doc_id": null,
      "pacer_seq_no": null
    },
    {
      "date_entered": "1998-09-18",
      "date_filed": "1998-09-15",
      "description": "Certificate Of Service By Jeffry A. Davis for Trustee Harold Taxel Of [130-1] Motion Hearing Notice by Harold Taxel, [129-1] Application For authorization for trustee to pay his one-third share of the fees and expenses of Richard Page, Arbitrator by Harold Taxel . (Entered: 09/18/1998)",
      "document_number": "131",
      "pacer_doc_id": null,
      "pacer_seq_no": null
    },
    {
      "date_entered": "1998-09-23",
      "date_filed": "1998-09-17",
      "description": "AMENDED Notice of Motion by: other professional Gray Cary Ware & Freidenrich With Hearing Re: [125-1] Application For allowance of fees and reimbursement of expenses by special litigation accountants, Brodshaltzer, Wallace, Spoon & YIP by Harold Taxel scheduled For 2:00 10/13/98 at Rm 328, Weinberger Courthouse, [124-1] Application For allowance of fees and reimbursement of expenses by O'Conner, Greenspoon, Special litigation counsel to Harold S. Taxel, chapter 7 trustee. by Harold Taxel scheduled For 2:00 10/13/98 at Rm 328, Weinberger Courthouse, [126-1] Application For allowance of fees and reimbursement of expenses by Gray, Cary Ware & Fredenrich LLP, counsel for the chapter 7 trustee by Harold Taxel scheduled For 2:00 10/13/98 at Rm 328, Weinberger Courthouse ; [Amended to reflect new time] (Entered: 09/23/1998)",
      "document_number": "132",
      "pacer_doc_id": null,
      "pacer_seq_no": null
    },
    {
      "date_entered": "1998-09-23",
      "date_filed": "1998-09-21",
      "description": "AMENDED Notice of Motion by: other professional Gray Cary Ware & Freidenrich With Hearing Re: [129-1] Application For authorization for trustee to pay his one-third share of the fees and expenses of Richard Page, Arbitrator by Harold Taxel scheduled For 2:00 10/13/98 at Rm 328, Weinberger Courthouse ; [Amended to reflect new hearing time] (Entered: 09/23/1998)",
      "document_number": "133",
      "pacer_doc_id": null,
      "pacer_seq_no": null
    },
    {
      "date_entered": "1998-10-02",
      "date_filed": "1998-10-01",
      "description": "Objection by U.S. Trustee United States Trusteeto [125-1] Application For allowance of fees and reimbursement of expenses by special litigation accountants, Brodshaltzer, Wallace, Spoon & YIP by Harold Taxel (Entered: 10/02/1998)",
      "document_number": "134",
      "pacer_doc_id": null,
      "pacer_seq_no": null
    },
    {
      "date_entered": "1998-10-02",
      "date_filed": "1998-10-01",
      "description": "Objection by U.S. Trustee United States Trustee to [129-1] Application For authorization for trustee to pay his one-third share of the fees and expenses of Richard Page, Arbitrator by Harold Taxel (Entered: 10/02/1998)",
      "document_number": "135",
      "pacer_doc_id": null,
      "pacer_seq_no": null
    },
    {
      "date_entered": "1998-10-02",
      "date_filed": "1998-10-01",
      "description": "Objection by U.S. Trustee United States Trustee to [126-1] Application For allowance of fees and reimbursement of expenses by Gray, Cary Ware & Fredenrich LLP, counsel for the chapter 7 trustee by Harold Taxel (Entered: 10/02/1998)",
      "document_number": "136",
      "pacer_doc_id": null,
      "pacer_seq_no": null
    },
    {
      "date_entered": "1998-10-02",
      "date_filed": "1998-10-01",
      "description": "Certificate Of Service By U.S. Trustee United States Trustee Of [136-1] Objection by United States Trustee, [135-1] Objection by United States Trustee, [134-1] Objection by United States Trustee . (Entered: 10/02/1998)",
      "document_number": "137",
      "pacer_doc_id": null,
      "pacer_seq_no": null
    },
    {
      "date_entered": "1998-10-09",
      "date_filed": "1998-10-07",
      "description": "Reply By Trustee Harold Taxel To [136-1] Objection by United States Trustee . (Entered: 10/09/1998)",
      "document_number": "138",
      "pacer_doc_id": null,
      "pacer_seq_no": null
    },
    {
      "date_entered": "1998-10-09",
      "date_filed": "1998-10-07",
      "description": "Declaration in Support by: Jeffry A. Davis Re: [136-1] Objection by United States Trustee (Entered: 10/09/1998)",
      "document_number": "139",
      "pacer_doc_id": null,
      "pacer_seq_no": null
    },
    {
      "date_entered": "1998-10-09",
      "date_filed": "1998-10-07",
      "description": "Declaration in Connection by: Trustee Harold Taxel Re: [136-1] Objection by United States Trustee (Entered: 10/09/1998)",
      "document_number": "140",
      "pacer_doc_id": null,
      "pacer_seq_no": null
    },
    {
      "date_entered": "1998-10-13",
      "date_filed": "1998-10-09",
      "description": "Declaration in rewponse by: other professional Robert H. Wallace Re: [134-1] Objection by United States Trusteeto the first interim application for allowance of fees and reimbursement of expenses by special litigation accountants, Brodshatzer, Wallace, Spoon and Yip (Entered: 10/13/1998)",
      "document_number": "141",
      "pacer_doc_id": null,
      "pacer_seq_no": null
    },
    {
      "date_entered": "1998-10-14",
      "date_filed": "1998-10-13",
      "description": "Hearing Held Re: 1 4th Interim application for compensation & reimbursment of expenses of Gray Cary Ware & Freidenrich, counsel for trustee--fees approved $226,730, fees auth for pymt $181,334, costs $8367.08. Prior holdback auth for pymt. 2 1st Interim application for compensation & reimbursement of expenses by Broadshatzer, Wallace, Spoon & Yip special litigation accountants--Fees approved $31,415, Fees auth for pymt $15,707.50, Costs $29.50. 3 1st and Fiunal application for compensation & reimbursment of expenses by O'Conner, Greenspoon, special litigation counsel to trustee--Fees approved $2456.51, Fees auth for pymt $2456.51, Costs $565.69 retainer of $43.39=$522.30. 4 Trustee's application for authorization to pay his one-third share of the fees & expenses of Richard Page, arbitrator--Fees approved $2666.67, Fees auth for pymt $2666.67, Costs $140.17. Order by Zander (Entered: 10/14/1998)",
      "document_number": "142",
      "pacer_doc_id": null,
      "pacer_seq_no": null
    },
    {
      "date_entered": "1998-10-16",
      "date_filed": "1998-10-15",
      "description": "Order Granting [124-1] Application For allowance of fees and reimbursement of expenses by O'Conner, Greenspoon, Special litigation counsel to Harold S. Taxel, chapter 7 trustee. by Harold Taxel. Payment to O'Connor, Greenspoon of $2456.61 in fees and $565.69 in costs . (Entered: 10/16/1998)",
      "document_number": "143",
      "pacer_doc_id": null,
      "pacer_seq_no": null
    },
    {
      "date_entered": "1998-10-16",
      "date_filed": "1998-10-15",
      "description": "Order Granting [126-1] Application For allowance of fees and reimbursement of expenses by Gray, Cary Ware & Fredenrich LLP, counsel for the chapter 7 trustee by Harold Taxel payment to Gray Cary, et al of $181334.00 in fees and $8367.08 in costs (Entered: 10/16/1998)",
      "document_number": "144",
      "pacer_doc_id": null,
      "pacer_seq_no": null
    },
    {
      "date_entered": "1998-10-22",
      "date_filed": "1998-10-20",
      "description": "Order Granting [129-1] Application For authorization for trustee to pay his one-third share of the fees and expenses of Richard Page, Arbitrator by Harold Taxel payment to Richard W. Page of $2666.67 in fees and $140.17 in expenses . (Entered: 10/22/1998)",
      "document_number": "145",
      "pacer_doc_id": null,
      "pacer_seq_no": null
    },
    {
      "date_entered": "1998-10-22",
      "date_filed": "1998-10-20",
      "description": "Order Granting [125-1] Application For allowance of fees and reimbursement of expenses by special litigation accountants, Brodshaltzer, Wallace, Spoon & YIP by Harold Taxel payment to Brodshatzer Wallac Spoon & Yip of $31415.23 in fees and $29.51 in expenses . (Entered: 10/22/1998)",
      "document_number": "146",
      "pacer_doc_id": null,
      "pacer_seq_no": null
    },
    {
      "date_entered": "1999-03-18",
      "date_filed": "1999-03-18",
      "description": "Disposition Of Adversary [97-90128] Granting [1-1] Complaint NOS 454 Recover Money/Property. (Entered: 03/18/1999)",
      "document_number": null,
      "pacer_doc_id": null,
      "pacer_seq_no": null
    },
    {
      "date_entered": "1999-03-18",
      "date_filed": "1999-03-18",
      "description": "Adversary Case [97-90128] Closed. [95-05684] (Entered: 03/18/1999)",
      "document_number": null,
      "pacer_doc_id": null,
      "pacer_seq_no": null
    },
    {
      "date_entered": "1999-03-23",
      "date_filed": "1999-03-22",
      "description": "Declaration of disinterest of Daniel M. Lisulo SC on behalf of himself and Lisulo & Co /: Jeffry A. Davis for Trustee Harold Taxel (Entered: 03/23/1999)",
      "document_number": "147",
      "pacer_doc_id": null,
      "pacer_seq_no": null
    },
    {
      "date_entered": "1999-03-23",
      "date_filed": "1999-03-22",
      "description": "Certificate Of Service By Jeffry A. Davis for Trustee Harold Taxel Of [147-1] Declaration by Jeffry A. Davis . (Entered: 03/23/1999)",
      "document_number": "148",
      "pacer_doc_id": null,
      "pacer_seq_no": null
    },
    {
      "date_entered": "1999-03-23",
      "date_filed": "1999-03-22",
      "description": "Certificate Of Service By Jeffry A. Davis for Trustee Harold Taxel Of [147-1] Declaration by Jeffry A. Davis . (Entered: 03/23/1999)",
      "document_number": "149",
      "pacer_doc_id": null,
      "pacer_seq_no": null
    },
    {
      "date_entered": "1999-03-23",
      "date_filed": "1999-03-22",
      "description": "Statement of Position by the U.S. Trustee Re: [ex parte application to employ Lisulo & Co as special litigation counsel to the trustee-- the U.S Trustee Has No Objection (Entered: 03/23/1999)",
      "document_number": "150",
      "pacer_doc_id": null,
      "pacer_seq_no": null
    },
    {
      "date_entered": "1999-03-24",
      "date_filed": "1999-03-23",
      "description": "Order Granted, w/ ex parte application to Employ Lisulo & Co as special litigation counsel for trustee . (Entered: 03/24/1999)",
      "document_number": "151",
      "pacer_doc_id": null,
      "pacer_seq_no": null
    },
    {
      "date_entered": "1999-06-09",
      "date_filed": "1999-06-08",
      "description": "Notice by Trustee Harold Taxel of Intent to compromise or settle action re: adversary proceeding against Zia Mian adversary proceeding No. 97-90128 ; Last Day For Objections 7/8/99 (Entered: 06/09/1999)",
      "document_number": "152",
      "pacer_doc_id": null,
      "pacer_seq_no": null
    },
    {
      "date_entered": "1999-07-16",
      "date_filed": "1999-07-15",
      "description": "Certificate Of Service By Trustee Harold Taxel Of [152-1] Intent Notice by Harold Taxel . (Entered: 07/16/1999)",
      "document_number": "153",
      "pacer_doc_id": null,
      "pacer_seq_no": null
    },
    {
      "date_entered": "1999-07-20",
      "date_filed": "1999-07-19",
      "description": "Order Granting [152-1] Notice of intended action by Harold Taxel . (Entered: 07/20/1999)",
      "document_number": "154",
      "pacer_doc_id": null,
      "pacer_seq_no": null
    },
    {
      "date_entered": "1999-08-19",
      "date_filed": "1999-08-19",
      "description": "Trustee's Request for Notice of Proposed Abandonment. (Entered: 08/19/1999)",
      "document_number": null,
      "pacer_doc_id": null,
      "pacer_seq_no": null
    },
    {
      "date_entered": "1999-08-24",
      "date_filed": "1999-08-21",
      "description": "Notice Of Intent by Trustee Harold Taxel To Abandon personal re Zambia Coppe Mine etc. With Service; # of Notices: 231 (Entered: 08/24/1999)",
      "document_number": "155",
      "pacer_doc_id": null,
      "pacer_seq_no": null
    },
    {
      "date_entered": "1999-09-02",
      "date_filed": "1999-09-02",
      "description": "Disposition of Adversary [97-90395] Dismissing [1-3] Complaint 1 Breach of contract 2 Fraud 3 Negligent misrepresentaion 4 Embezzlement 5 Conversion 6 Breach of fiduciary duty 7 Intentional interference with Economic relations 8 Neglegent interference with economic relations 9 Constructive Trust 10 Violation of good faith and fair dealing 11 Negligence 12 conspiracy to defraud 13 conspiracy to convert funds 14 Avoidance of preferential transfers 15 Avoidance of preferential transfers 16 Avoidance of fraudulent transfers 17 Turnover of property 18 Violation of automatic stay [19 Disallowance of claim 20 Equitable subordination of claim and 21 accounting Dismissing [1-2] Complaint NOS 434 Injunctive Relief Dismissing [1-1] Complaint NOS 454 Recover Money/Property (Entered: 09/02/1999)",
      "document_number": null,
      "pacer_doc_id": null,
      "pacer_seq_no": null
    },
    {
      "date_entered": "1999-09-02",
      "date_filed": "1999-09-02",
      "description": "Adversary Case [97-90395] Closed. (Entered: 09/02/1999)",
      "document_number": null,
      "pacer_doc_id": null,
      "pacer_seq_no": null
    },
    {
      "date_entered": "1999-09-23",
      "date_filed": "1999-09-22",
      "description": "Report of abandonment of real property by Trustee RE: 1 The $100,00 receivable from Zambia Copper Mine, uncollectable; and the 3 million dollars in unfilled orders. No performance by Sandle or old Hypac; ; all documents, papers and corporate documents including but not limited to those located in the office of Grey, Cary,etc., and on the premises of Hypac, Inc., San Marcos, CA., except for those records the bankruptcy trustee maintains for 3 years subsequent to closing of case.. (Entered: 09/23/1999)",
      "document_number": "156",
      "pacer_doc_id": null,
      "pacer_seq_no": null
    },
    {
      "date_entered": "2000-03-17",
      "date_filed": "2000-03-16",
      "description": "Supplemental final Application By accountant R. Dean Johnson, CPA For allowance of Compensation and reimbursement of expenses as accountant for Harold Taxel, trustee of debtor . (Entered: 03/17/2000)",
      "document_number": "157",
      "pacer_doc_id": null,
      "pacer_seq_no": null
    },
    {
      "date_entered": "2000-03-21",
      "date_filed": "2000-03-17",
      "description": "Fifth and Final Application By Jeffry A. Davis/Gray Cary Ware & Freidenrich/ Trustee Harold Taxel For allowance of fees and reimbursement of expenses by Gray Cary Ware & Freidenrich LLP, counsel for the chapter 7 trustee . (Entered: 03/21/2000)",
      "document_number": "158",
      "pacer_doc_id": null,
      "pacer_seq_no": null
    },
    {
      "date_entered": "2000-03-21",
      "date_filed": "2000-03-17",
      "description": "Second and Final Application By Jeffry A. Davis for Trustee Harold Taxel For allowance of fees and reimbursement of expenses by special litigation accountants, Brodshatzer, Wallace, Spoon & Yip . (Entered: 03/21/2000)",
      "document_number": "159",
      "pacer_doc_id": null,
      "pacer_seq_no": null
    },
    {
      "date_entered": "2000-03-21",
      "date_filed": "2000-03-17",
      "description": "Notice of Motion by: Jeffrey A. Davis/ Gray Cary Ware & Freidenrich With Hearing Re: [159-1] Application For allowance of fees and reimbursement of expenses by special litigation accountants, Brodshatzer, Wallace, Spoon & Yip by Jeffry A. Davis scheduled For 10:30 4/17/00 at Rm 328, Weinberger Courthouse, [158-1] Application For allowance of fees and reimbursement of expenses by Gray Cary Ware & Freidenrich LLP, counsel for the chapter 7 trustee by Harold Taxel scheduled For 10:30 4/17/00 at Rm 328, Weinberger Courthouse ; (Entered: 03/21/2000)",
      "document_number": "160",
      "pacer_doc_id": null,
      "pacer_seq_no": null
    },
    {
      "date_entered": "2000-03-21",
      "date_filed": "2000-03-17",
      "description": "Certificate Of Service By Jeffry A. Davis for Trustee Harold Taxel Of [160-1] Motion Hearing Notice by Gray Cary Ware & Freidenrich, [159-1] Application For allowance of fees and reimbursement of expenses by special litigation accountants, Brodshatzer, Wallace, Spoon & Yip by Jeffry A. Davis, [158-1] Application For allowance of fees and reimbursement of expenses by Gray Cary Ware & Freidenrich LLP, counsel for the chapter 7 trustee by Harold Taxel . (Entered: 03/21/2000)",
      "document_number": "161",
      "pacer_doc_id": null,
      "pacer_seq_no": null
    },
    {
      "date_entered": "2000-03-22",
      "date_filed": "2000-03-20",
      "description": "Notice of Motion by: other professional Gray Cary Ware & Freidenrich With Hearing Re: [159-1] Application For allowance of fees and reimbursement of expenses by special litigation accountants, Brodshatzer, Wallace, Spoon & Yip by Jeffry A. Davis scheduled For 10:30 4/17/00 at Rm 328, Weinberger Courthouse, [158-1] Application For allowance of fees and reimbursement of expenses by Gray Cary Ware & Freidenrich LLP, counsel for the chapter 7 trustee by Harold Taxel scheduled For 10:30 4/17/00 at Rm 328, Weinberger Courthouse ; (Entered: 03/22/2000)",
      "document_number": "162",
      "pacer_doc_id": null,
      "pacer_seq_no": null
    },
    {
      "date_entered": "2000-04-18",
      "date_filed": "2000-04-17",
      "description": "Hearing Held Re: [159-1] Application For Allowance Of Fees And Reimbursement Of Expenses By Special Litigation Accountants, Brodshatzer, Wallace, Spoon & Yip, [158-1] Application For Allowance Of Fees And Reimbursement Of Expenses By Gray Cary Ware & Freidenrich LLP, Counsel For The Chapter 7 Trustee, [157-1] Application For Allowance Of Compensation And Reimbursement Of Expenses As Accountant For Harold Taxel, By R. Dean Johnson, CPA - - Granted As Prayed For. Prior Award Confirmed. Any Holdback Authorized For Payment; Order To Be Prepared By Jeffry Davis. (Entered: 04/18/2000)",
      "document_number": "163",
      "pacer_doc_id": null,
      "pacer_seq_no": null
    },
    {
      "date_entered": "2000-04-27",
      "date_filed": "2000-04-26",
      "description": "Order Granting [159-1] Application For allowance of fees and reimbursement of expenses by special litigation accountants, Brodshatzer, Wallace, Spoon & Yip by Jeffry A. Davis Granting [158-1] Application For allowance of fees and reimbursement of expenses by Gray Cary Ware & Freidenrich LLP, counsel for the chapter 7 trustee by Harold Taxel Granting [157-1] Application For allowance of Compensation and reimbursement of expenses as accountant for Harold Taxel, trustee of debtor by R. Dean Johnson, CPA . (Entered: 04/27/2000)",
      "document_number": "164",
      "pacer_doc_id": null,
      "pacer_seq_no": null
    },
    {
      "date_entered": "2000-06-07",
      "date_filed": "2000-06-05",
      "description": "Objection By Trustee Harold Taxel To Claim Of Imperial Bank, Clm. # 5 - $ 40,338.25. (Entered: 06/07/2000)",
      "document_number": "165",
      "pacer_doc_id": null,
      "pacer_seq_no": null
    },
    {
      "date_entered": "2000-06-07",
      "date_filed": "2000-06-05",
      "description": "Declaration In Support By Trustee Harold Taxel Re: [165-1] Claims Objection By Harold Taxel. (Entered: 06/07/2000)",
      "document_number": "166",
      "pacer_doc_id": null,
      "pacer_seq_no": null
    },
    {
      "date_entered": "2000-06-07",
      "date_filed": "2000-06-05",
      "description": "Objection By Trustee Harold Taxel To Claim Of Graham Jones, Clm. # 28 - $ 28,963.39. (Entered: 06/07/2000)",
      "document_number": "167",
      "pacer_doc_id": null,
      "pacer_seq_no": null
    },
    {
      "date_entered": "2000-06-07",
      "date_filed": "2000-06-05",
      "description": "Objection By Trustee Harold Taxel To Claim Of China National Chemicals Impor & Export, Clm. # 30 - $ 42,525.00. (Entered: 06/07/2000)",
      "document_number": "168",
      "pacer_doc_id": null,
      "pacer_seq_no": null
    },
    {
      "date_entered": "2000-06-07",
      "date_filed": "2000-06-05",
      "description": "Objection By Trustee Harold Taxel To Claim Of Russell Pearon, Clm. # 31 - $ 16,415.67. (Entered: 06/07/2000)",
      "document_number": "169",
      "pacer_doc_id": null,
      "pacer_seq_no": null
    },
    {
      "date_entered": "2000-06-07",
      "date_filed": "2000-06-05",
      "description": "Objection By Trustee Harold Taxel To Claim of Sande Equipment Company, Inc., Clm. # 41 - $ 2,453.90. (Entered: 06/07/2000)",
      "document_number": "170",
      "pacer_doc_id": null,
      "pacer_seq_no": null
    },
    {
      "date_entered": "2000-06-07",
      "date_filed": "2000-06-05",
      "description": "Objection By Trustee Harold Taxel To Claim of Monroe Paul Sweetland, Inc., Clm. # 43 - $ 5,481.30. (Entered: 06/07/2000)",
      "document_number": "171",
      "pacer_doc_id": null,
      "pacer_seq_no": null
    },
    {
      "date_entered": "2000-06-27",
      "date_filed": "2000-06-23",
      "description": "Trustee's Request For Notice Of Proposed Abandonment. (Entered: 06/27/2000)",
      "document_number": null,
      "pacer_doc_id": null,
      "pacer_seq_no": null
    },
    {
      "date_entered": "2000-07-03",
      "date_filed": "2000-06-27",
      "description": "Notice Of Intent By Trustee Harold Taxel To Abandon Claim Against Celadon-Jackey Maeder, Case # 99-90253; With Service # Of Notices 230. (Entered: 07/03/2000)",
      "document_number": "172",
      "pacer_doc_id": null,
      "pacer_seq_no": null
    },
    {
      "date_entered": "2000-08-02",
      "date_filed": "2000-08-02",
      "description": "Report by Trustee RE: [172-1] To Abandon Notice by Harold Taxel (Entered: 08/02/2000)",
      "document_number": "173",
      "pacer_doc_id": null,
      "pacer_seq_no": null
    },
    {
      "date_entered": "2000-08-07",
      "date_filed": "2000-08-03",
      "description": "Order Granted; re claims # 5, 28, 30, 31, 41, and 43. signed on 8/3/2000. (Guthrie, Y.) (Entered: 08/07/2000)",
      "document_number": "174",
      "pacer_doc_id": "0360302134",
      "pacer_seq_no": null
    },
    {
      "date_entered": "2000-10-19",
      "date_filed": "2000-10-18",
      "description": "Application for Compensation & Reimbursement of Expenses (First And Final) filed by Harold S. Taxel on behalf of Harold Taxel. (Robinson, G.) (Entered: 10/19/2000)",
      "document_number": "175",
      "pacer_doc_id": "03601202909",
      "pacer_seq_no": null
    },
    {
      "date_entered": "2000-11-01",
      "date_filed": "2000-10-31",
      "description": "Notice of Motion and Hearing with Certificate of Service Of First And Final Fee Application By Harold S. Taxel (related document(s) 175 ) filed by Harold S. Taxel on behalf of Harold Taxel. Scheduled for 12/4/2000 at 10:30 AM at Courtroom 4, Room 328, Weinberger Courthouse. Notice of Motion and Hearing Served On: 10/31/2000. Opposition due by: 11/17/2000. (Robinson, G.) (Entered: 11/01/2000)",
      "document_number": "176",
      "pacer_doc_id": "03601195006",
      "pacer_seq_no": null
    },
    {
      "date_entered": "2000-11-01",
      "date_filed": "2000-10-31",
      "description": "Notice by Trustee of Intent to Distribute Estate filed by Harold S. Taxel on behalf of Harold Taxel. Objections due by 11/29/2000, (Robinson, G.) (Entered: 11/01/2000)",
      "document_number": "177",
      "pacer_doc_id": "03601195007",
      "pacer_seq_no": null
    },
    {
      "date_entered": "2000-12-06",
      "date_filed": "2000-12-04",
      "description": "Hearing Held Harold S. Taxel's First And Final Application For Compensation & Reimbursement Of Expenses (Related Document 175 ) - - Granted; Order To Be Prepared By Harold S. Taxel. (Robinson, G.) (Entered: 12/06/2000)",
      "document_number": "178",
      "pacer_doc_id": "03602850502",
      "pacer_seq_no": null
    },
    {
      "date_entered": "2000-12-06",
      "date_filed": "2000-12-04",
      "description": "Order Granting First And Final Application For Compensation & Reimbursement Of Expenses By Harold S. Taxel (Related Document 175 ); Signed On 12/4/2000. (Robinson, G.) (Entered: 12/06/2000)",
      "document_number": "179",
      "pacer_doc_id": "0360512102",
      "pacer_seq_no": null
    },
    {
      "date_entered": "2000-12-08",
      "date_filed": "2000-12-07",
      "description": "Order Re: Trustee's Notice Of Intent To Distribute Estate And Notice Of Intended Action; Signed On 12/7/2000 (Related Document 177 ). (Robinson, G.) (Entered: 12/08/2000)",
      "document_number": "180",
      "pacer_doc_id": "0360516001",
      "pacer_seq_no": null
    },
    {
      "date_entered": "2000-12-12",
      "date_filed": "2000-12-08",
      "description": "Trustee's Final Report and Account and Application for Compensation filed by Harold Taxel. (Robinson, G.) (Entered: 12/12/2000)",
      "document_number": "181",
      "pacer_doc_id": "03602683331",
      "pacer_seq_no": null
    },
    {
      "date_entered": "2002-04-03",
      "date_filed": "2002-04-03",
      "description": "Order Approving Account, Discharging Trustee and Closing Estate. It appearing to the Court that Trustee, the Chapter 7 Trustee, has reduced the property and effects of the estate of the above-named debtor(s) to cash, or has disposed of said property and effects with approval of Court; the Trustee has made distribution as required by order of this Court and has rendered a full and complete account; and the Trustee has performed all other duties required of him in the administration of said estate; IT IS ORDERED that the accounts of the Trustee be approved and allowed; the Trustee be discharged and relieved of his trust; the bond of the Trustee, or blanket bond as it applies to this estate, be canceled and any sureties be released from further liability, except any liability which may have accrued during the time such bond was in effect; and the case is hereby closed. The debtor is relieved of any further responsibility for keeping this Court and the Trustee advised of his current mailing address. Barry K. Lander, Clerk (Robinson, G.) (Entered: 04/03/2002)",
      "document_number": "182",
      "pacer_doc_id": null,
      "pacer_seq_no": null
    },
    {
      "date_entered": "2002-07-15",
      "date_filed": "2002-07-12",
      "description": "Trustee's Final Account, Request for Discharge and, if applicable, for Transmittal of Unclaimed Funds Pursuant to Federal Rule of Bankruptcy Procedure 3011 filed by Harold Taxel. (Robinson, G.) (Entered: 07/15/2002)",
      "document_number": "183",
      "pacer_doc_id": "0360798545",
      "pacer_seq_no": null
    },
    {
      "date_entered": "2010-01-28",
      "date_filed": "2010-01-28",
      "description": "Application and Order for Return of Tendered Funds. $ 1,400.76, belonging to Mac Whyte Co.. COURT NOTE: Access to this document is Restricted; Please contact the Court on an alternate method of accessing this Document. with BNC Service signed on 1/28/2010. (Crosby, A.C.) (Entered: 01/28/2010)",
      "document_number": "184",
      "pacer_doc_id": "03607318455",
      "pacer_seq_no": null
    },
    {
      "date_entered": "2010-01-30",
      "date_filed": "2010-01-28",
