{
  "assigned_to_str": "Christopher S. Sontchi", 
  "case_name": "American Home Mortgage Holdings, Inc.", 
  "cause": null, 
  "court_id": "deb", 
  "date_converted": null, 
  "date_discharged": null, 
  "date_filed": "2007-08-06", 
  "date_terminated": null, 
  "demand": null, 
  "docket_entries": [
    {
      "date_filed": "2010-02-16", 
      "description": "Monthly Application for Compensation / Twenty-Second Monthly Fee Application of Blank Rome LLP, Co-Counsel to the Official Committee of Unsecured Creditors of American Home Mortgage Holdings, Inc., et al., for Compensation and Reimbursement of Expenses for the Period of January 1, 2010 through January 31, 2010 Filed by Blank Rome LLP. Objections due by 3/8/2010. (Attachments: # 1 Notice # 2 Attachment B# 3 Exhibit A# 4 Exhibit B# 5 Certificate of Service) (Fatell, Bonnie) (Entered: 02/16/2010)", 
      "document_number": "8580", 
      "pacer_doc_id": "show_doc.pl"
    }, 
    {
      "date_filed": "2010-02-16", 
      "description": "Monthly Application for Compensation / Twenty-First Monthly Fee Application of Blank Rome LLP, Co-Counsel to the Official Committee of Unsecured Creditors of American Home Mortgage Holdings, Inc., et al., for Compensation and Reimbursement of Expenses for the Period of December 1, 2009 through December 31, 2009 Filed by Blank Rome LLP. Objections due by 3/8/2010. (Attachments: # 1 Notice # 2 Attachment B# 3 Exhibit A# 4 Exhibit B# 5 Certificate of Service) (Fatell, Bonnie) (Entered: 02/16/2010)", 
      "document_number": "8579", 
      "pacer_doc_id": "show_doc.pl"
    }, 
    {
      "date_filed": "2010-02-16", 
      "description": "Amended Notice of Agenda of Matters Scheduled for Hearing Filed by American Home Mortgage Holdings, Inc.. Hearing scheduled for 2/18/2010 at 11:00 AM at US Bankruptcy Court, 824 Market St., 5th Fl., Courtroom #6, Wilmington, Delaware. (Hammond Coyle, Kara) (Entered: 02/16/2010)", 
      "document_number": "8578", 
      "pacer_doc_id": "show_doc.pl"
    }, 
    {
      "date_filed": "2010-02-16", 
      "description": "Affidavit of Kevin Nystrom in Support of Debtors' Motion to Approve Sale, Assignment and Transfer of Limited Liability Company Interest of Broadhollow Funding, LLC; and (B) the Sale, Assignment and Transfer of Limited Liability Company Interest of Melville Funding, LLC; (II) Settlement of Claims, Releases and Waivers; (III) Release of Certain Escrow Funds; and (IV) Granting Related Relief (related document(s) 8524 ) Filed by American Home Mortgage Holdings, Inc.. (Hammond Coyle, Kara) (Entered: 02/16/2010)", 
      "document_number": "8577", 
      "pacer_doc_id": "show_doc.pl"
    }, 
    {
      "date_filed": "2010-02-16", 
      "description": "Order Granting Motion for Admission pro hac vice of Allan B. Diamond and Christopher A. Provost. (Related Doc # 8575 ) Order Signed on 2/16/2010. (BAM) (Entered: 02/16/2010)", 
      "document_number": "8576", 
      "pacer_doc_id": "show_doc.pl"
    }, 
    {
      "date_filed": "2010-02-16", 
      "description": "Motion to Appear pro hac vice of Allan B. Diamond and Christopher A. Provost, Esquires of Diamond McCarthy LLP. Receipt Number DEX003147, Filed by B&M Management Corp.. (Attachments: # 1 Proposed Form of Order # 2 Certificate of Service) (Monhait, Norman) (Entered: 02/16/2010)", 
      "document_number": "8575", 
      "pacer_doc_id": "show_doc.pl"
    }, 
    {
      "date_filed": "2010-02-16", 
      "description": "Notice of Agenda of Matters Scheduled for Hearing Filed by American Home Mortgage Holdings, Inc.. Hearing scheduled for 2/18/2010 at 11:00 AM at US Bankruptcy Court, 824 Market St., 5th Fl., Courtroom #6, Wilmington, Delaware. (Hammond Coyle, Kara) (Entered: 02/16/2010)", 
      "document_number": "8574", 
      "pacer_doc_id": "show_doc.pl"
    }, 
    {
      "date_filed": "2010-02-16", 
      "description": "Exhibit - Notice of Filing of (A) Revised Sale, Assignment and Transfer of Limited Liability Company Interest of Broadhollow Funding, LLC (B) Revised Sale, Assignment and Transfer of Limited Liability Company Interest of Melville Funding, LLC; and (C) Revised Proposed form of Order Pursuant to Bankruptcy Code Sections 105, 363 and 1146(a) and Bankruptcy Rules 2002, 6004, 9014 and 9019 Approving and Authorizing: (I)(a) the Sale, Assignment and Transfer of Limited Liability Company Interest of Broadhollow Funding, LLC; and (b) The Sale, Assignment and transfer of Limited Liability Company Interest of Melville Funding, LLC; (II) Settlement of Claims, Releases and Waivers; (III) Release of Certain Escrow Funds; and (IV) Granting Related Relief (related document(s) 8524 ) Filed by American Home Mortgage Holdings, Inc.. (Attachments: # 1 Exhibit A# 2 Exhibit B# 3 Exhbit C# 4 Exhibit D# 5 Exhibit E# 6 Exhibit F) (Hammond Coyle, Kara) (Entered: 02/16/2010)", 
      "document_number": "8573", 
      "pacer_doc_id": "show_doc.pl"
    }, 
    {
      "date_filed": "2010-02-16", 
      "description": "Notice of Service Notice of Filing of Proposed Order Approving Stipulation Regarding the Objection of CitiMortgage, Inc. to Proposed Purchaser's Cure Amounts Filed by American Home Mortgage Servicing, Inc.. (Attachments: # 1 Exhibit A# 2 Certificate of Service) (Minuti, Mark) (Entered: 02/16/2010)", 
      "document_number": "8572", 
      "pacer_doc_id": "show_doc.pl"
    }, 
    {
      "date_filed": "2010-02-15", 
      "description": "Monthly Application for Compensation (Seventh) as Special Conflicts Counsel to the Official Committee of Unsecured Creditors for Allowance of Compensation for Services Rendered and Reimbursement of Expenses for the Period of January 1, 2010 through January 31, 2010 Filed by Ferry, Joseph & Pearce, P.A.. Objections due by 3/8/2010. (Attachments: # 1 Notice # 2 Exhibit A# 3 Exhibit B# 4 Certificate of Service) (Coggins, Lisa) (Entered: 02/15/2010)", 
      "document_number": "8571", 
      "pacer_doc_id": "show_doc.pl"
    }, 
    {
      "date_filed": "2010-02-15", 
      "description": "Affidavit/Declaration of Service (related document(s) 8558, 8559 ) Filed by American Home Mortgage Holdings, Inc.. (Bartley, Ryan) (Entered: 02/15/2010)", 
      "document_number": "8570", 
      "pacer_doc_id": "show_doc.pl"
    }, 
    {
      "date_filed": "2010-02-15", 
      "description": "Affidavit/Declaration of Service regarding Application for Compensation and Reimbursement of Expenses for the Period November 1, 2009 through November 30, 2009 Filed by Allen & Overy, LLP (related document(s) 8450 ) Filed by American Home Mortgage Holdings, Inc.. (Bartley, Ryan) (Entered: 02/15/2010)", 
      "document_number": "8569", 
      "pacer_doc_id": "show_doc.pl"
    }, 
    {
      "date_filed": "2010-02-15", 
      "description": "Affidavit/Declaration of Service (related document(s) 8528, 8532, 8533 ) Filed by American Home Mortgage Holdings, Inc.. (Bartley, Ryan) (Entered: 02/15/2010)", 
      "document_number": "8568", 
      "pacer_doc_id": "show_doc.pl"
    }, 
    {
      "date_filed": "2010-02-15", 
      "description": "Affidavit/Declaration of Service regarding Application for Compensation and Reimbursement of Expenses for the Period December 1, 2009 through December 31, 2009 Filed by Allen & Overy, LLP (related document(s) 8538 ) Filed by American Home Mortgage Holdings, Inc.. (Bartley, Ryan) (Entered: 02/15/2010)", 
      "document_number": "8567", 
      "pacer_doc_id": "show_doc.pl"
    }, 
    {
      "date_filed": "2010-02-15", 
      "description": "Affidavit/Declaration of Service regarding Application for Compensation and Reimbursement of Expenses for the Period November 1, 2009 through November 30, 2009 Filed by QUINN, EMANUEL, URQUHART, OLIVER & HEDGES, LLP (related document(s) 8522 ) Filed by American Home Mortgage Holdings, Inc.. (Bartley, Ryan) (Entered: 02/15/2010)", 
      "document_number": "8566", 
      "pacer_doc_id": "show_doc.pl"
    }, 
    {
      "date_filed": "2010-02-15", 
      "description": "Affidavit/Declaration of Service regarding Motion to Approve Sale, Assignment and Transfer of Limited Liability Company Interest of Broadhollow Funding, LLC; and (B) the Sale, Assignment and Transfer of Limited Liability Company Interest of Melville Funding, LLC; (II) Settlement of Claims, Releases and Waivers; (III) Release of Certain Escrow Funds; and (IV) Granting Related Relief (related document(s) 8524 ) Filed by Epiq Bankrputcy Solutions, LLC. (Beach, Sean) (Entered: 02/15/2010)", 
      "document_number": "8565", 
      "pacer_doc_id": "show_doc.pl"
    }, 
    {
      "date_filed": "2010-02-15", 
      "description": "Certificate of Publication regarding Motion to Approve Sale, Assignment and Transfer of Limited Liability Company Interest of Broadhollow Funding, LLC; and (B) the Sale, Assignment and Transfer of Limited Liability Company Interest of Melville Funding, LLC; (II) Settlement of Claims, Releases and Waivers; (III) Release of Certain Escrow Funds; and (IV) Granting Related Relief (related document(s) 8524, 8525 ) Filed by American Home Mortgage Holdings, Inc.. (Beach, Sean) (Entered: 02/15/2010)", 
      "document_number": "8564", 
      "pacer_doc_id": "show_doc.pl"
    }, 
    {
      "date_filed": "2010-02-15", 
      "description": "Affidavit/Declaration of Service regarding Motion to Approve Sale, Assignment and Transfer of Limited Liability Company Interest of Broadhollow Funding, LLC; and (B) the Sale, Assignment and Transfer of Limited Liability Company Interest of Melville Funding, LLC; (II) Settlement of Claims, Releases and Waivers; (III) Release of Certain Escrow Funds; and (IV) Granting Related Relief (related document(s) 8521, 8524, 8525 ) Filed by American Home Mortgage Holdings, Inc.. (Beach, Sean) (Entered: 02/15/2010)", 
      "document_number": "8563", 
      "pacer_doc_id": "show_doc.pl"
    }, 
    {
      "date_filed": "2010-02-15", 
      "description": "Affidavit/Declaration of Service regarding Amended Application for Compensation - Ninth Interim Quarterly Fee Requests of Debtors' Professionals (related document(s) 8484 ) Filed by American Home Mortgage Holdings, Inc.. (Beach, Sean) (Entered: 02/15/2010)", 
      "document_number": "8562", 
      "pacer_doc_id": "show_doc.pl"
    }, 
    {
      "date_filed": "2010-02-12", 
      "description": "Monthly Application for Compensation / Twenty-Eighth Monthly Fee Application of BDO Seidman, LLP, Financial Advisors to the Official Committee of Unsecured Creditors of American Home Mortgage Holdings, Inc., et al., for Compensation and Reimbursement of Expenses for the Period January 1, 2010 through January 31, 2010 Filed by BDO Seidman, LLP. Objections due by 3/4/2010. (Attachments: # 1 Notice # 2 Exhibit # 3 Declaration # 4 Certificate of Service) (Fatell, Bonnie) (Entered: 02/12/2010)", 
      "document_number": "8561", 
      "pacer_doc_id": "show_doc.pl"
    }, 
    {
      "date_filed": "2010-02-12", 
      "description": "Certification of Counsel Submitting Consensual Order Resolving Debtors' Twenty-Ninth Omnibus Objection to Claims (related document(s) 6826 ) Filed by American Home Mortgage Holdings, Inc.. (Neiburg, Michael) (Entered: 02/12/2010)", 
      "document_number": "8560", 
      "pacer_doc_id": "show_doc.pl"
    }, 
    {
      "date_filed": "2010-02-12", 
      "description": "Application for Compensation and Reimbursement of Expenses for the Period November 1, 2009 through November 30, 2009 Filed by Cadwalader, Wickersham & Taft LLP. Objections due by 3/4/2010. (Attachments: # 1 Notice) (Bartley, Ryan) (Entered: 02/12/2010)", 
      "document_number": "8559", 
      "pacer_doc_id": "show_doc.pl"
    }, 
    {
      "date_filed": "2010-02-12", 
      "description": "Application for Compensation and Reimbursement of Expenses for the Period December 1, 2009 through December 31, 2009 Filed by Weiner Brodsky Sidman Kider PC. Objections due by 3/4/2010. (Attachments: # 1 Notice) (Bartley, Ryan) (Entered: 02/12/2010)", 
      "document_number": "8558", 
      "pacer_doc_id": "show_doc.pl"
    }, 
    {
      "date_filed": "2010-02-11", 
      "description": "Certificate of Service regarding Order Granting The Official Committee Of Unsecured Creditors' Fifth Omnibus Motion For An Order Approving Settlements With Certain Preference Defendants (related document(s) 8553 ) Filed by Official Committee of Unsecured Creditors. (Guilfoyle, Victoria) (Entered: 02/11/2010)", 
      "document_number": "8557", 
      "pacer_doc_id": "show_doc.pl"
    }, 
    {
      "date_filed": "2010-02-11", 
      "description": "Objection of the Debtors and the Committee to the Motion for Supersedeas Bond to Protect Judgment for Mona Dobben (related document(s) 8527 ) Filed by American Home Mortgage Holdings, Inc. (Attachments: # 1 Exhibit A# 2 Exhibit B# 3 Exhibit C) (Beach, Sean) (Entered: 02/11/2010)", 
      "document_number": "8556", 
      "pacer_doc_id": "show_doc.pl"
    }, 
    {
      "date_filed": "2010-02-09", 
      "description": "Monthly Application for Compensation / Twenty-Seventh Monthly Fee Application of BDO Seidman, LLP, Financial Advisors to the Official Committee of Unsecured Creditors of American Home Mortgage Holdings, Inc., et al., for Compensation and Reimbursement of Expenses for the Period December 1, 2009 through December 31, 2009 Filed by BDO Seidman, LLP. Objections due by 3/1/2010. (Attachments: # 1 Notice # 2 Exhibit # 3 Declaration # 4 Certificate of Service) (Fatell, Bonnie) (Entered: 02/09/2010)", 
      "document_number": "8555", 
      "pacer_doc_id": "show_doc.pl"
    }, 
    {
      "date_filed": "2010-02-09", 
      "description": "Notice of Appearance of Rosenthal, Monhait & Goddess, P.A. and Diamond McCarthy LLP Filed by B&M Management Corp.. (Attachments: # 1 Certificate of Service) (Monhait, Norman) (Entered: 02/09/2010)", 
      "document_number": "8554", 
      "pacer_doc_id": "show_doc.pl"
    }, 
    {
      "date_filed": "2010-02-09", 
      "description": "Order Granting The Official Committee Of Unsecured Creditors' Fifth Omnibus Motion For An Order Approving Settlements With Certain Preference Defendants. (related document(s) 8497 ) Order Signed on 2/9/2010. (BMT) (Entered: 02/09/2010)", 
      "document_number": "8553", 
      "pacer_doc_id": "show_doc.pl"
    }, 
    {
      "date_filed": "2010-02-09", 
      "description": "Response to Omnibus Objection to Claim(s) (related document(s) 8544 ) Filed by Folsom Parkshore Self-Storage (BAM) (Entered: 02/09/2010)", 
      "document_number": "8552", 
      "pacer_doc_id": "show_doc.pl"
    }, 
    {
      "date_filed": "2010-02-08", 
      "description": "Certification of Counsel Submitting Consensual Order Resolving Omnibus Objection to Claims (Thirteenth) (Substantive). (related document(s) 5181 ) Filed by American Home Mortgage Holdings, Inc.. (Neiburg, Michael) (Entered: 02/08/2010)", 
      "document_number": "8551", 
      "pacer_doc_id": "show_doc.pl"
    }, 
    {
      "date_filed": "2010-02-08", 
      "description": "Certificate of No Objection to Monthly Application for Compensation for Services Rendered and Reimbursement of Expenses For the Period of December 1, 2009 through December 31, 2009 (related document(s) 8508 ) Filed by Ferry, Joseph & Pearce, P.A.. (Attachments: # 1 Certificate of Service) (Coggins, Lisa) (Entered: 02/08/2010)", 
      "document_number": "8550", 
      "pacer_doc_id": "show_doc.pl"
    }, 
    {
      "date_filed": "2010-02-08", 
      "description": "Affidavit/Declaration of Service regarding Omnibus Objection to Claims (Fifty-First) (Substantive). (related document(s) 8544 ) Filed by American Home Mortgage Holdings, Inc.. (Neiburg, Michael) (Entered: 02/08/2010)", 
      "document_number": "8549", 
      "pacer_doc_id": "show_doc.pl"
    }, 
    {
      "date_filed": "2010-02-08", 
      "description": "Certificate of No Objection regarding The Official Committee of Unsecured Creditors Fifth Omnibus Motion for an Order Approving Settlements with Certain Preference Defendants and Limiting Notice Thereof (related document(s) 8497 ) Filed by Official Committee of Unsecured Creditors. (Guilfoyle, Victoria) (Entered: 02/08/2010)", 
      "document_number": "8548", 
      "pacer_doc_id": "show_doc.pl"
    }, 
    {
      "date_filed": "2010-02-08", 
      "description": "Order Granting First and Final Application of Margot Saunders.(related document(s) 7372 ) Order Signed on 2/8/2010. (BAM) (Entered: 02/08/2010)", 
      "document_number": "8547", 
      "pacer_doc_id": "show_doc.pl"
    }, 
    {
      "date_filed": "2010-02-06", 
      "description": "BNC Certificate of Mailing. (related document(s) 8537 ) Service Date 02/06/2010. (Admin.) (Entered: 02/07/2010)", 
      "document_number": "8546", 
      "pacer_doc_id": "show_doc.pl"
    }, 
    {
      "date_filed": "2010-02-05", 
      "description": "Certification of Counsel Proposed Order re First Interim Fee Application of Margot Saunders for Allowance of Fees and Reimbursement of Expenses as Testifying Expert on Behalf of the Official Committee of Borrowers for the Period January 20, 2009 Through February 28, 2009 (related document(s) 7372 ) Filed by Official Committee of Borrowers. (Macauley, Thomas) (Entered: 02/05/2010)", 
      "document_number": "8545", 
      "pacer_doc_id": "show_doc.pl"
    }, 
    {
      "date_filed": "2010-02-05", 
      "description": "Omnibus Objection to Claims (Fifty-First) (Substantive). Filed by American Home Mortgage Holdings, Inc.. Hearing scheduled for 3/9/2010 at 10:00 AM at US Bankruptcy Court, 824 Market St., 5th Fl., Courtroom #6, Wilmington, Delaware. Objections due by 3/9/2010. (Attachments: # 1 Notice # 2 Proposed Form of Order) (Neiburg, Michael) (Entered: 02/05/2010)", 
      "document_number": "8544", 
      "pacer_doc_id": "show_doc.pl"
    }, 
    {
      "date_filed": "2010-02-05", 
      "description": "Notice of Withdrawal of Certificate of No Objection regarding Twentieth Monthly Fee Application of Blank Rome LLP, Co-Counsel to the Official Committee of Unsecured Creditors of American Home Mortgage Holdings, Inc., et al., for Compensation and Reimbursement of Expenses for the Period of November 1, 2009 through November 30, 2009 (related document(s) 8531 ) Filed by Blank Rome LLP. (Fatell, Bonnie) (Entered: 02/05/2010)", 
      "document_number": "8543", 
      "pacer_doc_id": "show_doc.pl"
    }, 
    {
      "date_filed": "2010-02-05", 
      "description": "Notice of Submission of Proof of Claim regarding Omnibus Objection to Claims - Fiftieth (Substantive). (related document(s) 8513 ) Filed by American Home Mortgage Holdings, Inc.. (Neiburg, Michael) (Entered: 02/05/2010)", 
      "document_number": "8542", 
      "pacer_doc_id": "show_doc.pl"
    }, 
    {
      "date_filed": "2010-02-04", 
      "description": "Order CONSENSUAL) Resolving Debtors' Thirtheenth Omnibus (Substantive) Objection to Claims with Respect to Proof of Claims No.6085.(related document(s) 5181, 5463 ) Order Signed on 2/4/2010. (BAM) (Entered: 02/04/2010)", 
      "document_number": "8541", 
      "pacer_doc_id": "show_doc.pl"
    }, 
    {
      "date_filed": "2010-02-04", 
      "description": "Order CONSENSUAL) Resolving Debtors' Thirtheenth Omnibus (Substantive) Objection to Claims with Respect to Proof of Claims No.7066.(related document(s) 5181, 5463 ) Order Signed on 2/4/2010. (BAM) (Entered: 02/04/2010)", 
      "document_number": "8540", 
      "pacer_doc_id": "show_doc.pl"
    }, 
    {
      "date_filed": "2010-02-04", 
      "description": "Order (CONSENSUAL) Resolving Debtors' Thirtheenth Omnibus (Substantive) Objection to Claims with Respect to Proof of Claims No.5538. (related document(s) 5181, 5463 ) Order Signed on 2/4/2010. (BAM) added related docket no. on 2/5/2010 (BAM). (Entered: 02/04/2010)", 
      "document_number": "8539", 
      "pacer_doc_id": "show_doc.pl"
    }, 
    {
      "date_filed": "2010-02-04", 
      "description": "Application for Compensation and Reimbursement of Expenses for the Period December 1, 2009 through December 31, 2009 Filed by Allen & Overy, LLP. Objections due by 2/24/2010. (Attachments: # 1 Notice) (Enos, Kenneth) (Entered: 02/04/2010)", 
      "document_number": "8538", 
      "pacer_doc_id": "show_doc.pl"
    }, 
    {
      "date_filed": "2010-02-04", 
      "description": "Transcript regarding Hearing Held 1/12/10 RE: Omnibus, Pre-trial. Remote electronic access to the transcript is restricted until 5/5/2010. The transcript may be viewed at the Bankruptcy Court Clerk's Office. [For information about how to contact the transcriber, call the Clerk's Office] or [Contact the Court Reporter/Transcriber Diaz Data Services, Telephone number 717-233-6664.] Notice of Intent to Request Redaction Deadline Due By 2/11/2010. Redaction Request Due By 2/25/2010. Redacted Transcript Submission Due By 3/8/2010. Transcript access will be restricted through 5/5/2010. (related document(s) 8483 ) (LAM) (Entered: 02/04/2010)", 
      "document_number": "8537", 
      "pacer_doc_id": "show_doc.pl"
    }, 
    {
      "date_filed": "2010-02-04", 
      "description": "Transmittal of Record on Appeal to DC District Court BAP 09-102 (related document(s) 8436 ) (BAM) (Entered: 02/04/2010)", 
      "document_number": "8536", 
      "pacer_doc_id": "show_doc.pl"
    }, 
    {
      "date_filed": "2010-02-03", 
      "description": "Certification of Counsel Submitting Consensual Order Resolving Debtors' Thirteenth Omnibus Objection to Claims with Respect to Proof of Claim No. 6085 (related document(s) 5181 ) Filed by American Home Mortgage Holdings, Inc.. (Neiburg, Michael) (Entered: 02/03/2010)", 
      "document_number": "8535", 
      "pacer_doc_id": "show_doc.pl"
    }, 
    {
      "date_filed": "2010-02-03", 
      "description": "Certification of Counsel Submitting Consensual Order Resolving Debtors' Thirteenth Omnibus Objection to Claims with Respect to Proof of Claim No. 7066 (related document(s) 5181 ) Filed by American Home Mortgage Holdings, Inc.. (Neiburg, Michael) (Entered: 02/03/2010)", 
      "document_number": "8534", 
      "pacer_doc_id": "show_doc.pl"
    }, 
    {
      "date_filed": "2010-02-02", 
      "description": "Application for Compensation and Reimbursement of Expenses for the Period December 1, 2009 through December 31, 2009 Filed by Young Conaway Stargatt & Taylor, LLP. Objections due by 2/22/2010. (Attachments: # 1 Notice # 2 Exhibit) (Morgan, Pauline) (Entered: 02/02/2010)", 
      "document_number": "8533", 
      "pacer_doc_id": "show_doc.pl"
    }, 
    {
      "date_filed": "2010-02-02", 
      "description": "Application for Compensation and Reimbursement of Expenses for the Period December 1, 2009 through December 31, 2009 Filed by Zolfo Cooper. Objections due by 2/22/2010. (Attachments: # 1 Notice) (Lunn, Matthew) (Entered: 02/02/2010)", 
      "document_number": "8532", 
      "pacer_doc_id": "show_doc.pl"
    }, 
    {
      "date_filed": "2010-02-02", 
      "description": "WILTHSDRAWN related docket # 8543 . Certificate of No Objection regarding Twentieth Monthly Fee Application of Blank Rome LLP, Co-Counsel to the Official Committee of Unsecured Creditors of American Home Mortgage Holdings, Inc., et al., for Compensation and Reimbursement of Expenses for the Period of November 1, 2009 through November 30, 2009 [No Order Required] (related document(s) 8353 ) Filed by Blank Rome LLP. (Fatell, Bonnie) Modified on 2/8/2010 (BAM). (Entered: 02/02/2010)", 
      "document_number": "8531", 
      "pacer_doc_id": "show_doc.pl"
    }, 
    {
      "date_filed": "2010-02-02", 
      "description": "Order Setting Omnibus Hearing Dates. All hearings will be held at US Bankruptcy Court, 824 Market St., 5th Fl., Courtroom #6, Wilmington, Delaware (Related document(s) 8529 ). Omnibus Hearings scheduled for 4/6/2010 at 10:30 AM., 5/4/2010 at 09:00 AM. Signed on 2/2/2010. (BAM) (Entered: 02/02/2010)", 
      "document_number": "8530", 
      "pacer_doc_id": "show_doc.pl"
    }, 
    {
      "date_filed": "2010-02-02", 
      "description": "Certification of Counsel Submitting Consensual Order Regarding Omnibus Objection to Claims - Forty Second (Substantive). (related document(s) 8049 ) Filed by American Home Mortgage Holdings, Inc.. (Neiburg, Michael) (Entered: 02/02/2010)", 
      "document_number": "8529", 
      "pacer_doc_id": "show_doc.pl"
    }, 
    {
      "date_filed": "2010-02-02", 
      "description": "Application for Compensation and Reimbursement of Expenses for the Period November 1, 2009 through November 30, 2009 Filed by Young Conaway Stargatt & Taylor, LLP. Objections due by 2/22/2010. (Attachments: # 1 Notice # 2 Exhibit) (Morgan, Pauline) (Entered: 02/02/2010)", 
      "document_number": "8528", 
      "pacer_doc_id": "show_doc.pl"
    }, 
    {
      "date_filed": "2010-01-29", 
      "description": "Motion to Prohibit Use of Cash Collateral Motion for Supersedeas Bond to Protect Judgment for Mona Dobben (related document(s) 8424 ) Filed by Mona Dobben. Hearing scheduled for 2/18/2010 at 11:00 AM at US Bankruptcy Court, 824 Market St., 5th Fl., Courtroom #6, Wilmington, Delaware. Objections due by 2/11/2010. (Attachments: # 1 Certificate of Service # 2 Notice # 3 Proposed Form of Order) (Houghton, Vivian) (Entered: 01/29/2010)", 
      "document_number": "8527", 
      "pacer_doc_id": "show_doc.pl"
    }, 
    {
      "date_filed": "2010-01-29", 
      "description": "Application for Compensation / First Application of Receivable Management Services Corporation for Compensation for Services Rendered as Collection Agent for the Official Committee of Unsecured Creditors of American Home Mortgage Holdings, Inc., et al., the Period of July 1, 2009 through December 31, 2009 Filed by Receivable Management Service. Hearing scheduled for 2/18/2010 at 11:00 AM at US Bankruptcy Court, 824 Market St., 5th Fl., Courtroom #6, Wilmington, Delaware. Objections due by 2/15/2010. (Attachments: # 1 Notice # 2 Exhibit # 3 Declaration # 4 Certificate of Service) (Guilfoyle, Victoria) (Entered: 01/29/2010)", 
      "document_number": "8526", 
      "pacer_doc_id": "show_doc.pl"
    }, 
    {
      "date_filed": "2010-01-29", 
      "description": "Notice of Hearing - Notice of Private Sale and Sale Approval Hearing (related document(s) 8524 ) Filed by American Home Mortgage Holdings, Inc.. Hearing scheduled for 2/18/2010 at 11:00 AM at US Bankruptcy Court, 824 Market St., 5th Fl., Courtroom #6, Wilmington, Delaware. Objections due by 2/11/2010. (Beach, Sean) Additional attachment(s) added on 2/2/2010 (BAM). (Entered: 01/29/2010)", 
      "document_number": "8525", 
      "pacer_doc_id": "show_doc.pl"
    }, 
    {
      "date_filed": "2010-01-29", 
      "description": "Motion to Approve Sale, Assignment and Transfer of Limited Liability Company Interest of Broadhollow Funding, LLC; and (B) the Sale, Assignment and Transfer of Limited Liability Company Interest of Melville Funding, LLC; (II) Settlement of Claims, Releases and Waivers; (III) Release of Certain Escrow Funds; and (IV) Granting Related Relief Filed by American Home Mortgage Holdings, Inc.. Hearing scheduled for 2/18/2010 at 11:00 AM at US Bankruptcy Court, 824 Market St., 5th Fl., Courtroom #6, Wilmington, Delaware. Objections due by 2/11/2010. (Attachments: # 1 Notice # 2 Exhibit A and B# 3 Proposed Form of Order) (Beach, Sean) (Entered: 01/29/2010)", 
      "document_number": "8524", 
      "pacer_doc_id": "show_doc.pl"
    }, 
    {
      "date_filed": "2010-01-29", 
      "description": "Certification of Counsel Regarding Scheduling of Omnibus Hearing Dates Filed by American Home Mortgage Holdings, Inc.. (Beach, Sean) (Entered: 01/29/2010)", 
      "document_number": "8523", 
      "pacer_doc_id": "show_doc.pl"
    }, 
    {
      "date_filed": "2010-01-29", 
      "description": "Application for Compensation and Reimbursement of Expenses for the Period November 1, 2009 through November 30, 2009 Filed by QUINN, EMANUEL, URQUHART, OLIVER & HEDGES, LLP. Objections due by 2/18/2010. (Attachments: # 1 Notice) (Jackson, Patrick) (Entered: 01/29/2010)", 
      "document_number": "8522", 
      "pacer_doc_id": "show_doc.pl"
    }, 
    {
      "date_filed": "2010-01-29", 
      "description": "Motion to Approve Compromise under Rule 9019 for an Order Approving and Authorizing the Stipulation Between American Home Mortgage Corp. and Corporate Center Drive Holdings, LLC Resolving All Claims and Disputes Relating to Stockbridge Property Filed by American Home Mortgage Holdings, Inc.. Hearing scheduled for 2/18/2010 at 11:00 AM at US Bankruptcy Court, 824 Market St., 5th Fl., Courtroom #6, Wilmington, Delaware. Objections due by 2/11/2010. (Attachments: # 1 Notice # 2 Proposed Form of Order) (Neiburg, Michael) (Entered: 01/29/2010)", 
      "document_number": "8521", 
      "pacer_doc_id": "show_doc.pl"
    }, 
    {
      "date_filed": "2010-01-28", 
      "description": "Order (Consensual) Regarding Debtors Thirty-Seventh Omnibus (Substantive)Objection to Claims. (related document(s) 7473, 7566, 7584 ) Signed on 1/28/2010. (VIB) (Entered: 01/28/2010)", 
      "document_number": "8520", 
      "pacer_doc_id": "show_doc.pl"
    }, 
    {
      "date_filed": "2010-01-27", 
      "description": "Certification of Counsel regarding Omnibus Objection to Claims (Thirty-Seventh) (Substantive). (related document(s) 7473 ) Filed by American Home Mortgage Holdings, Inc.. (Neiburg, Michael) (Entered: 01/27/2010)", 
      "document_number": "8519", 
      "pacer_doc_id": "show_doc.pl"
    }, 
    {
      "date_filed": "2010-01-22", 
      "description": "Affidavit/Declaration of Service Regarding Omnibus Objection to Claims - Forty-Ninth (Non-Substantive); Omnibus Objection to Claims - Fiftieth (Substantive);Objection to Repurchase Agreement Deficiency Claim of Orix Capital Markets, LLC (Claim No. 9211) (related document(s) 8512, 8513, 8514 ) Filed by American Home Mortgage Holdings, Inc.. (Beach, Sean) (Entered: 01/22/2010)", 
      "document_number": "8518", 
      "pacer_doc_id": "show_doc.pl"
    }, 
    {
      "date_filed": "2010-01-21", 
      "description": "Certificate of No Objection regarding Application for Compensation and Reimbursement of Expenses for the Period November 1, 2009 through November 30, 2009 Filed by Allen & Overy, LLP (related document(s) 8450 ) Filed by American Home Mortgage Holdings, Inc.. (Enos, Kenneth) (Entered: 01/21/2010)", 
      "document_number": "8517", 
      "pacer_doc_id": "show_doc.pl"
    }, 
    {
      "date_filed": "2010-01-21", 
      "description": "Certificate of No Objection regarding Application for Compensation and Reimbursement of Expenses for the Period November 1, 2009 through November 30, 2009 Filed by Zolfo Cooper (related document(s) 8435 ) Filed by American Home Mortgage Holdings, Inc.. (Bartley, Ryan) (Entered: 01/21/2010)", 
      "document_number": "8516", 
      "pacer_doc_id": "show_doc.pl"
    }, 
    {
      "date_filed": "2010-01-20", 
      "description": "Certificate of No Objection to Fourth Monthly Application for Allowance of Compensation for Services Rendered and for Reimbursement of Expenses for the Period from August 1, 2009 Through October 31, 2009 (related document(s) 8439 ) Filed by Hennigan, Bennett & Dorman LLP. (Attachments: # 1 Certificate of Service) (Coggins, Lisa) (Entered: 01/20/2010)", 
      "document_number": "8515", 
      "pacer_doc_id": "show_doc.pl"
    }, 
    {
      "date_filed": "2010-01-19", 
      "description": "Motion to Disallow Claim(s) /Objection to Repurchase Agreement Deficiency Claim of Orix Capital Markets, LLC (Claim No. 9211). Filed by American Home Mortgage Holdings, Inc.. Hearing scheduled for 2/18/2010 at 11:00 AM at US Bankruptcy Court, 824 Market St., 5th Fl., Courtroom #6, Wilmington, Delaware. Objections due by 2/11/2010. (Attachments: # 1 Notice # 2 Proposed Form of Order) (Neiburg, Michael) Modified text on 1/21/2010 (BAM). (Entered: 01/19/2010)", 
      "document_number": "8514", 
      "pacer_doc_id": "show_doc.pl"
    }, 
    {
      "date_filed": "2010-01-19", 
      "description": "Omnibus Objection to Claims - Fiftieth (Substantive). Filed by American Home Mortgage Holdings, Inc.. Hearing scheduled for 2/18/2010 at 11:00 AM at US Bankruptcy Court, 824 Market St., 5th Fl., Courtroom #6, Wilmington, Delaware. Objections due by 2/11/2010. (Attachments: # 1 Notice # 2 Declaration # 3 Proposed Form of Order with Exhibits) (Neiburg, Michael) (Entered: 01/19/2010)", 
      "document_number": "8513", 
      "pacer_doc_id": "show_doc.pl"
    }, 
    {
      "date_filed": "2010-01-19", 
      "description": "Omnibus Objection to Claims - Forty-Ninth (Non-Substantive). Filed by American Home Mortgage Holdings, Inc.. Hearing scheduled for 2/18/2010 at 11:00 AM at US Bankruptcy Court, 824 Market St., 5th Fl., Courtroom #6, Wilmington, Delaware. Objections due by 2/11/2010. (Attachments: # 1 Notice # 2 Declaration # 3 Proposed Form of Order with Exhibits) (Neiburg, Michael) (Entered: 01/19/2010)", 
      "document_number": "8512", 
      "pacer_doc_id": "show_doc.pl"
    }, 
    {
      "date_filed": "2010-01-19", 
      "description": "Order (CONSENSUAL) Regarding Debtors' Thirteenth Omnibus (Substantive) Objection to Claims. (related document(s) 5181,5257, 5463 ) Order Signed on 1/19/2010. (BAM) (Entered: 01/19/2010)", 
      "document_number": "8511", 
      "pacer_doc_id": "show_doc.pl"
    }, 
    {
      "date_filed": "2010-01-18", 
      "description": "Appellee Designation of Additional Items for Inclusion in Record of Appeal (related document(s) 8424 ) Filed by Mona Dobben. (Attachments: # 1 Certificate of Service) (Houghton, Vivian) (Entered: 01/18/2010)", 
      "document_number": "8510", 
      "pacer_doc_id": "show_doc.pl"
    }, 
    {
      "date_filed": "2010-01-15", 
      "description": "Notice of Withdrawal (Partial) of Debtors' Nineteenth Omnibus Objection to Claims with Respect to Proof of Claim Number 7613 (related document(s) 6009 ) Filed by American Home Mortgage Holdings, Inc.. (Neiburg, Michael) (Entered: 01/15/2010)", 
      "document_number": "8509", 
      "pacer_doc_id": "show_doc.pl"
    }, 
    {
      "date_filed": "2010-01-15", 
      "description": "Monthly Application for Compensation for Services Rendered and Reimbursement of Expenses For the Period of December 1, 2009 through December 31, 2009 Filed by Ferry, Joseph & Pearce, P.A.. Objections due by 2/4/2010. (Attachments: # 1 Notice # 2 Exhibit A# 3 Exhibit B# 4 Certificate of Service) (Coggins, Lisa) terminated on 2/9/2010 (BAM). (Entered: 01/15/2010)", 
      "document_number": "8508", 
      "pacer_doc_id": "show_doc.pl"
    }, 
    {
      "date_filed": "2010-01-15", 
      "description": "Order Setting Briefing Schedule Re: Laura Beall's Response To Debtors' Objection To Claim. (related document(s) 8049 ) Order Signed on 1/15/2010. (BMT) (Entered: 01/15/2010)", 
      "document_number": "8507", 
      "pacer_doc_id": "show_doc.pl"
    }, 
    {
      "date_filed": "2010-01-15", 
      "description": "Affidavit/Declaration of Service Regarding Reply to the Opposition of Park National Bank to Debtors' Motion for Allowance and Payment of Section 506(c) Claim (related document(s) 8480 ) Filed by American Home Mortgage Holdings, Inc.. (Neiburg, Michael) (Entered: 01/15/2010)", 
      "document_number": "8506", 
      "pacer_doc_id": "show_doc.pl"
    }, 
    {
      "date_filed": "2010-01-15", 
      "description": "Affidavit/Declaration of Service Regarding Renotice of Hearing, Designation of Records (related document(s) 8468, 8469 ) Filed by American Home Mortgage Holdings, Inc.. (Neiburg, Michael) (Entered: 01/15/2010)", 
      "document_number": "8505", 
      "pacer_doc_id": "show_doc.pl"
    }, 
    {
      "date_filed": "2010-01-15", 
      "description": "Affidavit/Declaration of Service Regarding Application of Zolfo Cooper for Compensation and Reimbursement of Expenses for the Period November 1, 2009 through November 30, 2009 (related document(s) 8435 ) Filed by American Home Mortgage Holdings, Inc.. (Neiburg, Michael) (Entered: 01/15/2010)", 
      "document_number": "8504", 
      "pacer_doc_id": "show_doc.pl"
    }, 
    {
      "date_filed": "2010-01-14", 
      "description": "Certification of Counsel re Order Setting Briefing Schedule re: Laura Beall's Response to Debtor's Objection To Claim (related document(s) 8049 ) Filed by Laura Beall. (Attachments: # 1 Proposed Form of Order # 2 Certificate of Service) (Loizides, Christopher) (Entered: 01/14/2010)", 
      "document_number": "8503", 
      "pacer_doc_id": "show_doc.pl"
    }, 
    {
      "date_filed": "2010-01-14", 
      "description": "Certificate of No Objection regarding Application for Compensation and Reimbursement for the Period October 1, 2009 through October 31, 2009. Filed by QUINN, EMANUEL, URQUHART, OLIVER & HEDGES (related document(s) 8428 ) Filed by American Home Mortgage Holdings, Inc.. (Bartley, Ryan) (Entered: 01/14/2010)", 
      "document_number": "8502", 
      "pacer_doc_id": "show_doc.pl"
    }, 
    {
      "date_filed": "2010-01-14", 
      "description": "Certificate of No Objection regarding Application for Compensation and Reimbursement of Expenses for the Period October 1, 2009 through October 31, 2009 Filed by Young Conaway Stargatt & Taylor, LLP (related document(s) 8425 ) Filed by American Home Mortgage Holdings, Inc.. (Bartley, Ryan) (Entered: 01/14/2010)", 
      "document_number": "8501", 
      "pacer_doc_id": "show_doc.pl"
    }, 
    {
      "date_filed": "2010-01-14", 
      "description": "Certificate of No Objection regarding Application for Compensation and Reimbursement of Expenses for the Period November 1, 2009 through November 30, 2009 Filed by Weiner Brodsky Sidman Kider PC (related document(s) 8430 ) Filed by American Home Mortgage Holdings, Inc.. (Bartley, Ryan) (Entered: 01/14/2010)", 
      "document_number": "8500", 
      "pacer_doc_id": "show_doc.pl"
    }
  ], 
  "docket_number": "07-11047", 
  "jurisdiction": null, 
  "jury_demand": null, 
  "nature_of_suit": null, 
  "parties": [
    {
      "attorneys": [
        {
          "contact": "Young, Conaway, Stargatt & Taylor\nThe Brandywine Building\n1000 West Street, 17th Floor\nP.O. Box 391\nWilmington, DE 19899-0391\nusa\n302-571-6755\nFax : 302-571-1253\nEmail: bankfilings@ycst.com\n", 
          "name": "Curtis J Crowther", 
          "roles": []
        }, 
        {
          "contact": "Young, Conaway, Stargatt & Taylor\n1000 West Street\n17th Floor\nWilmington, DE 19801\n302-571-6600\nEmail: bankfilings@ycst.com\n", 
          "name": "Donald J. Bowman, Jr.", 
          "roles": []
        }, 
        {
          "contact": "Young, Conaway, Stargatt & Taylor\n1000 West Street, 17th Floor\nPO Box 391\nWilmington, DE 19899\nusa\n302 571-6600\nFax : 302-571-1253\nEmail: bankfilings@ycst.com\n", 
          "name": "Edward J. Kosmowski", 
          "roles": []
        }, 
        {
          "contact": "Young, Conaway, Stargatt & Taylor\nThe Brandywine Building\n1000 West Street, 17th Floor\nPO Box 391\nWilmington, DE 19899-0391\nusa\n302 571-6600\nFax : 302-571-1253\nEmail: bankfilings@ycst.com\n", 
          "name": "Edwin J. Harron", 
          "roles": []
        }, 
        {
          "contact": "Young, Conaway, Stargatt & Taylor\nThe Brandywine Building\n17th Floor\n1000 West Street\nWilmington, DE 19801\n302-571-6600\nEmail: bankfilings@ycst.com\n", 
          "name": "Erin Edwards", 
          "roles": []
        }, 
        {
          "contact": "Young, Conaway, Stargatt & Taylor\nThe Brandywine Bldg.\n1000 West Street, 17th Floor\nPO Box 391\nWilmington, DE 19899-0391\nusa\n302 571-6600\nFax : 302-571-0453\nEmail: bankfilings@ycst.com\n", 
          "name": "Joel A. Waite", 
          "roles": []
        }, 
        {
          "contact": "Young Conaway Stargatt & Taylor LLP\n1000 West St., 17th Floor\nBrandywine Building\nWilmington, DE 19801\n302-571-6600\nEmail: bankfilings@ycst.com\n", 
          "name": "Kara Hammond Coyle", 
          "roles": []
        }, 
        {
          "contact": "Young, Conaway, Stargatt & Taylor\n1000 West Street\n17th Floor\nWilmington, DE 19801\n302-571-6600\nEmail: bankfilings@ycst.com\n", 
          "name": "Kenneth J. Enos", 
          "roles": []
        }, 
        {
          "contact": "Young, Conaway, Stargatt & Taylor\n1000 West Street\n17th Floor\nWilmington, DE 19801\n302-571-6600\nEmail: bankfilings@ycst.com\n", 
          "name": "Margaret Whiteman Greecher", 
          "roles": []
        }, 
        {
          "contact": "Young, Conaway, Stargatt & Taylor\nThe Brandywine Building, 17th Floor\n1000 West Street\nPO Box 391\nWilmington, DE 19899\n302-571-6600\nEmail: bankfilings@ycst.com\n", 
          "name": "Matthew Barry Lunn", 
          "roles": []
        }, 
        {
          "contact": "Young Conaway Stargatt & Taylor, LLP\nThe Brandywine Building\n1000 West Street\n17th Floor\nWilmington, DE 19801\n302-571-6600\nFax : 302-571-1253\nEmail: bankfilings@ycst.com\n", 
          "name": "Michael S. Neiburg", 
          "roles": []
        }, 
        {
          "contact": "Young Conaway Stargatt & Taylor, LLP\nThe Brandywine Bldg.\n17th Floor\nWilmington, DE 19801-0391\n302-571-6600\nEmail: bankfilings@ycst.com\n", 
          "name": "Nathan D. Grow", 
          "roles": []
        }, 
        {
          "contact": "Young Conaway Stargatt & Taylor, LLP\nThe Brandywine Bldg 17th Fl,1000 West St\nWilmington, DE 19801\n302-571-6600\nEmail: bankfilings@ycst.com\n", 
          "name": "Patrick A. Jackson", 
          "roles": []
        }, 
        {
          "contact": "Young, Conaway, Stargatt & Taylor\n1000 West Street, 17th Floor\nPO Box 391\nWilmington, DE 19899-0391\n302 571-6600\nFax : 302-571-1253\nEmail: bankfilings@ycst.com\n", 
          "name": "Pauline K. Morgan", 
          "roles": []
        }, 
        {
          "contact": "Quinn Emanuel Urquhart Oliver & Hedges\n", 
          "name": "Quinn Emanuel", 
          "roles": []
        }, 
        {
          "contact": "Young, Conaway, Stargatt & Taylor\nThe Brandywine Bldg.\n1000 West Street, 17th Floor\nPO Box 391\nWilmington, DE 19899-0391\nusa\n302-571-6600\nFax : 302-571-1253\nEmail: bankfilings@ycst.com\n", 
          "name": "Robert S. Brady", 
          "roles": []
        }, 
        {
          "contact": "Young Conaway Stargatt & Taylor, LLP\nThe Brandywine Building\n1000 West Street\n17th Fl.\nWilmington, DE 19801\n302-571-6600\nEmail: bankfilings@ycst.com\n", 
          "name": "Ryan M. Bartley", 
          "roles": []
        }, 
        {
          "contact": "Young, Conaway, Stargatt & Taylor\nThe Brandywine Building, 17th Floor\n1000 West Street\nPO Box 391\nWilmington, DE 19899\n302-571-6600\nFax : 302-576-3281\nEmail: bankfilings@ycst.com\n", 
          "name": "Sean Matthew Beach", 
          "roles": []
        }, 
        {
          "contact": "Young, Conaway, Stargatt & Taylor\nThe Brandywine Bldg., 17th Floor\n1000 West Street\nPO Box 391\nWilmington, DE 19899\n302-571-6600\nFax : 302-576-3350\nEmail: bankfilings@ycst.com\n", 
          "name": "Sharon M Zieg", 
          "roles": []
        }, 
        {
          "contact": "Young Conaway Stargatt & Taylor, LLP\nThe Brandywine Bldg., 17th Fl.\n1000 West Street\nWilmington, DE 19801\n302-571-6600\nEmail: bankfilings@ycst.com\n", 
          "name": "Travis N. Turner", 
          "roles": []
        }
      ], 
      "extra_info": "538 Broadhollow Road\nMelville, NY 11747\nTax ID / EIN: 13-4066303", 
      "name": "American Home Mortgage Holdings, Inc.", 
      "type": "Debtor"
    }, 
    {
      "attorneys": [], 
      "extra_info": "844 King Street, Room 2207\nLockbox #35\nWilmington, DE 19899-0035\n302-573-6491", 
      "name": "United States Trustee", 
      "type": "U.S. Trustee"
    }, 
    {
      "attorneys": [
        {
          "contact": "Blank Rome LLP\n1201 Market Street, Suite 800\nWilmington, DE 19801\n(302) 425-6423\nFax : (302) 425-6464\nEmail: fatell@blankrome.com\n", 
          "name": "Bonnie Glantz Fatell", 
          "roles": []
        }, 
        {
          "contact": "Blank Rome LLP\n1201 Market Street, Suite 800\nWilmington, DE 19801\nusa\n302-425-6400\nFax : 302-425-6464\nEmail: carickhoff@blankrome.com\n", 
          "name": "David W. Carickhoff", 
          "roles": []
        }, 
        {
          "contact": "Blank Rome LLP\n1201 Market Street\nSuite 800\nWilmington, DE 19801\n302-425-6404\nFax : 302-425-6464\nEmail: guilfoyle@blankrome.com\n", 
          "name": "Victoria A. Guilfoyle", 
          "roles": []
        }, 
        {
          "contact": "Blank Rome LLP\n1201 Market Street\nSuite 800\nWilmington, DE 19801\n302-425-6404\nFax : 302-425-6464\nEmail: guilfoyle@blankrome.com\n", 
          "name": "Victoria A. Guilfoyle", 
          "roles": []
        }
      ], 
      "extra_info": "", 
      "name": "The Official Committee of Unsecured Creditors", 
      "type": "Creditor Committee"
    }
  ], 
  "referred_to_str": null
}