{
  "assigned_to_str": "Michael G. Williamson",
  "case_name": "Dazlbet Partners, LLC",
  "cause": "",
  "court_id": "flmb",
  "date_converted": null,
  "date_discharged": null,
  "date_filed": "2009-10-08",
  "date_terminated": null,
  "demand": "",
  "docket_entries": [
    {
      "date_entered": "2009-10-08",
      "date_filed": "2009-10-08",
      "description": "Voluntary Petition under Chapter 11. (Filing Fee Paid) Deficiencies: Summary, Statistical Summary, Schedules A thru J, Statement of Financial Affairs, Atty Disclosure of Compensation, List of 20 Largest Creditors, Statement of Corporation Ownership not filed. Filed by Bernard J. Morse on behalf of Dazlbet Partners, LLC. (Morse, Bernard) Modified on 10/9/2009 (Trester, Susan). (Entered: 10/08/2009)",
      "document_number": "1",
      "pacer_doc_id": "046029736590",
      "pacer_seq_no": null
    },
    {
      "date_entered": "2009-10-08",
      "date_filed": "2009-10-08",
      "description": "Declaration Under Penalty of Perjury for Electronic Filing Regarding Petition Filed by Bernard J. Morse on behalf of Debtor Dazlbet Partners, LLC. (Morse, Bernard) (Entered: 10/08/2009)",
      "document_number": "2",
      "pacer_doc_id": "046029736609",
      "pacer_seq_no": null
    },
    {
      "date_entered": "2009-10-08",
      "date_filed": "2009-10-08",
      "description": "Receipt of Filing Fee for Voluntary Petition (Chapter 11)(8:09-bk-22876) [misc,volp11a2] (1039.00). Receipt Number 17740074, Amount Paid $1039.00 (U.S. Treasury) (Entered: 10/08/2009)",
      "document_number": null,
      "pacer_doc_id": null,
      "pacer_seq_no": null
    },
    {
      "date_entered": "2009-10-08",
      "date_filed": "2009-10-08",
      "description": "Application to Employ Morse & Gomez, PA as Counsel for Debtor and Affidavit of Proposed Attorney and Rule 2016(b) Statement Filed by Bernard J. Morse on behalf of Debtor Dazlbet Partners, LLC (Attachments: # 1 Mailing Matrix) (Morse, Bernard) (Entered: 10/08/2009)",
      "document_number": "3",
      "pacer_doc_id": "046029743956",
      "pacer_seq_no": null
    },
    {
      "date_entered": "2009-10-08",
      "date_filed": "2009-10-08",
      "description": "Emergency Motion to Use Cash Collateral and Request for Expedited Hearing Filed by Bernard J. Morse on behalf of Debtor Dazlbet Partners, LLC (Attachments: # 1 Mailing Matrix) (Morse, Bernard) (Entered: 10/08/2009)",
      "document_number": "4",
      "pacer_doc_id": "046029744098",
      "pacer_seq_no": null
    },
    {
      "date_entered": "2009-10-08",
      "date_filed": "2009-10-08",
      "description": "Chapter 11 Case Management Summary Filed by Bernard J. Morse on behalf of Debtor Dazlbet Partners, LLC. (Morse, Bernard) (Entered: 10/08/2009)",
      "document_number": "5",
      "pacer_doc_id": "046029745735",
      "pacer_seq_no": null
    },
    {
      "date_entered": "2009-10-08",
      "date_filed": "2009-10-08",
      "description": "Emergency Motion/Application to Pay Pre-Petition Wages and Salaries (Payroll due October 9, 2009) Filed by Bernard J. Morse on behalf of Debtor Dazlbet Partners, LLC (Attachments: # 1 Mailing Matrix) (Morse, Bernard) (Entered: 10/08/2009)",
      "document_number": "6",
      "pacer_doc_id": "046029746331",
      "pacer_seq_no": null
    },
    {
      "date_entered": "2009-10-08",
      "date_filed": "2009-10-08",
      "description": "Notice of Appearance and Request for Notice Filed by United States Trustee - TPA. (Barnett, Denise) (Entered: 10/08/2009)",
      "document_number": "7",
      "pacer_doc_id": "046029746520",
      "pacer_seq_no": null
    },
    {
      "date_entered": "2009-10-09",
      "date_filed": "2009-10-09",
      "description": "Assignment of the Honorable Michael G. Williamson, Bankruptcy Judge to this case. The Trustee appointed to this case is the United States Trustee. (Wiener, Sarah) (Entered: 10/09/2009)",
      "document_number": null,
      "pacer_doc_id": null,
      "pacer_seq_no": null
    },
    {
      "date_entered": "2009-10-09",
      "date_filed": "2009-10-09",
      "description": "Emergency Motion For Contempt Emergency Motion for Contempt, Sanctions, and Other Relief Filed by Bernard J. Morse on behalf of Debtor Dazlbet Partners, LLC (Morse, Bernard) (Entered: 10/09/2009)",
      "document_number": "8",
      "pacer_doc_id": "046029758598",
      "pacer_seq_no": null
    },
    {
      "date_entered": "2009-10-09",
      "date_filed": "2009-10-09",
      "description": "Notice of Hearing Filed by Bernard J. Morse on behalf of Debtor Dazlbet Partners, LLC (related document(s) 6, 4 ). Hearing scheduled for 10/9/2009 at 03:00 PM at Tampa, FL - Courtroom 8A, Sam M. Gibbons United States Courthouse, 801 N. Florida Avenue. (Morse, Bernard) (Entered: 10/09/2009)",
      "document_number": "9",
      "pacer_doc_id": "046029762542",
      "pacer_seq_no": null
    },
    {
      "date_entered": "2009-10-09",
      "date_filed": "2009-10-09",
      "description": "Response to Debtor's Emergency Motion for Contempt, Sanctions and Other Relief Filed by Marsha A McCoy on behalf of Vestcor Construction Services, Inc., Steve Moore (related document(s) 8 ). (Attachments: # 1 Exhibit # 2 Exhibit) (McCoy, Marsha) (Entered: 10/09/2009)",
      "document_number": "10",
      "pacer_doc_id": "046029768974",
      "pacer_seq_no": null
    },
    {
      "date_entered": "2009-10-09",
      "date_filed": "2009-10-09",
      "description": "Notice of Commencement of Case, Section 341 Meeting of Creditors, and Fixing Deadlines . Section 341(a) meeting to be held on 11/5/2009 at 01:30 PM at Tampa, FL (861) - Room 100-B, Timberlake Annex, 501 E. Polk Street. Last day to oppose discharge or dischargeability is 1/4/2010. Proofs of Claims due by 12/22/2009. (Trester, Susan) (Entered: 10/09/2009)",
      "document_number": "11",
      "pacer_doc_id": "046029770074",
      "pacer_seq_no": null
    },
    {
      "date_entered": "2009-10-09",
      "date_filed": "2009-10-09",
      "description": "Notice of Deficient Filing. Schedules A thru J, Statement of Financial Affairs, Atty Disclosure of Compensation, List of 20 Largest Creditors, Statement of Corporation Ownership not filed. (related document(s) 1 ). Compliance required no later than 10/26/2009. (Trester, Susan) (Entered: 10/09/2009)",
      "document_number": "12",
      "pacer_doc_id": "046029770243",
      "pacer_seq_no": null
    },
    {
      "date_entered": "2009-10-09",
      "date_filed": "2009-10-09",
      "description": "Order to File All State and Federal Tax Returns and Pay Taxes When Due . Signed on 10/9/2009 (Trester, Susan) (Entered: 10/09/2009)",
      "document_number": "13",
      "pacer_doc_id": "046029770534",
      "pacer_seq_no": null
    },
    {
      "date_entered": "2009-10-12",
      "date_filed": "2009-10-11",
      "description": "BNC Certificate of Mailing - Notice to Creditors and Parties in Interest (related document(s) (Related Doc # 12 )). Service Date 10/11/2009. (Admin.) (Entered: 10/12/2009)",
      "document_number": "14",
      "pacer_doc_id": "046029794411",
      "pacer_seq_no": null
    },
    {
      "date_entered": "2009-10-12",
      "date_filed": "2009-10-11",
      "description": "BNC Certificate of Mailing - Operating Order (related document(s) (Related Doc # 13 )). Service Date 10/11/2009. (Admin.) (Entered: 10/12/2009)",
      "document_number": "15",
      "pacer_doc_id": "046029794412",
      "pacer_seq_no": null
    },
    {
      "date_entered": "2009-10-12",
      "date_filed": "2009-10-11",
      "description": "BNC Certificate of Mailing - Notice of Meeting of Creditors. (related document(s) (Related Doc # 11 )). Service Date 10/11/2009. (Admin.) (Entered: 10/12/2009)",
      "document_number": "16",
      "pacer_doc_id": "046029794413",
      "pacer_seq_no": null
    },
    {
      "date_entered": "2009-10-13",
      "date_filed": "2009-10-13",
      "description": "Notice of Appearance and Request for Notice Filed by John W Chapman Jr on behalf of Creditor Elite Weiler Pools, Inc.. (Chapman, John) (Entered: 10/13/2009)",
      "document_number": "17",
      "pacer_doc_id": "046029819283",
      "pacer_seq_no": null
    },
    {
      "date_entered": "2009-10-14",
      "date_filed": "2009-10-14",
      "description": "Order Scheduling Status Conference. Hearing scheduled for 11/4/2009 at 09:30 AM at Tampa, FL - Courtroom 8A, Sam M. Gibbons United States Courthouse, 801 N. Florida Avenue. Signed on 10/14/2009 (Trester, Susan) (Entered: 10/14/2009)",
      "document_number": "18",
      "pacer_doc_id": "046029835912",
      "pacer_seq_no": null
    },
    {
      "date_entered": "2009-10-14",
      "date_filed": "2009-10-14",
      "description": "Order Scheduling Final Hearing on Application to Employ Attorney. Application Approved on Interim Basis (related document(s) 3 ). Hearing scheduled for 11/4/2009 at 09:30 AM at Tampa, FL - Courtroom 8A, Sam M. Gibbons United States Courthouse, 801 N. Florida Avenue. Signed on 10/14/2009 (Trester, Susan) (Entered: 10/14/2009)",
      "document_number": "19",
      "pacer_doc_id": "046029836029",
      "pacer_seq_no": null
    },
    {
      "date_entered": "2009-10-14",
      "date_filed": "2009-10-14",
      "description": "Request for Notice Filed by Creditor Manatee County Tax Collector. (Manatee County Tax Collector (SP)) (Entered: 10/14/2009)",
      "document_number": "20",
      "pacer_doc_id": "046029836288",
      "pacer_seq_no": null
    },
    {
      "date_entered": "2009-10-15",
      "date_filed": "2009-10-15",
      "description": "Application/Motion for Authority to Employ Management Company Filed by Bernard J. Morse on behalf of Debtor Dazlbet Partners, LLC (Morse, Bernard) (Entered: 10/15/2009)",
      "document_number": "21",
      "pacer_doc_id": "046029870979",
      "pacer_seq_no": null
    },
    {
      "date_entered": "2009-10-16",
      "date_filed": "2009-10-16",
      "description": "Interim Order on Motion to Use Cash Collateral and scheduling further hearing to be held October 19, 2009 at 1:00 p.m., Courtroom 8A, 801 N Florida Avenue, Tampa FL (related document(s) 4 ). Signed on 10/16/2009 (Trester, Susan) (Entered: 10/16/2009)",
      "document_number": "22",
      "pacer_doc_id": "046029899415",
      "pacer_seq_no": null
    },
    {
      "date_entered": "2009-10-17",
      "date_filed": "2009-10-16",
      "description": "BNC Certificate of Mailing - Order (related document(s) (Related Doc # 19 )). Service Date 10/16/2009. (Admin.) (Entered: 10/17/2009)",
      "document_number": "23",
      "pacer_doc_id": "046029915730",
      "pacer_seq_no": null
    },
    {
      "date_entered": "2009-10-17",
      "date_filed": "2009-10-16",
      "description": "BNC Certificate of Mailing - Order (related document(s) (Related Doc # 18 )). Service Date 10/16/2009. (Admin.) (Entered: 10/17/2009)",
      "document_number": "24",
      "pacer_doc_id": "046029915731",
      "pacer_seq_no": null
    },
    {
      "date_entered": "2009-10-19",
      "date_filed": "2009-10-18",
      "description": "BNC Certificate of Mailing - PDF Document. (related document(s) (Related Doc # 22 )). Service Date 10/18/2009. (Admin.) (Entered: 10/19/2009)",
      "document_number": "25",
      "pacer_doc_id": "046029933893",
      "pacer_seq_no": null
    },
    {
      "date_entered": "2009-10-20",
      "date_filed": "2009-10-20",
      "description": "Order Granting Motion To Pay Pre-Petition Wages and Salaries (Related Doc # 6 ). Signed on 10/20/2009. (Trester, Susan ) (Entered: 10/20/2009)",
      "document_number": "26",
      "pacer_doc_id": "046029960838",
      "pacer_seq_no": null
    },
    {
      "date_entered": "2009-10-21",
      "date_filed": "2009-10-21",
      "description": "Notice of Preliminary Hearing on Application/Motion for Authority to Employ Management Company (related document(s) 21 ). Hearing scheduled for 11/4/2009 at 09:30 AM at Tampa, FL - Courtroom 8A, Sam M. Gibbons United States Courthouse, 801 N. Florida Avenue. (Trester, Susan) (Entered: 10/21/2009)",
      "document_number": "27",
      "pacer_doc_id": "046029981857",
      "pacer_seq_no": null
    },
    {
      "date_entered": "2009-10-22",
      "date_filed": "2009-10-22",
      "description": "Motion to Extend Time to File Chapter 11 Schedules and Statement of Financial Affairs Filed by Bernard J. Morse on behalf of Debtor Dazlbet Partners, LLC (Attachments: # 1 Mailing Matrix) (Morse, Bernard) (Entered: 10/22/2009)",
      "document_number": "28",
      "pacer_doc_id": "046030020532",
      "pacer_seq_no": null
    },
    {
      "date_entered": "2009-10-23",
      "date_filed": "2009-10-22",
      "description": "BNC Certificate of Mailing - PDF Document. (related document(s) (Related Doc # 26 )). Service Date 10/22/2009. (Admin.) (Entered: 10/23/2009)",
      "document_number": "29",
      "pacer_doc_id": "046030033488",
      "pacer_seq_no": null
    },
    {
      "date_entered": "2009-10-23",
      "date_filed": "2009-10-23",
      "description": "Second Order on Motion to Use Cash Collateral and scheduling further hearing to be held November 4, 2009 at 9:30 a.m., Courtroom 8A, 801 N Florida Avenue, Tampa FL (related document(s) 4 ). Signed on 10/23/2009 (Trester, Susan) (Entered: 10/23/2009)",
      "document_number": "30",
      "pacer_doc_id": "046030042085",
      "pacer_seq_no": null
    },
    {
      "date_entered": "2009-10-24",
      "date_filed": "2009-10-23",
      "description": "BNC Certificate of Mailing - Notice of Hearing (related document(s) (Related Doc # 27 )). Service Date 10/23/2009. (Admin.) (Entered: 10/24/2009)",
      "document_number": "31",
      "pacer_doc_id": "046030060136",
      "pacer_seq_no": null
    },
    {
      "date_entered": "2009-10-26",
      "date_filed": "2009-10-25",
      "description": "BNC Certificate of Mailing - Order (related document(s) (Related Doc # 30 )). Service Date 10/25/2009. (Admin.) (Entered: 10/26/2009)",
      "document_number": "32",
      "pacer_doc_id": "046030076002",
      "pacer_seq_no": null
    },
    {
      "date_entered": "2009-10-27",
      "date_filed": "2009-10-27",
      "description": "Notice of Change of Address for International Construction Consultants, Inc. Filed by Bernard J. Morse on behalf of Debtor Dazlbet Partners, LLC. (Morse, Bernard) (Entered: 10/27/2009)",
      "document_number": "33",
      "pacer_doc_id": "046030114882",
      "pacer_seq_no": null
    },
    {
      "date_entered": "2009-10-27",
      "date_filed": "2009-10-27",
      "description": "Motion for Approval of Insider Transactions Filed by Bernard J. Morse on behalf of Debtor Dazlbet Partners, LLC (Attachments: # 1 Mailing Matrix) (Morse, Bernard) (Entered: 10/27/2009)",
      "document_number": "34",
      "pacer_doc_id": "046030116348",
      "pacer_seq_no": null
    },
    {
      "date_entered": "2009-10-28",
      "date_filed": "2009-10-28",
      "description": "Withdrawal of Emergency Motion for Contempt, Sanctions, and for Other Relief Filed by Bernard J. Morse on behalf of Debtor Dazlbet Partners, LLC (related document(s) 8 ). (Morse, Bernard) (Entered: 10/28/2009)",
      "document_number": "35",
      "pacer_doc_id": "046030130966",
      "pacer_seq_no": null
    },
    {
      "date_entered": "2009-10-28",
      "date_filed": "2009-10-28",
      "description": "Order Granting Motion to Extend Time to file schedules and statements up to and including November 4, 2009. (Related Doc # 28 ). Signed on 10/28/2009. (Trester, Susan ) (Entered: 10/28/2009)",
      "document_number": "36",
      "pacer_doc_id": "046030140533",
      "pacer_seq_no": null
    },
    {
      "date_entered": "2009-10-30",
      "date_filed": "2009-10-30",
      "description": "Notice of Hearing on the Debtor's Motion for Approval of Insider Transactions Filed by Bernard J. Morse on behalf of Debtor Dazlbet Partners, LLC (related document(s) 34 ). Hearing scheduled for 11/4/2009 at 09:30 AM at Tampa, FL - Courtroom 8A, Sam M. Gibbons United States Courthouse, 801 N. Florida Avenue. (Attachments: # 1 Mailing Matrix) (Morse, Bernard) (Entered: 10/30/2009)",
      "document_number": "37",
      "pacer_doc_id": "046030216322",
      "pacer_seq_no": null
    },
    {
      "date_entered": "2009-10-31",
      "date_filed": "2009-10-30",
      "description": "BNC Certificate of Mailing - PDF Document. (related document(s) (Related Doc # 36 )). Service Date 10/30/2009. (Admin.) (Entered: 10/31/2009)",
      "document_number": "38",
      "pacer_doc_id": "046030224856",
      "pacer_seq_no": null
    },
    {
      "date_entered": "2009-11-04",
      "date_filed": "2009-11-04",
      "description": "Notice of Appearance and Request for Notice and Demand for Service of Papers Filed by John J. Lamoureux on behalf of Creditor Capmark Bank. (Lamoureux, John) (Entered: 11/04/2009)",
      "document_number": "39",
      "pacer_doc_id": "046030311359",
      "pacer_seq_no": null
    },
    {
      "date_entered": "2009-11-04",
      "date_filed": "2009-11-04",
      "description": "Schedules A - H, (Fee Paid.), Statement of Financial Affairs, List of Equity Security Holders, Summary of Schedules Filed by Bernard J. Morse on behalf of Debtor Dazlbet Partners, LLC. (Morse, Bernard) (Entered: 11/04/2009)",
      "document_number": "40",
      "pacer_doc_id": "046030314869",
      "pacer_seq_no": null
    },
    {
      "date_entered": "2009-11-04",
      "date_filed": "2009-11-04",
      "description": "Receipt of Filing Fee for Schedules (all schedules, individual schedules or amended schedules)(8:09-bk-22876-MGW) [misc,schaja] ( 26.00). Receipt Number 18068738, Amount Paid $ 26.00 (U.S. Treasury) (Entered: 11/04/2009)",
      "document_number": null,
      "pacer_doc_id": null,
      "pacer_seq_no": null
    },
    {
      "date_entered": "2009-11-04",
      "date_filed": "2009-11-04",
      "description": "Declaration Under Penalty of Perjury for Electronic Filing Regarding Declaration Concerning Debtor's Schedule, Statement of Financial Affairs, List of Equity Security Holders Filed by Bernard J. Morse on behalf of Debtor Dazlbet Partners, LLC (related document(s) 40 ). (Morse, Bernard) (Entered: 11/04/2009)",
      "document_number": "41",
      "pacer_doc_id": "046030315067",
      "pacer_seq_no": null
    },
    {
      "date_entered": "2009-11-04",
      "date_filed": "2009-11-04",
      "description": "Statement of Corporate Ownership Filed by Bernard J. Morse on behalf of Debtor Dazlbet Partners, LLC. (Morse, Bernard) (Entered: 11/04/2009)",
      "document_number": "42",
      "pacer_doc_id": "046030319187",
      "pacer_seq_no": null
    },
    {
      "date_entered": "2009-11-04",
      "date_filed": "2009-11-04",
      "description": "Certificate of Service Re: Notice of Chapter 11 Bankruptcy Case, Meeting of Creditors & Deadlines Filed by Bernard J. Morse on behalf of Debtor Dazlbet Partners, LLC (related document(s) 11 ). (Attachments: # 1 Mailing Matrix) (Morse, Bernard) (Entered: 11/04/2009)",
      "document_number": "43",
      "pacer_doc_id": "046030319415",
      "pacer_seq_no": null
    },
    {
      "date_entered": "2009-11-04",
      "date_filed": "2009-11-04",
      "description": "List of 20 Largest Unsecured Creditors Filed by Bernard J. Morse on behalf of Debtor Dazlbet Partners, LLC. (Morse, Bernard) (Entered: 11/04/2009)",
      "document_number": "44",
      "pacer_doc_id": "046030320222",
      "pacer_seq_no": null
    },
    {
      "date_entered": "2009-11-06",
      "date_filed": "2009-11-06",
      "description": "Notice of Change of Address of the Debtor Filed by Bernard J. Morse on behalf of Debtor Dazlbet Partners, LLC. (Attachments: # 1 Mailing Matrix) (Morse, Bernard) (Entered: 11/06/2009)",
      "document_number": "45",
      "pacer_doc_id": "046030367732",
      "pacer_seq_no": null
    },
    {
      "date_entered": "2009-11-09",
      "date_filed": "2009-11-09",
      "description": "Notice of Appearance and Request for Notice and Service of Papers Filed by Creditor Vestcor Construction Services, Inc.. (Blanks, Daniel) (Entered: 11/09/2009)",
      "document_number": "46",
      "pacer_doc_id": "046030433076",
      "pacer_seq_no": null
    },
    {
      "date_entered": "2009-11-10",
      "date_filed": "2009-11-10",
      "description": "Order Establishing Deadline for Filing Plan and Disclosure Statement . Chapter 11 Plan & Disclosure Statement due by 1/4/2010. Signed on 11/10/2009 (Trester, Susan) (Entered: 11/10/2009)",
      "document_number": "47",
      "pacer_doc_id": "046030437143",
      "pacer_seq_no": null
    },
    {
      "date_entered": "2009-11-10",
      "date_filed": "2009-11-10",
      "description": "The United States Trustee states that the initial meeting of creditors was held and concluded on Thursday, November 5, 2009. Filed by United States Trustee - TPA. (Barnett, Denise) (Entered: 11/10/2009)",
      "document_number": null,
      "pacer_doc_id": null,
      "pacer_seq_no": null
    },
    {
      "date_entered": "2009-11-10",
      "date_filed": "2009-11-10",
      "description": "Interim Order on Motion for Authority to Employ Management Company and scheduling further hearing on November 18, 2009 at 10:00 a.m., Courtroom 8A, 801 N Florida Avenue, Tampa, FL (related document(s) 21 ). Signed on 11/10/2009 (Trester, Susan) (Entered: 11/10/2009)",
      "document_number": "48",
      "pacer_doc_id": "046030452192",
      "pacer_seq_no": null
    },
    {
      "date_entered": "2009-11-10",
      "date_filed": "2009-11-10",
      "description": "Interim Order on Motion for Approval of Insider Transactions and scheduling hearing on November 18, 2009 at 10:00 a.m., Courtroom 8A, 801 N Florida Avenue, Tampa FL (related document(s) 34 ). Signed on 11/10/2009 (Trester, Susan) (Entered: 11/10/2009)",
      "document_number": "49",
      "pacer_doc_id": "046030452263",
      "pacer_seq_no": null
    },
    {
      "date_entered": "2009-11-13",
      "date_filed": "2009-11-12",
      "description": "BNC Certificate of Mailing - Order (related document(s) (Related Doc # 47 )). Service Date 11/12/2009. (Admin.) (Entered: 11/13/2009)",
      "document_number": "50",
      "pacer_doc_id": "046030505822",
      "pacer_seq_no": null
    },
    {
      "date_entered": "2009-11-13",
      "date_filed": "2009-11-12",
      "description": "BNC Certificate of Mailing - Order (related document(s) (Related Doc # 48 )). Service Date 11/12/2009. (Admin.) (Entered: 11/13/2009)",
      "document_number": "51",
      "pacer_doc_id": "046030505823",
      "pacer_seq_no": null
    },
    {
      "date_entered": "2009-11-13",
      "date_filed": "2009-11-12",
      "description": "BNC Certificate of Mailing - Order (related document(s) (Related Doc # 49 )). Service Date 11/12/2009. (Admin.) (Entered: 11/13/2009)",
      "document_number": "52",
      "pacer_doc_id": "046030505824",
      "pacer_seq_no": null
    },
    {
      "date_entered": "2009-11-16",
      "date_filed": "2009-11-16",
      "description": "Order Approving Application to Employ/Retain Bernard J. Morse, Morse & Gomez as Attorney for Debtor (Related Doc # 3 ). Signed on 11/16/2009. (Trester, Susan ) (Entered: 11/16/2009)",
      "document_number": "53",
      "pacer_doc_id": "046030562344",
      "pacer_seq_no": null
    },
    {
      "date_entered": "2009-11-16",
      "date_filed": "2009-11-16",
      "description": "Third Interim Order on the Motion to Use Cash Collateral and scheduling further hearing for November 18, 2009 at 10:00 a.m., Courtroom 8A, 801 N Florida Avenue, Tampa FL (related document(s) 4 ). Signed on 11/16/2009 (Trester, Susan) (Entered: 11/16/2009)",
      "document_number": "54",
      "pacer_doc_id": "046030566847",
      "pacer_seq_no": null
    },
    {
      "date_entered": "2009-11-19",
      "date_filed": "2009-11-18",
      "description": "BNC Certificate of Mailing - PDF Document. (related document(s) (Related Doc # 53 )). Service Date 11/18/2009. (Admin.) (Entered: 11/19/2009)",
      "document_number": "55",
      "pacer_doc_id": "046030634734",
      "pacer_seq_no": null
    },
    {
      "date_entered": "2009-11-19",
      "date_filed": "2009-11-18",
      "description": "BNC Certificate of Mailing - Order (related document(s) (Related Doc # 54 )). Service Date 11/18/2009. (Admin.) (Entered: 11/19/2009)",
      "document_number": "56",
      "pacer_doc_id": "046030634735",
      "pacer_seq_no": null
    },
    {
      "date_entered": "2009-11-30",
      "date_filed": "2009-11-23",
      "description": "Notice of Change of Address of the Debtor Filed by Bernard J. Morse on behalf of Debtor Dazlbet Partners, LLC. (Trester, Susan) (Entered: 11/30/2009)",
      "document_number": "57",
      "pacer_doc_id": "046030829523",
      "pacer_seq_no": null
    },
    {
      "date_entered": "2009-12-01",
      "date_filed": "2009-12-01",
      "description": "Financial Reports for the Period October 8, 2009 to October 31, 2009. Filed by Bernard J. Morse on behalf of Debtor Dazlbet Partners, LLC. (Morse, Bernard) (Entered: 12/01/2009)",
      "document_number": "58",
      "pacer_doc_id": "046030870782",
      "pacer_seq_no": null
    },
    {
      "date_entered": "2009-12-04",
      "date_filed": "2009-12-04",
      "description": "Motion and Notice of Compromise of Controversy. Motion is filed with negative notice. Objections to the Motion are due within 21 days of the date of entry of the Motion on the docket, but an additional three days may be added if the Motion is served by U.S. Mail. Filed by Bernard J. Morse on behalf of Debtor Dazlbet Partners, LLC (Morse, Bernard) (Entered: 12/04/2009)",
      "document_number": "59",
      "pacer_doc_id": "046030953013",
      "pacer_seq_no": null
    },
    {
      "date_entered": "2009-12-04",
      "date_filed": "2009-12-04",
      "description": "Fourth Interim Order on Motion to Use Cash Collateral and scheduling further hearing to be held December 16, 2009 at 9:30 a.m., Courtroom 8A, 801 N Florida Avenue, Tampa FL. (related document(s) 4 ). Signed on 12/4/2009 (Trester, Susan) (Entered: 12/04/2009)",
      "document_number": "60",
      "pacer_doc_id": "046030958518",
      "pacer_seq_no": null
    },
    {
      "date_entered": "2009-12-07",
      "date_filed": "2009-12-06",
      "description": "BNC Certificate of Mailing - Order (related document(s) (Related Doc # 60 )). Service Date 12/06/2009. (Admin.) (Entered: 12/07/2009)",
      "document_number": "61",
      "pacer_doc_id": "046030991188",
      "pacer_seq_no": null
    },
    {
      "date_entered": "2009-12-07",
      "date_filed": "2009-12-07",
      "description": "Application to Employ Richard Lovesky, Esquire as Special Counsel Filed by Bernard J. Morse on behalf of Debtor Dazlbet Partners, LLC (Attachments: # 1 Affidavit of Special Counsel# 2 Mailing Matrix) (Morse, Bernard) (Entered: 12/07/2009)",
      "document_number": "62",
      "pacer_doc_id": "046031000403",
      "pacer_seq_no": null
    },
    {
      "date_entered": "2009-12-14",
      "date_filed": "2009-12-14",
      "description": "Notice of Preliminary Hearing on Application to Employ Richard Lovesky, Esquire as Special Counsel (related document(s) 62 ). Hearing scheduled for 12/16/2009 at 09:30 AM at Tampa, FL - Courtroom 8A, Sam M. Gibbons United States Courthouse, 801 N. Florida Avenue. (Trester, Susan) (Entered: 12/14/2009)",
      "document_number": "63",
      "pacer_doc_id": "046031151890",
      "pacer_seq_no": null
    },
    {
      "date_entered": "2009-12-16",
      "date_filed": "2009-12-16",
      "description": "Second Interim Order on Motion for Approval of Insider Transactions and scheduling further hearing to be held December 16, 2009 at 9:30 a.m. (related document(s) 49, 34 ). Signed on 12/16/2009 (Trester, Susan) (Entered: 12/16/2009)",
      "document_number": "64",
      "pacer_doc_id": "046031200197",
      "pacer_seq_no": null
    },
    {
      "date_entered": "2009-12-16",
      "date_filed": "2009-12-16",
      "description": "Notice of Change of Address for KRB Management Filed by Bernard J. Morse on behalf of Debtor Dazlbet Partners, LLC. (Morse, Bernard) (Entered: 12/16/2009)",
      "document_number": "65",
      "pacer_doc_id": "046031202170",
      "pacer_seq_no": null
    },
    {
      "date_entered": "2009-12-16",
      "date_filed": "2009-12-16",
      "description": "Second Interim Order on Motion for Authority to Employ Management Company and scheduling further hearing on December 16, 2009 at 9:30 a.m. (related document(s) 21, 48 ). Signed on 12/16/2009 (Trester, Susan) (Entered: 12/16/2009)",
      "document_number": "66",
      "pacer_doc_id": "046031211076",
      "pacer_seq_no": null
    },
    {
      "date_entered": "2009-12-17",
      "date_filed": "2009-12-16",
      "description": "BNC Certificate of Mailing - Notice of Hearing (related document(s) (Related Doc # 63 )). Service Date 12/16/2009. (Admin.) (Entered: 12/17/2009)",
      "document_number": "67",
      "pacer_doc_id": "046031221693",
      "pacer_seq_no": null
    },
    {
      "date_entered": "2009-12-19",
      "date_filed": "2009-12-18",
      "description": "BNC Certificate of Mailing - Order (related document(s) (Related Doc # 64 )). Service Date 12/18/2009. (Admin.) (Entered: 12/19/2009)",
      "document_number": "68",
      "pacer_doc_id": "046031279221",
      "pacer_seq_no": null
    },
    {
      "date_entered": "2009-12-19",
      "date_filed": "2009-12-18",
      "description": "BNC Certificate of Mailing - Order (related document(s) (Related Doc # 66 )). Service Date 12/18/2009. (Admin.) (Entered: 12/19/2009)",
      "document_number": "69",
      "pacer_doc_id": "046031279222",
      "pacer_seq_no": null
    },
    {
      "date_entered": "2009-12-21",
      "date_filed": "2009-12-21",
      "description": "Order Approving Application to Employ/Retain Richard Lovesky, Esquire as Special Counsel for Debtor (Related Doc # 62 ). Signed on 12/21/2009. (Trester, Susan ) (Entered: 12/21/2009)",
      "document_number": "70",
      "pacer_doc_id": "046031305489",
      "pacer_seq_no": null
    },
    {
      "date_entered": "2009-12-22",
      "date_filed": "2009-12-21",
      "description": "Motion to Object to Motion to Compromise Filed by Creditor International Construction Consultants, Inc. (related document(s) 59 ). (Trester, Susan) (Entered: 12/22/2009)",
      "document_number": "72",
      "pacer_doc_id": "046031338967",
      "pacer_seq_no": null
    },
    {
      "date_entered": "2009-12-22",
      "date_filed": "2009-12-22",
      "description": "Financial Reports for the Period 11/1/09 to 11/30/09. Filed by Bernard J. Morse on behalf of Debtor Dazlbet Partners, LLC. (Attachments: # 1 Report Continuation) (Morse, Bernard) (Entered: 12/22/2009)",
      "document_number": "71",
      "pacer_doc_id": "046031330940",
      "pacer_seq_no": null
    },
    {
      "date_entered": "2009-12-22",
      "date_filed": "2009-12-22",
      "description": "Order Striking Signed on 12/22/2009 (Trester, Susan) See Corrective Entry dated 12/22/2009 Modified on 12/22/2009 (Trester, Susan). Additional attachment(s) added on 12/22/2009 (Trester, Susan). (Entered: 12/22/2009)",
      "document_number": "73",
      "pacer_doc_id": "046031339442",
      "pacer_seq_no": null
    },
    {
      "date_entered": "2009-12-22",
      "date_filed": "2009-12-22",
      "description": "Corrective Entry Re: Document Entered in Error during Docketing; Corrected by Clerks Office.. (Trester, Susan) (Entered: 12/22/2009)",
      "document_number": null,
      "pacer_doc_id": null,
      "pacer_seq_no": null
    },
    {
      "date_entered": "2009-12-22",
      "date_filed": "2009-12-22",
      "description": "Order Striking Motion to Object to Motion to Compromise (related document(s) 72 ). Signed on 12/22/2009 (Trester, Susan) (Entered: 12/22/2009)",
      "document_number": "74",
      "pacer_doc_id": "046031339397",
      "pacer_seq_no": null
    },
    {
      "date_entered": "2009-12-23",
      "date_filed": "2009-12-23",
      "description": "Order Vacating Order Striking Motion to Object to Motion to Compromise (related document(s) 74 ). Signed on 12/23/2009 (Trester, Susan) (Entered: 12/23/2009)",
      "document_number": "75",
      "pacer_doc_id": "046031359252",
      "pacer_seq_no": null
    },
    {
      "date_entered": "2009-12-24",
      "date_filed": "2009-12-23",
      "description": "BNC Certificate of Mailing - PDF Document. (related document(s) (Related Doc # 70 )). Service Date 12/23/2009. (Admin.) (Entered: 12/24/2009)",
      "document_number": "76",
      "pacer_doc_id": "046031373168",
      "pacer_seq_no": null
    },
    {
      "date_entered": "2009-12-25",
      "date_filed": "2009-12-24",
      "description": "BNC Certificate of Mailing - PDF Document. (related document(s) (Related Doc # 74 )). Service Date 12/24/2009. (Admin.) (Entered: 12/25/2009)",
      "document_number": "77",
      "pacer_doc_id": "046031386980",
      "pacer_seq_no": null
    },
    {
      "date_entered": "2009-12-26",
      "date_filed": "2009-12-25",
      "description": "BNC Certificate of Mailing - Order (related document(s) (Related Doc # 75 )). Service Date 12/25/2009. (Admin.) (Entered: 12/26/2009)",
      "document_number": "78",
      "pacer_doc_id": "046031394234",
      "pacer_seq_no": null
    },
    {
      "date_entered": "2009-12-29",
      "date_filed": "2009-12-29",
      "description": "Telephonic Notice of Hearing regarding Motion of Compromise of Controversy. Parties called on December 29, 2009 at 10:06 AM: Message left with Danette, assistant to David E McCulla, President of International Construction Consultants Inc (related document(s) 59, 72 ). Hearing scheduled for 12/30/2009 at 09:30 AM at Tampa, FL - Courtroom 8A, Sam M. Gibbons United States Courthouse, 801 N. Florida Avenue. (Valencia, Dianna) (Entered: 12/29/2009)",
      "document_number": null,
      "pacer_doc_id": null,
      "pacer_seq_no": null
    },
    {
      "date_entered": "2009-12-29",
      "date_filed": "2009-12-29",
      "description": "Third Interim Order Granting Motion for Authority to Employ Management Company KRB Management Inc. and Scheduling Further Hearing to be held February 17, 2010 at 9:30 a.m., Courtroom 8A, 801 N Florida Avenue, Tampa FL (related document(s) 21 ). Signed on 12/29/2009 (Valencia, Dianna) Modified on 1/15/2010 (Trester, Susan). (Entered: 12/29/2009)",
      "document_number": "79",
      "pacer_doc_id": "046031437294",
      "pacer_seq_no": null
    },
    {
      "date_entered": "2009-12-29",
      "date_filed": "2009-12-29",
      "description": "Third Interim Order Granting Motion to Approve Insider Transactions and scheduling further hearing to be held on February 17, 2010 at 9:30 a.m., Courtroom 8A, 801 N Florida Avenue, Tampa FL(related document(s) 34 ). Signed on 12/29/2009 (Valencia, Dianna) Modified on 1/15/2010 (Trester, Susan). (Entered: 12/29/2009)",
      "document_number": "80",
      "pacer_doc_id": "046031437380",
      "pacer_seq_no": null
    },
    {
      "date_entered": "2009-12-30",
      "date_filed": "2009-12-30",
      "description": "Order Granting Motion and Notice of Compromise of Controversy (Related Doc # 59 ) Signed on 12/30/2009. (Attachments: # 1 Settlement Agreement) (Valencia, Dianna ) (Entered: 12/30/2009)",
      "document_number": "81",
      "pacer_doc_id": "046031453186",
      "pacer_seq_no": null
    },
    {
      "date_entered": "2010-01-01",
      "date_filed": "2009-12-31",
      "description": "BNC Certificate of Mailing - Order (related document(s) (Related Doc # 79 )). Service Date 12/31/2009. (Admin.) (Entered: 01/01/2010)",
      "document_number": "82",
      "pacer_doc_id": "046031497689",
      "pacer_seq_no": null
    },
    {
      "date_entered": "2010-01-01",
      "date_filed": "2009-12-31",
      "description": "BNC Certificate of Mailing - Order (related document(s) (Related Doc # 80 )). Service Date 12/31/2009. (Admin.) (Entered: 01/01/2010)",
      "document_number": "83",
      "pacer_doc_id": "046031497690",
      "pacer_seq_no": null
    },
    {
      "date_entered": "2010-01-02",
      "date_filed": "2010-01-01",
      "description": "BNC Certificate of Mailing - PDF Document. (related document(s) (Related Doc # 81 )). Service Date 01/01/2010. (Admin.) (Entered: 01/02/2010)",
      "document_number": "84",
      "pacer_doc_id": "046031505342",
      "pacer_seq_no": null
    },
    {
      "date_entered": "2010-01-04",
      "date_filed": "2010-01-04",
      "description": "Motion to Extend Time to File Chapter 11 Plan of Reorganization and Disclosure Statement Filed by Bernard J. Morse on behalf of Debtor Dazlbet Partners, LLC (Attachments: # 1 Mailing Matrix) (Morse, Bernard) (Entered: 01/04/2010)",
      "document_number": "85",
      "pacer_doc_id": "046031526260",
      "pacer_seq_no": null
    },
    {
      "date_entered": "2010-01-05",
      "date_filed": "2010-01-05",
      "description": "Order Granting Motion to Extend Time to File Plan and Disclosure Statement Until February 15, 2010 (Related Doc # 47, 85 ). Signed on 1/5/2010. (Valencia, Dianna ) (Entered: 01/05/2010)",
      "document_number": "86",
      "pacer_doc_id": "046031539432",
      "pacer_seq_no": null
    },
    {
      "date_entered": "2010-01-08",
      "date_filed": "2010-01-07",
      "description": "BNC Certificate of Mailing - PDF Document. (related document(s) (Related Doc # 86 )). Service Date 01/07/2010. (Admin.) (Entered: 01/08/2010)",
      "document_number": "87",
      "pacer_doc_id": "046031615016",
      "pacer_seq_no": null
    },
    {
      "date_entered": "2010-01-13",
      "date_filed": "2010-01-13",
      "description": "Objection to Claim(s). Claim No. 9 of International Construction Consultants, Inc.. Filed by Bernard J. Morse on behalf of Debtor Dazlbet Partners, LLC (Morse, Bernard) (Entered: 01/13/2010)",
      "document_number": "88",
      "pacer_doc_id": "046031731327",
      "pacer_seq_no": null
    },
    {
      "date_entered": "2010-01-13",
      "date_filed": "2010-01-13",
      "description": "Application for Compensation for Richard Anton Lovesky, P.A., Special Counsel, Fee: $1443.00, Expenses: $590.00. For the period: 10/15/09 - 1/7/10 Filed by Attorney Bernard J. Morse (Attachments: # 1 Mailing Matrix) (Morse, Bernard) (Entered: 01/13/2010)",
      "document_number": "89",
      "pacer_doc_id": "046031732195",
      "pacer_seq_no": null
    },
    {
      "date_entered": "2010-01-14",
      "date_filed": "2010-01-14",
      "description": "Notice Regarding Objection to Claim 9 of International Construction Consultants (related document(s) 88 ). Responses due by 2/18/2010. (Trester, Susan) (Entered: 01/14/2010)",
      "document_number": "90",
      "pacer_doc_id": "046031750593",
      "pacer_seq_no": null
    },
    {
      "date_entered": "2010-01-14",
      "date_filed": "2010-01-14",
      "description": "Notice of Hearing on Application for Compensation (related document(s) 89 ). Hearing scheduled for 2/17/2010 at 09:30 AM at Tampa, FL - Courtroom 8A, Sam M. Gibbons United States Courthouse, 801 N. Florida Avenue. (Trester, Susan) (Entered: 01/14/2010)",
      "document_number": "91",
      "pacer_doc_id": "046031755382",
      "pacer_seq_no": null
    },
    {
      "date_entered": "2010-01-15",
      "date_filed": "2010-01-15",
      "description": "Financial Reports for the Period 12/1/09 to 12/31/09. Filed by Bernard J. Morse on behalf of Debtor Dazlbet Partners, LLC. (Attachments: # 1 Attachments to Report) (Morse, Bernard) (Entered: 01/15/2010)",
      "document_number": "92",
      "pacer_doc_id": "046031788126",
      "pacer_seq_no": null
    },
    {
      "date_entered": "2010-01-17",
      "date_filed": "2010-01-16",
      "description": "BNC Certificate of Mailing. (related document(s) (Related Doc # 90 )). Service Date 01/16/2010. (Admin.) (Entered: 01/17/2010)",
      "document_number": "93",
      "pacer_doc_id": "046031804174",
      "pacer_seq_no": null
    },
    {
      "date_entered": "2010-01-17",
      "date_filed": "2010-01-16",
      "description": "BNC Certificate of Mailing - Notice of Hearing (related document(s) (Related Doc # 91 )). Service Date 01/16/2010. (Admin.) (Entered: 01/17/2010)",
      "document_number": "94",
      "pacer_doc_id": "046031804175",
      "pacer_seq_no": null
    },
    {
      "date_entered": "2010-01-18",
      "date_filed": "2010-01-18",
      "description": "Application to Employ R.A. Simasek, P.A. as Auditor Filed by Bernard J. Morse on behalf of Debtor Dazlbet Partners, LLC (Attachments: # 1 Mailing Matrix) (Morse, Bernard) (Entered: 01/18/2010)",
      "document_number": "95",
      "pacer_doc_id": "046031820873",
      "pacer_seq_no": null
    },
    {
      "date_entered": "2010-01-19",
      "date_filed": "2010-01-19",
      "description": "Motion for Approval of Transactions Outside the Ordinary Course of Business Filed by Bernard J. Morse on behalf of Debtor Dazlbet Partners, LLC (Morse, Bernard) (Entered: 01/19/2010)",
      "document_number": "96",
      "pacer_doc_id": "046031841712",
      "pacer_seq_no": null
    },
    {
      "date_entered": "2010-01-20",
      "date_filed": "2010-01-20",
      "description": "Notice of Preliminary Hearing on Motion for Approval of Transactions Outside the Ordinary Course of Business (related document(s) 96 ). Hearing scheduled for 2/17/2010 at 09:30 AM at Tampa, FL - Courtroom 8A, Sam M. Gibbons United States Courthouse, 801 N. Florida Avenue. (Trester, Susan) (Entered: 01/20/2010)",
      "document_number": "97",
      "pacer_doc_id": "046031862562",
      "pacer_seq_no": null
    },
    {
      "date_entered": "2010-01-20",
      "date_filed": "2010-01-20",
      "description": "Notice of Preliminary Hearing on Application to Employ RA Simasek PA as Auditor (related document(s) 95 ). Hearing scheduled for 2/17/2010 at 09:30 AM at Tampa, FL - Courtroom 8A, Sam M. Gibbons United States Courthouse, 801 N. Florida Avenue. (Trester, Susan) (Entered: 01/20/2010)",
      "document_number": "98",
      "pacer_doc_id": "046031867213",
      "pacer_seq_no": null
    },
    {
      "date_entered": "2010-01-23",
      "date_filed": "2010-01-22",
      "description": "BNC Certificate of Mailing - Notice of Hearing (related document(s) (Related Doc # 97 )). Service Date 01/22/2010. (Admin.) (Entered: 01/23/2010)",
      "document_number": "99",
      "pacer_doc_id": "046031935465",
      "pacer_seq_no": null
    },
    {
      "date_entered": "2010-01-23",
      "date_filed": "2010-01-22",
      "description": "BNC Certificate of Mailing - Notice of Hearing (related document(s) (Related Doc # 98 )). Service Date 01/22/2010. (Admin.) (Entered: 01/23/2010)",
      "document_number": "100",
      "pacer_doc_id": "046031935466",
      "pacer_seq_no": null
    },
    {
      "date_entered": "2010-01-27",
      "date_filed": "2010-01-27",
      "description": "Motion to Determine Correct Adequate Protection Payment Pursuant to Terms of Cash Collateral Order Filed by Bernard J. Morse on behalf of Debtor Dazlbet Partners, LLC (Attachments: # 1 Mailing Matrix) (related document # 4, 60, 102 ) (Morse, Bernard) (Entered: 01/27/2010)",
      "document_number": "101",
      "pacer_doc_id": "046032020159",
      "pacer_seq_no": null
    },
    {
      "date_entered": "2010-01-28",
      "date_filed": "2010-01-28",
      "description": "Fifth Interim Order on Motion to Use Cash Collateral and scheduling further hearing to be held February 17, 2010 at 9:30 a.m., Courtroom 8A, 801 N Florida Avenue, Tampa FL (related document(s) 60, 4 ). Signed on 1/28/2010 (Trester, Susan) (Entered: 01/28/2010)",
      "document_number": "102",
      "pacer_doc_id": "046032048987",
      "pacer_seq_no": null
    },
    {
      "date_entered": "2010-01-28",
      "date_filed": "2010-01-28",
      "description": "Notice of Preliminary Hearing on Motion to Determine Correct Adequate Protection Payment Pursuant to Terms of Cash Collateral Order (related document(s) 101, 4 ). Hearing scheduled for 2/17/2010 at 09:30 AM at Tampa, FL - Courtroom 8A, Sam M. Gibbons United States Courthouse, 801 N. Florida Avenue. (Trester, Susan) (Entered: 01/28/2010)",
      "document_number": "103",
      "pacer_doc_id": "046032052221",
      "pacer_seq_no": null
    },
    {
      "date_entered": "2010-01-31",
      "date_filed": "2010-01-30",
      "description": "BNC Certificate of Mailing - Notice of Hearing (related document(s) (Related Doc # 103 )). Service Date 01/30/2010. (Admin.) (Entered: 01/31/2010)",
      "document_number": "104",
      "pacer_doc_id": "046032108245",
      "pacer_seq_no": null
    },
    {
      "date_entered": "2010-01-31",
      "date_filed": "2010-01-30",
      "description": "BNC Certificate of Mailing - Order (related document(s) (Related Doc # 102 )). Service Date 01/30/2010. (Admin.) (Entered: 01/31/2010)",
      "document_number": "105",
      "pacer_doc_id": "046032108246",
      "pacer_seq_no": null
    },
    {
      "date_entered": "2010-02-08",
      "date_filed": "2010-02-08",
      "description": "Withdrawal of Claim(s): 10 Filed by Creditor Vestcor Construction Services, Inc.. (Blanks, Daniel) (Entered: 02/08/2010)",
      "document_number": "106",
      "pacer_doc_id": "046032285176",
      "pacer_seq_no": null
    },
    {
      "date_entered": "2010-02-13",
      "date_filed": "2010-02-13",
      "description": "Response to Objection to Claim No. 9 Filed by Frank A Principe on behalf of Creditor International Construction Consultants, Inc. (related document(s) 88 ). (Principe, Frank) (Entered: 02/13/2010)",
      "document_number": "107",
      "pacer_doc_id": "046032403160",
      "pacer_seq_no": null
    },
    {
      "date_entered": "2010-02-16",
      "date_filed": "2010-02-16",
      "description": "Disclosure Statement Filed by Bernard J. Morse on behalf of Debtor Dazlbet Partners, LLC. (Morse, Bernard) (Entered: 02/16/2010)",
      "document_number": "108",
      "pacer_doc_id": "046032439917",
      "pacer_seq_no": null
    },
    {
      "date_entered": "2010-02-16",
      "date_filed": "2010-02-16",
      "description": "Chapter 11 Plan of Reorganization . Filed by Bernard J. Morse on behalf of Debtor Dazlbet Partners, LLC. (Morse, Bernard) (Entered: 02/16/2010)",
      "document_number": "109",
      "pacer_doc_id": "046032439951",
      "pacer_seq_no": null
    }
  ],
  "docket_number": "8:09-bk-22876",
  "federal_defendant_number": null,
  "federal_dn_case_type": "bk",
  "federal_dn_judge_initials_assigned": "MGW",
  "federal_dn_judge_initials_referred": null,
  "federal_dn_office_code": "8",
  "jurisdiction": "",
  "jury_demand": "",
  "mdl_status": "",
  "nature_of_suit": "",
  "ordered_by": "date_filed",
  "parties": [
    {
      "attorneys": [
        {
          "contact": "Morse & Gomez PA\n11268 Winthrop Main Street, Suite 102\nRiverview, FL 33578\n813-341-8400\nFax : 813-463-1807\nEmail:\n",
          "name": "Bernard J. Morse",
          "roles": []
        },
        {
          "contact": "Richard Anton Lovesky, P.A.\n5550 - 26th St. W., Suite 8\nBradenotn, FL 34207\n",
          "name": "Richard A Lovesky",
          "roles": []
        }
      ],
      "date_terminated": null,
      "extra_info": "c/o Royal Palm Terrace Apartments\n5030 26th St E\nBradenton, FL 34203\nTax ID / EIN: 55-0830161",
      "name": "Dazlbet Partners, LLC",
      "type": "Debtor"
    },
    {
      "attorneys": [
        {
          "contact": "United States Trustee\n501 East Polk Street\nSuite 1200\nTampa, FL 33602\n813-228-2000 Ext. 227\nFax : 813-228-2303\nEmail:\n",
          "name": "Denise E Barnett",
          "roles": []
        }
      ],
      "date_terminated": null,
      "extra_info": "Timberlake Annex, Suite 1200\n501 E Polk Street\nTampa, FL 33602\n813-228-2000",
      "name": "United States Trustee - TPA",
      "type": "U.S. Trustee"
    }
  ],
  "referred_to_str": ""
}