{
  "assigned_to_str": "Caryl E. Delano",
  "case_name": "Kearney Construction Co., LLC",
  "cause": "",
  "court_id": "flmb",
  "date_converted": null,
  "date_discharged": null,
  "date_filed": "2009-08-26",
  "date_terminated": null,
  "demand": "",
  "docket_entries": [
    {
      "date_entered": "2010-01-25",
      "date_filed": "2010-01-25",
      "description": "Financial Reports for the Period December 1, 2009 to December 31, 2009. Filed by Barbara A Hart on behalf of Debtor Kearney Construction Co., LLC. (Attachments: # 1 Attachment 2 Exhibit - Part 1# 2 Attachement 2 Exhibit - Part 2# 3 Attachment 2 Exhibit - Part 3# 4 Attachment 2 Exhibit - Part 4# 5 Attachment 2 Exhibit - Part 5) (Hart, Barbara) (Entered: 01/25/2010)",
      "document_number": "86",
      "pacer_doc_id": "046031960024",
      "pacer_seq_no": null
    },
    {
      "date_entered": "2009-12-22",
      "date_filed": "2009-12-22",
      "description": "Financial Reports for the Period November 1, 2009 to November 30, 2009. Filed by Barbara A Hart on behalf of Debtor Kearney Construction Co., LLC. (Attachments: # 1 Attachment 2 Exhibit - Part 1# 2 Attachment 2 Exhibit - Part 2# 3 Attachment 2 Exhibit - Part 3# 4 Attachment 2 Exhibit - Part 4# 5 Attachment 2 Exhibit - Part 5# 6 Attachment 2 Exhibit - Part 6# 7 Attachment 2 Exhibit - Part 7# 8 Attachment 2 Exhibit - Part 8) (Hart, Barbara) (Entered: 12/22/2009)",
      "document_number": "85",
      "pacer_doc_id": "046031335452",
      "pacer_seq_no": null
    },
    {
      "date_entered": "2009-12-10",
      "date_filed": "2009-12-10",
      "description": "Removal of Viewing Restrictions on Transcript Due to No Request for Redaction from Hearing Participants (related document(s) 66 ). (Merritt, Anel) (Entered: 12/10/2009)",
      "document_number": null,
      "pacer_doc_id": null,
      "pacer_seq_no": null
    },
    {
      "date_entered": "2009-11-24",
      "date_filed": "2009-11-24",
      "description": "Financial Reports for the Period October 1, 2009 to October 31, 2009. Filed by Barbara A Hart on behalf of Debtor Kearney Construction Co., LLC. (Attachments: # 1 Attachment 1 Exhibit# 2 Attachment 2 Exhibit Part 1# 3 Attachment 2 Exhibit Part 2# 4 Attachment 2 Exhibit Part 3# 5 Attachment 2 Exhibit Part 4# 6 Attachment 2 Exhibit Part 5# 7 Attachment 2 Exhibit Part 6# 8 Attachment 2 Exhibit Part 7# 9 Attachment 2 Exhibit Part 8# 10 Attachment 2 Exhibit Part 9# 11 Attachment 2 Exhibit Part 10# 12 Attachment 2 Exhibit Part 11# 13 Attachment 2 Exhibit Part 12# 14 Attachment 2 Exhibit Part 13) (Hart, Barbara) (Entered: 11/24/2009)",
      "document_number": "84",
      "pacer_doc_id": "046030773730",
      "pacer_seq_no": null
    },
    {
      "date_entered": "2009-11-09",
      "date_filed": "2009-11-09",
      "description": "Corrective Entry Re: Document Filed in Incorrect Case by Electronic Filer; Docketed in Correct Case by Clerks Office. (related document(s) 83 ). (Merritt, Anel) (Entered: 11/09/2009)",
      "document_number": null,
      "pacer_doc_id": null,
      "pacer_seq_no": null
    },
    {
      "date_entered": "2009-11-06",
      "date_filed": "2009-11-06",
      "description": "Notice of Appearance and Request for Notice Filed by Walter L Sanders on behalf of Creditor The Bottrell Insurance Agency, Inc.. (Sanders, Walter) See Corrective Entry Dated 11/9/09Modified on 11/9/2009 (Merritt, Anel). (Entered: 11/06/2009)",
      "document_number": "83",
      "pacer_doc_id": "046030368014",
      "pacer_seq_no": null
    },
    {
      "date_entered": "2009-11-06",
      "date_filed": "2009-11-06",
      "description": "Corrective Entry Re: Document Filed in Incorrect Case by Electronic Filer; also Filed in Correct Case. No Action Required. (related document(s) 82 ). (Merritt, Anel) (Entered: 11/06/2009)",
      "document_number": null,
      "pacer_doc_id": null,
      "pacer_seq_no": null
    },
    {
      "date_entered": "2009-11-05",
      "date_filed": "2009-11-05",
      "description": "Notice of Appearance and Request for Notice Filed by Mark H Muller on behalf of Creditor Key Equipment Finance. (Muller, Mark) See Corrective Entry Dated 11/6/09 Modified on 11/6/2009 (Merritt, Anel). (Entered: 11/05/2009)",
      "document_number": "82",
      "pacer_doc_id": "046030333994",
      "pacer_seq_no": null
    },
    {
      "date_entered": "2009-10-23",
      "date_filed": "2009-10-23",
      "description": "Financial Reports for the Period August 27, 2009 to September 30, 2009. Filed by Barbara A Hart on behalf of Debtor Kearney Construction Co., LLC. (Attachments: # 1 Monthly Report - Part 2# 2 Attachment 2 Exhibit - Part 1# 3 Attachment 2 Exhibit - Part 2# 4 Attachament 2 Exhibit - Part 3# 5 Attachment to Exhibit 2 - Part 4# 6 Attachment 2 Exhibit - Part 5# 7 Attachment 2 Exhibit - Part 6) (Hart, Barbara) (Entered: 10/23/2009)",
      "document_number": "81",
      "pacer_doc_id": "046030038489",
      "pacer_seq_no": null
    },
    {
      "date_entered": "2009-10-16",
      "date_filed": "2009-10-16",
      "description": "Corrective Entry Re: Document Filed in Incorrect Case by Electronic Filer; Docketed in Correct Case by Clerks Office.. (related document(s) 79, 80 ). (Merritt, Anel) Modified on 10/16/2009 (Merritt, Anel). (Entered: 10/16/2009)",
      "document_number": null,
      "pacer_doc_id": null,
      "pacer_seq_no": null
    },
    {
      "date_entered": "2009-10-15",
      "date_filed": "2009-10-15",
      "description": "Receipt of Filing Fee for Motion for Relief From Stay(8:09-bk-18848-CED) [motion,mrlfsty] ( 150.00). Receipt Number 17812572, Amount Paid $ 150.00 (U.S. Treasury) (Entered: 10/15/2009)",
      "document_number": null,
      "pacer_doc_id": null,
      "pacer_seq_no": null
    },
    {
      "date_entered": "2009-10-15",
      "date_filed": "2009-10-15",
      "description": "Motion for Relief from Stay. (Fee Paid.) Filed by David E Hicks on behalf of Creditor Stager, Clifford (Attachments: # 1 Exhibit # 2 Mailing Matrix) (Hicks, David)See Corrective Entry Dated 10/16/09 Modified on 10/16/2009 (Merritt, Anel). (Entered: 10/15/2009)",
      "document_number": "80",
      "pacer_doc_id": "046029873660",
      "pacer_seq_no": null
    },
    {
      "date_entered": "2009-10-15",
      "date_filed": "2009-10-15",
      "description": "Notice of Appearance and Request for Notice Filed by David E Hicks on behalf of Creditor Stager, Clifford. (Hicks, David) See Corrective Entry Dated 10/16/09 Modified on 10/16/2009 (Merritt, Anel). (Entered: 10/15/2009)",
      "document_number": "79",
      "pacer_doc_id": "046029873316",
      "pacer_seq_no": null
    },
    {
      "date_entered": "2009-10-09",
      "date_filed": "2009-10-09",
      "description": "Certificate of Service Re: Notice of Commencement of Chapter 11 Case Filed by Barbara A Hart on behalf of Debtor Kearney Construction Co., LLC (related document(s) 19 ). (Hart, Barbara) (Entered: 10/09/2009)",
      "document_number": "78",
      "pacer_doc_id": "046029775104",
      "pacer_seq_no": null
    },
    {
      "date_entered": "2009-10-02",
      "date_filed": "2009-10-02",
      "description": "The United States Trustee states that the initial meeting of creditors was held and concluded on 10/02/2009. Filed by United States Trustee - TPA. (Burnette, Cynthia) (Entered: 10/02/2009)",
      "document_number": null,
      "pacer_doc_id": null,
      "pacer_seq_no": null
    },
    {
      "date_entered": "2009-09-25",
      "date_filed": "2009-09-25",
      "description": "Receipt of Filing Fee for Schedules (all schedules, individual schedules or amended schedules)(8:09-bk-18848-CED) [misc,schaja] ( 26.00). Receipt Number 17592020, Amount Paid $ 26.00 (U.S. Treasury) (Entered: 09/25/2009)",
      "document_number": null,
      "pacer_doc_id": null,
      "pacer_seq_no": null
    },
    {
      "date_entered": "2009-09-25",
      "date_filed": "2009-09-25",
      "description": "Summary of Schedules, Schedules A - H, Filing Fee Paid ., Statement of Financial Affairs, List of Equity Security Holders Filed by Stephen R Leslie on behalf of Debtor Kearney Construction Co., LLC. (Leslie, Stephen) Modified on 9/28/2009 (Merritt, Anel). (Entered: 09/25/2009)",
      "document_number": "77",
      "pacer_doc_id": "046029468076",
      "pacer_seq_no": null
    },
    {
      "date_entered": "2009-09-25",
      "date_filed": "2009-09-25",
      "description": "Notice of Change of Address of Creditors Filed by Barbara A Hart on behalf of Debtor Kearney Construction Co., LLC. (Hart, Barbara) (Entered: 09/25/2009)",
      "document_number": "76",
      "pacer_doc_id": "046029465831",
      "pacer_seq_no": null
    },
    {
      "date_entered": "2009-09-21",
      "date_filed": "2009-09-21",
      "description": "Change of address submitted to the Court on September 21, 2009 by attorney Jacqueline E. Ferris, Burr & Forman LLP, 450 S Orange Avenue, CNL Tower 1, Suite 200, Orlando Florida 32801. (Johnson, Alyson) (Entered: 09/21/2009)",
      "document_number": null,
      "pacer_doc_id": null,
      "pacer_seq_no": null
    },
    {
      "date_entered": "2009-09-18",
      "date_filed": "2009-09-18",
      "description": "Notice of Appearance and Request for Notice Filed by Douglas B Szabo on behalf of Creditor WilsonMiller, Inc.. (Szabo, Douglas) (Entered: 09/18/2009)",
      "document_number": "75",
      "pacer_doc_id": "046029305605",
      "pacer_seq_no": null
    },
    {
      "date_entered": "2009-09-17",
      "date_filed": "2009-09-14",
      "description": "Notice of Appearance and Request for Notice Filed by Creditor TW Telecom Inc.. (Merritt, Anel) (Entered: 09/17/2009)",
      "document_number": "74",
      "pacer_doc_id": "046029285475",
      "pacer_seq_no": null
    },
    {
      "date_entered": "2009-09-14",
      "date_filed": "2009-09-14",
      "description": "Corrective Entry Re: Document Filed in Incorrect Case by Electronic Filer; also Filed in Correct Case. No Action Required. (related document(s) 71, 70 ). (Merritt, Anel) (Entered: 09/14/2009)",
      "document_number": null,
      "pacer_doc_id": null,
      "pacer_seq_no": null
    },
    {
      "date_entered": "2009-09-14",
      "date_filed": "2009-09-13",
      "description": "BNC Certificate of Mailing. (related document(s) (Related Doc # 69 )). Service Date 09/13/2009. (Admin.) (Entered: 09/14/2009)",
      "document_number": "73",
      "pacer_doc_id": "046029198240",
      "pacer_seq_no": null
    },
    {
      "date_entered": "2009-09-13",
      "date_filed": "2009-09-12",
      "description": "BNC Certificate of Mailing - PDF Document. (related document(s) (Related Doc # 67 )). Service Date 09/12/2009. (Admin.) (Entered: 09/13/2009)",
      "document_number": "72",
      "pacer_doc_id": "046029189206",
      "pacer_seq_no": null
    },
    {
      "date_entered": "2009-09-11",
      "date_filed": "2009-09-11",
      "description": "Response to Debtors' Response to Travelers Casualty and Surety Company of America's Emergency Motion to Lift Stay, or Alternatively, for Adequate Protection Filed by Stephen R Leslie on behalf of Debtor Kearney Construction Co., LLC (related document(s) 38 ). (Leslie, Stephen)See Corrective Entry Dated 9/14/09 Modified on 9/14/2009 (Merritt, Anel). (Entered: 09/11/2009)",
      "document_number": "71",
      "pacer_doc_id": "046029174742",
      "pacer_seq_no": null
    },
    {
      "date_entered": "2009-09-11",
      "date_filed": "2009-09-11",
      "description": "Notice of Appearance and Request for Notice Filed by Jacqueline E Ferris on behalf of Creditor FCC Equipment Financing, Inc.. (Ferris, Jacqueline)See Corrective Entry Dated 9/14/09 Modified on 9/14/2009 (Merritt, Anel). (Entered: 09/11/2009)",
      "document_number": "70",
      "pacer_doc_id": "046029170827",
      "pacer_seq_no": null
    },
    {
      "date_entered": "2009-09-11",
      "date_filed": "2009-09-11",
      "description": "Notice Regarding Filing of Transcript and Deadline for Filing Notice of Intent to Request Redaction of Transcript. Notice of Intent to Request Redaction of Transcript to be filed within 7 business days of the date of service of this notice, but an additional three days may be added if the notice is served by U.S. Mail (related document(s) 66 ). (Merritt, Anel) (Entered: 09/11/2009)",
      "document_number": "69",
      "pacer_doc_id": "046029158418",
      "pacer_seq_no": null
    },
    {
      "date_entered": "2009-09-10",
      "date_filed": "2009-09-10",
      "description": "Order Granting Motion to Extend Time to File Schedules and Statement of Financial Affairs Filed by Barbara A Hart on behalf of Debtor Kearney Construction Co., LLC Until 9/25/09 (Related Doc # 64 ). Signed on 9/10/2009. (Merritt, Anel ) (Entered: 09/10/2009)",
      "document_number": "67",
      "pacer_doc_id": "046029128954",
      "pacer_seq_no": null
    },
    {
      "date_entered": "2009-09-10",
      "date_filed": "2009-09-10",
      "description": "Transcript Regarding Hearing Held 9/1/09 on [Re: 09-11791] 1-Emerg. Mot. For Joint Admin. Of Lead Case With Others (Doc. #87); [Re: 09-18848] 1-Emerg. Mot. For Joint Admin. Of Lead Case With Others (Doc. #4); 2-Motion To Use Cash Collateral & Granting Replacement Lien (Doc. #11) and Opposition To Use Of Cash Collateral By Travelers (Doc. #27); 3-Emerg. Mot. For Auth. To Pay Prepetition Wages, Salaries And Other Employee Benefits (Doc. #13); 4-Emerg. Mot. Prohibiting Utilities From Altering, Refusing, Or Discontinuing Service, etc. (Doc. #15); 5-Emerg. Mot. For Auth. To Pay Prepetition And Postpetition Officer And Insider Salaries (Doc. #17); 6-Emerg. Mot. For Order Auth. Maint. Of Existing Bank Account At Platinum Bank (Doc. #36); 7-Emerg. Mot. Of Hardin Construction Co. To Set Prompt Deadline For Assumption Or Rejection Of Exec. Contract (Doc. #25); [Re: 09-18851] Emerg. Mot. For Joint Admin. Of Lead Case With Others (Doc. #4); [Re: 09-18861] 1-Emerg. Mot. For Joint Admin. Of Lead Case With Others (Doc. #4). To purchase a copy of this transcript, please contact Johnson Transcription Service: 813-920-1466 . Transcript access will be restricted through 12/9/2009. (Johnson Transcription Service) (Entered: 09/10/2009)",
      "document_number": "66",
      "pacer_doc_id": "046029127925",
      "pacer_seq_no": null
    },
    {
      "date_entered": "2009-09-08",
      "date_filed": "2009-09-08",
      "description": "Notice of Change of Address of Creditors Filed by Barbara A Hart on behalf of Debtor Kearney Construction Co., LLC. (Hart, Barbara) (Entered: 09/08/2009)",
      "document_number": "65",
      "pacer_doc_id": "046029099088",
      "pacer_seq_no": null
    },
    {
      "date_entered": "2009-09-08",
      "date_filed": "2009-09-08",
      "description": "Motion to Extend Time to File Schedules and Statement of Financial Affairs Filed by Barbara A Hart on behalf of Debtor Kearney Construction Co., LLC (Hart, Barbara) (Entered: 09/08/2009)",
      "document_number": "64",
      "pacer_doc_id": "046029098261",
      "pacer_seq_no": null
    },
    {
      "date_entered": "2009-09-07",
      "date_filed": "2009-09-06",
      "description": "BNC Certificate of Mailing - Order (related document(s) (Related Doc # 54 )). Service Date 09/06/2009. (Admin.) (Entered: 09/07/2009)",
      "document_number": "63",
      "pacer_doc_id": "046029074293",
      "pacer_seq_no": null
    },
    {
      "date_entered": "2009-09-07",
      "date_filed": "2009-09-06",
      "description": "BNC Certificate of Mailing - Order (related document(s) (Related Doc # 53 )). Service Date 09/06/2009. (Admin.) (Entered: 09/07/2009)",
      "document_number": "62",
      "pacer_doc_id": "046029074292",
      "pacer_seq_no": null
    },
    {
      "date_entered": "2009-09-07",
      "date_filed": "2009-09-06",
      "description": "BNC Certificate of Mailing - Order (related document(s) (Related Doc # 52 )). Service Date 09/06/2009. (Admin.) (Entered: 09/07/2009)",
      "document_number": "61",
      "pacer_doc_id": "046029074291",
      "pacer_seq_no": null
    },
    {
      "date_entered": "2009-09-07",
      "date_filed": "2009-09-06",
      "description": "BNC Certificate of Mailing - PDF Document. (related document(s) (Related Doc # 55 )). Service Date 09/06/2009. (Admin.) (Entered: 09/07/2009)",
      "document_number": "60",
      "pacer_doc_id": "046029074290",
      "pacer_seq_no": null
    },
    {
      "date_entered": "2009-09-07",
      "date_filed": "2009-09-06",
      "description": "BNC Certificate of Mailing - PDF Document. (related document(s) (Related Doc # 51 )). Service Date 09/06/2009. (Admin.) (Entered: 09/07/2009)",
      "document_number": "59",
      "pacer_doc_id": "046029074289",
      "pacer_seq_no": null
    },
    {
      "date_entered": "2009-09-06",
      "date_filed": "2009-09-05",
      "description": "BNC Certificate of Mailing - Notice to Creditors and Parties in Interest (related document(s) (Related Doc # 48 )). Service Date 09/05/2009. (Admin.) (Entered: 09/06/2009)",
      "document_number": "58",
      "pacer_doc_id": "046029067402",
      "pacer_seq_no": null
    },
    {
      "date_entered": "2009-09-10",
      "date_filed": "2009-09-04",
      "description": "Notice of Appearance and Request for Notice on Behalf of the Debtor Filed by Tula Michele Haff on behalf of Creditor Travis Resmondo Sod, Inc.. (Merritt, Anel) (Entered: 09/10/2009)",
      "document_number": "68",
      "pacer_doc_id": "046029136869",
      "pacer_seq_no": null
    },
    {
      "date_entered": "2009-09-04",
      "date_filed": "2009-09-04",
      "description": "Statement of Corporate Ownership Filed by Stephen R Leslie on behalf of Debtor Kearney Construction Co., LLC. (Leslie, Stephen) (Entered: 09/04/2009)",
      "document_number": "57",
      "pacer_doc_id": "046029048675",
      "pacer_seq_no": null
    },
    {
      "date_entered": "2009-09-04",
      "date_filed": "2009-09-04",
      "description": "Notice of Appearance and Request for Notice Filed by Heather A DeGrave on behalf of Creditor Ajax Paving Industries, Inc.. (DeGrave, Heather) (Entered: 09/04/2009)",
      "document_number": "56",
      "pacer_doc_id": "046029044197",
      "pacer_seq_no": null
    },
    {
      "date_entered": "2009-09-04",
      "date_filed": "2009-09-04",
      "description": "Order Granting Motion For Joint Administration 8:09-bk-18848-CED with 8:09-bk-11791-CED as the Lead case. \"An Order has been entered under rule 1015(b) of the Federal Rules of Bankruptcy Procedure directing the procedural consolidation and joint administration of the Chapter 11 cases of Kearney Construction Co., LLC, Kearney Construction Company, Inc., AVT Equipment, LLC, Florida Trucking Co., Inc. and Florida Equipment Co., Inc., Case No. 8:09-bk-11791-CED should be consulted for all matters affecting this Chapter 11 Case.\" (Related Doc # 4 ). Signed on 9/4/2009. (Merritt, Anel ) (Entered: 09/04/2009)",
      "document_number": "55",
      "pacer_doc_id": "046029043532",
      "pacer_seq_no": null
    },
    {
      "date_entered": "2009-09-04",
      "date_filed": "2009-09-04",
      "description": "Order Granting Motion for Order Authorizing the Maintenance of Existing Bank Account at Platinum Bank Filed by Barbara A Hart on behalf of Debtor Kearney Construction Co., LLC (Related Doc # 36 ). Signed on 9/4/2009. (Merritt, Anel ) (Entered: 09/04/2009)",
      "document_number": "54",
      "pacer_doc_id": "046029039802",
      "pacer_seq_no": null
    },
    {
      "date_entered": "2009-09-04",
      "date_filed": "2009-09-04",
      "description": "Order Granting Motion for Authority to Pay Prepetition and Postpetition Officer and Insider Salaries Filed by Stephen R Leslie on behalf of Debtor Kearney Construction Co., LLC (Interim Order) (Related Doc # 17 ). Signed on 9/4/2009. (Merritt, Anel ) (Entered: 09/04/2009)",
      "document_number": "53",
      "pacer_doc_id": "046029039715",
      "pacer_seq_no": null
    },
    {
      "date_entered": "2009-09-04",
      "date_filed": "2009-09-04",
      "description": "Order Granting Motion for Authorization to Pay Prepetition Wages, Salaries and Other Employee Benefits Filed by Stephen R Leslie on behalf of Debtor Kearney Construction Co., LLC (Related Doc # 13 ). Signed on 9/4/2009. (Merritt, Anel ) (Entered: 09/04/2009)",
      "document_number": "52",
      "pacer_doc_id": "046029039255",
      "pacer_seq_no": null
    },
    {
      "date_entered": "2009-09-04",
      "date_filed": "2009-09-04",
      "description": "Order Granting Motion Puirsuant to Sections 105(a) and 336 of the Bankruptcy Code (i) Prohibiting Utilites from Altering, Rufusing or Discontinuing Service on Account of Unpaid Prepetition Invoices; (ii)Approving the Debtor's Proposed Aadequate Assurance of Payment; and (iii) Establishing Procedures for Determining Additional Requests for Adequate Assurance of Payment (Related Doc # 15 ). Signed on 9/4/2009. (Merritt, Anel ) (Entered: 09/04/2009)",
      "document_number": "51",
      "pacer_doc_id": "046029038989",
      "pacer_seq_no": null
    },
    {
      "date_entered": "2009-09-04",
      "date_filed": "2009-09-03",
      "description": "BNC Certificate of Mailing - Notice of Hearing (related document(s) (Related Doc # 45 )). Service Date 09/03/2009. (Admin.) (Entered: 09/04/2009)",
      "document_number": "50",
      "pacer_doc_id": "046029034137",
      "pacer_seq_no": null
    },
    {
      "date_entered": "2009-09-04",
      "date_filed": "2009-09-03",
      "description": "BNC Certificate of Mailing - Notice of Hearing (related document(s) (Related Doc # 46 )). Service Date 09/03/2009. (Admin.) (Entered: 09/04/2009)",
      "document_number": "49",
      "pacer_doc_id": "046029034136",
      "pacer_seq_no": null
    },
    {
      "date_entered": "2009-09-03",
      "date_filed": "2009-09-03",
      "description": "Amended Notice of Deficient Filing. Summary of Schedules, Schedules, Statement of Financial Affairs, Disclosure of Compensation and Statement Corporate Ownership (amended to include Statement of Corporate Ownership). Compliance required no later than 9/5/2009. (Merritt, Anel) Modified on 9/3/2009 (Merritt, Anel). (Entered: 09/03/2009)",
      "document_number": "48",
      "pacer_doc_id": "046029015720",
      "pacer_seq_no": null
    },
    {
      "date_entered": "2009-09-08",
      "date_filed": "2009-09-02",
      "description": "Receipt of Filing Fee for Motion for Relief from Automatic Stay. Receipt Number 72355/ED., Amount Paid $150 (related document(s) 38 ). (High, Liz) (Entered: 09/08/2009)",
      "document_number": null,
      "pacer_doc_id": null,
      "pacer_seq_no": null
    },
    {
      "date_entered": "2009-09-02",
      "date_filed": "2009-09-02",
      "description": "Notice of Continued Hearing Filed by Barbara A Hart on behalf of Debtor Kearney Construction Co., LLC (related document(s) 27, 11, 33 ). Hearing scheduled for 9/14/2009 at 03:30 PM at Tampa, FL - Courtroom 10B, Sam M. Gibbons United States Courthouse, 801 N. Florida Avenue. (Hart, Barbara) (Entered: 09/02/2009)",
      "document_number": "47",
      "pacer_doc_id": "046028990391",
      "pacer_seq_no": null
    },
    {
      "date_entered": "2009-09-01",
      "date_filed": "2009-09-01",
      "description": "Corrective Entry Re: Incorrect Event selected by ElectronicFiler; Corrected by Clerks Office. (related document(s) 38 ). (Merritt, Anel) (Entered: 09/01/2009)",
      "document_number": null,
      "pacer_doc_id": null,
      "pacer_seq_no": null
    },
    {
      "date_entered": "2009-09-01",
      "date_filed": "2009-09-01",
      "description": "Preliminary Hearing Order on Motion for Relief from Stay re: Bonded Contracts Filed by Travelers Casualty and Surety Company of America (related document(s) 38 ). Hearing scheduled for 9/14/2009 at 03:30 PM at Tampa, FL - Courtroom 10B, Sam M. Gibbons United States Courthouse, 801 N. Florida Avenue. Signed on 9/1/2009 (Merritt, Anel) (Entered: 09/01/2009)",
      "document_number": "46",
      "pacer_doc_id": "046028977709",
      "pacer_seq_no": null
    },
    {
      "date_entered": "2009-09-01",
      "date_filed": "2009-09-01",
      "description": "Notice of Preliminary Hearing on Emergency Motion to Set Date Certain for Debtor in Possession to Accept or Reject Certain Executory Contracts Filed by Alberta L. Adams on behalf of Creditor Travelers Casualty and Surety Company of America (related document(s) 39 ). Hearing scheduled for 9/14/2009 at 03:30 PM at Tampa, FL - Courtroom 10B, Sam M. Gibbons United States Courthouse, 801 N. Florida Avenue. (Merritt, Anel) (Entered: 09/01/2009)",
      "document_number": "45",
      "pacer_doc_id": "046028977278",
      "pacer_seq_no": null
    },
    {
      "date_entered": "2009-09-01",
      "date_filed": "2009-09-01",
      "description": "Notice of Hearing Filed by Barbara A Hart on behalf of Debtor Kearney Construction Co., LLC (related document(s) 36 ). Hearing scheduled for 9/1/2009 at 02:00 PM at Tampa, FL - Courtroom 10B, Sam M. Gibbons United States Courthouse, 801 N. Florida Avenue. (Hart, Barbara) (Entered: 09/01/2009)",
      "document_number": "44",
      "pacer_doc_id": "046028968120",
      "pacer_seq_no": null
    },
    {
      "date_entered": "2009-09-01",
      "date_filed": "2009-09-01",
      "description": "Notice of Appearance and Request for Notice Filed by F. Lorraine Jahn on behalf of Creditor Hamilton Engineering & Surveying, Inc.. (Jahn, F.) (Entered: 09/01/2009)",
      "document_number": "43",
      "pacer_doc_id": "046028965796",
      "pacer_seq_no": null
    },
    {
      "date_entered": "2009-09-01",
      "date_filed": "2009-09-01",
      "description": "Certificate of Service Re: Emergency Motion for Order Authorizing the Maintenance of Existing Bank Account at Platinum Bank Filed by Barbara A Hart on behalf of Debtor Kearney Construction Co., LLC (related document(s) 36 ). (Hart, Barbara) (Entered: 09/01/2009)",
      "document_number": "42",
      "pacer_doc_id": "046028960642",
      "pacer_seq_no": null
    },
    {
      "date_entered": "2009-08-31",
      "date_filed": "2009-08-31",
      "description": "Certificate of Necessity Regarding Motion to Set Date Certain for Debtor in Possession to Accept or Reject Certain Executory Contracts Filed by Alberta L. Adams on behalf of Creditor Travelers Casualty and Surety Company of America (related document(s) 39 ). (Adams, Alberta) (Entered: 08/31/2009)",
      "document_number": "41",
      "pacer_doc_id": "046028956222",
      "pacer_seq_no": null
    },
    {
      "date_entered": "2009-08-31",
      "date_filed": "2009-08-31",
      "description": "Certificate of Necessity Regarding Emergency Motion to Lift Stay, Alternatively, for Adequate Protection Filed by Alberta L. Adams on behalf of Creditor Travelers Casualty and Surety Company of America (related document(s) 38 ). (Adams, Alberta) (Entered: 08/31/2009)",
      "document_number": "40",
      "pacer_doc_id": "046028956163",
      "pacer_seq_no": null
    },
    {
      "date_entered": "2009-08-31",
      "date_filed": "2009-08-31",
      "description": "Emergency Motion to Set Date Certain for Debtor in Possession to Accept or Reject Certain Executory Contracts Filed by Alberta L. Adams on behalf of Creditor Travelers Casualty and Surety Company of America (Attachments: # 1 Exhibit A# 2 Exhibit B# 3 Exhibit C_Part 1# 4 Exhibit C_Part 2# 5 Exhibit C_Part 3# 6 Exhibit C_Part 4# 7 Exhibit D) (Adams, Alberta) (Entered: 08/31/2009)",
      "document_number": "39",
      "pacer_doc_id": "046028956042",
      "pacer_seq_no": null
    },
    {
      "date_entered": "2009-08-31",
      "date_filed": "2009-08-31",
      "description": "Emergency Motion to Lift Stay, Alternatively, for Adequate Protection(Filing Fee Paid) re: Bonded Contracts Filed by Alberta L. Adams on behalf of Creditor Travelers Casualty and Surety Company of America (Attachments: # 1 Exhibit A# 2 Exhibit B# 3 Exhibit C_Part 1# 4 Exhibit C_Part 2# 5 Exhibit C_Part 3# 6 Exhibit C_Part 4# 7 Exhibit D) (Adams, Alberta)See Corrective Entry Dated 9/1/09 Modified on 9/1/2009 (Merritt, Anel). Modified on 9/8/2009 (Merritt, Anel). (Entered: 08/31/2009)",
      "document_number": "38",
      "pacer_doc_id": "046028955774",
      "pacer_seq_no": null
    },
    {
      "date_entered": "2009-08-31",
      "date_filed": "2009-08-31",
      "description": "Certificate of Necessity for Emergency Hearing Filed by Barbara A Hart on behalf of Debtor Kearney Construction Co., LLC (related document(s) 36 ). (Hart, Barbara) (Entered: 08/31/2009)",
      "document_number": "37",
      "pacer_doc_id": "046028954605",
      "pacer_seq_no": null
    },
    {
      "date_entered": "2009-08-31",
      "date_filed": "2009-08-31",
      "description": "Emergency Motion for Order Authorizing the Maintenance of Existing Bank Account at Platinum Bank Filed by Barbara A Hart on behalf of Debtor Kearney Construction Co., LLC (Hart, Barbara) (Entered: 08/31/2009)",
      "document_number": "36",
      "pacer_doc_id": "046028954403",
      "pacer_seq_no": null
    },
    {
      "date_entered": "2009-08-31",
      "date_filed": "2009-08-31",
      "description": "Chapter 11 Case Management Summary Filed by Barbara A Hart on behalf of Debtor Kearney Construction Co., LLC. (Hart, Barbara) (Entered: 08/31/2009)",
      "document_number": "35",
      "pacer_doc_id": "046028952969",
      "pacer_seq_no": null
    },
    {
      "date_entered": "2009-08-31",
      "date_filed": "2009-08-31",
      "description": "Notice of Appearance and Request for Notice Filed by Rabian M. Brooks III on behalf of Creditor GE Commercial Finance Business Property Corporation. (Brooks, Rabian) (Entered: 08/31/2009)",
      "document_number": "34",
      "pacer_doc_id": "046028951710",
      "pacer_seq_no": null
    },
    {
      "date_entered": "2009-08-31",
      "date_filed": "2009-08-31",
      "description": "Opposition to Motion for Entry of Interim and Final Orders Authorizing Use of Cash Collateral Filed by Jeffrey W. Warren on behalf of Creditor Bank of America, N.A. (related document(s) 11 ). (Attachments: # 1 Exhibit A# 2 Exhibits B-G) (Warren, Jeffrey) (Entered: 08/31/2009)",
      "document_number": "33",
      "pacer_doc_id": "046028950405",
      "pacer_seq_no": null
    },
    {
      "date_entered": "2009-08-31",
      "date_filed": "2009-08-31",
      "description": "Notice of Emergency Hearing Filed by John D Emmanuel on behalf of Creditor Hardin Construction Company LLC (related document(s) 25 ). Hearing scheduled for 9/1/2009 at 02:00 PM at Tampa, FL - Courtroom 10B, Sam M. Gibbons United States Courthouse, 801 N. Florida Avenue. (Emmanuel, John) (Entered: 08/31/2009)",
      "document_number": "32",
      "pacer_doc_id": "046028944083",
      "pacer_seq_no": null
    },
    {
      "date_entered": "2009-08-30",
      "date_filed": "2009-08-29",
      "description": "BNC Certificate of Mailing - Notice of Meeting of Creditors. (related document(s) (Related Doc # 19 )). Service Date 08/29/2009. (Admin.) (Entered: 08/30/2009)",
      "document_number": "31",
      "pacer_doc_id": "046028918992",
      "pacer_seq_no": null
    },
    {
      "date_entered": "2009-08-30",
      "date_filed": "2009-08-29",
      "description": "BNC Certificate of Mailing - Operating Order (related document(s) (Related Doc # 8 )). Service Date 08/29/2009. (Admin.) (Entered: 08/30/2009)",
      "document_number": "30",
      "pacer_doc_id": "046028918991",
      "pacer_seq_no": null
    },
    {
      "date_entered": "2009-08-30",
      "date_filed": "2009-08-29",
      "description": "BNC Certificate of Mailing - Operating Order (related document(s) (Related Doc # 6 )). Service Date 08/29/2009. (Admin.) (Entered: 08/30/2009)",
      "document_number": "29",
      "pacer_doc_id": "046028918990",
      "pacer_seq_no": null
    },
    {
      "date_entered": "2009-08-30",
      "date_filed": "2009-08-29",
      "description": "BNC Certificate of Mailing - Notice to Creditors and Parties in Interest (related document(s) (Related Doc # 5 )). Service Date 08/29/2009. (Admin.) (Entered: 08/30/2009)",
      "document_number": "28",
      "pacer_doc_id": "046028918989",
      "pacer_seq_no": null
    },
    {
      "date_entered": "2009-08-28",
      "date_filed": "2009-08-28",
      "description": "Opposition Objection to Debtor's Emergency Motion for Interim and Final Orders Authorizing Use of Cash Collateral and Granting Replacement Lien Pursuant to Sections 105(a), 361, 363, 541 and 552 of the Bankrtupcy Code and Rule 4001 of the Federal Rules of Bankruptcy Procedure Filed by Alberta L. Adams on behalf of Creditor Travelers Casualty and Surety Company of America (related document(s) 11 ). (Attachments: # 1 Exhibit A# 2 Exhibit B# 3 Exhibit C_Part 1# 4 Exhibit C_Part 2# 5 Exhibit C_Part 3# 6 Exhibit C_Part 4# 7 Exhibit D) (Adams, Alberta) (Entered: 08/28/2009)",
      "document_number": "27",
      "pacer_doc_id": "046028907159",
      "pacer_seq_no": null
    },
    {
      "date_entered": "2009-08-28",
      "date_filed": "2009-08-28",
      "description": "Certificate of Necessity For Emergency Motion Of Hardin Construction Company, LLC To Set Prompt Deadline For Assumption or Rejection of Executory Contract Filed by John D Emmanuel on behalf of Creditor Hardin Construction Company LLC (related document(s) 25 ). (Emmanuel, John) (Entered: 08/28/2009)",
      "document_number": "26",
      "pacer_doc_id": "046028897216",
      "pacer_seq_no": null
    },
    {
      "date_entered": "2009-08-28",
      "date_filed": "2009-08-28",
      "description": "Emergency Motion of Hardin Construction Company LLC to Set Prompt Deadline For Assumption or Rejection of Executory Contract Filed by John D Emmanuel on behalf of Creditor Hardin Construction Company LLC (Attachments: # 1 Exhibit A) (Emmanuel, John) (Entered: 08/28/2009)",
      "document_number": "25",
      "pacer_doc_id": "046028897136",
      "pacer_seq_no": null
    },
    {
      "date_entered": "2009-08-28",
      "date_filed": "2009-08-28",
      "description": "Notice of Appearance and Request for Notice Filed by United States Trustee - TPA. (Burnette, Cynthia) (Entered: 08/28/2009)",
      "document_number": "24",
      "pacer_doc_id": "046028886282",
      "pacer_seq_no": null
    },
    {
      "date_entered": "2009-08-27",
      "date_filed": "2009-08-27",
      "description": "Notice of Appearance and Request for Notice Filed by Ryan Scully on behalf of Creditor Travelers Casualty and Surety Company of America. (Scully, Ryan) (Entered: 08/27/2009)",
      "document_number": "23",
      "pacer_doc_id": "046028879620",
      "pacer_seq_no": null
    },
    {
      "date_entered": "2009-08-27",
      "date_filed": "2009-08-27",
      "description": "Notice of Appearance and Request for Notice And Placement On The Local Rule 1007-2 Parties In Interest List Filed by John D Emmanuel on behalf of Creditor Hardin Construction Company LLC. (Emmanuel, John) (Entered: 08/27/2009)",
      "document_number": "22",
      "pacer_doc_id": "046028876572",
      "pacer_seq_no": null
    },
    {
      "date_entered": "2009-08-27",
      "date_filed": "2009-08-27",
      "description": "Complaint by Kearney Construction Co., LLC against Travelers Casualty and Surety Company of America 8:09-ap-00599-CED; Nature of Suit(s): 12 (Recovery of money/property - 547 preference). (Leslie, Stephen) (Entered: 08/27/2009)",
      "document_number": "21",
      "pacer_doc_id": null,
      "pacer_seq_no": null
    },
    {
      "date_entered": "2009-08-27",
      "date_filed": "2009-08-27",
      "description": "Notice of Hearing Filed by Barbara A Hart on behalf of Debtor Kearney Construction Co., LLC (related document(s) 17, 15, 11, 4, 13 ). Hearing scheduled for 9/1/2009 at 02:00 PM at Tampa, FL - Courtroom 10B, Sam M. Gibbons United States Courthouse, 801 N. Florida Avenue. (Hart, Barbara) (Entered: 08/27/2009)",
      "document_number": "20",
      "pacer_doc_id": "046028872847",
      "pacer_seq_no": null
    },
    {
      "date_entered": "2009-08-27",
      "date_filed": "2009-08-27",
      "description": "Notice of Commencement of Case, Section 341 Meeting of Creditors, and Fixing Deadlines . Section 341(a) meeting to be held on 10/2/2009 at 01:30 PM at Tampa, FL (860) - Room 100-A, Timberlake Annex, 501 E. Polk Street. Last day to oppose discharge or dischargeability is 12/1/2009. Proofs of Claims due by 11/9/2009. (Thomas, Christiane) (Entered: 08/27/2009)",
      "document_number": "19",
      "pacer_doc_id": "046028869523",
      "pacer_seq_no": null
    },
    {
      "date_entered": "2009-08-27",
      "date_filed": "2009-08-27",
      "description": "Certificate of Necessity Re: Motion to Pay Prepetition and Postpetitioin Officer and Insider Salaries Filed by Stephen R Leslie on behalf of Debtor Kearney Construction Co., LLC (related document(s) 17 ). (Leslie, Stephen) (Entered: 08/27/2009)",
      "document_number": "18",
      "pacer_doc_id": "046028868583",
      "pacer_seq_no": null
    },
    {
      "date_entered": "2009-08-27",
      "date_filed": "2009-08-27",
      "description": "Emergency Motion for Authority to Pay Prepetition and Postpetition Officer and Insider Salaries Filed by Stephen R Leslie on behalf of Debtor Kearney Construction Co., LLC (Leslie, Stephen) (Entered: 08/27/2009)",
      "document_number": "17",
      "pacer_doc_id": "046028868547",
      "pacer_seq_no": null
    },
    {
      "date_entered": "2009-08-27",
      "date_filed": "2009-08-27",
      "description": "Certificate of Necessity Re: Motion to Prohibit Utilities from Altering, Refusing or Discontinuing Service, etc. Filed by Stephen R Leslie on behalf of Debtor Kearney Construction Co., LLC (related document(s) 15 ). (Leslie, Stephen) (Entered: 08/27/2009)",
      "document_number": "16",
      "pacer_doc_id": "046028868508",
      "pacer_seq_no": null
    },
    {
      "date_entered": "2009-08-27",
      "date_filed": "2009-08-27",
      "description": "Emergency Motion Prohibit Utilities from Altering, Refusing, or Discontinuing Service on Account of Prepetition Invoices; Approving Debtor's Proposed Adequate Assurance of Payment; and Establishing Procedures for Determining Additional Requests for Adequate Assurance of Payment Filed by Stephen R Leslie on behalf of Debtor Kearney Construction Co., LLC (Leslie, Stephen) (Entered: 08/27/2009)",
      "document_number": "15",
      "pacer_doc_id": "046028868466",
      "pacer_seq_no": null
    },
    {
      "date_entered": "2009-08-27",
      "date_filed": "2009-08-27",
      "description": "Certificate of Necessity Re: Motion to Pay Wages, Salaries and Other Employee Benefits Filed by Stephen R Leslie on behalf of Debtor Kearney Construction Co., LLC (related document(s) 13 ). (Leslie, Stephen) (Entered: 08/27/2009)",
      "document_number": "14",
      "pacer_doc_id": "046028868416",
      "pacer_seq_no": null
    },
    {
      "date_entered": "2009-08-27",
      "date_filed": "2009-08-27",
      "description": "Emergency Motion for Authorization to Pay Prepetition Wages, Salaries and Other Employee Benefits Filed by Stephen R Leslie on behalf of Debtor Kearney Construction Co., LLC (Leslie, Stephen) (Entered: 08/27/2009)",
      "document_number": "13",
      "pacer_doc_id": "046028868383",
      "pacer_seq_no": null
    },
    {
      "date_entered": "2009-08-27",
      "date_filed": "2009-08-27",
      "description": "Certificate of Necessity Re: Motion to Use Cash Collateral and Granting Replacement Lien Filed by Stephen R Leslie on behalf of Debtor Kearney Construction Co., LLC (related document(s) 11 ). (Leslie, Stephen) (Entered: 08/27/2009)",
      "document_number": "12",
      "pacer_doc_id": "046028868328",
      "pacer_seq_no": null
    },
    {
      "date_entered": "2009-08-27",
      "date_filed": "2009-08-27",
      "description": "Motion to Use Cash Collateral and Granting Replacement Lien Filed by Stephen R Leslie on behalf of Debtor Kearney Construction Co., LLC (Leslie, Stephen) (Entered: 08/27/2009)",
      "document_number": "11",
      "pacer_doc_id": "046028868296",
      "pacer_seq_no": null
    },
    {
      "date_entered": "2009-08-27",
      "date_filed": "2009-08-27",
      "description": "Certificate of Necessity Re: Motion for Joint Administration Filed by Stephen R Leslie on behalf of Debtor Kearney Construction Co., LLC (related document(s) 4 ). (Leslie, Stephen) (Entered: 08/27/2009)",
      "document_number": "10",
      "pacer_doc_id": "046028868178",
      "pacer_seq_no": null
    },
    {
      "date_entered": "2009-08-27",
      "date_filed": "2009-08-27",
      "description": "Notice of Appearance and Request for Notice Filed by Jeffrey W. Warren on behalf of Creditor Bank of America, N.A.. (Warren, Jeffrey) (Entered: 08/27/2009)",
      "document_number": "9",
      "pacer_doc_id": "046028866872",
      "pacer_seq_no": null
    },
    {
      "date_entered": "2009-08-27",
      "date_filed": "2009-08-27",
      "description": "Order to File All State and Federal Tax Returns and Pay Taxes When Due . Signed on 8/27/2009 (Thomas, Christiane) (Entered: 08/27/2009)",
      "document_number": "8",
      "pacer_doc_id": "046028862953",
      "pacer_seq_no": null
    },
    {
      "date_entered": "2009-08-27",
      "date_filed": "2009-08-27",
      "description": "Supplemental Affidavit of Stephen R. Leslie in Support of Application for Authorization to Employ Stichter, Riedel, Blain & Prosser, P.A. as Counsel for Debtor Filed by Stephen R Leslie on behalf of Debtor Kearney Construction Co., LLC (related document(s) 3 ). (Leslie, Stephen) (Entered: 08/27/2009)",
      "document_number": "7",
      "pacer_doc_id": "046028859386",
      "pacer_seq_no": null
    },
    {
      "date_entered": "2009-08-26",
      "date_filed": "2009-08-26",
      "description": "Order to File All State and Federal Tax Returns and Pay Taxes When Due . Signed on 8/26/2009 (Merritt, Anel) (Entered: 08/26/2009)",
      "document_number": "6",
      "pacer_doc_id": "046028851764",
      "pacer_seq_no": null
    },
    {
      "date_entered": "2009-08-26",
      "date_filed": "2009-08-26",
      "description": "Notice of Deficient Filing. Summary of Schedules, Schedules, Statement of Financial Affairs, Disclosure of Compensation, Case Management Summary . Compliance required no later than 9/5/2009. (Merritt, Anel) (Entered: 08/26/2009)",
      "document_number": "5",
      "pacer_doc_id": "046028851701",
      "pacer_seq_no": null
    },
    {
      "date_entered": "2009-08-26",
      "date_filed": "2009-08-26",
      "description": "Emergency Motion for Joint Administration of Lead Case 8:09-bk-11791-CED with 8:09-bk-11792-CED, 8:09-bk-18848-CED, 8:09-bk18851-CED, and 8:09-bk-18861-CED Filed by Stephen R Leslie on behalf of Debtor Kearney Construction Co., LLC (Leslie, Stephen) Modified on 8/26/2009 (Merritt, Anel). (Entered: 08/26/2009)",
      "document_number": "4",
      "pacer_doc_id": "046028847246",
      "pacer_seq_no": null
    },
    {
      "date_entered": "2009-08-26",
      "date_filed": "2009-08-26",
      "description": "Receipt of Filing Fee for Voluntary Petition (Chapter 11)(8:09-bk-18848) [misc,volp11a2] (1039.00). Receipt Number 17251278, Amount Paid $1039.00 (U.S. Treasury) (Entered: 08/26/2009)",
      "document_number": null,
      "pacer_doc_id": null,
      "pacer_seq_no": null
    },
    {
      "date_entered": "2009-08-26",
      "date_filed": "2009-08-26",
      "description": "Assignment of the Honorable Caryl E. Delano, Bankruptcy Judge to this case, The Trustee appointed to this case is the United States Trustee. (Mason, Sara) (Entered: 08/26/2009)",
      "document_number": null,
      "pacer_doc_id": null,
      "pacer_seq_no": null
    },
    {
      "date_entered": "2009-08-26",
      "date_filed": "2009-08-26",
      "description": "Application to Employ Stichter, Riedel, Blain & Prosser, P.A. as Counsel for Debtor Filed by Stephen R Leslie on behalf of Debtor Kearney Construction Co., LLC (Leslie, Stephen) (Entered: 08/26/2009)",
      "document_number": "3",
      "pacer_doc_id": "046028844747",
      "pacer_seq_no": null
    },
    {
      "date_entered": "2009-08-26",
      "date_filed": "2009-08-26",
      "description": "List of 20 Largest Unsecured Creditors Filed by Stephen R Leslie on behalf of Debtor Kearney Construction Co., LLC. (Leslie, Stephen) (Entered: 08/26/2009)",
      "document_number": "2",
      "pacer_doc_id": "046028844674",
      "pacer_seq_no": null
    },
    {
      "date_entered": "2009-08-26",
      "date_filed": "2009-08-26",
      "description": "Voluntary Petition under Chapter 11. (Fee Paid) Schedules and Statements Incomplete, Statement of Financial Affairs Not Filed or Incomplete, Disclosure of Compensation of Attorney Not Filed or Not Required, Filed by Stephen R Leslie on behalf of Kearney Construction Co., LLC. (Leslie, Stephen) Modified on 8/26/2009 (Merritt, Anel). (Entered: 08/26/2009)",
      "document_number": "1",
      "pacer_doc_id": "046028844562",
      "pacer_seq_no": null
    }
  ],
  "docket_number": "8:09-bk-18848",
  "federal_defendant_number": null,
  "federal_dn_case_type": "bk",
  "federal_dn_judge_initials_assigned": "CED",
  "federal_dn_judge_initials_referred": null,
  "federal_dn_office_code": "8",
  "jurisdiction": "",
  "jury_demand": "",
  "mdl_status": "",
  "nature_of_suit": "",
  "ordered_by": "date_filed",
  "parties": [
    {
      "attorneys": [
        {
          "contact": "Stichter, Riedel, Blain & Prosser\n110 E. Madison Street, Suite 200\nTampa, FL 33602-4700\n813-229-0144\nFax : 813-229-1811\nEmail:\n",
          "name": "Barbara A Hart",
          "roles": []
        },
        {
          "contact": "Stichter, Riedel, Blain & Prosser\n110 East Madison Street, Suite 200\nTampa, FL 33602-4700\n813-229-0144\nEmail:\n",
          "name": "Stephen R Leslie",
          "roles": []
        }
      ],
      "date_terminated": null,
      "extra_info": "5115 Joanne Kearney Blvd.\nTampa, FL 33619\nTax ID / EIN: 20-3917360",
      "name": "Kearney Construction Co., LLC",
      "type": "Debtor"
    },
    {
      "attorneys": [
        {
          "contact": "United States Trustee\nTimberlake Annex, Ste. 1200\n501 E. Polk Street\nTampa, FL 33602\n813-228-2000\nFax : 813-228-2303\nEmail:\n",
          "name": "Cynthia Burnette",
          "roles": []
        }
      ],
      "date_terminated": null,
      "extra_info": "Timberlake Annex, Suite 1200\n501 E Polk Street\nTampa, FL 33602\n813-228-2000",
      "name": "United States Trustee - TPA",
      "type": "U.S. Trustee"
    }
  ],
  "referred_to_str": ""
}