{
  "assigned_to_str": "Manuel Barbosa", 
  "case_name": "Sean Burke", 
  "cause": null, 
  "court_id": "ilnb", 
  "date_converted": null, 
  "date_discharged": null, 
  "date_filed": "2009-01-06", 
  "date_terminated": null, 
  "demand": null, 
  "docket_entries": [
    {
      "date_filed": "2009-01-06", 
      "description": "Chapter 7 Voluntary Petition Fee Amount $299, Filed by Scott R Clar on behalf of Sean Burke, Nikole Burke (Clar, Scott) (Entered: 01/06/2009)", 
      "document_number": "1", 
      "pacer_doc_id": "066020081654"
    }, 
    {
      "date_filed": "2009-01-06", 
      "description": "Chapter 7 Statement of Current Monthly Income and Means Test Calculation - Form 22A. Filed by Scott R Clar on behalf of Nikole Burke, Sean Burke. (Clar, Scott) (Entered: 01/06/2009)", 
      "document_number": "2", 
      "pacer_doc_id": "066020081821"
    }, 
    {
      "date_filed": "2009-01-06", 
      "description": "Statement of Social Security Number(s) Filed by Scott R Clar on behalf of Nikole Burke, Sean Burke. (Clar, Scott) (Entered: 01/06/2009)", 
      "document_number": "3", 
      "pacer_doc_id": "066020083169"
    }, 
    {
      "date_filed": "2009-01-06", 
      "description": "Receipt of Voluntary Petition (Chapter 7)(09-70027) [misc,volp7a] ( 299.00) Filing Fee. Receipt number 10258123. Fee Amount $ 299.00 (U.S. Treasury) (Entered: 01/06/2009)", 
      "document_number": "4", 
      "pacer_doc_id": null
    }, 
    {
      "date_filed": "2009-01-06", 
      "description": "Meeting of Creditors with 341(a) meeting to be held on 02/06/2009 at 10:30 AM at Stewart Square, 308 West State Street, Rm. 40, Rockford, Illinois 61101. Objections for Discharge due by 04/07/2009. (Clar, Scott) (Entered: 01/06/2009)", 
      "document_number": "5", 
      "pacer_doc_id": null
    }, 
    {
      "date_filed": "2009-01-07", 
      "description": "Request for Chapter 7 341 Meeting of Creditors (Shabez, Cindy) (Entered: 01/07/2009)", 
      "document_number": "6", 
      "pacer_doc_id": "066020649655"
    }, 
    {
      "date_filed": "2009-01-07", 
      "description": "Certificate of Credit Counseling Filed by Scott R Clar on behalf of Sean Burke. (Clar, Scott) (Entered: 01/07/2009)", 
      "document_number": "7", 
      "pacer_doc_id": "066020650150"
    }, 
    {
      "date_filed": "2009-01-07", 
      "description": "Certificate of Credit Counseling Filed by Scott R Clar on behalf of Nikole Burke. (Clar, Scott) (Entered: 01/07/2009)", 
      "document_number": "8", 
      "pacer_doc_id": "066020089815"
    }, 
    {
      "date_filed": "2009-01-07", 
      "description": "BNC Certificate of Service - Meeting of Creditors. (RE: 6 Request for Chapter 7 341 Meeting of Creditors). No. of Notices: 12. Service Date 01/09/2009. (Admin.) (Entered: 01/10/2009)", 
      "document_number": "9", 
      "pacer_doc_id": "066020672293"
    }, 
    {
      "date_filed": "2009-01-14", 
      "description": "Declaration Re: Electronic Filing Filed by Scott R Clar on behalf of Nikole Burke, Sean Burke. (Clar, Scott) (Entered: 01/14/2009)", 
      "document_number": "10", 
      "pacer_doc_id": "066020695071"
    }, 
    {
      "date_filed": "2009-01-23", 
      "description": "Notice of Motion and Motion for Relief from Stay as to 250 S. Blvd. of the Presidents, Sarasota, FL 34236. Fee Amount $150, Filed by Faiq Mihlar on behalf of Regions Bank dba Regions Mortgage. Hearing scheduled for 2/11/2009 at 09:30 AM at Federal Building, 211 South Court Street, Rm. 115, Rockford, Illinois 61101. (Attachments: # 1 Exhibit Loan Documents# 2 Proposed Order # 3 Statement Accompanying Relief From Stay) (Mihlar, Faiq) (Entered: 01/23/2009)", 
      "document_number": "11", 
      "pacer_doc_id": "066020182195"
    }, 
    {
      "date_filed": "2009-01-23", 
      "description": "Receipt of Motion for Relief Stay(09-70027) [motion,mrlfsty] ( 150.00) Filing Fee. Receipt number 10376062. Fee Amount $ 150.00 (U.S. Treasury) (Entered: 01/23/2009)", 
      "document_number": "12", 
      "pacer_doc_id": null
    }, 
    {
      "date_filed": "2009-01-28", 
      "description": "Request for Service of Notices. Ford Motor Credit Company LLC, C/O Steven L. Nelson, P.O. Box 3700, Rock Island, IL 61204-3700 Filed by Steven L Nelson on behalf of Ford Motor Credit Company LLC. (Nelson, Steven) (Entered: 01/28/2009)", 
      "document_number": "13", 
      "pacer_doc_id": "066020210092"
    }, 
    {
      "date_filed": "2009-02-03", 
      "description": "Notice of Required Document(s) for Discharge for Both Debtors (Shabez, Cindy) (Entered: 02/03/2009)", 
      "document_number": "14", 
      "pacer_doc_id": "066020248026"
    }, 
    {
      "date_filed": "2009-02-03", 
      "description": "BNC Certificate of Service - Notice of Required Document(s) for Discharge (RE: 14 Notice of Required Document(s) for Discharge). No. of Notices: 3. Service Date 02/05/2009. (Admin.) (Entered: 02/06/2009)", 
      "document_number": "15", 
      "pacer_doc_id": "066020263537"
    }, 
    {
      "date_filed": "2009-02-11", 
      "description": "Order Granting Motion for Relief from Stay (Related Doc # 11 ). Signed on 2/11/2009. (Shabez, Cindy) (Entered: 02/11/2009)", 
      "document_number": "16", 
      "pacer_doc_id": "066020292577"
    }, 
    {
      "date_filed": "2009-02-11", 
      "description": "Amended Schedules : B and C. Filed by Scott R Clar on behalf of Nikole Burke, Sean Burke. (Clar, Scott) (Entered: 02/11/2009)", 
      "document_number": "17", 
      "pacer_doc_id": "066020851820"
    }, 
    {
      "date_filed": "2009-02-11", 
      "description": "Amended Statement of Financial Affairs Filed by Scott R Clar on behalf of Nikole Burke, Sean Burke. (Clar, Scott) (Entered: 02/11/2009)", 
      "document_number": "18", 
      "pacer_doc_id": "066020290448"
    }, 
    {
      "date_filed": "2009-02-11", 
      "description": "Debtor's Certification of Completion of Instructional Course Concerning Personal Financial Management Filed by Scott R Clar on behalf of Sean Burke. (Clar, Scott) (Entered: 02/11/2009)", 
      "document_number": "19", 
      "pacer_doc_id": "066020293770"
    }, 
    {
      "date_filed": "2009-02-11", 
      "description": "Debtor's Certification of Completion of Instructional Course Concerning Personal Financial Management Filed by Scott R Clar on behalf of Nikole Burke. (Clar, Scott) (Entered: 02/11/2009)", 
      "document_number": "20", 
      "pacer_doc_id": "066020854229"
    }, 
    {
      "date_filed": "2009-02-13", 
      "description": "Reaffirmation Agreement with Ford Motor Credit Company LLC Filed by Steven L Nelson on behalf of Ford Motor Credit Company LLC. (Nelson, Steven) (Entered: 02/13/2009)", 
      "document_number": "21", 
      "pacer_doc_id": "066020871750"
    }, 
    {
      "date_filed": "2009-02-17", 
      "description": "Reviewed - No Presumption of Undue Hardship (RE: 21 Reaffirmation Agreement). (Shabez, Cindy) (Entered: 02/17/2009)", 
      "document_number": "22", 
      "pacer_doc_id": null
    }, 
    {
      "date_filed": "2009-03-11", 
      "description": "Reaffirmation Agreement with Fifth Third Bank Filed by Fifth Third Bank. (Rykert, Carolyn) (Entered: 03/11/2009)", 
      "document_number": "23", 
      "pacer_doc_id": "066021167457"
    }, 
    {
      "date_filed": "2009-03-12", 
      "description": "Reviewed - No Presumption of Undue Hardship (RE: 23 Reaffirmation Agreement). (Shabez, Cindy) (Entered: 03/12/2009)", 
      "document_number": "24", 
      "pacer_doc_id": null
    }, 
    {
      "date_filed": "2009-03-17", 
      "description": "Initial Report of Assets - Trustee has found assets in this estate to be administered for the benefit of creditors, or believes there is a likelihood that such assets will be recovered within a reasonable period of time. The Trustee requests that notice be sent to creditors fixing time for filing claims. (Heeg, Megan) (Entered: 03/17/2009)", 
      "document_number": "25", 
      "pacer_doc_id": null
    }, 
    {
      "date_filed": "2009-03-17", 
      "description": "Request Notice Fixing Time For Filing . Proofs of Claims due by 6/17/2009. Government Proof of Claim due by 6/17/2009. (Shabez, Cindy) (Entered: 03/18/2009)", 
      "document_number": "26", 
      "pacer_doc_id": "066021257674"
    }, 
    {
      "date_filed": "2009-03-18", 
      "description": "BNC Certificate of Service - Notice Fixing Time for Filing Claims (RE: 26 Request Notice Fixing Time For Filing). No. of Notices: 12. Service Date 03/20/2009. (Admin.) (Entered: 03/21/2009)", 
      "document_number": "27", 
      "pacer_doc_id": "066021312829"
    }, 
    {
      "date_filed": "2009-04-08", 
      "description": "Request for Discharge Order for Both Debtors (Shabez, Cindy) (Entered: 04/08/2009)", 
      "document_number": "28", 
      "pacer_doc_id": "066021542321"
    }, 
    {
      "date_filed": "2009-04-08", 
      "description": "BNC Certificate of Service - Order of Discharge. (RE: 28 Request for Discharge Order). No. of Notices: 13. Service Date 04/10/2009. (Admin.) (Entered: 04/11/2009)", 
      "document_number": "30", 
      "pacer_doc_id": "066021585828"
    }, 
    {
      "date_filed": "2009-04-10", 
      "description": "Reaffirmation Agreement with US Bank Home Mortgage Filed by Scott R Clar on behalf of Nikole Burke, Sean Burke. (Clar, Scott) (Entered: 04/10/2009)", 
      "document_number": "29", 
      "pacer_doc_id": "066021574244"
    }, 
    {
      "date_filed": "2009-04-13", 
      "description": "Reviewed - No Presumption of Undue Hardship (RE: 29 Reaffirmation Agreement). (Shabez, Cindy) (Entered: 04/13/2009)", 
      "document_number": "31", 
      "pacer_doc_id": null
    }, 
    {
      "date_filed": "2009-10-06", 
      "description": "Notice of Motion and Application to Employ Megan Heeg and Ehrmann Gehlbach Badger & Lee as Attorneys for Trustee Filed by Megan G Heeg Hearing scheduled for 10/26/2009 at 09:30 AM at Federal Building, 211 South Court Street, Rm. 115, Rockford, Illinois 61101. (Attachments: # 1 Affidavit # 2 Proposed Order) (Heeg, Megan) (Entered: 10/06/2009)", 
      "document_number": "32", 
      "pacer_doc_id": "066023898236"
    }, 
    {
      "date_filed": "2009-10-06", 
      "description": "Notice of Hearing and Objection to Claim(s) 1 Filed by Megan G Heeg on behalf of Megan G Heeg. Hearing scheduled for 11/9/2009 at 09:30 AM at Federal Building, 211 South Court Street, Rm. 115, Rockford, Illinois 61101. (Attachments: # 1 Proposed Order)(Heeg, Megan) (Entered: 10/06/2009)", 
      "document_number": "33", 
      "pacer_doc_id": "066023901188"
    }, 
    {
      "date_filed": "2009-10-26", 
      "description": "Order Granting Application to Employ Megan G Heeg for Megan G Heeg (Related Doc # 32 ). Signed on 10/26/2009. (Shabez, Cindy) (Entered: 10/26/2009)", 
      "document_number": "34", 
      "pacer_doc_id": "066024167298"
    }, 
    {
      "date_filed": "2009-11-09", 
      "description": "Order Disallowing Claim(s) 1 (RE: 33 Objection to Claim). Signed on 11/9/2009 (Shabez, Cindy) (Entered: 11/09/2009)", 
      "document_number": "35", 
      "pacer_doc_id": "066024379637"
    }, 
    {
      "date_filed": "2009-12-03", 
      "description": "Final Report and Account Filed by U.S. Trustee William Neary. (Ryczek, Carole) (Entered: 12/03/2009)", 
      "document_number": "36", 
      "pacer_doc_id": "066024715352"
    }, 
    {
      "date_filed": "2009-12-03", 
      "description": "Notice of Motion and Application for Compensation for Megan G Heeg, Trustee Chapter 7, Fee: $2,335.55, Expenses: $0.00. Filed by Megan G Heeg Hearing scheduled for 12/28/2009 at 09:30 AM at Federal Building, 211 South Court Street, Rm. 115, Rockford, Illinois 61101. (Attachments: # 1 Notice of Hearing# 2 Proposed Order) (Ryczek, Carole) (Entered: 12/03/2009)", 
      "document_number": "37", 
      "pacer_doc_id": "066024715397"
    }, 
    {
      "date_filed": "2009-12-03", 
      "description": "Notice of Motion and Application for Compensation for Megan G Heeg, Trustee's Attorney, Fee: $450.00, Expenses: $106.41. Filed by Megan G Heeg Hearing scheduled for 12/28/2009 at 09:30 AM at Federal Building, 211 South Court Street, Rm. 115, Rockford, Illinois 61101. (Attachments: # 1 Notice of Hearing# 2 Proposed Order) (Ryczek, Carole) (Entered: 12/03/2009)", 
      "document_number": "38", 
      "pacer_doc_id": "066024715433"
    }, 
    {
      "date_filed": "2009-12-03", 
      "description": "The United States Trustee has reviewed the Chapter 7 Trustee's Final Report, Application for Compensation and Compensation of Professionals. Filed by U.S. Trustee William Neary. (Ryczek, Carole) (Entered: 12/03/2009)", 
      "document_number": "39", 
      "pacer_doc_id": null
    }, 
    {
      "date_filed": "2009-12-03", 
      "description": "Notice of Trustee's Final Report and Applications for Compensation Filed by Trustee Megan G Heeg (RE: 36 Final Report and Account - Asset). Hearing scheduled for 12/28/2009 at 09:30 AM at Federal Building, 211 South Court Street, Rm. 115, Rockford, Illinois 61101. (Ryczek, Carole) (Entered: 12/03/2009)", 
      "document_number": "40", 
      "pacer_doc_id": "066024715466"
    }, 
    {
      "date_filed": "2009-12-07", 
      "description": "BNC Certificate of Service - PDF Document. (RE: 40 Notice of Trustee's Final Report and Applications for Compensation). No. of Notices: 17. Service Date 12/09/2009. (Admin.) (Entered: 12/09/2009)", 
      "document_number": "41", 
      "pacer_doc_id": "066024801619"
    }, 
    {
      "date_filed": "2009-12-28", 
      "description": "Order Granting Application For Compensation (Related Doc # 37 ). Megan G Heeg, fees awarded: $2335.55, expenses awarded: $0.00, Granting Application For Compensation (Related Doc # 38 ). Megan G Heeg, fees awarded: $450.00, expenses awarded: $106.41. Signed on 12/28/2009. (Shabez, Cindy) (Entered: 12/28/2009)", 
      "document_number": "42", 
      "pacer_doc_id": "066025027929"
    }, 
    {
      "date_filed": "2010-01-12", 
      "description": "Amended Distribution Report Filed by Trustee Megan G Heeg. (Ryczek, Carole) (Entered: 01/12/2010)", 
      "document_number": "43", 
      "pacer_doc_id": "066025215838"
    }
  ], 
  "docket_number": "09-70027", 
  "jurisdiction": null, 
  "jury_demand": null, 
  "nature_of_suit": null, 
  "parties": [
    {
      "attorneys": [
        {
          "contact": "Crane Heyman Simon Welch & Clar\n135 S Lasalle Suite 3705\nChicago, IL 60603\n312 641-6777\nFax : 312 641-7114\nEmail: sclar@craneheyman.com\n", 
          "name": "Scott R Clar", 
          "roles": []
        }
      ], 
      "extra_info": "1900 Andover Lane\nCrystal Lake, IL 60014\nSSN / ITIN: xxx-xx-4134", 
      "name": "Sean Burke", 
      "type": "Debtor"
    }, 
    {
      "attorneys": [
        {
          "contact": "Crane Heyman Simon Welch & Clar\n135 S Lasalle Suite 3705\nChicago, IL 60603\n312 641-6777\nFax : 312 641-7114\nEmail: sclar@craneheyman.com\n", 
          "name": "Scott R Clar", 
          "roles": []
        }
      ], 
      "extra_info": "1900 Andover Lane\nCrystal Lake, IL 60014\nSSN / ITIN: xxx-xx-5103", 
      "name": "Nikole Burke", 
      "type": "Joint Debtor"
    }, 
    {
      "attorneys": [
        {
          "contact": "Ehrmann Gehlbach Badger & Lee\nPob 447- 215 E First St, Ste 100\nDixon, IL 61021\n815-288-4949\nEmail: heeg@egbbl.com\n", 
          "name": "Megan G Heeg", 
          "roles": []
        }, 
        {
          "contact": "Ehrmann Gehlbach Badger & Lee\nPob 447- 215 E First St, Ste 100\nDixon, IL 61021\n815-288-4949\nEmail: heeg@egbbl.com\n", 
          "name": "Megan G Heeg", 
          "roles": []
        }
      ], 
      "extra_info": "Ehrmann Gehlbach Badger & Lee\nPob 447- 215 E First St, Ste 100\nDixon, IL 61021\n815-288-4949", 
      "name": "Megan G Heeg", 
      "type": "Trustee"
    }, 
    {
      "attorneys": [], 
      "extra_info": "Office of the U.S. Trustee, Region 11\n780 Regent St.\nSuite 304\nMadison, WI 53715\n608-264-5522", 
      "name": "William Neary", 
      "type": "U.S. Trustee"
    }
  ], 
  "referred_to_str": null
}