{
  "assigned_to_str": "Joan N. Feeney", 
  "case_name": "Tanners Cafe, Inc.", 
  "cause": null, 
  "court_id": "mab", 
  "date_converted": null, 
  "date_discharged": null, 
  "date_filed": "2009-07-15", 
  "date_terminated": null, 
  "demand": null, 
  "docket_entries": [
    {
      "date_filed": "2009-07-15", 
      "description": "Chapter 11 Voluntary Petition with Matrix and Corporate Vote. Filed by Tanners Cafe, Inc. rep by, Charles W. McCarthy . (vj, USBC) (Entered: 07/15/2009)", 
      "document_number": "1", 
      "pacer_doc_id": "094011507106"
    }, 
    {
      "date_filed": "2009-07-15", 
      "description": "Order to Update: 20 Largest Unsecured Creditors due 7/30/2009. Atty Disclosure Statement due 7/30/2009. List of Equity Security Holders due 7/30/2009. Schedules A-H due 7/30/2009. Statement of Financial Affairs due 7/30/2009. Balance Sheet Date: 7/30/2009 Statement of Operations Due 7/30/2009 Cash Flow Statement Due 7/30/2009. Small Business Tax Return Date: 7/30/2009. (vj, USBC) (Entered: 07/15/2009)", 
      "document_number": "3", 
      "pacer_doc_id": "094011507613"
    }, 
    {
      "date_filed": "2009-07-15", 
      "description": "Court Certificate of Mailing. RE: 3 Order to Update (vj, USBC) (Entered: 07/15/2009)", 
      "document_number": "4", 
      "pacer_doc_id": "094011507627"
    }, 
    {
      "date_filed": "2009-07-16", 
      "description": "Court's Notice of 341 sent (vj, USBC) (Entered: 07/16/2009)", 
      "document_number": "5", 
      "pacer_doc_id": "094011512954"
    }, 
    {
      "date_filed": "2009-07-17", 
      "description": "Amended Notice of 341 Meeting of Creditors 341(a) meeting to be held on 8/18/2009 at 01:45 PM at Room 1190, US Trustee Office. RE: Meeting of Creditors Chapter 11 (vj, USBC) (Entered: 07/17/2009)", 
      "document_number": "6", 
      "pacer_doc_id": "094011526066"
    }, 
    {
      "date_filed": "2009-07-18", 
      "description": "BNC Certificate of Mailing - Meeting of Creditors. RE: 5 Court's Notice of 341 sent - 11 Corporation Service Date 07/18/2009. (Admin.) (Entered: 07/19/2009)", 
      "document_number": "7", 
      "pacer_doc_id": "094011531608"
    }, 
    {
      "date_filed": "2009-07-19", 
      "description": "BNC Certificate of Mailing. RE: 6 Amended Notice of 341 Meeting of Creditors Service Date 07/19/2009. (Admin.) (Entered: 07/20/2009)", 
      "document_number": "8", 
      "pacer_doc_id": "094011533758"
    }, 
    {
      "date_filed": "2009-07-30", 
      "description": "Motion filed by Debtor Tanners Cafe, Inc. to Extend Time To Comply with Order To Update Re: 3 Order to Update with certificate of service (request to: August 13, 2009) (pkn, USBC) (Entered: 07/31/2009)", 
      "document_number": "9", 
      "pacer_doc_id": "094011620078"
    }, 
    {
      "date_filed": "2009-07-31", 
      "description": "Endorsed Order Dated 7/31/2009 Re: 9 Motion to Extend Time To Comply with Order To Update. (request to: August 13, 2009) MOTION ALLOWED. (pkn, USBC) (Entered: 08/03/2009)", 
      "document_number": "10", 
      "pacer_doc_id": "094011634878"
    }, 
    {
      "date_filed": "2009-08-05", 
      "description": "BNC Certificate of Mailing - PDF Document. RE: 10 Order on Motion to Extend Service Date 08/05/2009. (Admin.) (Entered: 08/06/2009)", 
      "document_number": "11", 
      "pacer_doc_id": "094011654741"
    }, 
    {
      "date_filed": "2009-08-14", 
      "description": "Statement of Financial Affairs filed by Debtor Tanners Cafe, Inc. (pkn, USBC) (Entered: 08/17/2009)", 
      "document_number": "12", 
      "pacer_doc_id": "094011727347"
    }, 
    {
      "date_filed": "2009-08-14", 
      "description": "Disclosure of Compensation of Attorney in the amount of $700.00 filed by Debtor Tanners Cafe, Inc. (pkn, USBC) (Entered: 08/17/2009)", 
      "document_number": "13", 
      "pacer_doc_id": "094011727372"
    }, 
    {
      "date_filed": "2009-08-14", 
      "description": "List of 20 Largest Creditors filed by Debtor Tanners Cafe, Inc. (pkn, USBC) (Entered: 08/17/2009)", 
      "document_number": "14", 
      "pacer_doc_id": "094011727397"
    }, 
    {
      "date_filed": "2009-08-14", 
      "description": "Statistical Summary of Certain Liabilities, Schedules A-H, Summary of Schedules filed by Debtor Tanners Cafe, Inc. (pkn, USBC) (Entered: 08/17/2009)", 
      "document_number": "15", 
      "pacer_doc_id": "094011727430"
    }, 
    {
      "date_filed": "2009-08-14", 
      "description": "Motion filed by Debtor Tanners Cafe, Inc. to Extend Time To Comply with Order to Update Re: 3 Order to Update Dated 7/15/09 with certificate of service (pkn, USBC) (Entered: 08/17/2009)", 
      "document_number": "16", 
      "pacer_doc_id": "094011727534"
    }, 
    {
      "date_filed": "2009-08-18", 
      "description": "Endorsed Order Dated 8/18/09 Re: 16 Motion to Extend Time To Comply with Order To Update. THIS MOTION IS MOOT. THE DEBTOR DID NOT REQUEST EXPEDITED DETERMINATION OF THIS MOTION AND THE REQUESTED DATE FOR THE EXTENSION TO COMPLY WITH THE ORDER TO UPDATE HAS PASSED. (pkn, USBC) (Entered: 08/18/2009)", 
      "document_number": "17", 
      "pacer_doc_id": "094011730744"
    }, 
    {
      "date_filed": "2009-08-20", 
      "description": "BNC Certificate of Mailing - PDF Document. RE: 17 Order on Motion to Extend Service Date 08/20/2009. (Admin.) (Entered: 08/21/2009)", 
      "document_number": "18", 
      "pacer_doc_id": "094011751515"
    }, 
    {
      "date_filed": "2009-08-21", 
      "description": "Debtor-In-Possession Monthly Operating Report for Filing Period July 15, 2009 through and including July 31, 2009. filed by Debtor Tanners Cafe, Inc.. (cpd, USBC) (Entered: 08/24/2009)", 
      "document_number": "19", 
      "pacer_doc_id": "094011770460"
    }, 
    {
      "date_filed": "2009-08-21", 
      "description": "Motion filed by Debtor Tanners Cafe, Inc. To Submit U.S. Trustee's Basic Monthly Operating Report for the Period July 15, 2009 Through and Including July 31, 2009. with certificate of service. (cpd, USBC) (Entered: 08/24/2009)", 
      "document_number": "20", 
      "pacer_doc_id": "094011770541"
    }, 
    {
      "date_filed": "2009-08-25", 
      "description": "Endorsed Order Dated 8/25/09 Re: 20 Debtor's Motion To Submit U.S. Trustees Basic Monthly Operating Report For The Period July 15, 2009 Through and Including July 31, 2009. THE COURT SHALL TAKE NO ACTION ON THIS MOTION AS COURT AUTHORITY IS NOT REQUIRED TO COMPLY WITH THE RECORD KEEPING REQUIREMENTS OF THE U.S. TRUSTEE. SEE GENERALLY 28 U.S.C. SEC 586. (pkn, USBC) (Entered: 08/26/2009)", 
      "document_number": "21", 
      "pacer_doc_id": "094011780346"
    }, 
    {
      "date_filed": "2009-08-28", 
      "description": "BNC Certificate of Mailing - PDF Document. RE: 21 Order on Generic Motion Service Date 08/28/2009. (Admin.) (Entered: 08/29/2009)", 
      "document_number": "22", 
      "pacer_doc_id": "094011803885"
    }, 
    {
      "date_filed": "2009-09-01", 
      "description": "Order of Dismissal Dated September 1, 2009 Re: 3 Order to Update, 10 Order on Motion to Extend. DUE TO THE FAILURE OF THE DEBTOR TO COMPLY WITH THE COURT'S ORDER OF 7/15/2009, 7/31/2009, AND THE DEBTOR HAVING FAILED TO FILE TIMELY THE BALANCE SHEET, CASH FLOW STATEMENT, IT IS HEREBY ORDERED THAT THE ABOVE-ENTITLED CASE BE AND HEREBY IS DISMISSED. (pkn, USBC) (Entered: 09/01/2009)", 
      "document_number": "23", 
      "pacer_doc_id": "094011823849"
    }, 
    {
      "date_filed": "2009-09-01", 
      "description": "Notice of Dismissal For Failure to File Other Documents . (pkn, USBC) (Entered: 09/01/2009)", 
      "document_number": "24", 
      "pacer_doc_id": "094011823880"
    }, 
    {
      "date_filed": "2009-09-03", 
      "description": "Tax Documents for the Year(s) of 2007 filed by Debtor Tanners Cafe, Inc. (Weinberg, Herbert) (Entered: 09/03/2009)", 
      "document_number": "25", 
      "pacer_doc_id": "094011837231"
    }, 
    {
      "date_filed": "2009-09-03", 
      "description": "Motion filed by Debtor Tanners Cafe, Inc. to Reinstate Case with certificate of service (Weinberg, Herbert) (Entered: 09/03/2009)", 
      "document_number": "26", 
      "pacer_doc_id": "094011837254"
    }, 
    {
      "date_filed": "2009-09-03", 
      "description": "Declaration Re: Electronic Filing (Re: 1 Voluntary Petition (Chapter 11)) filed by Debtor Tanners Cafe, Inc. (Weinberg, Herbert) (Entered: 09/03/2009)", 
      "document_number": "27", 
      "pacer_doc_id": "094011837280"
    }, 
    {
      "date_filed": "2009-09-03", 
      "description": "Affidavit of Joseph McCarthy with certificate of service (Re: 23 Order) filed by Debtor Tanners Cafe, Inc. (Weinberg, Herbert) (Entered: 09/03/2009)", 
      "document_number": "28", 
      "pacer_doc_id": "094011837318"
    }, 
    {
      "date_filed": "2009-09-03", 
      "description": "Application filed by Debtor Tanners Cafe, Inc. to Employ Rosenberg & Weinberg as Attorney with Affidavit and with certificate of service. (Weinberg, Herbert) (Entered: 09/03/2009)", 
      "document_number": "29", 
      "pacer_doc_id": "094011837357"
    }, 
    {
      "date_filed": "2009-09-03", 
      "description": "BNC Certificate of Mailing. RE: 24 Notice of Dismissal Service Date 09/03/2009. (Admin.) (Entered: 09/04/2009)", 
      "document_number": "30", 
      "pacer_doc_id": "094011840237"
    }, 
    {
      "date_filed": "2009-09-03", 
      "description": "BNC Certificate of Mailing - PDF Document. RE: 23 Order Service Date 09/03/2009. (Admin.) (Entered: 09/04/2009)", 
      "document_number": "31", 
      "pacer_doc_id": "094011840238"
    }, 
    {
      "date_filed": "2009-09-14", 
      "description": "Endorsed Order Dated 9/14/2009 Re: 26 Debtor's Motion To Reinstate Case. NO OBJECTIONS. MOTION ALLOWED. (pkn, USBC) (Entered: 09/15/2009)", 
      "document_number": "32", 
      "pacer_doc_id": "094011904621"
    }, 
    {
      "date_filed": "2009-09-16", 
      "description": "Motion filed by Debtor Tanners Cafe, Inc. to Sell Liquor License Free and Clear of All Liens, Encumbrances and Interests (Weinberg, Herbert) (Entered: 09/16/2009)", 
      "document_number": "33", 
      "pacer_doc_id": "094011910887"
    }, 
    {
      "date_filed": "2009-09-16", 
      "description": "Motion filed by Debtor Tanners Cafe, Inc. to Set Bar Date (Weinberg, Herbert) (Entered: 09/16/2009)", 
      "document_number": "34", 
      "pacer_doc_id": "094011910895"
    }, 
    {
      "date_filed": "2009-09-16", 
      "description": "Certificate of Service (Re: 34 Motion to Set Bar Date) filed by Debtor Tanners Cafe, Inc. (Weinberg, Herbert) (Entered: 09/16/2009)", 
      "document_number": "35", 
      "pacer_doc_id": "094011911054"
    }, 
    {
      "date_filed": "2009-09-16", 
      "description": "Certificate of Service (Re: 33 Motion to Sell) filed by Debtor Tanners Cafe, Inc. (Weinberg, Herbert) (Entered: 09/16/2009)", 
      "document_number": "36", 
      "pacer_doc_id": "094011911064"
    }, 
    {
      "date_filed": "2009-09-16", 
      "description": "Order And Notice Fixing Deadline For Filing Proofs of Claim Dated 9/16/2009 Re: 34 Motion by Debtor Tanners Cafe, Inc. To Set Bar Date. Proofs of Claims due by 10/19/2009. Government proof of claim due by 3/15/2010. (pkn, USBC) (Entered: 09/17/2009)", 
      "document_number": "37", 
      "pacer_doc_id": "094011919440"
    }, 
    {
      "date_filed": "2009-09-17", 
      "description": "Hearing scheduled for 10/13/2009 at 10:45 AM Boston Courtroom 1 - JNF, Objections due by 10/9/2009 at 04:30 PM. RE: 33 Motion filed by Debtor Tanners Cafe, Inc. to Sell Liquor License Free and Clear of All Liens, Encumbrances and Interests. (mnd) (Entered: 09/17/2009)", 
      "document_number": "38", 
      "pacer_doc_id": "094011921303"
    }, 
    {
      "date_filed": "2009-09-17", 
      "description": "Notice of Intent to Sell Liquor License. Hearing Scheduled for 10/13/2009 at 10:45 AM with Objections due by 10/9/2009 by 04:30 PM. Thomas P. O'Neill Federal Building, 10 Causeway Street, 11th Floor, Courtroom 1 - JNF Boston, Ma. RE: 33 Motion to Sell Liquor License filed by Debtor Tanners Cafe, Inc. (pkn, USBC) (Entered: 09/17/2009)", 
      "document_number": "39", 
      "pacer_doc_id": "094011922798"
    }, 
    {
      "date_filed": "2009-09-17", 
      "description": "Certificate of Service of Notice of Hearing (Re: 33 Motion to Sell) filed by Debtor Tanners Cafe, Inc. (Weinberg, Herbert) (Entered: 09/17/2009)", 
      "document_number": "40", 
      "pacer_doc_id": "094011922822"
    }, 
    {
      "date_filed": "2009-09-17", 
      "description": "Certificate of Service (Re: 37 Order on Motion To Set Bar Date) filed by Debtor Tanners Cafe, Inc. (Weinberg, Herbert) (Entered: 09/17/2009)", 
      "document_number": "41", 
      "pacer_doc_id": "094011922960"
    }, 
    {
      "date_filed": "2009-09-17", 
      "description": "Motion filed by Creditor Mary Ann Voisine for Abstention Under Section 305 with certificate of service (D'Angio, Carl) (Entered: 09/17/2009)", 
      "document_number": "42", 
      "pacer_doc_id": "094011923733"
    }, 
    {
      "date_filed": "2009-09-17", 
      "description": "BNC Certificate of Mailing - PDF Document. RE: 32 Order on Motion to Reinstate Case Service Date 09/17/2009. (Admin.) (Entered: 09/18/2009)", 
      "document_number": "43", 
      "pacer_doc_id": "094011924325"
    }, 
    {
      "date_filed": "2009-09-19", 
      "description": "BNC Certificate of Mailing - Hearing. RE: 38 Hearing Scheduled Service Date 09/19/2009. (Admin.) (Entered: 09/20/2009)", 
      "document_number": "44", 
      "pacer_doc_id": "094011934818"
    }, 
    {
      "date_filed": "2009-09-19", 
      "description": "BNC Certificate of Mailing - PDF Document. RE: 37 Order on Motion To Set Bar Date Service Date 09/19/2009. (Admin.) (Entered: 09/20/2009)", 
      "document_number": "45", 
      "pacer_doc_id": "094011934819"
    }, 
    {
      "date_filed": "2009-09-19", 
      "description": "BNC Certificate of Mailing - PDF Document. RE: 39 No action taken on Notice of Intent to Sell Service Date 09/19/2009. (Admin.) (Entered: 09/20/2009)", 
      "document_number": "46", 
      "pacer_doc_id": "094011934820"
    }, 
    {
      "date_filed": "2009-09-24", 
      "description": "Opposition with certificate of service filed by Debtor Tanners Cafe, Inc. Re: 42 Motion filed by Creditor Mary Ann Voisine for Abstention Under Section 305 with certificate of service (Weinberg, Herbert) (Entered: 09/24/2009)", 
      "document_number": "47", 
      "pacer_doc_id": "094011965450"
    }, 
    {
      "date_filed": "2009-09-28", 
      "description": "Hearing scheduled for 10/13/2009 at 10:45 AM Boston Courtroom 1 - JNF, Objections due by 10/8/2009 at 04:00 PM. RE: 42 Motion filed by Creditor Mary Ann Voisine for Abstention Under Section 305. (mnd) (Entered: 09/28/2009)", 
      "document_number": "48", 
      "pacer_doc_id": "094011987606"
    }, 
    {
      "date_filed": "2009-09-28", 
      "description": "Hearing scheduled for 10/13/2009 at 10:45 AM Boston Courtroom 1 - JNF RE: 29 Application filed by Debtor Tanners Cafe, Inc. to Employ Rosenberg & Weinberg as Attorney with Affidavit. (mnd) (Entered: 09/28/2009)", 
      "document_number": "49", 
      "pacer_doc_id": "094011987620"
    }, 
    {
      "date_filed": "2009-09-29", 
      "description": "Certificate of Service of Notice of Hearing Nonevidentiary (Re: 42 Motion by Mary Ann Voisine for Abstention Under Section 305) filed by Debtor Tanners Cafe, Inc. (Weinberg, Herbert)CORRECTIVE ENTRY: #42 Modified To Reflect Correct Caption of Pleading. Modified on 9/29/2009 (pkn, USBC). (Entered: 09/29/2009)", 
      "document_number": "50", 
      "pacer_doc_id": "094011994899"
    }, 
    {
      "date_filed": "2009-09-29", 
      "description": "Certificate of Service of Notice of Hearing Nonevidentiary (Re: 29 Application to Employ) filed by Debtor Tanners Cafe, Inc. (Weinberg, Herbert) (Entered: 09/29/2009)", 
      "document_number": "51", 
      "pacer_doc_id": "094011994950"
    }, 
    {
      "date_filed": "2009-09-30", 
      "description": "BNC Certificate of Mailing - Hearing. RE: 48 Hearing Scheduled Service Date 09/30/2009. (Admin.) (Entered: 10/01/2009)", 
      "document_number": "52", 
      "pacer_doc_id": "094012009143"
    }, 
    {
      "date_filed": "2009-09-30", 
      "description": "BNC Certificate of Mailing - Hearing. RE: 49 Hearing Scheduled Service Date 09/30/2009. (Admin.) (Entered: 10/01/2009)", 
      "document_number": "53", 
      "pacer_doc_id": "094012009144"
    }, 
    {
      "date_filed": "2009-09-30", 
      "description": "Notice of Appearance and Request for Notice by Thomas J. Barrett with certificate of service filed by Interested Party Charles Muollo (pkn, USBC) (Entered: 10/01/2009)", 
      "document_number": "54", 
      "pacer_doc_id": "094012016386"
    }, 
    {
      "date_filed": "2009-10-07", 
      "description": "Objection with certificate of service filed by Assistant U.S. Trustee John Fitzgerald Re: 29 Application filed by Debtor Tanners Cafe, Inc. to Employ Rosenberg & Weinberg as Attorney with Affidavit and with certificate of service. (Bachtell, Paula) (Entered: 10/07/2009)", 
      "document_number": "55", 
      "pacer_doc_id": "094012053666"
    }, 
    {
      "date_filed": "2009-10-07", 
      "description": "Amended 29 Application filed by Debtor Tanners Cafe, Inc. For Order Authorizing Debtor to Employ Rosenberg & Weinberg as Attorney with Affidavit and with certificate of service. (Weinberg, Herbert) CORRECTIVE ENTRY: Text Modified To Add Linkage #29. Modified on 10/7/2009 (pkn, USBC). (Entered: 10/07/2009)", 
      "document_number": "56", 
      "pacer_doc_id": "094012054080"
    }, 
    {
      "date_filed": "2009-10-13", 
      "description": "Order Dated 10/13/2009 Re: 42 Motion by Mary Ann Voisine for Abstention Under Section 305. THE PARTIES REPORTED THE MATTER SETTLED AND WILL FILE A STIPULATION IN TWO WEEKS. (pkn, USBC) (Entered: 10/14/2009)", 
      "document_number": "57", 
      "pacer_doc_id": "094012094839"
    }, 
    {
      "date_filed": "2009-10-13", 
      "description": "Order Dated 10/13/2009 Re: 33 Motion by Debtor To Sell Liquor License Free and Clear of All Liens, Encumbrances and Interests. #33 GRANTED. (pkn, USBC) (Entered: 10/14/2009)", 
      "document_number": "58", 
      "pacer_doc_id": "094012094889"
    }, 
    {
      "date_filed": "2009-10-13", 
      "description": "Order Dated 10/13/2009 Re: 29 Application to Employ Rosenberg & Weinberg as Attorney for Debtor Tanners Cafe, Inc. 56 Amended Application to Employ Rosenberg & Weinberg as Attoreny for Debtor Tanners Cafe, Inc. THE #56 AMENDED APPLICATION IS ALLOWED SUBJECT TO PRIOR COURT APPROVAL OF ANY FEE APPLICATIONS THAT SHALL COMPLY WITH 11 U.S.C. SECTION 330, FED. R. BANKR. P. 2019 and MLBR. 2016. (pkn, USBC) (Entered: 10/14/2009)", 
      "document_number": "59", 
      "pacer_doc_id": "094012096424"
    }, 
    {
      "date_filed": "2009-10-16", 
      "description": "BNC Certificate of Mailing - PDF Document. RE: 57 Order on Motion for Abstention Under Section 305 Service Date 10/16/2009. (Admin.) (Entered: 10/17/2009)", 
      "document_number": "60", 
      "pacer_doc_id": "094012114750"
    }, 
    {
      "date_filed": "2009-10-16", 
      "description": "BNC Certificate of Mailing - PDF Document. RE: 58 Order on Motion To Sell Service Date 10/16/2009. (Admin.) (Entered: 10/17/2009)", 
      "document_number": "61", 
      "pacer_doc_id": "094012114751"
    }, 
    {
      "date_filed": "2009-10-16", 
      "description": "BNC Certificate of Mailing - PDF Document. RE: 59 Order Service Date 10/16/2009. (Admin.) (Entered: 10/17/2009)", 
      "document_number": "62", 
      "pacer_doc_id": "094012114752"
    }, 
    {
      "date_filed": "2009-12-23", 
      "description": "Adversary case 09-01397. Complaint by Tanner's Cafe, Inc. against City of Peabody, Alcohol Beverage Control Commission. Fee Amount of $250 is Deferred. Receipt Number Deferred. Nature of Suit(72 (Injunctive relief - other))(Weinberg, Herbert) (Entered: 12/23/2009)", 
      "document_number": "63", 
      "pacer_doc_id": "094012571498"
    }, 
    {
      "date_filed": "2009-12-28", 
      "description": "Stipulation By Debtor Tanners Cafe, Inc. and Mary Ann Voisine (Re: 42 Motion For Abstention Under Section 305 For The Matter To Be Heard In State Court filed by Debtor Tanners Cafe, Inc. (Weinberg, Herbert) CORRECTIVE ENTRY: Text Modified To Reflect Caption of #42. Modified on 12/29/2009 (pkn, USBC). (Entered: 12/28/2009)", 
      "document_number": "64", 
      "pacer_doc_id": "094012588675"
    }, 
    {
      "date_filed": "2009-12-28", 
      "description": "Motion filed by Debtor Tanners Cafe, Inc. to Approve (Re: 64 Stipulation) (Weinberg, Herbert) (Entered: 12/28/2009)", 
      "document_number": "65", 
      "pacer_doc_id": "094012588725"
    }, 
    {
      "date_filed": "2009-12-28", 
      "description": "Certificate of Service (Re: 64 Stipulation, 65 Motion to Approve) filed by Debtor Tanners Cafe, Inc. (Weinberg, Herbert) (Entered: 12/28/2009)", 
      "document_number": "66", 
      "pacer_doc_id": "094012588771"
    }, 
    {
      "date_filed": "2009-12-29", 
      "description": "Motion filed by Assistant U.S. Trustee John Fitzgerald to Convert Case to Chapter 7 with certificate of service. Fee Amount $15 (Bachtell, Paula) (Entered: 12/29/2009)", 
      "document_number": "67", 
      "pacer_doc_id": "094012590602"
    }, 
    {
      "date_filed": "2009-12-29", 
      "description": "Order Dated 12/29/09 Re: 67 Motion filed by Assistant U.S. Trustee John Fitzgerald to Convert Case to Chapter 7 with certificate of service. #67 IN LIGHT OF THE ALLEGATIONS MADE IN THE MOTION REGARDING THE LACK OF INSURANCE, THE COURT SHORTENS THE TIME FOR A HEARING ON THE MOTION, AND WILL CONDUCT A HEARING ON THE MOTION ON 12/30/09 AT 10:00 AM. (pkn, USBC) (Entered: 12/29/2009)", 
      "document_number": "68", 
      "pacer_doc_id": "094012594075"
    }, 
    {
      "date_filed": "2009-12-29", 
      "description": "Hearing scheduled for 12/30/2009 at 10:00 AM Boston Courtroom 1, 12th Floor, 5 Post Office Square, Boston, MA 02109 RE: 65 Motion by Debtor to Approve 64 Stipulation By Debtor Tanners Cafe, Inc. and Mary Ann Voisine Re: 42 Motion For Abstention Under Section 305 For The Matter To Be Heard In State Court filed by Debtor Tanners Cafe, Inc. (mnd) (Entered: 12/29/2009)", 
      "document_number": "69", 
      "pacer_doc_id": "094012594274"
    }, 
    {
      "date_filed": "2009-12-29", 
      "description": "Hearing scheduled for 12/30/2009 at 10:00 AM Boston Courtroom 1, 12th Floor, 5 Post Office Square, Boston, MA 02109 RE: 67 Motion to Convert Case to Chapter 7 filed by Assistant U.S. Trustee John Fitzgerald. (mnd) (Entered: 12/29/2009)", 
      "document_number": "70", 
      "pacer_doc_id": "094012594333"
    }, 
    {
      "date_filed": "2009-12-29", 
      "description": "Notice of Hearing scheduled for 12/30/2009 at 10:00 AM Boston Courtroom 1, 12th Floor, 5 Post Office Square, Boston, MA 02109 (RE: 67 Motion to Convert Case to Chapter 7) filed by Assistant U.S. Trustee John Fitzgerald (Bachtell, Paula) (Entered: 12/29/2009)", 
      "document_number": "71", 
      "pacer_doc_id": "094012594696"
    }, 
    {
      "date_filed": "2009-12-30", 
      "description": "Order Dated 12/30/2009 Re: 67 Motion filed by Assistant U.S. Trustee John Fitzgerald to Convert Case to Chapter 7. AT THE REQUEST OF THE U.S. TRUSTEE THE MATTER IS CONTINUED GENERALLY. (cpd, USBC) (Entered: 12/30/2009)", 
      "document_number": "72", 
      "pacer_doc_id": "094012598861"
    }, 
    {
      "date_filed": "2009-12-30", 
      "description": "Order Dated 12/30/2009 Re: 65 Motion filed by Debtor Tanners Cafe, Inc. to Approve 64 Stipulation. THE COURT APPROVED THE STIPULATION AS CLARIFIED IN OPEN COURT. (cpd, USBC) (Entered: 12/30/2009)", 
      "document_number": "73", 
      "pacer_doc_id": "094012599135"
    }, 
    {
      "date_filed": "2009-12-31", 
      "description": "BNC Certificate of Mailing - Hearing. RE: 69 Hearing Scheduled Service Date 12/31/2009. (Admin.) (Entered: 01/01/2010)", 
      "document_number": "74", 
      "pacer_doc_id": "094012613378"
    }, 
    {
      "date_filed": "2009-12-31", 
      "description": "BNC Certificate of Mailing - Hearing. RE: 70 Hearing Scheduled Service Date 12/31/2009. (Admin.) (Entered: 01/01/2010)", 
      "document_number": "75", 
      "pacer_doc_id": "094012613379"
    }, 
    {
      "date_filed": "2009-12-31", 
      "description": "BNC Certificate of Mailing - PDF Document. RE: 68 Order on Motion to Convert Case to Chapter 7 Service Date 12/31/2009. (Admin.) (Entered: 01/01/2010)", 
      "document_number": "76", 
      "pacer_doc_id": "094012613380"
    }, 
    {
      "date_filed": "2010-01-01", 
      "description": "BNC Certificate of Mailing - PDF Document. RE: 72 Order on Motion to Convert Case to Chapter 7 Service Date 01/01/2010. (Admin.) (Entered: 01/02/2010)", 
      "document_number": "77", 
      "pacer_doc_id": "094012616069"
    }, 
    {
      "date_filed": "2010-01-01", 
      "description": "BNC Certificate of Mailing - PDF Document. RE: 73 Order on Motion for Approval Service Date 01/01/2010. (Admin.) (Entered: 01/02/2010)", 
      "document_number": "78", 
      "pacer_doc_id": "094012616070"
    }, 
    {
      "date_filed": "2010-01-07", 
      "description": "Interim Application for Compensation with certificate of service for Herbert Weinberg, Debtor's Attorney, Period: 8/26/2009 to 12/29/2009, Fee: $13,738.50, Expenses: $24.96. (Weinberg, Herbert) (Entered: 01/07/2010)", 
      "document_number": "79", 
      "pacer_doc_id": "094012646545"
    }, 
    {
      "date_filed": "2010-01-13", 
      "description": "Notice of Objection Deadline Set. Objections due by 2/10/2010 at 04:30 PM. RE: 79 Interim Application for Compensation of Herbert Weinberg, Counsel to Debtor Tanners Cafe, Inc. Period 8/26/09 to 12/29/09 Fee $13,738.50, Expenses $24.96. (pkn, USBC) (Entered: 01/13/2010)", 
      "document_number": "80", 
      "pacer_doc_id": "094012688151"
    }, 
    {
      "date_filed": "2010-01-13", 
      "description": "Certificate of Service of Notice of Objection Deadline (Re: 79 Application for Compensation) filed by Debtor Tanners Cafe, Inc. (Weinberg, Herbert) (Entered: 01/13/2010)", 
      "document_number": "81", 
      "pacer_doc_id": "094012688735"
    }, 
    {
      "date_filed": "2010-02-11", 
      "description": "Order Dated 2/11/2010 Re: 79 Interim Application For Compensation for Herbert Weinberg, Debtor's Attorney, Period: 8/26/2009 to 12/29/2009, Fees awarded: $13,738.50, Expenses awarded: $24.96; GRANTED. THERE BEING PROPER NOTICE AND NO OBJECTIONS, THE COURT APPROVES THE INTERIM APPLICATION AND ALLOWS COMPENSATION FOR SERVICES AND EXPENSES AS REQUESTED ON AN INTERIM BASIS. (pkn, USBC) (Entered: 02/12/2010)", 
      "document_number": "82", 
      "pacer_doc_id": "094012893698"
    }, 
    {
      "date_filed": "2010-02-14", 
      "description": "BNC Certificate of Mailing - PDF Document. RE: 82 Order on Application for Compensation Service Date 02/14/2010. (Admin.) (Entered: 02/15/2010)", 
      "document_number": "83", 
      "pacer_doc_id": "094012903734"
    }
  ], 
  "docket_number": "09-16656", 
  "jurisdiction": null, 
  "jury_demand": null, 
  "nature_of_suit": null, 
  "parties": [
    {
      "attorneys": [
        {
          "contact": "J.P. Legrand & Associates\n375 Broadway\nSomerville, MA 02145\n617 636 3001\n", 
          "name": "Charles W. McCarthy, Jr.", 
          "roles": []
        }, 
        {
          "contact": "Rosenberg & Weinberg,\n805 Turnpike St., Suite. 201\nNorth Andover, MA 01845\n(978) 683-2479\nFax : 978-682-3041\nEmail: hweinberg@jrhwlaw.com\n", 
          "name": "Herbert Weinberg", 
          "roles": []
        }
      ], 
      "extra_info": "53 Town Farm Rd.\nIpswich, MA 01938\nTax ID / EIN: 80-0120671", 
      "name": "Tanners Cafe, Inc.", 
      "type": "Debtor"
    }, 
    {
      "attorneys": [
        {
          "contact": "Department of Justice\n10 Causeway St.\nRoom 1184\nBoston, MA 02222\n(617) 788-0406\nEmail: paula.bachtell@usdoj.gov\n", 
          "name": "Paula R.C. Bachtell", 
          "roles": []
        }
      ], 
      "extra_info": "Office of the US Trustee\nJ.W. McCormack Post Office & Courthouse\n5 Post Office Sq., 10th Fl, Suite 1000\nBoston, MA 02109", 
      "name": "John Fitzgerald", 
      "type": "Assistant U.S. Trustee"
    }
  ], 
  "referred_to_str": null
}