{
  "assigned_to_str": "Edward Ellington", 
  "case_name": "Wyatt & McAlister PLLC", 
  "cause": null, 
  "court_id": "mssb", 
  "date_converted": null, 
  "date_discharged": null, 
  "date_filed": "2009-12-10", 
  "date_terminated": null, 
  "demand": null, 
  "docket_entries": [
    {
      "date_filed": "2010-02-10", 
      "description": "BNC Certificate of Mailing - PDF Document. (RE: related document(s) 51 Notice of Deficiency) Service Date 02/10/2010. (Admin.) (Entered: 02/11/2010)", 
      "document_number": "52", 
      "pacer_doc_id": "show_doc.pl"
    }, 
    {
      "date_filed": "2010-02-08", 
      "description": "Notice of Deficiency (RE: related document(s) 47 Objection to Claim filed by Debtor Wyatt & McAlister PLLC, 48 21 Day Notice filed by Debtor Wyatt & McAlister PLLC, 49 Objection to Claim filed by Debtor Wyatt & McAlister PLLC, 50 21 Day Notice filed by Debtor Wyatt & McAlister PLLC) Compliance due date: 2/22/2010. (Thompson, Jennifer) (Entered: 02/08/2010)", 
      "document_number": "51", 
      "pacer_doc_id": "show_doc.pl"
    }, 
    {
      "date_filed": "2010-02-03", 
      "description": "Notice: Allowing 21 Days to File Written Objection/Response . Filed by Debtor Wyatt & McAlister PLLC (RE: related document(s) 49 Objection to Claim Number 2 by Claimant Mississippi State Tax Commission. Filed by Debtor Wyatt & McAlister PLLC.). Objections due by 2/24/2010. (Leonard, Vann) (Entered: 02/03/2010)", 
      "document_number": "50", 
      "pacer_doc_id": "show_doc.pl"
    }, 
    {
      "date_filed": "2010-02-03", 
      "description": "Objection to Claim Number 2 by Claimant Mississippi State Tax Commission. Filed by Debtor Wyatt & McAlister PLLC. (Leonard, Vann) (Entered: 02/03/2010)", 
      "document_number": "49", 
      "pacer_doc_id": "show_doc.pl"
    }, 
    {
      "date_filed": "2010-02-03", 
      "description": "Notice: Allowing 21 Days to File Written Objection/Response . Filed by Debtor Wyatt & McAlister PLLC (RE: related document(s) 47 Objection to Claim Number 1 by Claimant Mississippi State Tax Commission. Filed by Debtor Wyatt & McAlister PLLC.). Objections due by 2/24/2010. (Leonard, Vann) (Entered: 02/03/2010)", 
      "document_number": "48", 
      "pacer_doc_id": "show_doc.pl"
    }, 
    {
      "date_filed": "2010-02-03", 
      "description": "Objection to Claim Number 1 by Claimant Mississippi State Tax Commission. Filed by Debtor Wyatt & McAlister PLLC. (Leonard, Vann) (Entered: 02/03/2010)", 
      "document_number": "47", 
      "pacer_doc_id": "show_doc.pl"
    }, 
    {
      "date_filed": "2010-02-02", 
      "description": "Order Resetting Hearing for 02-16-10 at 2:30 P.M. (RE: related document(s) 6 Motion to Dismiss Debtor filed by Partner Mary E. McAllister, 8 Response filed by Debtor Wyatt & McAlister PLLC) cc: SSmith, EShaffer, VLeonard, LAallison (Greer, Rita) (Entered: 02/02/2010)", 
      "document_number": "46", 
      "pacer_doc_id": "show_doc.pl"
    }, 
    {
      "date_filed": "2010-01-27", 
      "description": "BNC Certificate of Mailing-Notice of Assets (RE: related document(s) 42 Notice To File Claims) Service Date 01/27/2010. (Admin.) (Entered: 01/28/2010)", 
      "document_number": "44", 
      "pacer_doc_id": "show_doc.pl"
    }, 
    {
      "date_filed": "2010-01-27", 
      "description": "Objection to (related document(s): 6 Emergency Motion to Dismiss Debtor Wyatt & McAlister, PLLC's Chapter 7 Voluntary Petition filed by Partner Mary E. McAllister) Filed by Interested Party Derek A. Wyatt (Simmons, Michael) (Entered: 01/27/2010)", 
      "document_number": "43", 
      "pacer_doc_id": "show_doc.pl"
    }, 
    {
      "date_filed": "2010-01-25", 
      "description": "Notice To Creditors To File Claims Proofs of Claims due by 4/28/2010. (Thompson, Jennifer) (Entered: 01/25/2010)", 
      "document_number": "42", 
      "pacer_doc_id": "show_doc.pl"
    }, 
    {
      "date_filed": "2010-01-23", 
      "description": "Trustee's Notice of Assets & Request for Notice to Creditors Filed by Trustee Stephen Smith. (Smith, Stephen) (Entered: 01/23/2010)", 
      "document_number": "41", 
      "pacer_doc_id": "show_doc.pl"
    }, 
    {
      "date_filed": "2010-01-23", 
      "description": "Meeting of Creditors Held Filed by Trustee Stephen Smith. (Smith, Stephen) (Entered: 01/23/2010)", 
      "document_number": "40", 
      "pacer_doc_id": "show_doc.pl"
    }, 
    {
      "date_filed": "2010-01-22", 
      "description": "BNC Certificate of Mailing - Deficiency Notice (RE: related document(s) 38 Notice of Deficiency) Service Date 01/22/2010. (Admin.) (Entered: 01/23/2010)", 
      "document_number": "39", 
      "pacer_doc_id": "show_doc.pl"
    }, 
    {
      "date_filed": "2010-01-20", 
      "description": "Notice of Deficiency (RE: related document(s) 26 Document filed by Debtor Wyatt & McAlister PLLC, 27 Schedule A - Real Property filed by Debtor Wyatt & McAlister PLLC, 28 Schedule B - Personal Property filed by Debtor Wyatt & McAlister PLLC, 29 Schedule D - Creditors Holding Secured Claims filed by Debtor Wyatt & McAlister PLLC, 30 Schedule E - Creditors Holding Unsecured Priority Claims filed by Debtor Wyatt & McAlister PLLC, 31 Schedule F filed by Debtor Wyatt & McAlister PLLC, 32 Schedule H filed by Debtor Wyatt & McAlister PLLC, 33 Statement of Financial Affairs filed by Debtor Wyatt & McAlister PLLC, 34 Statement of Corporate Ownership filed by Debtor Wyatt & McAlister PLLC, 35 Summary of Schedules filed by Debtor Wyatt & McAlister PLLC, 36 Disclosure of Compensation of Attorney for Debtor filed by Debtor Wyatt & McAlister PLLC) Compliance due date: 2/3/2010. (Thompson, Jennifer) (Entered: 01/20/2010)", 
      "document_number": "38", 
      "pacer_doc_id": "show_doc.pl"
    }, 
    {
      "date_filed": "2010-01-13", 
      "description": "Document Filed by Debtor Wyatt & McAlister PLLC (RE: related document(s) 27 Schedule A - Real Property, 28 Schedule B - Personal Property, 29 Schedule D - Creditors Holding Secured Claims, 30 Schedule E - Creditors Holding Unsecured Priority Claims, 31 Schedule F, 32 Schedule H). (Leonard, Vann) (Entered: 01/13/2010)", 
      "document_number": "37", 
      "pacer_doc_id": "show_doc.pl"
    }, 
    {
      "date_filed": "2010-01-13", 
      "description": "Disclosure of Compensation of Attorney for Debtor Filed by Debtor Wyatt & McAlister PLLC (RE: related document(s) 1 Voluntary Petition (Chapter 7)). (Leonard, Vann) (Entered: 01/13/2010)", 
      "document_number": "36", 
      "pacer_doc_id": "show_doc.pl"
    }, 
    {
      "date_filed": "2010-01-13", 
      "description": "Summary of Schedules Filed by Debtor Wyatt & McAlister PLLC. (Leonard, Vann) (Entered: 01/13/2010)", 
      "document_number": "35", 
      "pacer_doc_id": "show_doc.pl"
    }, 
    {
      "date_filed": "2010-01-13", 
      "description": "Statement of Corporate Ownership filed. Filed by Debtor Wyatt & McAlister PLLC. (Leonard, Vann) (Entered: 01/13/2010)", 
      "document_number": "34", 
      "pacer_doc_id": "show_doc.pl"
    }, 
    {
      "date_filed": "2010-01-13", 
      "description": "Statement of Financial Affairs Filed by Debtor Wyatt & McAlister PLLC (RE: related document(s) 1 Voluntary Petition (Chapter 7)). (Leonard, Vann) (Entered: 01/13/2010)", 
      "document_number": "33", 
      "pacer_doc_id": "show_doc.pl"
    }, 
    {
      "date_filed": "2010-01-13", 
      "description": "Schedule H Filed by Debtor Wyatt & McAlister PLLC. (Leonard, Vann) (Entered: 01/13/2010)", 
      "document_number": "32", 
      "pacer_doc_id": "show_doc.pl"
    }, 
    {
      "date_filed": "2010-01-13", 
      "description": "Schedule F Filed by Debtor Wyatt & McAlister PLLC. (Leonard, Vann) (Entered: 01/13/2010)", 
      "document_number": "31", 
      "pacer_doc_id": "show_doc.pl"
    }, 
    {
      "date_filed": "2010-01-13", 
      "description": "Schedule E Filed by Debtor Wyatt & McAlister PLLC. (Leonard, Vann) (Entered: 01/13/2010)", 
      "document_number": "30", 
      "pacer_doc_id": "show_doc.pl"
    }, 
    {
      "date_filed": "2010-01-13", 
      "description": "Schedule D Filed by Debtor Wyatt & McAlister PLLC. (Leonard, Vann) (Entered: 01/13/2010)", 
      "document_number": "29", 
      "pacer_doc_id": "show_doc.pl"
    }, 
    {
      "date_filed": "2010-01-13", 
      "description": "Schedule B Filed by Debtor Wyatt & McAlister PLLC. (Leonard, Vann) (Entered: 01/13/2010)", 
      "document_number": "28", 
      "pacer_doc_id": "show_doc.pl"
    }, 
    {
      "date_filed": "2010-01-13", 
      "description": "Schedule A Filed by Debtor Wyatt & McAlister PLLC. (Leonard, Vann) (Entered: 01/13/2010)", 
      "document_number": "27", 
      "pacer_doc_id": "show_doc.pl"
    }, 
    {
      "date_filed": "2010-01-13", 
      "description": "Document Verification of Matrix Filed by Debtor Wyatt & McAlister PLLC (RE: related document(s) 25 Schedules/Statements). (Leonard, Vann) (Entered: 01/13/2010)", 
      "document_number": "26", 
      "pacer_doc_id": "show_doc.pl"
    }, 
    {
      "date_filed": "2010-01-12", 
      "description": "DOCKET ERROR-- Schedules/Statements Filed by Debtor Wyatt & McAlister PLLC (RE: related document(s) 1 Voluntary Petition (Chapter 7)). (Leonard, Vann) Modified on 1/13/2010 incorrect event (Nix, Kathy). (Entered: 01/12/2010)", 
      "document_number": "25", 
      "pacer_doc_id": "show_doc.pl"
    }, 
    {
      "date_filed": "2010-01-09", 
      "description": "BNC Certificate of Mailing - Hearing. (RE: related document(s) 22 Hearing Set) Service Date 01/09/2010. (Admin.) (Entered: 01/09/2010)", 
      "document_number": "24", 
      "pacer_doc_id": "show_doc.pl"
    }, 
    {
      "date_filed": "2010-01-07", 
      "description": "Notice: Allowing 21 Days to File Written Objection/Response to Emergency Motion to Dismiss Chapter 7 Voluntary Petition. Filed by Partner Mary E. McAllister (RE: related document(s) 6 Emergency Motion to Dismiss Debtor Wyatt & McAlister, PLLC's Chapter 7 Voluntary Petition Filed by Partner Mary E. McAllister). Objections due by 1/28/2010. (Attachments: # 1 Exhibit 1 - Motion to Dismiss) (Allison, Lawrence) (Entered: 01/07/2010)", 
      "document_number": "23", 
      "pacer_doc_id": "show_doc.pl"
    }, 
    {
      "date_filed": "2010-01-07", 
      "description": "Hearing Set (RE: related document(s) 6 Motion to Dismiss Debtor filed by Partner Mary E. McAllister, 8 Response filed by Debtor Wyatt & McAlister PLLC) Hearing to be held on 2/2/2010 at 01:30 PM Courtroom - Jackson, (Thompson, Jennifer) (Entered: 01/07/2010)", 
      "document_number": "22", 
      "pacer_doc_id": "show_doc.pl"
    }, 
    {
      "date_filed": "2010-01-06", 
      "description": "DOCKET ERROR - Incorrect Event Used (see correction dkt#23) Notice of Motion to Dismiss Filed by Partner Mary E. McAllister (RE: related document(s) 6 Emergency Motion to Dismiss Debtor Wyatt & McAlister, PLLC's Chapter 7 Voluntary Petition Filed by Partner Mary E. McAllister). (Attachments: # 1 Exhibit 1 - Emergency Motion to Dismiss) (Allison, Lawrence) Modified on 1/7/2010 (Thompson, Jennifer). (Entered: 01/06/2010)", 
      "document_number": "21", 
      "pacer_doc_id": "show_doc.pl"
    }, 
    {
      "date_filed": "2009-12-31", 
      "description": "BNC Certificate of Mailing - PDF Document. (RE: related document(s) 19 Order on Motion to Extend Deadline to File Schedules) Service Date 12/31/2009. (Admin.) (Entered: 01/01/2010)", 
      "document_number": "20", 
      "pacer_doc_id": "show_doc.pl"
    }, 
    {
      "date_filed": "2009-12-29", 
      "description": "Order Granting Motion To Extend Deadline to File Schedules or Provide Required Information until 1/12/2010 (Related Doc # 18 ) (Wright, Terry) (Entered: 12/29/2009)", 
      "document_number": "19", 
      "pacer_doc_id": "show_doc.pl"
    }, 
    {
      "date_filed": "2009-12-23", 
      "description": "Motion to Extend Deadline to File Schedules or Provide Required Information Filed by Debtor Wyatt & McAlister PLLC (Leonard, Vann) (Entered: 12/23/2009)", 
      "document_number": "18", 
      "pacer_doc_id": "show_doc.pl"
    }, 
    {
      "date_filed": "2009-12-23", 
      "description": "Notice: Allowing 21 Days to File Written Objection/Response . Filed by Trustee Stephen Smith (RE: related document(s) 16 Motion to Reject Lease or Executory Contract Between Wyatt & McAlister, PLLC and Carousel Development, LLC Filed by Trustee Stephen Smith). Objections due by 1/13/2010. (Shaffer A3, Eileen) (Entered: 12/23/2009)", 
      "document_number": "17", 
      "pacer_doc_id": "show_doc.pl"
    }, 
    {
      "date_filed": "2009-12-23", 
      "description": "Motion to Reject Lease or Executory Contract Between Wyatt & McAlister, PLLC and Carousel Development, LLC Filed by Trustee Stephen Smith (Shaffer A3, Eileen) (Entered: 12/23/2009)", 
      "document_number": "16", 
      "pacer_doc_id": "show_doc.pl"
    }, 
    {
      "date_filed": "2009-12-19", 
      "description": "BNC Certificate of Mailing - PDF Document. (RE: related document(s) 13 Order on Application to Employ) Service Date 12/19/2009. (Admin.) (Entered: 12/20/2009)", 
      "document_number": "15", 
      "pacer_doc_id": "show_doc.pl"
    }, 
    {
      "date_filed": "2009-12-19", 
      "description": "BNC Certificate of Mailing - PDF Document. (RE: related document(s) 12 Order on Application to Employ) Service Date 12/19/2009. (Admin.) (Entered: 12/20/2009)", 
      "document_number": "14", 
      "pacer_doc_id": "show_doc.pl"
    }, 
    {
      "date_filed": "2009-12-17", 
      "description": "Order Granting Application to Employ Stephen Smith & Company PC as CPA for Trustee (Related Doc # 10 ) (Thompson, Jennifer) (Entered: 12/17/2009)", 
      "document_number": "13", 
      "pacer_doc_id": "show_doc.pl"
    }, 
    {
      "date_filed": "2009-12-17", 
      "description": "Order Granting Application to Employ Eileen N. Shaffer as Attorney for Trustee(Related Doc # 9 ) (Thompson, Jennifer) (Entered: 12/17/2009)", 
      "document_number": "12", 
      "pacer_doc_id": "show_doc.pl"
    }, 
    {
      "date_filed": "2009-12-16", 
      "description": "BNC Certificate of Mailing - Meeting of Creditors. (RE: related document(s) 7 Meeting of Creditors Chapter 7 No Asset) Service Date 12/16/2009. (Admin.) (Entered: 12/17/2009)", 
      "document_number": "11", 
      "pacer_doc_id": "show_doc.pl"
    }, 
    {
      "date_filed": "2009-12-16", 
      "description": "Application to Employ Stephen Smith & Company, P.C. as CPA Filed by Trustee Stephen Smith (Attachments: # 1 Affidavit Statement of Professional) (Shaffer A3, Eileen) (Entered: 12/16/2009)", 
      "document_number": "10", 
      "pacer_doc_id": "show_doc.pl"
    }, 
    {
      "date_filed": "2009-12-16", 
      "description": "Application to Employ Eileen N. Shaffer as Attorney for Trustee Filed by Trustee Stephen Smith (Attachments: # 1 Affidavit Statement of Professional) (Shaffer A3, Eileen) (Entered: 12/16/2009)", 
      "document_number": "9", 
      "pacer_doc_id": "show_doc.pl"
    }, 
    {
      "date_filed": "2009-12-15", 
      "description": "Response to (related document(s): 6 Emergency Motion to Dismiss Debtor Wyatt & McAlister, PLLC's Chapter 7 Voluntary Petition filed by Partner Mary E. McAllister) Filed by Debtor Wyatt & McAlister PLLC (Attachments: # 1 Exhibit A# 2 Exhibit B# 3 Exhibit # 4 Exhibit D) (Leonard, Vann) (Entered: 12/15/2009)", 
      "document_number": "8", 
      "pacer_doc_id": "show_doc.pl"
    }, 
    {
      "date_filed": "2009-12-14", 
      "description": "Meeting of Creditors 341(a) meeting to be held on 1/21/2010 at 01:00 PM at 341 Mtg - Jackson. (Ooton, Donna) (Entered: 12/14/2009)", 
      "document_number": "7", 
      "pacer_doc_id": "show_doc.pl"
    }, 
    {
      "date_filed": "2009-12-14", 
      "description": "Emergency Motion to Dismiss Debtor Wyatt & McAlister, PLLC's Chapter 7 Voluntary Petition Filed by Partner Mary E. McAllister (Attachments: # 1 Exhibit A to Emergency Motion to Dismiss Chapter 7 Voluntary Petition) (Allison, Lawrence) (Entered: 12/14/2009)", 
      "document_number": "6", 
      "pacer_doc_id": "show_doc.pl"
    }, 
    {
      "date_filed": "2009-12-13", 
      "description": "BNC Certificate of Mailing - PDF Document. (RE: related document(s) 3 Notice of Deficiency) Service Date 12/13/2009. (Admin.) (Entered: 12/13/2009)", 
      "document_number": "5", 
      "pacer_doc_id": "show_doc.pl"
    }, 
    {
      "date_filed": "2009-12-11", 
      "description": "Adversary case 09-00152. (02 (Other (e.g. other actions that would have been brought in state court if unrelated to bankruptcy))): Notice of Removal by Derek A Wyatt. Fee Amount $250 (Attachments: # 1 Exhibit 1# 2 Exhibit 2# 3 Exhibit 3# 4 Exhibit 4# 5 Exhibit 5a# 6 Exhibit 5b# 7 Exhibit 6# 8 Exhibit 7# 9 Exhibit 8# 10 Exhibit 9# 11 Exhibit 10# 12 Exhibit 11a# 13 Exhibit 11b# 14 Exhibit 11c# 15 Exhibit 11d# 16 Exhibit 11e# 17 Exhibit 11f# 18 Exhibit 11g# 19 Exhibit 12# 20 Exhibit 13# 21 Exhibit 13b# 22 Exhibit 13c# 23 Exhibit 14# 24 Exhibit 15# 25 Exhibit 16# 26 Exhibit 17# 27 Exhibit 18) (Leonard, Vann) (Entered: 12/11/2009)", 
      "document_number": "4", 
      "pacer_doc_id": "show_doc.pl"
    }, 
    {
      "date_filed": "2009-12-11", 
      "description": "Notice of Deficiency (RE: related document(s) 1 Voluntary Petition (Chapter 7) filed by Debtor Wyatt & McAlister PLLC) Compliance due date: 12/24/2009. (Ooton, Donna) (Entered: 12/11/2009)", 
      "document_number": "3", 
      "pacer_doc_id": "show_doc.pl"
    }, 
    {
      "date_filed": "2009-12-10", 
      "description": "Matrix Filed by Debtor Wyatt & McAlister PLLC. (Leonard, Vann) (Entered: 12/10/2009)", 
      "document_number": "2", 
      "pacer_doc_id": "show_doc.pl"
    }, 
    {
      "date_filed": "2009-12-10", 
      "description": "Chapter 7 Voluntary Petition . Fee Amount $299 Filed by Wyatt & McAlister PLLC Incomplete Filings due by 12/24/2009. (Leonard, Vann) (Entered: 12/10/2009)", 
      "document_number": "1", 
      "pacer_doc_id": "show_doc.pl"
    }
  ], 
  "docket_number": "09-04354", 
  "jurisdiction": null, 
  "jury_demand": null, 
  "nature_of_suit": null, 
  "parties": [
    {
      "attorneys": [
        {
          "contact": "PO Box 16026\nJackson, MS 39236-6026\n601 956-8001\nFax : 601 978-1770\nEmail: vfllaw@bellsouth.net\n", 
          "name": "Vann F. Leonard", 
          "roles": []
        }
      ], 
      "extra_info": "102 Northlake Lane\nMadison, MS 39110\nTax ID / EIN: 30-0506406", 
      "name": "Wyatt & McAlister PLLC", 
      "type": "Debtor"
    }, 
    {
      "attorneys": [
        {
          "contact": "P. O. Box 1177\nJackson, MS 39215-1177\n601-969-3006\nFax : 601-949-4002\nEmail: enslaw@bellsouth.net\n", 
          "name": "Eileen N. Shaffer A3", 
          "roles": []
        }
      ], 
      "extra_info": "5 Old River Place\nSuite 107\nJackson, MS 39202-3449\n601-352-6767", 
      "name": "Stephen Smith", 
      "type": "Trustee"
    }, 
    {
      "attorneys": [], 
      "extra_info": "100 W. Capitol St.\nSuite 706\nJackson, MS 39269\n(601) 965-5241", 
      "name": "R. Michael Bolen", 
      "type": "U.S. Trustee"
    }
  ], 
  "referred_to_str": null
}