{
  "assigned_to_str": "Stuart M. Bernstein", 
  "case_name": "Administrative Case Re: 08-01789 (Securities Invest - Adversary Proceeding", 
  "cause": null, 
  "court_id": "nysb", 
  "date_converted": null, 
  "date_discharged": null, 
  "date_filed": "2009-06-22", 
  "date_terminated": null, 
  "demand": "$213080000", 
  "docket_entries": [
    {
      "date_filed": "2009-06-22", 
      "description": "Complaint against Cohmad Securities Corporation, Maurice J. Cohn, Marcia B. Cohn, Robert Jaffe, Alvin J. Delaire, Jr., Stanley Mervin Berman, Jonathan Greenberg, Cyril Jalon, Morton Kurzrok, Linda Schoenheimer McCurdy, Richard Spring, Rosalie Buccellato, Milton S. Cohn, Marilyn Cohn, Jane M. Delaire a/k/a Jane Delaire Hackett, Carole Delaire, Edward H Kohlschreiber, Edward H Kohlschreiber SR REV MGT Trust, Gloria Kurzrok, Joyce Berman, S & J Partnership, Janet Jaffin Revocable Trust, The Spring Family Trust, Jeanne T. Spring Trust, The Estate of Elena Jalon, The Joint Tenancy of Phyllis Guenzburger and Fabian Guenzburger, The Joint Tenancy of Robert Pinchou and Fabian Guenzburger, Elizabeth M. Moody . Nature(s) of Suit: (11 (Recovery of money/property - 542 turnover of property)), (12 (Recovery of money/property - 547 preference)), (13 (Recovery of money/property - 548 fraudulent transfer)), (14 (Recovery of money/property - other)) Filed by Irving H. Picard, Trustee for the Liquidation of Bernard L. Madoff Investment Securities LLC. (Attachments: 1 Exhibit 12 Exhibit 23 Exhibit 3 - Part 14 Exhibit 3 - Part 25 Exhibit 3 - Part 36 Exhibit 47 Exhibit 58 Exhibit 69 Exhibit 710 Exhibit 811 Exhibit 912 Exhibit 1013 Exhibit 11) (Sheehan, David) (Entered: 06/22/2009)", 
      "document_number": "1", 
      "pacer_doc_id": "12608141641"
    }, 
    {
      "date_filed": "2009-06-22", 
      "description": "Summons with Notice of Pre-Trial Conference issued by Clerk's Office with Pre-Trial Conference set for 8/11/2009 at 10:00 AM at Courtroom 623 (BRL), Answer due by 7/22/2009, (Leggett, Venice) (Entered: 06/22/2009)", 
      "document_number": "2", 
      "pacer_doc_id": "12608142965"
    }, 
    {
      "date_filed": "2009-06-25", 
      "description": "Certificate of Service of Summons and Complaint (related document(s)2, 1) filed by David J. Sheehan on behalf of Irving H. Picard, Trustee for the Liquidation of Bernard L. Madoff Investment Securities LLC. (Sheehan, David) (Entered: 06/25/2009)", 
      "document_number": "3", 
      "pacer_doc_id": "12608157870"
    }, 
    {
      "date_filed": "2009-06-26", 
      "description": "Supplemental Certificate of Service of Summons and Complaint (related document(s)2, 1) filed by David J. Sheehan on behalf of Irving H. Picard, Trustee for the Liquidation of Bernard L. Madoff Investment Securities LLC. (Sheehan, David) (Entered: 06/26/2009)", 
      "document_number": "4", 
      "pacer_doc_id": "12608163309"
    }, 
    {
      "date_filed": "2009-07-02", 
      "description": "Notice of Appearance of John Moscow filed by John Moscow on behalf of Irving H. Picard, Trustee for the Liquidation of Bernard L. Madoff Investment Securities LLC. (Moscow, John) (Entered: 07/02/2009)", 
      "document_number": "5", 
      "pacer_doc_id": "12608185322"
    }, 
    {
      "date_filed": "2009-07-02", 
      "description": "Notice of Appearance Oren Warshavsky filed by John Moscow on behalf of Irving H. Picard, Trustee for the Liquidation of Bernard L. Madoff Investment Securities LLC. (Moscow, John) (Entered: 07/02/2009)", 
      "document_number": "6", 
      "pacer_doc_id": "12608185481"
    }, 
    {
      "date_filed": "2009-07-02", 
      "description": "Notice of Appearance of Seanna Brown filed by Seanna Brown on behalf of Irving H. Picard, Trustee for the Liquidation of Bernard L. Madoff Investment Securities LLC. (Brown, Seanna) (Entered: 07/02/2009)", 
      "document_number": "7", 
      "pacer_doc_id": "12608185507"
    }, 
    {
      "date_filed": "2009-07-02", 
      "description": "Certificate of Service of Notices of Appearance of John Moscow, Oren Warshavsky and Seanna Brown (related document(s)5, 7, 6) filed by John Moscow on behalf of Irving H. Picard, Trustee for the Liquidation of Bernard L. Madoff Investment Securities LLC. (Moscow, John) (Entered: 07/02/2009)", 
      "document_number": "8", 
      "pacer_doc_id": "12608185539"
    }, 
    {
      "date_filed": "2009-07-10", 
      "description": "Second Summons with Notice of Pre-Trial Conference issued by Clerk's Office with Pre-Trial Conference set for 9/3/2009 at 10:00 AM at Courtroom 623 (BRL), Answer due by 8/10/2009, (Leggett, Venice) (Entered: 07/10/2009)", 
      "document_number": "9", 
      "pacer_doc_id": "12608207872"
    }, 
    {
      "date_filed": "2009-07-10", 
      "description": "Summons Service Executed on Carole Delaire Answer Due: 08/10/2009; Alvin J. Delaire, Jr. Answer Due: 08/10/2009./Certificate of Service for Service of Second Summons (issued 7/10/2009) and Complaint (related document(s)9, 1) filed by David J. Sheehan on behalf of Irving H. Picard, Trustee for the Liquidation of Bernard L. Madoff Investment Securities LLC. (Sheehan, David) (Entered: 07/10/2009)", 
      "document_number": "10", 
      "pacer_doc_id": "12608211758"
    }, 
    {
      "date_filed": "2009-07-15", 
      "description": "Notice of Appearance in Adversary Proceeding filed by Eric Fisher on behalf of Richard Spring, The Spring Family Trust, and The Jeanne T. Spring Trust. (Fisher, Eric) (Entered: 07/15/2009)", 
      "document_number": "11", 
      "pacer_doc_id": "12608223967"
    }, 
    {
      "date_filed": "2009-07-15", 
      "description": "Certificate of Service (related document(s)11) filed by Eric Fisher on behalf of Richard Spring, The Spring Family Trust, and The Jeanne T. Spring Trust. (Fisher, Eric) (Entered: 07/15/2009)", 
      "document_number": "12", 
      "pacer_doc_id": "12608224090"
    }, 
    {
      "date_filed": "2009-07-21", 
      "description": "Answer to Complaint (Related Doc # 1) filed by Rachel Nicotra on behalf of Linda Schoenheimer McCurdy. (Nicotra, Rachel) (Entered: 07/21/2009)", 
      "document_number": "13", 
      "pacer_doc_id": "12608248126"
    }, 
    {
      "date_filed": "2009-07-21", 
      "description": "Answer to Complaint (Related Doc # 1) (related document(s)2, 1) filed by Elizabeth M. Moody. (Chou, Rosalyn) (Entered: 07/21/2009)", 
      "document_number": "14", 
      "pacer_doc_id": "12608249235"
    }, 
    {
      "date_filed": "2009-07-22", 
      "description": "Answer to Complaint (Related Doc # 1) filed by Edward H Kohlschreiber. (Ebanks, Liza) (Entered: 07/23/2009)", 
      "document_number": "16", 
      "pacer_doc_id": "12608257522"
    }, 
    {
      "date_filed": "2009-07-23", 
      "description": "So Ordered Stipulation signed on 7/23/2009 Between Irving H. Picard, Esq., Trustee for the Substantively Consolidated SIPA Liquidation of Bernard L. Madoff Investment Securities LLC and Bernard L. Madoff; Cohmad Securities Corporation, Maurice Cohn, Marcia Cohn, Milton Cohn and Marilyn Cohn; Richard Spring, The Spring Family Trust, and The Jeanne T. Spring Trust; Stanley Mervin Berman, Joyce Berman and S&J Partnership; Jonathan Greenberg; Cyril Jalon, The Estate of Elena Jalon, The Joint Tenancy of Phyllis Guenzburger and Fabian Guenzburger, The Joint Tenancy of Robert Pinchou and Fabian Guenzburger and Morton Kurzrok and Gloria Kurzrok. RE: Extending Defendants' Time to Move, Answer or Otherwise Respond to the Complaint to and Including 8/24/09. (Saenz De Viteri, Monica) (Entered: 07/23/2009)", 
      "document_number": "15", 
      "pacer_doc_id": "12608255907"
    }, 
    {
      "date_filed": "2009-08-05", 
      "description": "So Ordered Stipulation signed on 8/4/2009 Between Irving H. Picard, Esq., Trustee for the Substantively Consolidated SIPA Liquidation of Bernard L. Madoff Investment Securities LLC and Bernard L. Madoff and Jane Delaire. RE: Extending Defendant Jane Delaire's Time to Move, Answer or Otherwise Respond to the Complaint to and Including 8/24/2009. (Saenz De Viteri, Monica) (Entered: 08/05/2009)", 
      "document_number": "17", 
      "pacer_doc_id": "12608303159"
    }, 
    {
      "date_filed": "2009-08-06", 
      "description": "Notice of Adjournment of Hearing /Notice of Adjournment of the Pre-trial Conference to 9/9/2009 filed by Oren Warshavsky on behalf of Irving H. Picard, Trustee for the Liquidation of Bernard L. Madoff Investment Securities LLC. (Attachments: 1 Appendix Certificate of Service)(Warshavsky, Oren) (Entered: 08/06/2009)", 
      "document_number": "18", 
      "pacer_doc_id": "12608311909"
    }, 
    {
      "date_filed": "2009-08-17", 
      "description": "Motion to Withdraw the Reference filed by Steven Paradise on behalf of Cohmad Securities Corporation, Marcia B. Cohn, Maurice J. Cohn. Filing fee collected, receipt #180478. (Rouzeau, Anatin) (Entered: 08/17/2009)", 
      "document_number": "19", 
      "pacer_doc_id": "12608347213"
    }, 
    {
      "date_filed": "2009-08-17", 
      "description": "Memorandum of Law in Support of Motion to Withdraw the Reference (related document(s)19) filed by Steven Paradise on behalf of Cohmad Securities Corporation, Marcia B. Cohn, Maurice J. Cohn. (Attachments: 1 Exhibit A) (Rouzeau, Anatin) (Entered: 08/17/2009)", 
      "document_number": "20", 
      "pacer_doc_id": "12608347264"
    }, 
    {
      "date_filed": "2009-08-18", 
      "description": "Civil Cover Sheet from U.S. District Court, Case Number: 0907275 (related document(s)19) filed by Clerk's Office of the U.S. Bankruptcy Court, S.D.N.Y.. (Rouzeau, Anatin) (Entered: 08/18/2009)", 
      "document_number": "21", 
      "pacer_doc_id": "12608350309"
    }, 
    {
      "date_filed": "2009-08-19", 
      "description": "Stipulation and Order for Extension of Time to Answer or Otherwise Respond to Complaint signed on 8/19/2009 (White, Greg) (Entered: 08/19/2009)", 
      "document_number": "22", 
      "pacer_doc_id": "12608353031"
    }, 
    {
      "date_filed": "2009-08-20", 
      "description": "Notice of Appearance filed by Jack Hoffinger on behalf of Cyril Jalon, The Estate of Elena Jalon. (Hoffinger, Jack) (Entered: 08/20/2009)", 
      "document_number": "23", 
      "pacer_doc_id": "12608358970"
    }, 
    {
      "date_filed": "2009-08-20", 
      "description": "Notice of Appearance filed by Jack Hoffinger on behalf of The Joint Tenancy of Phyllis Guenzburger and Fabian Guenzburger, The Joint Tenancy of Robert Pinchou and Fabian Guenzburger. (Hoffinger, Jack) (Entered: 08/20/2009)", 
      "document_number": "24", 
      "pacer_doc_id": "12608359105"
    }, 
    {
      "date_filed": "2009-08-20", 
      "description": "Notice of Appearance filed by Fran Hoffinger on behalf of Cyril Jalon, The Estate of Elena Jalon. (Hoffinger, Fran) (Entered: 08/20/2009)", 
      "document_number": "25", 
      "pacer_doc_id": "12608359427"
    }, 
    {
      "date_filed": "2009-08-20", 
      "description": "Notice of Appearance filed by Fran Hoffinger on behalf of The Joint Tenancy of Phyllis Guenzburger and Fabian Guenzburger, The Joint Tenancy of Robert Pinchou and Fabian Guenzburger. (Hoffinger, Fran) (Entered: 08/20/2009)", 
      "document_number": "26", 
      "pacer_doc_id": "12608359542"
    }, 
    {
      "date_filed": "2009-08-21", 
      "description": "Certificate of Service of (1) Corporate Disclosure Statement, (2) Notice of Motion Pursuant to 28 U.S.C. \u00a7157(d) to Withdraw the Reference to the Bankruptcy Court, and (3) Memorandum of Law in Support of Motion Pursuant to 28 U.S.C. \u00a7 157(d) to Withdraw the Reference to the Bankruptcy Court (related document(s)20, 19) filed by Steven Paradise on behalf of Cohmad Securities Corporation, Marcia B. Cohn, Maurice J. Cohn. (Paradise, Steven) (Entered: 08/21/2009)", 
      "document_number": "27", 
      "pacer_doc_id": "12608362535"
    }, 
    {
      "date_filed": "2009-08-21", 
      "description": "Certificate of Service of Corrected Notice of Motion Pursuant to 28 U.S.C. \u00a7 157 (d) to Withdraw the Reference to the Bankruptcy Court (related document(s)19) filed by Steven Paradise on behalf of Cohmad Securities Corporation, Marcia B. Cohn, Maurice J. Cohn. (Paradise, Steven) (Entered: 08/21/2009)", 
      "document_number": "28", 
      "pacer_doc_id": "12608362563"
    }, 
    {
      "date_filed": "2009-08-21", 
      "description": "Notice of Dismissal of Complaint filed by Stanley S. Arkin on behalf of Robert Jaffe. (Arkin, Stanley) (Entered: 08/21/2009)", 
      "document_number": "29", 
      "pacer_doc_id": "12608364643"
    }, 
    {
      "date_filed": "2009-08-21", 
      "description": "Memorandum of Law in Support of Motion to Dismiss filed by Stanley S. Arkin on behalf of Robert Jaffe. (Arkin, Stanley) (Entered: 08/21/2009)", 
      "document_number": "30", 
      "pacer_doc_id": "12608364683"
    }, 
    {
      "date_filed": "2009-08-21", 
      "description": "Notice of Withdrawal of Reference (related document(s)19) filed by Stanley S. Arkin on behalf of Robert Jaffe. (Arkin, Stanley) (Entered: 08/21/2009)", 
      "document_number": "31", 
      "pacer_doc_id": "12608364741"
    }, 
    {
      "date_filed": "2009-08-21", 
      "description": "Memorandum of Law in Support of Withdrawal of Reference filed by Stanley S. Arkin on behalf of Robert Jaffe. (Arkin, Stanley) (Entered: 08/21/2009)", 
      "document_number": "32", 
      "pacer_doc_id": "12608364792"
    }, 
    {
      "date_filed": "2009-08-21", 
      "description": "Application for Pro Hac Vice Admission filed by John J. Lavin on behalf of Carol Delaire, Alvin Delaire. Filing fee collected, receipt #180539. (Cappiello, Karen) (Entered: 08/24/2009)", 
      "document_number": "33", 
      "pacer_doc_id": "12608369828"
    }, 
    {
      "date_filed": "2009-08-21", 
      "description": "Application for Pro Hac Vice Admission filed by Mark A. Blount on behalf of Carol Delaire, Alvin Delaire. Filing fee collected, receipt #180538. (Cappiello, Karen) (Entered: 08/24/2009)", 
      "document_number": "34", 
      "pacer_doc_id": "12608370330"
    }, 
    {
      "date_filed": "2009-08-24", 
      "description": "Notice of Appearance in Adversary Proceeding filed by Jeffrey A. Miller on behalf of Gloria Kurzrok, Morton Kurzrok. (Miller, Jeffrey) (Entered: 08/24/2009)", 
      "document_number": "35", 
      "pacer_doc_id": "12608370339"
    }, 
    {
      "date_filed": "2009-08-24", 
      "description": "Answer to Complaint (Related Doc # 1), Counterclaim against Irving H. Picard, Trustee for the Liquidation of Bernard L. Madoff Investment Securities LLC filed by Jeffrey A. Miller on behalf of Gloria Kurzrok. (Attachments: 1 Affidavit of Service)(Miller, Jeffrey) (Entered: 08/24/2009)", 
      "document_number": "36", 
      "pacer_doc_id": "12608370375"
    }, 
    {
      "date_filed": "2009-08-24", 
      "description": "Answer to Complaint (Related Doc # 1), Counterclaim against Irving H. Picard, Trustee for the Liquidation of Bernard L. Madoff Investment Securities LLC filed by Jeffrey A. Miller on behalf of Morton Kurzrok. (Attachments: 1 Affidavit of Service)(Miller, Jeffrey) (Entered: 08/24/2009)", 
      "document_number": "37", 
      "pacer_doc_id": "12608370403"
    }, 
    {
      "date_filed": "2009-08-24", 
      "description": "Motion to Dismiss Adversary Proceeding, Dismissing all claims against Defendants Richard Spring, The Spring Family Trust, and The Jeanne T. Spring Trust, filed by Eric Fisher on behalf of Richard Spring, The Spring Family Trust, and The Jeanne T. Spring Trust. Responses due by 9/10/2009, (Fisher, Eric) (Entered: 08/24/2009)", 
      "document_number": "38", 
      "pacer_doc_id": "12608370999"
    }, 
    {
      "date_filed": "2009-08-24", 
      "description": "Memorandum of Law In Support of Motion to Dismiss all claims against Defendants Richard Spring, The Spring Family Trust, and The Jeanne T. Spring Trust, filed by Eric Fisher on behalf of Richard Spring, The Spring Family Trust, and The Jeanne T. Spring Trust. (Fisher, Eric) (Entered: 08/24/2009)", 
      "document_number": "39", 
      "pacer_doc_id": "12608371058"
    }, 
    {
      "date_filed": "2009-08-24", 
      "description": "Certificate of Service of Motion to Dismiss all claims against Defendants Richard Spring, The Spring Family Trust, and The Jeanne T. Spring Trust, and Memorandum of Law in Support Thereof, filed by Eric Fisher on behalf of Richard Spring, The Spring Family Trust, and The Jeanne T. Spring Trust. (Fisher, Eric) (Entered: 08/24/2009)", 
      "document_number": "40", 
      "pacer_doc_id": "12608371081"
    }, 
    {
      "date_filed": "2009-08-24", 
      "description": "Motion to Dismiss Case (related document(s)39, 38) filed by Jack Hoffinger on behalf of Cyril Jalon, The Estate of Elena Jalon. (Hoffinger, Jack) (Entered: 08/24/2009)", 
      "document_number": "41", 
      "pacer_doc_id": "12608371105"
    }, 
    {
      "date_filed": "2009-08-24", 
      "description": "Affirmation Supporting Motion to Dismiss (related document(s)41, 38) filed by Jack Hoffinger on behalf of Cyril Jalon, The Estate of Elena Jalon. (Hoffinger, Jack) (Entered: 08/24/2009)", 
      "document_number": "42", 
      "pacer_doc_id": "12608371131"
    }, 
    {
      "date_filed": "2009-08-24", 
      "description": "Answer to Complaint (Related Doc # 1) filed by Fred Stevens on behalf of Jonathan Greenberg. (Stevens, Fred) (Entered: 08/24/2009)", 
      "document_number": "43", 
      "pacer_doc_id": "12608371514"
    }, 
    {
      "date_filed": "2009-08-24", 
      "description": "Motion to Dismiss Adversary Proceeding filed by Steven Paradise on behalf of Cohmad Securities Corporation, Marcia B. Cohn, Marilyn Cohn, Maurice J. Cohn, Milton S. Cohn. (Paradise, Steven) (Entered: 08/24/2009)", 
      "document_number": "44", 
      "pacer_doc_id": "12608371740"
    }, 
    {
      "date_filed": "2009-08-24", 
      "description": "Declaration of Steven Paradise in Support of Motion to Dismiss (related document(s)44) filed by Steven Paradise on behalf of Cohmad Securities Corporation, Marcia B. Cohn, Marilyn Cohn, Maurice J. Cohn, Milton S. Cohn. (Attachments: 1 Exhibit A2 Exhibit B3 Exhibit C4 Exhibit D5 Exhibit E6 Exhibit F7 Exhibit G8 Exhibit H9 Exhibit I10 Exhibit J11 Exhibit K12 Exhibit L13 Exhibit M14 Exhibit N15 Exhibit O) (Paradise, Steven) (Entered: 08/24/2009)", 
      "document_number": "45", 
      "pacer_doc_id": "12608371811"
    }, 
    {
      "date_filed": "2009-08-24", 
      "description": "Memorandum of Law in Support of Motion to Dismiss (related document(s)44) filed by Steven Paradise on behalf of Cohmad Securities Corporation, Marcia B. Cohn, Marilyn Cohn, Maurice J. Cohn, Milton S. Cohn. (Paradise, Steven) (Entered: 08/24/2009)", 
      "document_number": "46", 
      "pacer_doc_id": "12608371849"
    }, 
    {
      "date_filed": "2009-08-25", 
      "description": "Certificate of Service of (1) Notice of Appearance of Jack S. Hoffinger, (2) Notice of Appearance of Fran Hoffinger, (3) Notice of Motion to Dismiss Case, and (4) Affirmation of Jack S. Hoffinger in Support of Motion to Dismiss Case (related document(s)42, 25, 41, 23) filed by Jack Hoffinger on behalf of Cyril Jalon, The Estate of Elena Jalon. (Hoffinger, Jack) (Entered: 08/25/2009)", 
      "document_number": "47", 
      "pacer_doc_id": "12608373459"
    }, 
    {
      "date_filed": "2009-08-25", 
      "description": "Certificate of Service of (1) Notice of Appearance of Jack S. Hoffinger, (2) Notice of Appearance of Fran Hoffinger, (3) Notice of Motion to Dismiss Case, and (4) Affirmation of Jack S. Hoffinger in Support of Motion to Dismiss Case to Baker & Hostetler LLP (related document(s)42, 25, 41, 23) filed by Jack Hoffinger on behalf of Cyril Jalon, The Estate of Elena Jalon. (Hoffinger, Jack) (Entered: 08/25/2009)", 
      "document_number": "48", 
      "pacer_doc_id": "12608373499"
    }, 
    {
      "date_filed": "2009-08-25", 
      "description": "Certificate of Service of (1) Notice of Partial Motion to Dismiss Complaint, (2) Memorandum of Law in Support of Partial Motion to Dismiss Complaint, and (3) Declaration of Steven Paradise in Support of Partial Motion to Dismiss Complaint (related document(s)44) filed by Steven Paradise on behalf of Cohmad Securities Corporation, Marcia B. Cohn, Marilyn Cohn, Maurice J. Cohn, Milton S. Cohn. (Paradise, Steven) (Entered: 08/25/2009)", 
      "document_number": "49", 
      "pacer_doc_id": "12608375328"
    }, 
    {
      "date_filed": "2009-08-25", 
      "description": "Letter dated August 20, 2009 (related document(s)18, 16) filed by Edward H Kohlschreiber. (Chou, Rosalyn) (Entered: 08/27/2009)", 
      "document_number": "54", 
      "pacer_doc_id": "12608382769"
    }, 
    {
      "date_filed": "2009-08-25", 
      "description": "Statement by Joseph R. Purita, M.D. (related document(s)54) filed by Edward H Kohlschreiber. (Chou, Rosalyn) (Entered: 08/27/2009)", 
      "document_number": "55", 
      "pacer_doc_id": "12608382820"
    }, 
    {
      "date_filed": "2009-08-26", 
      "description": "Motion to Dismiss Case filed by Jack Hoffinger on behalf of The Joint Tenancy of Phyllis Guenzburger and Fabian Guenzburger, The Joint Tenancy of Robert Pinchou and Fabian Guenzburger. (Hoffinger, Jack) (Entered: 08/26/2009)", 
      "document_number": "50", 
      "pacer_doc_id": "12608377793"
    }, 
    {
      "date_filed": "2009-08-26", 
      "description": "Declaration of Jack S. Hoffinger in Support of Motion to Dismiss (related document(s)50) filed by Jack Hoffinger on behalf of The Joint Tenancy of Phyllis Guenzburger and Fabian Guenzburger, The Joint Tenancy of Robert Pinchou and Fabian Guenzburger. (Attachments: 1 Exhibit 12 Exhibit 2) (Hoffinger, Jack) (Entered: 08/26/2009)", 
      "document_number": "51", 
      "pacer_doc_id": "12608377831"
    }, 
    {
      "date_filed": "2009-08-26", 
      "description": "Memorandum of Law in Support of Motion to Dismiss the Case (related document(s)50) filed by Jack Hoffinger on behalf of The Joint Tenancy of Phyllis Guenzburger and Fabian Guenzburger, The Joint Tenancy of Robert Pinchou and Fabian Guenzburger. (Hoffinger, Jack) (Entered: 08/26/2009)", 
      "document_number": "52", 
      "pacer_doc_id": "12608377857"
    }, 
    {
      "date_filed": "2009-08-26", 
      "description": "Certificate of Service of (1) Notice of Appearance of Jack S. Hoffinger, (2) Notice of Appearance of Fran Hoffinger, (3) Notice of Motion to Dismiss Case, (4) Declaration of Jack S. Hoffinger in Support of Motion to Dismiss Case, (5) Memorandum of Law in Support of Motion to Dismiss Case (related document(s)24, 52, 51, 26, 50) filed by Jack Hoffinger on behalf of The Joint Tenancy of Phyllis Guenzburger and Fabian Guenzburger, The Joint Tenancy of Robert Pinchou and Fabian Guenzburger. (Hoffinger, Jack) (Entered: 08/26/2009)", 
      "document_number": "53", 
      "pacer_doc_id": "12608379569"
    }, 
    {
      "date_filed": "2009-08-27", 
      "description": "Notice of Appearance of Clifford Thau and Joseph Kroetsch filed by Steven Paradise on behalf of Cohmad Securities Corporation, Marcia B. Cohn, Marilyn Cohn, Maurice J. Cohn, Milton S. Cohn. (Paradise, Steven) (Entered: 08/27/2009)", 
      "document_number": "56", 
      "pacer_doc_id": "12608385654"
    }, 
    {
      "date_filed": "2009-08-28", 
      "description": "Order signed on 8/28/2009 Granting Application for Pro Hac Vice of John J. Lavin, Esq. (Related Doc # 33). (Saenz De Viteri, Monica) (Entered: 08/28/2009)", 
      "document_number": "57", 
      "pacer_doc_id": "12608387505"
    }, 
    {
      "date_filed": "2009-08-28", 
      "description": "Order signed on 8/28/2009 Granting Application for Pro Hac Vice of Mark A. Blount, Esq. (Related Doc # 34). (Saenz De Viteri, Monica) (Entered: 08/28/2009)", 
      "document_number": "58", 
      "pacer_doc_id": "12608387532"
    }, 
    {
      "date_filed": "2009-08-31", 
      "description": "Certificate of Service of Notice of Appearance (related document(s)56) filed by Steven Paradise on behalf of Cohmad Securities Corporation, Marcia B. Cohn, Marilyn Cohn, Maurice J. Cohn, Milton S. Cohn. (Paradise, Steven) (Entered: 08/31/2009)", 
      "document_number": "59", 
      "pacer_doc_id": "12608397469"
    }, 
    {
      "date_filed": "2009-09-01", 
      "description": "Motion to Withdraw the Reference (related document(s)32, 31, 20, 19) filed by David M. Pohl on behalf of Robert Jaffe. (Pohl, David) (Entered: 09/01/2009)", 
      "document_number": "60", 
      "pacer_doc_id": "12608401517"
    }, 
    {
      "date_filed": "2009-09-03", 
      "description": "Notice of Appearance in Adversary Proceeding filed by Mark A. Blount on behalf of Alvin Delaire, Carol Delaire. (Blount, Mark) (Entered: 09/03/2009)", 
      "document_number": "61", 
      "pacer_doc_id": "12608409922"
    }, 
    {
      "date_filed": "2009-09-03", 
      "description": "Motion to Dismiss Adversary Proceeding filed by Mark A. Blount on behalf of Alvin Delaire, Carol Delaire. (Blount, Mark) (Entered: 09/03/2009)", 
      "document_number": "62", 
      "pacer_doc_id": "12608409925"
    }, 
    {
      "date_filed": "2009-09-03", 
      "description": "Motion to Dismiss Adversary Proceeding (related document(s)62) filed by Mark A. Blount on behalf of Alvin Delaire, Carol Delaire. (Blount, Mark) (Entered: 09/03/2009)", 
      "document_number": "63", 
      "pacer_doc_id": "12608409928"
    }, 
    {
      "date_filed": "2009-09-03", 
      "description": "Motion for Attachment (related document(s)62) filed by Mark A. Blount on behalf of Alvin Delaire, Carol Delaire. (Blount, Mark) (Entered: 09/03/2009)", 
      "document_number": "64", 
      "pacer_doc_id": "12608409938"
    }, 
    {
      "date_filed": "2009-09-04", 
      "description": "Answer to Complaint (Related Doc # 1) filed by Philip Bentley on behalf of Janet Jaffin Revocable Trust. (Bentley, Philip) (Entered: 09/04/2009)", 
      "document_number": "65", 
      "pacer_doc_id": "12608413492"
    }, 
    {
      "date_filed": "2009-09-04", 
      "description": "Motion to Dismiss Adversary Proceeding (related document(s)9, 2, 1) filed by James B. Glucksman on behalf of Jane M. Delaire a/k/a Jane Delaire Hackett. with hearing to be held on 11/17/2009 at 10:00 AM at Courtroom 623 (BRL) Responses due by 10/8/2009, (Glucksman, James) (Entered: 09/04/2009)", 
      "document_number": "66", 
      "pacer_doc_id": "12608413586"
    }, 
    {
      "date_filed": "2009-09-04", 
      "description": "Memorandum of Law in Support of Motion to Dismiss Adversary Proceeding (related document(s)66) filed by James B. Glucksman on behalf of Jane M. Delaire a/k/a Jane Delaire Hackett. Objections due by 10/8/2009, (Glucksman, James) (Entered: 09/04/2009)", 
      "document_number": "67", 
      "pacer_doc_id": "12608413599"
    }, 
    {
      "date_filed": "2009-09-04", 
      "description": "Motion to Authorize /Demand for Jury Trial filed by Jeffrey A. Miller on behalf of Gloria Kurzrok, Morton Kurzrok. (Miller, Jeffrey) (Entered: 09/04/2009)", 
      "document_number": "68", 
      "pacer_doc_id": "12608414833"
    }, 
    {
      "date_filed": "2009-09-04", 
      "description": "Affidavit of Service of Demand For Jury Trial (related document(s)68) filed by Jeffrey A. Miller on behalf of Gloria Kurzrok, Morton Kurzrok. (Miller, Jeffrey) (Entered: 09/04/2009)", 
      "document_number": "69", 
      "pacer_doc_id": "12608414845"
    }, 
    {
      "date_filed": "2009-09-14", 
      "description": "Notice of Hearing /Plaintiff Irving H. Picard, Trustee's, Motion to Dismiss Defendant Gloria Kurzrok's Counterclaims (related document(s)36) filed by Oren Warshavsky on behalf of Irving H. Picard, Trustee for the Liquidation of Bernard L. Madoff Investment Securities LLC. with hearing to be held on 10/6/2009 at 10:00 AM at Courtroom 623 (BRL) Objections due by 10/2/2009, (Attachments: 1 Notice of Motion2 Exhibit A3 Exhibit B4 Exhibit C5 Appendix Certificate of Service)(Warshavsky, Oren) (Entered: 09/14/2009)", 
      "document_number": "70", 
      "pacer_doc_id": "12608440247"
    }, 
    {
      "date_filed": "2009-09-17", 
      "description": "Memorandum of Law /Plaintiff Trustee Irving H. Picard's Memorandum of Law in Support of the Objection to the Motion to Dismiss Filed by Defendants The Joint Tenancy of Phyllis Guenzburger and Fabian Guenzburger, and The Joint Tenancy of Robert Pinchou and Fabian Guenzburger (related document(s)50) filed by Oren Warshavsky on behalf of Irving H. Picard, Trustee for the Liquidation of Bernard L. Madoff Investment Securities LLC. (Attachments: 1 Declaration of John Moscow In Support of Trustee's Objection2 Exhibit 13 Exhibit 24 Exhibit 35 Exhibit 46 Exhibit 57 Exhibit 68 Exhibit 79 Exhibit 810 Exhibit 911 Exhibit 1012 Exhibit 1113 Exhibit 1214 Exhibit 1315 Exhibit 1416 Exhibit 1517 Exhibit 1618 Exhibit 1719 Exhibit 1720 Exhibit 1921 Appendix Certificate of Service) (Warshavsky, Oren) (Entered: 09/17/2009)", 
      "document_number": "71", 
      "pacer_doc_id": "12608454750"
    }, 
    {
      "date_filed": "2009-09-21", 
      "description": "Answer to Complaint (Related Doc # 1) filed by Stuart Wachs on behalf of Rosalie Buccellato. (Wachs, Stuart) (Entered: 09/21/2009)", 
      "document_number": "72", 
      "pacer_doc_id": "12608464260"
    }, 
    {
      "date_filed": "2009-09-21", 
      "description": "Answer to Complaint (Related Doc # 1) (related document(s)2, 1) filed by Edward H Kohlschreiber SR REV MGT Trust. (Chou, Rosalyn) (Entered: 09/22/2009)", 
      "document_number": "73", 
      "pacer_doc_id": "12608466476"
    }, 
    {
      "date_filed": "2009-09-22", 
      "description": "Motion to Dismiss Case filed by Vivian R. Drohan on behalf of Stanley Mervin Berman. with hearing to be held on 11/17/2009 at 10:00 AM at Courtroom 623 (BRL) Responses due by 10/8/2009, (Drohan, Vivian) (Entered: 09/22/2009)", 
      "document_number": "74", 
      "pacer_doc_id": "12608468733"
    }, 
    {
      "date_filed": "2009-09-22", 
      "description": "Motion to Dismiss Case filed by Vivian R. Drohan on behalf of Joyce Berman. with hearing to be held on 11/17/2009 at 10:00 AM at Courtroom 623 (BRL) Responses due by 10/8/2009, (Drohan, Vivian) (Entered: 09/22/2009)", 
      "document_number": "75", 
      "pacer_doc_id": "12608468752"
    }, 
    {
      "date_filed": "2009-09-22", 
      "description": "Motion to Dismiss Case filed by Vivian R. Drohan on behalf of S & J Partnership. with hearing to be held on 11/17/2009 at 10:00 AM at Courtroom 623 (BRL) Responses due by 10/8/2009, (Drohan, Vivian) (Entered: 09/22/2009)", 
      "document_number": "76", 
      "pacer_doc_id": "12608468766"
    }, 
    {
      "date_filed": "2009-09-25", 
      "description": "So Ordered Case Management Plan signed on 9/24/2009 Between Irving H. Picard, Esq., Trustee for the Substantively Consolidated SIPA Liquidation of Bernard L. Madoff Investment Securities LLC and Bernard L. Madoff; Defendants Cohmad Securities Corporation, Maurice J. Cohn, Marcia B. Cohn, Milton S. Cohn and Marilyn Cohn; Defendants Cyril Jalon, The Estate of Elena Jalon, The Joint Tenancy of Phyllis Guenzburger and Fabian Guenzburger, and The Joint Tenancy of Robert Pinchou and Fabian Guenzburger; Defendant Robert Jaffe; Defendants Stanley Berman, Joyce Berman and the S & J Partnership; Defendant Jonathan Greenberg; Defendants Morton Kurzrok and Gloria Kurzrok; Janet Jaffin and Milton Cooper, as Trustees of The Janet Jaffin Dispositive Trust s/h/a Janet Jaffin Revocable Trust; Defendants Alvin Sonny Delaire, Jr. and Carole Delaire; Defendant Elizabeth M. Moody; Defendants Richard Spring, The Spring Family Trust and Jeanne T. Spring Trust; Defendant Linda Schoenheimer McCurdy; Defendant Jane M. Delaire a/k/a Jane Delaire Hackett; Defendant Rosalie Buccellato and Edward H. Kohlschreiber. (Saenz De Viteri, Monica) (Entered: 09/25/2009)", 
      "document_number": "77", 
      "pacer_doc_id": "12608483794"
    }, 
    {
      "date_filed": "2009-10-05", 
      "description": "So Ordered Stipulation signed on 10/5/2009 Between Trustee Irving H. Picard and Defendant Gloria Kurzrok. RE: Adjourning The motion (Motion) by Irving H. Picard, Esq. (Trustee), as trustee for the substantively consolidated liquidation of Bernard L. Madoff Investment Securities LLC (BLMIS) and the Estate of Bernard L. Madoff, to Dismiss the Counterclaim Filed by Defendant Gloria Kurzro (related document(s)70). With Adjourned Hearing to be Held on 10/27/2009 at 10:00 AM at Courtroom 623 (BRL). (Saenz De Viteri, Monica) (Entered: 10/05/2009)", 
      "document_number": "78", 
      "pacer_doc_id": "12608517419"
    }, 
    {
      "date_filed": "2009-10-06", 
      "description": "Declaration of Jack S. Hoffinger in Further Support of Motion to Dismiss (related document(s)50) filed by Jack Hoffinger on behalf of The Joint Tenancy of Phyllis Guenzburger and Fabian Guenzburger, The Joint Tenancy of Robert Pinchou and Fabian Guenzburger. (Attachments: 1 Exhibit 3) (Hoffinger, Jack) (Entered: 10/06/2009)", 
      "document_number": "79", 
      "pacer_doc_id": "12608523183"
    }, 
    {
      "date_filed": "2009-10-06", 
      "description": "Memorandum of Law in Further Support of Motion to Dismiss (related document(s)50) filed by Jack Hoffinger on behalf of The Joint Tenancy of Phyllis Guenzburger and Fabian Guenzburger, The Joint Tenancy of Robert Pinchou and Fabian Guenzburger. (Hoffinger, Jack) (Entered: 10/06/2009)", 
      "document_number": "80", 
      "pacer_doc_id": "12608523265"
    }, 
    {
      "date_filed": "2009-10-06", 
      "description": "Certificate of Service (related document(s)79, 80) filed by Jack Hoffinger on behalf of The Joint Tenancy of Phyllis Guenzburger and Fabian Guenzburger, The Joint Tenancy of Robert Pinchou and Fabian Guenzburger. (Hoffinger, Jack) (Entered: 10/06/2009)", 
      "document_number": "81", 
      "pacer_doc_id": "12608523532"
    }, 
    {
      "date_filed": "2009-10-08", 
      "description": "Amended Complaint against all defendants Filed by Oren Warshavsky on behalf of Irving H. Picard, Trustee for the Liquidation of Bernard L. Madoff Investment Securities LLC. (Attachments: 1 Exhibit 12 Exhibit 23 Exhibit 34 Exhibit 45 Exhibit 56 Exhibit 67 Exhibit 78 Exhibit 89 Exhibit 910 Exhibit 1011 Exhibit 1112 Exhibit 1213 Exhibit 1314 Exhibit 1415 Exhibit 1516 Exhibit 1617 Exhibit 17) (Warshavsky, Oren) (Entered: 10/08/2009)", 
      "document_number": "82", 
      "pacer_doc_id": "12608533019"
    }, 
    {
      "date_filed": "2009-10-08", 
      "description": "Transcript regarding Hearing Held on 10/6/09 RE: Chais Matters. Remote electronic access to the transcript is restricted until 1/6/2010. The transcript may be viewed at the Bankruptcy Court Clerks Office. [Transcription Service Agency: Veritext, LLC.]. (See the Courts Website for contact information for the Transcription Service Agency.). Notice of Intent to Request Redaction Deadline Due By 10/15/2009. Statement of Redaction Request Due By 10/29/2009. Redacted Transcript Submission Due By 11/9/2009. Transcript access will be restricted through 1/6/2010. (Richards, Beverly) Modified on 10/22/2009 (Richards, Beverly). Modified on 7/21/2010 (Richards, Beverly). (Entered: 10/09/2009)", 
      "document_number": "83", 
      "pacer_doc_id": "12608535517"
    }, 
    {
      "date_filed": "2009-10-12", 
      "description": "Certificate of Service of Amended Complaint (related document(s)82) filed by Oren Warshavsky on behalf of Irving H. Picard, Trustee for the Liquidation of Bernard L. Madoff Investment Securities LLC. (Warshavsky, Oren) (Entered: 10/12/2009)", 
      "document_number": "84", 
      "pacer_doc_id": "12608540419"
    }, 
    {
      "date_filed": "2009-10-15", 
      "description": "Civil Cover Sheet from U.S. District Court, Case Number: 0907655 (related document(s)60) filed by Clerk's Office of the U.S. Bankruptcy Court, S.D.N.Y.. (Rouzeau, Anatin) (Entered: 10/15/2009)", 
      "document_number": "85", 
      "pacer_doc_id": "12608551958"
    }, 
    {
      "date_filed": "2009-10-15", 
      "description": "AMENDED Summons with Notice of Pre-Trial Conference issued by Clerk's Office with Pre-Trial Conference set for 12/9/2009 at 10:00 AM at Courtroom 623 (BRL), Answer due by 11/16/2009, (Campbell, Tiffany) (Entered: 10/15/2009)", 
      "document_number": "86", 
      "pacer_doc_id": "12608554104"
    }, 
    {
      "date_filed": "2009-10-19", 
      "description": "So Ordered Stipulation signed on 10/19/2009 Between Trustee Irving H. Picard and Defendant Gloria Kurzrok. RE: Adjourning The motion (Motion) by Irving H. Picard, Esq. (Trustee), as trustee for the substantively consolidated liquidation of Bernard L. Madoff Investment Securities LLC (BLMIS) and the Estate of Bernard L. Madoff, to Dismiss the Counterclaim Filed by Defendant Gloria Kurzro. With Adjourned Hearing to be held on 12/8/2009 at 10:00 AM at Courtroom 623 (BRL). (Saenz De Viteri, Monica) (Entered: 10/19/2009)", 
      "document_number": "87", 
      "pacer_doc_id": "12608566131"
    }, 
    {
      "date_filed": "2009-10-20", 
      "description": "Summons and Notice of Pre-Trial Conference against Joyce Berman Answer Due: 11/19/2009; Stanley Mervin Berman Answer Due: 11/19/2009; Rosalie Buccellato Answer Due: 11/19/2009; Cohmad Securities Corporation Answer Due: 11/19/2009; Marcia B. Cohn Answer Due: 11/19/2009; Marilyn Cohn Answer Due: 11/19/2009; Maurice J. Cohn Answer Due: 11/19/2009; Milton S. Cohn Answer Due: 11/19/2009; Carole Delaire Answer Due: 11/19/2009; Alvin J. Delaire, Jr. Answer Due: 11/19/2009; Edward H Kohlschreiber SR REV MGT Trust Answer Due: 11/19/2009; Jonathan Greenberg Answer Due: 11/19/2009; Robert Jaffe Answer Due: 11/19/2009; Cyril Jalon Answer Due: 11/19/2009; Jane M. Delaire a/k/a Jane Delaire Hackett Answer Due: 11/19/2009; Janet Jaffin Individually And in Her Capacity as Trustee of The Janet Jaffin Dispositive Trust Answer Due: 11/19/2009; Janet Jaffin Revocable Trust Answer Due: 11/19/2009; Jeanne T. Spring Trust Answer Due: 11/19/2009; Edward H Kohlschreiber Answer Due: 11/19/2009; Gloria Kurzrok Answer Due: 11/19/2009; Morton Kurzrok Answer Due: 11/19/2009; M/A/S Capital Corporation Answer Due: 11/19/2009; Milton Cooper in His Capacity as Trustee of the Janet Jaffin Dispositive Trust Answer Due: 11/19/2009; Elizabeth M. Moody Answer Due: 11/19/2009; Richard Spring, The Spring Family Trust, and The Jeanne T. Spring Trust Answer Due: 11/19/2009; S & J Partnership Answer Due: 11/19/2009; Linda Schoenheimer McCurdy Answer Due: 11/19/2009; Richard Spring Answer Due: 11/19/2009; The Estate of Elena Jalon Answer Due: 11/19/2009; The Joint Tenancy of Phyllis Guenzburger and Fabian Guenzburger Answer Due: 11/19/2009; The Joint Tenancy of Robert Pinchou and Fabian Guenzburger Answer Due: 11/19/2009; The Spring Family Trust Answer Due: 11/19/2009. SECOND AMENDED SUMMONS Filed by Clerk's Office of the U.S. Bankruptcy Court, S.D.N.Y.. with Pre-Trial Conference set for 12/9/2009 at 10:00 AM at Courtroom 623 (BRL), (Campbell, Tiffany) (Entered: 10/20/2009)", 
      "document_number": "88", 
      "pacer_doc_id": "12608568940"
    }, 
    {
      "date_filed": "2009-10-21", 
      "description": "Certificate of Service of Second Amended Summons and Amended Complaint Service Executed on Defendants Janet Jaffin Individually and in Her Capacity as Trustee of The Janet Jaffin Dispositive Trust, Milton Cooper in His Capacity as Trustee of The Janet Jaffin Dispositive Trust and M/A/S Capital Corporation (related document(s)82, 88) filed by Oren Warshavsky on behalf of Irving H. Picard, Trustee for the Liquidation of Bernard L. Madoff Investment Securities LLC. (Warshavsky, Oren) (Entered: 10/21/2009)", 
      "document_number": "89", 
      "pacer_doc_id": "12608574780"
    }, 
    {
      "date_filed": "2009-10-26", 
      "description": "Written Opinion/Memorandum Decision and Order signed on 10/26/2009 Denying Defendants' Motion to Dismiss (related document(s)52, 51, 50). (Saenz De Viteri, Monica) (Entered: 10/26/2009)", 
      "document_number": "90", 
      "pacer_doc_id": "12608591343"
    }, 
    {
      "date_filed": "2009-11-03", 
      "description": "So Ordered Stipulation signed on 11/3/2009. RE: Extending Defendants' Cohmad Securities Corporation, Maurice J. Cohn, Marcia B. Cohn, Milton S. Cohn, Marilyn Cohn; Cyril Jalon, The Estate of Elena Jalon; Robert Jaffe, M/A/S Capital Corporation; Stanley Berman, Joyce Berman, S & J Partnership; Jonathan Greenberg; Morton Kurzrok, Gloria Kurzrok; Janet Jaffin and Milton Cooper, as Trustees of The Janet Jaffin Dispositive Trust s/h/a Janet Jaffin Revocable Trust, Janet Jaffin Individually; Alvin Delaire, Jr., Carole Delaire; Elizabeth M. Moody; Richard Spring, The Spring Family Trust, Jeanne T. Spring Trust; Linda Schoenheimer McCurdy; Jane M. Delaire a/k/a Jane Delaire Hackett and Rosalie Buccellato Time to Answer, Move Against, or Otherwise Respond to the First Amended Complaint to and Including December 1, 2009. (Saenz De Viteri, Monica) (Entered: 11/03/2009)", 
      "document_number": "91", 
      "pacer_doc_id": "12608627662"
    }, 
    {
      "date_filed": "2009-11-23", 
      "description": "So Ordered Stipulation signed on 11/23/2009 Between Irving H. Picard, Esq., Trustee for the Substantively Consolidated SIPA Liquidation of Bernard L. Madoff Investment Securities LLC And Bernard L. Madoff and Gloria Kurzrok. RE: Dismissal Without Prejudice of Gloria Kurzrok's Counterclaim in Above-Caption (related document(s)70, 36, 1). (Saenz De Viteri, Monica) (Entered: 11/23/2009)", 
      "document_number": "92", 
      "pacer_doc_id": "12608699375"
    }, 
    {
      "date_filed": "2009-12-01", 
      "description": "Answer to Amended Complaint (Related Doc # 82) filed by Ernest E. Badway on behalf of Jonathan Greenberg. (Badway, Ernest) (Entered: 12/01/2009)", 
      "document_number": "93", 
      "pacer_doc_id": "12608721202"
    }, 
    {
      "date_filed": "2009-12-01", 
      "description": "Answer to Amended Complaint (Related Doc # 82) filed by Rachel Nicotra on behalf of Linda Schoenheimer McCurdy. (Nicotra, Rachel) (Entered: 12/01/2009)", 
      "document_number": "94", 
      "pacer_doc_id": "12608722263"
    }, 
    {
      "date_filed": "2009-12-01", 
      "description": "Motion to Dismiss Adversary Proceeding Notice of Motion filed by Eric Fisher on behalf of Richard Spring, The Spring Family Trust, and The Jeanne T. Spring Trust. (Fisher, Eric) (Entered: 12/01/2009)", 
      "document_number": "95", 
      "pacer_doc_id": "12608722542"
    }, 
    {
      "date_filed": "2009-12-01", 
      "description": "Memorandum of Law in Support of Motion to Dismiss Filed By Defendants Richard Spring, The Spring Family Trust and The Jeanne T. Spring Trust (related document(s)95) filed by Eric Fisher on behalf of Richard Spring, The Spring Family Trust, and The Jeanne T. Spring Trust. (Fisher, Eric) (Entered: 12/01/2009)", 
      "document_number": "96", 
      "pacer_doc_id": "12608722603"
    }, 
    {
      "date_filed": "2009-12-01", 
      "description": "Affidavit of Service of Answer to Amended Complaint (related document(s)93) filed by Ernest E. Badway on behalf of Jonathan Greenberg. (Badway, Ernest) (Entered: 12/01/2009)", 
      "document_number": "97", 
      "pacer_doc_id": "12608722609"
    }, 
    {
      "date_filed": "2009-12-01", 
      "description": "Certificate of Service (related document(s)95) filed by Eric Fisher on behalf of Richard Spring, The Spring Family Trust, and The Jeanne T. Spring Trust. (Fisher, Eric) (Entered: 12/01/2009)", 
      "document_number": "98", 
      "pacer_doc_id": "12608722647"
    }, 
    {
      "date_filed": "2009-12-01", 
      "description": "Certificate of Service of Amended Answer of Linda Schoenheimer McCurdy (related document(s)94) filed by Rachel Nicotra on behalf of Linda Schoenheimer McCurdy. (Nicotra, Rachel) (Entered: 12/01/2009)", 
      "document_number": "99", 
      "pacer_doc_id": "12608722871"
    }, 
    {
      "date_filed": "2009-12-01", 
      "description": "Answer to Amended Complaint (Related Doc # 82) filed by Jeffrey A. Miller on behalf of Morton Kurzrok. (Miller, Jeffrey) (Entered: 12/01/2009)", 
      "document_number": "100", 
      "pacer_doc_id": "12608723313"
    }
  ], 
  "docket_number": "09-01305", 
  "jurisdiction": null, 
  "jury_demand": null, 
  "nature_of_suit": "11 Recovery of money/property - 542 turnover of property; 12 Recovery of money/property - 547 preference; 13 Recovery of money/property - 548 fraudulent transfer; 14 Recovery of money/property - other", 
  "parties": [
    {
      "attorneys": [
        {
          "contact": "Baker & Hostetler LLP\n45 Rockefeller Plaza\nNew York, NY 10111\n(212) 589-4200\nFax : (212) 589-4201\nEmail:\n", 
          "name": "Seanna Brown", 
          "roles": []
        }, 
        {
          "contact": "Baker & Hostetler LLP\n45 Rockefeller Plaza\nNew York, NY 10111\n212-589-4200\nFax : 212-589-4201\nEmail:\n", 
          "name": "Marc E. Hirschfield", 
          "roles": []
        }, 
        {
          "contact": "Baker & Hostetler LLP\n45 Rockefeller Plaza\nNew York, NY 10111\n212-589-4200\nFax : 212-589-4201\nEmail:\n", 
          "name": "John Moscow", 
          "roles": []
        }, 
        {
          "contact": "Baker & Hostetler LLP\n45 Rockefeller Plaza\nNew York, NY 10111\n212 589 4200\nFax : 212 589 4201\nEmail:\n", 
          "name": "David J. Sheehan", 
          "roles": [
            "LEAD ATTORNEY"
          ]
        }, 
        {
          "contact": "Baker & Hostetler LLP\n45 Rockefeller Plaza\nNew York, NY 10111\n212.589.4200\nFax : 212.589.4201\nEmail:\n", 
          "name": "Oren Warshavsky", 
          "roles": []
        }
      ], 
      "extra_info": "", 
      "name": "Irving H. Picard, Trustee for the Liquidation of Bernard L. Madoff Investment Securities LLC, and Bernard L. Madoff", 
      "type": "Plaintiff"
    }, 
    {
      "attorneys": [
        {
          "contact": "Pohl LLP\n345 Seventh Avenue\n21st Floor\nNew York, NY 10001\n212-202-1614\nFax : 646-924-3100\nEmail:\n", 
          "name": "David M. Pohl", 
          "roles": []
        }
      ], 
      "extra_info": "", 
      "name": "Robert Jaffe", 
      "type": "Defendant"
    }, 
    {
      "attorneys": [
        {
          "contact": "PRO SE\n", 
          "name": "Alvin J. Delaire, Jr.", 
          "roles": []
        }, 
        {
          "contact": "", 
          "name": "", 
          "roles": []
        }
      ], 
      "extra_info": "", 
      "name": "Alvin J. Delaire, Jr.", 
      "type": "Defendant"
    }, 
    {
      "attorneys": [
        {
          "contact": "Fox Rothschild LLP\n100 Park Avenue\n15th Floor\nNew York, NY 10017\n(212) 878-7900\nFax : (212) 692-0940\nEmail:\n", 
          "name": "Ernest E. Badway", 
          "roles": []
        }, 
        {
          "contact": "Klestadt Winters Jureller\nSouthard & Stevens, LLP\n200 West 41st Street\n17th Floor\nNew York, NY 10036\n(212) 972-3000\nFax : (212) 972-2245\nEmail:\n", 
          "name": "Fred Stevens", 
          "roles": []
        }
      ], 
      "extra_info": "", 
      "name": "Jonathan Greenberg", 
      "type": "Defendant"
    }, 
    {
      "attorneys": [
        {
          "contact": "Westerman Ball Ederer Miller Sharfstein LLP\n1201 RXR Plaza\nUniondale, NY 11556\n(516) 622-9200\nFax : (516) 622-9212\nEmail:\n", 
          "name": "Jeffrey A. Miller", 
          "roles": []
        }
      ], 
      "extra_info": "", 
      "name": "Morton Kurzrok", 
      "type": "Defendant"
    }, 
    {
      "attorneys": [
        {
          "contact": "McLaughlin & Stern, LLP\n360 Madison Avenue\nNew York, NY 10016\n(212) 448-1100\nFax : (212) 448-0066\nEmail:\n", 
          "name": "Bruce A. Langer", 
          "roles": []
        }, 
        {
          "contact": "McLaughlin & Stern, LLP\n260 Madison Avenue\nNew York, NY 10016\n(212) 448-1100\nFax : (212) 448-0066\nEmail:\n", 
          "name": "Rachel Nicotra", 
          "roles": []
        }
      ], 
      "extra_info": "", 
      "name": "Linda Schoenheimer McCurdy", 
      "type": "Defendant"
    }, 
    {
      "attorneys": [
        {
          "contact": "Katsky Korins LLP\n605 Third Avenue\nNew York, NY 10158-6899\n(212) 716-3237\nFax : (212) 716-3337\nEmail:\n", 
          "name": "Robert Alan Abrams", 
          "roles": []
        }
      ], 
      "extra_info": "", 
      "name": "Richard Spring", 
      "type": "Defendant"
    }, 
    {
      "attorneys": [
        {
          "contact": "Rattet PLLC\n202 Mamaroneck Avenue\nWhite Plains, NY 10601\n914-381-7400\nFax : 914-381-7406\nEmail:\n", 
          "name": "James B. Glucksman", 
          "roles": []
        }
      ], 
      "extra_info": "", 
      "name": "Jane M. Delaire a/k/a Jane Delaire Hackett", 
      "type": "Defendant"
    }, 
    {
      "attorneys": [
        {
          "contact": "PRO SE\n", 
          "name": "Carole Delaire", 
          "roles": []
        }, 
        {
          "contact": "", 
          "name": "", 
          "roles": []
        }
      ], 
      "extra_info": "", 
      "name": "Carole Delaire", 
      "type": "Defendant"
    }, 
    {
      "attorneys": [
        {
          "contact": "Drohan Lee LLP\n489 Fifth Avenue\nNew York, NY 10017\n(212)710-0004\nFax : (212)710-0003\nEmail:\n", 
          "name": "Vivian R. Drohan", 
          "roles": []
        }
      ], 
      "extra_info": "Individually and in her capacity as Executor of the Estate of Stanley Merwin Berman", 
      "name": "Joyce Berman,  Individually and in her capacity as Executor of the Estate of Stanley Merwin Berman", 
      "type": "Defendant"
    }, 
    {
      "attorneys": [
        {
          "contact": "Drohan Lee LLP\n489 Fifth Avenue\nNew York, NY 10017\n(212)710-0004\nFax : (212)710-0003\nEmail:\n", 
          "name": "Vivian R. Drohan", 
          "roles": []
        }
      ], 
      "extra_info": "", 
      "name": "S & J Partnership", 
      "type": "Defendant"
    }, 
    {
      "attorneys": [
        {
          "contact": "Katsky Korins LLP\n605 Third Avenue\nNew York, NY 10158-6899\n(212) 716-3237\nFax : (212) 716-3337\nEmail:\n", 
          "name": "Robert Alan Abrams", 
          "roles": []
        }
      ], 
      "extra_info": "", 
      "name": "The Spring Family Trust", 
      "type": "Defendant"
    }, 
    {
      "attorneys": [
        {
          "contact": "Katsky Korins LLP\n605 Third Avenue\nNew York, NY 10158-6899\n(212) 716-3237\nFax : (212) 716-3337\nEmail:\n", 
          "name": "Robert Alan Abrams", 
          "roles": []
        }
      ], 
      "extra_info": "", 
      "name": "Jeanne T. Spring Trust", 
      "type": "Defendant"
    }, 
    {
      "attorneys": [
        {
          "contact": "Katsky Korins LLP\n605 Third Avenue\nNew York, NY 10158-6899\n(212) 716-3237\nFax : (212) 716-3337\nEmail:\n", 
          "name": "Robert Alan Abrams", 
          "roles": []
        }, 
        {
          "contact": "Binder & Schwartz LLP\n366 Madison Avenue, 6th Floor\nNew York, NY 10017\n212-510-7008\nFax : (212) 510-7299\nEmail:\n", 
          "name": "Eric Fisher", 
          "roles": []
        }, 
        {
          "contact": "Katsky Korins LLP\n605 Third Avenue\n16th Floor\nNew York, NY 10158\n(212) 953-6000\nFax : (212) 953-6899\nEmail:\n", 
          "name": "Steven H. Newman", 
          "roles": []
        }
      ], 
      "extra_info": "", 
      "name": "Richard Spring, The Spring Family Trust, and The Jeanne T. Spring Trust", 
      "type": "Defendant"
    }, 
    {
      "attorneys": [
        {
          "contact": "Drohan Lee LLP\n489 Fifth Avenue\nNew York, NY 10017\n(212)710-0004\nFax : (212)710-0003\nEmail:\n", 
          "name": "Vivian R. Drohan", 
          "roles": []
        }
      ], 
      "extra_info": "in her capacity as Executor of the Estate of Stanley Merwin Berman a/k/a", 
      "name": "Estate of Stanley Merwin Berman a/k/a Stanley M. Berman and Joyce C. Berman,  in her capacity as Executor of the Estate of Stanley Merwin Berman a/k/a", 
      "type": "Defendant"
    }, 
    {
      "attorneys": [
        {
          "contact": "Jaspan Schlesinger LLP\n300 Garden City Plaza, 5th Floor\nGarden City, NY 11530\n516-746-8000\nFax : 516-393-8282\nEmail:\n", 
          "name": "Jeffrey H. Schwartz", 
          "roles": []
        }
      ], 
      "extra_info": "", 
      "name": "Estate of Janet Jaffin", 
      "type": "Defendant"
    }, 
    {
      "attorneys": [
        {
          "contact": "Jaspan Schlesinger LLP\n300 Garden City Plaza, 5th Floor\nGarden City, NY 11530\n516-746-8000\nFax : 516-393-8282\nEmail:\n", 
          "name": "Jeffrey H. Schwartz", 
          "roles": []
        }
      ], 
      "extra_info": "in his capacity as trustee of the Janet Jaffin Dispositive Trust, and as coexecutor of the Estate of Janet Jaffin", 
      "name": "Milton Cooper,  in his capacity as trustee of the Janet Jaffin Dispositive Trust, and as coexecutor of the Estate of Janet Jaffin", 
      "type": "Defendant"
    }, 
    {
      "attorneys": [
        {
          "contact": "Jaspan Schlesinger LLP\n300 Garden City Plaza, 5th Floor\nGarden City, NY 11530\n516-746-8000\nFax : 516-393-8282\nEmail:\n", 
          "name": "Jeffrey H. Schwartz", 
          "roles": []
        }
      ], 
      "extra_info": "as co-executor of the Estate of Janet Jaffin", 
      "name": "Matthew Greenberg,  as co-executor of the Estate of Janet Jaffin", 
      "type": "Defendant"
    }, 
    {
      "attorneys": [
        {
          "contact": "Jaspan Schlesinger LLP\n300 Garden City Plaza, 5th Floor\nGarden City, NY 11530\n516-746-8000\nFax : 516-393-8282\nEmail:\n", 
          "name": "Jeffrey H. Schwartz", 
          "roles": []
        }
      ], 
      "extra_info": "as co-executor of the Estate of Janet Jaffin", 
      "name": "Lois Levine,  as co-executor of the Estate of Janet Jaffin", 
      "type": "Defendant"
    }, 
    {
      "attorneys": [], 
      "extra_info": "", 
      "name": "Gloria Kurzrok", 
      "type": "Counter-Claimant"
    }, 
    {
      "attorneys": [
        {
          "contact": "Baker & Hostetler LLP\n45 Rockefeller Plaza\nNew York, NY 10111\n212.589.4200\nFax : 212.589.4201\nEmail:\n", 
          "name": "Oren Warshavsky", 
          "roles": []
        }
      ], 
      "extra_info": "", 
      "name": "Irving H. Picard, Trustee for the Liquidation of Bernard L. Madoff Investment Securities LLC, and Bernard L. Madoff", 
      "type": "Counter-Defendant"
    }, 
    {
      "attorneys": [], 
      "extra_info": "", 
      "name": "Morton Kurzrok", 
      "type": "Counter-Claimant"
    }, 
    {
      "attorneys": [
        {
          "contact": "Jaspan Schlesinger LLP\n300 Garden City Plaza, 5th Floor\nGarden City, NY 11530\n516-746-8000\nFax : 516-393-8282\nEmail:\n", 
          "name": "Jeffrey H. Schwartz", 
          "roles": []
        }
      ], 
      "extra_info": "", 
      "name": "Janet Jaffin Individually And in Her Capacity as Trustee of The Janet Jaffin Dispositive Trust", 
      "type": "Counter-Claimant"
    }, 
    {
      "attorneys": [
        {
          "contact": "Jaspan Schlesinger LLP\n300 Garden City Plaza, 5th Floor\nGarden City, NY 11530\n516-746-8000\nFax : 516-393-8282\nEmail:\n", 
          "name": "Jeffrey H. Schwartz", 
          "roles": []
        }
      ], 
      "extra_info": "", 
      "name": "Milton Cooper in His Capacity as Trustee of the Janet Jaffin Dispositive Trust", 
      "type": "Counter-Claimant"
    }
  ], 
  "referred_to_str": null
}