{
  "assigned_to_str": "Robert E. Gerber", 
  "case_name": "Duane Street Design Studio, LLC", 
  "cause": null, 
  "court_id": "nysb", 
  "date_converted": null, 
  "date_discharged": null, 
  "date_filed": "2010-01-05", 
  "date_terminated": null, 
  "demand": null, 
  "docket_entries": [
    {
      "date_filed": "2010-02-16", 
      "description": "Order Granting Motion for Joint Administration directing the procedural consolidation and joint administration of the chapter 11 case of Duane Street Design Studio, LLC, Case No. 10-10044(REG) an the chapter 7 case of Nili Lotan, Inc., Case No. 10-10042(REG).(Related Doc # 33 ) signed on 2/16/2010. (Blum, Helene) (Entered: 02/16/2010)", 
      "document_number": "34", 
      "pacer_doc_id": "show_doc.pl"
    }, 
    {
      "date_filed": "2010-02-16", 
      "description": "Joint Motion for Joint Administration of Chapter 11 Case of Duane Street Design Studio, LLC and Chapter 7 Case of Nili Lotan, Inc. filed by Erica R. Feynman on behalf of Duane Street Design Studio, LLC. (Feynman, Erica) (Entered: 02/16/2010)", 
      "document_number": "33", 
      "pacer_doc_id": "show_doc.pl"
    }, 
    {
      "date_filed": "2010-02-16", 
      "description": "Final Order Granting Use of Cash Collateral (Related Doc # 27 ) signed on 2/16/2010. (Blum, Helene) (Entered: 02/16/2010)", 
      "document_number": "32", 
      "pacer_doc_id": "show_doc.pl"
    }, 
    {
      "date_filed": "2010-02-09", 
      "description": "Interim Order signed on 2/9/2010 Authorizing the Debtor to Borrow Funds Pursuant to Section 364(b) of the Bankruptcy Code. (related document(s) 27 ) (Blum, Helene) (Entered: 02/09/2010)", 
      "document_number": "31", 
      "pacer_doc_id": "show_doc.pl"
    }, 
    {
      "date_filed": "2010-02-09", 
      "description": "Interim Order signed on 2/9/2010 Authorizing Use of Cash Collateral. (Blum, Helene) (Entered: 02/09/2010)", 
      "document_number": "30", 
      "pacer_doc_id": "show_doc.pl"
    }, 
    {
      "date_filed": "2010-02-04", 
      "description": "Affidavit (Supplemental) of Alan Yedin, CPA in Further Support of Debtor's Application to Approve Retention (related document(s) 28, 11 ) filed by Erica R. Feynman on behalf of Duane Street Design Studio, LLC. (Feynman, Erica) (Entered: 02/04/2010)", 
      "document_number": "29", 
      "pacer_doc_id": "show_doc.pl"
    }, 
    {
      "date_filed": "2010-02-04", 
      "description": "Amended Application to Employ Alan Yedin, CPA as Debtor's Accountant (related document(s) 11 ) filed by Erica R. Feynman on behalf of Duane Street Design Studio, LLC. (Feynman, Erica) (Entered: 02/04/2010)", 
      "document_number": "28", 
      "pacer_doc_id": "show_doc.pl"
    }, 
    {
      "date_filed": "2010-02-02", 
      "description": "Motion to Approve Debtor in Possession Financing Pursuant to Section 364(b) of the Bankruptcy Code with Exhibits filed by Erica R. Feynman on behalf of Duane Street Design Studio, LLC. (Feynman, Erica) (Entered: 02/02/2010)", 
      "document_number": "27", 
      "pacer_doc_id": "show_doc.pl"
    }, 
    {
      "date_filed": "2010-02-01", 
      "description": "Affidavit of Service of Notice of Deadline Requiring Filing of Proofs of Claim on or Before March 15, 2010 at 5:00 P.M. (EST) (related document(s) 25 ) filed by Erica R. Feynman on behalf of Duane Street Design Studio, LLC. (Feynman, Erica) (Entered: 02/01/2010)", 
      "document_number": "26", 
      "pacer_doc_id": "show_doc.pl"
    }, 
    {
      "date_filed": "2010-01-29", 
      "description": "Order Granting Motion to Set Last Day to File Proofs of Claim (Related Doc # 14 ) signed on 1/29/2010. (Blum, Helene) (Entered: 01/29/2010)", 
      "document_number": "25", 
      "pacer_doc_id": "show_doc.pl"
    }, 
    {
      "date_filed": "2010-01-28", 
      "description": "Order Granting Motion Authorizing Payment of Certain Pre-Petition Wages, Administrative Claim and other Related Relief (Related Doc # 6 ) signed on 1/28/2010. (Blum, Helene) (Entered: 01/28/2010)", 
      "document_number": "24", 
      "pacer_doc_id": "show_doc.pl"
    }, 
    {
      "date_filed": "2010-01-25", 
      "description": "Declaration of Kimberley R. Chapman in opposition to Debtor's (1) Notice of Presentment of Stipulation and Order Authorizing the Use of Cash Collateral by Debtor Pursuant to 11 U.S.C. \u00a7 363 (Doc #13); (2) Notice of Presentment of Order Establishing Deadline for Filing Proofs of Claim and Approving the Form and Manner of Notice Thereof (Doc. # 15); and (3) Notice of Presentment of Order (a) authorizing the debtor to pay and honor certain prepetition claims for wages, withholdings and deductions, (b) directing banks to receive, process, honor and pay all checks presented for payment and electronic payment requests relating to the foregoing and (c) authorizing payment of administrative expense claim of prepetition state court appointed receiver (Doc. # 17) (related document(s) 14 ) filed by Andrew T. Solomon on behalf of Joseph Moshkovsky. (Attachments: # 1 Exhibit 1# 2 Exhibit 2# 3 Exhibit 3# 4 Exhibit 4 Part 1# 5 Exhibit 4 Part 2# 6 Exhibit 4 Part 3# 7 Exhibit 4 Part 4# 8 Exhibit 4 Part 5# 9 Exhibit 5) (Solomon, Andrew) (Entered: 01/25/2010)", 
      "document_number": "23", 
      "pacer_doc_id": "show_doc.pl"
    }, 
    {
      "date_filed": "2010-01-25", 
      "description": "Omnibus Opposition Brief regarding (1) Notice of Presentment of Stipulation and Order Authorizing the Use of Cash Collateral by Debtor Pursuant to 11 U.S.C. \u00a7 363 (Doc. #13); (2) Notice of Presentment of Order Establishing Deadline for Filing Proofs of Claim and Approving the Form and Manner of Notice Thereof (Doc #15); and (3) Notice of Presentment of Order (a) authorizing the debtor to pay and honor certain prepetition claims for wages, withholdings and deductions, (b) directing banks to receive, process, honor and pay all checks presented for payment and electronic payment requests relating to the foregoing and (c) authorizing payment of administrative expense claim of prepetition state court appointed receiver (Doc #17) (related document(s) 14 ) filed by Andrew T. Solomon on behalf of Joseph Moshkovsky. (Solomon, Andrew) (Entered: 01/25/2010)", 
      "document_number": "22", 
      "pacer_doc_id": "show_doc.pl"
    }, 
    {
      "date_filed": "2010-01-25", 
      "description": "Case Management Order #1 signed on 1/25/2010. (Blum, Helene) (Entered: 01/25/2010)", 
      "document_number": "21", 
      "pacer_doc_id": "show_doc.pl"
    }, 
    {
      "date_filed": "2010-01-22", 
      "description": "Notice of Appearance and Request for Service of Papers filed by Jil Mazer-Marino on behalf of Chapter 7 Trustee for Nili Lotan, Inc.. (Mazer-Marino, Jil) (Entered: 01/22/2010)", 
      "document_number": "20", 
      "pacer_doc_id": "show_doc.pl"
    }, 
    {
      "date_filed": "2010-01-19", 
      "description": "Affidavit of Service (related document(s) 6, 17 ) filed by Erica R. Feynman on behalf of Duane Street Design Studio, LLC. (Feynman, Erica) (Entered: 01/19/2010)", 
      "document_number": "19", 
      "pacer_doc_id": "show_doc.pl"
    }, 
    {
      "date_filed": "2010-01-19", 
      "description": "Order Granting Application to Employ Rattet, Pasternak & Gordon-Oliver, LLP as Debtor's Counsel (Related Doc # 5 ) signed on 1/19/2010. (Blum, Helene) (Entered: 01/19/2010)", 
      "document_number": "18", 
      "pacer_doc_id": "show_doc.pl"
    }, 
    {
      "date_filed": "2010-01-15", 
      "description": "Notice of Presentment of Employee Wage Motion and Other Related Relief (related document(s) 6 ) filed by Erica R. Feynman on behalf of Duane Street Design Studio, LLC. with presentment to be held on 2/2/2010 at 12:00 PM at Courtroom 621 (REG) (Feynman, Erica) (Entered: 01/15/2010)", 
      "document_number": "17", 
      "pacer_doc_id": "show_doc.pl"
    }, 
    {
      "date_filed": "2010-01-15", 
      "description": "Affidavit of Service of Notice of Presentment and Proposed Stipulation and Order Authorizing Use of Cash Collateral (related document(s) 13 ) filed by Erica R. Feynman on behalf of Duane Street Design Studio, LLC. (Feynman, Erica) (Entered: 01/15/2010)", 
      "document_number": "16", 
      "pacer_doc_id": "show_doc.pl"
    }, 
    {
      "date_filed": "2010-01-15", 
      "description": "Notice of Presentment of Order Establishing Deadline for Filing Proofs of Claim and Approving the Form and Manner of Notice Thereof (related document(s) 14 ) filed by Erica R. Feynman on behalf of Duane Street Design Studio, LLC. with presentment to be held on 2/1/2010 at 12:00 PM at Courtroom 621 (REG) (Attachments: # 1 Affidavit of Service)(Feynman, Erica) (Entered: 01/15/2010)", 
      "document_number": "15", 
      "pacer_doc_id": "show_doc.pl"
    }, 
    {
      "date_filed": "2010-01-15", 
      "description": "Motion to Set Last Day to File Proofs of Claim filed by Erica R. Feynman on behalf of Duane Street Design Studio, LLC. (Attachments: # 1 Exhibit A - Proposed Order# 2 Exhibit B - Bar Date Notice) (Feynman, Erica) (Entered: 01/15/2010)", 
      "document_number": "14", 
      "pacer_doc_id": "show_doc.pl"
    }, 
    {
      "date_filed": "2010-01-14", 
      "description": "Notice of Presentment of Stipulation and Order Between the Debtor and Carole Godin and Zeev Lotan Authorizing the Use of Cash Collateral Pursuant to 11 U.S.C. Section 363 filed by Erica R. Feynman on behalf of Duane Street Design Studio, LLC. with presentment to be held on 2/1/2010 at 12:00 PM at Courtroom 621 (REG) Objections due by 1/25/2010, (Attachments: # 1 Proposed Stipulation and Order Authorizing Use of Cash Collateral# 2 Ex. A: Carole Godin Promissory Note, Security Agreement and UCC-1# 3 Ex. B: Zeev Lotan Promissory Note, Security Agreement and UCC-1 Financing Statement)(Feynman, Erica) (Entered: 01/14/2010)", 
      "document_number": "13", 
      "pacer_doc_id": "show_doc.pl"
    }, 
    {
      "date_filed": "2010-01-14", 
      "description": "Schedules filed: Schedule A, Schedule B, Schedule C, Schedule D, Schedule E, Schedule F, Schedule G, Schedule H, Statement of Financial Affairs, Rule 2016 Statement filed by Erica R. Feynman on behalf of Duane Street Design Studio, LLC. (Feynman, Erica) (Entered: 01/14/2010)", 
      "document_number": "12", 
      "pacer_doc_id": "show_doc.pl"
    }, 
    {
      "date_filed": "2010-01-14", 
      "description": "Application to Employ Alan M. Yedin CPA as Debtor's Accountant filed by Erica R. Feynman on behalf of Duane Street Design Studio, LLC. (Attachments: # 1 Affidavit of Alan M. Yedin, CPA# 2 Proposed Order) (Feynman, Erica) (Entered: 01/14/2010)", 
      "document_number": "11", 
      "pacer_doc_id": "show_doc.pl"
    }, 
    {
      "date_filed": "2010-01-14", 
      "description": "Notice of 341(a) Meeting of Creditors with Certificate of Mailing. (related document(s) (Related Doc # 9 )) . Service Date 01/13/2010. (Admin.) (Entered: 01/14/2010)", 
      "document_number": "10", 
      "pacer_doc_id": "show_doc.pl"
    }, 
    {
      "date_filed": "2010-01-11", 
      "description": "Request for 341(a) Notice with 341(a) meeting to be held on 2/9/2010 at 02:30 PM at 80 Broad St., 4th Floor, USTM. (Suarez, Aurea). (Entered: 01/11/2010)", 
      "document_number": "9", 
      "pacer_doc_id": "show_doc.pl"
    }, 
    {
      "date_filed": "2010-01-11", 
      "description": "Affidavit of Service of Order Scheduling Initial Case Conference (related document(s) 7 ) filed by Erica R. Feynman on behalf of Duane Street Design Studio, LLC. (Feynman, Erica) (Entered: 01/11/2010)", 
      "document_number": "8", 
      "pacer_doc_id": "show_doc.pl"
    }, 
    {
      "date_filed": "2010-01-11", 
      "description": "Order signed on 1/11/2010 Scheduling Initial Case Conference with hearing to be held on 1/28/2010 at 09:45 AM at Courtroom 621 (REG) (Blum, Helene) (Entered: 01/11/2010)", 
      "document_number": "7", 
      "pacer_doc_id": "show_doc.pl"
    }, 
    {
      "date_filed": "2010-01-08", 
      "description": "Motion to Authorize Payment of Certain Pre-Petition Wages, Administrative Claim and other Related Relief filed by Erica R. Feynman on behalf of Duane Street Design Studio, LLC. (Attachments: # 1 Ex A: Proposed Order# 2 Ex B: Receiver Invoice) (Feynman, Erica) (Entered: 01/08/2010)", 
      "document_number": "6", 
      "pacer_doc_id": "show_doc.pl"
    }, 
    {
      "date_filed": "2010-01-08", 
      "description": "Application to Employ Rattet, Pasternak & Gordon-Oliver, LLP as Debtor's Counsel filed by Erica R. Feynman on behalf of Duane Street Design Studio, LLC. (Attachments: # 1 Affidavit of Jonathan S. Pasternak) (Feynman, Erica) (Entered: 01/08/2010)", 
      "document_number": "5", 
      "pacer_doc_id": "show_doc.pl"
    }, 
    {
      "date_filed": "2010-01-06", 
      "description": "Amended Voluntary Petition.to Reflect Pending Bankruptcy Case Filed by Affiliate of Debtor filed by Erica R. Feynman on behalf of Duane Street Design Studio, LLC. (Feynman, Erica) (Entered: 01/06/2010)", 
      "document_number": "4", 
      "pacer_doc_id": "show_doc.pl"
    }, 
    {
      "date_filed": "2010-01-05", 
      "description": "Letter / Membership Resolution filed by Erica R. Feynman on behalf of Duane Street Design Studio, LLC. (Feynman, Erica) (Entered: 01/05/2010)", 
      "document_number": "3", 
      "pacer_doc_id": "show_doc.pl"
    }, 
    {
      "date_filed": "2010-01-05", 
      "description": "Affidavit of Nili Lotan pursuant to Local Bankruptcy Rule 1007-2 filed by Erica R. Feynman on behalf of Duane Street Design Studio, LLC. (Feynman, Erica) (Entered: 01/05/2010)", 
      "document_number": "2", 
      "pacer_doc_id": "show_doc.pl"
    }, 
    {
      "date_filed": "2010-01-05", 
      "description": "Voluntary Petition (Chapter 11). Order for Relief Entered. Schedule A due 1/19/2010. Schedule B due 1/19/2010. Schedule D due 1/19/2010. Schedule E due 1/19/2010. Schedule F due 1/19/2010. Schedule G due 1/19/2010. Schedule H due 1/19/2010. Summary of schedules - Page 1 due 1/19/2010. Statement of Financial Affairs due 1/19/2010. Atty Disclosure State. due 1/19/2010. Incomplete Filings due by 1/19/2010, Small Business Chapter 11 Plan due by 11/1/2010, Filed by Jonathan S. Pasternak of Rattet, Pasternak & Gordon Oliver, LLP on behalf of Duane Street Design Studio, LLC. (Pasternak, Jonathan) (Entered: 01/05/2010)", 
      "document_number": "1", 
      "pacer_doc_id": "show_doc.pl"
    }
  ], 
  "docket_number": "10-10044", 
  "jurisdiction": null, 
  "jury_demand": null, 
  "nature_of_suit": null, 
  "parties": [
    {
      "attorneys": [
        {
          "contact": "Rattet, Pasternak & Gordon-Oliver, LLP\n550 Mamaroneck Avenue\nHarrison, NY 10528\n(914) 381-7400\nFax : (914) 381-7406\nEmail: efeynman@rattetlaw.com\n", 
          "name": "Erica R. Feynman", 
          "roles": []
        }, 
        {
          "contact": "Rattet, Pasternak & Gordon Oliver, LLP\n550 Mamaroneck Avenue\nSuite 510\nHarrison, NY 10528\n(914) 381-7400\nFax : (914) 381-7406\nEmail: jsp@rattetlaw.com\n", 
          "name": "Jonathan S. Pasternak", 
          "roles": []
        }
      ], 
      "extra_info": "188 Duane Street\nNew York, NY 10013\nTax ID / EIN: 26-4805067", 
      "name": "Duane Street Design Studio, LLC", 
      "type": "Debtor"
    }, 
    {
      "attorneys": [], 
      "extra_info": "33 Whitehall Street\n21st Floor\nNew York, NY 10004\n(212) 510-0500", 
      "name": "United States Trustee", 
      "type": "U.S. Trustee"
    }
  ], 
  "referred_to_str": null
}