{
  "assigned_to_str": "Thomas P. Agresti", 
  "case_name": "Thayer Power and Communication Line Construction Company, Inc.", 
  "cause": null, 
  "court_id": "pawb", 
  "date_converted": null, 
  "date_discharged": null, 
  "date_filed": "2008-10-04", 
  "date_terminated": null, 
  "demand": null, 
  "docket_entries": [
    {
      "date_filed": "2010-02-11", 
      "description": "Response to the Objection of National Electrical Annuity Plan and National Electrical Benefit Fund to Debtor's Motion for Approval of Sale of Assets and Related Relief [Docket No. 302] Regarding the Hearing on 02/12/2010. Filed by Sargent Electric Company (RE: related document(s): 302 Motion to Sell Property Free and Clear of Liens filed by Debtor Thayer Power and Communication Line Construction Company, Inc., 393 Objection filed by Creditor National Electrical Benefit Fund, Creditor National Electrical Annuity Plan). (Attachments: # 1 Certificate of Service) (Lampl, David) (Entered: 02/11/2010)", 
      "document_number": "397", 
      "pacer_doc_id": "show_doc.pl"
    }, 
    {
      "date_filed": "2010-02-11", 
      "description": "Response of the Official Committee of Unsecured Creditors to the Debtor's Motion for Sale of Personal Property Regarding the Hearing on 02/12/10. Filed by Official Committee of Unsecured Creditors of Thayer Power & Communication Line Construction Co., Inc. (RE: related document(s): 302 Motion to Sell Property Free and Clear of Liens filed by Debtor Thayer Power and Communication Line Construction Company, Inc.). (Fustine, Guy) (Entered: 02/11/2010)", 
      "document_number": "396", 
      "pacer_doc_id": "show_doc.pl"
    }, 
    {
      "date_filed": "2010-02-11", 
      "description": "Certificate of Service via First Class Mail and Email Filed by Creditor Anderson Group, LLC (RE: related document(s): 394 Notice filed by Creditor Anderson Group, LLC). (Greenfield, Harry) (Entered: 02/11/2010)", 
      "document_number": "395", 
      "pacer_doc_id": "show_doc.pl"
    }, 
    {
      "date_filed": "2010-02-11", 
      "description": "Notice Regarding /Notice of the Stalking Horse Bidder Regarding (A) Cure Payment Terms Between Certain Unions and the Stalking Horse Bidder and (B) Proposed Acquisition of Additional Equipment. Filed by Creditor Anderson Group, LLC (RE: related document(s): 337 Order on Application for Approval). (Attachments: # 1 Attachment 1# 2 Attachment 2) (Greenfield, Harry) 302 Modified on 2/12/2010 (pbar). (Entered: 02/11/2010)", 
      "document_number": "394", 
      "pacer_doc_id": "show_doc.pl"
    }, 
    {
      "date_filed": "2010-02-11", 
      "description": "Objection to Debtor's Motion for Approval of Sale of Assets and Related Relief Regarding the Hearing on 02/12/2010. Filed by National Electrical Annuity Plan, National Electrical Benefit Fund (RE: related document(s): 302 Motion to Sell Property Free and Clear of Liens filed by Debtor Thayer Power and Communication Line Construction Company, Inc., 337 Order on Application for Approval, 377 Order Scheduling a Hearing). (Skiba, Gary) (Entered: 02/11/2010)", 
      "document_number": "393", 
      "pacer_doc_id": "show_doc.pl"
    }, 
    {
      "date_filed": "2010-02-10", 
      "description": "Certificate of Service Regarding the Hearing on 3/18/2010. Filed by Debtor Thayer Power and Communication Line Construction Company, Inc. (RE: related document(s): 389 Motion to Extend Time filed by Debtor Thayer Power and Communication Line Construction Company, Inc., 390 Order Scheduling a Hearing). (Bolla, Lawrence) (Entered: 02/10/2010)", 
      "document_number": "392", 
      "pacer_doc_id": "show_doc.pl"
    }, 
    {
      "date_filed": "2010-02-09", 
      "description": "Monthly Financial Report for Filing Period December, 2009 Filed by Debtor Thayer Power and Communication Line Construction Company, Inc. (Bolla, Lawrence) (Entered: 02/09/2010)", 
      "document_number": "391", 
      "pacer_doc_id": "show_doc.pl"
    }, 
    {
      "date_filed": "2010-02-09", 
      "description": "Order Scheduling a Hearing on (RE: related document(s): 389 Fifth Motion to Extend Time Exclusivity Periods Pursuant to 11 U.S.C Section 1121(d) filed by Debtor Thayer Power and Communication Line Construction Company, Inc.). Hearing scheduled for 3/18/2010 at 01:30 PM at Bankruptcy Courtroom, U.S. Courthouse, 17 South Park Row, Erie. Responses due by 3/11/2010. (avay) (Entered: 02/09/2010)", 
      "document_number": "390", 
      "pacer_doc_id": "show_doc.pl"
    }, 
    {
      "date_filed": "2010-02-05", 
      "description": "Fifth Motion to Extend Time Exclusivity Periods Pursuant to 11 U.S.C Section 1121(d) Filed by Debtor Thayer Power and Communication Line Construction Company, Inc.. (Attachments: # 1 Proposed Order) (Pagliari, Nicholas) (Entered: 02/05/2010)", 
      "document_number": "389", 
      "pacer_doc_id": "show_doc.pl"
    }, 
    {
      "date_filed": "2010-02-04", 
      "description": "Notice of Appearance and Request for Notice of Service of Papers by Neil J. Gregorio Filed by Creditor Western Pennsylvania Electrical Employees Benefit Funds (Gregorio, Neil) (Entered: 02/04/2010)", 
      "document_number": "388", 
      "pacer_doc_id": "show_doc.pl"
    }, 
    {
      "date_filed": "2010-02-03", 
      "description": "Receipt Number 02031, Fee Amount $ 150.00 (RE: related document(s): 363 Order Requiring Payment of Processing Fee and Sanction). (vkna) (Entered: 02/03/2010)", 
      "document_number": "387", 
      "pacer_doc_id": null
    }, 
    {
      "date_filed": "2010-02-02", 
      "description": "Proof of Publication of Notice of Sale Filed by Debtor Thayer Power and Communication Line Construction Company, Inc. (RE: related document(s): 302 Motion to Sell Property Free and Clear of Liens filed by Debtor Thayer Power and Communication Line Construction Company, Inc., 338 Order Scheduling a Hearing, 377 Order Scheduling a Hearing). (Bolla, Lawrence) (Entered: 02/02/2010)", 
      "document_number": "386", 
      "pacer_doc_id": "show_doc.pl"
    }, 
    {
      "date_filed": "2010-02-02", 
      "description": "Certificate of Service regarding Exhibit to Schedule 1.1(e) of the Stalking Horse Asset Purchase Agreement Regarding the Hearing on 2/12/2010. Filed by Debtor Thayer Power and Communication Line Construction Company, Inc. (RE: related document(s): 382 Exhibit filed by Debtor Thayer Power and Communication Line Construction Company, Inc.). (Pagliari, Nicholas) (Entered: 02/02/2010)", 
      "document_number": "385", 
      "pacer_doc_id": "show_doc.pl"
    }, 
    {
      "date_filed": "2010-02-01", 
      "description": "Certificate of Service via First Class Mail and Email Filed by Creditor Anderson Group, LLC (RE: related document(s): 383 Notice filed by Creditor Anderson Group, LLC). (Greenfield, Harry) (Entered: 02/01/2010)", 
      "document_number": "384", 
      "pacer_doc_id": "show_doc.pl"
    }, 
    {
      "date_filed": "2010-02-01", 
      "description": "Notice Regarding The Stalking Horse Bidder Regarding Cure Payment Terms Between Certain Unions and the Stalking Horse Bidder. Filed by Creditor Anderson Group, LLC (RE: related document(s): 337 Order on Application for Approval). (Attachments: # 1 Exhibit A) (Greenfield, Harry) 302 Modified on 2/2/2010 (pbar). (Entered: 02/01/2010)", 
      "document_number": "383", 
      "pacer_doc_id": "show_doc.pl"
    }, 
    {
      "date_filed": "2010-02-01", 
      "description": "Exhibit to Schedule 1.1(e) of the Stalking Horse Asset Purchase Agreement Filed by Debtor Thayer Power and Communication Line Construction Company, Inc. (RE: related document(s): 302 Motion to Sell Property Free and Clear of Liens filed by Debtor Thayer Power and Communication Line Construction Company, Inc., 337 Order on Application for Approval, 377 Order Scheduling a Hearing). (Attachments: # 1 Exhibit) (Pagliari, Nicholas) (Entered: 02/01/2010)", 
      "document_number": "382", 
      "pacer_doc_id": "show_doc.pl"
    }, 
    {
      "date_filed": "2010-02-01", 
      "description": "Response Regarding the Hearing on 2/4/10. Filed by GMAC (RE: related document(s): 302 Motion to Sell Property Free and Clear of Liens filed by Debtor Thayer Power and Communication Line Construction Company, Inc.). (Attachments: # 1 Proposed Order # 2 Certificate of Service) (Sanders, Russell) (Entered: 02/01/2010)", 
      "document_number": "381", 
      "pacer_doc_id": "show_doc.pl"
    }, 
    {
      "date_filed": "2010-02-01", 
      "description": "Certificate of Service of Order Approving Amended Emergency Motion to (A) Compel the Production of Certain Due Diligence Material; (B) Modify Order Approving (I) Bidding Procedures; (II) Break-Up Fee Related to the Sale of Substantially All of the Debtor's Personal Property; And (III) Form and Manner of Sale Notice Regarding the Hearing on 2/12/2010. Filed by Interested Party Sargent Electric Company (RE: related document(s): 377 Order Scheduling a Hearing). (Lampl, David) (Entered: 02/01/2010)", 
      "document_number": "380", 
      "pacer_doc_id": "show_doc.pl"
    }, 
    {
      "date_filed": "2010-01-31", 
      "description": "BNC Certificate of Mailing - PDF Document. (RE: related document(s): 378 Hearing (Bk) Rescheduled). Service Date 01/31/2010. (Admin.) (Entered: 02/01/2010)", 
      "document_number": "379", 
      "pacer_doc_id": "show_doc.pl"
    }, 
    {
      "date_filed": "2010-01-29", 
      "description": "Order Rescheduling Hearing from 2/4/2010 (RE: related document(s): 343 Motion to Establish Cure Amounts for Executory Contracts and Unexpired Leases filed by Debtor Thayer Power and Communication Line Construction Company, Inc.). Hearing scheduled for 2/12/2010 at 02:00 PM at Bankruptcy Courtroom, U.S. Courthouse, 17 South Park Row, Erie. (avay) (Entered: 01/29/2010)", 
      "document_number": "378", 
      "pacer_doc_id": "show_doc.pl"
    }, 
    {
      "date_filed": "2010-01-28", 
      "description": "Order approving amended emergency motion to (a) compelThe production of certain due diligence material; (b)Modify order approving (i) bidding procedures; (ii) break-upFee related to the sale of substantially all of debtorsPersonal property; and (iii) form and manner of sale notice 350 : Order Scheduling a Hearing on (RE: related document(s): 302 Motion to Sell Property Free and Clear of Liens filed by Debtor Thayer Power and Communication Line Construction Company, Inc.). Hearing scheduled for 2/12/2010 at 02:00 PM at Bankruptcy Courtroom, U.S. Courthouse, 17 South Park Row, Erie. Responses due by 2/11/2010. (avay) (Entered: 01/29/2010)", 
      "document_number": "377", 
      "pacer_doc_id": "show_doc.pl"
    }, 
    {
      "date_filed": "2010-01-28", 
      "description": "Verified Statement Required by F.R.B.P. 2019 Filed by Creditor GMAC (Attachments: # 1 Certificate of Service) (Sanders, Russell) (Entered: 01/28/2010)", 
      "document_number": "376", 
      "pacer_doc_id": "show_doc.pl"
    }, 
    {
      "date_filed": "2010-01-28", 
      "description": "Notice of Filing of Transcript. Notice is hereby given that a transcript of the hearing held on 12/17/2009 on EXPEDITED MOTION FOR ORDER APPROVING (I) BIDDING PROCEDURES; (II) BREAK-UP FEE RELATED TO THE SALE OF SUBSTANTIALLY ALL OF DEBTORS PERSONAL PROPERTY; AND (III) FORM AND MANNER OF SALE NOTICE has been filed. Transcripts are available for inspection only at the Clerk's Office or may be purchased from the Court Transcriber during the 90 day restriction period. (RE: related document(s): 374 Transcript). (avay) (Entered: 01/28/2010)", 
      "document_number": "375", 
      "pacer_doc_id": "show_doc.pl"
    }, 
    {
      "date_filed": "2010-01-27", 
      "description": "Certified Transcript regarding Hearing Held 12/17/2009. The transcript may be viewed at the Bankruptcy Court Clerk's Office. For information about how to contact the transcriber, call the Clerk's Office or contact the Court Reporter/Transcriber Carol Holdnack, Telephone number 452-4556. (RE: related document(s) 336 Hearing Held). Notice of Intent to Request Redaction due 2/8/2010. Redaction Request due 2/17/2010. Redacted Transcript Submission due 3/1/2010. Remote electronic access to the transcript is restricted through 4/27/2010. (avay) (Entered: 01/28/2010)", 
      "document_number": "374", 
      "pacer_doc_id": "show_doc.pl"
    }, 
    {
      "date_filed": "2010-01-27", 
      "description": "Proposed Order RE: Amended Emergency Motion to (A) Compel the Production of Certain Due Diligence Material; (B) Modify Order Approving (I) Bidding Procedures; (II) Break-Up Fee Related to the Sale of Substantially All of the Debtors Personal Property; And (III) Form and Manner of Sale Notice Filed by Interested Party Sargent Electric Company (RE: related document(s): 337 Order on Application for Approval, 349 Motion to Compel filed by Interested Party Sargent Electric Company). (Lampl, David) 350 Modified on 1/28/2010 (pbar). (Entered: 01/27/2010)", 
      "document_number": "373", 
      "pacer_doc_id": "show_doc.pl"
    }, 
    {
      "date_filed": "2010-01-27", 
      "description": "Notice Regarding Notice of Extent of Claims. Refiled per corrective entry received on 1/27/10. Filed by Creditor I.B.E.W. Local 56 (RE: related document(s): 337 Order on Application for Approval). (Attachments: # 1 Exhibit 1) (Myers, Thomas) 343 Modified on 1/29/2010 (pbar). (Entered: 01/27/2010)", 
      "document_number": "372", 
      "pacer_doc_id": "show_doc.pl"
    }, 
    {
      "date_filed": "2010-01-26", 
      "description": "Notice Regarding Contributions. Filed by Creditor I.B.E.W. Local 56 (RE: related document(s): 337 Order on Application for Approval). (Thompson, Tony) 343 Modified on 1/29/2010 (pbar). (Entered: 01/26/2010)", 
      "document_number": "370", 
      "pacer_doc_id": "show_doc.pl"
    }, 
    {
      "date_filed": "2010-01-26", 
      "description": "CORRECTIVE ENTRY: ALL DOCUMENTS FILED ELECTRONICALLY THAT HAVE BEEN CREATED, AUTHORED, OR CUSTOMIZED BY THE ELECTRONIC FILER MUST BE FILED IN A FORMAT THAT ALLOWS THE COURT TO PERFORM A FULL TEXT SEARCH IN ACCORDANCE WITH ECF PROCEDURE #13. FOR INSTRUCTIONS ON CREATING A PDF IN THE PROPER FORMAT, YOU MAY REFER TO THE ONLINE ATTORNEY TRAINING MANUAL ON THE COURT'S WEBSITE. THIS DOCUMENT MUST BE REFILED. (RE: related document(s): 366 Notice filed by Creditor I.B.E.W. Local 56). (avay) (Entered: 01/26/2010)", 
      "document_number": "369", 
      "pacer_doc_id": null
    }, 
    {
      "date_filed": "2010-01-25", 
      "description": "Hearing Held (RE: related document(s): 350 Motion to Compel the Production of Certain Due Diligence Material; (B) Modify Order Approving (I) Bidding Procedures; (II) Break-Up Fee Realted to the Sale of Substantially all of the Debtor's Personal Property; and (III) Form and Manner of Sale Notice; or (C) In the Alternative, Seek the Appointment of a Chapter 11 Trustee filed by Interested Party Sargent Electric Company). (Parties to submit proposed order reflecting the agreement stated in Court) (avay) (Entered: 01/26/2010)", 
      "document_number": "371", 
      "pacer_doc_id": "show_doc.pl"
    }, 
    {
      "date_filed": "2010-01-25", 
      "description": "Notice Regarding Contributions. Filed by Creditor I.B.E.W. Local 56 (RE: related document(s): 337 Order on Application for Approval). (Thompson, Tony) DUPLICATE FILED AT DOCUMENT NO. 370 Modified on 1/26/2010 (avay). Modified on 1/27/2010 (avay). (Entered: 01/25/2010)", 
      "document_number": "368", 
      "pacer_doc_id": "show_doc.pl"
    }, 
    {
      "date_filed": "2010-01-25", 
      "description": "Notice of Appearance and Request for Notice by Tony J. Thompson Filed by Creditor I.B.E.W. Local 56 (Thompson, Tony) (Entered: 01/25/2010)", 
      "document_number": "367", 
      "pacer_doc_id": "show_doc.pl"
    }, 
    {
      "date_filed": "2010-01-25", 
      "description": "Notice Regarding Notice of Extent of Claims. Filed by Creditor I.B.E.W. Local 56 (RE: related document(s): 337 Order on Application for Approval). (Attachments: # 1 Exhibit 1) (Myers, Thomas) CORRECTIVE ENTRY: ALL DOCUMENTS FILED ELECTRONICALLY THAT HAVE BEEN CREATED, AUTHORED, OR CUSTOMIZED BY THE ELECTRONIC FILER MUST BE FILED IN A FORMAT THAT ALLOWS THE COURT TO PERFORM A FULL TEXT SEARCH IN ACCORDANCE WITH ECF PROCEDURE #13. FOR INSTRUCTIONS ON CREATING A PDF IN THE PROPER FORMAT, YOU MAY REFER TO THE ONLINE ATTORNEY TRAINING MANUAL ON THE COURT'S WEBSITE. THIS DOCUMENT MUST BE REFILED.Modified on 1/26/2010 (avay). 343 Modified on 1/29/2010 (pbar). (Entered: 01/25/2010)", 
      "document_number": "366", 
      "pacer_doc_id": "show_doc.pl"
    }, 
    {
      "date_filed": "2010-01-25", 
      "description": "Notice of Appearance and Request for Notice by Michael J. Healey Filed by Creditor IBEW Local Union No. 71 (Healey, Michael) (Entered: 01/25/2010)", 
      "document_number": "365", 
      "pacer_doc_id": "show_doc.pl"
    }, 
    {
      "date_filed": "2010-01-25", 
      "description": "Objection to Omnibus Mtion to Establish Cure Amounts for Executory Contracts and Unexpired Leases Regarding the Hearing on 02/04/2010. Filed by National Electrical Annuity Plan, National Electrical Benefit Fund (RE: related document(s): 302 Motion to Sell Property Free and Clear of Liens filed by Debtor Thayer Power and Communication Line Construction Company, Inc., 337 Order on Application for Approval, 343 Motion filed by Debtor Thayer Power and Communication Line Construction Company, Inc.). (Skiba, Gary) (Entered: 01/25/2010)", 
      "document_number": "364", 
      "pacer_doc_id": "show_doc.pl"
    }, 
    {
      "date_filed": "2010-01-25", 
      "description": "Order Requiring Payment of Processing Fee and Sanction of Attorney Robert F. Henninger Signed on 1/25/2010 (RE: related document(s): 362 Notice filed by Robert F. Henninger, Esq. on behalf of Creditor IBEW Local No. 126). (avay) (Entered: 01/25/2010)", 
      "document_number": "363", 
      "pacer_doc_id": "show_doc.pl"
    }, 
    {
      "date_filed": "2010-01-25", 
      "description": "Notice Regarding Notice Of Cure Amounts. Filed by Creditor IBEW Local No. 126 (RE: related document(s): 343 Motion filed by Debtor Thayer Power and Communication Line Construction Company, Inc., 344 Notice filed by Debtor Thayer Power and Communication Line Construction Company, Inc.). (Filed by Robert F. Henninger, Esq.) (avay) (Entered: 01/25/2010)", 
      "document_number": "362", 
      "pacer_doc_id": "show_doc.pl"
    }, 
    {
      "date_filed": "2010-01-25", 
      "description": "Objection of Altec Capital Services, LLC to the Debtors' Omnibus Motion to Establish Cure Amounts for Executory Contracts and Unexpired Leases Regarding the Hearing on 02/04/10. Filed by Altec Capital Services, LLC (RE: related document(s): 302 Motion to Sell Property Free and Clear of Liens filed by Debtor Thayer Power and Communication Line Construction Company, Inc., 337 Order on Application for Approval, 343 Motion filed by Debtor Thayer Power and Communication Line Construction Company, Inc.). (Walker, Joel) Modified on 1/28/2010 (jmar). (Entered: 01/25/2010)", 
      "document_number": "361", 
      "pacer_doc_id": "show_doc.pl"
    }, 
    {
      "date_filed": "2010-01-25", 
      "description": "CORRECTIVE ENTRY: ALL DOCUMENTS FILED ELECTRONICALLY THAT HAVE BEEN CREATED, AUTHORED, OR CUSTOMIZED BY THE ELECTRONIC FILER MUST BE FILED IN A FORMAT THAT ALLOWS THE COURT TO PERFORM A FULL TEXT SEARCH IN ACCORDANCE WITH ECF PROCEDURE #13. FOR INSTRUCTIONS ON CREATING A PDF IN THE PROPER FORMAT, YOU MAY REFER TO THE ONLINE ATTORNEY TRAINING MANUAL ON THE COURT'S WEBSITE. THIS DOCUMENT MUST BE REFILED. (RE: related document(s): 359 Objection filed by Respondent Altec Capital Services, LLC). (avay) (Entered: 01/25/2010)", 
      "document_number": "360", 
      "pacer_doc_id": null
    }, 
    {
      "date_filed": "2010-01-22", 
      "description": "Objection Regarding the Hearing on 02/04/10. Filed by Altec Capital Services, LLC (RE: related document(s): 302 Motion to Sell Property Free and Clear of Liens filed by Debtor Thayer Power and Communication Line Construction Company, Inc., 337 Order on Application for Approval, 343 Motion filed by Debtor Thayer Power and Communication Line Construction Company, Inc.). (Walker, Joel) CORRECTIVE ENTRY: ALL DOCUMENTS FILED ELECTRONICALLY THAT HAVE BEEN CREATED, AUTHORED, OR CUSTOMIZED BY THE ELECTRONIC FILER MUST BE FILED IN A FORMAT THAT ALLOWS THE COURT TO PERFORM A FULL TEXT SEARCH IN ACCORDANCE WITH ECF PROCEDURE #13. FOR INSTRUCTIONS ON CREATING A PDF IN THE PROPER FORMAT, YOU MAY REFER TO THE ONLINE ATTORNEY TRAINING MANUAL ON THE COURT'S WEBSITE. THIS DOCUMENT MUST BE REFILED. Modified on 1/25/2010 (avay). (Entered: 01/22/2010)", 
      "document_number": "359", 
      "pacer_doc_id": "show_doc.pl"
    }, 
    {
      "date_filed": "2010-01-22", 
      "description": "Response to Amended Emergency Motion to Compel Regarding the Hearing on 1/25/2010. Filed by Thayer Power and Communication Line Construction Company, Inc. (RE: related document(s): 350 Motion to Compel filed by Interested Party Sargent Electric Company, 352 Hearing (Bk) Rescheduled). (Bolla, Lawrence) (Entered: 01/22/2010)", 
      "document_number": "358", 
      "pacer_doc_id": "show_doc.pl"
    }, 
    {
      "date_filed": "2010-01-22", 
      "description": "Certificate of Service of Amended Order Scheduling Date for a Response and Hearing on Amended Emergency Motion to (A) Compel the Production of Certain Due Diligence Material (B) Modify Order Approving (I) Bidding Procedures; (II) Break-Up Fee Related to the Sale of Substantially all of the Debtors Personal Property; and (III) Form and Manner of Sale Notice; or (C) In the Alternative, Seek the Appointment of a Chapter 11 Trustee; and Amended Emergency Motion to (A) Compel the Production of Certain Due Diligence Material (B) Modify Order Approving (I) Bidding Procedures; (II) Break-Up Fee Related to the Sale of Substantially all of the Debtors Personal Property; and (III) Form and Manner of Sale Notice; or (C) In the Alternative, Seek the Appointment of a Chapter 11 Trustee Regarding the Hearing on 1/25/2010. Filed by Interested Party Sargent Electric Company (RE: related document(s): 350 Motion to Compel filed by Interested Party Sargent Electric Company, 352 Hearing (Bk) Rescheduled, 354 Corrective Entry). (Lampl, David) (Entered: 01/22/2010)", 
      "document_number": "357", 
      "pacer_doc_id": "show_doc.pl"
    }, 
    {
      "date_filed": "2010-01-21", 
      "description": "Certificate of Service of Response of the Official Committee of Unsecured Creditors to Sargent Electric Company's Amended Motion to Compel Regarding the Hearing on 1/22/2010. Filed by Creditor Committee Official Committee of Unsecured Creditors of Thayer Power & Communication Line Construction Co., Inc. (RE: related document(s): 350 Motion to Compel filed by Interested Party Sargent Electric Company, 355 Response filed by Creditor Committee Official Committee of Unsecured Creditors of Thayer Power & Communication Line Construction Co., Inc.). (Gula, Joseph) (Entered: 01/21/2010)", 
      "document_number": "356", 
      "pacer_doc_id": "show_doc.pl"
    }, 
    {
      "date_filed": "2010-01-21", 
      "description": "Response of the Official Committee of Unsecured Creditors to Sargent Electric Company's Amended Motion to Compel Regarding the Hearing on 01/22/10. Filed by Official Committee of Unsecured Creditors of Thayer Power & Communication Line Construction Co., Inc. (RE: related document(s): 350 Motion to Compel filed by Interested Party Sargent Electric Company). (Attachments: # 1 Proposed Order) (Gula, Joseph) (Entered: 01/21/2010)", 
      "document_number": "355", 
      "pacer_doc_id": "show_doc.pl"
    }, 
    {
      "date_filed": "2010-01-21", 
      "description": "CORRECTIVE ENTRY: ALL DOCUMENTS MUST BE FILED IN A FORMAT THAT ALLOWS THE COURT TO PERFORM A FULL TEXT SEARCH IN ACCORDANCE WITH ECF PROCEDURE #13. FOR INSTRUCTIONS ON CREATING A PDF IN THE PROPER FORMAT, YOU MAY REFER TO THE ONLINE ATTORNEY TRAINING MANUAL ON THE COURT'S WEBSITE. THIS DOCUMENT MUST BE REFILED. ALSO, A COMPLETE CAPTION, LISTING DEBTORS, MOVANTS AND RESPONDENTS, IS REQUIRED ON ALL DOCUMENTS. (RE: related document(s): 353 Certificate of Service filed by Interested Party Sargent Electric Company). (avay) (Entered: 01/21/2010)", 
      "document_number": "354", 
      "pacer_doc_id": null
    }, 
    {
      "date_filed": "2010-01-20", 
      "description": "Certificate of Service Amended Order Scheduling Date for a Response and Hearing on Amended Emergency Motion to (A) Compel the Production of Certain Due Diligence Material (B) Modify Order Approving (I) Bidding Procedures; (II) Break-Up Fee Related to the Sale of Substantially all of the Debtors Personal Property; and (III) Form and Manner of Sale Notice; or (C) In the Alternative, Seek the Appointment of a Chapter 11 Trustee and Amended Emergency Motion to (A) Compel the Production of Certain Due Diligence Material (B) Modify Order Approving (I) Bidding Procedures; (II) Break-Up Fee Related to the Sale of Substantially all of the Debtors Personal Property; and (III) Form and Manner of Sale Notice; or (C) In the Alternative, Seek the Appointment of a Chapter 11 Trustee Regarding the Hearing on 1/25/2010. Filed by Interested Party Sargent Electric Company (RE: related document(s): 350 Motion to Compel filed by Interested Party Sargent Electric Company, 352 Hearing (Bk) Rescheduled). (Lampl, David) CORRECTIVE ENTRY: ALL DOCUMENTS MUST BE FILED IN A FORMAT THAT ALLOWS THE COURT TO PERFORM A FULL TEXT SEARCH IN ACCORDANCE WITH ECF PROCEDURE #13. FOR INSTRUCTIONS ON CREATING A PDF IN THE PROPER FORMAT, YOU MAY REFER TO THE ONLINE ATTORNEY TRAINING MANUAL ON THE COURT'S WEBSITE. THIS DOCUMENT MUST BE REFILED. ALSO, A COMPLETE CAPTION, LISTING DEBTORS, MOVANTS AND RESPONDENTS, IS REQUIRED ON ALL DOCUMENTS. Modified on 1/21/2010 (avay). (Entered: 01/20/2010)", 
      "document_number": "353", 
      "pacer_doc_id": "show_doc.pl"
    }, 
    {
      "date_filed": "2010-01-20", 
      "description": "Amended Order Rescheduling Hearing on (RE: related document(s): 350 Motion to Compel the Production of Certain Due Diligence Material; (B) Modify Order Approving (I) Bidding Procedures; (II) Break-Up Fee Realted to the Sale of Substantially all of the Debtor's Personal Property; and (III) Form and Manner of Sale Notice; or (C) In the Alternative, Seek the Appointment of a Chapter 11 Trusteefiled by Interested Party Sargent Electric Company). Reschedule Hearing scheduled for 1/25/2010 at 10:00 AM at Bankruptcy Courtroom, U.S. Courthouse, 17 South Park Row, Erie. Responses due by 1/22/2010 at noon. (avay) (Entered: 01/20/2010)", 
      "document_number": "352", 
      "pacer_doc_id": "show_doc.pl"
    }, 
    {
      "date_filed": "2010-01-20", 
      "description": "Order Scheduling a Hearing on (RE: related document(s): 350 Motion to Compel the Production of Certain Due Diligence Material; (B) Modify Order Approving (I) Bidding Procedures; (II) Break-Up Fee Realted to the Sale of Substantially all of the Debtor's Personal Property; and (III) Form and Manner of Sale Notice; or (C) In the Alternative, Seek the Appointment of a Chapter 11 Trustee filed by Interested Party Sargent Electric Company). Hearing scheduled for 1/22/2010 at 02:00 PM at Bankruptcy Courtroom, U.S. Courthouse, 17 South Park Row, Erie. Responses due by 1/21/2010. (avay) (Entered: 01/20/2010)", 
      "document_number": "351", 
      "pacer_doc_id": "show_doc.pl"
    }, 
    {
      "date_filed": "2010-01-20", 
      "description": "Amended Motion to Compel the Production of Certain Due Diligence Material; (B) Modify Order Approving (I) Bidding Procedures; (II) Break-Up Fee Realted to the Sale of Substantially all of the Debtor's Personal Property; and (III) Form and Manner of Sale Notice; or (C) In the Alternative, Seek the Appointment of a Chapter 11 Trustee Filed by Interested Party Sargent Electric Company. (Attachments: # 1 Exhibit A# 2 Proposed Order) (Lampl, David) 349 Modified on 1/20/2010 (pbar). (Entered: 01/20/2010)", 
      "document_number": "350", 
      "pacer_doc_id": "show_doc.pl"
    }, 
    {
      "date_filed": "2010-01-19", 
      "description": "Emergency Motion to Compel the Production of Certain Due Diligence Material; Modify Order Approving (I) Bidding Procedures; (II) Break-up Fee Related to the Sale of Substantially All of Debtor's Personal Property; and (III) Form and Manner of Sale Notice; or in the Alternative, Seek the Appointment of a Chapter 11 Trustee Filed by Interested Party Sargent Electric Company. (Attachments: # 1 Proposed Order) (Lampl, David) 337 Modified on 1/20/2010 (pbar). (Entered: 01/19/2010)", 
      "document_number": "349", 
      "pacer_doc_id": "show_doc.pl"
    }, 
    {
      "date_filed": "2010-01-19", 
      "description": "Exhibit (Second Amendment to Exhibit \"A\" to Ominibus Motion to Establish Cure Amounts for Executory Contracts and Unexpired Leases) Filed by Debtor Thayer Power and Communication Line Construction Company, Inc. (RE: related document(s): 343 Motion filed by Debtor Thayer Power and Communication Line Construction Company, Inc., 347 Exhibit filed by Debtor Thayer Power and Communication Line Construction Company, Inc.). (Attachments: # 1 Exhibit) (Pagliari, Nicholas) (Entered: 01/19/2010)", 
      "document_number": "348", 
      "pacer_doc_id": "show_doc.pl"
    }, 
    {
      "date_filed": "2010-01-14", 
      "description": "Exhibit (Amended Exhibit \"A\" to Omnibus Motion to Establish Cure Amounts for Executory Contracts and Unexpired Leases) Filed by Debtor Thayer Power and Communication Line Construction Company, Inc. (RE: related document(s): 343 Motion filed by Debtor Thayer Power and Communication Line Construction Company, Inc.). (Attachments: # 1 Exhibit) (Pagliari, Nicholas) (Entered: 01/14/2010)", 
      "document_number": "347", 
      "pacer_doc_id": "show_doc.pl"
    }, 
    {
      "date_filed": "2010-01-11", 
      "description": "Monthly Financial Report for Filing Period November, 2009 Filed by Debtor Thayer Power and Communication Line Construction Company, Inc. (Bolla, Lawrence) (Entered: 01/11/2010)", 
      "document_number": "346", 
      "pacer_doc_id": "show_doc.pl"
    }, 
    {
      "date_filed": "2010-01-07", 
      "description": "Certificate of Service Filed by Debtor Thayer Power and Communication Line Construction Company, Inc. (RE: related document(s): 343 Motion filed by Debtor Thayer Power and Communication Line Construction Company, Inc., 344 Notice filed by Debtor Thayer Power and Communication Line Construction Company, Inc.). (Pagliari, Nicholas) (Entered: 01/07/2010)", 
      "document_number": "345", 
      "pacer_doc_id": "show_doc.pl"
    }, 
    {
      "date_filed": "2010-01-07", 
      "description": "Notice Regarding Notice Regarding the Notice of Hearing on Omnibus Motion to Establish Cure Amounts for Executory Contracts and Unexpired Leases. (Response Deadline of January 25, 2010) Filed by Debtor Thayer Power and Communication Line Construction Company, Inc. (RE: related document(s): 302 Motion to Sell Property Free and Clear of Liens filed by Debtor Thayer Power and Communication Line Construction Company, Inc., 337 Order on Application for Approval, 343 Motion filed by Debtor Thayer Power and Communication Line Construction Company, Inc.). (Pagliari, Nicholas) (Entered: 01/07/2010)", 
      "document_number": "344", 
      "pacer_doc_id": "show_doc.pl"
    }, 
    {
      "date_filed": "2010-01-07", 
      "description": "Omnibus Motion to Establish Cure Amounts for Executory Contracts and Unexpired Leases Filed by Debtor Thayer Power and Communication Line Construction Company, Inc.. (Attachments: # 1 Proposed Order # 2 Exhibit A# 3 Exhibit B# 4 Exhibit C# 5 Exhibit D) (Pagliari, Nicholas) (Entered: 01/07/2010)", 
      "document_number": "343", 
      "pacer_doc_id": "show_doc.pl"
    }, 
    {
      "date_filed": "2010-01-04", 
      "description": "Certificate of Service 301 Regarding the Hearing on 2/4/2010. Filed by Debtor Thayer Power and Communication Line Construction Company, Inc. (RE: related document(s): 302 Motion to Sell Property Free and Clear of Liens filed by Debtor Thayer Power and Communication Line Construction Company, Inc., 337 Order on Application for Approval, 338 Order Scheduling a Hearing). (Bolla, Lawrence) (Entered: 01/04/2010)", 
      "document_number": "342", 
      "pacer_doc_id": "show_doc.pl"
    }, 
    {
      "date_filed": "2010-01-04", 
      "description": "Certificate of Service Regarding the Hearing on 2/4/2010. Filed by Debtor Thayer Power and Communication Line Construction Company, Inc. (RE: related document(s): 302 Motion to Sell Property Free and Clear of Liens filed by Debtor Thayer Power and Communication Line Construction Company, Inc., 337 Order on Application for Approval, 338 Order Scheduling a Hearing). (Bolla, Lawrence) (Entered: 01/04/2010)", 
      "document_number": "341", 
      "pacer_doc_id": "show_doc.pl"
    }, 
    {
      "date_filed": "2009-12-31", 
      "description": "Certificate of Service of Order Approving Application for Compensation by Accountant for the Official Committee of Unsecured Creditors Regarding the Hearing on 12/17/2009. Filed by Accountant McGill, Power, Bell & Associates, LLP (RE: related document(s): 304 Order or Proceeding Memo Setting Hearing, 334 Order on Application for Compensation). (Fustine, Guy) (Entered: 12/31/2009)", 
      "document_number": "340", 
      "pacer_doc_id": "show_doc.pl"
    }, 
    {
      "date_filed": "2009-12-31", 
      "description": "Certificate of Service of Order Approving Third Interim Application for Compensation and Reimbursement of Expenses by Attorney for Creditors' Committee Regarding the Hearing on 12/17/2009. Filed by Creditor Committee Official Committee of Unsecured Creditors of Thayer Power & Communication Line Construction Co., Inc. (RE: related document(s): 332 Order on Application for Compensation). (Fustine, Guy) (Entered: 12/31/2009)", 
      "document_number": "339", 
      "pacer_doc_id": "show_doc.pl"
    }, 
    {
      "date_filed": "2009-12-29", 
      "description": "Order Scheduling a Hearing on (RE: related document(s): 302 Motion to Sell Property Free and Clear of Liens filed by Debtor Thayer Power and Communication Line Construction Company, Inc.). Hearing scheduled for 2/4/2010 at 02:30 PM at Bankruptcy Courtroom, U.S. Courthouse, 17 South Park Row, Erie. Responses due by 2/2/2010. (avay) Additional attachment(s) added on 12/29/2009 (avay). PAGE 3 REMOVED FROM PDF AS IT WAS ERRONEOUSLY ATTACHED. Modified on 12/29/2009 (avay). Additional attachment(s) added on 12/30/2009 (avay). (Entered: 12/29/2009)", 
      "document_number": "338", 
      "pacer_doc_id": "show_doc.pl"
    }, 
    {
      "date_filed": "2009-12-29", 
      "description": "Order Granting Application for Approval of (I) Bidding Procedures; (II) Break-Up Fee Related to the Sale of Substantially All of Debtor's Personal Property; and (III) Form and Manner of Sale Notice (Related Doc # 301 ) Signed on 12/29/2009. (avay) Additional attachment(s) added on 12/29/2009 (avay). PAGE 16 REMOVED FROM PDF AS IT WAS ERRONEOUSLY ATTACHED. Modified on 12/29/2009 (avay). Additional attachment(s) added on 12/30/2009 (avay). 302 Modified on 2/12/2010 (pbar). (Entered: 12/29/2009)", 
      "document_number": "337", 
      "pacer_doc_id": "show_doc.pl"
    }, 
    {
      "date_filed": "2009-12-18", 
      "description": "BNC Certificate of Mailing - PDF Document. (RE: related document(s): 325 Order on Motion to Appear pro hac vice). Service Date 12/18/2009. (Admin.) (Entered: 12/19/2009)", 
      "document_number": "335", 
      "pacer_doc_id": "show_doc.pl"
    }, 
    {
      "date_filed": "2009-12-18", 
      "description": "Certificate of Service of Joint Objection Filed by Creditors National Electrical Annuity Plan, National Electrical Benefit Fund (RE: related document(s): 319 Motion filed by Creditor National Electrical Benefit Fund, Creditor National Electrical Annuity Plan). (Skiba, Gary) (Entered: 12/18/2009)", 
      "document_number": "330", 
      "pacer_doc_id": "show_doc.pl"
    }, 
    {
      "date_filed": "2009-12-17", 
      "description": "Hearing Held (RE: related document(s): 301 Application for Approval filed by Debtor Thayer Power and Communication Line Construction Company, Inc.). Counsel to submit proposed consent order. (avay) (Entered: 12/21/2009)", 
      "document_number": "336", 
      "pacer_doc_id": "show_doc.pl"
    }, 
    {
      "date_filed": "2009-12-17", 
      "description": "Order Granting Application For Compensation (Related Doc # 300 ) Granting for McGill, Power, Bell & Associates, LLP, fees awarded: $8165.00, expenses awarded: $0.00 Signed on 12/17/2009. (avay) (Entered: 12/18/2009)", 
      "document_number": "334", 
      "pacer_doc_id": "show_doc.pl"
    }, 
    {
      "date_filed": "2009-12-17", 
      "description": "Hearing Held (RE: related document(s): 300 Application for Compensation filed by Accountant McGill, Power, Bell & Associates, LLP). (avay) (Entered: 12/18/2009)", 
      "document_number": "333", 
      "pacer_doc_id": "show_doc.pl"
    }, 
    {
      "date_filed": "2009-12-17", 
      "description": "Order Granting Application For Compensation (Related Doc # 299 ) Granting for Guy C. Fustine, fees awarded: $17210.00, expenses awarded: $754.43 Signed on 12/17/2009. (avay) (Entered: 12/18/2009)", 
      "document_number": "332", 
      "pacer_doc_id": "show_doc.pl"
    }, 
    {
      "date_filed": "2009-12-17", 
      "description": "Hearing Held (RE: related document(s): 299 Application for Compensation filed by Creditor Committee Official Committee of Unsecured Creditors of Thayer Power & Communication Line Construction Co., Inc.). (avay) (Entered: 12/18/2009)", 
      "document_number": "331", 
      "pacer_doc_id": "show_doc.pl"
    }, 
    {
      "date_filed": "2009-12-17", 
      "description": "CORRECTIVE ENTRY: THE ATTACHED PDF DOES NOT CORRESPOND WITH THE CHOSEN EVENT. ATTORNEY MUST CORRECT AND REFILE. (RE: related document(s): 324 Certificate of Service filed by Creditor National Electrical Benefit Fund, Creditor National Electrical Annuity Plan). (avay) (Entered: 12/17/2009)", 
      "document_number": "329", 
      "pacer_doc_id": null
    }, 
    {
      "date_filed": "2009-12-16", 
      "description": "Reply to Response of OUCC to Motion for Order Approving (I) Bidding Procedures; (II) Break-Up Fee Related to the Sale of Substantially all of Debtor's Personal Property; and (III) Form and Manner of Sale Notice Regarding the Hearing on 12/17/2009. Filed by Thayer Power and Communication Line Construction Company, Inc. (RE: related document(s): 301 Application for Approval filed by Debtor Thayer Power and Communication Line Construction Company, Inc., 321 Response filed by Creditor Committee Official Committee of Unsecured Creditors of Thayer Power & Communication Line Construction Co., Inc.). (Bolla, Lawrence) (Entered: 12/16/2009)", 
      "document_number": "328", 
      "pacer_doc_id": "show_doc.pl"
    }, 
    {
      "date_filed": "2009-12-16", 
      "description": "Reply to Response of Key Bank National Association to Motion for Order Approving (I) Bidding Procedures; (II) Break-up Fee Related to the Sale of Substantially all of Debtor's Personal Property; and (III) Form and Manner of Sale Notice Regarding the Hearing on 12/17/2009. Filed by Thayer Power and Communication Line Construction Company, Inc. (RE: related document(s): 301 Application for Approval filed by Debtor Thayer Power and Communication Line Construction Company, Inc., 320 Response filed by Creditor KeyBank National Association). (Bolla, Lawrence) (Entered: 12/16/2009)", 
      "document_number": "327", 
      "pacer_doc_id": "show_doc.pl"
    }, 
    {
      "date_filed": "2009-12-16", 
      "description": "Response to Response of Sargent Electric Company to Expedited Motion for Order Approving (I) Bidding Procedures; (II) Break-Up Fee Related to the Sale of Substantially all of Debtor's Personal Property; and (III) Form and Manner of Sale Notice Regarding the Hearing on 12/17/2009. Filed by Debtor Thayer Power and Communication Line Construction Company, Inc. (RE: related document(s): 301 Application for Approval filed by Debtor Thayer Power and Communication Line Construction Company, Inc., 318 Response filed by Interested Party Sargent Electric Company). (Bolla, Lawrence) (Entered: 12/16/2009)", 
      "document_number": "326", 
      "pacer_doc_id": "show_doc.pl"
    }, 
    {
      "date_filed": "2009-12-16", 
      "description": "Order Granting Motion To Appear pro hac vice National Electrical Benefit Fund, and National Electrical Annuity Plan rep by, Dianne S. Ruhlandt, Dianne S. Ruhlandt. (Related Doc # 317 ) Signed on 12/16/2009. (avay) (Entered: 12/16/2009)", 
      "document_number": "325", 
      "pacer_doc_id": "show_doc.pl"
    }, 
    {
      "date_filed": "2009-12-16", 
      "description": "Certificate of Service of Joint Objection Filed by Creditors National Electrical Annuity Plan, National Electrical Benefit Fund (RE: related document(s): 319 Motion filed by Creditor National Electrical Benefit Fund, Creditor National Electrical Annuity Plan). (Skiba, Gary) CORRECTIVE ENTRY: THE ATTACHED PDF DOES NOT CORRESPOND WITH THE CHOSEN EVENT. ATTORNEY MUST CORRECT AND REFILE. Modified on 12/17/2009 (avay). (Entered: 12/16/2009)", 
      "document_number": "324", 
      "pacer_doc_id": "show_doc.pl"
    }, 
    {
      "date_filed": "2009-12-16", 
      "description": "Order Granting Motion To Appear pro hac vice Anderson Group, LLC rep by, Harry W. Greenfield. (Related Doc # 316 ) Signed on 12/16/2009. (avay) (Entered: 12/16/2009)", 
      "document_number": "323", 
      "pacer_doc_id": "show_doc.pl"
    }, 
    {
      "date_filed": "2009-12-16", 
      "description": "Notice of Appearance and Request for Notice of Harry W. Greenfield on behalf of the Anderson Group, LLC by Thomas K. Dimond Filed by Creditor The Anderson Group, LLC (Attachments: # 1 Certificate of Service) (Dimond, Thomas) (Entered: 12/16/2009)", 
      "document_number": "322", 
      "pacer_doc_id": "show_doc.pl"
    }, 
    {
      "date_filed": "2009-12-15", 
      "description": "Response to Expedited Motion for Order Approving Bidding Procedures; Break-Up Fee Related to the Sale of Substantially all of the Debtor's Personal Property; and Form and Manner of Sale Notice Regarding the Hearing on 12/17/09. Filed by Official Committee of Unsecured Creditors of Thayer Power & Communication Line Construction Co., Inc. (RE: related document(s): 301 Application for Approval filed by Debtor Thayer Power and Communication Line Construction Company, Inc.). (Fustine, Guy) (Entered: 12/15/2009)", 
      "document_number": "321", 
      "pacer_doc_id": "show_doc.pl"
    }, 
    {
      "date_filed": "2009-12-15", 
      "description": "Response Regarding the Hearing on 12/17/2006. Filed by KeyBank National Association (RE: related document(s): 301 Application for Approval filed by Debtor Thayer Power and Communication Line Construction Company, Inc.). (Russ, Peter) (Entered: 12/15/2009)", 
      "document_number": "320", 
      "pacer_doc_id": "show_doc.pl"
    }, 
    {
      "date_filed": "2009-12-15", 
      "description": "Motion Joint Objection of the National Electrical Annuity Plan and The National Electrical Benefit Fund to Debtor's Motion for Order Approving Bidding Procedures in Connection with Sale of Its Assets Filed by Creditors National Electrical Annuity Plan, National Electrical Benefit Fund. (Skiba, Gary) 301 Modified on 12/16/2009 (pbar). (Entered: 12/15/2009)", 
      "document_number": "319", 
      "pacer_doc_id": "show_doc.pl"
    }, 
    {
      "date_filed": "2009-12-15", 
      "description": "Response of Sargent Electric Company to Expedited Motion for Order Approving (I) Bidding Procedures; (II) Break-Up Fee Related to the Sale of Substantially all of Debtor's Personal Property; and (III) Form and Manner of Sale Notice Regarding the Hearing on 12/17/2009. Filed by Sargent Electric Company (RE: related document(s): 301 Application for Approval filed by Debtor Thayer Power and Communication Line Construction Company, Inc.). (Attachments: # 1 Certificate of Service) (Steiner, John) (Entered: 12/15/2009)", 
      "document_number": "318", 
      "pacer_doc_id": "show_doc.pl"
    }, 
    {
      "date_filed": "2009-12-15", 
      "description": "Motion to Appear pro hac vice Filed by Creditors National Electrical Annuity Plan, National Electrical Benefit Fund. (Attachments: # 1 Proposed Order) (Skiba, Gary) (Entered: 12/15/2009)", 
      "document_number": "317", 
      "pacer_doc_id": "show_doc.pl"
    }, 
    {
      "date_filed": "2009-12-14", 
      "description": "Motion to Appear pro hac vice for The Law Firm of Buckley King, LPA and Harry W. Greenfield, Esquire Filed by Creditor The Anderson Group, LLC. (Attachments: # 1 Proposed Order # 2 Certificate of Service) (Dimond, Thomas) (Entered: 12/14/2009)", 
      "document_number": "316", 
      "pacer_doc_id": "show_doc.pl"
    }, 
    {
      "date_filed": "2009-12-14", 
      "description": "Order Dismissing Motion For Pro Hac Vice Admission For Noncompliance with Local Rules/Procedures (Related Doc # 312 ) Signed on 12/14/2009. (avay) DOCKETED IN ERROR. TO BE REISSUED. Modified on 12/14/2009 (avay). THE ORDER WILL NOT BE REISSUED AS IT WAS REFILED AT DOCUMENT NO. 317 Modified on 12/15/2009 (avay). (Entered: 12/14/2009)", 
      "document_number": "315", 
      "pacer_doc_id": "show_doc.pl"
    }, 
    {
      "date_filed": "2009-12-11", 
      "description": "BNC Certificate of Mailing - PDF Document. (RE: related document(s): 309 Hearing (Bk) Rescheduled). Service Date 12/11/2009. (Admin.) (Entered: 12/12/2009)", 
      "document_number": "314", 
      "pacer_doc_id": "show_doc.pl"
    }, 
    {
      "date_filed": "2009-12-11", 
      "description": "BNC Certificate of Mailing - PDF Document. (RE: related document(s): 308 Hearing (Bk) Rescheduled). Service Date 12/11/2009. (Admin.) (Entered: 12/12/2009)", 
      "document_number": "313", 
      "pacer_doc_id": "show_doc.pl"
    }, 
    {
      "date_filed": "2009-12-11", 
      "description": "Motion for Pro Hac Vice Admission Filed by Creditors National Electrical Annuity Plan, National Electrical Benefit Fund. (Attachments: # 1 Proposed Order) (Skiba, Gary) (Entered: 12/11/2009)", 
      "document_number": "312", 
      "pacer_doc_id": "show_doc.pl"
    }, 
    {
      "date_filed": "2009-12-10", 
      "description": "Monthly Financial Report for Filing Period October, 2009 Filed by Debtor Thayer Power and Communication Line Construction Company, Inc. (Bolla, Lawrence) (Entered: 12/10/2009)", 
      "document_number": "311", 
      "pacer_doc_id": "show_doc.pl"
    }, 
    {
      "date_filed": "2009-12-09", 
      "description": "Certificate of Service Regarding the Hearing on 12/17/2009. Filed by Debtor Thayer Power and Communication Line Construction Company, Inc. (RE: related document(s): 301 Application for Approval filed by Debtor Thayer Power and Communication Line Construction Company, Inc., 307 Order or Proceeding Memo Setting Hearing). (Bolla, Lawrence) (Entered: 12/09/2009)", 
      "document_number": "310", 
      "pacer_doc_id": "show_doc.pl"
    }, 
    {
      "date_filed": "2009-12-09", 
      "description": "Amended Order Rescheduling Hearing on (RE: related document(s): 300 Application for Compensation filed by Accountant McGill, Power, Bell & Associates, LLP). Hearing scheduled for 12/17/2009 at 03:00 PM at Bankruptcy Courtroom, U.S. Courthouse, 17 South Park Row, Erie. Responses due by 12/16/2009. (avay) cm: Fustine, Esq. by USPS and others served by other means. Modified on 12/9/2009 (avay). (Entered: 12/09/2009)", 
      "document_number": "309", 
      "pacer_doc_id": "show_doc.pl"
    }, 
    {
      "date_filed": "2009-12-09", 
      "description": "Amended Order Rescheduling Hearing on (RE: related document(s): 299 Application for Compensation filed by Creditor Committee Official Committee of Unsecured Creditors of Thayer Power & Communication Line Construction Co., Inc.). Hearing scheduled for 12/17/2009 at 03:00 PM at Bankruptcy Courtroom, U.S. Courthouse, 17 South Park Row, Erie. Responses due by 12/16/2009. (avay) cm: Fustine, Esq. by USPS and others served by other means. Modified on 12/9/2009 (avay). Modified on 12/9/2009 (avay). (Entered: 12/09/2009)", 
      "document_number": "308", 
      "pacer_doc_id": "show_doc.pl"
    }, 
    {
      "date_filed": "2009-12-08", 
      "description": "Order Setting Hearing on (RE: related document(s): 301 Application for Approval filed by Debtor Thayer Power and Communication Line Construction Company, Inc.). Hearing scheduled for 12/17/2009 at 02:30 PM at Bankruptcy Courtroom, U.S. Courthouse, 17 South Park Row, Erie. Responses due by 12/15/2009. cm: Bolla, Esq. (avay) (Entered: 12/08/2009)", 
      "document_number": "307", 
      "pacer_doc_id": "show_doc.pl"
    }, 
    {
      "date_filed": "2009-12-05", 
      "description": "BNC Certificate of Mailing - PDF Document. (RE: related document(s): 304 Order or Proceeding Memo Setting Hearing). Service Date 12/05/2009. (Admin.) (Entered: 12/06/2009)", 
      "document_number": "306", 
      "pacer_doc_id": "show_doc.pl"
    }, 
    {
      "date_filed": "2009-12-05", 
      "description": "BNC Certificate of Mailing - PDF Document. (RE: related document(s): 303 Order or Proceeding Memo Setting Hearing). Service Date 12/05/2009. (Admin.) (Entered: 12/06/2009)", 
      "document_number": "305", 
      "pacer_doc_id": "show_doc.pl"
    }, 
    {
      "date_filed": "2009-12-02", 
      "description": "Order Setting Hearing on (RE: related document(s): 300 Application for Compensation filed by Accountant McGill, Power, Bell & Associates, LLP). Hearing scheduled for 1/7/2010 at 01:30 PM at Bankruptcy Courtroom, U.S. Courthouse, 17 South Park Row, Erie. Objections due by 12/31/2009. (avay) (Entered: 12/03/2009)", 
      "document_number": "304", 
      "pacer_doc_id": "show_doc.pl"
    }, 
    {
      "date_filed": "2009-12-02", 
      "description": "Order Setting Hearing on (RE: related document(s): 299 Application for Compensation filed by Creditor Committee Official Committee of Unsecured Creditors of Thayer Power & Communication Line Construction Co., Inc.). Non-Evidentiary Hearing scheduled for 1/7/2010 at 01:30 PM at Bankruptcy Courtroom, U.S. Courthouse, 17 South Park Row, Erie. Objections due by 12/31/2009. (avay) (Entered: 12/03/2009)", 
      "document_number": "303", 
      "pacer_doc_id": "show_doc.pl"
    }, 
    {
      "date_filed": "2009-12-02", 
      "description": "Motion to Sell Property Free and Clear of Liens Re: Substanitally All Personal Property. Free and Clear of Liens Claims, Encumbrances and Interests Outside the Ordinary Course of Business, (ii) Authorizing Debtor to Assume and Assign Certain Executory Conttracts and Unexpired Leases, and (iii) Granting Related Relief Filed by Debtor Thayer Power and Communication Line Construction Company, Inc.. (Attachments: # 1 Proposed Order # 2 Proposed Scheduling Order# 3 Exhibit A) (Bolla, Lawrence) Clerk has added related document link 301 . Modified on 12/3/2009 (pbar). (Entered: 12/02/2009)", 
      "document_number": "302", 
      "pacer_doc_id": "show_doc.pl"
    }, 
    {
      "date_filed": "2009-12-02", 
      "description": "Expedited Application for Approval of (I) Bidding Procedures; (II) Break-Up Fee Related to the Sale of Substantially All of Debtor's Personal Property; and (III) Form and Manner of Sale Notice Filed by Debtor Thayer Power and Communication Line Construction Company, Inc.. (Attachments: # 1 Proposed Order # 2 Exhibit A# 3 Exhibit B) (Bolla, Lawrence) (Entered: 12/02/2009)", 
      "document_number": "301", 
      "pacer_doc_id": "show_doc.pl"
    }, 
    {
      "date_filed": "2009-11-24", 
      "description": "Interim Application for Compensation for McGill, Power, Bell & Associates, LLP, Accountant, Period: 8/1/2009 to 11/16/2009, Fee: $8,165.00, Expenses: $. Filed by Accountant McGill, Power, Bell & Associates, LLP. (Attachments: # 1 Exhibit # 2 Proposed Order) (Fustine, Guy) (Entered: 11/24/2009)", 
      "document_number": "300", 
      "pacer_doc_id": "show_doc.pl"
    }, 
    {
      "date_filed": "2009-11-24", 
      "description": "Interim Application for Compensation for Guy C. Fustine, Creditor Comm. Aty, Period: 8/25/2009 to 11/15/2009, Fee: $17,210.00, Expenses: $754.43. Filed by Attorney Guy C. Fustine. (Attachments: # 1 Exhibit # 2 Exhibit # 3 Exhibit # 4 Proposed Order) (Fustine, Guy) (Entered: 11/24/2009)", 
      "document_number": "299", 
      "pacer_doc_id": "show_doc.pl"
    }, 
    {
      "date_filed": "2009-11-17", 
      "description": "Monthly Financial Report for Filing Period September, 2009 Filed by Debtor Thayer Power and Communication Line Construction Company, Inc. (Bolla, Lawrence) (Entered: 11/17/2009)", 
      "document_number": "298", 
      "pacer_doc_id": "show_doc.pl"
    }
  ], 
  "docket_number": "08-11904", 
  "jurisdiction": null, 
  "jury_demand": null, 
  "nature_of_suit": null, 
  "parties": [
    {
      "attorneys": [
        {
          "contact": "Quinn Buseck Leemhuis Toohey & Kroto Inc\n2222 West Grandview Boulevard\nErie, PA 16506-4508\n814-833-2222\nEmail: lbolla@quinnfirm.com\n", 
          "name": "Lawrence C. Bolla", 
          "roles": []
        }, 
        {
          "contact": "Quinn Law Firm\n2222 West Grandview Boulevard\nErie, PA 16506\n814-833-2222\nFax : 814-835-2076\nEmail: mkruszewski@quinnfirm.com\n", 
          "name": "Michael P. Kruszewski", 
          "roles": []
        }, 
        {
          "contact": "Quinn Buseck Leemhuis Toohey & Kroto Inc\n2222 W. Grandview Blvd.\nErie, PA 16506\n814-833-2222\nFax : 814-835-2076\nEmail: npagliari@quinnfirm.com\n", 
          "name": "Nicholas R. Pagliari", 
          "roles": []
        }
      ], 
      "extra_info": "7400 Market Road\nP.O. Box 915\nFairview, PA 16415\nTax ID / EIN: 25-1374363", 
      "name": "Thayer Power and Communication Line Construction Company, Inc.", 
      "type": "Debtor"
    }, 
    {
      "attorneys": [
        {
          "contact": "Office of the United States Trustee\nLiberty Center, Suite 970\n1001 Liberty Avenue\nPittsburgh, PA 15222\n412-644-4756\nFax : 412-644-4785\nEmail: Heather.Sprague@usdoj.gov\n", 
          "name": "Heather A. Sprague on Behalf of the United States Trustee by", 
          "roles": []
        }
      ], 
      "extra_info": "Liberty Center.\n1001 Liberty Avenue, Suite 970\nPittsburgh, PA 15222\n412-644-4756", 
      "name": "Office of the United States Trustee", 
      "type": "U.S. Trustee"
    }, 
    {
      "attorneys": [
        {
          "contact": "Knox McLaughlin Gornall & Sennett, P.C.\n120 West Tenth Street\nErie, PA 16501\n814-459-2800\nEmail: gfustine@kmgslaw.com\n", 
          "name": "Guy C. Fustine", 
          "roles": []
        }, 
        {
          "contact": "Knox McLaughlin Gornell & Sennett, P.C.\n120 West Tenth Street\nErie, PA 16501\n814-459-2800\nFax : 814-453-4530\nEmail: jgula@kmgslaw.com\n", 
          "name": "Joseph F. Gula, III", 
          "roles": []
        }
      ], 
      "extra_info": "c/o Guy C. Fustine, Esquire\n120 West Tenth Street\nErie, PA 16501", 
      "name": "Official Committee of Unsecured Creditors of Thayer Power & Communication Line Construction Co., Inc.", 
      "type": "Creditor Committee"
    }
  ], 
  "referred_to_str": null
}