{
  "assigned_to_str": "David Alan Ezra",
  "case_name": "United States v. Furtado",
  "cause": "",
  "court_id": "hid",
  "date_converted": null,
  "date_discharged": null,
  "date_filed": "2004-06-16",
  "date_terminated": "2005-04-13",
  "demand": "",
  "docket_entries": [
    {
      "date_entered": "2004-05-25",
      "date_filed": "2004-05-25",
      "description": "COMPLAINT by ATF S/A Gordon Horiye against Jeff Furtado signed by Mag Judge Barry M. Kurren [ 1:04-m -401 ] (afc) (Entered: 05/25/2004)",
      "document_number": "1",
      "pacer_doc_id": null,
      "pacer_seq_no": null
    },
    {
      "date_entered": "2004-05-25",
      "date_filed": "2004-05-25",
      "description": "WARRANT of arrest issued as to Jeff Furtado; bail \"To be Determined\" by Mag Judge Barry M. Kurren [ 1:04-m -401 ] (afc) (Entered: 05/25/2004)",
      "document_number": "2",
      "pacer_doc_id": null,
      "pacer_seq_no": null
    },
    {
      "date_entered": "2004-05-25",
      "date_filed": "2004-05-25",
      "description": "AMENDED CRIMINAL COMPLAINT; agent's affidavit [amendment is as to name of defendant - from JEFF Furtado to JASON Furtado] [ 1:04-m -401 ] (afc) Modified on 05/25/2004 (Entered: 05/25/2004)",
      "document_number": "3",
      "pacer_doc_id": null,
      "pacer_seq_no": null
    },
    {
      "date_entered": "2004-05-25",
      "date_filed": "2004-05-25",
      "description": "AMENDED ARREST Warrant issued for JASON Furtado bail \"To be determined\" Mag Judge Barry M. Kurren [ 1:04-m -401 ] (afc) (Entered: 05/25/2004)",
      "document_number": "4",
      "pacer_doc_id": null,
      "pacer_seq_no": null
    },
    {
      "date_entered": "2004-06-08",
      "date_filed": "2004-06-08",
      "description": "MOTION to detain defendant without bail by USA as to Jason Furtado - referred to Mag Judge Barry M. Kurren [ 1:04-m -401 ] (afc) (Entered: 06/08/2004)",
      "document_number": "5",
      "pacer_doc_id": null,
      "pacer_seq_no": null
    },
    {
      "date_entered": "2004-06-08",
      "date_filed": "2004-06-08",
      "description": "EP: MINUTES: Initial Appearance - Defendant present in custody. Defendant sworn to Financial Affidavit. Request for Court Appointed Attorney - Granted. Alexander Silvert, AFPD and the Office of the Federal Public Defender Apptd Atty. Charges received. Motion to Detain filed. Detention Hearing set for 11:30 6/10/04, LEK. Preliminary Hearing set for 3:00 6/23/04, BMK. Defendant remanded to the custody of the US Marshal. [5-1] Jason Furtado, USA Attorney Edric M.K. Ching; AFPD Alexander Silvert present (Ct Rptr: FTR-C7-CD TIME: 3:07-3:09) by Judge Leslie E. Kobayashi [ 1:04-m -401 ] (afc) (Entered: 06/08/2004)",
      "document_number": "6",
      "pacer_doc_id": null,
      "pacer_seq_no": null
    },
    {
      "date_entered": "2004-06-08",
      "date_filed": "2004-06-08",
      "description": "FINANCIAL Affidavit as to Jason Furtado [ 1:04-m -401 ] (afc) (Entered: 06/08/2004)",
      "document_number": "7",
      "pacer_doc_id": null,
      "pacer_seq_no": null
    },
    {
      "date_entered": "2004-06-08",
      "date_filed": "2004-06-08",
      "description": "ORDER of Temporary Detention Pending Hearing Pursuant to Bail Reform Act as to Jason Furtado by Mag Judge Leslie Kobayashi [ 1:04-m -401 ] (afc) (Entered: 06/08/2004)",
      "document_number": "8",
      "pacer_doc_id": null,
      "pacer_seq_no": null
    },
    {
      "date_entered": "2004-06-14",
      "date_filed": "2004-06-10",
      "description": "EP: MINUTES: Detention Hearing-Defendant present in Custody. Government's Motion to Detain Defendant is hereby Denied. Bail will be set. Bail- (7a1) Execute a bond in the amount of $25,000,unsecured bond. The Defendant is placed in the Third Party Custodian ship of Jeffrey Furtado 73-4200 Honu Street, Kailua-Kona, Hawaii 96740. Phone (808) 325-0753 or Fax: (808) 327-9354. The Court Authorizes the U.S. District Clerk's Office to forward the bail papers to the third party custodian by fax, mail, or other means of delivery where attestation may be administered by notary public. The defendant is release forthwith prior to the signature of the third party custodian. The third party custodian must return the bail papers to the U.S. District Clerk's Office no later than: June 24, 2004. (7b) Comply with pretrial services supervision, and abide by all conditions of release as directed by Pretrial Services. (7c) Maintain or actively seek employment, as directed by Pretrial Services. (7g2) Do not apply for/obtain a passport. (7h1) Travel is restricted to State of Hawaii; inter-island travel must be approved in advance by Pretrial Services. (7j) Maintain residence with/at: Jeffrey Furtado, at 73-4200 Honu Street, Kailua-Kona, Hawaii 96740. (7m2) Contact is prohibited directly, indirectly, or through third parties with: Francine Butler. (7o) Comply with the following curfew: as directed by Pretrial Services. (7s2) You are prohibited from possessing, or having access to any firearm, ammunition, destructive device, or other dangerous weapon. Immediately surrender all firearms, ammunition, destructive devices, and other dangerous weapons to an agent approved by Pretrial Services. (7y) You must contribute toward the costs of the services required by this bond, to the extent you are financially able to do so, as determined by Pretrial Services. Other Conditions: Comply with the terms and conditions of State probation Special Conditions of Release- You shall not commit any offense in violation of federal, state, or local law while on release in this case. You shall appear at all proceedings as requested and shall surrender for service of any sentence imposed as directed. Defendant's Oral Request to have the U.S. Marshal's provide a One Way Plane Ticket from Honolulu, Hawaii to Kailua, Kona-is hereby Granted. [5-1] Jason Furtado, USA Attorney Edric M.K. Ching; AFPD William Domingo present (Ct Rptr: FTR-C7; CD20 - 11:39:51; Time: 11:39-11:47) by Judge Leslie E. Kobayashi [ 1:04-m -401 ] (afc) (Entered: 06/14/2004)",
      "document_number": "9",
      "pacer_doc_id": null,
      "pacer_seq_no": null
    },
    {
      "date_entered": "2004-06-17",
      "date_filed": "2004-06-16",
      "description": "EP: INDICTMENT by USA Counts filed against Jason Furtado (1) count(s) 1; PS ordered ( Laura Savo ) by Mag Judge Leslie E. Kobayashi (bbb) Additional attachment(s) added on 3/23/2006 (bbb, ). (Entered: 06/17/2004)",
      "document_number": "10",
      "pacer_doc_id": "0610258639",
      "pacer_seq_no": "39"
    },
    {
      "date_entered": "2004-06-17",
      "date_filed": "2004-06-17",
      "description": "PS issued as to Jason Furtado ; arraignment set for 3:00 6/23/04 for Jason Furtado before Mag Judge Barry M. Kurren (bbb) (Entered: 06/17/2004)",
      "document_number": "11",
      "pacer_doc_id": null,
      "pacer_seq_no": null
    },
    {
      "date_entered": "2004-06-25",
      "date_filed": "2004-06-23",
      "description": "EP: MINUTES: A & P to the Indictment - deft present on bail. Arrn waived. Plea of NOT GUILTY entered. Dates given: JS/JT 8-17-04 @ 9 a.m. DAE FPT 7-26-04 @ 10 a.m. KSC Motions due 7-14-04 Response due 7-28-04 Bail to continue. Jason Furtado, USA Attorney Edric Ming-Kai Ching, William M. Domingo present ( Ct Rptr: C6 CD#7 3:09-3:10p) by Judge Barry M. Kurren (bbb) (Entered: 06/25/2004)",
      "document_number": "13",
      "pacer_doc_id": null,
      "pacer_seq_no": null
    },
    {
      "date_entered": "2004-06-24",
      "date_filed": "2004-06-24",
      "description": "PS executed on 6/21/04 as to Jason Furtado: RRR 06/22/04 (bbb) (Entered: 06/24/2004)",
      "document_number": "12",
      "pacer_doc_id": null,
      "pacer_seq_no": null
    },
    {
      "date_entered": "2004-07-06",
      "date_filed": "2004-07-02",
      "description": "APPEARANCE BOND ( $25,000.00 UNSECURED) posted by Jason Furtado signed by Judge Leslie E. Kobayashi (bbb) (Entered: 07/06/2004)",
      "document_number": "14",
      "pacer_doc_id": null,
      "pacer_seq_no": null
    },
    {
      "date_entered": "2004-07-06",
      "date_filed": "2004-07-02",
      "description": "ORDER Setting Conditions of Release for Jason Furtado ( $25,000.00 UNSECURED posted ) by Mag Judge Leslie E. Kobayashi (bbb) (Entered: 07/06/2004)",
      "document_number": "15",
      "pacer_doc_id": null,
      "pacer_seq_no": null
    },
    {
      "date_entered": "2004-07-19",
      "date_filed": "2004-07-16",
      "description": "EO: MINUTES: A Stipulation to Continue Trial, Final PreTrial Conference Dates and Motions Deadline will be submitted for Court Approval. New Dates are listed as follows: Jury Selection/Jury Trial-October 19, 2004 @9:00 a.m. before Judge Ezra Final PreTrial Conference-September 20, 2004 @l0:00 a.m. before Judge Kobayashi Defendant's Motions are to be filed by August 30, 2004 Government's Response to be filed by September 17, 2004 Time excluded from August 17, 2004 through October 19, 2004 by Judge Ezra (gs) (Entered: 07/19/2004)",
      "document_number": "16",
      "pacer_doc_id": null,
      "pacer_seq_no": null
    },
    {
      "date_entered": "2004-07-26",
      "date_filed": "2004-07-23",
      "description": "STIPULATION continuing trial date and excluding time under the speedy trial act and order by Judge Susan O. Mollway ; jury trial set for 9:00 10/19/04 for Jason Furtado ; pretrial conference set for 10:00 9/20/04 for Jason Furtado, time excluded between 08/17/2004 thru 10/19/2004 (bbb) (Entered: 07/26/2004)",
      "document_number": "17",
      "pacer_doc_id": null,
      "pacer_seq_no": null
    },
    {
      "date_entered": "2004-09-21",
      "date_filed": "2004-09-17",
      "description": "EO: MINUTES: A Stipulation to Continue Trial and Final PreTrial Conference Dates and Motions Deadline will be submitted for Court approval. New Dates are listed below- Jury Selection/Jury Trial-January 25, 2005 @9:00 a.m. before Judge Ezra Final PreTrial Conference-December 27, 2004 @l0:00 a.m. before Judge Kobayashi Defendant's Motions are to be filed by November 08, 2004 Government Response to be filed by November 29, 2004 Time excluded from October 19, 2004 through January 25, 2005 ; jury trial set for 9:00 1/25/05 for Jason Furtado ; final pretrial conf set for 10:00 12/27/04 for Jason Furtado, by Judge David A. Ezra (bbb) (Entered: 09/21/2004)",
      "document_number": "18",
      "pacer_doc_id": null,
      "pacer_seq_no": null
    },
    {
      "date_entered": "2004-09-30",
      "date_filed": "2004-09-28",
      "description": "Second STIPULATION continuing trial date and excluding time under the speedy trial act; and order by Judge David A. Ezra ; jury trial set for 9:00 1/25/05 for Jason Furtado ; pretrial conference set for 10:00 12/27/04 for Jason Furtado, time excluded between 10/19/2004 thru 01/25/2005 (bbb) (Entered: 09/30/2004)",
      "document_number": "19",
      "pacer_doc_id": null,
      "pacer_seq_no": null
    },
    {
      "date_entered": "2004-11-17",
      "date_filed": "2004-11-12",
      "description": "Notice of Motion; defendant's MOTION to suppress evidence ; memorandum of law; declaration of counsel; certificate of service - Motion hearing set for 10:30 01/03/2005 DAE (bbb) (Entered: 11/17/2004)",
      "document_number": "20",
      "pacer_doc_id": null,
      "pacer_seq_no": null
    },
    {
      "date_entered": "2004-11-22",
      "date_filed": "2004-11-17",
      "description": "EO: MINUTES: Final Pretrial Conference has been continued from 12/27/2004 10:00:00 AM to 02/22/2005 10:00:00 AM Jury Selection/Trial to Follow has been continued from 01/25/2005 09:00:00 AM to 03/22/2005 09:00:00 AM before DAE Motions due: 1/31/2005 Reponses due: 2/14/2005 Time excluded from 1/25/2005 to 3/22/2005. Stip to be prepared by Lynelle.: time excluded between 01/25/2005 thru 03/22/2005 : by Judge David A. Ezra (bbb) (Entered: 11/22/2004)",
      "document_number": "21",
      "pacer_doc_id": null,
      "pacer_seq_no": null
    },
    {
      "date_entered": "2004-11-23",
      "date_filed": "2004-11-22",
      "description": "Notice of Motion; MOTION to dismiss no. 1 as to by defendant Jason Furtado ; memorandum in support; certificate of compliance; certificate of service - Motion hearing set for 9:00 01/28/2005 DAE (bbb) (Entered: 11/23/2004)",
      "document_number": "22",
      "pacer_doc_id": null,
      "pacer_seq_no": null
    },
    {
      "date_entered": "2004-11-23",
      "date_filed": "2004-11-22",
      "description": "Notice of Motion; MOTION to dismiss no. 2 as to by defendant Jason Furtado ; memorandum in support; exhibits a-d; declaration of counsel; certificate of service - Motion hearing set for 10:30 01/03/2005 DAE (bbb) (Entered: 11/23/2004)",
      "document_number": "23",
      "pacer_doc_id": null,
      "pacer_seq_no": null
    },
    {
      "date_entered": "2004-11-23",
      "date_filed": "2004-11-22",
      "description": "EO: MINUTES: Final Pretrial Conference set for 02/22/2005 10:00 AM is moved to 02:00:00 PM before LEK. cc: all counsel ; final pretrial conf set for 2:00 2/22/05 for Jason Furtado by Judge Leslie E. Kobayashi (bbb) (Entered: 11/23/2004)",
      "document_number": "24",
      "pacer_doc_id": null,
      "pacer_seq_no": null
    },
    {
      "date_entered": "2004-11-23",
      "date_filed": "2004-11-22",
      "description": "Defendant's STIPULATION and order continuing trial and to exlude time by Judge David A. Ezra ; jury trial set for 9:00 3/22/05; pretrial set for 10:00 2/22/05 for Jason Furtado, time excluded between 01/25/2005 thru 03/22/2005 (bbb) (Entered: 11/23/2004)",
      "document_number": "25",
      "pacer_doc_id": null,
      "pacer_seq_no": null
    },
    {
      "date_entered": "2004-12-28",
      "date_filed": "2004-12-27",
      "description": "EO: MINUTES: Defendant Jason Furtado's Motion to Supress Evidence Defendant's Motion to Dismiss No. 2 Both motions have been continued from 01/03/2005 10:30:00 AM to 01/18/2005 09:00:00 AM before DAE cc: All counsel via email. [23-1]; [20-1] by Judge David A. Ezra (bbb) (Entered: 12/28/2004)",
      "document_number": "26",
      "pacer_doc_id": null,
      "pacer_seq_no": null
    },
    {
      "date_entered": "2005-01-12",
      "date_filed": "2005-01-11",
      "description": "Government's OPPOSITION to defendant's motion to suppress evidence [20-1]; declaration of Edric M. Ching; certificate of service (bbb) (Entered: 01/12/2005)",
      "document_number": "27",
      "pacer_doc_id": null,
      "pacer_seq_no": null
    },
    {
      "date_entered": "2005-01-12",
      "date_filed": "2005-01-11",
      "description": "The United States of America's OPPOSITION to defendant's motion to dismiss no. 1 [22-1]; certificate of service (bbb) (Entered: 01/12/2005)",
      "document_number": "28",
      "pacer_doc_id": null,
      "pacer_seq_no": null
    },
    {
      "date_entered": "2005-01-12",
      "date_filed": "2005-01-11",
      "description": "United States' OPPOSITION to defendant's motion to dismiss no. 2 [23-1]; exhibits a-c; declaration of Edric M. Ching; certificate of service (bbb) (Entered: 01/12/2005)",
      "document_number": "29",
      "pacer_doc_id": null,
      "pacer_seq_no": null
    },
    {
      "date_entered": "2005-01-19",
      "date_filed": "2005-01-14",
      "description": "REPLY by defendant Jason Furtado to Government's opposition to Furtado's motion to suppress evidence [20-1]; certificate of service (bbb) (Entered: 01/19/2005)",
      "document_number": "30",
      "pacer_doc_id": null,
      "pacer_seq_no": null
    },
    {
      "date_entered": "2005-01-19",
      "date_filed": "2005-01-14",
      "description": "REPLY by defendant Jason Furtado to Government's opposition to Furtado's motion to dismiss no. 2 [23-1]; certificate of service (bbb) (Entered: 01/19/2005)",
      "document_number": "31",
      "pacer_doc_id": null,
      "pacer_seq_no": null
    },
    {
      "date_entered": "2005-01-19",
      "date_filed": "2005-01-18",
      "description": "EP: MINUTES: Defendant Jason Furtado's Motion to Suppress Evidence. Defendant's Motion to Dismiss No. 2 Defendant Jason Furtado present, not in custody. Defendant Jason Furtado's Motion to Suppress Evidence-CONTINUED to 2/18/2005 @900amDAE. Arguments heard. Defendant's Motion to Dismiss No. 2- TAKEN UNDER ADVISEMENT. [23-1], [20-1] ; Jason Furtado, USA Attorney Edric Ming-Kai Ching, Silvert present ( Ct Rptr: Cynthia Fazio) by Judge David A. Ezra (bbb) (Entered: 01/19/2005)",
      "document_number": "32",
      "pacer_doc_id": null,
      "pacer_seq_no": null
    },
    {
      "date_entered": "2005-01-24",
      "date_filed": "2005-01-20",
      "description": "REPLY to Government's memorandum in opposition to defendant's motion to dismiss no. 1 [22-1]; certificate of compliance; certificate of service (bbb) (Entered: 01/24/2005)",
      "document_number": "33",
      "pacer_doc_id": null,
      "pacer_seq_no": null
    },
    {
      "date_entered": "2005-01-27",
      "date_filed": "2005-01-24",
      "description": "EX PARTE application for issuance of subpoena, payment of witness fees, transportation costs and sealing of all papers; declaration of counsel; proposed order [SEALED] - by defendant (sealed) (Entered: 01/27/2005)",
      "document_number": "35",
      "pacer_doc_id": null,
      "pacer_seq_no": null
    },
    {
      "date_entered": "2005-01-27",
      "date_filed": "2005-01-27",
      "description": "ORDER to subpoena witness, pay witness fees and costs of transportation and sealing of al papers by Mag Judge Leslie E. Kobayashi (SEALED) (bbb) (Entered: 01/27/2005)",
      "document_number": "34",
      "pacer_doc_id": null,
      "pacer_seq_no": null
    },
    {
      "date_entered": "2005-01-31",
      "date_filed": "2005-01-28",
      "description": "EP: MINUTES: Defendant's Motion to Dismiss. Defendant Jason Furtado presence waived. Defendant's Motion to Dismiss - DENIED [22-1]; Jason Furtado, USA Attorney Loretta Sheehan, Edric Ming-Kai, Peter C. Wolff, Mike Weight Ching present (Ct Rptr: Cynthia Fazio) by Judge David A. Ezra (bbb) (Entered: 01/31/2005)",
      "document_number": "36",
      "pacer_doc_id": null,
      "pacer_seq_no": null
    },
    {
      "date_entered": "2005-02-10",
      "date_filed": "2005-02-08",
      "description": "ORDER denying defendant Jason Furtado's motion to dismiss no. 1 [22-1] by Judge David A. Ezra (cc: all counsel) (bbb) (Entered: 02/10/2005)",
      "document_number": "37",
      "pacer_doc_id": null,
      "pacer_seq_no": null
    },
    {
      "date_entered": "2005-02-24",
      "date_filed": "2005-02-18",
      "description": "EP: MINUTES: Defendant Jason Furtado's Motion to Suppress Evidence. Defendant Jason Furtado present in custody. Governments' Witnesses: Robert Pule. Defendant Jason Furtado's Motion to Suppress Evidence-GRANTED. Court to issue order. [20-1] ; Jason Furtado, USA Attorney Edric Ming-Kai Ching, Alexander Silvert present ( Ct Rptr: ESR-LG) by Judge David A. Ezra (bbb) (Entered: 02/24/2005)",
      "document_number": "38",
      "pacer_doc_id": null,
      "pacer_seq_no": null
    },
    {
      "date_entered": "2005-02-25",
      "date_filed": "2005-02-18",
      "description": "EO: MINUTES: Final Pretrial Conference set for 02/22/2005 02:00:00 PM before LEK- CASE TO BE DISMISSED. final pretrial conference held on 2/18/05 by Judge Leslie E. Kobayashi (bbb) (Entered: 02/25/2005)",
      "document_number": "39",
      "pacer_doc_id": null,
      "pacer_seq_no": null
    },
    {
      "date_entered": "2005-03-21",
      "date_filed": "2005-03-17",
      "description": "Notice of Motion; MOTION to remove conditions of bail by defendant Jason Furtado ; declaration of counsel; certificate of service - Motion hearing set for 1:30 03/24/2005 KSC (bbb) (Entered: 03/21/2005)",
      "document_number": "40",
      "pacer_doc_id": null,
      "pacer_seq_no": null
    },
    {
      "date_entered": "2005-03-22",
      "date_filed": "2005-03-21",
      "description": "Defendant Jason Furtado's CLARIFICATION to the motion to remove conditions of bail [40-1]; certificate of service (bbb) (Entered: 03/22/2005)",
      "document_number": "41",
      "pacer_doc_id": null,
      "pacer_seq_no": null
    },
    {
      "date_entered": "2005-03-28",
      "date_filed": "2005-03-23",
      "description": "The United States of America's RESPONSE to Defendant's motion to remove conditions of bail [40-1]; certificate of service (bbb) (Entered: 03/28/2005)",
      "document_number": "42",
      "pacer_doc_id": null,
      "pacer_seq_no": null
    },
    {
      "date_entered": "2005-03-29",
      "date_filed": "2005-03-24",
      "description": "EP: MINUTES: Motion to Remove Conditions of Bail - defendant's presence waived. There being no opposition, Motion granted. Mr. Silvert to prepare the Order. Special Condition 7o (curfew) shall be deleted. All other terms remain. [40-1] to modify conditions of release as to Jason Furtado ; Jason Furtado, USA Attorney Edric Ming-Kai Ching, Alexander Silvert present ( Ct Rptr: C5 1:44:15-1:46:24) by Judge Kevin S.C. Chang (bbb) (Entered: 03/29/2005)",
      "document_number": "43",
      "pacer_doc_id": null,
      "pacer_seq_no": null
    },
    {
      "date_entered": "2005-04-07",
      "date_filed": "2005-04-05",
      "description": "ORDER granting modification of conditions of bail by Mag Judge Barry M. Kurren re [14-1] deft's conditions of bail be modified in that the previosly imposed curfew condition be removed. (bbb) (Entered: 04/07/2005)",
      "document_number": "44",
      "pacer_doc_id": null,
      "pacer_seq_no": null
    },
    {
      "date_entered": "2005-04-12",
      "date_filed": "2005-04-08",
      "description": "ORDER granting Defendant's motion to suppress evidence [20-1] by Judge David A. Ezra as to Defendant Jason Furtado (cc: all counsel) (bbb) (Entered: 04/12/2005)",
      "document_number": "45",
      "pacer_doc_id": null,
      "pacer_seq_no": null
    },
    {
      "date_entered": "2005-04-15",
      "date_filed": "2005-04-13",
      "description": "ORDER for dismissal by Judge David A. Ezra case dismissed as to Jason Furtado (1) count(s) 1. Order for Dismissal., case terminated by USA (bbb) Additional attachment(s) added on 8/2/2006 (bbb, ). (Entered: 04/15/2005)",
      "document_number": "46",
      "pacer_doc_id": "061050570",
      "pacer_seq_no": "28"
    },
    {
      "date_entered": "2006-03-04",
      "date_filed": "2006-03-02",
      "description": "Amended Warrant for Arrest Warrant Returned Executed on 6/8/04. in case as to Jason Furtado. (afc) (Entered: 03/04/2006)",
      "document_number": "47",
      "pacer_doc_id": "06103402",
      "pacer_seq_no": "1407494"
    }
  ],
  "docket_number": "1:04-cr-00233",
  "federal_defendant_number": "1",
  "federal_dn_case_type": "cr",
  "federal_dn_judge_initials_assigned": "DAE",
  "federal_dn_judge_initials_referred": null,
  "federal_dn_office_code": "1",
  "jurisdiction": "",
  "jury_demand": "",
  "mdl_status": "",
  "nature_of_suit": "",
  "ordered_by": "date_filed",
  "parties": [
    {
      "attorneys": [
        {
          "contact": "Office of the Federal Public Defender\nPJKK Federal Building\n300 Ala Moana Blvd Rm 7-104\nHonolulu, HI 96850\n541-2521\nFax: 541-3545\nEmail: alexander_silvert@fd.org\n",
          "name": "Alexander Silvert",
          "roles": [
            "TERMINATED: 04/13/2005",
            "LEAD ATTORNEY",
            "ATTORNEY TO BE NOTICED"
          ]
        },
        {
          "contact": "Office of the Federal Public Defenders\nPJKK Federal Building\n300 Ala Moana Blvd Rm 7-104\nHonolulu, HI 96813\n541-2521\nEmail: hid_resp@hid.uscourts.gov\n",
          "name": "Michael A. Weight",
          "roles": [
            "TERMINATED: 04/13/2005",
            "LEAD ATTORNEY",
            "ATTORNEY TO BE NOTICED"
          ]
        },
        {
          "contact": "Office of the Federal Public Defender\nPJKK Federal Building\n300 Ala Moana Blvd Rm 7-104\nHonolulu, HI 96850\n541-2521\nFax: 541-3545\nEmail: peter_wolff@fd.org\n",
          "name": "Peter C. Wolff",
          "roles": [
            "TERMINATED: 04/13/2005",
            "LEAD ATTORNEY",
            "ATTORNEY TO BE NOTICED"
          ]
        },
        {
          "contact": "547 Halekauwila St Ste 102\nHonolulu, HI 96813\n521-4323\nEmail: wmdomingo@yahoo.com\n",
          "name": "William M. Domingo",
          "roles": [
            "TERMINATED: 04/13/2005",
            "LEAD ATTORNEY",
            "ATTORNEY TO BE NOTICED"
          ]
        }
      ],
      "criminal_data": {
        "complaints": [],
        "counts": [
          {
            "disposition": "Order for Dismissal.",
            "name": "18:922G.F UNLAWFUL POSSESSION OF FIREARMS - a Remington Scoremaster model 511 .22 caliber rifle - 04/12/2004(1)",
            "status": "terminated"
          }
        ],
        "highest_offense_level_opening": "None",
        "highest_offense_level_terminated": "Felony"
      },
      "date_terminated": "2005-04-13",
      "extra_info": "TERMINATED: 04/13/2005",
      "name": "Jason Furtado",
      "type": "Defendant"
    },
    {
      "attorneys": [
        {
          "contact": "Office of the United States Attorney\nPrince Kuhio Federal Building\n300 Ala Moana Blvd Ste 6100\nHonolulu, HI 96850\n541-2850\nEmail: edric.ching@usdoj.gov\n",
          "name": "Edric Ming-Kai Ching",
          "roles": [
            "LEAD ATTORNEY",
            "ATTORNEY TO BE NOTICED"
          ]
        }
      ],
      "date_terminated": null,
      "extra_info": "",
      "name": "USA",
      "type": "Plaintiff"
    }
  ],
  "referred_to_str": ""
}