{
  "assigned_to_str": "Dale A. Kimball",
  "case_name": "United States v. Mitchell",
  "cause": "",
  "court_id": "utd",
  "date_converted": null,
  "date_discharged": null,
  "date_filed": "2008-03-05",
  "date_terminated": "2011-05-26",
  "demand": "",
  "docket_entries": [
    {
      "date_entered": "2008-03-06",
      "date_filed": "2008-03-05",
      "description": "INDICTMENT as to Bryan David Mitchell (1) count(s) 1, 2, Wanda Eileen Barzee (2) count(s) 1, 2.Assigned to Judge Dale A. Kimball (jwt) (Entered: 03/06/2008)",
      "document_number": "1",
      "pacer_doc_id": "18301069018",
      "pacer_seq_no": "7"
    },
    {
      "date_entered": "2008-03-06",
      "date_filed": "2008-03-05",
      "description": "Arrest Warrant Issued in case as to Bryan David Mitchell, Wanda Eileen Barzee. (jwt) Modified by removing unsealing entry per order 120 on 10/26/2009 (rak). Modified by unsealing the document per minute entry 131 on 10/30/2009 (rak). (Entered: 03/06/2008)",
      "document_number": "2",
      "pacer_doc_id": "18301069024",
      "pacer_seq_no": "17"
    },
    {
      "date_entered": "2008-03-10",
      "date_filed": "2008-03-10",
      "description": "NOTICE OF ATTORNEY APPEARANCE Brett L. Tolman appearing for USA. (Tolman, Brett) (Entered: 03/10/2008)",
      "document_number": "3",
      "pacer_doc_id": "18301072149",
      "pacer_seq_no": "23"
    },
    {
      "date_entered": "2008-10-16",
      "date_filed": "2008-10-16",
      "description": "MOTION for Writ of Habeas Corpus ad prosequendum by USA as to Bryan David Mitchell. (Attachments: # 1 Text of Proposed Order)(Lambert, Richard) (Entered: 10/16/2008)",
      "document_number": "4",
      "pacer_doc_id": "18301244414",
      "pacer_seq_no": "27"
    },
    {
      "date_entered": "2008-10-16",
      "date_filed": "2008-10-16",
      "description": "DOCKET TEXT ORDER granting 4 Motion for Writ of Habeas Corpus ad Prosequendum as to Bryan David Mitchell (1). Signed by Magistrate Judge Samuel Alba on 10/16/08. No attached document. (cas) (Entered: 10/16/2008)",
      "document_number": "5",
      "pacer_doc_id": null,
      "pacer_seq_no": null
    },
    {
      "date_entered": "2008-10-16",
      "date_filed": "2008-10-16",
      "description": "Writ of Habeas Corpus ad Prosequendum issued as to Bryan David Mitchell for 10/20/08 at 12:00 p.m. before Judge Magistrate Judge Samuel Alba. (cas) (Entered: 10/16/2008)",
      "document_number": "6",
      "pacer_doc_id": "18301244424",
      "pacer_seq_no": "32"
    },
    {
      "date_entered": "2008-10-17",
      "date_filed": "2008-10-17",
      "description": "NOTICE OF ATTORNEY APPEARANCE David F. Backman appearing for USA. (Backman, David) (Entered: 10/17/2008)",
      "document_number": "7",
      "pacer_doc_id": "18301245176",
      "pacer_seq_no": "34"
    },
    {
      "date_entered": "2008-10-20",
      "date_filed": "2008-10-20",
      "description": "NOTICE OF ATTORNEY APPEARANCE Diana Hagen appearing for USA. (Hagen, Diana) (Entered: 10/20/2008)",
      "document_number": "8",
      "pacer_doc_id": "18301246364",
      "pacer_seq_no": "38"
    },
    {
      "date_entered": "2008-10-20",
      "date_filed": "2008-10-20",
      "description": "MOTION for Hearing To Determine the Mental Competency of Defendant by USA as to Bryan David Mitchell. (Tolman, Brett) (Entered: 10/20/2008)",
      "document_number": "9",
      "pacer_doc_id": "18301246381",
      "pacer_seq_no": "42"
    },
    {
      "date_entered": "2008-10-20",
      "date_filed": "2008-10-20",
      "description": "NOTICE OF ATTORNEY APPEARANCE: Parker Douglas appearing for Bryan David Mitchell (Douglas, Parker) (Entered: 10/20/2008)",
      "document_number": "10",
      "pacer_doc_id": "18301246781",
      "pacer_seq_no": "45"
    },
    {
      "date_entered": "2008-10-20",
      "date_filed": "2008-10-20",
      "description": "NOTICE OF ATTORNEY APPEARANCE: Steven B. Killpack appearing for Bryan David Mitchell (Killpack, Steven) (Entered: 10/20/2008)",
      "document_number": "11",
      "pacer_doc_id": "18301246821",
      "pacer_seq_no": "49"
    },
    {
      "date_entered": "2008-10-20",
      "date_filed": "2008-10-20",
      "description": "NOTICE OF HEARING as to Bryan David Mitchell: Arraignment continued to 10/24/2008 at 11:00 a.m. before Magistrate Judge Samuel Alba. The hearing will be held in Judge Kimball's courtroom. (cas) (Entered: 10/20/2008)",
      "document_number": "12",
      "pacer_doc_id": null,
      "pacer_seq_no": null
    },
    {
      "date_entered": "2008-10-21",
      "date_filed": "2008-10-20",
      "description": "Arrest Warrant Returned Executed on 10/20/08, filed on 10/20/08 in case as to Bryan David Mitchell. (jwt) (Entered: 10/21/2008)",
      "document_number": "14",
      "pacer_doc_id": "18301247130",
      "pacer_seq_no": "57"
    },
    {
      "date_entered": "2008-10-21",
      "date_filed": "2008-10-20",
      "description": "REMARK- Hearing was set for an initial appearance and an arraignment. Defendant Bryan David Mitchell was present. Court appointed the Federal Public Defenders office to represent the defendant. Defendant disrupted the proceedings. Court canceled the hearing. Hearing will be reset. Court instructed the USMS to provide a room where the defendant may participate by video. Defendant was remanded to the custody of the USMS. (ss) (Entered: 10/21/2008)",
      "document_number": "15",
      "pacer_doc_id": null,
      "pacer_seq_no": null
    },
    {
      "date_entered": "2008-10-21",
      "date_filed": "2008-10-21",
      "description": "NOTICE OF ATTORNEY APPEARANCE: Robert L. Steele appearing for Bryan David Mitchell (Steele, Robert) (Entered: 10/21/2008)",
      "document_number": "13",
      "pacer_doc_id": "18301247094",
      "pacer_seq_no": "54"
    },
    {
      "date_entered": "2008-10-24",
      "date_filed": "2008-10-24",
      "description": "RESPONSE to Motion by Bryan David Mitchell re 9 MOTION for Hearing To Determine the Mental Competency of Defendant (Killpack, Steven) (Entered: 10/24/2008)",
      "document_number": "16",
      "pacer_doc_id": "18301250265",
      "pacer_seq_no": "62"
    },
    {
      "date_entered": "2008-10-28",
      "date_filed": "2008-10-24",
      "description": "Minute Entry for proceedings held before Judge Magistrate Judge Samuel Alba. Initial Appearance,arraignment as to Bryan David Mitchell held on 10/24/2008. Defendant present and in custody. Court asked counsel to have Mr. Mitchell to refrain from singing. Mr. Mitchell continued disrupting the proceedings. Court had the defendant removed from the courtroom and placed in an area where he was able to hear and see the proceedings. This was confirmed by Deputy Monks. Mr. Mitchell was also accompanied by counsel, Mr. Steele. Charging document read, rights and penalties explained. Court entered a plea of not guilty for the defendant. Court requested that any and all reports regarding the defendant be made available to court and the FPD office by 10/31/08. Government has until 10/31/08 to file their response to defendant's memorandum in opposition to the motion for a competency hearing. After reviewing the documents and briefs, Court will make a determination of whether to send the defendant for a competency evaluation. Pretrial Conference as to Bryan David Mitchell held on 10/24/2008. Discovery due by 11/7/2008, Motions due by 12/3/2008, Fourteen day Jury Trial set for 12/22/2008 08:30 AM before Judge Dale A. Kimball. Court set the matter for a status conference on 11/12/2008 at 10:00 AM before Magistrate Judge Samuel Alba. Attorney for Plaintiff: Brett Tolman, Richard Lambert, Dave Backman, Diana Hagen, Attorney for Defendant: Steve Killpack, Bob Steele, Parker Douglas, fpd. Court Reporter: Becky Janke. (ss) (Entered: 10/28/2008)",
      "document_number": "17",
      "pacer_doc_id": null,
      "pacer_seq_no": null
    },
    {
      "date_entered": "2008-10-31",
      "date_filed": "2008-10-31",
      "description": "REPLY TO RESPONSE to Motion by USA as to Bryan David Mitchell re 9 MOTION for Hearing To Determine the Mental Competency of Defendant (Hagen, Diana) (Entered: 10/31/2008)",
      "document_number": "18",
      "pacer_doc_id": "18301256469",
      "pacer_seq_no": "77"
    },
    {
      "date_entered": "2008-11-03",
      "date_filed": "2008-11-03",
      "description": "Defendant's MOTION for Leave to File Responsive Brief to Government's Reply to Motion for Hearing to Determine The Mental Capacity of Defendant filed by Bryan David Mitchell. (Attachments: # 1 Text of Proposed Order)(Killpack, Steven) (Entered: 11/03/2008)",
      "document_number": "19",
      "pacer_doc_id": "18301257242",
      "pacer_seq_no": "80"
    },
    {
      "date_entered": "2008-11-03",
      "date_filed": "2008-11-03",
      "description": "ORDER granting 19 Motion for Leave to File as to Bryan David Mitchell (1). Defendant may have until November 7, 2008, to file a responsive brief, and the government may have until November 10, 2008, to reply. Signed by Magistrate Judge Samuel Alba on 11/3/08. (cas) (Entered: 11/03/2008)",
      "document_number": "20",
      "pacer_doc_id": "18301257631",
      "pacer_seq_no": "83"
    },
    {
      "date_entered": "2008-11-06",
      "date_filed": "2008-11-06",
      "description": "REPLY TO RESPONSE to Motion by Bryan David Mitchell re 9 MOTION for Hearing To Determine the Mental Competency of Defendant (Attachments: # 1 Exhibit)(Killpack, Steven) (Entered: 11/06/2008)",
      "document_number": "21",
      "pacer_doc_id": "18301261620",
      "pacer_seq_no": "85"
    },
    {
      "date_entered": "2008-11-06",
      "date_filed": "2008-11-06",
      "description": "MOTION for Hearing re Detention filed by Bryan David Mitchell. (Killpack, Steven) (Entered: 11/06/2008)",
      "document_number": "22",
      "pacer_doc_id": "18301261665",
      "pacer_seq_no": "88"
    },
    {
      "date_entered": "2008-11-10",
      "date_filed": "2008-11-10",
      "description": "REPLY TO RESPONSE to Motion by USA as to Bryan David Mitchell re 9 MOTION for Hearing To Determine the Mental Competency of Defendant SECOND REPLY (Attachments: # 1 Procedures for Examination, # 2 Local Competency Evaluations, # 3 Committed Competency Evaluations)(Hagen, Diana) (Entered: 11/10/2008)",
      "document_number": "23",
      "pacer_doc_id": "18301263967",
      "pacer_seq_no": "91"
    },
    {
      "date_entered": "2008-11-14",
      "date_filed": "2008-11-12",
      "description": "Minute Entry for proceedings held before Magistrate Judge Samuel Alba. Defendant present in custody with counsel. Defendant began singing during the proceedings. Court asked the defendant if he would sit quietly and listen to the proceedings. Counsel stated on the record that the defendant has been non responsive with them as well. Court ordered that Mr. Mitchell be removed from the courtroom and placed in an area where he will be able to see and hear the proceedings without disrupting them. Counsel for the defendant stated on the record that Mr. Steele will be present with the defendant during the proceedings. USMS confirmed that the defendant was now in the holding cell and was able to hear and see the proceedings. After hearing arguments from counsel, Court granted the 9 MOTION for Hearing To Determine the Mental Competency of Defendant filed by USA. Court ordered the defendant be sent, in the custody of the USMS, transferred to the Bureau of Prisons for an inpatient mental competency evaluation. Due to the defendant appearing on a writ from state custody the 22 MOTION for a detention hearing is moot. Defendant will remain in the custody of the USMS. Court ordered the government to prepare an order. Attorney for Plaintiff: Brett Tolman, Dave Backman, Diana Hagen, Richard Lambert, AUSA, Attorney for Defendant: Steve Killpack, Parker Douglas, Audrey James, Bob Steele, fpd. Court Reporter: Electronic.(Time Start: 13:05, Time End: 36:38, Room 248.) (ss) (Entered: 11/14/2008)",
      "document_number": "26",
      "pacer_doc_id": null,
      "pacer_seq_no": null
    },
    {
      "date_entered": "2008-11-13",
      "date_filed": "2008-11-13",
      "description": "GOVERNMENTS STATEMENT OF DISCOVERY POLICY by USA as to Bryan David Mitchell (Tolman, Brett) (Entered: 11/13/2008)",
      "document_number": "24",
      "pacer_doc_id": "18301266217",
      "pacer_seq_no": "94"
    },
    {
      "date_entered": "2008-11-13",
      "date_filed": "2008-11-13",
      "description": "First CERTIFICATE OF COMPLIANCE filed by USA as to Bryan David Mitchell. (Tolman, Brett) (Entered: 11/13/2008)",
      "document_number": "25",
      "pacer_doc_id": "18301266223",
      "pacer_seq_no": "96"
    },
    {
      "date_entered": "2008-11-14",
      "date_filed": "2008-11-14",
      "description": "ORDER as to Bryan David Mitchell re 26 Motion Hearing. Follows oral order of 11/12/08. Signed by Magistrate Judge Samuel Alba on 11/14/08. (cas) (Entered: 11/14/2008)",
      "document_number": "27",
      "pacer_doc_id": "18301267310",
      "pacer_seq_no": "105"
    },
    {
      "date_entered": "2008-11-18",
      "date_filed": "2008-11-18",
      "description": "Defendant's MOTION to Clarify and Supplement the Order for Competency Determination re 27 Order - Written Order Following Oral Order on Motion filed by Bryan David Mitchell. (Attachments: # 1 Text of Proposed Order)(Steele, Robert) (Entered: 11/18/2008)",
      "document_number": "28",
      "pacer_doc_id": "18301270591",
      "pacer_seq_no": "108"
    },
    {
      "date_entered": "2008-11-19",
      "date_filed": "2008-11-19",
      "description": "ORDER as to Bryan David Mitchell re 26 Amended Order for Competency Determination Pursuant to 18 U.S.C. 4241. Follows oral order of 11/12/08. Signed by Magistrate Judge Samuel Alba on 11/19/08. (cas) (Entered: 11/19/2008)",
      "document_number": "29",
      "pacer_doc_id": "18301270966",
      "pacer_seq_no": "112"
    },
    {
      "date_entered": "2008-12-05",
      "date_filed": "2008-12-05",
      "description": "Terminate Deadlines and Hearings as to Bryan David Mitchell: The motion filing deadline of 12/3/08 and the Jury trial set for 12/22/08 are vacated as the dft is undergoing a competency evaluation at this time. (kmj) (Entered: 12/05/2008)",
      "document_number": null,
      "pacer_doc_id": null,
      "pacer_seq_no": null
    },
    {
      "date_entered": "2008-12-12",
      "date_filed": "2008-12-12",
      "description": "** RESTRICTED DOCUMENT ** RETURN OF SERVICE Executed for Amended Order for Competency Determination on 12/4/08 as to Bryan David Mitchell. (jwt) (Entered: 12/12/2008)",
      "document_number": "30",
      "pacer_doc_id": "18301288918",
      "pacer_seq_no": "119"
    },
    {
      "date_entered": "2008-12-19",
      "date_filed": "2008-12-19",
      "description": "MOTION to Correct Spelling of Defendant's Name filed by Bryan David Mitchell. (Attachments: # 1 Text of Proposed Order)(Killpack, Steven) (Entered: 12/19/2008)",
      "document_number": "31",
      "pacer_doc_id": "18301294855",
      "pacer_seq_no": "121"
    },
    {
      "date_entered": "2008-12-22",
      "date_filed": "2008-12-22",
      "description": "ORDER granting 31 Motion to Correct Spelling of Dft Name as to Bryan David Mitchell (1). Signed by Magistrate Judge Samuel Alba on 12/22/08 (alt) (Entered: 12/22/2008)",
      "document_number": "32",
      "pacer_doc_id": "18301295552",
      "pacer_seq_no": "124"
    },
    {
      "date_entered": "2008-12-22",
      "date_filed": "2008-12-22",
      "description": "NAME CORRECTION as to Bryan David Mitchell. Original Name: Bryan David Mitchell. Corrected Name: Brian David Mitchell. Refer to document number: 32 (alt) (Entered: 12/22/2008)",
      "document_number": null,
      "pacer_doc_id": null,
      "pacer_seq_no": null
    },
    {
      "date_entered": "2009-02-17",
      "date_filed": "2009-02-17",
      "description": "NOTICE OF HEARING as to Brian David Mitchell: Status Conference set for 2/27/2009 10:00 AM in Judge Kimball's courtroom, Room 230, before Magistrate Judge Samuel Alba. (cas) (Entered: 02/17/2009)",
      "document_number": "33",
      "pacer_doc_id": null,
      "pacer_seq_no": null
    },
    {
      "date_entered": "2009-02-25",
      "date_filed": "2009-02-24",
      "description": "**SEALED DOCUMENT**DOCUMENTS LODGED consisting of letter to the court from BOP. (jwt) Modified by unsealing entry per order 120 on 10/26/2009 (rak). (Entered: 02/25/2009)",
      "document_number": "34",
      "pacer_doc_id": "18301344940",
      "pacer_seq_no": "131"
    },
    {
      "date_entered": "2009-02-25",
      "date_filed": "2009-02-25",
      "description": "Defendant's MOTION to Waive Appearance at Scheduling Conference filed by Brian David Mitchell. (Killpack, Steven) (Entered: 02/25/2009)",
      "document_number": "35",
      "pacer_doc_id": "18301345227",
      "pacer_seq_no": "133"
    },
    {
      "date_entered": "2009-02-25",
      "date_filed": "2009-02-25",
      "description": "AFFIDAVIT in Support by Affiant Robert L. Steele by Brian David Mitchell re 35 Defendant's MOTION to Waive Appearance at Scheduling Conference (jwt) (Entered: 02/25/2009)",
      "document_number": "36",
      "pacer_doc_id": "18301345380",
      "pacer_seq_no": "136"
    },
    {
      "date_entered": "2009-02-26",
      "date_filed": "2009-02-26",
      "description": "DOCKET TEXT ORDER denying 35 Motion to Waive Appearance as to Brian David Mitchell (1). Signed by Magistrate Judge Samuel Alba on 2/26/09. No attached document. (cas) (Entered: 02/26/2009)",
      "document_number": "37",
      "pacer_doc_id": null,
      "pacer_seq_no": null
    },
    {
      "date_entered": "2009-02-27",
      "date_filed": "2009-02-27",
      "description": "Minute Entry for proceedings held before Magistrate Judge Samuel Alba. Status Conference as to Brian David Mitchell held on 2/27/2009. Defendant present with counsel. Defendant began singing when he entered the courtroom. Defendant continued singing while Judge began talking. Judge had the defendant removed from the proceedings and taken to a room where the defendant can hear but cannot disrupt the proceedings. USMS confirmed that the defendant could hear the proceedings. Government stated that they are in the process of retaining a forensic expert. Counsel requested more time to obtain copies of all documents and tapes of interviews. Court set the matter for a status conference on 4/8/2009 at 09:00 AM before Magistrate Judge Samuel Alba. Defendant does not need to be present for this hearing. Attorney for Plaintiff: Richard Lambert, Brett Tolman, AUSA, Attorney for Defendant: Bob Steele, fpd. Court Reporter: Patti Walker. (ss) (Entered: 02/27/2009)",
      "document_number": "38",
      "pacer_doc_id": null,
      "pacer_seq_no": null
    },
    {
      "date_entered": "2009-03-05",
      "date_filed": "2009-03-05",
      "description": "**SEALED DOCUMENT**DOCUMENTS LODGED consisting of letter from the BOP received on 2/24/09. (jwt) Modified by unsealing entry per order 120 on 10/26/2009 (rak). (Entered: 03/05/2009)",
      "document_number": "39",
      "pacer_doc_id": "18301351535",
      "pacer_seq_no": "145"
    },
    {
      "date_entered": "2009-03-17",
      "date_filed": "2009-03-17",
      "description": "NOTICE OF FILING OF OFFICIAL TRANSCRIPT of Proceedings as to Brian David Mitchell held on February 27, 2009-Status Conference before Judge Samuel Alba. Court Reporter/Transcriber Patti Walker, CSR, RPR, Telephone number 801-364-5440. NOTICE RE REDACTION OF TRANSCRIPTS: Within 7 calendar days of this filing, each party shall inform the Court, by filing a Notice of Intent to Redact, of the parties intent to redact personal data identifiers from the electronic transcript of the court proceeding. The policy and forms are located on the court's website at www.utd.uscourts.gov. Please read this policy carefully. If no Notice of Intent to Redact is filed within the allotted time, this transcript will be made electronically available on the date set forth below. Transcript may be viewed at the court public terminal or purchased through the Court Reporter/Transcriber before the deadline for Release of Transcript Restriction. After that date it may be obtained through PACER. Redaction Request due 4/7/2009. Redacted Transcript Deadline set for 4/17/2009. Release of Transcript Restriction set for 6/15/2009. (jmr) Modified on 6/19/2009 - removed restricted text (rak). (Entered: 03/17/2009)",
      "document_number": "40",
      "pacer_doc_id": "18301361404",
      "pacer_seq_no": "147"
    },
    {
      "date_entered": "2009-03-19",
      "date_filed": "2009-03-19",
      "description": "MOTION for Issuance of Order to Allow Government/Defense Investigators and Attorneys Access to Utah State Hospital and Staff by USA as to Brian David Mitchell. (Attachments: # 1 Text of Proposed Order)(Tolman, Brett) (Entered: 03/19/2009)",
      "document_number": "42",
      "pacer_doc_id": "18301364380",
      "pacer_seq_no": "152"
    },
    {
      "date_entered": "2009-03-20",
      "date_filed": "2009-03-20",
      "description": "ORDER granting 42 Motion for Issuance of Order to Allow Government/Defense Investigators and Attorneys Access to Utah State Hospital and Staffas to Brian David Mitchell (1). Signed by Judge Dale A. Kimball on 3/20/09. (jwt) (Entered: 03/20/2009)",
      "document_number": "43",
      "pacer_doc_id": "18301365168",
      "pacer_seq_no": "155"
    },
    {
      "date_entered": "2009-04-06",
      "date_filed": "2009-04-06",
      "description": "MOTION to Continue Reset Status Hearing by USA as to Brian David Mitchell. (Attachments: # 1 Text of Proposed Order)(Lambert, Richard) (Entered: 04/06/2009)",
      "document_number": "44",
      "pacer_doc_id": "18301379399",
      "pacer_seq_no": "157"
    },
    {
      "date_entered": "2009-04-07",
      "date_filed": "2009-04-07",
      "description": "DOCKET TEXT ORDER granting 44 Motion to Continue as to Brian David Mitchell (1). The hearing scheduled for April 8, 2009, is hereby stricken, and the matter continued to April 30, 2009, at 11:00 a.m. Signed by Magistrate Judge Samuel Alba on 4/7/09. No attached document. (cas) (Entered: 04/07/2009)",
      "document_number": "45",
      "pacer_doc_id": null,
      "pacer_seq_no": null
    },
    {
      "date_entered": "2009-04-07",
      "date_filed": "2009-04-07",
      "description": "NOTICE OF HEARING as to Brian David Mitchell: Status Conference set for 4/30/2009 11:00 AM in Room 248 before Magistrate Judge Samuel Alba. (cas) (Entered: 04/07/2009)",
      "document_number": "46",
      "pacer_doc_id": null,
      "pacer_seq_no": null
    },
    {
      "date_entered": "2009-04-30",
      "date_filed": "2009-04-30",
      "description": "Minute Entry for proceedings held before Magistrate Judge Samuel Alba: Status Conference as to Brian David Mitchell held on 4/30/2009. Counsel for government and defendant present. Government counsel stated that Mr. Mitchell has been interviewed by their forensic expert. Dr. Wellner requested 6 (six) weeks to review all documents and prepare his report. Court set the matter for a status conference on 6/18/2009 at 09:00 AM in Room 248 before Magistrate Judge Samuel Alba. Government stated that they will provide all discovery by 6/18/09. All time is excluded pursuant to the Speedy Trial Act. Mr. Lambert to prepare an order. Defense counsel waived Mr. Mitchell's presence at the hearing set for 6/18/09. Attorney for Plaintiff: Richard Lambert, AUSA, Attorney for Defendant: Parker Douglas and Bob Steele, fpd. Court Reporter: Electronic.(Time Start: 8:55, Time End: 15:56, Room 248.) (ss) (Entered: 04/30/2009)",
      "document_number": "47",
      "pacer_doc_id": null,
      "pacer_seq_no": null
    },
    {
      "date_entered": "2009-05-05",
      "date_filed": "2009-05-05",
      "description": "**SEALED DOCUMENT**Sealed Notice of Hearing for 5/7/09. (kmj) Modified by unsealing entry per order 120 on 10/26/2009 (rak). (Entered: 05/05/2009)",
      "document_number": "48",
      "pacer_doc_id": "18301403962",
      "pacer_seq_no": "169"
    },
    {
      "date_entered": "2009-05-07",
      "date_filed": "2009-05-07",
      "description": "Minute Entry for proceedings held before Judge Dale A. Kimball: SEALED MINUTE ENTRY for miscellaneous hearing as to Brian David Mitchell held on 5/7/2009. The dft was not present. The Court advised counsel that a potential witness in the forthcoming competency hearing, Dr. Paul Whitehead, is the brother of one of Judge Kimball's law clerks, but that clerk will have no involvement in the case. The Court directed counsel to consider the matter and file a written pleading by 5/29/09 indicating whether or not Judge Kimball should recuse himself from this case. A discussion was held regarding the nature and probable length of the competency hearing. Attorney for Plaintiff: Richard Lambert, AUSA; David Backman, AUSA; Diana Hagen, AUSA; Alicia Cook, SAUSA. Attorney for Defendant: Steven Killpack, FPD; Robert Steele, AFPD; Parker Douglas, AFPD. Court Reporter: Ed Young. (kmj) Modified on 10/26/2009 (kmj). Modified by unsealing docket entry per order 120 on 10/26/2009 (rak). (Entered: 05/07/2009)",
      "document_number": "49",
      "pacer_doc_id": null,
      "pacer_seq_no": null
    },
    {
      "date_entered": "2009-05-08",
      "date_filed": "2009-05-08",
      "description": "Second CERTIFICATE OF COMPLIANCE filed by USA as to Brian David Mitchell. (Backman, David) (Entered: 05/08/2009)",
      "document_number": "50",
      "pacer_doc_id": "18301406655",
      "pacer_seq_no": "174"
    },
    {
      "date_entered": "2009-05-12",
      "date_filed": "2009-05-12",
      "description": "ENTRY ERROR - ORDER TO BE RE-ENTERED ON THE DOCKET. ORDER TO CONTINUE - Ends of Justice as to Brian David Mitchell. Time excluded from 5/1/09 until 6/18/09. Signed by Magistrate Judge Samuel Alba on 5/11/09. (jwt) Modified on 5/12/2009 (ce) (Entered: 05/12/2009)",
      "document_number": "51",
      "pacer_doc_id": "18301408849",
      "pacer_seq_no": "176"
    },
    {
      "date_entered": "2009-05-12",
      "date_filed": "2009-05-12",
      "description": "Terminate Deadlines and Hearings as to Brian David Mitchell, Wanda Eileen Barzee: Note: the competency hearing set in order 51 was incorrect. The hearing set for 6/18/09 is a Status Conference before Magistrate Judge Samuel Alba. (ce) (Entered: 05/12/2009)",
      "document_number": null,
      "pacer_doc_id": null,
      "pacer_seq_no": null
    },
    {
      "date_entered": "2009-05-12",
      "date_filed": "2009-05-12",
      "description": "ORDER that the Status Conference has been continued until 6/18/09 at 9:00 a.m. as to Brian David Mitchell, to be heard before Magistrate Judge Samuel Alba. Signed by Magistrate Judge Samuel Alba on 5/11/09. (ce) (Entered: 05/12/2009)",
      "document_number": "52",
      "pacer_doc_id": "18301409147",
      "pacer_seq_no": "182"
    },
    {
      "date_entered": "2009-05-28",
      "date_filed": "2009-05-28",
      "description": "Third CERTIFICATE OF COMPLIANCE filed by USA as to Brian David Mitchell. (Tolman, Brett) (Entered: 05/28/2009)",
      "document_number": "54",
      "pacer_doc_id": "18301422731",
      "pacer_seq_no": "187"
    },
    {
      "date_entered": "2009-06-01",
      "date_filed": "2009-06-01",
      "description": "Fourth CERTIFICATE OF COMPLIANCE filed by USA as to Brian David Mitchell. (Tolman, Brett) (Entered: 06/01/2009)",
      "document_number": "55",
      "pacer_doc_id": "18301425290",
      "pacer_seq_no": "189"
    },
    {
      "date_entered": "2009-06-18",
      "date_filed": "2009-06-18",
      "description": "Minute Entry for proceedings held before Magistrate Judge Samuel Alba. Status Conference as to Brian David Mitchell held on 6/18/2009. Defendant was not present. After hearing from counsel, Court set the following deadlines: motions in limine are to be filed by 8/10/2009. Court set a status report and scheduling conference for 8/17/2009 at 09:00 AM in Room 248 before Magistrate Judge Samuel Alba. Attorney for Plaintiff: Richard Lambert, AUSA, Attorney for Defendant: Bob Steele, Parker Douglas, Audrey James, fpd. Court Reporter: Electronic.(Time Start: :00, Time End: 10:07, Room 248.) (ss) (Entered: 06/18/2009)",
      "document_number": "56",
      "pacer_doc_id": null,
      "pacer_seq_no": null
    },
    {
      "date_entered": "2009-07-06",
      "date_filed": "2009-07-06",
      "description": "Defendant's MOTION to Compel Evidence filed by Brian David Mitchell. (Attachments: # 1 Exhibit)(Steele, Robert) (Entered: 07/06/2009)",
      "document_number": "57",
      "pacer_doc_id": "18301455432",
      "pacer_seq_no": "196"
    },
    {
      "date_entered": "2009-07-20",
      "date_filed": "2009-07-20",
      "description": "Fifth CERTIFICATE OF COMPLIANCE filed by USA as to Brian David Mitchell. (Tolman, Brett) (Entered: 07/20/2009)",
      "document_number": "58",
      "pacer_doc_id": "18301467923",
      "pacer_seq_no": "199"
    },
    {
      "date_entered": "2009-07-21",
      "date_filed": "2009-07-21",
      "description": "NOTICE of Partial Resolution of Defendant's Motion to Compel Evidence by Brian David Mitchell re 57 Defendant's MOTION to Compel Evidence (Attachments: # 1 Exhibit A) (Steele, Robert) (Entered: 07/21/2009)",
      "document_number": "59",
      "pacer_doc_id": "18301469303",
      "pacer_seq_no": "201"
    },
    {
      "date_entered": "2009-07-28",
      "date_filed": "2009-07-28",
      "description": "Amended MOTION to Compel Evidence, Defendant's MOTION to Continue Scheduling Conference filed by Brian David Mitchell. (Attachments: # 1 Exhibit A)(Steele, Robert) (Entered: 07/28/2009)",
      "document_number": "60",
      "pacer_doc_id": "18301475536",
      "pacer_seq_no": "204"
    },
    {
      "date_entered": "2009-08-03",
      "date_filed": "2009-08-03",
      "description": "RESPONSE to Motion by USA as to Brian David Mitchell re 60 Amended MOTION to Compel EvidenceDefendant's MOTION to Continue Scheduling Conference (Lambert, Richard) (Entered: 08/03/2009)",
      "document_number": "61",
      "pacer_doc_id": "18301480844",
      "pacer_seq_no": "209"
    },
    {
      "date_entered": "2009-08-04",
      "date_filed": "2009-08-04",
      "description": "DOCKET TEXT ORDER granting 60 Motion to Compel as to Brian David Mitchell (1); granting 60 Motion to Continue as to Brian David Mitchell (1). The scheduling conference is continued to August 31, 2009, at 10:00 a.m. Signed by Magistrate Judge Samuel Alba on 8/4/09. No attached document. (cas) (Entered: 08/04/2009)",
      "document_number": "62",
      "pacer_doc_id": null,
      "pacer_seq_no": null
    },
    {
      "date_entered": "2009-08-04",
      "date_filed": "2009-08-04",
      "description": "AMENDED NOTICE OF HEARING as to Brian David Mitchell:The Scheduling Conference previously set for 8/17/09 has been continued to 8/31/2009 at 10:00 a.m. in Room 248 before Magistrate Judge Samuel Alba. (cas) (Entered: 08/04/2009)",
      "document_number": "63",
      "pacer_doc_id": null,
      "pacer_seq_no": null
    },
    {
      "date_entered": "2009-08-12",
      "date_filed": "2009-08-11",
      "description": "ORDER/STIPULATION AND AGREEMENT re: non-public information as to Brian David Mitchell. Signed by Judge Dale A. Kimball on 8/11/09. (las) (Entered: 08/12/2009)",
      "document_number": "64",
      "pacer_doc_id": "18301488158",
      "pacer_seq_no": "218"
    },
    {
      "date_entered": "2009-08-13",
      "date_filed": "2009-08-12",
      "description": "ORDER EXCLUDING TIME as to Brian David Mitchell. Signed by Magistrate Judge Samuel Alba on 8/12/09. (las) (Entered: 08/13/2009)",
      "document_number": "65",
      "pacer_doc_id": "18301489349",
      "pacer_seq_no": "220"
    },
    {
      "date_entered": "2009-08-21",
      "date_filed": "2009-08-21",
      "description": "NOTICE OF ATTORNEY APPEARANCE: Audrey K. James appearing for Brian David Mitchell (James, Audrey) (Entered: 08/21/2009)",
      "document_number": "66",
      "pacer_doc_id": "18301495605",
      "pacer_seq_no": "225"
    },
    {
      "date_entered": "2009-08-24",
      "date_filed": "2009-08-24",
      "description": "Defendant's MOTION Requesting Deadlines for the Filing of Final Expert Reports filed by Brian David Mitchell. (Steele, Robert) (Entered: 08/24/2009)",
      "document_number": "67",
      "pacer_doc_id": "18301497104",
      "pacer_seq_no": "228"
    },
    {
      "date_entered": "2009-08-24",
      "date_filed": "2009-08-24",
      "description": "Defendant's MOTION to Exclude Expert Testimony and Objection to Introduction of Writings by Ervil LeBaron filed by Brian David Mitchell. (Steele, Robert) (Entered: 08/24/2009)",
      "document_number": "68",
      "pacer_doc_id": "18301497225",
      "pacer_seq_no": "231"
    },
    {
      "date_entered": "2009-08-24",
      "date_filed": "2009-08-24",
      "description": "Defendant's MOTION to Exclude the Introduction of all Lay Witness Testimony as Irrelevant, Unfairly Prejudicial and Cumulative filed by Brian David Mitchell. (Steele, Robert) (Entered: 08/24/2009)",
      "document_number": "69",
      "pacer_doc_id": "18301497228",
      "pacer_seq_no": "234"
    },
    {
      "date_entered": "2009-08-24",
      "date_filed": "2009-08-24",
      "description": "**SEALED DOCUMENT** MEMORANDUM in Support by Brian David Mitchell re 69 Defendant's MOTION to Exclude the Introduction of all Lay Witness Testimony as Irrelevant, Unfairly Prejudicial and Cumulative (Steele, Robert) Modified on 8/25/2009 sealed the docket entry(las). Modified by unsealing docket entry per order 120 on 10/26/2009 (rak). (Entered: 08/24/2009)",
      "document_number": "70",
      "pacer_doc_id": "18301497237",
      "pacer_seq_no": "237"
    },
    {
      "date_entered": "2009-08-25",
      "date_filed": "2009-08-24",
      "description": "**SEALED DOCUMENT**Sealed Attachments re 69 Defendant's MOTION to Exclude the Introduction of all Lay Witness Testimony as Irrelevant, Unfairly Prejudicial and Cumulative by Brian David Mitchell (las) Modified by unsealing docket entry per order 120 on 10/26/2009 (rak). (Entered: 08/25/2009)",
      "document_number": "74",
      "pacer_doc_id": "18301497680",
      "pacer_seq_no": "248"
    },
    {
      "date_entered": "2009-08-25",
      "date_filed": "2009-08-24",
      "description": "**SEALED DOCUMENT**Sealed Memorandum in Support re 68 Defendant's MOTION to Exclude Expert Testimony and Objection to Introduction of Writings by Ervil LeBaron by Brian David Mitchell (las) Modified by unsealing docket entry per order 120 on 10/26/2009 (rak). (Entered: 08/25/2009)",
      "document_number": "75",
      "pacer_doc_id": "18301497745",
      "pacer_seq_no": "251"
    },
    {
      "date_entered": "2009-08-25",
      "date_filed": "2009-08-25",
      "description": "MODIFICATION OF DOCKET re 70 MEMORANDUM in Support, as to Brian David Mitchell. The document has information that needed to be redacted. The document was sealed and will be refiled with that information redacted. (las) (Entered: 08/25/2009)",
      "document_number": "71",
      "pacer_doc_id": null,
      "pacer_seq_no": null
    },
    {
      "date_entered": "2009-08-25",
      "date_filed": "2009-08-25",
      "description": "***STAFF NOTES as to Brian David Mitchell: Valarie from the FPD's office called and said that the 70 Memorandum in Support they filed had information about the victim that needed to be redacted. The document was sealed and they will refile the document with the information redacted. (las) Modified by removing court only restriction per minute entry 131 on 10/30/2009 (rak). (Entered: 08/25/2009)",
      "document_number": "72",
      "pacer_doc_id": null,
      "pacer_seq_no": null
    },
    {
      "date_entered": "2009-08-25",
      "date_filed": "2009-08-25",
      "description": "MEMORANDUM in Support by Brian David Mitchell re 69 Defendant's MOTION to Exclude the Introduction of all Lay Witness Testimony as Irrelevant, Unfairly Prejudicial and Cumulative (Steele, Robert) (Entered: 08/25/2009)",
      "document_number": "73",
      "pacer_doc_id": "18301497516",
      "pacer_seq_no": "245"
    },
    {
      "date_entered": "2009-08-27",
      "date_filed": "2009-08-27",
      "description": "NOTICE OF HEARING ON MOTION in case as to Brian David Mitchell re 67 Defendant's MOTION Requesting Deadlines for the Filing of Final Expert Reports: Motion Hearing set for 8/31/2009 10:00 AM in Room 248 before Magistrate Judge Samuel Alba. (cas) (Entered: 08/27/2009)",
      "document_number": "76",
      "pacer_doc_id": null,
      "pacer_seq_no": null
    },
    {
      "date_entered": "2009-08-28",
      "date_filed": "2009-08-28",
      "description": "RESPONSE to Motion by USA as to Brian David Mitchell re 67 Defendant's MOTION Requesting Deadlines for the Filing of Final Expert Reports (Lambert, Richard) (Entered: 08/28/2009)",
      "document_number": "77",
      "pacer_doc_id": "18301501961",
      "pacer_seq_no": "257"
    },
    {
      "date_entered": "2009-08-31",
      "date_filed": "2009-08-31",
      "description": "Minute Entry for proceedings held before Judge Dale A. Kimball: In Chambers Conference as to Brian David Mitchell held on 8/31/2009. 10-day Competency Hearing set for 11/30/2009 09:00 AM in Room 220 before Judge Dale A. Kimball. Govt's Responses to the pending motions due by 9/28/2009, Dft's Replies due by 10/13/2009. Motion Hearing set for 11/9/2009 09:00 AM in Room 220 before Judge Dale A. Kimball. Motion Hearing as to the portion of dft's Motion to Exclude Witnesses pertaining to Elizabeth Smart is set for 9/25/2009 at 9:00 AM. Attorney for Plaintiff: AUSA Richard Lambert, AUSA David Backman, AUSA Diana Hagen, AUSA Alicia Cook. Attorney for Defendant: Robert Steele, Audrey James, Parker Douglas, Kent Hart,FPD. Court Reporter: Patti Walker. (kmj) (Entered: 08/31/2009)",
      "document_number": "78",
      "pacer_doc_id": null,
      "pacer_seq_no": null
    },
    {
      "date_entered": "2009-09-01",
      "date_filed": "2009-08-31",
      "description": "**SEALED DOCUMENT** SEALED MOTION to Exclude Testimony of Dr. Michael Welner as Inadmissible Under Rule 702 of the Federal Rules of Evidence by Brian David Mitchell. (las) Modified by unsealing docket entry per order 120 on 10/26/2009 (rak). (Entered: 09/01/2009)",
      "document_number": "79",
      "pacer_doc_id": "18301503587",
      "pacer_seq_no": "267"
    },
    {
      "date_entered": "2009-09-01",
      "date_filed": "2009-08-31",
      "description": "**SEALED DOCUMENT**Sealed Memorandum in Support re 79 SEALED MOTION by Brian David Mitchell (Attachments: # 1 Exhibit A, # 2 Exhibit B, # 3 Exhibit C-I, # 4 Exhibit J-R)(las) Modified by unsealing docket entry per order 120 on 10/26/2009 (rak). (Entered: 09/01/2009)",
      "document_number": "80",
      "pacer_doc_id": "18301503711",
      "pacer_seq_no": "270"
    },
    {
      "date_entered": "2009-09-02",
      "date_filed": "2009-08-31",
      "description": "Minute Entry for proceedings held before Magistrate Judge Samuel Alba:Status Conference as to Brian David Mitchell held on 8/31/2009. Defendants presence has been waived. Counsel stated on the record that they are trying to resolve the 67 Defendant's MOTION Requesting Deadlines for the Filing of Final Expert Reports filed by Brian David Mitchell, and 57 Defendant's MOTION to Compel Evidence filed by Brian David Mitchell, without court involvement. Court instructed counsel to contact Judge Kimball for a hearing date. Attorney for Plaintiff: Richard Lambert,Dave Backman, Diana Hagen, Alicia Cook AUSA, Attorney for Defendant: Bob Steele, Parker Douglas, Audrey James, fpd. Court Reporter: Electronic.(Time Start: 27:06, Time End: 34:32, Room 248.) (ss) (Entered: 09/02/2009)",
      "document_number": "81",
      "pacer_doc_id": null,
      "pacer_seq_no": null
    },
    {
      "date_entered": "2009-09-15",
      "date_filed": "2009-09-15",
      "description": "Minute Entry for proceedings held before Judge Dale A. Kimball: In Chambers Conference as to Brian David Mitchell held on 9/15/2009. On motion of the United States, and without objection from Dft, the hearing on the motion as to whether Elizabeth Smart will be allowed to testify at Dft's competency hearing will be held at 10:00 AM on 9/25/09. If Elizabeth Smart is permitted to testify concerning Dft's competency, that evidentiary hearing will be held on 10/1/2009 at 9:00 AM. The 10-day Competency Hearing set for 11/30/2009 will be held at 08:30 AM each day in Room 220 before Judge Dale A. Kimball. Evidentiary Hearing set for 10/1/2009 09:00 AM in Room 220 before Judge Dale A. Kimball. Govt's Response to dft's motion to exclude lay witness, as to Elizabeth Smart only, due by 9/21/2009, Dft's Reply due by 9/24/2009. Motion Hearing set for 9/25/2009 10:00 AM in Room 220 before Judge Dale A. Kimball. Attorney for Plaintiff: Richard Lambert, AUSA. Attorney for Defendant: Robert Steele, FPD. Court Reporter: Becky Janke. (kmj) (Entered: 09/15/2009)",
      "document_number": "82",
      "pacer_doc_id": null,
      "pacer_seq_no": null
    },
    {
      "date_entered": "2009-09-21",
      "date_filed": "2009-09-21",
      "description": "DECORUM ORDER as to Brian David Mitchell, Wanda Eileen Barzee re: the Motion Hearing on September 25, 2009. Signed by Judge Dale A. Kimball on 9/21/09. (las) (Entered: 09/21/2009)",
      "document_number": "83",
      "pacer_doc_id": "18301520916",
      "pacer_seq_no": "288"
    },
    {
      "date_entered": "2009-09-22",
      "date_filed": "2009-09-22",
      "description": "**SEALED DOCUMENT**Sealed Document-Response to the Defense's Motion to Preclude the Introduction of All Lay Witness Testimony filed by USA as to Brian David Mitchell (Attachments: # 1 Exhibit 1, # 2 Exhibit 2, # 3 Exhibit 3, # 4 Exhibit 4, # 5 Exhibit 5, # 6 Exhibit 6, # 7 Exhibit 7, # 8 Exhibit 8, # 9 Exhibit 9, # 10 Exhibit 10, # 11 Exhibit 12, # 12 Exhibit 13, # 13 Exhibit 14, # 14 Exhibit 15) NOTE: Exhibit 11 is a disk. It will be retained in the clerks office under seal. (las) Modified by unsealing docket entry per order 120 on 10/26/2009 (rak). (Entered: 09/22/2009)",
      "document_number": "84",
      "pacer_doc_id": "18301522430",
      "pacer_seq_no": "290"
    },
    {
      "date_entered": "2009-09-23",
      "date_filed": "2009-09-23",
      "description": "Sixth CERTIFICATE OF COMPLIANCE filed by USA as to Brian David Mitchell. (Backman, David) (Entered: 09/23/2009)",
      "document_number": "85",
      "pacer_doc_id": "18301524406",
      "pacer_seq_no": "292"
    },
    {
      "date_entered": "2009-09-24",
      "date_filed": "2009-09-24",
      "description": "REPLY TO RESPONSE to Motion by Brian David Mitchell re 69 Defendant's MOTION to Exclude the Introduction of all Lay Witness Testimony as Irrelevant, Unfairly Prejudicial and Cumulative (James, Audrey) (Entered: 09/24/2009)",
      "document_number": "86",
      "pacer_doc_id": "18301525695",
      "pacer_seq_no": "294"
    },
    {
      "date_entered": "2009-09-25",
      "date_filed": "2009-09-25",
      "description": "Minute Entry for proceedings held before Judge Dale A. Kimball: Motion Hearing as to Brian David Mitchell held on 9/25/2009 re 69 Defendant's MOTION to Exclude the Introduction of Lay Witness Testimony from Elizabeth Smart as Irrelevant, Unfairly Prejudicial and Cumulative filed by Brian David Mitchell. Defendant, in custody, was present with counsel. After being advised by the Court of his right to be present in the courtroom as long as he does not disrupt the proceedings, the defendant continued to sing and was removed from the courtroom. The Court heard the arguments presented by Robert Steele, AFPD and David Backman, AUSA, then took the motion under advisement. Attorney for Plaintiff: Richard Lambert, David Backman, AUSA's. Attorney for Defendant: Robert Steele, Parker Douglas, Audrey James, AFPD's. Court Reporter: Kelly Hicken. (kmj) (Entered: 09/25/2009)",
      "document_number": "87",
      "pacer_doc_id": null,
      "pacer_seq_no": null
    },
    {
      "date_entered": "2009-09-25",
      "date_filed": "2009-09-25",
      "description": "NOTICE OF FILING OF OFFICIAL TRANSCRIPT of Proceedings as to Brian David Mitchell held on September 25, 2009-Motion Hearing before Judge Dale A. Kimball. Court Reporter/Transcriber Kelly Brown, Hicken CSR, RPR, RMR, Telephone number 801-521-7238. NOTICE RE REDACTION OF TRANSCRIPTS: Within 7 calendar days of this filing, each party shall inform the Court, by filing a Notice of Intent to Redact, of the parties intent to redact personal data identifiers from the electronic transcript of the court proceeding. The policy and forms are located on the court's website at www.utd.uscourts.gov. Please read this policy carefully. If no Notice of Intent to Redact is filed within the allotted time, this transcript will be made electronically available on the date set forth below. Transcript may be viewed at the court public terminal or purchased through the Court Reporter/Transcriber before the deadline for Release of Transcript Restriction. After that date it may be obtained through PACER. Redaction Request due 10/16/2009. Redacted Transcript Deadline set for 10/26/2009. Release of Transcript Restriction set for 12/24/2009. (jmr) Modified by removing restricted text on 12/28/2009 (rgj). (Entered: 09/25/2009)",
      "document_number": "88",
      "pacer_doc_id": "18301526761",
      "pacer_seq_no": "301"
    },
    {
      "date_entered": "2009-09-28",
      "date_filed": "2009-09-28",
      "description": "MEMORANDUM DECISION AND ORDER denying in part 69 Motion to Exclude the Introduction of all Lay Witness Testimony as Irrelevant, Unfairly Prejudicial and Cumulative as to Brian David Mitchell (1). Defendant's Motion to Preclude the Introduction of All Lay Witness Testimony is Denied as to the portion of the motion regarding Ms. Smart's proposed testimony. Pursuant to prior scheduling agreement between the parties, the evidentiary hearing to take Ms. Smart's testimony will be held Thursday, October 1, 2009, at 9:00 a.m. Signed by Judge Dale A. Kimball on 9/28/09. (las) (Entered: 09/28/2009)",
      "document_number": "90",
      "pacer_doc_id": "18301527476",
      "pacer_seq_no": "306"
    },
    {
      "date_entered": "2009-09-28",
      "date_filed": "2009-09-28",
      "description": "DECORUM ORDER #2 as to Brian David Mitchell, Wanda Eileen Barzee re: Evidentiary hearing on October 1, 2009. Signed by Judge Dale A. Kimball on 9/28/09. (las) (Entered: 09/28/2009)",
      "document_number": "91",
      "pacer_doc_id": "18301527687",
      "pacer_seq_no": "309"
    },
    {
      "date_entered": "2009-09-28",
      "date_filed": "2009-09-28",
      "description": "RESPONSE to Motion by USA as to Brian David Mitchell re 68 Defendant's MOTION to Exclude Expert Testimony and Objection to Introduction of Writings by Ervil LeBaron (Attachments: # 1 Exhibit, # 2 Exhibit)(Lambert, Richard) (Entered: 09/28/2009)",
      "document_number": "92",
      "pacer_doc_id": "18301527993",
      "pacer_seq_no": "311"
    },
    {
      "date_entered": "2009-09-28",
      "date_filed": "2009-09-28",
      "description": "RESPONSE TO DEFENDANT'S SEALED MOTION TO EXCLUDE TESTIMONY OF DR. MICHAEL WELNER filed by USA as to Brian David Mitchell (Hagen, Diana) (Entered: 09/28/2009)",
      "document_number": "93",
      "pacer_doc_id": "18301528240",
      "pacer_seq_no": "314"
    },
    {
      "date_entered": "2009-09-29",
      "date_filed": "2009-09-29",
      "description": "ADDENDUM by USA as to Brian David Mitchell to 93 Response (NOT to motion) filed by USA (Attachments: # 1 Attachment A, # 2 Attachment B, # 3 Attachment C, # 4 Attachment D, # 5 Attachment E, # 6 Attachment F, # 7 Attachment G, # 8 Attachment h, # 9 Attachment I, # 10 Attachment J, # 11 Attachment K, # 12 Attachment L, # 13 Attachment M, # 14 Attachment N, # 15 Attachment O, # 16 Attachment P, # 17 Attachment Q)(Hagen, Diana) (Entered: 09/29/2009)",
      "document_number": "94",
      "pacer_doc_id": "18301528440",
      "pacer_seq_no": "316"
    },
    {
      "date_entered": "2009-10-01",
      "date_filed": "2009-10-01",
      "description": "Minute Entry for proceedings held before Judge Dale A. Kimball: Evidentiary Hearing as to Brian David Mitchell held on 10/1/2009. The defendant, in custody, was present with counsel. The Court advised the defendant of his right to be present in the courtroom if he did not disrupt the proceedings in any way; when the defendant continued to sing, the Court ordered him removed to a room where he would be able to see and hear, but not disrupt, the proceedings. The government called Elizabeth Smart as a witness. Ms. Smart was sworn in as a witness and gave testimony. Court adjourned. Attorney for Plaintiff: U.S. Attorney Brett Tolman, AUSA Richard Lambert, AUSA David Backman, SAUSA Alicia Cook. Attorney for Defendant: AFPD Robert Steele, AFPD Parker Douglas, AFPD Audrey James, AFPD Kent Hart. Court Reporter: Kelly Hicken. (kmj) (Entered: 10/01/2009)",
      "document_number": "95",
      "pacer_doc_id": null,
      "pacer_seq_no": null
    },
    {
      "date_entered": "2009-10-09",
      "date_filed": "2009-10-08",
      "description": "**SEALED DOCUMENT** SEALED MOTION for Sanctions by Brian David Mitchell. (Attachments: # 1 Exhibit A, # 2 Exhibit B, # 3 Exhibit C)(ce) Modified by unsealing docket entry per order 120 on 10/26/2009 (rak). (Entered: 10/09/2009)",
      "document_number": "96",
      "pacer_doc_id": "18301538935",
      "pacer_seq_no": "322"
    },
    {
      "date_entered": "2009-10-09",
      "date_filed": "2009-10-09",
      "description": "MOTION to Unseal Document Defendant's Motion for Sanctions by USA as to Brian David Mitchell. (Hagen, Diana) (Entered: 10/09/2009)",
      "document_number": "97",
      "pacer_doc_id": "18301539480",
      "pacer_seq_no": "325"
    },
    {
      "date_entered": "2009-10-09",
      "date_filed": "2009-10-09",
      "description": "MEMORANDUM in Support by USA as to Brian David Mitchell re 97 MOTION to Unseal Document Defendant's Motion for Sanctions (Hagen, Diana) (Entered: 10/09/2009)",
      "document_number": "98",
      "pacer_doc_id": "18301539483",
      "pacer_seq_no": "328"
    },
    {
      "date_entered": "2009-10-13",
      "date_filed": "2009-10-13",
      "description": "Second MOTION to Compel Evidence filed by Brian David Mitchell. (Attachments: # 1 Exhibit Exhibits A-B)(Steele, Robert) (Entered: 10/13/2009)",
      "document_number": "99",
      "pacer_doc_id": "18301540374",
      "pacer_seq_no": "331"
    },
    {
      "date_entered": "2009-10-13",
      "date_filed": "2009-10-13",
      "description": "RESPONSE TO DEFENDANT'S SEALED MOTION FOR SANCTIONS filed by USA as to Brian David Mitchell (Hagen, Diana) (Entered: 10/13/2009)",
      "document_number": "100",
      "pacer_doc_id": "18301540536",
      "pacer_seq_no": "334"
    },
    {
      "date_entered": "2009-10-14",
      "date_filed": "2009-10-13",
      "description": "ORDER as to Brian David Mitchell re 97 MOTION to Unseal Document Defendant's Motion for Sanctions filed by USA. The court directs the parties to file cross briefs regarding the issues relating to the propriety of sealing certain matters regarding the competency hearing by October 20, 2009. The parties shall then file reply memoranda to the opposing party's brief by October 26, 2009. The government shall also file an opposition to Defendant's Motion for Sanctions by October 21, 2009, and Defendant shall file a reply by October 27, 2009. Sealed Motion Hearing set for 10/30/2009 01:30 PM in Room 220. Signed by Judge Dale A. Kimball on 10/13/09. (las) (Entered: 10/14/2009)",
      "document_number": "101",
      "pacer_doc_id": "18301541347",
      "pacer_seq_no": "336"
    },
    {
      "date_entered": "2009-10-15",
      "date_filed": "2009-10-13",
      "description": "**SEALED DOCUMENT**Sealed Entry-Document re 86 Reply to Response by Brian David Mitchell. (kpf) Modified by unsealing docket entry per order 120 on 10/26/2009 (rak). (Entered: 10/15/2009)",
      "document_number": "102",
      "pacer_doc_id": "18301542981",
      "pacer_seq_no": "340"
    },
    {
      "date_entered": "2009-10-15",
      "date_filed": "2009-10-13",
      "description": "**SEALED DOCUMENT**Sealed Entry-Document re 92 Response to Motion by Brian David Mitchell (kpf) Modified by unsealing docket entry per order 120 on 10/26/2009 (rak). (Entered: 10/15/2009)",
      "document_number": "103",
      "pacer_doc_id": "18301543024",
      "pacer_seq_no": "343"
    },
    {
      "date_entered": "2009-10-15",
      "date_filed": "2009-10-13",
      "description": "**SEALED DOCUMENT**Sealed Entry-Document re 97 MOTION to Unseal Document Defendant's Motion for Sanctions by Brian David Mitchell (kpf) Modified by unsealing docket entry per order 120 on 10/26/2009 (rak). (Entered: 10/15/2009)",
      "document_number": "104",
      "pacer_doc_id": "18301543031",
      "pacer_seq_no": "346"
    },
    {
      "date_entered": "2009-10-15",
      "date_filed": "2009-10-13",
      "description": "**SEALED DOCUMENT**Sealed Entry-Document re 93 Response by Brian David Mitchell (Attachments: # 1 Exhibit A, # 2 Exhibit B, # 3 Exhibit C, # 4 Exhibit D, # 5 Exhibit E, # 6 Exhibit F)(kpf) Modified by unsealing docket entry per order 120 on 10/26/2009 (rak). (Entered: 10/15/2009)",
      "document_number": "105",
      "pacer_doc_id": "18301543074",
      "pacer_seq_no": "349"
    },
    {
      "date_entered": "2009-10-19",
      "date_filed": "2009-10-19",
      "description": "MOTION to Intervene in Order to Oppose Further Sealing, MOTION to Unseal Materials Already Filed by Deseret News, Salt Lake Tribune, Associated Press, Utah Headliners Chapter of the Society of Professional Journalists as to Brian David Mitchell, Wanda Eileen Barzee. (Attachments: # 1 Text of Proposed Order) (alt) (Entered: 10/19/2009)",
      "document_number": "106",
      "pacer_doc_id": "18301545823",
      "pacer_seq_no": "360"
    },
    {
      "date_entered": "2009-10-19",
      "date_filed": "2009-10-19",
      "description": "MEMORANDUM in Support by Deseret News, Salt Lake Tribune, Associated Press, Utah Headliners Chapter of the Society of Professional Journalists as to Brian David Mitchell, Wanda Eileen Barzee re 106 MOTION to Intervene in Order to Oppose Further Sealing MOTION to Unseal Materials Already Filed (O'Brien, Michael) (Entered: 10/19/2009)",
      "document_number": "107",
      "pacer_doc_id": "18301545885",
      "pacer_seq_no": "367"
    },
    {
      "date_entered": "2009-10-19",
      "date_filed": "2009-10-19",
      "description": "MOTION to Unseal Case, Keep Hearings Open and Disclose Secret Docket Entries by Deseret News, Salt Lake Tribune, Associated Press, Utah Headliners Chapter of the Society of Professional Journalists as to Brian David Mitchell, Wanda Eileen Barzee. (O'Brien, Michael) (Entered: 10/19/2009)",
      "document_number": "108",
      "pacer_doc_id": "18301545923",
      "pacer_seq_no": "373"
    },
    {
      "date_entered": "2009-10-19",
      "date_filed": "2009-10-19",
      "description": "MOTION for Leave to File Excess Pages by Deseret News, Salt Lake Tribune, Associated Press, Utah Headliners Chapter of the Society of Professional Journalists as to Brian David Mitchell, Wanda Eileen Barzee. (Attachments: # 1 Supplement Attachment 1 - Memo in Support of Motion to Unseal Court Records, # 2 Exhibit A to Attachment 1, # 3 Exhibit B to Attachment 1, # 4 Exhibit C to Attachment 1, # 5 Text of Proposed Order Attachment 2)(O'Brien, Michael) (Entered: 10/19/2009)",
      "document_number": "109",
      "pacer_doc_id": "18301545969",
      "pacer_seq_no": "377"
    },
    {
      "date_entered": "2009-10-19",
      "date_filed": "2009-10-19",
      "description": "MEMORANDUM in Support by Deseret News, Salt Lake Tribune, Associated Press, Utah Headliners Chapter of the Society of Professional Journalists as to Brian David Mitchell, Wanda Eileen Barzee re 108 MOTION to Unseal Case, Keep Hearings Open and Disclose Secret Docket Entries (Attachments: # 1 Exhibit A, # 2 Errata B, # 3 Exhibit C)(O'Brien, Michael) (Entered: 10/19/2009)",
      "document_number": "110",
      "pacer_doc_id": "18301546196",
      "pacer_seq_no": "381"
    },
    {
      "date_entered": "2009-10-20",
      "date_filed": "2009-10-20",
      "description": "MOTION to Intervene in Order to Oppose Further Sealing by Utah Press Association as to Brian David Mitchell, Wanda Eileen Barzee. (Attachments: # 1 Text of Proposed Order) (alt) (Entered: 10/20/2009)",
      "document_number": "111",
      "pacer_doc_id": "18301547113",
      "pacer_seq_no": "387"
    },
    {
      "date_entered": "2009-10-20",
      "date_filed": "2009-10-20",
      "description": "MEMORANDUM in Support by Deseret News, Salt Lake Tribune, Associated Press, Utah Headliners Chapter of the Society of Professional Journalists, Utah Press Association as to Brian David Mitchell, Wanda Eileen Barzee re 111 MOTION to Intervene in Order to Oppose Further Sealing (O'Brien, Michael) (Entered: 10/20/2009)",
      "document_number": "112",
      "pacer_doc_id": "18301547230",
      "pacer_seq_no": "391"
    },
    {
      "date_entered": "2009-10-20",
      "date_filed": "2009-10-20",
      "description": "MOTION to Seal Limited Portions of the \"United States' Response to the Defense's Motion to Preclude the Introduction of All Lay Witness Testimony\" by USA as to Brian David Mitchell. (Hagen, Diana) (Entered: 10/20/2009)",
      "document_number": "113",
      "pacer_doc_id": "18301547774",
      "pacer_seq_no": "395"
    },
    {
      "date_entered": "2009-10-20",
      "date_filed": "2009-10-20",
      "description": "MEMORANDUM in Support by USA as to Brian David Mitchell re 113 MOTION to Seal Limited Portions of the \"United States' Response to the Defense's Motion to Preclude the Introduction of All Lay Witness Testimony\" (Hagen, Diana) (Entered: 10/20/2009)",
      "document_number": "114",
      "pacer_doc_id": "18301547777",
      "pacer_seq_no": "398"
    },
    {
      "date_entered": "2009-10-20",
      "date_filed": "2009-10-20",
      "description": "ORDER granting 109 Motion for Leave to File Excess Pages as to Brian David Mitchell (1), Wanda Eileen Barzee (2). Signed by Judge Dale A. Kimball on 10/20/09. (las) (Entered: 10/20/2009)",
      "document_number": "115",
      "pacer_doc_id": "18301547813",
      "pacer_seq_no": "401"
    },
    {
      "date_entered": "2009-10-20",
      "date_filed": "2009-10-20",
      "description": "Seventh CERTIFICATE OF COMPLIANCE filed by USA as to Brian David Mitchell. (Tolman, Brett) (Entered: 10/20/2009)",
      "document_number": "116",
      "pacer_doc_id": "18301547832",
      "pacer_seq_no": "403"
    },
    {
      "date_entered": "2009-10-20",
      "date_filed": "2009-10-20",
      "description": "First RESPONSE to Court's Order dated October 13, 2009 filed by Brian David Mitchell as to Brian David Mitchell, Wanda Eileen Barzee (Douglas, Parker) (Entered: 10/20/2009)",
      "document_number": "117",
      "pacer_doc_id": "18301547904",
      "pacer_seq_no": "405"
    },
    {
      "date_entered": "2009-10-22",
      "date_filed": "2009-10-20",
      "description": "**SEALED DOCUMENT**Sealed Entry-Document re 114 MEMORANDUM in Support filed by USA as to Brian David Mitchell: USA's Response to the Defenses's Motion to Preclude the Introduction of All Lay Witness Testimony (ce) Modified by unsealing docket entry per order 120 on 10/26/2009 (rak). Modified on 11/4/2009 to reflect that this document has been re-filed as redacted entry 135 dated 11/3/2009 (ce). (Entered: 10/22/2009)",
      "document_number": "119",
      "pacer_doc_id": "18301549495",
      "pacer_seq_no": "409"
    },
    {
      "date_entered": "2009-10-21",
      "date_filed": "2009-10-21",
      "description": "RESPONSE DEFENDANTS [ERRATA] MEMORANDUM SUBMITTED IN RESPONSE TO COURTS ORDER DATED OCTOBER 13, 2009 filed by Brian David Mitchell as to Brian David Mitchell, Wanda Eileen Barzee (Douglas, Parker) (Entered: 10/21/2009)",
      "document_number": "118",
      "pacer_doc_id": "18301548470",
      "pacer_seq_no": "407"
    },
    {
      "date_entered": "2009-10-26",
      "date_filed": "2009-10-26",
      "description": "ORDER re: Sealed Documents as to Brian David Mitchell, Wanda Eileen Barzee. The clerk's office shall unsealed all sealed docket ENTRIES in the docket. For further information re: sealed documents, hearings, etc., see order. Signed by Judge Dale A. Kimball on 10/26/2009. (ce) (Entered: 10/26/2009)",
      "document_number": "120",
      "pacer_doc_id": "18301552086",
      "pacer_seq_no": "412"
    },
    {
      "date_entered": "2009-10-26",
      "date_filed": "2009-10-26",
      "description": "MODIFICATION OF DOCKET as to Brian David Mitchell Correction: clarified information disclosed in hearing regarding Judge Kimball's law clerk. re 49 Sealed Minute Entry. (kmj) (Entered: 10/26/2009)",
      "document_number": "121",
      "pacer_doc_id": null,
      "pacer_seq_no": null
    }
  ],
  "docket_number": "2:08-cr-00125",
  "federal_defendant_number": "1",
  "federal_dn_case_type": "cr",
  "federal_dn_judge_initials_assigned": "DAK",
  "federal_dn_judge_initials_referred": null,
  "federal_dn_office_code": "2",
  "jurisdiction": "",
  "jury_demand": "",
  "mdl_status": "",
  "nature_of_suit": "",
  "ordered_by": "date_filed",
  "parties": [
    {
      "attorneys": [
        {
          "contact": "43 E 400 S\nSALT LAKE CITY, UT 84111\n(801)656-5221\nEmail: killpack@rocketmail.com\n",
          "name": "Steven B. Killpack",
          "roles": [
            "LEAD ATTORNEY",
            "ATTORNEY TO BE NOTICED"
          ]
        },
        {
          "contact": "UTAH FEDERAL DEFENDER OFFICE\n46 W BROADWAY STE 110\nSALT LAKE CITY, UT 84101\n(801)524-4010\nEmail: audrey_james@fd.org\n",
          "name": "Audrey K. James",
          "roles": [
            "ATTORNEY TO BE NOTICED"
          ]
        },
        {
          "contact": "UTAH ATTORNEY GENERAL'S OFFICE\n350 N STATE ST STE 230\nPO BOX 142320\nSALT LAKE CITY, UT 84114-2320\n(801)538-9600\n",
          "name": "Parker Douglas",
          "roles": [
            "ATTORNEY TO BE NOTICED"
          ]
        },
        {
          "contact": "UTAH FEDERAL DEFENDER OFFICE\n46 W BROADWAY STE 110\nSALT LAKE CITY, UT 84101\n(801)524-5877\nEmail: robert_steele@fd.org\n",
          "name": "Robert L. Steele",
          "roles": [
            "ATTORNEY TO BE NOTICED"
          ]
        },
        {
          "contact": "UTAH FEDERAL DEFENDER OFFICE\n46 W BROADWAY STE 110\nSALT LAKE CITY, UT 84101\n(801)524-4010\nEmail: scott_wilson@fd.org\n",
          "name": "Scott Keith Wilson",
          "roles": [
            "ATTORNEY TO BE NOTICED"
          ]
        },
        {
          "contact": "UTAH FEDERAL DEFENDER OFFICE\n46 W BROADWAY STE 110\nSALT LAKE CITY, UT 84101\n(801)524-4010\nEmail: wendy_lewis@fd.org\n",
          "name": "Wendy M. Lewis",
          "roles": [
            "ATTORNEY TO BE NOTICED"
          ]
        }
      ],
      "criminal_data": {
        "complaints": [],
        "counts": [
          {
            "disposition": "Dft was found guilty by jury verdict. SENTENCE: dft is committed to the custody of BOP for life. No term of Supervised Release. No fine. $200 SPA.",
            "name": "18:1201(a)(1) KIDNAPPING/Kidnapping(1)",
            "status": "pending"
          },
          {
            "disposition": "Dft was found guilty by jury verdict. SENTENCE: dft is committed to the custody of BOP for life. No term of Supervised Release. No fine. $200 SPA.",
            "name": "18:2423(a) COERCION OR ENTICEMENT OF MINOR FEMALE/Unlawful Transportation of a Minor(2)",
            "status": "pending"
          }
        ],
        "highest_offense_level_opening": "Felony",
        "highest_offense_level_terminated": "None"
      },
      "date_terminated": "2011-05-26",
      "extra_info": "TERMINATED: 05/26/2011\nalso known as\nBryan David Mitchell\nTERMINATED: 05/26/2011",
      "name": "Brian David Mitchell",
      "type": "Defendant"
    },
    {
      "attorneys": [
        {
          "contact": "JONES WALDO HOLBROOK & MCDONOUGH (SLC)\n170 S MAIN ST STE 1500\nSALT LAKE CITY, UT 84101\n(801)521-3200\nEmail: mobrien@joneswaldo.com\n",
          "name": "Michael P. O'Brien",
          "roles": [
            "LEAD ATTORNEY",
            "ATTORNEY TO BE NOTICED"
          ]
        },
        {
          "contact": "JONES WALDO HOLBROOK & MCDONOUGH (SLC)\n170 S MAIN ST STE 1500\nSALT LAKE CITY, UT 84101\n(801)521-3200\nEmail: rharris@joneswaldo.com\n",
          "name": "Ryan M. Harris",
          "roles": [
            "ATTORNEY TO BE NOTICED"
          ]
        },
        {
          "contact": "JONES WALDO HOLBROOK & MCDONOUGH\n170 S MAIN ST STE 1500\nSALT LAKE CITY, UT 84101\n(801)534-7482\nEmail: shane.shumway@gmail.com\n",
          "name": "Shane J. Shumway",
          "roles": []
        }
      ],
      "date_terminated": null,
      "extra_info": "",
      "name": "Deseret News",
      "type": "Movant"
    },
    {
      "attorneys": [
        {
          "contact": "JONES WALDO HOLBROOK & MCDONOUGH (SLC)\n170 S MAIN ST STE 1500\nSALT LAKE CITY, UT 84101\n(801)521-3200\nEmail: mobrien@joneswaldo.com\n",
          "name": "Michael P. O'Brien",
          "roles": [
            "LEAD ATTORNEY",
            "ATTORNEY TO BE NOTICED"
          ]
        },
        {
          "contact": "JONES WALDO HOLBROOK & MCDONOUGH (SLC)\n170 S MAIN ST STE 1500\nSALT LAKE CITY, UT 84101\n(801)521-3200\nEmail: rharris@joneswaldo.com\n",
          "name": "Ryan M. Harris",
          "roles": [
            "ATTORNEY TO BE NOTICED"
          ]
        },
        {
          "contact": "JONES WALDO HOLBROOK & MCDONOUGH\n170 S MAIN ST STE 1500\nSALT LAKE CITY, UT 84101\n(801)534-7482\nEmail: shane.shumway@gmail.com\n",
          "name": "Shane J. Shumway",
          "roles": []
        }
      ],
      "date_terminated": null,
      "extra_info": "",
      "name": "Salt Lake Tribune",
      "type": "Movant"
    },
    {
      "attorneys": [
        {
          "contact": "JONES WALDO HOLBROOK & MCDONOUGH (SLC)\n170 S MAIN ST STE 1500\nSALT LAKE CITY, UT 84101\n(801)521-3200\nEmail: mobrien@joneswaldo.com\n",
          "name": "Michael P. O'Brien",
          "roles": [
            "LEAD ATTORNEY",
            "ATTORNEY TO BE NOTICED"
          ]
        },
        {
          "contact": "JONES WALDO HOLBROOK & MCDONOUGH (SLC)\n170 S MAIN ST STE 1500\nSALT LAKE CITY, UT 84101\n(801)521-3200\nEmail: rharris@joneswaldo.com\n",
          "name": "Ryan M. Harris",
          "roles": [
            "ATTORNEY TO BE NOTICED"
          ]
        },
        {
          "contact": "JONES WALDO HOLBROOK & MCDONOUGH\n170 S MAIN ST STE 1500\nSALT LAKE CITY, UT 84101\n(801)534-7482\nEmail: shane.shumway@gmail.com\n",
          "name": "Shane J. Shumway",
          "roles": []
        }
      ],
      "date_terminated": null,
      "extra_info": "",
      "name": "Associated Press",
      "type": "Movant"
    },
    {
      "attorneys": [
        {
          "contact": "JONES WALDO HOLBROOK & MCDONOUGH (SLC)\n170 S MAIN ST STE 1500\nSALT LAKE CITY, UT 84101\n(801)521-3200\nEmail: mobrien@joneswaldo.com\n",
          "name": "Michael P. O'Brien",
          "roles": [
            "LEAD ATTORNEY",
            "ATTORNEY TO BE NOTICED"
          ]
        },
        {
          "contact": "JONES WALDO HOLBROOK & MCDONOUGH (SLC)\n170 S MAIN ST STE 1500\nSALT LAKE CITY, UT 84101\n(801)521-3200\nEmail: rharris@joneswaldo.com\n",
          "name": "Ryan M. Harris",
          "roles": [
            "ATTORNEY TO BE NOTICED"
          ]
        },
        {
          "contact": "JONES WALDO HOLBROOK & MCDONOUGH\n170 S MAIN ST STE 1500\nSALT LAKE CITY, UT 84101\n(801)534-7482\nEmail: shane.shumway@gmail.com\n",
          "name": "Shane J. Shumway",
          "roles": []
        }
      ],
      "date_terminated": null,
      "extra_info": "",
      "name": "Utah Headliners Chapter of the Society of Professional Journalists",
      "type": "Movant"
    },
    {
      "attorneys": [
        {
          "contact": "JONES WALDO HOLBROOK & MCDONOUGH (SLC)\n170 S MAIN ST STE 1500\nSALT LAKE CITY, UT 84101\n(801)521-3200\nEmail: mobrien@joneswaldo.com\n",
          "name": "Michael P. O'Brien",
          "roles": [
            "LEAD ATTORNEY",
            "ATTORNEY TO BE NOTICED"
          ]
        },
        {
          "contact": "JONES WALDO HOLBROOK & MCDONOUGH (SLC)\n170 S MAIN ST STE 1500\nSALT LAKE CITY, UT 84101\n(801)521-3200\nEmail: rharris@joneswaldo.com\n",
          "name": "Ryan M. Harris",
          "roles": [
            "ATTORNEY TO BE NOTICED"
          ]
        },
        {
          "contact": "JONES WALDO HOLBROOK & MCDONOUGH\n170 S MAIN ST STE 1500\nSALT LAKE CITY, UT 84101\n(801)534-7482\nEmail: shane.shumway@gmail.com\n",
          "name": "Shane J. Shumway",
          "roles": []
        }
      ],
      "date_terminated": null,
      "extra_info": "",
      "name": "Utah Press Association",
      "type": "Movant"
    },
    {
      "attorneys": [
        {
          "contact": "US ATTORNEY'S OFFICE\nEmail: Candelaria.Bennett@usdoj.gov\nPRO SE\n",
          "name": "Victim Witness Coordinator",
          "roles": []
        }
      ],
      "date_terminated": null,
      "extra_info": "",
      "name": "Victim Witness Coordinator",
      "type": "Notice Party"
    },
    {
      "attorneys": [
        {
          "contact": "US PROBATION/PRETRIAL\nEmail: meriska_holt@utp.uscourts.gov\nPRO SE\n",
          "name": "Meriska A. Holt",
          "roles": []
        }
      ],
      "date_terminated": null,
      "extra_info": "",
      "name": "Meriska A. Holt",
      "type": "Notice Party"
    },
    {
      "attorneys": [
        {
          "contact": "US ATTORNEY'S OFFICE (UT)\nSALT LAKE CITY, UT 00000\n(801)325-3255\nEmail: felice.viti@usdoj.gov\n",
          "name": "Felice J. Viti",
          "roles": [
            "LEAD ATTORNEY",
            "ATTORNEY TO BE NOTICED"
          ]
        },
        {
          "contact": "950 PENNSYLVANIA AVE NW STE 7600\nWASHINGTON, DC 20530\n(202)514-0110\nEmail: alicook@me.com\n",
          "name": "Alicia H. Cook",
          "roles": [
            "ATTORNEY TO BE NOTICED"
          ]
        },
        {
          "contact": "RAY QUINNEY & NEBEKER\n36 S STATE ST STE 1400\nPO BOX 45385\nSALT LAKE CITY, UT 84145-0385\n(801)532-1500\nEmail: btolman@rqn.com\n",
          "name": "Brett L. Tolman",
          "roles": [
            "TERMINATED: 02/16/2010"
          ]
        },
        {
          "contact": "US ATTORNEY'S OFFICE (UT)\nSALT LAKE CITY, UT 00000\n(801)524-5682\nEmail: david.backman@usdoj.gov\n",
          "name": "David F. Backman",
          "roles": [
            "ATTORNEY TO BE NOTICED"
          ]
        },
        {
          "contact": "US ATTORNEY'S OFFICE\nSALT LAKE CITY, UT 00000\n(801)325-1400\n",
          "name": "David J. Schwendiman",
          "roles": [
            "ATTORNEY TO BE NOTICED"
          ]
        },
        {
          "contact": "UTAH COURT OF APPEALS\n450 S STATE 5TH FL\nPO BOX 140230\nSALT LAKE CITY, UT 84111-0230\n(801)578-3912\nEmail: dhagen@utcourts.gov\n",
          "name": "Diana Hagen",
          "roles": [
            "ATTORNEY TO BE NOTICED"
          ]
        },
        {
          "contact": "US ATTORNEY'S OFFICE (UT)\nSALT LAKE CITY, UT 00000\n(801)325-3257\nEmail: Elizabethanne.Stevens@usdoj.gov\n",
          "name": "Elizabethanne C. Stevens",
          "roles": [
            "ATTORNEY TO BE NOTICED"
          ]
        },
        {
          "contact": "171 EAST 3RD AVE #309\nSALT LAKE CITY, UT 84103\n",
          "name": "Richard N. Lambert",
          "roles": [
            "TERMINATED: 05/24/2010"
          ]
        }
      ],
      "date_terminated": null,
      "extra_info": "",
      "name": "USA",
      "type": "Plaintiff"
    }
  ],
  "referred_to_str": ""
}