<mods xmlns="http://www.loc.gov/mods/v3" xmlns:exslt="http://exslt.org/common" xmlns:xsi="http://www.w3.org/2001/XMLSchema-instance" xmlns:xlink="http://www.w3.org/1999/xlink" xsi:schemaLocation="http://www.loc.gov/mods/v3 http://www.loc.gov/standards/mods/v3/mods-3-3.xsd" version="3.3" ID="P0b002ee181ce09b5">
<name type="corporate">
 <namePart>United States Government Printing Office</namePart>
 <role>
  <roleTerm type="text" authority="marcrelator">printer</roleTerm>
  <roleTerm type="code" authority="marcrelator">prt</roleTerm>
</role>
 <role>
  <roleTerm type="text" authority="marcrelator">distributor</roleTerm>
  <roleTerm type="code" authority="marcrelator">dst</roleTerm>
</role>
</name>
<name type="corporate">
 <namePart>United States</namePart>
 <namePart>United States District Court District of Nebraska</namePart>
 <role>
  <roleTerm type="text" authority="marcrelator">author</roleTerm>
  <roleTerm type="code" authority="marcrelator">aut</roleTerm>
</role>
 <description>Government Organization</description>
</name>
<typeOfResource>text</typeOfResource>
<genre authority="marcgt">government publication</genre>
<language>
 <languageTerm authority="iso639-2b" type="code">eng</languageTerm>
</language>
<extension>
 <collectionCode>USCOURTS</collectionCode>
 <category>Judicial Publications</category>
 <branch>judicial</branch>
 <dateIngested>2012-01-25</dateIngested>
</extension>
<originInfo>
 <publisher>Administrative Office of the United States Courts</publisher>
 <dateIssued encoding="w3cdtf">2012-01-24</dateIssued>
 <issuance>monographic</issuance>
</originInfo>
<physicalDescription>
 <note type="source content type">deposited</note>
 <digitalOrigin>born digital</digitalOrigin>
</physicalDescription>
<classification authority="sudocs">JU 4.15</classification>
<identifier type="uri">http://www.gpo.gov/fdsys/pkg/USCOURTS-ned-8_05-cr-00199</identifier>
<identifier type="local">P0b002ee181ce09b5</identifier>
<recordInfo>
 <recordContentSource authority="marcorg">DGPO</recordContentSource>
 <recordCreationDate encoding="w3cdtf">2012-01-25</recordCreationDate>
 <recordChangeDate encoding="w3cdtf">2012-01-25</recordChangeDate>
 <recordIdentifier source="DGPO">USCOURTS-ned-8_05-cr-00199</recordIdentifier>
 <recordOrigin>machine generated</recordOrigin>
 <languageOfCataloging>
  <languageTerm authority="iso639-2b" type="code">eng</languageTerm>
</languageOfCataloging>
</recordInfo>
<accessCondition type="GPO scope determination">fdlp</accessCondition>
<extension>
 <docClass>USCOURTS</docClass>
 <accessId>USCOURTS-ned-8_05-cr-00199</accessId>
 <courtType>District</courtType>
 <courtCode>ned</courtCode>
 <courtCircuit>8th</courtCircuit>
 <courtState>Nebraska</courtState>
 <courtSortOrder>2300</courtSortOrder>
 <caseNumber>8:05-cr-00199</caseNumber>
 <caseOffice>8 Omaha</caseOffice>
 <caseType>criminal</caseType>
 <party firstName="Duane" fullName="Duane Charles Anderson" lastName="Anderson" middleName="Charles" role="Defendant"></party>
 <party firstName="Jose" fullName="Jose Contreras" lastName="Contreras" role="Defendant"></party>
 <party firstName="Jose" fullName="Jose C. Contreras-Cortez" lastName="Contreras-Cortez" middleName="C." role="Defendant"></party>
 <party firstName="Jose" fullName="Jose C. Cortez" lastName="Cortez" middleName="C." role="Defendant"></party>
 <party fullName="Freddy" lastName="Freddy" role="Defendant"></party>
 <party firstName="Jose" fullName="Jose F. Hernandez" lastName="Hernandez" middleName="F." role="Defendant"></party>
 <party firstName="Jose" fullName="Jose Hernandez-Mendoza" lastName="Hernandez-Mendoza" role="Defendant"></party>
 <party fullName="Juan" lastName="Juan" role="Defendant"></party>
 <party firstName="Jose" fullName="Jose Mendoza" lastName="Mendoza" role="Defendant"></party>
 <party firstName="David" fullName="David Rodriguez" lastName="Rodriguez" role="Defendant"></party>
 <party firstName="JOsue" fullName="JOsue Rodriguez" lastName="Rodriguez" role="Defendant"></party>
 <party firstName="Josue" fullName="Josue Martin Rodriguez-Lopez" lastName="Rodriguez-Lopez" middleName="Martin" role="Defendant"></party>
 <party firstName="David" fullName="David Rodriguez-Solis" lastName="Rodriguez-Solis" role="Defendant"></party>
 <party firstName="Freddy" fullName="Freddy Rodriguez-Solis" lastName="Rodriguez-Solis" role="Defendant"></party>
 <party firstName="Fred" fullName="Fred David Rodriguez-Solis" lastName="Rodriguez-Solis" middleName="David" role="Defendant"></party>
 <party fullName="USA" lastName="USA" role="Plaintiff"></party>
 <party firstName="Rogelio" fullName="Rogelio Valenzuela" lastName="Valenzuela" role="Defendant"></party>
 <party firstName="Rogelio" fullName="Rogelio L. Valenzuela-Lopez" lastName="Valenzuela-Lopez" middleName="L." role="Defendant"></party>
</extension>
<titleInfo>
 <title>USA v. Anderson et al</title>
 <partNumber>8:05-cr-00199</partNumber>
</titleInfo>
<location>
 <url access="object in context" displayLabel="Content Detail">http://www.gpo.gov/fdsys/pkg/USCOURTS-ned-8_05-cr-00199/content-detail.html</url>
</location>
<classification authority="sudocs">JU 4.15</classification>
<identifier type="preferred citation">8:05-cr-00199;05-199</identifier>
<name type="corporate">
 <namePart>United States District Court District of Nebraska</namePart>
 <namePart>8th Circuit</namePart>
 <namePart>8 Omaha</namePart>
 <affiliation>U.S. Courts</affiliation>
 <role>
  <roleTerm authority="marcrelator" type="text">author</roleTerm>
  <roleTerm authority="marcrelator" type="code">aut</roleTerm>
</role>
</name>
<name type="personal">
 <displayForm>Duane Charles Anderson</displayForm>
 <namePart type="family">Anderson</namePart>
 <namePart type="given">Duane</namePart>
 <namePart type="termsOfAddress"></namePart>
 <description>Defendant</description>
</name>
<name type="personal">
 <displayForm>Jose Contreras</displayForm>
 <namePart type="family">Contreras</namePart>
 <namePart type="given">Jose</namePart>
 <namePart type="termsOfAddress"></namePart>
 <description>Defendant</description>
</name>
<name type="personal">
 <displayForm>Jose C. Contreras-Cortez</displayForm>
 <namePart type="family">Contreras-Cortez</namePart>
 <namePart type="given">Jose</namePart>
 <namePart type="termsOfAddress"></namePart>
 <description>Defendant</description>
</name>
<name type="personal">
 <displayForm>Jose C. Cortez</displayForm>
 <namePart type="family">Cortez</namePart>
 <namePart type="given">Jose</namePart>
 <namePart type="termsOfAddress"></namePart>
 <description>Defendant</description>
</name>
<name type="personal">
 <displayForm>Freddy</displayForm>
 <namePart type="family">Freddy</namePart>
 <namePart type="given"></namePart>
 <namePart type="termsOfAddress"></namePart>
 <description>Defendant</description>
</name>
<name type="personal">
 <displayForm>Jose F. Hernandez</displayForm>
 <namePart type="family">Hernandez</namePart>
 <namePart type="given">Jose</namePart>
 <namePart type="termsOfAddress"></namePart>
 <description>Defendant</description>
</name>
<name type="personal">
 <displayForm>Jose Hernandez-Mendoza</displayForm>
 <namePart type="family">Hernandez-Mendoza</namePart>
 <namePart type="given">Jose</namePart>
 <namePart type="termsOfAddress"></namePart>
 <description>Defendant</description>
</name>
<name type="personal">
 <displayForm>Juan</displayForm>
 <namePart type="family">Juan</namePart>
 <namePart type="given"></namePart>
 <namePart type="termsOfAddress"></namePart>
 <description>Defendant</description>
</name>
<name type="personal">
 <displayForm>Jose Mendoza</displayForm>
 <namePart type="family">Mendoza</namePart>
 <namePart type="given">Jose</namePart>
 <namePart type="termsOfAddress"></namePart>
 <description>Defendant</description>
</name>
<name type="personal">
 <displayForm>David Rodriguez</displayForm>
 <namePart type="family">Rodriguez</namePart>
 <namePart type="given">David</namePart>
 <namePart type="termsOfAddress"></namePart>
 <description>Defendant</description>
</name>
<name type="personal">
 <displayForm>JOsue Rodriguez</displayForm>
 <namePart type="family">Rodriguez</namePart>
 <namePart type="given">JOsue</namePart>
 <namePart type="termsOfAddress"></namePart>
 <description>Defendant</description>
</name>
<name type="personal">
 <displayForm>Josue Martin Rodriguez-Lopez</displayForm>
 <namePart type="family">Rodriguez-Lopez</namePart>
 <namePart type="given">Josue</namePart>
 <namePart type="termsOfAddress"></namePart>
 <description>Defendant</description>
</name>
<name type="personal">
 <displayForm>David Rodriguez-Solis</displayForm>
 <namePart type="family">Rodriguez-Solis</namePart>
 <namePart type="given">David</namePart>
 <namePart type="termsOfAddress"></namePart>
 <description>Defendant</description>
</name>
<name type="personal">
 <displayForm>Freddy Rodriguez-Solis</displayForm>
 <namePart type="family">Rodriguez-Solis</namePart>
 <namePart type="given">Freddy</namePart>
 <namePart type="termsOfAddress"></namePart>
 <description>Defendant</description>
</name>
<name type="personal">
 <displayForm>Fred David Rodriguez-Solis</displayForm>
 <namePart type="family">Rodriguez-Solis</namePart>
 <namePart type="given">Fred</namePart>
 <namePart type="termsOfAddress"></namePart>
 <description>Defendant</description>
</name>
<name type="personal">
 <displayForm>USA</displayForm>
 <namePart type="family">USA</namePart>
 <namePart type="given"></namePart>
 <namePart type="termsOfAddress"></namePart>
 <description>Plaintiff</description>
</name>
<name type="personal">
 <displayForm>Rogelio Valenzuela</displayForm>
 <namePart type="family">Valenzuela</namePart>
 <namePart type="given">Rogelio</namePart>
 <namePart type="termsOfAddress"></namePart>
 <description>Defendant</description>
</name>
<name type="personal">
 <displayForm>Rogelio L. Valenzuela-Lopez</displayForm>
 <namePart type="family">Valenzuela-Lopez</namePart>
 <namePart type="given">Rogelio</namePart>
 <namePart type="termsOfAddress"></namePart>
 <description>Defendant</description>
</name>
<extension>
 <docClass>USCOURTS</docClass>
 <accessId>USCOURTS-ned-8_05-cr-00199</accessId>
 <courtType>District</courtType>
 <courtCode>ned</courtCode>
 <courtCircuit>8th</courtCircuit>
 <courtState>Nebraska</courtState>
 <courtSortOrder>2300</courtSortOrder>
 <caseNumber>8:05-cr-00199</caseNumber>
 <caseOffice>8 Omaha</caseOffice>
 <caseType>criminal</caseType>
 <party firstName="Duane" fullName="Duane Charles Anderson" lastName="Anderson" middleName="Charles" role="Defendant"></party>
 <party firstName="Jose" fullName="Jose Contreras" lastName="Contreras" role="Defendant"></party>
 <party firstName="Jose" fullName="Jose C. Contreras-Cortez" lastName="Contreras-Cortez" middleName="C." role="Defendant"></party>
 <party firstName="Jose" fullName="Jose C. Cortez" lastName="Cortez" middleName="C." role="Defendant"></party>
 <party fullName="Freddy" lastName="Freddy" role="Defendant"></party>
 <party firstName="Jose" fullName="Jose F. Hernandez" lastName="Hernandez" middleName="F." role="Defendant"></party>
 <party firstName="Jose" fullName="Jose Hernandez-Mendoza" lastName="Hernandez-Mendoza" role="Defendant"></party>
 <party fullName="Juan" lastName="Juan" role="Defendant"></party>
 <party firstName="Jose" fullName="Jose Mendoza" lastName="Mendoza" role="Defendant"></party>
 <party firstName="David" fullName="David Rodriguez" lastName="Rodriguez" role="Defendant"></party>
 <party firstName="JOsue" fullName="JOsue Rodriguez" lastName="Rodriguez" role="Defendant"></party>
 <party firstName="Josue" fullName="Josue Martin Rodriguez-Lopez" lastName="Rodriguez-Lopez" middleName="Martin" role="Defendant"></party>
 <party firstName="David" fullName="David Rodriguez-Solis" lastName="Rodriguez-Solis" role="Defendant"></party>
 <party firstName="Freddy" fullName="Freddy Rodriguez-Solis" lastName="Rodriguez-Solis" role="Defendant"></party>
 <party firstName="Fred" fullName="Fred David Rodriguez-Solis" lastName="Rodriguez-Solis" middleName="David" role="Defendant"></party>
 <party fullName="USA" lastName="USA" role="Plaintiff"></party>
 <party firstName="Rogelio" fullName="Rogelio Valenzuela" lastName="Valenzuela" role="Defendant"></party>
 <party firstName="Rogelio" fullName="Rogelio L. Valenzuela-Lopez" lastName="Valenzuela-Lopez" middleName="L." role="Defendant"></party>
 <state>Nebraska</state>
</extension>
<relatedItem type="constituent" ID="id-USCOURTS-ned-8_05-cr-00199-0" xlink:href="http://www.gpo.gov/fdsys/granule/USCOURTS-ned-8_05-cr-00199/USCOURTS-ned-8_05-cr-00199-0/mods.xml">
 <titleInfo>
  <title>USA v. Anderson et al</title>
  <subTitle>ORDER APPOINTING COUNSEL - as to defendant Duane Charles Anderson - Federal Public Defender is appointed to represent the defendant signed by Magistrate Judge Thomas D. Thalken on 5/26/2005. (MBB)</subTitle>
  <partNumber>0</partNumber>
</titleInfo>
 <originInfo>
  <dateIssued>2005-05-26</dateIssued>
</originInfo>
 <relatedItem xlink:href="http://www.gpo.gov/fdsys/pkg/pdf/USCOURTS-ned-8_05-cr-00199-0.pdf" type="otherFormat">
  <identifier type="FDsys Unique ID">D09002ee181cf2ff1</identifier>
</relatedItem>
 <identifier type="uri">http://www.gpo.gov/fdsys/granule/USCOURTS-ned-8_05-cr-00199/USCOURTS-ned-8_05-cr-00199-0</identifier>
 <identifier type="former granule identifier">ned-8_05-cr-00199_0.pdf</identifier>
 <location>
  <url access="object in context" displayLabel="Content Detail">http://www.gpo.gov/fdsys/granule/USCOURTS-ned-8_05-cr-00199/USCOURTS-ned-8_05-cr-00199-0/content-detail.html</url>
  <url access="raw object" displayLabel="PDF rendition">http://www.gpo.gov/fdsys/pkg/USCOURTS-ned-8_05-cr-00199/pdf/USCOURTS-ned-8_05-cr-00199-0.pdf</url>
</location>
 <extension>
  <searchTitle>USCOURTS 8:05-cr-00199; USA v. Anderson et al; </searchTitle>
  <courtName>United States District Court District of Nebraska</courtName>
  <state>Nebraska</state>
  <accessId>USCOURTS-ned-8_05-cr-00199-0</accessId>
  <sequenceNumber>0</sequenceNumber>
  <dateIssued>2005-05-26</dateIssued>
  <docketText>ORDER APPOINTING COUNSEL - as to defendant Duane Charles Anderson - Federal Public Defender is appointed to represent the defendant signed by Magistrate Judge Thomas D. Thalken on 5/26/2005. (MBB)</docketText>
</extension>
</relatedItem>
<relatedItem type="constituent" ID="id-USCOURTS-ned-8_05-cr-00199-1" xlink:href="http://www.gpo.gov/fdsys/granule/USCOURTS-ned-8_05-cr-00199/USCOURTS-ned-8_05-cr-00199-1/mods.xml">
 <titleInfo>
  <title>USA v. Anderson et al</title>
  <subTitle>ORDER that the Oral Motion for extension of time to file pretrial motions is granted. The pretrial motions deadline is extended to 7/7/05. The time between 6/13/05 and 7/7/05 shall be excluded under the Speedy Trial Act as to Duane Charles Anderson. Signed by Magistrate Judge Thomas D. Thalken on 5/26/2005. (KBJ)</subTitle>
  <partNumber>1</partNumber>
</titleInfo>
 <originInfo>
  <dateIssued>2005-05-26</dateIssued>
</originInfo>
 <relatedItem xlink:href="http://www.gpo.gov/fdsys/pkg/pdf/USCOURTS-ned-8_05-cr-00199-1.pdf" type="otherFormat">
  <identifier type="FDsys Unique ID">D09002ee181cf2ffe</identifier>
</relatedItem>
 <identifier type="uri">http://www.gpo.gov/fdsys/granule/USCOURTS-ned-8_05-cr-00199/USCOURTS-ned-8_05-cr-00199-1</identifier>
 <identifier type="former granule identifier">ned-8_05-cr-00199_1.pdf</identifier>
 <location>
  <url access="object in context" displayLabel="Content Detail">http://www.gpo.gov/fdsys/granule/USCOURTS-ned-8_05-cr-00199/USCOURTS-ned-8_05-cr-00199-1/content-detail.html</url>
  <url access="raw object" displayLabel="PDF rendition">http://www.gpo.gov/fdsys/pkg/USCOURTS-ned-8_05-cr-00199/pdf/USCOURTS-ned-8_05-cr-00199-1.pdf</url>
</location>
 <extension>
  <searchTitle>USCOURTS 8:05-cr-00199; USA v. Anderson et al; </searchTitle>
  <courtName>United States District Court District of Nebraska</courtName>
  <state>Nebraska</state>
  <accessId>USCOURTS-ned-8_05-cr-00199-1</accessId>
  <sequenceNumber>1</sequenceNumber>
  <dateIssued>2005-05-26</dateIssued>
  <docketText>ORDER that the Oral Motion for extension of time to file pretrial motions is granted. The pretrial motions deadline is extended to 7/7/05. The time between 6/13/05 and 7/7/05 shall be excluded under the Speedy Trial Act as to Duane Charles Anderson. Signed by Magistrate Judge Thomas D. Thalken on 5/26/2005. (KBJ)</docketText>
</extension>
</relatedItem>
<relatedItem type="constituent" ID="id-USCOURTS-ned-8_05-cr-00199-2" xlink:href="http://www.gpo.gov/fdsys/granule/USCOURTS-ned-8_05-cr-00199/USCOURTS-ned-8_05-cr-00199-2/mods.xml">
 <titleInfo>
  <title>USA v. Anderson et al</title>
  <subTitle>ORDER of Detention pending trial as to defendant Duane Charles Anderson. Signed by Magistrate Judge Thomas D. Thalken on 5/31/2005. (KBJ)</subTitle>
  <partNumber>2</partNumber>
</titleInfo>
 <originInfo>
  <dateIssued>2005-05-31</dateIssued>
</originInfo>
 <relatedItem xlink:href="http://www.gpo.gov/fdsys/pkg/pdf/USCOURTS-ned-8_05-cr-00199-2.pdf" type="otherFormat">
  <identifier type="FDsys Unique ID">D09002ee181cf3004</identifier>
</relatedItem>
 <identifier type="uri">http://www.gpo.gov/fdsys/granule/USCOURTS-ned-8_05-cr-00199/USCOURTS-ned-8_05-cr-00199-2</identifier>
 <identifier type="former granule identifier">ned-8_05-cr-00199_2.pdf</identifier>
 <location>
  <url access="object in context" displayLabel="Content Detail">http://www.gpo.gov/fdsys/granule/USCOURTS-ned-8_05-cr-00199/USCOURTS-ned-8_05-cr-00199-2/content-detail.html</url>
  <url access="raw object" displayLabel="PDF rendition">http://www.gpo.gov/fdsys/pkg/USCOURTS-ned-8_05-cr-00199/pdf/USCOURTS-ned-8_05-cr-00199-2.pdf</url>
</location>
 <extension>
  <searchTitle>USCOURTS 8:05-cr-00199; USA v. Anderson et al; </searchTitle>
  <courtName>United States District Court District of Nebraska</courtName>
  <state>Nebraska</state>
  <accessId>USCOURTS-ned-8_05-cr-00199-2</accessId>
  <sequenceNumber>2</sequenceNumber>
  <dateIssued>2005-05-31</dateIssued>
  <docketText>ORDER of Detention pending trial as to defendant Duane Charles Anderson. Signed by Magistrate Judge Thomas D. Thalken on 5/31/2005. (KBJ)</docketText>
</extension>
</relatedItem>
<relatedItem type="constituent" ID="id-USCOURTS-ned-8_05-cr-00199-3" xlink:href="http://www.gpo.gov/fdsys/granule/USCOURTS-ned-8_05-cr-00199/USCOURTS-ned-8_05-cr-00199-3/mods.xml">
 <titleInfo>
  <title>USA v. Anderson et al</title>
  <subTitle>ORDER of Detention pending trial as to defendant Jose C. Contreras-Cortez. Signed by Magistrate Judge Thomas D. Thalken on 5/31/2005. (KBJ)</subTitle>
  <partNumber>3</partNumber>
</titleInfo>
 <originInfo>
  <dateIssued>2005-05-31</dateIssued>
</originInfo>
 <relatedItem xlink:href="http://www.gpo.gov/fdsys/pkg/pdf/USCOURTS-ned-8_05-cr-00199-3.pdf" type="otherFormat">
  <identifier type="FDsys Unique ID">D09002ee181cf2ff0</identifier>
</relatedItem>
 <identifier type="uri">http://www.gpo.gov/fdsys/granule/USCOURTS-ned-8_05-cr-00199/USCOURTS-ned-8_05-cr-00199-3</identifier>
 <identifier type="former granule identifier">ned-8_05-cr-00199_3.pdf</identifier>
 <location>
  <url access="object in context" displayLabel="Content Detail">http://www.gpo.gov/fdsys/granule/USCOURTS-ned-8_05-cr-00199/USCOURTS-ned-8_05-cr-00199-3/content-detail.html</url>
  <url access="raw object" displayLabel="PDF rendition">http://www.gpo.gov/fdsys/pkg/USCOURTS-ned-8_05-cr-00199/pdf/USCOURTS-ned-8_05-cr-00199-3.pdf</url>
</location>
 <extension>
  <searchTitle>USCOURTS 8:05-cr-00199; USA v. Anderson et al; </searchTitle>
  <courtName>United States District Court District of Nebraska</courtName>
  <state>Nebraska</state>
  <accessId>USCOURTS-ned-8_05-cr-00199-3</accessId>
  <sequenceNumber>3</sequenceNumber>
  <dateIssued>2005-05-31</dateIssued>
  <docketText>ORDER of Detention pending trial as to defendant Jose C. Contreras-Cortez. Signed by Magistrate Judge Thomas D. Thalken on 5/31/2005. (KBJ)</docketText>
</extension>
</relatedItem>
<relatedItem type="constituent" ID="id-USCOURTS-ned-8_05-cr-00199-4" xlink:href="http://www.gpo.gov/fdsys/granule/USCOURTS-ned-8_05-cr-00199/USCOURTS-ned-8_05-cr-00199-4/mods.xml">
 <titleInfo>
  <title>USA v. Anderson et al</title>
  <subTitle>ORDER of Detention pending trial as to defendant Jose Hernandez-Mendoza. Signed by Magistrate Judge Thomas D. Thalken on 5/31/2005. (KBJ)</subTitle>
  <partNumber>4</partNumber>
</titleInfo>
 <originInfo>
  <dateIssued>2005-05-31</dateIssued>
</originInfo>
 <relatedItem xlink:href="http://www.gpo.gov/fdsys/pkg/pdf/USCOURTS-ned-8_05-cr-00199-4.pdf" type="otherFormat">
  <identifier type="FDsys Unique ID">D09002ee181cf3005</identifier>
</relatedItem>
 <identifier type="uri">http://www.gpo.gov/fdsys/granule/USCOURTS-ned-8_05-cr-00199/USCOURTS-ned-8_05-cr-00199-4</identifier>
 <identifier type="former granule identifier">ned-8_05-cr-00199_4.pdf</identifier>
 <location>
  <url access="object in context" displayLabel="Content Detail">http://www.gpo.gov/fdsys/granule/USCOURTS-ned-8_05-cr-00199/USCOURTS-ned-8_05-cr-00199-4/content-detail.html</url>
  <url access="raw object" displayLabel="PDF rendition">http://www.gpo.gov/fdsys/pkg/USCOURTS-ned-8_05-cr-00199/pdf/USCOURTS-ned-8_05-cr-00199-4.pdf</url>
</location>
 <extension>
  <searchTitle>USCOURTS 8:05-cr-00199; USA v. Anderson et al; </searchTitle>
  <courtName>United States District Court District of Nebraska</courtName>
  <state>Nebraska</state>
  <accessId>USCOURTS-ned-8_05-cr-00199-4</accessId>
  <sequenceNumber>4</sequenceNumber>
  <dateIssued>2005-05-31</dateIssued>
  <docketText>ORDER of Detention pending trial as to defendant Jose Hernandez-Mendoza. Signed by Magistrate Judge Thomas D. Thalken on 5/31/2005. (KBJ)</docketText>
</extension>
</relatedItem>
<relatedItem type="constituent" ID="id-USCOURTS-ned-8_05-cr-00199-5" xlink:href="http://www.gpo.gov/fdsys/granule/USCOURTS-ned-8_05-cr-00199/USCOURTS-ned-8_05-cr-00199-5/mods.xml">
 <titleInfo>
  <title>USA v. Anderson et al</title>
  <subTitle>ORDER APPOINTING COUNSEL - as to defendant Fred David Rodriguez-Solis; Kristina B. Murphree is appointed as counsel for the defendant signed by Magistrate Judge Thomas D. Thalken on 5/31/2005. (MBB)</subTitle>
  <partNumber>5</partNumber>
</titleInfo>
 <originInfo>
  <dateIssued>2005-05-31</dateIssued>
</originInfo>
 <relatedItem xlink:href="http://www.gpo.gov/fdsys/pkg/pdf/USCOURTS-ned-8_05-cr-00199-5.pdf" type="otherFormat">
  <identifier type="FDsys Unique ID">D09002ee181cf3000</identifier>
</relatedItem>
 <identifier type="uri">http://www.gpo.gov/fdsys/granule/USCOURTS-ned-8_05-cr-00199/USCOURTS-ned-8_05-cr-00199-5</identifier>
 <identifier type="former granule identifier">ned-8_05-cr-00199_5.pdf</identifier>
 <location>
  <url access="object in context" displayLabel="Content Detail">http://www.gpo.gov/fdsys/granule/USCOURTS-ned-8_05-cr-00199/USCOURTS-ned-8_05-cr-00199-5/content-detail.html</url>
  <url access="raw object" displayLabel="PDF rendition">http://www.gpo.gov/fdsys/pkg/USCOURTS-ned-8_05-cr-00199/pdf/USCOURTS-ned-8_05-cr-00199-5.pdf</url>
</location>
 <extension>
  <searchTitle>USCOURTS 8:05-cr-00199; USA v. Anderson et al; </searchTitle>
  <courtName>United States District Court District of Nebraska</courtName>
  <state>Nebraska</state>
  <accessId>USCOURTS-ned-8_05-cr-00199-5</accessId>
  <sequenceNumber>5</sequenceNumber>
  <dateIssued>2005-05-31</dateIssued>
  <docketText>ORDER APPOINTING COUNSEL - as to defendant Fred David Rodriguez-Solis; Kristina B. Murphree is appointed as counsel for the defendant signed by Magistrate Judge Thomas D. Thalken on 5/31/2005. (MBB)</docketText>
</extension>
</relatedItem>
<relatedItem type="constituent" ID="id-USCOURTS-ned-8_05-cr-00199-6" xlink:href="http://www.gpo.gov/fdsys/granule/USCOURTS-ned-8_05-cr-00199/USCOURTS-ned-8_05-cr-00199-6/mods.xml">
 <titleInfo>
  <title>USA v. Anderson et al</title>
  <subTitle>ORDER of Detention pending trial as to defendant Fred David Rodriguez-Solis. Signed by Magistrate Judge Thomas D. Thalken on 5/31/2005. (KBJ)</subTitle>
  <partNumber>6</partNumber>
</titleInfo>
 <originInfo>
  <dateIssued>2005-05-31</dateIssued>
</originInfo>
 <relatedItem xlink:href="http://www.gpo.gov/fdsys/pkg/pdf/USCOURTS-ned-8_05-cr-00199-6.pdf" type="otherFormat">
  <identifier type="FDsys Unique ID">D09002ee181cf3006</identifier>
</relatedItem>
 <identifier type="uri">http://www.gpo.gov/fdsys/granule/USCOURTS-ned-8_05-cr-00199/USCOURTS-ned-8_05-cr-00199-6</identifier>
 <identifier type="former granule identifier">ned-8_05-cr-00199_6.pdf</identifier>
 <location>
  <url access="object in context" displayLabel="Content Detail">http://www.gpo.gov/fdsys/granule/USCOURTS-ned-8_05-cr-00199/USCOURTS-ned-8_05-cr-00199-6/content-detail.html</url>
  <url access="raw object" displayLabel="PDF rendition">http://www.gpo.gov/fdsys/pkg/USCOURTS-ned-8_05-cr-00199/pdf/USCOURTS-ned-8_05-cr-00199-6.pdf</url>
</location>
 <extension>
  <searchTitle>USCOURTS 8:05-cr-00199; USA v. Anderson et al; </searchTitle>
  <courtName>United States District Court District of Nebraska</courtName>
  <state>Nebraska</state>
  <accessId>USCOURTS-ned-8_05-cr-00199-6</accessId>
  <sequenceNumber>6</sequenceNumber>
  <dateIssued>2005-05-31</dateIssued>
  <docketText>ORDER of Detention pending trial as to defendant Fred David Rodriguez-Solis. Signed by Magistrate Judge Thomas D. Thalken on 5/31/2005. (KBJ)</docketText>
</extension>
</relatedItem>
<relatedItem type="constituent" ID="id-USCOURTS-ned-8_05-cr-00199-7" xlink:href="http://www.gpo.gov/fdsys/granule/USCOURTS-ned-8_05-cr-00199/USCOURTS-ned-8_05-cr-00199-7/mods.xml">
 <titleInfo>
  <title>USA v. Anderson et al</title>
  <subTitle>ORDER APPOINTING COUNSEL - as to defendant Jose Hernandez-Mendoza; M. Scott Vander Schaaf is appointed as counsel for defendant signed by Magistrate Judge Thomas D. Thalken on 5/31/2005. (MBB)</subTitle>
  <partNumber>7</partNumber>
</titleInfo>
 <originInfo>
  <dateIssued>2005-05-31</dateIssued>
</originInfo>
 <relatedItem xlink:href="http://www.gpo.gov/fdsys/pkg/pdf/USCOURTS-ned-8_05-cr-00199-7.pdf" type="otherFormat">
  <identifier type="FDsys Unique ID">D09002ee181cf2fef</identifier>
</relatedItem>
 <identifier type="uri">http://www.gpo.gov/fdsys/granule/USCOURTS-ned-8_05-cr-00199/USCOURTS-ned-8_05-cr-00199-7</identifier>
 <identifier type="former granule identifier">ned-8_05-cr-00199_7.pdf</identifier>
 <location>
  <url access="object in context" displayLabel="Content Detail">http://www.gpo.gov/fdsys/granule/USCOURTS-ned-8_05-cr-00199/USCOURTS-ned-8_05-cr-00199-7/content-detail.html</url>
  <url access="raw object" displayLabel="PDF rendition">http://www.gpo.gov/fdsys/pkg/USCOURTS-ned-8_05-cr-00199/pdf/USCOURTS-ned-8_05-cr-00199-7.pdf</url>
</location>
 <extension>
  <searchTitle>USCOURTS 8:05-cr-00199; USA v. Anderson et al; </searchTitle>
  <courtName>United States District Court District of Nebraska</courtName>
  <state>Nebraska</state>
  <accessId>USCOURTS-ned-8_05-cr-00199-7</accessId>
  <sequenceNumber>7</sequenceNumber>
  <dateIssued>2005-05-31</dateIssued>
  <docketText>ORDER APPOINTING COUNSEL - as to defendant Jose Hernandez-Mendoza; M. Scott Vander Schaaf is appointed as counsel for defendant signed by Magistrate Judge Thomas D. Thalken on 5/31/2005. (MBB)</docketText>
</extension>
</relatedItem>
<relatedItem type="constituent" ID="id-USCOURTS-ned-8_05-cr-00199-8" xlink:href="http://www.gpo.gov/fdsys/granule/USCOURTS-ned-8_05-cr-00199/USCOURTS-ned-8_05-cr-00199-8/mods.xml">
 <titleInfo>
  <title>USA v. Anderson et al</title>
  <subTitle>ORDER - An evidentiary hearing on all pending motions is scheduled before the undersigned magistrate judge at 9:00 a.m. on August 23, 2005, in Courtroom No. 7, Second Floor, Roman L. Hruska United States Courthouse, 111 South 18th Plaza, Omaha, Nebraska as to Jose C. Contreras-Cortez; as to Josue Martin Rodriguez-Lopez ; as to Jose Hernandez-Mendoza Signed by Magsitrate Judge Thomas D. Thalken on 7/12/2005. (TJS)ORDER - An evidentiary hearing on all pending motions is scheduled before the undersigned magistrate judge at 9:00 a.m. on August 23, 2005, in Courtroom No. 7, Second Floor, Roman L. Hruska United States Courthouse, 111 South 18th Plaza, Omaha, Nebraska as to Jose C. Contreras-Cortez; as to Josue Martin Rodriguez-Lopez ; as to Jose Hernandez-Mendoza Signed by Magsitrate Judge Thomas D. Thalken on 7/12/2005. (TJS)ORDER - An evidentiary hearing on all pending motions is scheduled before the undersigned magistrate judge at 9:00 a.m. on August 23, 2005, in Courtroom No. 7, Second Floor, Roman L. Hruska United States Courthouse, 111 South 18th Plaza, Omaha, Nebraska as to Jose C. Contreras-Cortez; as to Josue Martin Rodriguez-Lopez ; as to Jose Hernandez-Mendoza Signed by Magsitrate Judge Thomas D. Thalken on 7/12/2005. (TJS)</subTitle>
  <partNumber>8</partNumber>
</titleInfo>
 <originInfo>
  <dateIssued>2005-07-12</dateIssued>
</originInfo>
 <relatedItem xlink:href="http://www.gpo.gov/fdsys/pkg/pdf/USCOURTS-ned-8_05-cr-00199-8.pdf" type="otherFormat">
  <identifier type="FDsys Unique ID">D09002ee181cf300c</identifier>
</relatedItem>
 <identifier type="uri">http://www.gpo.gov/fdsys/granule/USCOURTS-ned-8_05-cr-00199/USCOURTS-ned-8_05-cr-00199-8</identifier>
 <identifier type="former granule identifier">ned-8_05-cr-00199_8.pdf</identifier>
 <location>
  <url access="object in context" displayLabel="Content Detail">http://www.gpo.gov/fdsys/granule/USCOURTS-ned-8_05-cr-00199/USCOURTS-ned-8_05-cr-00199-8/content-detail.html</url>
  <url access="raw object" displayLabel="PDF rendition">http://www.gpo.gov/fdsys/pkg/USCOURTS-ned-8_05-cr-00199/pdf/USCOURTS-ned-8_05-cr-00199-8.pdf</url>
</location>
 <extension>
  <searchTitle>USCOURTS 8:05-cr-00199; USA v. Anderson et al; </searchTitle>
  <courtName>United States District Court District of Nebraska</courtName>
  <state>Nebraska</state>
  <accessId>USCOURTS-ned-8_05-cr-00199-8</accessId>
  <sequenceNumber>8</sequenceNumber>
  <dateIssued>2005-07-12</dateIssued>
  <docketText>ORDER - An evidentiary hearing on all pending motions is scheduled before the undersigned magistrate judge at 9:00 a.m. on August 23, 2005, in Courtroom No. 7, Second Floor, Roman L. Hruska United States Courthouse, 111 South 18th Plaza, Omaha, Nebraska as to Jose C. Contreras-Cortez; as to Josue Martin Rodriguez-Lopez ; as to Jose Hernandez-Mendoza Signed by Magsitrate Judge Thomas D. Thalken on 7/12/2005. (TJS)ORDER - An evidentiary hearing on all pending motions is scheduled before the undersigned magistrate judge at 9:00 a.m. on August 23, 2005, in Courtroom No. 7, Second Floor, Roman L. Hruska United States Courthouse, 111 South 18th Plaza, Omaha, Nebraska as to Jose C. Contreras-Cortez; as to Josue Martin Rodriguez-Lopez ; as to Jose Hernandez-Mendoza Signed by Magsitrate Judge Thomas D. Thalken on 7/12/2005. (TJS)ORDER - An evidentiary hearing on all pending motions is scheduled before the undersigned magistrate judge at 9:00 a.m. on August 23, 2005, in Courtroom No. 7, Second Floor, Roman L. Hruska United States Courthouse, 111 South 18th Plaza, Omaha, Nebraska as to Jose C. Contreras-Cortez; as to Josue Martin Rodriguez-Lopez ; as to Jose Hernandez-Mendoza Signed by Magsitrate Judge Thomas D. Thalken on 7/12/2005. (TJS)</docketText>
</extension>
</relatedItem>
<relatedItem type="constituent" ID="id-USCOURTS-ned-8_05-cr-00199-9" xlink:href="http://www.gpo.gov/fdsys/granule/USCOURTS-ned-8_05-cr-00199/USCOURTS-ned-8_05-cr-00199-9/mods.xml">
 <titleInfo>
  <title>USA v. Anderson et al</title>
  <subTitle>ORDER granting [] Oral Motion to extend time to file a brief as to Jose Hernandez-Mendoza (6). IT IS ORDERED that all defendants are granted an extension of time to December1, 2005 in which to file a brief in response to their motions. The government may have untilDecember 7, 2005 to respond. Signed by Magistrate Judge Thomas D. Thalken on 11/21/2005. (ADB)</subTitle>
  <partNumber>9</partNumber>
</titleInfo>
 <originInfo>
  <dateIssued>2005-11-21</dateIssued>
</originInfo>
 <relatedItem xlink:href="http://www.gpo.gov/fdsys/pkg/pdf/USCOURTS-ned-8_05-cr-00199-9.pdf" type="otherFormat">
  <identifier type="FDsys Unique ID">D09002ee181cf2fea</identifier>
</relatedItem>
 <identifier type="uri">http://www.gpo.gov/fdsys/granule/USCOURTS-ned-8_05-cr-00199/USCOURTS-ned-8_05-cr-00199-9</identifier>
 <identifier type="former granule identifier">ned-8_05-cr-00199_9.pdf</identifier>
 <location>
  <url access="object in context" displayLabel="Content Detail">http://www.gpo.gov/fdsys/granule/USCOURTS-ned-8_05-cr-00199/USCOURTS-ned-8_05-cr-00199-9/content-detail.html</url>
  <url access="raw object" displayLabel="PDF rendition">http://www.gpo.gov/fdsys/pkg/USCOURTS-ned-8_05-cr-00199/pdf/USCOURTS-ned-8_05-cr-00199-9.pdf</url>
</location>
 <extension>
  <searchTitle>USCOURTS 8:05-cr-00199; USA v. Anderson et al; </searchTitle>
  <courtName>United States District Court District of Nebraska</courtName>
  <state>Nebraska</state>
  <accessId>USCOURTS-ned-8_05-cr-00199-9</accessId>
  <sequenceNumber>9</sequenceNumber>
  <dateIssued>2005-11-21</dateIssued>
  <docketText>ORDER granting [] Oral Motion to extend time to file a brief as to Jose Hernandez-Mendoza (6). IT IS ORDERED that all defendants are granted an extension of time to December1, 2005 in which to file a brief in response to their motions. The government may have untilDecember 7, 2005 to respond. Signed by Magistrate Judge Thomas D. Thalken on 11/21/2005. (ADB)</docketText>
</extension>
</relatedItem>
<relatedItem type="constituent" ID="id-USCOURTS-ned-8_05-cr-00199-10" xlink:href="http://www.gpo.gov/fdsys/granule/USCOURTS-ned-8_05-cr-00199/USCOURTS-ned-8_05-cr-00199-10/mods.xml">
 <titleInfo>
  <title>USA v. Anderson et al</title>
  <subTitle>REPORT AND RECOMMENDATION that MOTION to Suppress 27 be denied as to the currency found on his person but otherwise granted, MOTION to Suppress 33 be should be granted as to the statements and gestures made in Apartment No. 7 on March 21, 2005, but otherwise denied, MOTION to Suppress Evidence and Request for Evidentiary Hearing and Oral Argument 37 be denied, MOTION to Suppress 31 be denied as to defendants Fred David Rodriguez-Solis, Jose C. Contreras-Cortez, Josue Martin Rodriguez-Lopez, Jose Hernandez-Mendoza. Signed by Magistrate Judge Thomas D. Thalken on 1/27/2006. (PAV, )REPORT AND RECOMMENDATION that MOTION to Suppress 27 be denied as to the currency found on his person but otherwise granted, MOTION to Suppress 33 be should be granted as to the statements and gestures made in Apartment No. 7 on March 21, 2005, but otherwise denied, MOTION to Suppress Evidence and Request for Evidentiary Hearing and Oral Argument 37 be denied, MOTION to Suppress 31 be denied as to defendants Fred David Rodriguez-Solis, Jose C. Contreras-Cortez, Josue Martin Rodriguez-Lopez, Jose Hernandez-Mendoza. Signed by Magistrate Judge Thomas D. Thalken on 1/27/2006. (PAV, )REPORT AND RECOMMENDATION that MOTION to Suppress 27 be denied as to the currency found on his person but otherwise granted, MOTION to Suppress 33 be should be granted as to the statements and gestures made in Apartment No. 7 on March 21, 2005, but otherwise denied, MOTION to Suppress Evidence and Request for Evidentiary Hearing and Oral Argument 37 be denied, MOTION to Suppress 31 be denied as to defendants Fred David Rodriguez-Solis, Jose C. Contreras-Cortez, Josue Martin Rodriguez-Lopez, Jose Hernandez-Mendoza. Signed by Magistrate Judge Thomas D. Thalken on 1/27/2006. (PAV, )REPORT AND RECOMMENDATION that MOTION to Suppress 27 be denied as to the currency found on his person but otherwise granted, MOTION to Suppress 33 be should be granted as to the statements and gestures made in Apartment No. 7 on March 21, 2005, but otherwise denied, MOTION to Suppress Evidence and Request for Evidentiary Hearing and Oral Argument 37 be denied, MOTION to Suppress 31 be denied as to defendants Fred David Rodriguez-Solis, Jose C. Contreras-Cortez, Josue Martin Rodriguez-Lopez, Jose Hernandez-Mendoza. Signed by Magistrate Judge Thomas D. Thalken on 1/27/2006. (PAV, )</subTitle>
  <partNumber>10</partNumber>
</titleInfo>
 <originInfo>
  <dateIssued>2006-01-27</dateIssued>
</originInfo>
 <relatedItem xlink:href="http://www.gpo.gov/fdsys/pkg/pdf/USCOURTS-ned-8_05-cr-00199-10.pdf" type="otherFormat">
  <identifier type="FDsys Unique ID">D09002ee181cf2f67</identifier>
</relatedItem>
 <identifier type="uri">http://www.gpo.gov/fdsys/granule/USCOURTS-ned-8_05-cr-00199/USCOURTS-ned-8_05-cr-00199-10</identifier>
 <identifier type="former granule identifier">ned-8_05-cr-00199_10.pdf</identifier>
 <location>
  <url access="object in context" displayLabel="Content Detail">http://www.gpo.gov/fdsys/granule/USCOURTS-ned-8_05-cr-00199/USCOURTS-ned-8_05-cr-00199-10/content-detail.html</url>
  <url access="raw object" displayLabel="PDF rendition">http://www.gpo.gov/fdsys/pkg/USCOURTS-ned-8_05-cr-00199/pdf/USCOURTS-ned-8_05-cr-00199-10.pdf</url>
</location>
 <extension>
  <searchTitle>USCOURTS 8:05-cr-00199; USA v. Anderson et al; </searchTitle>
  <courtName>United States District Court District of Nebraska</courtName>
  <state>Nebraska</state>
  <accessId>USCOURTS-ned-8_05-cr-00199-10</accessId>
  <sequenceNumber>10</sequenceNumber>
  <dateIssued>2006-01-27</dateIssued>
  <docketText>REPORT AND RECOMMENDATION that MOTION to Suppress 27 be denied as to the currency found on his person but otherwise granted, MOTION to Suppress 33 be should be granted as to the statements and gestures made in Apartment No. 7 on March 21, 2005, but otherwise denied, MOTION to Suppress Evidence and Request for Evidentiary Hearing and Oral Argument 37 be denied, MOTION to Suppress 31 be denied as to defendants Fred David Rodriguez-Solis, Jose C. Contreras-Cortez, Josue Martin Rodriguez-Lopez, Jose Hernandez-Mendoza. Signed by Magistrate Judge Thomas D. Thalken on 1/27/2006. (PAV, )REPORT AND RECOMMENDATION that MOTION to Suppress 27 be denied as to the currency found on his person but otherwise granted, MOTION to Suppress 33 be should be granted as to the statements and gestures made in Apartment No. 7 on March 21, 2005, but otherwise denied, MOTION to Suppress Evidence and Request for Evidentiary Hearing and Oral Argument 37 be denied, MOTION to Suppress 31 be denied as to defendants Fred David Rodriguez-Solis, Jose C. Contreras-Cortez, Josue Martin Rodriguez-Lopez, Jose Hernandez-Mendoza. Signed by Magistrate Judge Thomas D. Thalken on 1/27/2006. (PAV, )REPORT AND RECOMMENDATION that MOTION to Suppress 27 be denied as to the currency found on his person but otherwise granted, MOTION to Suppress 33 be should be granted as to the statements and gestures made in Apartment No. 7 on March 21, 2005, but otherwise denied, MOTION to Suppress Evidence and Request for Evidentiary Hearing and Oral Argument 37 be denied, MOTION to Suppress 31 be denied as to defendants Fred David Rodriguez-Solis, Jose C. Contreras-Cortez, Josue Martin Rodriguez-Lopez, Jose Hernandez-Mendoza. Signed by Magistrate Judge Thomas D. Thalken on 1/27/2006. (PAV, )REPORT AND RECOMMENDATION that MOTION to Suppress 27 be denied as to the currency found on his person but otherwise granted, MOTION to Suppress 33 be should be granted as to the statements and gestures made in Apartment No. 7 on March 21, 2005, but otherwise denied, MOTION to Suppress Evidence and Request for Evidentiary Hearing and Oral Argument 37 be denied, MOTION to Suppress 31 be denied as to defendants Fred David Rodriguez-Solis, Jose C. Contreras-Cortez, Josue Martin Rodriguez-Lopez, Jose Hernandez-Mendoza. Signed by Magistrate Judge Thomas D. Thalken on 1/27/2006. (PAV, )</docketText>
</extension>
</relatedItem>
<relatedItem type="constituent" ID="id-USCOURTS-ned-8_05-cr-00199-11" xlink:href="http://www.gpo.gov/fdsys/granule/USCOURTS-ned-8_05-cr-00199/USCOURTS-ned-8_05-cr-00199-11/mods.xml">
 <titleInfo>
  <title>USA v. Anderson et al</title>
  <subTitle>ORDER the Defendant&apos;s motion for an extension of time (Filing No. 66) to fileobjections to the Magistrate Judge&apos;s Report and Recommendation isgranted; and The Defendant must file any objections to the Report and Recommendationon or before February 21, 2006 as to defendant Josue Martin Rodriguez-Lopez. Signed by Judge Laurie Smith Camp on 2/9/2006. (DKM, )</subTitle>
  <partNumber>11</partNumber>
</titleInfo>
 <originInfo>
  <dateIssued>2006-02-09</dateIssued>
</originInfo>
 <relatedItem xlink:href="http://www.gpo.gov/fdsys/pkg/pdf/USCOURTS-ned-8_05-cr-00199-11.pdf" type="otherFormat">
  <identifier type="FDsys Unique ID">D09002ee181cf2ffa</identifier>
</relatedItem>
 <identifier type="uri">http://www.gpo.gov/fdsys/granule/USCOURTS-ned-8_05-cr-00199/USCOURTS-ned-8_05-cr-00199-11</identifier>
 <identifier type="former granule identifier">ned-8_05-cr-00199_11.pdf</identifier>
 <location>
  <url access="object in context" displayLabel="Content Detail">http://www.gpo.gov/fdsys/granule/USCOURTS-ned-8_05-cr-00199/USCOURTS-ned-8_05-cr-00199-11/content-detail.html</url>
  <url access="raw object" displayLabel="PDF rendition">http://www.gpo.gov/fdsys/pkg/USCOURTS-ned-8_05-cr-00199/pdf/USCOURTS-ned-8_05-cr-00199-11.pdf</url>
</location>
 <extension>
  <searchTitle>USCOURTS 8:05-cr-00199; USA v. Anderson et al; </searchTitle>
  <courtName>United States District Court District of Nebraska</courtName>
  <state>Nebraska</state>
  <accessId>USCOURTS-ned-8_05-cr-00199-11</accessId>
  <sequenceNumber>11</sequenceNumber>
  <dateIssued>2006-02-09</dateIssued>
  <docketText>ORDER the Defendant&apos;s motion for an extension of time (Filing No. 66) to fileobjections to the Magistrate Judge&apos;s Report and Recommendation isgranted; and The Defendant must file any objections to the Report and Recommendationon or before February 21, 2006 as to defendant Josue Martin Rodriguez-Lopez. Signed by Judge Laurie Smith Camp on 2/9/2006. (DKM, )</docketText>
</extension>
</relatedItem>
<relatedItem type="constituent" ID="id-USCOURTS-ned-8_05-cr-00199-12" xlink:href="http://www.gpo.gov/fdsys/granule/USCOURTS-ned-8_05-cr-00199/USCOURTS-ned-8_05-cr-00199-12/mods.xml">
 <titleInfo>
  <title>USA v. Anderson et al</title>
  <subTitle>ORDER granting 68 Motion to Extend as to Fred David Rodriguez-Solis (2). The defendant must file any objections to the Report and Recommendation by 2/21/06. Signed by Judge Laurie Smith Camp on 2/13/2006. (JSF)</subTitle>
  <partNumber>12</partNumber>
</titleInfo>
 <originInfo>
  <dateIssued>2006-02-13</dateIssued>
</originInfo>
 <relatedItem xlink:href="http://www.gpo.gov/fdsys/pkg/pdf/USCOURTS-ned-8_05-cr-00199-12.pdf" type="otherFormat">
  <identifier type="FDsys Unique ID">D09002ee181cf2feb</identifier>
</relatedItem>
 <identifier type="uri">http://www.gpo.gov/fdsys/granule/USCOURTS-ned-8_05-cr-00199/USCOURTS-ned-8_05-cr-00199-12</identifier>
 <identifier type="former granule identifier">ned-8_05-cr-00199_12.pdf</identifier>
 <location>
  <url access="object in context" displayLabel="Content Detail">http://www.gpo.gov/fdsys/granule/USCOURTS-ned-8_05-cr-00199/USCOURTS-ned-8_05-cr-00199-12/content-detail.html</url>
  <url access="raw object" displayLabel="PDF rendition">http://www.gpo.gov/fdsys/pkg/USCOURTS-ned-8_05-cr-00199/pdf/USCOURTS-ned-8_05-cr-00199-12.pdf</url>
</location>
 <extension>
  <searchTitle>USCOURTS 8:05-cr-00199; USA v. Anderson et al; </searchTitle>
  <courtName>United States District Court District of Nebraska</courtName>
  <state>Nebraska</state>
  <accessId>USCOURTS-ned-8_05-cr-00199-12</accessId>
  <sequenceNumber>12</sequenceNumber>
  <dateIssued>2006-02-13</dateIssued>
  <docketText>ORDER granting 68 Motion to Extend as to Fred David Rodriguez-Solis (2). The defendant must file any objections to the Report and Recommendation by 2/21/06. Signed by Judge Laurie Smith Camp on 2/13/2006. (JSF)</docketText>
</extension>
</relatedItem>
<relatedItem type="constituent" ID="id-USCOURTS-ned-8_05-cr-00199-13" xlink:href="http://www.gpo.gov/fdsys/granule/USCOURTS-ned-8_05-cr-00199/USCOURTS-ned-8_05-cr-00199-13/mods.xml">
 <titleInfo>
  <title>USA v. Anderson et al</title>
  <subTitle>MEMORANDUM AND ORDER that the Magistrate Judge&apos;s Report and Recommendation 65 is amended as set forth within the order, otherwise, the Magistrate Judge&apos;s Report and Recommendation is adopted; the Statement of Objections to the Report and Recommendation 70 by defendant Fred David Rodriguez-Solis, is narrowly granted in part and denied in part as set forth within the order; The statement of Objections to the Report and Recommendation 72 filed by defendant, Josue Martin Rodriguez-Lopez, is narrowly granted in part and denied in part as set forth within the order; the defendant Rodriguez-Solis&apos;s Motion to Suppress 37 is denied; the Defendant Contreras-Cortez&apos;s Motion to Suppress 27 is denied as to the currency found on his person but otherwise granted; Defendant Rodriguez-Lopez&apos;s Motion to Suppress 31 is granted as to any evidence found during the search of the premises of Rodriguez-Lopez&apos;s 24th Street residence, and otherwise denied; and the defendant Hernandez-Mendoza&apos;s Motion to Suprress 33 is granted as to the statements and gestures made in Apartment No.7 on March 21, 2005, but otherwise denied. Signed by Judge Laurie Smith Camp on 3/10/2006. (MKR, )MEMORANDUM AND ORDER that the Magistrate Judge&apos;s Report and Recommendation 65 is amended as set forth within the order, otherwise, the Magistrate Judge&apos;s Report and Recommendation is adopted; the Statement of Objections to the Report and Recommendation 70 by defendant Fred David Rodriguez-Solis, is narrowly granted in part and denied in part as set forth within the order; The statement of Objections to the Report and Recommendation 72 filed by defendant, Josue Martin Rodriguez-Lopez, is narrowly granted in part and denied in part as set forth within the order; the defendant Rodriguez-Solis&apos;s Motion to Suppress 37 is denied; the Defendant Contreras-Cortez&apos;s Motion to Suppress 27 is denied as to the currency found on his person but otherwise granted; Defendant Rodriguez-Lopez&apos;s Motion to Suppress 31 is granted as to any evidence found during the search of the premises of Rodriguez-Lopez&apos;s 24th Street residence, and otherwise denied; and the defendant Hernandez-Mendoza&apos;s Motion to Suprress 33 is granted as to the statements and gestures made in Apartment No.7 on March 21, 2005, but otherwise denied. Signed by Judge Laurie Smith Camp on 3/10/2006. (MKR, )MEMORANDUM AND ORDER that the Magistrate Judge&apos;s Report and Recommendation 65 is amended as set forth within the order, otherwise, the Magistrate Judge&apos;s Report and Recommendation is adopted; the Statement of Objections to the Report and Recommendation 70 by defendant Fred David Rodriguez-Solis, is narrowly granted in part and denied in part as set forth within the order; The statement of Objections to the Report and Recommendation 72 filed by defendant, Josue Martin Rodriguez-Lopez, is narrowly granted in part and denied in part as set forth within the order; the defendant Rodriguez-Solis&apos;s Motion to Suppress 37 is denied; the Defendant Contreras-Cortez&apos;s Motion to Suppress 27 is denied as to the currency found on his person but otherwise granted; Defendant Rodriguez-Lopez&apos;s Motion to Suppress 31 is granted as to any evidence found during the search of the premises of Rodriguez-Lopez&apos;s 24th Street residence, and otherwise denied; and the defendant Hernandez-Mendoza&apos;s Motion to Suprress 33 is granted as to the statements and gestures made in Apartment No.7 on March 21, 2005, but otherwise denied. Signed by Judge Laurie Smith Camp on 3/10/2006. (MKR, )MEMORANDUM AND ORDER that the Magistrate Judge&apos;s Report and Recommendation 65 is amended as set forth within the order, otherwise, the Magistrate Judge&apos;s Report and Recommendation is adopted; the Statement of Objections to the Report and Recommendation 70 by defendant Fred David Rodriguez-Solis, is narrowly granted in part and denied in part as set forth within the order; The statement of Objections to the Report and Recommendation 72 filed by defendant, Josue Martin Rodriguez-Lopez, is narrowly granted in part and denied in part as set forth within the order; the defendant Rodriguez-Solis&apos;s Motion to Suppress 37 is denied; the Defendant Contreras-Cortez&apos;s Motion to Suppress 27 is denied as to the currency found on his person but otherwise granted; Defendant Rodriguez-Lopez&apos;s Motion to Suppress 31 is granted as to any evidence found during the search of the premises of Rodriguez-Lopez&apos;s 24th Street residence, and otherwise denied; and the defendant Hernandez-Mendoza&apos;s Motion to Suprress 33 is granted as to the statements and gestures made in Apartment No.7 on March 21, 2005, but otherwise denied. Signed by Judge Laurie Smith Camp on 3/10/2006. (MKR, )</subTitle>
  <partNumber>13</partNumber>
</titleInfo>
 <originInfo>
  <dateIssued>2006-03-10</dateIssued>
</originInfo>
 <relatedItem xlink:href="http://www.gpo.gov/fdsys/pkg/pdf/USCOURTS-ned-8_05-cr-00199-13.pdf" type="otherFormat">
  <identifier type="FDsys Unique ID">D09002ee181cf2ffc</identifier>
</relatedItem>
 <identifier type="uri">http://www.gpo.gov/fdsys/granule/USCOURTS-ned-8_05-cr-00199/USCOURTS-ned-8_05-cr-00199-13</identifier>
 <identifier type="former granule identifier">ned-8_05-cr-00199_13.pdf</identifier>
 <location>
  <url access="object in context" displayLabel="Content Detail">http://www.gpo.gov/fdsys/granule/USCOURTS-ned-8_05-cr-00199/USCOURTS-ned-8_05-cr-00199-13/content-detail.html</url>
  <url access="raw object" displayLabel="PDF rendition">http://www.gpo.gov/fdsys/pkg/USCOURTS-ned-8_05-cr-00199/pdf/USCOURTS-ned-8_05-cr-00199-13.pdf</url>
</location>
 <extension>
  <searchTitle>USCOURTS 8:05-cr-00199; USA v. Anderson et al; </searchTitle>
  <courtName>United States District Court District of Nebraska</courtName>
  <state>Nebraska</state>
  <accessId>USCOURTS-ned-8_05-cr-00199-13</accessId>
  <sequenceNumber>13</sequenceNumber>
  <dateIssued>2006-03-10</dateIssued>
  <docketText>MEMORANDUM AND ORDER that the Magistrate Judge&apos;s Report and Recommendation 65 is amended as set forth within the order, otherwise, the Magistrate Judge&apos;s Report and Recommendation is adopted; the Statement of Objections to the Report and Recommendation 70 by defendant Fred David Rodriguez-Solis, is narrowly granted in part and denied in part as set forth within the order; The statement of Objections to the Report and Recommendation 72 filed by defendant, Josue Martin Rodriguez-Lopez, is narrowly granted in part and denied in part as set forth within the order; the defendant Rodriguez-Solis&apos;s Motion to Suppress 37 is denied; the Defendant Contreras-Cortez&apos;s Motion to Suppress 27 is denied as to the currency found on his person but otherwise granted; Defendant Rodriguez-Lopez&apos;s Motion to Suppress 31 is granted as to any evidence found during the search of the premises of Rodriguez-Lopez&apos;s 24th Street residence, and otherwise denied; and the defendant Hernandez-Mendoza&apos;s Motion to Suprress 33 is granted as to the statements and gestures made in Apartment No.7 on March 21, 2005, but otherwise denied. Signed by Judge Laurie Smith Camp on 3/10/2006. (MKR, )MEMORANDUM AND ORDER that the Magistrate Judge&apos;s Report and Recommendation 65 is amended as set forth within the order, otherwise, the Magistrate Judge&apos;s Report and Recommendation is adopted; the Statement of Objections to the Report and Recommendation 70 by defendant Fred David Rodriguez-Solis, is narrowly granted in part and denied in part as set forth within the order; The statement of Objections to the Report and Recommendation 72 filed by defendant, Josue Martin Rodriguez-Lopez, is narrowly granted in part and denied in part as set forth within the order; the defendant Rodriguez-Solis&apos;s Motion to Suppress 37 is denied; the Defendant Contreras-Cortez&apos;s Motion to Suppress 27 is denied as to the currency found on his person but otherwise granted; Defendant Rodriguez-Lopez&apos;s Motion to Suppress 31 is granted as to any evidence found during the search of the premises of Rodriguez-Lopez&apos;s 24th Street residence, and otherwise denied; and the defendant Hernandez-Mendoza&apos;s Motion to Suprress 33 is granted as to the statements and gestures made in Apartment No.7 on March 21, 2005, but otherwise denied. Signed by Judge Laurie Smith Camp on 3/10/2006. (MKR, )MEMORANDUM AND ORDER that the Magistrate Judge&apos;s Report and Recommendation 65 is amended as set forth within the order, otherwise, the Magistrate Judge&apos;s Report and Recommendation is adopted; the Statement of Objections to the Report and Recommendation 70 by defendant Fred David Rodriguez-Solis, is narrowly granted in part and denied in part as set forth within the order; The statement of Objections to the Report and Recommendation 72 filed by defendant, Josue Martin Rodriguez-Lopez, is narrowly granted in part and denied in part as set forth within the order; the defendant Rodriguez-Solis&apos;s Motion to Suppress 37 is denied; the Defendant Contreras-Cortez&apos;s Motion to Suppress 27 is denied as to the currency found on his person but otherwise granted; Defendant Rodriguez-Lopez&apos;s Motion to Suppress 31 is granted as to any evidence found during the search of the premises of Rodriguez-Lopez&apos;s 24th Street residence, and otherwise denied; and the defendant Hernandez-Mendoza&apos;s Motion to Suprress 33 is granted as to the statements and gestures made in Apartment No.7 on March 21, 2005, but otherwise denied. Signed by Judge Laurie Smith Camp on 3/10/2006. (MKR, )MEMORANDUM AND ORDER that the Magistrate Judge&apos;s Report and Recommendation 65 is amended as set forth within the order, otherwise, the Magistrate Judge&apos;s Report and Recommendation is adopted; the Statement of Objections to the Report and Recommendation 70 by defendant Fred David Rodriguez-Solis, is narrowly granted in part and denied in part as set forth within the order; The statement of Objections to the Report and Recommendation 72 filed by defendant, Josue Martin Rodriguez-Lopez, is narrowly granted in part and denied in part as set forth within the order; the defendant Rodriguez-Solis&apos;s Motion to Suppress 37 is denied; the Defendant Contreras-Cortez&apos;s Motion to Suppress 27 is denied as to the currency found on his person but otherwise granted; Defendant Rodriguez-Lopez&apos;s Motion to Suppress 31 is granted as to any evidence found during the search of the premises of Rodriguez-Lopez&apos;s 24th Street residence, and otherwise denied; and the defendant Hernandez-Mendoza&apos;s Motion to Suprress 33 is granted as to the statements and gestures made in Apartment No.7 on March 21, 2005, but otherwise denied. Signed by Judge Laurie Smith Camp on 3/10/2006. (MKR, )</docketText>
</extension>
</relatedItem>
<relatedItem type="constituent" ID="id-USCOURTS-ned-8_05-cr-00199-14" xlink:href="http://www.gpo.gov/fdsys/granule/USCOURTS-ned-8_05-cr-00199/USCOURTS-ned-8_05-cr-00199-14/mods.xml">
 <titleInfo>
  <title>USA v. Anderson et al</title>
  <subTitle>ORDER RE: TRIAL PREPARATION (Criminal Jury Trial) as to Defendants Duane Charles Anderson, Fred David Rodriguez-Solis, Jose C. Contreras-Cortez, Josue Martin Rodriguez-Lopez, and Jose Hernandez-Mendoza. Signed by Judge Laurie Smith Camp on 3/17/2006. (JB)ORDER RE: TRIAL PREPARATION (Criminal Jury Trial) as to Defendants Duane Charles Anderson, Fred David Rodriguez-Solis, Jose C. Contreras-Cortez, Josue Martin Rodriguez-Lopez, and Jose Hernandez-Mendoza. Signed by Judge Laurie Smith Camp on 3/17/2006. (JB)ORDER RE: TRIAL PREPARATION (Criminal Jury Trial) as to Defendants Duane Charles Anderson, Fred David Rodriguez-Solis, Jose C. Contreras-Cortez, Josue Martin Rodriguez-Lopez, and Jose Hernandez-Mendoza. Signed by Judge Laurie Smith Camp on 3/17/2006. (JB)ORDER RE: TRIAL PREPARATION (Criminal Jury Trial) as to Defendants Duane Charles Anderson, Fred David Rodriguez-Solis, Jose C. Contreras-Cortez, Josue Martin Rodriguez-Lopez, and Jose Hernandez-Mendoza. Signed by Judge Laurie Smith Camp on 3/17/2006. (JB)ORDER RE: TRIAL PREPARATION (Criminal Jury Trial) as to Defendants Duane Charles Anderson, Fred David Rodriguez-Solis, Jose C. Contreras-Cortez, Josue Martin Rodriguez-Lopez, and Jose Hernandez-Mendoza. Signed by Judge Laurie Smith Camp on 3/17/2006. (JB)</subTitle>
  <partNumber>14</partNumber>
</titleInfo>
 <originInfo>
  <dateIssued>2006-03-17</dateIssued>
</originInfo>
 <relatedItem xlink:href="http://www.gpo.gov/fdsys/pkg/pdf/USCOURTS-ned-8_05-cr-00199-14.pdf" type="otherFormat">
  <identifier type="FDsys Unique ID">D09002ee181cf2ff5</identifier>
</relatedItem>
 <identifier type="uri">http://www.gpo.gov/fdsys/granule/USCOURTS-ned-8_05-cr-00199/USCOURTS-ned-8_05-cr-00199-14</identifier>
 <identifier type="former granule identifier">ned-8_05-cr-00199_14.pdf</identifier>
 <location>
  <url access="object in context" displayLabel="Content Detail">http://www.gpo.gov/fdsys/granule/USCOURTS-ned-8_05-cr-00199/USCOURTS-ned-8_05-cr-00199-14/content-detail.html</url>
  <url access="raw object" displayLabel="PDF rendition">http://www.gpo.gov/fdsys/pkg/USCOURTS-ned-8_05-cr-00199/pdf/USCOURTS-ned-8_05-cr-00199-14.pdf</url>
</location>
 <extension>
  <searchTitle>USCOURTS 8:05-cr-00199; USA v. Anderson et al; </searchTitle>
  <courtName>United States District Court District of Nebraska</courtName>
  <state>Nebraska</state>
  <accessId>USCOURTS-ned-8_05-cr-00199-14</accessId>
  <sequenceNumber>14</sequenceNumber>
  <dateIssued>2006-03-17</dateIssued>
  <docketText>ORDER RE: TRIAL PREPARATION (Criminal Jury Trial) as to Defendants Duane Charles Anderson, Fred David Rodriguez-Solis, Jose C. Contreras-Cortez, Josue Martin Rodriguez-Lopez, and Jose Hernandez-Mendoza. Signed by Judge Laurie Smith Camp on 3/17/2006. (JB)ORDER RE: TRIAL PREPARATION (Criminal Jury Trial) as to Defendants Duane Charles Anderson, Fred David Rodriguez-Solis, Jose C. Contreras-Cortez, Josue Martin Rodriguez-Lopez, and Jose Hernandez-Mendoza. Signed by Judge Laurie Smith Camp on 3/17/2006. (JB)ORDER RE: TRIAL PREPARATION (Criminal Jury Trial) as to Defendants Duane Charles Anderson, Fred David Rodriguez-Solis, Jose C. Contreras-Cortez, Josue Martin Rodriguez-Lopez, and Jose Hernandez-Mendoza. Signed by Judge Laurie Smith Camp on 3/17/2006. (JB)ORDER RE: TRIAL PREPARATION (Criminal Jury Trial) as to Defendants Duane Charles Anderson, Fred David Rodriguez-Solis, Jose C. Contreras-Cortez, Josue Martin Rodriguez-Lopez, and Jose Hernandez-Mendoza. Signed by Judge Laurie Smith Camp on 3/17/2006. (JB)ORDER RE: TRIAL PREPARATION (Criminal Jury Trial) as to Defendants Duane Charles Anderson, Fred David Rodriguez-Solis, Jose C. Contreras-Cortez, Josue Martin Rodriguez-Lopez, and Jose Hernandez-Mendoza. Signed by Judge Laurie Smith Camp on 3/17/2006. (JB)</docketText>
</extension>
</relatedItem>
<relatedItem type="constituent" ID="id-USCOURTS-ned-8_05-cr-00199-15" xlink:href="http://www.gpo.gov/fdsys/granule/USCOURTS-ned-8_05-cr-00199/USCOURTS-ned-8_05-cr-00199-15/mods.xml">
 <titleInfo>
  <title>USA v. Anderson et al</title>
  <subTitle>ORDER as to Fred David Rodriguez-Solis that the motion to withdraw 78 is scheduled for hearing before Magistrate Judge Thomas D. Thalken at 10:00 a.m. on 03/23/2006, in Courtroom No. 7, Second Floor, Roman L. Hruska United States Courthouse, 111 South 18th Plaza, Omaha, Nebraska. Signed by Magistrate Judge Thomas D. Thalken on 3/22/2006. (MBB)</subTitle>
  <partNumber>15</partNumber>
</titleInfo>
 <originInfo>
  <dateIssued>2006-03-22</dateIssued>
</originInfo>
 <relatedItem xlink:href="http://www.gpo.gov/fdsys/pkg/pdf/USCOURTS-ned-8_05-cr-00199-15.pdf" type="otherFormat">
  <identifier type="FDsys Unique ID">D09002ee181cf300b</identifier>
</relatedItem>
 <identifier type="uri">http://www.gpo.gov/fdsys/granule/USCOURTS-ned-8_05-cr-00199/USCOURTS-ned-8_05-cr-00199-15</identifier>
 <identifier type="former granule identifier">ned-8_05-cr-00199_15.pdf</identifier>
 <location>
  <url access="object in context" displayLabel="Content Detail">http://www.gpo.gov/fdsys/granule/USCOURTS-ned-8_05-cr-00199/USCOURTS-ned-8_05-cr-00199-15/content-detail.html</url>
  <url access="raw object" displayLabel="PDF rendition">http://www.gpo.gov/fdsys/pkg/USCOURTS-ned-8_05-cr-00199/pdf/USCOURTS-ned-8_05-cr-00199-15.pdf</url>
</location>
 <extension>
  <searchTitle>USCOURTS 8:05-cr-00199; USA v. Anderson et al; </searchTitle>
  <courtName>United States District Court District of Nebraska</courtName>
  <state>Nebraska</state>
  <accessId>USCOURTS-ned-8_05-cr-00199-15</accessId>
  <sequenceNumber>15</sequenceNumber>
  <dateIssued>2006-03-22</dateIssued>
  <docketText>ORDER as to Fred David Rodriguez-Solis that the motion to withdraw 78 is scheduled for hearing before Magistrate Judge Thomas D. Thalken at 10:00 a.m. on 03/23/2006, in Courtroom No. 7, Second Floor, Roman L. Hruska United States Courthouse, 111 South 18th Plaza, Omaha, Nebraska. Signed by Magistrate Judge Thomas D. Thalken on 3/22/2006. (MBB)</docketText>
</extension>
</relatedItem>
<relatedItem type="constituent" ID="id-USCOURTS-ned-8_05-cr-00199-16" xlink:href="http://www.gpo.gov/fdsys/granule/USCOURTS-ned-8_05-cr-00199/USCOURTS-ned-8_05-cr-00199-16/mods.xml">
 <titleInfo>
  <title>USA v. Anderson et al</title>
  <subTitle>ORDER as to defendant Fred David Rodriguez-Solis. A hearing on the defendant&apos;s anticipated plea of guilty is scheduled before Magistrate Judge Thalken on 03/31/2006 at 11:00 a.m. in Courtroom No. 7, Second Floor, Roman L. Hruska U.S. Courthouse, 111 South 18th Plaza, Omaha, Nebraska. The time between today&apos;s date and the hearing on the anticipated plea of guilty is excluded for purposes of computing the limits under the Speedy Trial Act. Signed by Magistrate Judge Thomas D. Thalken on 3/23/2006. (MBB)</subTitle>
  <partNumber>16</partNumber>
</titleInfo>
 <originInfo>
  <dateIssued>2006-03-23</dateIssued>
</originInfo>
 <relatedItem xlink:href="http://www.gpo.gov/fdsys/pkg/pdf/USCOURTS-ned-8_05-cr-00199-16.pdf" type="otherFormat">
  <identifier type="FDsys Unique ID">D09002ee181cf2fe9</identifier>
</relatedItem>
 <identifier type="uri">http://www.gpo.gov/fdsys/granule/USCOURTS-ned-8_05-cr-00199/USCOURTS-ned-8_05-cr-00199-16</identifier>
 <identifier type="former granule identifier">ned-8_05-cr-00199_16.pdf</identifier>
 <location>
  <url access="object in context" displayLabel="Content Detail">http://www.gpo.gov/fdsys/granule/USCOURTS-ned-8_05-cr-00199/USCOURTS-ned-8_05-cr-00199-16/content-detail.html</url>
  <url access="raw object" displayLabel="PDF rendition">http://www.gpo.gov/fdsys/pkg/USCOURTS-ned-8_05-cr-00199/pdf/USCOURTS-ned-8_05-cr-00199-16.pdf</url>
</location>
 <extension>
  <searchTitle>USCOURTS 8:05-cr-00199; USA v. Anderson et al; </searchTitle>
  <courtName>United States District Court District of Nebraska</courtName>
  <state>Nebraska</state>
  <accessId>USCOURTS-ned-8_05-cr-00199-16</accessId>
  <sequenceNumber>16</sequenceNumber>
  <dateIssued>2006-03-23</dateIssued>
  <docketText>ORDER as to defendant Fred David Rodriguez-Solis. A hearing on the defendant&apos;s anticipated plea of guilty is scheduled before Magistrate Judge Thalken on 03/31/2006 at 11:00 a.m. in Courtroom No. 7, Second Floor, Roman L. Hruska U.S. Courthouse, 111 South 18th Plaza, Omaha, Nebraska. The time between today&apos;s date and the hearing on the anticipated plea of guilty is excluded for purposes of computing the limits under the Speedy Trial Act. Signed by Magistrate Judge Thomas D. Thalken on 3/23/2006. (MBB)</docketText>
</extension>
</relatedItem>
<relatedItem type="constituent" ID="id-USCOURTS-ned-8_05-cr-00199-17" xlink:href="http://www.gpo.gov/fdsys/granule/USCOURTS-ned-8_05-cr-00199/USCOURTS-ned-8_05-cr-00199-17/mods.xml">
 <titleInfo>
  <title>USA v. Anderson et al</title>
  <subTitle>ORDER granting 80 Motion to Continue Trial filed by Josue Martin Rodriguez-Lopez (4). Jury Trial continued to 5/23/2006 at 8:30 AM in Courtroom 2 (Omaha) before Judge Laurie Smith Camp as to defendants DUANE CHARLES ANDERSON, JOSE C. CONTRERAS-CORTEZ, JOSUE MARTIN RODRIGUEZ-LOPEZ and JOSE HERNANDEZ-MENDOZA. The time between 4/4/2006 and 5/23/2006 shall be deemed excludable under the Speedy Trial Act. Counsel for the United States shall confer with defense counsel and, no later than 5/15/2006, advise the court of the anticipated length of trial. Signed by Magistrate Judge F. A. Gossett on 3/27/2006. (CLS, )</subTitle>
  <partNumber>17</partNumber>
</titleInfo>
 <originInfo>
  <dateIssued>2006-03-27</dateIssued>
</originInfo>
 <relatedItem xlink:href="http://www.gpo.gov/fdsys/pkg/pdf/USCOURTS-ned-8_05-cr-00199-17.pdf" type="otherFormat">
  <identifier type="FDsys Unique ID">D09002ee181cf2f66</identifier>
</relatedItem>
 <identifier type="uri">http://www.gpo.gov/fdsys/granule/USCOURTS-ned-8_05-cr-00199/USCOURTS-ned-8_05-cr-00199-17</identifier>
 <identifier type="former granule identifier">ned-8_05-cr-00199_17.pdf</identifier>
 <location>
  <url access="object in context" displayLabel="Content Detail">http://www.gpo.gov/fdsys/granule/USCOURTS-ned-8_05-cr-00199/USCOURTS-ned-8_05-cr-00199-17/content-detail.html</url>
  <url access="raw object" displayLabel="PDF rendition">http://www.gpo.gov/fdsys/pkg/USCOURTS-ned-8_05-cr-00199/pdf/USCOURTS-ned-8_05-cr-00199-17.pdf</url>
</location>
 <extension>
  <searchTitle>USCOURTS 8:05-cr-00199; USA v. Anderson et al; </searchTitle>
  <courtName>United States District Court District of Nebraska</courtName>
  <state>Nebraska</state>
  <accessId>USCOURTS-ned-8_05-cr-00199-17</accessId>
  <sequenceNumber>17</sequenceNumber>
  <dateIssued>2006-03-27</dateIssued>
  <docketText>ORDER granting 80 Motion to Continue Trial filed by Josue Martin Rodriguez-Lopez (4). Jury Trial continued to 5/23/2006 at 8:30 AM in Courtroom 2 (Omaha) before Judge Laurie Smith Camp as to defendants DUANE CHARLES ANDERSON, JOSE C. CONTRERAS-CORTEZ, JOSUE MARTIN RODRIGUEZ-LOPEZ and JOSE HERNANDEZ-MENDOZA. The time between 4/4/2006 and 5/23/2006 shall be deemed excludable under the Speedy Trial Act. Counsel for the United States shall confer with defense counsel and, no later than 5/15/2006, advise the court of the anticipated length of trial. Signed by Magistrate Judge F. A. Gossett on 3/27/2006. (CLS, )</docketText>
</extension>
</relatedItem>
<relatedItem type="constituent" ID="id-USCOURTS-ned-8_05-cr-00199-18" xlink:href="http://www.gpo.gov/fdsys/granule/USCOURTS-ned-8_05-cr-00199/USCOURTS-ned-8_05-cr-00199-18/mods.xml">
 <titleInfo>
  <title>USA v. Anderson et al</title>
  <subTitle>ORDER as to defendant Jose Hernandez-Mendoza that a hearing on the defendant&apos;s anticipated plea of guilty is scheduled before Magistrate Judge Thalken on 04/28/2006 at 10:30 a.m. in Courtroom No. 7, Second Floor, Roman L. Hruska U.S. Courthouse, 111 South 18th Plaza, Omaha, Nebraska. The time between today&apos;s date and the hearing on the anticipated plea of guilty is excluded for purposes of computing the limits under the Speedy Trial Act. Signed by Magistrate Judge Thomas D. Thalken on 4/10/2006. (MBB)</subTitle>
  <partNumber>18</partNumber>
</titleInfo>
 <originInfo>
  <dateIssued>2006-04-10</dateIssued>
</originInfo>
 <relatedItem xlink:href="http://www.gpo.gov/fdsys/pkg/pdf/USCOURTS-ned-8_05-cr-00199-18.pdf" type="otherFormat">
  <identifier type="FDsys Unique ID">D09002ee181cf2ffb</identifier>
</relatedItem>
 <identifier type="uri">http://www.gpo.gov/fdsys/granule/USCOURTS-ned-8_05-cr-00199/USCOURTS-ned-8_05-cr-00199-18</identifier>
 <identifier type="former granule identifier">ned-8_05-cr-00199_18.pdf</identifier>
 <location>
  <url access="object in context" displayLabel="Content Detail">http://www.gpo.gov/fdsys/granule/USCOURTS-ned-8_05-cr-00199/USCOURTS-ned-8_05-cr-00199-18/content-detail.html</url>
  <url access="raw object" displayLabel="PDF rendition">http://www.gpo.gov/fdsys/pkg/USCOURTS-ned-8_05-cr-00199/pdf/USCOURTS-ned-8_05-cr-00199-18.pdf</url>
</location>
 <extension>
  <searchTitle>USCOURTS 8:05-cr-00199; USA v. Anderson et al; </searchTitle>
  <courtName>United States District Court District of Nebraska</courtName>
  <state>Nebraska</state>
  <accessId>USCOURTS-ned-8_05-cr-00199-18</accessId>
  <sequenceNumber>18</sequenceNumber>
  <dateIssued>2006-04-10</dateIssued>
  <docketText>ORDER as to defendant Jose Hernandez-Mendoza that a hearing on the defendant&apos;s anticipated plea of guilty is scheduled before Magistrate Judge Thalken on 04/28/2006 at 10:30 a.m. in Courtroom No. 7, Second Floor, Roman L. Hruska U.S. Courthouse, 111 South 18th Plaza, Omaha, Nebraska. The time between today&apos;s date and the hearing on the anticipated plea of guilty is excluded for purposes of computing the limits under the Speedy Trial Act. Signed by Magistrate Judge Thomas D. Thalken on 4/10/2006. (MBB)</docketText>
</extension>
</relatedItem>
<relatedItem type="constituent" ID="id-USCOURTS-ned-8_05-cr-00199-19" xlink:href="http://www.gpo.gov/fdsys/granule/USCOURTS-ned-8_05-cr-00199/USCOURTS-ned-8_05-cr-00199-19/mods.xml">
 <titleInfo>
  <title>USA v. Anderson et al</title>
  <subTitle>ORDER as to defendant Duane Charles Anderson that a hearing on the defendant&apos;s anticipated plea of guilty is scheduled before Magistrate Judge Thomas D. Thalken on 05/26/2006 at 11:15 a.m. in Courtroom No. 7, Second Floor, Roman L. Hruska U.S. Courthouse, 111 South 18th Plaza, Omaha, Nebraska. The time between today&apos;s date and the hearing on the anticipated plea of guilty is excluded for purposes of computing the limits under the Speedy Trial Act. Signed by Magistrate Judge Thomas D. Thalken on 5/16/2006. (MBB)</subTitle>
  <partNumber>19</partNumber>
</titleInfo>
 <originInfo>
  <dateIssued>2006-05-16</dateIssued>
</originInfo>
 <relatedItem xlink:href="http://www.gpo.gov/fdsys/pkg/pdf/USCOURTS-ned-8_05-cr-00199-19.pdf" type="otherFormat">
  <identifier type="FDsys Unique ID">D09002ee181cf3001</identifier>
</relatedItem>
 <identifier type="uri">http://www.gpo.gov/fdsys/granule/USCOURTS-ned-8_05-cr-00199/USCOURTS-ned-8_05-cr-00199-19</identifier>
 <identifier type="former granule identifier">ned-8_05-cr-00199_19.pdf</identifier>
 <location>
  <url access="object in context" displayLabel="Content Detail">http://www.gpo.gov/fdsys/granule/USCOURTS-ned-8_05-cr-00199/USCOURTS-ned-8_05-cr-00199-19/content-detail.html</url>
  <url access="raw object" displayLabel="PDF rendition">http://www.gpo.gov/fdsys/pkg/USCOURTS-ned-8_05-cr-00199/pdf/USCOURTS-ned-8_05-cr-00199-19.pdf</url>
</location>
 <extension>
  <searchTitle>USCOURTS 8:05-cr-00199; USA v. Anderson et al; </searchTitle>
  <courtName>United States District Court District of Nebraska</courtName>
  <state>Nebraska</state>
  <accessId>USCOURTS-ned-8_05-cr-00199-19</accessId>
  <sequenceNumber>19</sequenceNumber>
  <dateIssued>2006-05-16</dateIssued>
  <docketText>ORDER as to defendant Duane Charles Anderson that a hearing on the defendant&apos;s anticipated plea of guilty is scheduled before Magistrate Judge Thomas D. Thalken on 05/26/2006 at 11:15 a.m. in Courtroom No. 7, Second Floor, Roman L. Hruska U.S. Courthouse, 111 South 18th Plaza, Omaha, Nebraska. The time between today&apos;s date and the hearing on the anticipated plea of guilty is excluded for purposes of computing the limits under the Speedy Trial Act. Signed by Magistrate Judge Thomas D. Thalken on 5/16/2006. (MBB)</docketText>
</extension>
</relatedItem>
<relatedItem type="constituent" ID="id-USCOURTS-ned-8_05-cr-00199-20" xlink:href="http://www.gpo.gov/fdsys/granule/USCOURTS-ned-8_05-cr-00199/USCOURTS-ned-8_05-cr-00199-20/mods.xml">
 <titleInfo>
  <title>USA v. Anderson et al</title>
  <subTitle>ORDER granting 108 Motion to Continue Trial filed by Jose C. Contreras-Cortez (3). Jury Trial continued to 7/5/2006 at 9:00 AM in Courtroom 2 (Omaha) before Judge Laurie Smith Camp. The time between May 23, 2006 and July 5, 2006, shall be deemed excludable under the Speedy Trial Act. Counsel for the United States shall confer with defense counsel and, no later than June 27, 2006, advise the court of the anticipated length of trial. Signed by Magistrate Judge F. A. Gossett on 5/18/2006. (CLS, )</subTitle>
  <partNumber>20</partNumber>
</titleInfo>
 <originInfo>
  <dateIssued>2006-05-18</dateIssued>
</originInfo>
 <relatedItem xlink:href="http://www.gpo.gov/fdsys/pkg/pdf/USCOURTS-ned-8_05-cr-00199-20.pdf" type="otherFormat">
  <identifier type="FDsys Unique ID">D09002ee181cf3002</identifier>
</relatedItem>
 <identifier type="uri">http://www.gpo.gov/fdsys/granule/USCOURTS-ned-8_05-cr-00199/USCOURTS-ned-8_05-cr-00199-20</identifier>
 <identifier type="former granule identifier">ned-8_05-cr-00199_20.pdf</identifier>
 <location>
  <url access="object in context" displayLabel="Content Detail">http://www.gpo.gov/fdsys/granule/USCOURTS-ned-8_05-cr-00199/USCOURTS-ned-8_05-cr-00199-20/content-detail.html</url>
  <url access="raw object" displayLabel="PDF rendition">http://www.gpo.gov/fdsys/pkg/USCOURTS-ned-8_05-cr-00199/pdf/USCOURTS-ned-8_05-cr-00199-20.pdf</url>
</location>
 <extension>
  <searchTitle>USCOURTS 8:05-cr-00199; USA v. Anderson et al; </searchTitle>
  <courtName>United States District Court District of Nebraska</courtName>
  <state>Nebraska</state>
  <accessId>USCOURTS-ned-8_05-cr-00199-20</accessId>
  <sequenceNumber>20</sequenceNumber>
  <dateIssued>2006-05-18</dateIssued>
  <docketText>ORDER granting 108 Motion to Continue Trial filed by Jose C. Contreras-Cortez (3). Jury Trial continued to 7/5/2006 at 9:00 AM in Courtroom 2 (Omaha) before Judge Laurie Smith Camp. The time between May 23, 2006 and July 5, 2006, shall be deemed excludable under the Speedy Trial Act. Counsel for the United States shall confer with defense counsel and, no later than June 27, 2006, advise the court of the anticipated length of trial. Signed by Magistrate Judge F. A. Gossett on 5/18/2006. (CLS, )</docketText>
</extension>
</relatedItem>
<relatedItem type="constituent" ID="id-USCOURTS-ned-8_05-cr-00199-21" xlink:href="http://www.gpo.gov/fdsys/granule/USCOURTS-ned-8_05-cr-00199/USCOURTS-ned-8_05-cr-00199-21/mods.xml">
 <titleInfo>
  <title>USA v. Anderson et al</title>
  <subTitle>ORDER OF DISMISSAL- that the Plaintiff&apos;s motion to dismiss 120 is granted; Leave of Court is granted for the United States to dismiss, without prejudice, the Indictment filed herein as to the Defendant, Jose Contreras-Cortez; and the Indictment filed herein is hereby dismissed, without prejudice, as it pertains to the Defendant, Jose Contreras-Cortez. . Signed by Judge Laurie Smith Camp on 6/15/2006. (MKR, )</subTitle>
  <partNumber>21</partNumber>
</titleInfo>
 <originInfo>
  <dateIssued>2006-06-15</dateIssued>
</originInfo>
 <relatedItem xlink:href="http://www.gpo.gov/fdsys/pkg/pdf/USCOURTS-ned-8_05-cr-00199-21.pdf" type="otherFormat">
  <identifier type="FDsys Unique ID">D09002ee181cf2fed</identifier>
</relatedItem>
 <identifier type="uri">http://www.gpo.gov/fdsys/granule/USCOURTS-ned-8_05-cr-00199/USCOURTS-ned-8_05-cr-00199-21</identifier>
 <identifier type="former granule identifier">ned-8_05-cr-00199_21.pdf</identifier>
 <location>
  <url access="object in context" displayLabel="Content Detail">http://www.gpo.gov/fdsys/granule/USCOURTS-ned-8_05-cr-00199/USCOURTS-ned-8_05-cr-00199-21/content-detail.html</url>
  <url access="raw object" displayLabel="PDF rendition">http://www.gpo.gov/fdsys/pkg/USCOURTS-ned-8_05-cr-00199/pdf/USCOURTS-ned-8_05-cr-00199-21.pdf</url>
</location>
 <extension>
  <searchTitle>USCOURTS 8:05-cr-00199; USA v. Anderson et al; </searchTitle>
  <courtName>United States District Court District of Nebraska</courtName>
  <state>Nebraska</state>
  <accessId>USCOURTS-ned-8_05-cr-00199-21</accessId>
  <sequenceNumber>21</sequenceNumber>
  <dateIssued>2006-06-15</dateIssued>
  <docketText>ORDER OF DISMISSAL- that the Plaintiff&apos;s motion to dismiss 120 is granted; Leave of Court is granted for the United States to dismiss, without prejudice, the Indictment filed herein as to the Defendant, Jose Contreras-Cortez; and the Indictment filed herein is hereby dismissed, without prejudice, as it pertains to the Defendant, Jose Contreras-Cortez. . Signed by Judge Laurie Smith Camp on 6/15/2006. (MKR, )</docketText>
</extension>
</relatedItem>
<relatedItem type="constituent" ID="id-USCOURTS-ned-8_05-cr-00199-22" xlink:href="http://www.gpo.gov/fdsys/granule/USCOURTS-ned-8_05-cr-00199/USCOURTS-ned-8_05-cr-00199-22/mods.xml">
 <titleInfo>
  <title>USA v. Anderson et al</title>
  <subTitle>TENTATIVE FINDINGS OF FACT regarding Presentence Investigation Report as to defendant Fred David Rodriguez-Solis. Signed by Judge Laurie Smith Camp on 6/16/2006. (DKM, )</subTitle>
  <partNumber>22</partNumber>
</titleInfo>
 <originInfo>
  <dateIssued>2006-06-16</dateIssued>
</originInfo>
 <relatedItem xlink:href="http://www.gpo.gov/fdsys/pkg/pdf/USCOURTS-ned-8_05-cr-00199-22.pdf" type="otherFormat">
  <identifier type="FDsys Unique ID">D09002ee181cf2ff6</identifier>
</relatedItem>
 <identifier type="uri">http://www.gpo.gov/fdsys/granule/USCOURTS-ned-8_05-cr-00199/USCOURTS-ned-8_05-cr-00199-22</identifier>
 <identifier type="former granule identifier">ned-8_05-cr-00199_22.pdf</identifier>
 <location>
  <url access="object in context" displayLabel="Content Detail">http://www.gpo.gov/fdsys/granule/USCOURTS-ned-8_05-cr-00199/USCOURTS-ned-8_05-cr-00199-22/content-detail.html</url>
  <url access="raw object" displayLabel="PDF rendition">http://www.gpo.gov/fdsys/pkg/USCOURTS-ned-8_05-cr-00199/pdf/USCOURTS-ned-8_05-cr-00199-22.pdf</url>
</location>
 <extension>
  <searchTitle>USCOURTS 8:05-cr-00199; USA v. Anderson et al; </searchTitle>
  <courtName>United States District Court District of Nebraska</courtName>
  <state>Nebraska</state>
  <accessId>USCOURTS-ned-8_05-cr-00199-22</accessId>
  <sequenceNumber>22</sequenceNumber>
  <dateIssued>2006-06-16</dateIssued>
  <docketText>TENTATIVE FINDINGS OF FACT regarding Presentence Investigation Report as to defendant Fred David Rodriguez-Solis. Signed by Judge Laurie Smith Camp on 6/16/2006. (DKM, )</docketText>
</extension>
</relatedItem>
<relatedItem type="constituent" ID="id-USCOURTS-ned-8_05-cr-00199-23" xlink:href="http://www.gpo.gov/fdsys/granule/USCOURTS-ned-8_05-cr-00199/USCOURTS-ned-8_05-cr-00199-23/mods.xml">
 <titleInfo>
  <title>USA v. Anderson et al</title>
  <subTitle>JUDGMENT as to Fred David Rodriguez-Solis (2), The defendant pleaded guilty to counts 1 and 8 of the indictment and is committed to the custody of the Bureau of Prisons for 135 months; 5 years supervised release with special conditions; and $100 special assessment. Count 5 of the indictment is dismissed on the motion of the United States as to this defendant only as to defendant Fred David Rodriguez-Solis. Signed by Judge Laurie Smith Camp on 6/26/2006. 4 certified copies to the USM. (JSF)</subTitle>
  <partNumber>23</partNumber>
</titleInfo>
 <originInfo>
  <dateIssued>2006-06-26</dateIssued>
</originInfo>
 <relatedItem xlink:href="http://www.gpo.gov/fdsys/pkg/pdf/USCOURTS-ned-8_05-cr-00199-23.pdf" type="otherFormat">
  <identifier type="FDsys Unique ID">D09002ee181cf3003</identifier>
</relatedItem>
 <identifier type="uri">http://www.gpo.gov/fdsys/granule/USCOURTS-ned-8_05-cr-00199/USCOURTS-ned-8_05-cr-00199-23</identifier>
 <identifier type="former granule identifier">ned-8_05-cr-00199_23.pdf</identifier>
 <location>
  <url access="object in context" displayLabel="Content Detail">http://www.gpo.gov/fdsys/granule/USCOURTS-ned-8_05-cr-00199/USCOURTS-ned-8_05-cr-00199-23/content-detail.html</url>
  <url access="raw object" displayLabel="PDF rendition">http://www.gpo.gov/fdsys/pkg/USCOURTS-ned-8_05-cr-00199/pdf/USCOURTS-ned-8_05-cr-00199-23.pdf</url>
</location>
 <extension>
  <searchTitle>USCOURTS 8:05-cr-00199; USA v. Anderson et al; </searchTitle>
  <courtName>United States District Court District of Nebraska</courtName>
  <state>Nebraska</state>
  <accessId>USCOURTS-ned-8_05-cr-00199-23</accessId>
  <sequenceNumber>23</sequenceNumber>
  <dateIssued>2006-06-26</dateIssued>
  <docketText>JUDGMENT as to Fred David Rodriguez-Solis (2), The defendant pleaded guilty to counts 1 and 8 of the indictment and is committed to the custody of the Bureau of Prisons for 135 months; 5 years supervised release with special conditions; and $100 special assessment. Count 5 of the indictment is dismissed on the motion of the United States as to this defendant only as to defendant Fred David Rodriguez-Solis. Signed by Judge Laurie Smith Camp on 6/26/2006. 4 certified copies to the USM. (JSF)</docketText>
</extension>
</relatedItem>
<relatedItem type="constituent" ID="id-USCOURTS-ned-8_05-cr-00199-24" xlink:href="http://www.gpo.gov/fdsys/granule/USCOURTS-ned-8_05-cr-00199/USCOURTS-ned-8_05-cr-00199-24/mods.xml">
 <titleInfo>
  <title>USA v. Anderson et al</title>
  <subTitle>TENTATIVE FINDINGS regarding the Presentence Investigation Report as to Defendant Jose Hernandez-Mendoza. Signed by Judge Laurie Smith Camp on 7/6/2006. (JB)</subTitle>
  <partNumber>24</partNumber>
</titleInfo>
 <originInfo>
  <dateIssued>2006-07-06</dateIssued>
</originInfo>
 <relatedItem xlink:href="http://www.gpo.gov/fdsys/pkg/pdf/USCOURTS-ned-8_05-cr-00199-24.pdf" type="otherFormat">
  <identifier type="FDsys Unique ID">D09002ee181cf2f68</identifier>
</relatedItem>
 <identifier type="uri">http://www.gpo.gov/fdsys/granule/USCOURTS-ned-8_05-cr-00199/USCOURTS-ned-8_05-cr-00199-24</identifier>
 <identifier type="former granule identifier">ned-8_05-cr-00199_24.pdf</identifier>
 <location>
  <url access="object in context" displayLabel="Content Detail">http://www.gpo.gov/fdsys/granule/USCOURTS-ned-8_05-cr-00199/USCOURTS-ned-8_05-cr-00199-24/content-detail.html</url>
  <url access="raw object" displayLabel="PDF rendition">http://www.gpo.gov/fdsys/pkg/USCOURTS-ned-8_05-cr-00199/pdf/USCOURTS-ned-8_05-cr-00199-24.pdf</url>
</location>
 <extension>
  <searchTitle>USCOURTS 8:05-cr-00199; USA v. Anderson et al; </searchTitle>
  <courtName>United States District Court District of Nebraska</courtName>
  <state>Nebraska</state>
  <accessId>USCOURTS-ned-8_05-cr-00199-24</accessId>
  <sequenceNumber>24</sequenceNumber>
  <dateIssued>2006-07-06</dateIssued>
  <docketText>TENTATIVE FINDINGS regarding the Presentence Investigation Report as to Defendant Jose Hernandez-Mendoza. Signed by Judge Laurie Smith Camp on 7/6/2006. (JB)</docketText>
</extension>
</relatedItem>
<relatedItem type="constituent" ID="id-USCOURTS-ned-8_05-cr-00199-25" xlink:href="http://www.gpo.gov/fdsys/granule/USCOURTS-ned-8_05-cr-00199/USCOURTS-ned-8_05-cr-00199-25/mods.xml">
 <titleInfo>
  <title>USA v. Anderson et al</title>
  <subTitle>JUDGMENT as to Jose Hernandez-Mendoza (6), Defendant plead guilty to counts I and VIII of the Indictment and is committed to the custody of the Bureau of Prisons for a total term of 108 months; 5 years Supervised Release with special conditions; $100.00 Special Assessment; Counts IV-V of the Indictment are dismissed on the motion of the United States; Final order of forfeiture as to Count VIII forthcoming as to defendant Jose Hernandez-Mendoza. Signed by Judge Laurie Smith Camp on 7/14/2006. 4 cert to USM (MKR, )</subTitle>
  <partNumber>25</partNumber>
</titleInfo>
 <originInfo>
  <dateIssued>2006-07-14</dateIssued>
</originInfo>
 <relatedItem xlink:href="http://www.gpo.gov/fdsys/pkg/pdf/USCOURTS-ned-8_05-cr-00199-25.pdf" type="otherFormat">
  <identifier type="FDsys Unique ID">D09002ee181cf2ffd</identifier>
</relatedItem>
 <identifier type="uri">http://www.gpo.gov/fdsys/granule/USCOURTS-ned-8_05-cr-00199/USCOURTS-ned-8_05-cr-00199-25</identifier>
 <identifier type="former granule identifier">ned-8_05-cr-00199_25.pdf</identifier>
 <location>
  <url access="object in context" displayLabel="Content Detail">http://www.gpo.gov/fdsys/granule/USCOURTS-ned-8_05-cr-00199/USCOURTS-ned-8_05-cr-00199-25/content-detail.html</url>
  <url access="raw object" displayLabel="PDF rendition">http://www.gpo.gov/fdsys/pkg/USCOURTS-ned-8_05-cr-00199/pdf/USCOURTS-ned-8_05-cr-00199-25.pdf</url>
</location>
 <extension>
  <searchTitle>USCOURTS 8:05-cr-00199; USA v. Anderson et al; </searchTitle>
  <courtName>United States District Court District of Nebraska</courtName>
  <state>Nebraska</state>
  <accessId>USCOURTS-ned-8_05-cr-00199-25</accessId>
  <sequenceNumber>25</sequenceNumber>
  <dateIssued>2006-07-14</dateIssued>
  <docketText>JUDGMENT as to Jose Hernandez-Mendoza (6), Defendant plead guilty to counts I and VIII of the Indictment and is committed to the custody of the Bureau of Prisons for a total term of 108 months; 5 years Supervised Release with special conditions; $100.00 Special Assessment; Counts IV-V of the Indictment are dismissed on the motion of the United States; Final order of forfeiture as to Count VIII forthcoming as to defendant Jose Hernandez-Mendoza. Signed by Judge Laurie Smith Camp on 7/14/2006. 4 cert to USM (MKR, )</docketText>
</extension>
</relatedItem>
<relatedItem type="constituent" ID="id-USCOURTS-ned-8_05-cr-00199-26" xlink:href="http://www.gpo.gov/fdsys/granule/USCOURTS-ned-8_05-cr-00199/USCOURTS-ned-8_05-cr-00199-26/mods.xml">
 <titleInfo>
  <title>USA v. Anderson et al</title>
  <subTitle>TENTATIVE FINDINGS OF FACT regarding Presentence Investigation Report that the Court&apos;s tentative findings are that the Defendant&apos;s objections to the PSR(Filing No. 139) will be heard at sentencing; and otherwise the Court&apos;s tentative findings are that the Presentence InvestigationReport is correct in all respects as to defendant Duane Charles Anderson. Ordered by Judge Laurie Smith Camp.(DKM, )</subTitle>
  <partNumber>26</partNumber>
</titleInfo>
 <originInfo>
  <dateIssued>2006-09-21</dateIssued>
</originInfo>
 <relatedItem xlink:href="http://www.gpo.gov/fdsys/pkg/pdf/USCOURTS-ned-8_05-cr-00199-26.pdf" type="otherFormat">
  <identifier type="FDsys Unique ID">D09002ee181cf2ff9</identifier>
</relatedItem>
 <identifier type="uri">http://www.gpo.gov/fdsys/granule/USCOURTS-ned-8_05-cr-00199/USCOURTS-ned-8_05-cr-00199-26</identifier>
 <identifier type="former granule identifier">ned-8_05-cr-00199_26.pdf</identifier>
 <location>
  <url access="object in context" displayLabel="Content Detail">http://www.gpo.gov/fdsys/granule/USCOURTS-ned-8_05-cr-00199/USCOURTS-ned-8_05-cr-00199-26/content-detail.html</url>
  <url access="raw object" displayLabel="PDF rendition">http://www.gpo.gov/fdsys/pkg/USCOURTS-ned-8_05-cr-00199/pdf/USCOURTS-ned-8_05-cr-00199-26.pdf</url>
</location>
 <extension>
  <searchTitle>USCOURTS 8:05-cr-00199; USA v. Anderson et al; </searchTitle>
  <courtName>United States District Court District of Nebraska</courtName>
  <state>Nebraska</state>
  <accessId>USCOURTS-ned-8_05-cr-00199-26</accessId>
  <sequenceNumber>26</sequenceNumber>
  <dateIssued>2006-09-21</dateIssued>
  <docketText>TENTATIVE FINDINGS OF FACT regarding Presentence Investigation Report that the Court&apos;s tentative findings are that the Defendant&apos;s objections to the PSR(Filing No. 139) will be heard at sentencing; and otherwise the Court&apos;s tentative findings are that the Presentence InvestigationReport is correct in all respects as to defendant Duane Charles Anderson. Ordered by Judge Laurie Smith Camp.(DKM, )</docketText>
</extension>
</relatedItem>
<relatedItem type="constituent" ID="id-USCOURTS-ned-8_05-cr-00199-27" xlink:href="http://www.gpo.gov/fdsys/granule/USCOURTS-ned-8_05-cr-00199/USCOURTS-ned-8_05-cr-00199-27/mods.xml">
 <titleInfo>
  <title>USA v. Anderson et al</title>
  <subTitle>JUDGMENT as to Duane Charles Anderson (1), Defendant plead guilty to Counts I&amp;VIII of the Indictment and is committed to the custody of the Bureau of Prisons for 130 months; 5 years supervised release with special conditions; $100 special assessment; Count III of the Indictment is dismissed on the motion of the United States as to this defendant only; the defendant shall forfeit the defendant&apos;s interest in the following property to the United States: $6,465.00, $2,700.00 and $424.00 in U.S. Currency as to defendant Duane Charles Anderson Ordered by Judge Laurie Smith Camp. (4 certified copies to USM) (CJP)</subTitle>
  <partNumber>27</partNumber>
</titleInfo>
 <originInfo>
  <dateIssued>2006-09-27</dateIssued>
</originInfo>
 <relatedItem xlink:href="http://www.gpo.gov/fdsys/pkg/pdf/USCOURTS-ned-8_05-cr-00199-27.pdf" type="otherFormat">
  <identifier type="FDsys Unique ID">D09002ee181cf2ff4</identifier>
</relatedItem>
 <identifier type="uri">http://www.gpo.gov/fdsys/granule/USCOURTS-ned-8_05-cr-00199/USCOURTS-ned-8_05-cr-00199-27</identifier>
 <identifier type="former granule identifier">ned-8_05-cr-00199_27.pdf</identifier>
 <location>
  <url access="object in context" displayLabel="Content Detail">http://www.gpo.gov/fdsys/granule/USCOURTS-ned-8_05-cr-00199/USCOURTS-ned-8_05-cr-00199-27/content-detail.html</url>
  <url access="raw object" displayLabel="PDF rendition">http://www.gpo.gov/fdsys/pkg/USCOURTS-ned-8_05-cr-00199/pdf/USCOURTS-ned-8_05-cr-00199-27.pdf</url>
</location>
 <extension>
  <searchTitle>USCOURTS 8:05-cr-00199; USA v. Anderson et al; </searchTitle>
  <courtName>United States District Court District of Nebraska</courtName>
  <state>Nebraska</state>
  <accessId>USCOURTS-ned-8_05-cr-00199-27</accessId>
  <sequenceNumber>27</sequenceNumber>
  <dateIssued>2006-09-27</dateIssued>
  <docketText>JUDGMENT as to Duane Charles Anderson (1), Defendant plead guilty to Counts I&amp;VIII of the Indictment and is committed to the custody of the Bureau of Prisons for 130 months; 5 years supervised release with special conditions; $100 special assessment; Count III of the Indictment is dismissed on the motion of the United States as to this defendant only; the defendant shall forfeit the defendant&apos;s interest in the following property to the United States: $6,465.00, $2,700.00 and $424.00 in U.S. Currency as to defendant Duane Charles Anderson Ordered by Judge Laurie Smith Camp. (4 certified copies to USM) (CJP)</docketText>
</extension>
</relatedItem>
<relatedItem type="constituent" ID="id-USCOURTS-ned-8_05-cr-00199-28" xlink:href="http://www.gpo.gov/fdsys/granule/USCOURTS-ned-8_05-cr-00199/USCOURTS-ned-8_05-cr-00199-28/mods.xml">
 <titleInfo>
  <title>USA v. Anderson et al</title>
  <subTitle>ORDER APPOINTING COUNSEL as to defendant Rogelio L. Valenzuela-Lopez - Michael J. Lehan is appointed to represent the defendant. Ordered by Magistrate Judge Thomas D. Thalken. (MBB)</subTitle>
  <partNumber>28</partNumber>
</titleInfo>
 <originInfo>
  <dateIssued>2009-05-14</dateIssued>
</originInfo>
 <relatedItem xlink:href="http://www.gpo.gov/fdsys/pkg/pdf/USCOURTS-ned-8_05-cr-00199-28.pdf" type="otherFormat">
  <identifier type="FDsys Unique ID">D09002ee181cf2ff7</identifier>
</relatedItem>
 <identifier type="uri">http://www.gpo.gov/fdsys/granule/USCOURTS-ned-8_05-cr-00199/USCOURTS-ned-8_05-cr-00199-28</identifier>
 <identifier type="former granule identifier">ned-8_05-cr-00199_28.pdf</identifier>
 <location>
  <url access="object in context" displayLabel="Content Detail">http://www.gpo.gov/fdsys/granule/USCOURTS-ned-8_05-cr-00199/USCOURTS-ned-8_05-cr-00199-28/content-detail.html</url>
  <url access="raw object" displayLabel="PDF rendition">http://www.gpo.gov/fdsys/pkg/USCOURTS-ned-8_05-cr-00199/pdf/USCOURTS-ned-8_05-cr-00199-28.pdf</url>
</location>
 <extension>
  <searchTitle>USCOURTS 8:05-cr-00199; USA v. Anderson et al; </searchTitle>
  <courtName>United States District Court District of Nebraska</courtName>
  <state>Nebraska</state>
  <accessId>USCOURTS-ned-8_05-cr-00199-28</accessId>
  <sequenceNumber>28</sequenceNumber>
  <dateIssued>2009-05-14</dateIssued>
  <docketText>ORDER APPOINTING COUNSEL as to defendant Rogelio L. Valenzuela-Lopez - Michael J. Lehan is appointed to represent the defendant. Ordered by Magistrate Judge Thomas D. Thalken. (MBB)</docketText>
</extension>
</relatedItem>
<relatedItem type="constituent" ID="id-USCOURTS-ned-8_05-cr-00199-29" xlink:href="http://www.gpo.gov/fdsys/granule/USCOURTS-ned-8_05-cr-00199/USCOURTS-ned-8_05-cr-00199-29/mods.xml">
 <titleInfo>
  <title>USA v. Anderson et al</title>
  <subTitle>ORDER of Detention pending trial as to defendant Rogelio L. Valenzuela-Lopez ordered by Magistrate Judge Thomas D. Thalken. (MBB)</subTitle>
  <partNumber>29</partNumber>
</titleInfo>
 <originInfo>
  <dateIssued>2009-05-19</dateIssued>
</originInfo>
 <relatedItem xlink:href="http://www.gpo.gov/fdsys/pkg/pdf/USCOURTS-ned-8_05-cr-00199-29.pdf" type="otherFormat">
  <identifier type="FDsys Unique ID">D09002ee181cf2fff</identifier>
</relatedItem>
 <identifier type="uri">http://www.gpo.gov/fdsys/granule/USCOURTS-ned-8_05-cr-00199/USCOURTS-ned-8_05-cr-00199-29</identifier>
 <identifier type="former granule identifier">ned-8_05-cr-00199_29.pdf</identifier>
 <location>
  <url access="object in context" displayLabel="Content Detail">http://www.gpo.gov/fdsys/granule/USCOURTS-ned-8_05-cr-00199/USCOURTS-ned-8_05-cr-00199-29/content-detail.html</url>
  <url access="raw object" displayLabel="PDF rendition">http://www.gpo.gov/fdsys/pkg/USCOURTS-ned-8_05-cr-00199/pdf/USCOURTS-ned-8_05-cr-00199-29.pdf</url>
</location>
 <extension>
  <searchTitle>USCOURTS 8:05-cr-00199; USA v. Anderson et al; </searchTitle>
  <courtName>United States District Court District of Nebraska</courtName>
  <state>Nebraska</state>
  <accessId>USCOURTS-ned-8_05-cr-00199-29</accessId>
  <sequenceNumber>29</sequenceNumber>
  <dateIssued>2009-05-19</dateIssued>
  <docketText>ORDER of Detention pending trial as to defendant Rogelio L. Valenzuela-Lopez ordered by Magistrate Judge Thomas D. Thalken. (MBB)</docketText>
</extension>
</relatedItem>
<relatedItem type="constituent" ID="id-USCOURTS-ned-8_05-cr-00199-30" xlink:href="http://www.gpo.gov/fdsys/granule/USCOURTS-ned-8_05-cr-00199/USCOURTS-ned-8_05-cr-00199-30/mods.xml">
 <titleInfo>
  <title>USA v. Anderson et al</title>
  <subTitle>ORDER that Defendant Valenzuela-Lopez&apos;s motion for an extension of time 167 is granted; Valenzuela-Lopez is given until on or before July 6, 2009, in which to file pretrial motions pursuant to the progression order; the ends of justice have been served by granting such motion and outweigh the interests of the public and the defendants in a speedy trial; the additional time arising as a result of the granting of the motion, i.e., the time between June 3, 2009 and July 6, 2009, shall be deemed excludable time in any computation of time under the requirement of the Speedy Trial Act for the reason defendant&apos;s counsel require additional time to adequately prepare the case, taking into consideration due diligence of counsel, and the novelty and complexity of this case as to Rogelio L. Valenzuela-Lopez (5). Ordered by Magistrate Judge Thomas D. Thalken. (CJP)</subTitle>
  <partNumber>30</partNumber>
</titleInfo>
 <originInfo>
  <dateIssued>2009-06-03</dateIssued>
</originInfo>
 <relatedItem xlink:href="http://www.gpo.gov/fdsys/pkg/pdf/USCOURTS-ned-8_05-cr-00199-30.pdf" type="otherFormat">
  <identifier type="FDsys Unique ID">D09002ee181cf2ff8</identifier>
</relatedItem>
 <identifier type="uri">http://www.gpo.gov/fdsys/granule/USCOURTS-ned-8_05-cr-00199/USCOURTS-ned-8_05-cr-00199-30</identifier>
 <identifier type="former granule identifier">ned-8_05-cr-00199_30.pdf</identifier>
 <location>
  <url access="object in context" displayLabel="Content Detail">http://www.gpo.gov/fdsys/granule/USCOURTS-ned-8_05-cr-00199/USCOURTS-ned-8_05-cr-00199-30/content-detail.html</url>
  <url access="raw object" displayLabel="PDF rendition">http://www.gpo.gov/fdsys/pkg/USCOURTS-ned-8_05-cr-00199/pdf/USCOURTS-ned-8_05-cr-00199-30.pdf</url>
</location>
 <extension>
  <searchTitle>USCOURTS 8:05-cr-00199; USA v. Anderson et al; </searchTitle>
  <courtName>United States District Court District of Nebraska</courtName>
  <state>Nebraska</state>
  <accessId>USCOURTS-ned-8_05-cr-00199-30</accessId>
  <sequenceNumber>30</sequenceNumber>
  <dateIssued>2009-06-03</dateIssued>
  <docketText>ORDER that Defendant Valenzuela-Lopez&apos;s motion for an extension of time 167 is granted; Valenzuela-Lopez is given until on or before July 6, 2009, in which to file pretrial motions pursuant to the progression order; the ends of justice have been served by granting such motion and outweigh the interests of the public and the defendants in a speedy trial; the additional time arising as a result of the granting of the motion, i.e., the time between June 3, 2009 and July 6, 2009, shall be deemed excludable time in any computation of time under the requirement of the Speedy Trial Act for the reason defendant&apos;s counsel require additional time to adequately prepare the case, taking into consideration due diligence of counsel, and the novelty and complexity of this case as to Rogelio L. Valenzuela-Lopez (5). Ordered by Magistrate Judge Thomas D. Thalken. (CJP)</docketText>
</extension>
</relatedItem>
<relatedItem type="constituent" ID="id-USCOURTS-ned-8_05-cr-00199-31" xlink:href="http://www.gpo.gov/fdsys/granule/USCOURTS-ned-8_05-cr-00199/USCOURTS-ned-8_05-cr-00199-31/mods.xml">
 <titleInfo>
  <title>USA v. Anderson et al</title>
  <subTitle>TENTATIVE FINDINGS regarding the Revised Presentence Investigation Report as to Defendant Rogelio L. Valenzuela-Lopez. Ordered by Judge Laurie Smith Camp. (JB)</subTitle>
  <partNumber>31</partNumber>
</titleInfo>
 <originInfo>
  <dateIssued>2009-10-26</dateIssued>
</originInfo>
 <relatedItem xlink:href="http://www.gpo.gov/fdsys/pkg/pdf/USCOURTS-ned-8_05-cr-00199-31.pdf" type="otherFormat">
  <identifier type="FDsys Unique ID">D09002ee181cf2fec</identifier>
</relatedItem>
 <identifier type="uri">http://www.gpo.gov/fdsys/granule/USCOURTS-ned-8_05-cr-00199/USCOURTS-ned-8_05-cr-00199-31</identifier>
 <identifier type="former granule identifier">ned-8_05-cr-00199_31.pdf</identifier>
 <location>
  <url access="object in context" displayLabel="Content Detail">http://www.gpo.gov/fdsys/granule/USCOURTS-ned-8_05-cr-00199/USCOURTS-ned-8_05-cr-00199-31/content-detail.html</url>
  <url access="raw object" displayLabel="PDF rendition">http://www.gpo.gov/fdsys/pkg/USCOURTS-ned-8_05-cr-00199/pdf/USCOURTS-ned-8_05-cr-00199-31.pdf</url>
</location>
 <extension>
  <searchTitle>USCOURTS 8:05-cr-00199; USA v. Anderson et al; </searchTitle>
  <courtName>United States District Court District of Nebraska</courtName>
  <state>Nebraska</state>
  <accessId>USCOURTS-ned-8_05-cr-00199-31</accessId>
  <sequenceNumber>31</sequenceNumber>
  <dateIssued>2009-10-26</dateIssued>
  <docketText>TENTATIVE FINDINGS regarding the Revised Presentence Investigation Report as to Defendant Rogelio L. Valenzuela-Lopez. Ordered by Judge Laurie Smith Camp. (JB)</docketText>
</extension>
</relatedItem>
<relatedItem type="constituent" ID="id-USCOURTS-ned-8_05-cr-00199-32" xlink:href="http://www.gpo.gov/fdsys/granule/USCOURTS-ned-8_05-cr-00199/USCOURTS-ned-8_05-cr-00199-32/mods.xml">
 <titleInfo>
  <title>USA v. Anderson et al</title>
  <subTitle>ORDER regarding Notice of Appeal to USCA193 as to defendant Rogelio L. Valenzuela-Lopez. The defendant is permitted to proceed on appeal in forma pauperis. Ordered by Judge Laurie Smith Camp. (JAE)</subTitle>
  <partNumber>32</partNumber>
</titleInfo>
 <originInfo>
  <dateIssued>2009-11-20</dateIssued>
</originInfo>
 <relatedItem xlink:href="http://www.gpo.gov/fdsys/pkg/pdf/USCOURTS-ned-8_05-cr-00199-32.pdf" type="otherFormat">
  <identifier type="FDsys Unique ID">D09002ee181cf2ff2</identifier>
</relatedItem>
 <identifier type="uri">http://www.gpo.gov/fdsys/granule/USCOURTS-ned-8_05-cr-00199/USCOURTS-ned-8_05-cr-00199-32</identifier>
